[
  {
    "@odata.etag": "W/\"324596738\"",
    "nycsr_admininterventiontype@OData.Community.Display.V1.FormattedValue": "Partial Classroom Quarantine",
    "nycsr_admininterventiontype": 882450001,
    "nycsr_caseid": "d95b5103-d51e-ec11-b6e6-001dd8305f31",
    "nycsr_interventionenddate@OData.Community.Display.V1.FormattedValue": "10/4/2021",
    "nycsr_interventionenddate": "2021-10-04T04:00:00Z",
    "nycsr_casenumber": "052462",
    "nycsr_interventionstartdate@OData.Community.Display.V1.FormattedValue": "9/27/2021",
    "nycsr_interventionstartdate": "2021-09-27T04:00:00Z",
    "nycsr_building.nycsr_address": "321 Palmetto Street",
    "nycsr_building.nycsr_latitude@OData.Community.Display.V1.FormattedValue": "40,697,378.000000",
    "nycsr_building.nycsr_latitude": 40697378,
    "nycsr_building.nycsr_buildingid": "10fc3df4-30f4-ea11-b882-24ee9a37d45c",
    "nycsr_building.nycsr_borough@OData.Community.Display.V1.FormattedValue": "Brooklyn",
    "nycsr_building.nycsr_borough": 882450002,
    "nycsr_building.nycsr_longitude@OData.Community.Display.V1.FormattedValue": "-73,913,172.000000",
    "nycsr_building.nycsr_longitude": -73913172,
    "nycsr_building.nycsr_geographicaldistrictcode": "32",
    "nycsr_building.nycsr_buildingname": "ALL CITY LEADERSHIP SECONDARY SCHOOL - BROOKLYN",
    "nycsr_locationsite.nycsr_sitename": "All City Leadership Secondary School - K554 - K554 - 32K554 - 321 Palmetto Street"
  },
  {
    "@odata.etag": "W/\"326014583\"",
    "nycsr_admininterventiontype@OData.Community.Display.V1.FormattedValue": "Partial Classroom Quarantine",
    "nycsr_admininterventiontype": 882450001,
    "nycsr_caseid": "2a701b7a-d81e-ec11-b6e6-001dd8305f31",
    "nycsr_interventionenddate@OData.Community.Display.V1.FormattedValue": "10/4/2021",
    "nycsr_interventionenddate": "2021-10-04T04:00:00Z",
    "nycsr_casenumber": "052469",
    "nycsr_interventionstartdate@OData.Community.Display.V1.FormattedValue": "9/27/2021",
    "nycsr_interventionstartdate": "2021-09-27T04:00:00Z",
    "nycsr_building.nycsr_address": "230-17 HILLSIDE AVENUE",
    "nycsr_building.nycsr_latitude@OData.Community.Display.V1.FormattedValue": "40,733,888.000000",
    "nycsr_building.nycsr_latitude": 40733888,
    "nycsr_building.nycsr_buildingid": "c4b66262-32f4-ea11-b882-24ee9a37d45c",
    "nycsr_building.nycsr_borough@OData.Community.Display.V1.FormattedValue": "Queens",
    "nycsr_building.nycsr_borough": 882450003,
    "nycsr_building.nycsr_longitude@OData.Community.Display.V1.FormattedValue": "-73,739,726.000000",
    "nycsr_building.nycsr_longitude": -73739726,
    "nycsr_building.nycsr_geographicaldistrictcode": "26",
    "nycsr_building.nycsr_buildingname": "MARTIN VAN BUREN HS - QUEENS",
    "nycsr_locationsite.nycsr_sitename": "Business Technology Early College High School - Q315 - Q435 - 26Q315 - 230-17 HILLSIDE AVENUE"
  },
  {
    "@odata.etag": "W/\"324595436\"",
    "nycsr_admininterventiontype@OData.Community.Display.V1.FormattedValue": "Non-Classroom Quarantine",
    "nycsr_admininterventiontype": 882450003,
    "nycsr_caseid": "3803b199-dd1e-ec11-b6e6-001dd8305f31",
    "nycsr_interventionenddate@OData.Community.Display.V1.FormattedValue": "10/4/2021",
    "nycsr_interventionenddate": "2021-10-04T04:00:00Z",
    "nycsr_casenumber": "052484",
    "nycsr_interventionstartdate@OData.Community.Display.V1.FormattedValue": "9/27/2021",
    "nycsr_interventionstartdate": "2021-09-27T04:00:00Z",
    "nycsr_building.nycsr_address": "1581 VICTORY BOULEVARD",
    "nycsr_building.nycsr_latitude@OData.Community.Display.V1.FormattedValue": "40,614,039.000000",
    "nycsr_building.nycsr_latitude": 40614039,
    "nycsr_building.nycsr_buildingid": "7ba9d9c3-32f4-ea11-b882-24ee9a37d45c",
    "nycsr_building.nycsr_borough@OData.Community.Display.V1.FormattedValue": "Staten Island",
    "nycsr_building.nycsr_borough": 882450004,
    "nycsr_building.nycsr_longitude@OData.Community.Display.V1.FormattedValue": "-74,116,197.000000",
    "nycsr_building.nycsr_longitude": -74116197,
    "nycsr_building.nycsr_geographicaldistrictcode": "31",
    "nycsr_building.nycsr_buildingname": "P.S. 29 - STATEN ISLAND",
    "nycsr_locationsite.nycsr_sitename": "P.S. 029 Bardwell - R029 - R029 - 31R029 - 1581 VICTORY BOULEVARD"
  },
  {
    "@odata.etag": "W/\"326845572\"",
    "nycsr_admininterventiontype@OData.Community.Display.V1.FormattedValue": "Classroom Closed",
    "nycsr_admininterventiontype": 882450000,
    "nycsr_caseid": "ad149600-de1e-ec11-b6e6-001dd8305f31",
    "nycsr_interventionenddate@OData.Community.Display.V1.FormattedValue": "10/4/2021",
    "nycsr_interventionenddate": "2021-10-04T04:00:00Z",
    "nycsr_casenumber": "052488",
    "nycsr_interventionstartdate@OData.Community.Display.V1.FormattedValue": "9/27/2021",
    "nycsr_interventionstartdate": "2021-09-27T04:00:00Z",
    "nycsr_building.nycsr_address": "1500 EAST  92 STREET",
    "nycsr_building.nycsr_latitude@OData.Community.Display.V1.FormattedValue": "40,634,861.000000",
    "nycsr_building.nycsr_latitude": 40634861,
    "nycsr_building.nycsr_buildingid": "2fe85c61-30f4-ea11-b882-24ee9a37d45c",
    "nycsr_building.nycsr_borough@OData.Community.Display.V1.FormattedValue": "Brooklyn",
    "nycsr_building.nycsr_borough": 882450002,
    "nycsr_building.nycsr_longitude@OData.Community.Display.V1.FormattedValue": "-73,897,896.000000",
    "nycsr_building.nycsr_longitude": -73897896,
    "nycsr_building.nycsr_geographicaldistrictcode": "18",
    "nycsr_building.nycsr_buildingname": "P.S. 115 - BROOKLYN",
    "nycsr_locationsite.nycsr_sitename": "P.S. 115 Daniel Mucatel School - K115 - K115 - 18K115 - 1500 EAST  92 STREET"
  },
  {
    "@odata.etag": "W/\"324595462\"",
    "nycsr_admininterventiontype@OData.Community.Display.V1.FormattedValue": "Non-Classroom Quarantine",
    "nycsr_admininterventiontype": 882450003,
    "nycsr_caseid": "9ba1b437-de1e-ec11-b6e6-001dd8305f31",
    "nycsr_interventionenddate@OData.Community.Display.V1.FormattedValue": "10/4/2021",
    "nycsr_interventionenddate": "2021-10-04T04:00:00Z",
    "nycsr_casenumber": "052490",
    "nycsr_interventionstartdate@OData.Community.Display.V1.FormattedValue": "9/27/2021",
    "nycsr_interventionstartdate": "2021-09-27T04:00:00Z",
    "nycsr_building.nycsr_address": "112 SCHERMERHORN STREET",
    "nycsr_building.nycsr_latitude@OData.Community.Display.V1.FormattedValue": "40,690,007.000000",
    "nycsr_building.nycsr_latitude": 40690007,
    "nycsr_building.nycsr_buildingid": "f7fb3df4-30f4-ea11-b882-24ee9a37d45c",
    "nycsr_building.nycsr_borough@OData.Community.Display.V1.FormattedValue": "Brooklyn",
    "nycsr_building.nycsr_borough": 882450002,
    "nycsr_building.nycsr_longitude@OData.Community.Display.V1.FormattedValue": "-73,989,369.000000",
    "nycsr_building.nycsr_longitude": -73989369,
    "nycsr_building.nycsr_geographicaldistrictcode": "15",
    "nycsr_building.nycsr_buildingname": "PACIFIC ALT HS - K",
    "nycsr_locationsite.nycsr_sitename": "Brooklyn Frontiers High School - K423 - K520 - 15K423 - 112 SCHERMERHORN STREET"
  },
  {
    "@odata.etag": "W/\"324595467\"",
    "nycsr_admininterventiontype@OData.Community.Display.V1.FormattedValue": "Partial Classroom Quarantine",
    "nycsr_admininterventiontype": 882450001,
    "nycsr_caseid": "c6b899bc-de1e-ec11-b6e6-001dd8305f31",
    "nycsr_interventionenddate@OData.Community.Display.V1.FormattedValue": "10/4/2021",
    "nycsr_interventionenddate": "2021-10-04T04:00:00Z",
    "nycsr_casenumber": "052491",
    "nycsr_interventionstartdate@OData.Community.Display.V1.FormattedValue": "9/27/2021",
    "nycsr_interventionstartdate": "2021-09-27T04:00:00Z",
    "nycsr_building.nycsr_address": "345 DEAN STREET",
    "nycsr_building.nycsr_latitude@OData.Community.Display.V1.FormattedValue": "40,683,951.000000",
    "nycsr_building.nycsr_latitude": 40683951,
    "nycsr_building.nycsr_buildingid": "30416e00-31f4-ea11-b882-24ee9a37d45c",
    "nycsr_building.nycsr_borough@OData.Community.Display.V1.FormattedValue": "Brooklyn",
    "nycsr_building.nycsr_borough": 882450002,
    "nycsr_building.nycsr_longitude@OData.Community.Display.V1.FormattedValue": "-73,980,266.000000",
    "nycsr_building.nycsr_longitude": -73980266,
    "nycsr_building.nycsr_geographicaldistrictcode": "15",
    "nycsr_building.nycsr_buildingname": "BKLYN HS OF THE ARTS (OL S J HL)-K",
    "nycsr_locationsite.nycsr_sitename": "Brooklyn High School of the Arts - K656 - K655 - 15K656 - 345 DEAN STREET"
  },
  {
    "@odata.etag": "W/\"325404528\"",
    "nycsr_admininterventiontype@OData.Community.Display.V1.FormattedValue": "Classroom Closed",
    "nycsr_admininterventiontype": 882450000,
    "nycsr_caseid": "ae7c67da-df1e-ec11-b6e6-001dd8305f31",
    "nycsr_interventionenddate@OData.Community.Display.V1.FormattedValue": "10/4/2021",
    "nycsr_interventionenddate": "2021-10-04T04:00:00Z",
    "nycsr_casenumber": "052495",
    "nycsr_interventionstartdate@OData.Community.Display.V1.FormattedValue": "9/27/2021",
    "nycsr_interventionstartdate": "2021-09-27T04:00:00Z",
    "nycsr_building.nycsr_address": "1500 EAST  92 STREET",
    "nycsr_building.nycsr_latitude@OData.Community.Display.V1.FormattedValue": "40,634,861.000000",
    "nycsr_building.nycsr_latitude": 40634861,
    "nycsr_building.nycsr_buildingid": "2fe85c61-30f4-ea11-b882-24ee9a37d45c",
    "nycsr_building.nycsr_borough@OData.Community.Display.V1.FormattedValue": "Brooklyn",
    "nycsr_building.nycsr_borough": 882450002,
    "nycsr_building.nycsr_longitude@OData.Community.Display.V1.FormattedValue": "-73,897,896.000000",
    "nycsr_building.nycsr_longitude": -73897896,
    "nycsr_building.nycsr_geographicaldistrictcode": "18",
    "nycsr_building.nycsr_buildingname": "P.S. 115 - BROOKLYN",
    "nycsr_locationsite.nycsr_sitename": "P.S. 115 Daniel Mucatel School - K115 - K115 - 18K115 - 1500 EAST  92 STREET"
  },
  {
    "@odata.etag": "W/\"325135770\"",
    "nycsr_admininterventiontype@OData.Community.Display.V1.FormattedValue": "Classroom Closed",
    "nycsr_admininterventiontype": 882450000,
    "nycsr_caseid": "9fe838f1-e01e-ec11-b6e6-001dd8305f31",
    "nycsr_interventionenddate@OData.Community.Display.V1.FormattedValue": "10/3/2021",
    "nycsr_interventionenddate": "2021-10-03T04:00:00Z",
    "nycsr_casenumber": "052505",
    "nycsr_interventionstartdate@OData.Community.Display.V1.FormattedValue": "9/27/2021",
    "nycsr_interventionstartdate": "2021-09-27T04:00:00Z",
    "nycsr_building.nycsr_address": "250 KRAMER AVENUE",
    "nycsr_building.nycsr_latitude@OData.Community.Display.V1.FormattedValue": "40,541,856.000000",
    "nycsr_building.nycsr_latitude": 40541856,
    "nycsr_building.nycsr_buildingid": "3e0410ca-32f4-ea11-b882-24ee9a37d45c",
    "nycsr_building.nycsr_borough@OData.Community.Display.V1.FormattedValue": "Staten Island",
    "nycsr_building.nycsr_borough": 882450004,
    "nycsr_building.nycsr_longitude@OData.Community.Display.V1.FormattedValue": "-74,213,943.000000",
    "nycsr_building.nycsr_longitude": -74213943,
    "nycsr_building.nycsr_geographicaldistrictcode": "31",
    "nycsr_building.nycsr_buildingname": "P.S. 56 - STATEN ISLAND",
    "nycsr_locationsite.nycsr_sitename": "P.S. 56 The Louis Desario School - R056 - R056 - 31R056 - 250 KRAMER AVENUE"
  },
  {
    "@odata.etag": "W/\"324595538\"",
    "nycsr_admininterventiontype@OData.Community.Display.V1.FormattedValue": "Partial Classroom Quarantine",
    "nycsr_admininterventiontype": 882450001,
    "nycsr_caseid": "1577ca09-e11e-ec11-b6e6-001dd8305f31",
    "nycsr_interventionenddate@OData.Community.Display.V1.FormattedValue": "10/4/2021",
    "nycsr_interventionenddate": "2021-10-04T04:00:00Z",
    "nycsr_casenumber": "052506",
    "nycsr_interventionstartdate@OData.Community.Display.V1.FormattedValue": "9/27/2021",
    "nycsr_interventionstartdate": "2021-09-27T04:00:00Z",
    "nycsr_building.nycsr_address": "1200 MANOR ROAD",
    "nycsr_building.nycsr_latitude@OData.Community.Display.V1.FormattedValue": "40,588,985.000000",
    "nycsr_building.nycsr_latitude": 40588985,
    "nycsr_building.nycsr_buildingid": "5abe7adc-32f4-ea11-b882-24ee9a37d45c",
    "nycsr_building.nycsr_borough@OData.Community.Display.V1.FormattedValue": "Staten Island",
    "nycsr_building.nycsr_borough": 882450004,
    "nycsr_building.nycsr_longitude@OData.Community.Display.V1.FormattedValue": "-74,130,819.000000",
    "nycsr_building.nycsr_longitude": -74130819,
    "nycsr_building.nycsr_geographicaldistrictcode": "31",
    "nycsr_building.nycsr_buildingname": "SUSAN E. WAGNER HS - S. I.",
    "nycsr_locationsite.nycsr_sitename": "Susan E. Wagner High School - R460 - R460 - 31R460 - 1200 MANOR ROAD"
  },
  {
    "@odata.etag": "W/\"324686435\"",
    "nycsr_admininterventiontype@OData.Community.Display.V1.FormattedValue": "Classroom Closed",
    "nycsr_admininterventiontype": 882450000,
    "nycsr_caseid": "bb7cb982-e11e-ec11-b6e6-001dd8305f31",
    "nycsr_interventionenddate@OData.Community.Display.V1.FormattedValue": "10/4/2021",
    "nycsr_interventionenddate": "2021-10-04T04:00:00Z",
    "nycsr_casenumber": "052509",
    "nycsr_interventionstartdate@OData.Community.Display.V1.FormattedValue": "9/27/2021",
    "nycsr_interventionstartdate": "2021-09-27T04:00:00Z",
    "nycsr_building.nycsr_address": "420 BEACH  51 STREET",
    "nycsr_building.nycsr_latitude@OData.Community.Display.V1.FormattedValue": "40,595,911.000000",
    "nycsr_building.nycsr_latitude": 40595911,
    "nycsr_building.nycsr_buildingid": "b02ff20c-32f4-ea11-b882-24ee9a37d45c",
    "nycsr_building.nycsr_borough@OData.Community.Display.V1.FormattedValue": "Queens",
    "nycsr_building.nycsr_borough": 882450003,
    "nycsr_building.nycsr_longitude@OData.Community.Display.V1.FormattedValue": "-73,780,961.000000",
    "nycsr_building.nycsr_longitude": -73780961,
    "nycsr_building.nycsr_geographicaldistrictcode": "27",
    "nycsr_building.nycsr_buildingname": "P.S. 105 - QUEENS",
    "nycsr_locationsite.nycsr_sitename": "P.S. 105 The Bay School - Q105 - Q105 - 27Q105 - 420 BEACH  51 STREET"
  },
  {
    "@odata.etag": "W/\"324595603\"",
    "nycsr_admininterventiontype@OData.Community.Display.V1.FormattedValue": "Partial Classroom Quarantine",
    "nycsr_admininterventiontype": 882450001,
    "nycsr_caseid": "95c9599e-e31e-ec11-b6e6-001dd8305f31",
    "nycsr_interventionenddate@OData.Community.Display.V1.FormattedValue": "10/4/2021",
    "nycsr_interventionenddate": "2021-10-04T04:00:00Z",
    "nycsr_casenumber": "052521",
    "nycsr_interventionstartdate@OData.Community.Display.V1.FormattedValue": "9/27/2021",
    "nycsr_interventionstartdate": "2021-09-27T04:00:00Z",
    "nycsr_building.nycsr_address": "101 WARREN STREET",
    "nycsr_building.nycsr_latitude@OData.Community.Display.V1.FormattedValue": "40,620,443.000000",
    "nycsr_building.nycsr_latitude": 40620443,
    "nycsr_building.nycsr_buildingid": "190410ca-32f4-ea11-b882-24ee9a37d45c",
    "nycsr_building.nycsr_borough@OData.Community.Display.V1.FormattedValue": "Staten Island",
    "nycsr_building.nycsr_borough": 882450004,
    "nycsr_building.nycsr_longitude@OData.Community.Display.V1.FormattedValue": "-74,080,695.000000",
    "nycsr_building.nycsr_longitude": -74080695,
    "nycsr_building.nycsr_geographicaldistrictcode": "31",
    "nycsr_building.nycsr_buildingname": "I.S. 49 - STATEN ISLAND",
    "nycsr_locationsite.nycsr_sitename": "The Eagle Academy for Young Men of Staten Island - R028 - R049 - 31R028 - 101 WARREN STREET"
  },
  {
    "@odata.etag": "W/\"325860771\"",
    "nycsr_admininterventiontype@OData.Community.Display.V1.FormattedValue": "Partial Classroom Quarantine",
    "nycsr_admininterventiontype": 882450001,
    "nycsr_caseid": "f9fc291f-e41e-ec11-b6e6-001dd8305f31",
    "nycsr_interventionenddate@OData.Community.Display.V1.FormattedValue": "10/2/2021",
    "nycsr_interventionenddate": "2021-10-02T04:00:00Z",
    "nycsr_casenumber": "052523",
    "nycsr_interventionstartdate@OData.Community.Display.V1.FormattedValue": "9/28/2021",
    "nycsr_interventionstartdate": "2021-09-28T04:00:00Z",
    "nycsr_building.nycsr_address": "522 WEST 44TH STREET",
    "nycsr_building.nycsr_latitude@OData.Community.Display.V1.FormattedValue": "40,760,858.000000",
    "nycsr_building.nycsr_latitude": 40760858,
    "nycsr_building.nycsr_buildingid": "e7ed94c3-31f4-ea11-b882-24ee9a37d45c",
    "nycsr_building.nycsr_borough@OData.Community.Display.V1.FormattedValue": "Manhattan",
    "nycsr_building.nycsr_borough": 882450000,
    "nycsr_building.nycsr_longitude@OData.Community.Display.V1.FormattedValue": "-73,996,262.000000",
    "nycsr_building.nycsr_longitude": -73996262,
    "nycsr_building.nycsr_geographicaldistrictcode": "2",
    "nycsr_building.nycsr_buildingname": "BEACON HIGH SCHOOL - MANHATTAN",
    "nycsr_locationsite.nycsr_sitename": "Beacon High School - M479 - M912 - 03M479 - 522 WEST 44TH STREET"
  },
  {
    "@odata.etag": "W/\"325744740\"",
    "nycsr_admininterventiontype@OData.Community.Display.V1.FormattedValue": "Classroom Closed",
    "nycsr_admininterventiontype": 882450000,
    "nycsr_caseid": "41d82c44-e41e-ec11-b6e6-001dd8305f31",
    "nycsr_interventionenddate@OData.Community.Display.V1.FormattedValue": "10/3/2021",
    "nycsr_interventionenddate": "2021-10-03T04:00:00Z",
    "nycsr_casenumber": "052524",
    "nycsr_interventionstartdate@OData.Community.Display.V1.FormattedValue": "9/27/2021",
    "nycsr_interventionstartdate": "2021-09-27T04:00:00Z",
    "nycsr_building.nycsr_address": "249 EAST 17TH STREET",
    "nycsr_building.nycsr_latitude@OData.Community.Display.V1.FormattedValue": "40,644,927.000000",
    "nycsr_building.nycsr_latitude": 40644927,
    "nycsr_building.nycsr_buildingid": "432f7d06-31f4-ea11-b882-24ee9a37d45c",
    "nycsr_building.nycsr_borough@OData.Community.Display.V1.FormattedValue": "Brooklyn",
    "nycsr_building.nycsr_borough": 882450002,
    "nycsr_building.nycsr_longitude@OData.Community.Display.V1.FormattedValue": "-73,962,743.000000",
    "nycsr_building.nycsr_longitude": -73962743,
    "nycsr_building.nycsr_geographicaldistrictcode": "22",
    "nycsr_building.nycsr_buildingname": "P.S. 245 - BROOKLYN",
    "nycsr_locationsite.nycsr_sitename": "P.S. 245 - K245 - K735 - 22K245 - 249 EAST 17TH STREET"
  },
  {
    "@odata.etag": "W/\"325860776\"",
    "nycsr_admininterventiontype@OData.Community.Display.V1.FormattedValue": "Non-Classroom Quarantine",
    "nycsr_admininterventiontype": 882450003,
    "nycsr_caseid": "54177de4-e61e-ec11-b6e6-001dd8305f31",
    "nycsr_interventionenddate@OData.Community.Display.V1.FormattedValue": "10/2/2021",
    "nycsr_interventionenddate": "2021-10-02T04:00:00Z",
    "nycsr_casenumber": "052534",
    "nycsr_interventionstartdate@OData.Community.Display.V1.FormattedValue": "9/28/2021",
    "nycsr_interventionstartdate": "2021-09-28T04:00:00Z",
    "nycsr_building.nycsr_address": "522 WEST 44TH STREET",
    "nycsr_building.nycsr_latitude@OData.Community.Display.V1.FormattedValue": "40,760,858.000000",
    "nycsr_building.nycsr_latitude": 40760858,
    "nycsr_building.nycsr_buildingid": "e7ed94c3-31f4-ea11-b882-24ee9a37d45c",
    "nycsr_building.nycsr_borough@OData.Community.Display.V1.FormattedValue": "Manhattan",
    "nycsr_building.nycsr_borough": 882450000,
    "nycsr_building.nycsr_longitude@OData.Community.Display.V1.FormattedValue": "-73,996,262.000000",
    "nycsr_building.nycsr_longitude": -73996262,
    "nycsr_building.nycsr_geographicaldistrictcode": "2",
    "nycsr_building.nycsr_buildingname": "BEACON HIGH SCHOOL - MANHATTAN",
    "nycsr_locationsite.nycsr_sitename": "Beacon High School - M479 - M912 - 03M479 - 522 WEST 44TH STREET"
  },
  {
    "@odata.etag": "W/\"324685615\"",
    "nycsr_admininterventiontype@OData.Community.Display.V1.FormattedValue": "Classroom Closed",
    "nycsr_admininterventiontype": 882450000,
    "nycsr_caseid": "0e2b0fca-eb1e-ec11-b6e6-001dd8305f31",
    "nycsr_interventionenddate@OData.Community.Display.V1.FormattedValue": "10/4/2021",
    "nycsr_interventionenddate": "2021-10-04T04:00:00Z",
    "nycsr_casenumber": "052546",
    "nycsr_interventionstartdate@OData.Community.Display.V1.FormattedValue": "9/27/2021",
    "nycsr_interventionstartdate": "2021-09-27T04:00:00Z",
    "nycsr_building.nycsr_address": "349 CABRINI BOULEVARD",
    "nycsr_building.nycsr_latitude@OData.Community.Display.V1.FormattedValue": "40,856,239.000000",
    "nycsr_building.nycsr_latitude": 40856239,
    "nycsr_building.nycsr_buildingid": "59507380-31f4-ea11-b882-24ee9a37d45c",
    "nycsr_building.nycsr_borough@OData.Community.Display.V1.FormattedValue": "Manhattan",
    "nycsr_building.nycsr_borough": 882450000,
    "nycsr_building.nycsr_longitude@OData.Community.Display.V1.FormattedValue": "-73,936,840.000000",
    "nycsr_building.nycsr_longitude": -73936840,
    "nycsr_building.nycsr_geographicaldistrictcode": "6",
    "nycsr_building.nycsr_buildingname": "P.S./I.S. 187 - MANHATTAN",
    "nycsr_locationsite.nycsr_sitename": "P.S./I.S. 187 Hudson Cliffs - M187 - M187 - 06M187 - 349 CABRINI BOULEVARD"
  },
  {
    "@odata.etag": "W/\"325296038\"",
    "nycsr_admininterventiontype@OData.Community.Display.V1.FormattedValue": "Partial Classroom Quarantine",
    "nycsr_admininterventiontype": 882450001,
    "nycsr_caseid": "43410c2b-ec1e-ec11-b6e6-001dd8305f31",
    "nycsr_interventionenddate@OData.Community.Display.V1.FormattedValue": "10/3/2021",
    "nycsr_interventionenddate": "2021-10-03T04:00:00Z",
    "nycsr_casenumber": "052547",
    "nycsr_interventionstartdate@OData.Community.Display.V1.FormattedValue": "9/27/2021",
    "nycsr_interventionstartdate": "2021-09-27T04:00:00Z",
    "nycsr_building.nycsr_address": "800 HOME STREET",
    "nycsr_building.nycsr_latitude@OData.Community.Display.V1.FormattedValue": "40,826,933.000000",
    "nycsr_building.nycsr_latitude": 40826933,
    "nycsr_building.nycsr_buildingid": "8601ce37-33f4-ea11-b882-24ee9a37d45c",
    "nycsr_building.nycsr_borough@OData.Community.Display.V1.FormattedValue": "Bronx",
    "nycsr_building.nycsr_borough": 882450001,
    "nycsr_building.nycsr_longitude@OData.Community.Display.V1.FormattedValue": "-73,900,593.000000",
    "nycsr_building.nycsr_longitude": -73900593,
    "nycsr_building.nycsr_geographicaldistrictcode": "12",
    "nycsr_building.nycsr_buildingname": "I.S. 158 - BRONX",
    "nycsr_locationsite.nycsr_sitename": "Bronx Career and College Preparatory High School - X479 - X158 - 12X479 - 800 HOME STREET"
  },
  {
    "@odata.etag": "W/\"324597628\"",
    "nycsr_admininterventiontype@OData.Community.Display.V1.FormattedValue": "Classroom Closed",
    "nycsr_admininterventiontype": 882450000,
    "nycsr_caseid": "33647abf-ee1e-ec11-b6e6-001dd8305f31",
    "nycsr_interventionenddate@OData.Community.Display.V1.FormattedValue": "10/3/2021",
    "nycsr_interventionenddate": "2021-10-03T04:00:00Z",
    "nycsr_casenumber": "052554",
    "nycsr_interventionstartdate@OData.Community.Display.V1.FormattedValue": "9/27/2021",
    "nycsr_interventionstartdate": "2021-09-27T04:00:00Z",
    "nycsr_building.nycsr_address": "144 KEATING PLACE",
    "nycsr_building.nycsr_latitude@OData.Community.Display.V1.FormattedValue": "40,591,480.000000",
    "nycsr_building.nycsr_latitude": 40591480,
    "nycsr_building.nycsr_buildingid": "dd8521d0-32f4-ea11-b882-24ee9a37d45c",
    "nycsr_building.nycsr_borough@OData.Community.Display.V1.FormattedValue": "Staten Island",
    "nycsr_building.nycsr_borough": 882450004,
    "nycsr_building.nycsr_longitude@OData.Community.Display.V1.FormattedValue": "-74,157,327.000000",
    "nycsr_building.nycsr_longitude": -74157327,
    "nycsr_building.nycsr_geographicaldistrictcode": "31",
    "nycsr_building.nycsr_buildingname": "P.S. 69 - STATEN ISLAND",
    "nycsr_locationsite.nycsr_sitename": "P.S. 069 Daniel D. Tompkins - R069 - R069 - 31R069 - 144 KEATING PLACE"
  },
  {
    "@odata.etag": "W/\"324685368\"",
    "nycsr_admininterventiontype@OData.Community.Display.V1.FormattedValue": "Partial Classroom Quarantine",
    "nycsr_admininterventiontype": 882450001,
    "nycsr_caseid": "7d3a6756-f11e-ec11-b6e6-001dd8305f31",
    "nycsr_interventionenddate@OData.Community.Display.V1.FormattedValue": "10/4/2021",
    "nycsr_interventionenddate": "2021-10-04T04:00:00Z",
    "nycsr_casenumber": "052557",
    "nycsr_interventionstartdate@OData.Community.Display.V1.FormattedValue": "9/27/2021",
    "nycsr_interventionstartdate": "2021-09-27T04:00:00Z",
    "nycsr_building.nycsr_address": "237 7 AVENUE",
    "nycsr_building.nycsr_latitude@OData.Community.Display.V1.FormattedValue": "40,669,255.000000",
    "nycsr_building.nycsr_latitude": 40669255,
    "nycsr_building.nycsr_buildingid": "929c11e8-30f4-ea11-b882-24ee9a37d45c",
    "nycsr_building.nycsr_borough@OData.Community.Display.V1.FormattedValue": "Brooklyn",
    "nycsr_building.nycsr_borough": 882450002,
    "nycsr_building.nycsr_longitude@OData.Community.Display.V1.FormattedValue": "-73,978,580.000000",
    "nycsr_building.nycsr_longitude": -73978580,
    "nycsr_building.nycsr_geographicaldistrictcode": "15",
    "nycsr_building.nycsr_buildingname": "John Jay Educational Campus",
    "nycsr_locationsite.nycsr_sitename": "Park Slope Collegiate - K464 - K460 - 15K464 - 237 7 AVENUE"
  },
  {
    "@odata.etag": "W/\"325405337\"",
    "nycsr_admininterventiontype@OData.Community.Display.V1.FormattedValue": "Classroom Closed",
    "nycsr_admininterventiontype": 882450000,
    "nycsr_caseid": "f41daf64-f51e-ec11-b6e6-001dd8305f31",
    "nycsr_interventionenddate@OData.Community.Display.V1.FormattedValue": "10/4/2021",
    "nycsr_interventionenddate": "2021-10-04T04:00:00Z",
    "nycsr_casenumber": "052567",
    "nycsr_interventionstartdate@OData.Community.Display.V1.FormattedValue": "9/27/2021",
    "nycsr_interventionstartdate": "2021-09-27T04:00:00Z",
    "nycsr_building.nycsr_address": "557 PENNSYLVANIA AVENUE",
    "nycsr_building.nycsr_latitude@OData.Community.Display.V1.FormattedValue": "40,664,067.000000",
    "nycsr_building.nycsr_latitude": 40664067,
    "nycsr_building.nycsr_buildingid": "e7f57030-30f4-ea11-b882-24ee9a37d45c",
    "nycsr_building.nycsr_borough@OData.Community.Display.V1.FormattedValue": "Brooklyn",
    "nycsr_building.nycsr_borough": 882450002,
    "nycsr_building.nycsr_longitude@OData.Community.Display.V1.FormattedValue": "-73,893,328.000000",
    "nycsr_building.nycsr_longitude": -73893328,
    "nycsr_building.nycsr_geographicaldistrictcode": "19",
    "nycsr_building.nycsr_buildingname": "P.S. 13 - BROOKLYN",
    "nycsr_locationsite.nycsr_sitename": "P.S. 013 Roberto Clemente - K013 - K013 - 19K013 - 557 PENNSYLVANIA AVENUE"
  },
  {
    "@odata.etag": "W/\"325500810\"",
    "nycsr_admininterventiontype@OData.Community.Display.V1.FormattedValue": "Classroom Closed",
    "nycsr_admininterventiontype": 882450000,
    "nycsr_caseid": "6423edbf-f51e-ec11-b6e6-001dd8305f31",
    "nycsr_interventionenddate@OData.Community.Display.V1.FormattedValue": "10/1/2021",
    "nycsr_interventionenddate": "2021-10-01T04:00:00Z",
    "nycsr_casenumber": "052571",
    "nycsr_interventionstartdate@OData.Community.Display.V1.FormattedValue": "9/27/2021",
    "nycsr_interventionstartdate": "2021-09-27T04:00:00Z",
    "nycsr_building.nycsr_address": "825 HICKSVILLE ROAD",
    "nycsr_building.nycsr_latitude@OData.Community.Display.V1.FormattedValue": "40,599,664.000000",
    "nycsr_building.nycsr_latitude": 40599664,
    "nycsr_building.nycsr_buildingid": "93977d2b-32f4-ea11-b882-24ee9a37d45c",
    "nycsr_building.nycsr_borough@OData.Community.Display.V1.FormattedValue": "Queens",
    "nycsr_building.nycsr_borough": 882450003,
    "nycsr_building.nycsr_longitude@OData.Community.Display.V1.FormattedValue": "-73,744,128.000000",
    "nycsr_building.nycsr_longitude": -73744128,
    "nycsr_building.nycsr_geographicaldistrictcode": "27",
    "nycsr_building.nycsr_buildingname": "P.S. 197 - QUEENS",
    "nycsr_locationsite.nycsr_sitename": "P.S. 197 The Ocean School - Q197 - Q197 - 27Q197 - 825 HICKSVILLE ROAD"
  },
  {
    "@odata.etag": "W/\"327673015\"",
    "nycsr_admininterventiontype@OData.Community.Display.V1.FormattedValue": "Partial Classroom Quarantine",
    "nycsr_admininterventiontype": 882450001,
    "nycsr_caseid": "bb9068b1-fa1e-ec11-b6e6-001dd8305f31",
    "nycsr_interventionenddate@OData.Community.Display.V1.FormattedValue": "10/4/2021",
    "nycsr_interventionenddate": "2021-10-04T04:00:00Z",
    "nycsr_casenumber": "052580",
    "nycsr_interventionstartdate@OData.Community.Display.V1.FormattedValue": "9/29/2021",
    "nycsr_interventionstartdate": "2021-09-29T04:00:00Z",
    "nycsr_building.nycsr_address": "120 EAST 184 STREET",
    "nycsr_building.nycsr_latitude@OData.Community.Display.V1.FormattedValue": "40,859,496.000000",
    "nycsr_building.nycsr_latitude": 40859496,
    "nycsr_building.nycsr_buildingid": "5b0d6d19-33f4-ea11-b882-24ee9a37d45c",
    "nycsr_building.nycsr_borough@OData.Community.Display.V1.FormattedValue": "Bronx",
    "nycsr_building.nycsr_borough": 882450001,
    "nycsr_building.nycsr_longitude@OData.Community.Display.V1.FormattedValue": "-73,900,490.000000",
    "nycsr_building.nycsr_longitude": -73900490,
    "nycsr_building.nycsr_geographicaldistrictcode": "10",
    "nycsr_building.nycsr_buildingname": "I.S. 399 (OLD X HS/X115) - BRONX",
    "nycsr_locationsite.nycsr_sitename": "Academy For Personal Leadership And Excellence - X363 - X115 - 10X363 - 120 EAST 184 STREET"
  },
  {
    "@odata.etag": "W/\"324595816\"",
    "nycsr_admininterventiontype@OData.Community.Display.V1.FormattedValue": "Non-Classroom Quarantine",
    "nycsr_admininterventiontype": 882450003,
    "nycsr_caseid": "3e81168c-fc1e-ec11-b6e6-001dd8305f31",
    "nycsr_interventionenddate@OData.Community.Display.V1.FormattedValue": "10/4/2021",
    "nycsr_interventionenddate": "2021-10-04T04:00:00Z",
    "nycsr_casenumber": "052587",
    "nycsr_interventionstartdate@OData.Community.Display.V1.FormattedValue": "9/27/2021",
    "nycsr_interventionstartdate": "2021-09-27T04:00:00Z",
    "nycsr_building.nycsr_address": "51-60 MARATHON PARKWAY",
    "nycsr_building.nycsr_latitude@OData.Community.Display.V1.FormattedValue": "40,762,241.000000",
    "nycsr_building.nycsr_latitude": 40762241,
    "nycsr_building.nycsr_buildingid": "732f77fa-31f4-ea11-b882-24ee9a37d45c",
    "nycsr_building.nycsr_borough@OData.Community.Display.V1.FormattedValue": "Queens",
    "nycsr_building.nycsr_borough": 882450003,
    "nycsr_building.nycsr_longitude@OData.Community.Display.V1.FormattedValue": "-73,734,832.000000",
    "nycsr_building.nycsr_longitude": -73734832,
    "nycsr_building.nycsr_geographicaldistrictcode": "26",
    "nycsr_building.nycsr_buildingname": "J.H.S. 67 - QUEENS",
    "nycsr_locationsite.nycsr_sitename": "J.H.S. 067 Louis Pasteur - Q067 - Q067 - 26Q067 - 51-60 MARATHON PARKWAY"
  },
  {
    "@odata.etag": "W/\"325860796\"",
    "nycsr_admininterventiontype@OData.Community.Display.V1.FormattedValue": "Partial Classroom Quarantine",
    "nycsr_admininterventiontype": 882450001,
    "nycsr_caseid": "1d209336-831f-ec11-b6e6-001dd8305f31",
    "nycsr_interventionenddate@OData.Community.Display.V1.FormattedValue": "10/4/2021",
    "nycsr_interventionenddate": "2021-10-04T04:00:00Z",
    "nycsr_casenumber": "052601",
    "nycsr_interventionstartdate@OData.Community.Display.V1.FormattedValue": "9/28/2021",
    "nycsr_interventionstartdate": "2021-09-28T04:00:00Z",
    "nycsr_building.nycsr_address": "90-15 SUTTER AVENUE",
    "nycsr_building.nycsr_latitude@OData.Community.Display.V1.FormattedValue": "40,676,978.000000",
    "nycsr_building.nycsr_latitude": 40676978,
    "nycsr_building.nycsr_buildingid": "6a2f77fa-31f4-ea11-b882-24ee9a37d45c",
    "nycsr_building.nycsr_borough@OData.Community.Display.V1.FormattedValue": "Queens",
    "nycsr_building.nycsr_borough": 882450003,
    "nycsr_building.nycsr_longitude@OData.Community.Display.V1.FormattedValue": "-73,846,796.000000",
    "nycsr_building.nycsr_longitude": -73846796,
    "nycsr_building.nycsr_geographicaldistrictcode": "27",
    "nycsr_building.nycsr_buildingname": "P.S. 63 - QUEENS",
    "nycsr_locationsite.nycsr_sitename": "P.S. 063 Old South - Q063 - Q063 - 27Q063 - 90-15 SUTTER AVENUE"
  },
  {
    "@odata.etag": "W/\"325860801\"",
    "nycsr_admininterventiontype@OData.Community.Display.V1.FormattedValue": "Classroom Closed",
    "nycsr_admininterventiontype": 882450000,
    "nycsr_caseid": "77042f3d-841f-ec11-b6e6-001dd8305f31",
    "nycsr_interventionenddate@OData.Community.Display.V1.FormattedValue": "10/4/2021",
    "nycsr_interventionenddate": "2021-10-04T04:00:00Z",
    "nycsr_casenumber": "052603",
    "nycsr_interventionstartdate@OData.Community.Display.V1.FormattedValue": "9/28/2021",
    "nycsr_interventionstartdate": "2021-09-28T04:00:00Z",
    "nycsr_building.nycsr_address": "131 NORMAN AVENUE",
    "nycsr_building.nycsr_latitude@OData.Community.Display.V1.FormattedValue": "40,726,378.000000",
    "nycsr_building.nycsr_latitude": 40726378,
    "nycsr_building.nycsr_buildingid": "f91aad3c-30f4-ea11-b882-24ee9a37d45c",
    "nycsr_building.nycsr_borough@OData.Community.Display.V1.FormattedValue": "Brooklyn",
    "nycsr_building.nycsr_borough": 882450002,
    "nycsr_building.nycsr_longitude@OData.Community.Display.V1.FormattedValue": "-73,949,756.000000",
    "nycsr_building.nycsr_longitude": -73949756,
    "nycsr_building.nycsr_geographicaldistrictcode": "14",
    "nycsr_building.nycsr_buildingname": "P.S. 34 - BROOKLYN",
    "nycsr_locationsite.nycsr_sitename": "P.S. 034 Oliver H. Perry - K034 - K034 - 14K034 - 131 NORMAN AVENUE"
  },
  {
    "@odata.etag": "W/\"325860821\"",
    "nycsr_admininterventiontype@OData.Community.Display.V1.FormattedValue": "Partial Classroom Quarantine",
    "nycsr_admininterventiontype": 882450001,
    "nycsr_caseid": "17150ef3-841f-ec11-b6e6-001dd8305f31",
    "nycsr_interventionenddate@OData.Community.Display.V1.FormattedValue": "10/4/2021",
    "nycsr_interventionenddate": "2021-10-04T04:00:00Z",
    "nycsr_casenumber": "052607",
    "nycsr_interventionstartdate@OData.Community.Display.V1.FormattedValue": "9/28/2021",
    "nycsr_interventionstartdate": "2021-09-28T04:00:00Z",
    "nycsr_building.nycsr_address": "131 NORMAN AVENUE",
    "nycsr_building.nycsr_latitude@OData.Community.Display.V1.FormattedValue": "40,726,378.000000",
    "nycsr_building.nycsr_latitude": 40726378,
    "nycsr_building.nycsr_buildingid": "f91aad3c-30f4-ea11-b882-24ee9a37d45c",
    "nycsr_building.nycsr_borough@OData.Community.Display.V1.FormattedValue": "Brooklyn",
    "nycsr_building.nycsr_borough": 882450002,
    "nycsr_building.nycsr_longitude@OData.Community.Display.V1.FormattedValue": "-73,949,756.000000",
    "nycsr_building.nycsr_longitude": -73949756,
    "nycsr_building.nycsr_geographicaldistrictcode": "14",
    "nycsr_building.nycsr_buildingname": "P.S. 34 - BROOKLYN",
    "nycsr_locationsite.nycsr_sitename": "P.S. 034 Oliver H. Perry - K034 - K034 - 14K034 - 131 NORMAN AVENUE"
  },
  {
    "@odata.etag": "W/\"325860871\"",
    "nycsr_admininterventiontype@OData.Community.Display.V1.FormattedValue": "Classroom Closed",
    "nycsr_admininterventiontype": 882450000,
    "nycsr_caseid": "d5598b90-871f-ec11-b6e6-001dd8305f31",
    "nycsr_interventionenddate@OData.Community.Display.V1.FormattedValue": "10/2/2021",
    "nycsr_interventionenddate": "2021-10-02T04:00:00Z",
    "nycsr_casenumber": "052622",
    "nycsr_interventionstartdate@OData.Community.Display.V1.FormattedValue": "9/28/2021",
    "nycsr_interventionstartdate": "2021-09-28T04:00:00Z",
    "nycsr_building.nycsr_address": "1800 Utica Avenue",
    "nycsr_building.nycsr_latitude@OData.Community.Display.V1.FormattedValue": "40,628,417.000000",
    "nycsr_building.nycsr_latitude": 40628417,
    "nycsr_building.nycsr_buildingid": "17d8cf12-31f4-ea11-b882-24ee9a37d45c",
    "nycsr_building.nycsr_borough@OData.Community.Display.V1.FormattedValue": "Brooklyn",
    "nycsr_building.nycsr_borough": 882450002,
    "nycsr_building.nycsr_longitude@OData.Community.Display.V1.FormattedValue": "-73,928,250.000000",
    "nycsr_building.nycsr_longitude": -73928250,
    "nycsr_building.nycsr_geographicaldistrictcode": "22",
    "nycsr_building.nycsr_buildingname": "P.S. 326 - BROOKLYN",
    "nycsr_locationsite.nycsr_sitename": "P.S. 326 - K326 - K852 - 22K326 - 1800 Utica Avenue"
  },
  {
    "@odata.etag": "W/\"325860917\"",
    "nycsr_admininterventiontype@OData.Community.Display.V1.FormattedValue": "Classroom Closed",
    "nycsr_admininterventiontype": 882450000,
    "nycsr_caseid": "ca0e43f1-881f-ec11-b6e6-001dd8305f31",
    "nycsr_interventionenddate@OData.Community.Display.V1.FormattedValue": "10/2/2021",
    "nycsr_interventionenddate": "2021-10-02T04:00:00Z",
    "nycsr_casenumber": "052632",
    "nycsr_interventionstartdate@OData.Community.Display.V1.FormattedValue": "9/28/2021",
    "nycsr_interventionstartdate": "2021-09-28T04:00:00Z",
    "nycsr_building.nycsr_address": "1800 Utica Avenue",
    "nycsr_building.nycsr_latitude@OData.Community.Display.V1.FormattedValue": "40,628,417.000000",
    "nycsr_building.nycsr_latitude": 40628417,
    "nycsr_building.nycsr_buildingid": "17d8cf12-31f4-ea11-b882-24ee9a37d45c",
    "nycsr_building.nycsr_borough@OData.Community.Display.V1.FormattedValue": "Brooklyn",
    "nycsr_building.nycsr_borough": 882450002,
    "nycsr_building.nycsr_longitude@OData.Community.Display.V1.FormattedValue": "-73,928,250.000000",
    "nycsr_building.nycsr_longitude": -73928250,
    "nycsr_building.nycsr_geographicaldistrictcode": "22",
    "nycsr_building.nycsr_buildingname": "P.S. 326 - BROOKLYN",
    "nycsr_locationsite.nycsr_sitename": "P.S. 326 - K326 - K852 - 22K326 - 1800 Utica Avenue"
  },
  {
    "@odata.etag": "W/\"326846248\"",
    "nycsr_admininterventiontype@OData.Community.Display.V1.FormattedValue": "Partial Classroom Quarantine",
    "nycsr_admininterventiontype": 882450001,
    "nycsr_caseid": "7d83ee7f-931f-ec11-b6e6-001dd8305f31",
    "nycsr_interventionenddate@OData.Community.Display.V1.FormattedValue": "10/4/2021",
    "nycsr_interventionenddate": "2021-10-04T04:00:00Z",
    "nycsr_casenumber": "052686",
    "nycsr_interventionstartdate@OData.Community.Display.V1.FormattedValue": "9/28/2021",
    "nycsr_interventionstartdate": "2021-09-28T04:00:00Z",
    "nycsr_building.nycsr_address": "91-30 METROPOLITAN AVENUE",
    "nycsr_building.nycsr_latitude@OData.Community.Display.V1.FormattedValue": "40,708,431.000000",
    "nycsr_building.nycsr_latitude": 40708431,
    "nycsr_building.nycsr_buildingid": "a372c880-32f4-ea11-b882-24ee9a37d45c",
    "nycsr_building.nycsr_borough@OData.Community.Display.V1.FormattedValue": "Queens",
    "nycsr_building.nycsr_borough": 882450003,
    "nycsr_building.nycsr_longitude@OData.Community.Display.V1.FormattedValue": "-73,855,543.000000",
    "nycsr_building.nycsr_longitude": -73855543,
    "nycsr_building.nycsr_geographicaldistrictcode": "28",
    "nycsr_building.nycsr_buildingname": "METROPOLITAN AVENUE CAMPUS - QUEENS",
    "nycsr_locationsite.nycsr_sitename": "P.S. Q233 - Q233 - Q686 - 75Q233 - 91-30 METROPOLITAN AVENUE"
  },
  {
    "@odata.etag": "W/\"327198826\"",
    "nycsr_admininterventiontype@OData.Community.Display.V1.FormattedValue": "Partial Classroom Quarantine",
    "nycsr_admininterventiontype": 882450001,
    "nycsr_caseid": "fd1c4baa-961f-ec11-b6e6-001dd8305f31",
    "nycsr_interventionenddate@OData.Community.Display.V1.FormattedValue": "10/4/2021",
    "nycsr_interventionenddate": "2021-10-04T04:00:00Z",
    "nycsr_casenumber": "052714",
    "nycsr_interventionstartdate@OData.Community.Display.V1.FormattedValue": "9/29/2021",
    "nycsr_interventionstartdate": "2021-09-29T04:00:00Z",
    "nycsr_building.nycsr_address": "19 EAST 103 STREET",
    "nycsr_building.nycsr_latitude@OData.Community.Display.V1.FormattedValue": "40,792,302.000000",
    "nycsr_building.nycsr_latitude": 40792302,
    "nycsr_building.nycsr_buildingid": "42005d7a-31f4-ea11-b882-24ee9a37d45c",
    "nycsr_building.nycsr_borough@OData.Community.Display.V1.FormattedValue": "Manhattan",
    "nycsr_building.nycsr_borough": 882450000,
    "nycsr_building.nycsr_longitude@OData.Community.Display.V1.FormattedValue": "-73,951,425.000000",
    "nycsr_building.nycsr_longitude": -73951425,
    "nycsr_building.nycsr_geographicaldistrictcode": "4",
    "nycsr_building.nycsr_buildingname": "P.S. 171 - MANHATTAN",
    "nycsr_locationsite.nycsr_sitename": "P.S. 171 Patrick Henry - M171 - M171 - 04M171 - 19 EAST 103 STREET"
  },
  {
    "@odata.etag": "W/\"326073155\"",
    "nycsr_admininterventiontype@OData.Community.Display.V1.FormattedValue": "Classroom Closed",
    "nycsr_admininterventiontype": 882450000,
    "nycsr_caseid": "130d6ae1-991f-ec11-b6e6-001dd8305f31",
    "nycsr_interventionenddate@OData.Community.Display.V1.FormattedValue": "10/4/2021",
    "nycsr_interventionenddate": "2021-10-04T04:00:00Z",
    "nycsr_casenumber": "052746",
    "nycsr_interventionstartdate@OData.Community.Display.V1.FormattedValue": "9/28/2021",
    "nycsr_interventionstartdate": "2021-09-28T04:00:00Z",
    "nycsr_building.nycsr_address": "3047 BRUCKNER BOULEVARD",
    "nycsr_building.nycsr_latitude@OData.Community.Display.V1.FormattedValue": "40,835,318.000000",
    "nycsr_building.nycsr_latitude": 40835318,
    "nycsr_building.nycsr_buildingid": "2a9ebaee-32f4-ea11-b882-24ee9a37d45c",
    "nycsr_building.nycsr_borough@OData.Community.Display.V1.FormattedValue": "Bronx",
    "nycsr_building.nycsr_borough": 882450001,
    "nycsr_building.nycsr_longitude@OData.Community.Display.V1.FormattedValue": "-73,826,277.000000",
    "nycsr_building.nycsr_longitude": -73826277,
    "nycsr_building.nycsr_geographicaldistrictcode": "8",
    "nycsr_building.nycsr_buildingname": "P.S. 14 - BRONX",
    "nycsr_locationsite.nycsr_sitename": "P.S. X014 Senator John Calandra - X014 - X014 - 08X014 - 3047 BRUCKNER BOULEVARD"
  },
  {
    "@odata.etag": "W/\"325861315\"",
    "nycsr_admininterventiontype@OData.Community.Display.V1.FormattedValue": "Non-Classroom Quarantine",
    "nycsr_admininterventiontype": 882450003,
    "nycsr_caseid": "70366c86-9b1f-ec11-b6e6-001dd8305f31",
    "nycsr_interventionenddate@OData.Community.Display.V1.FormattedValue": "10/4/2021",
    "nycsr_interventionenddate": "2021-10-04T04:00:00Z",
    "nycsr_casenumber": "052760",
    "nycsr_interventionstartdate@OData.Community.Display.V1.FormattedValue": "9/28/2021",
    "nycsr_interventionstartdate": "2021-09-28T04:00:00Z",
    "nycsr_building.nycsr_address": "4202 EIGHTH AVENUE",
    "nycsr_building.nycsr_latitude@OData.Community.Display.V1.FormattedValue": "40,645,521.000000",
    "nycsr_building.nycsr_latitude": 40645521,
    "nycsr_building.nycsr_buildingid": "63275a30-4afb-ea11-b883-24ee9a37d459",
    "nycsr_building.nycsr_longitude@OData.Community.Display.V1.FormattedValue": "-73,999,155.000000",
    "nycsr_building.nycsr_longitude": -73999155,
    "nycsr_building.nycsr_geographicaldistrictcode": "15",
    "nycsr_building.nycsr_buildingname": "BCA Bay Ridge DCC",
    "nycsr_locationsite.nycsr_sitename": "BCA Bay Ridge DCC - KBUJ - KBTX -  - 4202 EIGHTH AVENUE"
  },
  {
    "@odata.etag": "W/\"327119069\"",
    "nycsr_admininterventiontype@OData.Community.Display.V1.FormattedValue": "Non-Classroom Quarantine",
    "nycsr_admininterventiontype": 882450003,
    "nycsr_caseid": "a80ce038-9e1f-ec11-b6e6-001dd8305f31",
    "nycsr_interventionenddate@OData.Community.Display.V1.FormattedValue": "10/4/2021",
    "nycsr_interventionenddate": "2021-10-04T04:00:00Z",
    "nycsr_casenumber": "052787",
    "nycsr_interventionstartdate@OData.Community.Display.V1.FormattedValue": "9/28/2021",
    "nycsr_interventionstartdate": "2021-09-28T04:00:00Z",
    "nycsr_building.nycsr_address": "300 ADELPHI STREET",
    "nycsr_building.nycsr_latitude@OData.Community.Display.V1.FormattedValue": "40,688,769.000000",
    "nycsr_building.nycsr_latitude": 40688769,
    "nycsr_building.nycsr_buildingid": "1fe85c61-30f4-ea11-b882-24ee9a37d45c",
    "nycsr_building.nycsr_borough@OData.Community.Display.V1.FormattedValue": "Brooklyn",
    "nycsr_building.nycsr_borough": 882450002,
    "nycsr_building.nycsr_longitude@OData.Community.Display.V1.FormattedValue": "-73,971,474.000000",
    "nycsr_building.nycsr_longitude": -73971474,
    "nycsr_building.nycsr_geographicaldistrictcode": "13",
    "nycsr_building.nycsr_buildingname": "I.S. 113 - BROOKLYN",
    "nycsr_locationsite.nycsr_sitename": "Compass Charter School - K789 - K113 - 84K789 - 300 ADELPHI STREET"
  },
  {
    "@odata.etag": "W/\"325861461\"",
    "nycsr_admininterventiontype@OData.Community.Display.V1.FormattedValue": "Classroom Closed",
    "nycsr_admininterventiontype": 882450000,
    "nycsr_caseid": "36f99b67-a01f-ec11-b6e6-001dd8305f31",
    "nycsr_interventionenddate@OData.Community.Display.V1.FormattedValue": "10/3/2021",
    "nycsr_interventionenddate": "2021-10-03T04:00:00Z",
    "nycsr_casenumber": "052807",
    "nycsr_interventionstartdate@OData.Community.Display.V1.FormattedValue": "9/28/2021",
    "nycsr_interventionstartdate": "2021-09-28T04:00:00Z",
    "nycsr_building.nycsr_address": "2944 PITKIN AVENUE",
    "nycsr_building.nycsr_latitude@OData.Community.Display.V1.FormattedValue": "40,675,881.000000",
    "nycsr_building.nycsr_latitude": 40675881,
    "nycsr_building.nycsr_buildingid": "4b5bc58c-30f4-ea11-b882-24ee9a37d45c",
    "nycsr_building.nycsr_borough@OData.Community.Display.V1.FormattedValue": "Brooklyn",
    "nycsr_building.nycsr_borough": 882450002,
    "nycsr_building.nycsr_longitude@OData.Community.Display.V1.FormattedValue": "-73,862,961.000000",
    "nycsr_building.nycsr_longitude": -73862961,
    "nycsr_building.nycsr_geographicaldistrictcode": "19",
    "nycsr_building.nycsr_buildingname": "P.S. 214 - BROOKLYN",
    "nycsr_locationsite.nycsr_sitename": "P.S. 214 Michael Friedsam - K214 - K214 - 19K214 - 2944 PITKIN AVENUE"
  },
  {
    "@odata.etag": "W/\"325861571\"",
    "nycsr_admininterventiontype@OData.Community.Display.V1.FormattedValue": "Partial Classroom Quarantine",
    "nycsr_admininterventiontype": 882450001,
    "nycsr_caseid": "6ee63193-a41f-ec11-b6e6-001dd8305f31",
    "nycsr_interventionenddate@OData.Community.Display.V1.FormattedValue": "10/4/2021",
    "nycsr_interventionenddate": "2021-10-04T04:00:00Z",
    "nycsr_casenumber": "052868",
    "nycsr_interventionstartdate@OData.Community.Display.V1.FormattedValue": "9/28/2021",
    "nycsr_interventionstartdate": "2021-09-28T04:00:00Z",
    "nycsr_building.nycsr_address": "1801 AVENUE Y",
    "nycsr_building.nycsr_latitude@OData.Community.Display.V1.FormattedValue": "40,591,103.000000",
    "nycsr_building.nycsr_latitude": 40591103,
    "nycsr_building.nycsr_buildingid": "a583ff9e-30f4-ea11-b882-24ee9a37d45c",
    "nycsr_building.nycsr_borough@OData.Community.Display.V1.FormattedValue": "Brooklyn",
    "nycsr_building.nycsr_borough": 882450002,
    "nycsr_building.nycsr_longitude@OData.Community.Display.V1.FormattedValue": "-73,951,550.000000",
    "nycsr_building.nycsr_longitude": -73951550,
    "nycsr_building.nycsr_geographicaldistrictcode": "22",
    "nycsr_building.nycsr_buildingname": "P.S. 254 - BROOKLYN",
    "nycsr_locationsite.nycsr_sitename": "P.S. 254 Dag Hammarskjold - K254 - K254 - 22K254 - 1801 AVENUE Y"
  },
  {
    "@odata.etag": "W/\"325861581\"",
    "nycsr_admininterventiontype@OData.Community.Display.V1.FormattedValue": "Classroom Closed",
    "nycsr_admininterventiontype": 882450000,
    "nycsr_caseid": "ee2c2a99-a41f-ec11-b6e6-001dd8305f31",
    "nycsr_interventionenddate@OData.Community.Display.V1.FormattedValue": "10/4/2021",
    "nycsr_interventionenddate": "2021-10-04T04:00:00Z",
    "nycsr_casenumber": "052870",
    "nycsr_interventionstartdate@OData.Community.Display.V1.FormattedValue": "9/28/2021",
    "nycsr_interventionstartdate": "2021-09-28T04:00:00Z",
    "nycsr_building.nycsr_address": "1801 AVENUE Y",
    "nycsr_building.nycsr_latitude@OData.Community.Display.V1.FormattedValue": "40,591,103.000000",
    "nycsr_building.nycsr_latitude": 40591103,
    "nycsr_building.nycsr_buildingid": "a583ff9e-30f4-ea11-b882-24ee9a37d45c",
    "nycsr_building.nycsr_borough@OData.Community.Display.V1.FormattedValue": "Brooklyn",
    "nycsr_building.nycsr_borough": 882450002,
    "nycsr_building.nycsr_longitude@OData.Community.Display.V1.FormattedValue": "-73,951,550.000000",
    "nycsr_building.nycsr_longitude": -73951550,
    "nycsr_building.nycsr_geographicaldistrictcode": "22",
    "nycsr_building.nycsr_buildingname": "P.S. 254 - BROOKLYN",
    "nycsr_locationsite.nycsr_sitename": "P.S. 254 Dag Hammarskjold - K254 - K254 - 22K254 - 1801 AVENUE Y"
  },
  {
    "@odata.etag": "W/\"325861587\"",
    "nycsr_admininterventiontype@OData.Community.Display.V1.FormattedValue": "Classroom Closed",
    "nycsr_admininterventiontype": 882450000,
    "nycsr_caseid": "042d2a99-a41f-ec11-b6e6-001dd8305f31",
    "nycsr_interventionenddate@OData.Community.Display.V1.FormattedValue": "10/4/2021",
    "nycsr_interventionenddate": "2021-10-04T04:00:00Z",
    "nycsr_casenumber": "052871",
    "nycsr_interventionstartdate@OData.Community.Display.V1.FormattedValue": "9/28/2021",
    "nycsr_interventionstartdate": "2021-09-28T04:00:00Z",
    "nycsr_building.nycsr_address": "1801 AVENUE Y",
    "nycsr_building.nycsr_latitude@OData.Community.Display.V1.FormattedValue": "40,591,103.000000",
    "nycsr_building.nycsr_latitude": 40591103,
    "nycsr_building.nycsr_buildingid": "a583ff9e-30f4-ea11-b882-24ee9a37d45c",
    "nycsr_building.nycsr_borough@OData.Community.Display.V1.FormattedValue": "Brooklyn",
    "nycsr_building.nycsr_borough": 882450002,
    "nycsr_building.nycsr_longitude@OData.Community.Display.V1.FormattedValue": "-73,951,550.000000",
    "nycsr_building.nycsr_longitude": -73951550,
    "nycsr_building.nycsr_geographicaldistrictcode": "22",
    "nycsr_building.nycsr_buildingname": "P.S. 254 - BROOKLYN",
    "nycsr_locationsite.nycsr_sitename": "P.S. 254 Dag Hammarskjold - K254 - K254 - 22K254 - 1801 AVENUE Y"
  },
  {
    "@odata.etag": "W/\"325861627\"",
    "nycsr_admininterventiontype@OData.Community.Display.V1.FormattedValue": "Non-Classroom Quarantine",
    "nycsr_admininterventiontype": 882450003,
    "nycsr_caseid": "a914738a-a61f-ec11-b6e6-001dd8305f31",
    "nycsr_interventionenddate@OData.Community.Display.V1.FormattedValue": "10/3/2021",
    "nycsr_interventionenddate": "2021-10-03T04:00:00Z",
    "nycsr_casenumber": "052893",
    "nycsr_interventionstartdate@OData.Community.Display.V1.FormattedValue": "9/28/2021",
    "nycsr_interventionstartdate": "2021-09-28T04:00:00Z",
    "nycsr_building.nycsr_address": "320 BEACH 104TH STREET",
    "nycsr_building.nycsr_latitude@OData.Community.Display.V1.FormattedValue": "40,584,543.000000",
    "nycsr_building.nycsr_latitude": 40584543,
    "nycsr_building.nycsr_buildingid": "a50e6e25-32f4-ea11-b882-24ee9a37d45c",
    "nycsr_building.nycsr_borough@OData.Community.Display.V1.FormattedValue": "Queens",
    "nycsr_building.nycsr_borough": 882450003,
    "nycsr_building.nycsr_longitude@OData.Community.Display.V1.FormattedValue": "-73,825,162.000000",
    "nycsr_building.nycsr_longitude": -73825162,
    "nycsr_building.nycsr_geographicaldistrictcode": "27",
    "nycsr_building.nycsr_buildingname": "I.S. 323 (OLD IS 180) - QUEENS",
    "nycsr_locationsite.nycsr_sitename": "Scholars' Academy - Q323 - Q180 - 27Q323 - 320 BEACH 104TH STREET"
  },
  {
    "@odata.etag": "W/\"327144015\"",
    "nycsr_admininterventiontype@OData.Community.Display.V1.FormattedValue": "Classroom Closed",
    "nycsr_admininterventiontype": 882450000,
    "nycsr_caseid": "e642369a-ad1f-ec11-b6e6-001dd8305f31",
    "nycsr_interventionenddate@OData.Community.Display.V1.FormattedValue": "10/4/2021",
    "nycsr_interventionenddate": "2021-10-04T04:00:00Z",
    "nycsr_casenumber": "052962",
    "nycsr_interventionstartdate@OData.Community.Display.V1.FormattedValue": "9/28/2021",
    "nycsr_interventionstartdate": "2021-09-28T04:00:00Z",
    "nycsr_building.nycsr_address": "60-02 60 LANE",
    "nycsr_building.nycsr_latitude@OData.Community.Display.V1.FormattedValue": "40,716,296.000000",
    "nycsr_building.nycsr_latitude": 40716296,
    "nycsr_building.nycsr_buildingid": "e19b4c1f-32f4-ea11-b882-24ee9a37d45c",
    "nycsr_building.nycsr_borough@OData.Community.Display.V1.FormattedValue": "Queens",
    "nycsr_building.nycsr_borough": 882450003,
    "nycsr_building.nycsr_longitude@OData.Community.Display.V1.FormattedValue": "-73,904,463.000000",
    "nycsr_building.nycsr_longitude": -73904463,
    "nycsr_building.nycsr_geographicaldistrictcode": "24",
    "nycsr_building.nycsr_buildingname": "P.S. 153 - QUEENS",
    "nycsr_locationsite.nycsr_sitename": "P.S. 153 Maspeth Elem - Q153 - Q153 - 24Q153 - 60-02 60 LANE"
  },
  {
    "@odata.etag": "W/\"325861799\"",
    "nycsr_admininterventiontype@OData.Community.Display.V1.FormattedValue": "Partial Classroom Quarantine",
    "nycsr_admininterventiontype": 882450001,
    "nycsr_caseid": "62b2c9ff-b01f-ec11-b6e6-001dd8305f31",
    "nycsr_interventionenddate@OData.Community.Display.V1.FormattedValue": "10/4/2021",
    "nycsr_interventionenddate": "2021-10-04T04:00:00Z",
    "nycsr_casenumber": "052988",
    "nycsr_interventionstartdate@OData.Community.Display.V1.FormattedValue": "9/28/2021",
    "nycsr_interventionstartdate": "2021-09-28T04:00:00Z",
    "nycsr_building.nycsr_address": "144 KEATING PLACE",
    "nycsr_building.nycsr_latitude@OData.Community.Display.V1.FormattedValue": "40,591,480.000000",
    "nycsr_building.nycsr_latitude": 40591480,
    "nycsr_building.nycsr_buildingid": "dd8521d0-32f4-ea11-b882-24ee9a37d45c",
    "nycsr_building.nycsr_borough@OData.Community.Display.V1.FormattedValue": "Staten Island",
    "nycsr_building.nycsr_borough": 882450004,
    "nycsr_building.nycsr_longitude@OData.Community.Display.V1.FormattedValue": "-74,157,327.000000",
    "nycsr_building.nycsr_longitude": -74157327,
    "nycsr_building.nycsr_geographicaldistrictcode": "31",
    "nycsr_building.nycsr_buildingname": "P.S. 69 - STATEN ISLAND",
    "nycsr_locationsite.nycsr_sitename": "P.S. 069 Daniel D. Tompkins - R069 - R069 - 31R069 - 144 KEATING PLACE"
  },
  {
    "@odata.etag": "W/\"325861804\"",
    "nycsr_admininterventiontype@OData.Community.Display.V1.FormattedValue": "Partial Classroom Quarantine",
    "nycsr_admininterventiontype": 882450001,
    "nycsr_caseid": "81b2c9ff-b01f-ec11-b6e6-001dd8305f31",
    "nycsr_interventionenddate@OData.Community.Display.V1.FormattedValue": "10/4/2021",
    "nycsr_interventionenddate": "2021-10-04T04:00:00Z",
    "nycsr_casenumber": "052989",
    "nycsr_interventionstartdate@OData.Community.Display.V1.FormattedValue": "9/28/2021",
    "nycsr_interventionstartdate": "2021-09-28T04:00:00Z",
    "nycsr_building.nycsr_address": "144 KEATING PLACE",
    "nycsr_building.nycsr_latitude@OData.Community.Display.V1.FormattedValue": "40,591,480.000000",
    "nycsr_building.nycsr_latitude": 40591480,
    "nycsr_building.nycsr_buildingid": "dd8521d0-32f4-ea11-b882-24ee9a37d45c",
    "nycsr_building.nycsr_borough@OData.Community.Display.V1.FormattedValue": "Staten Island",
    "nycsr_building.nycsr_borough": 882450004,
    "nycsr_building.nycsr_longitude@OData.Community.Display.V1.FormattedValue": "-74,157,327.000000",
    "nycsr_building.nycsr_longitude": -74157327,
    "nycsr_building.nycsr_geographicaldistrictcode": "31",
    "nycsr_building.nycsr_buildingname": "P.S. 69 - STATEN ISLAND",
    "nycsr_locationsite.nycsr_sitename": "P.S. 069 Daniel D. Tompkins - R069 - R069 - 31R069 - 144 KEATING PLACE"
  },
  {
    "@odata.etag": "W/\"325861809\"",
    "nycsr_admininterventiontype@OData.Community.Display.V1.FormattedValue": "Partial Classroom Quarantine",
    "nycsr_admininterventiontype": 882450001,
    "nycsr_caseid": "90b2c9ff-b01f-ec11-b6e6-001dd8305f31",
    "nycsr_interventionenddate@OData.Community.Display.V1.FormattedValue": "10/4/2021",
    "nycsr_interventionenddate": "2021-10-04T04:00:00Z",
    "nycsr_casenumber": "052990",
    "nycsr_interventionstartdate@OData.Community.Display.V1.FormattedValue": "9/28/2021",
    "nycsr_interventionstartdate": "2021-09-28T04:00:00Z",
    "nycsr_building.nycsr_address": "144 KEATING PLACE",
    "nycsr_building.nycsr_latitude@OData.Community.Display.V1.FormattedValue": "40,591,480.000000",
    "nycsr_building.nycsr_latitude": 40591480,
    "nycsr_building.nycsr_buildingid": "dd8521d0-32f4-ea11-b882-24ee9a37d45c",
    "nycsr_building.nycsr_borough@OData.Community.Display.V1.FormattedValue": "Staten Island",
    "nycsr_building.nycsr_borough": 882450004,
    "nycsr_building.nycsr_longitude@OData.Community.Display.V1.FormattedValue": "-74,157,327.000000",
    "nycsr_building.nycsr_longitude": -74157327,
    "nycsr_building.nycsr_geographicaldistrictcode": "31",
    "nycsr_building.nycsr_buildingname": "P.S. 69 - STATEN ISLAND",
    "nycsr_locationsite.nycsr_sitename": "P.S. 069 Daniel D. Tompkins - R069 - R069 - 31R069 - 144 KEATING PLACE"
  },
  {
    "@odata.etag": "W/\"327459601\"",
    "nycsr_admininterventiontype@OData.Community.Display.V1.FormattedValue": "Classroom Closed",
    "nycsr_admininterventiontype": 882450000,
    "nycsr_caseid": "72383eb9-bb1f-ec11-b6e6-001dd8305f31",
    "nycsr_interventionenddate@OData.Community.Display.V1.FormattedValue": "10/3/2021",
    "nycsr_interventionenddate": "2021-10-03T04:00:00Z",
    "nycsr_casenumber": "053063",
    "nycsr_interventionstartdate@OData.Community.Display.V1.FormattedValue": "9/28/2021",
    "nycsr_interventionstartdate": "2021-09-28T04:00:00Z",
    "nycsr_building.nycsr_address": "545 WILLOUGHBY AVENUE",
    "nycsr_building.nycsr_latitude@OData.Community.Display.V1.FormattedValue": "40,694,470.000000",
    "nycsr_building.nycsr_latitude": 40694470,
    "nycsr_building.nycsr_buildingid": "e5968d36-30f4-ea11-b882-24ee9a37d45c",
    "nycsr_building.nycsr_borough@OData.Community.Display.V1.FormattedValue": "Brooklyn",
    "nycsr_building.nycsr_borough": 882450002,
    "nycsr_building.nycsr_longitude@OData.Community.Display.V1.FormattedValue": "-73,947,256.000000",
    "nycsr_building.nycsr_longitude": -73947256,
    "nycsr_building.nycsr_geographicaldistrictcode": "14",
    "nycsr_building.nycsr_buildingname": "P.S. 23 - BROOKLYN",
    "nycsr_locationsite.nycsr_sitename": "P.S. 023 Carter G. Woodson - K023 - K023 - 14K023 - 545 WILLOUGHBY AVENUE"
  },
  {
    "@odata.etag": "W/\"328863368\"",
    "nycsr_admininterventiontype@OData.Community.Display.V1.FormattedValue": "Partial Classroom Quarantine",
    "nycsr_admininterventiontype": 882450001,
    "nycsr_caseid": "0b52ca16-c11f-ec11-b6e6-001dd8305f31",
    "nycsr_interventionenddate@OData.Community.Display.V1.FormattedValue": "10/3/2021",
    "nycsr_interventionenddate": "2021-10-03T04:00:00Z",
    "nycsr_casenumber": "053115",
    "nycsr_interventionstartdate@OData.Community.Display.V1.FormattedValue": "9/28/2021",
    "nycsr_interventionstartdate": "2021-09-28T04:00:00Z",
    "nycsr_building.nycsr_address": "925 ASTOR AVENUE",
    "nycsr_building.nycsr_latitude@OData.Community.Display.V1.FormattedValue": "40,860,443.000000",
    "nycsr_building.nycsr_latitude": 40860443,
    "nycsr_building.nycsr_buildingid": "439d7c62-33f4-ea11-b882-24ee9a37d45c",
    "nycsr_building.nycsr_borough@OData.Community.Display.V1.FormattedValue": "Bronx",
    "nycsr_building.nycsr_borough": 882450001,
    "nycsr_building.nycsr_longitude@OData.Community.Display.V1.FormattedValue": "-73,860,729.000000",
    "nycsr_building.nycsr_longitude": -73860729,
    "nycsr_building.nycsr_geographicaldistrictcode": "11",
    "nycsr_building.nycsr_buildingname": "CHRISTOPHER COLUMBUS HS - X",
    "nycsr_locationsite.nycsr_sitename": "Collegiate Institute for Math and Science - X288 - X415 - 11X288 - 925 ASTOR AVENUE"
  },
  {
    "@odata.etag": "W/\"325862026\"",
    "nycsr_admininterventiontype@OData.Community.Display.V1.FormattedValue": "Classroom Closed",
    "nycsr_admininterventiontype": 882450000,
    "nycsr_caseid": "5b1fafcc-c21f-ec11-b6e6-001dd8305f31",
    "nycsr_interventionenddate@OData.Community.Display.V1.FormattedValue": "10/4/2021",
    "nycsr_interventionenddate": "2021-10-04T04:00:00Z",
    "nycsr_casenumber": "053131",
    "nycsr_interventionstartdate@OData.Community.Display.V1.FormattedValue": "9/28/2021",
    "nycsr_interventionstartdate": "2021-09-28T04:00:00Z",
    "nycsr_building.nycsr_address": "19 EAST 103 STREET",
    "nycsr_building.nycsr_latitude@OData.Community.Display.V1.FormattedValue": "40,792,302.000000",
    "nycsr_building.nycsr_latitude": 40792302,
    "nycsr_building.nycsr_buildingid": "42005d7a-31f4-ea11-b882-24ee9a37d45c",
    "nycsr_building.nycsr_borough@OData.Community.Display.V1.FormattedValue": "Manhattan",
    "nycsr_building.nycsr_borough": 882450000,
    "nycsr_building.nycsr_longitude@OData.Community.Display.V1.FormattedValue": "-73,951,425.000000",
    "nycsr_building.nycsr_longitude": -73951425,
    "nycsr_building.nycsr_geographicaldistrictcode": "4",
    "nycsr_building.nycsr_buildingname": "P.S. 171 - MANHATTAN",
    "nycsr_locationsite.nycsr_sitename": "P.S. 171 Patrick Henry - M171 - M171 - 04M171 - 19 EAST 103 STREET"
  },
  {
    "@odata.etag": "W/\"326891702\"",
    "nycsr_admininterventiontype@OData.Community.Display.V1.FormattedValue": "Partial Classroom Quarantine",
    "nycsr_admininterventiontype": 882450001,
    "nycsr_caseid": "5e1de13a-c71f-ec11-b6e6-001dd8305f31",
    "nycsr_interventionenddate@OData.Community.Display.V1.FormattedValue": "10/7/2021",
    "nycsr_interventionenddate": "2021-10-07T04:00:00Z",
    "nycsr_casenumber": "053166",
    "nycsr_interventionstartdate@OData.Community.Display.V1.FormattedValue": "9/28/2021",
    "nycsr_interventionstartdate": "2021-09-28T04:00:00Z",
    "nycsr_building.nycsr_address": "237 7 AVENUE",
    "nycsr_building.nycsr_latitude@OData.Community.Display.V1.FormattedValue": "40,669,255.000000",
    "nycsr_building.nycsr_latitude": 40669255,
    "nycsr_building.nycsr_buildingid": "929c11e8-30f4-ea11-b882-24ee9a37d45c",
    "nycsr_building.nycsr_borough@OData.Community.Display.V1.FormattedValue": "Brooklyn",
    "nycsr_building.nycsr_borough": 882450002,
    "nycsr_building.nycsr_longitude@OData.Community.Display.V1.FormattedValue": "-73,978,580.000000",
    "nycsr_building.nycsr_longitude": -73978580,
    "nycsr_building.nycsr_geographicaldistrictcode": "15",
    "nycsr_building.nycsr_buildingname": "John Jay Educational Campus",
    "nycsr_locationsite.nycsr_sitename": "John Jay School for Law - K462 - K460 - 15K462 - 237 7 AVENUE"
  },
  {
    "@odata.etag": "W/\"327199028\"",
    "nycsr_admininterventiontype@OData.Community.Display.V1.FormattedValue": "Partial Classroom Quarantine",
    "nycsr_admininterventiontype": 882450001,
    "nycsr_caseid": "2f5d84cd-5020-ec11-b6e6-001dd8305f31",
    "nycsr_interventionenddate@OData.Community.Display.V1.FormattedValue": "10/7/2021",
    "nycsr_interventionenddate": "2021-10-07T04:00:00Z",
    "nycsr_casenumber": "053210",
    "nycsr_interventionstartdate@OData.Community.Display.V1.FormattedValue": "9/29/2021",
    "nycsr_interventionstartdate": "2021-09-29T04:00:00Z",
    "nycsr_building.nycsr_address": "150 WEST 105 STREET",
    "nycsr_building.nycsr_latitude@OData.Community.Display.V1.FormattedValue": "40,799,098.000000",
    "nycsr_building.nycsr_latitude": 40799098,
    "nycsr_building.nycsr_buildingid": "4a9f4974-31f4-ea11-b882-24ee9a37d45c",
    "nycsr_building.nycsr_borough@OData.Community.Display.V1.FormattedValue": "Manhattan",
    "nycsr_building.nycsr_borough": 882450000,
    "nycsr_building.nycsr_longitude@OData.Community.Display.V1.FormattedValue": "-73,965,611.000000",
    "nycsr_building.nycsr_longitude": -73965611,
    "nycsr_building.nycsr_geographicaldistrictcode": "3",
    "nycsr_building.nycsr_buildingname": "P.S. 145 - MANHATTAN",
    "nycsr_locationsite.nycsr_sitename": "West Prep Academy - M421 - M145 - 03M421 - 150 WEST 105 STREET"
  },
  {
    "@odata.etag": "W/\"328525974\"",
    "nycsr_admininterventiontype@OData.Community.Display.V1.FormattedValue": "Partial Classroom Quarantine",
    "nycsr_admininterventiontype": 882450001,
    "nycsr_caseid": "34c58823-5420-ec11-b6e6-001dd8305f31",
    "nycsr_interventionenddate@OData.Community.Display.V1.FormattedValue": "10/7/2021",
    "nycsr_interventionenddate": "2021-10-07T04:00:00Z",
    "nycsr_casenumber": "053217",
    "nycsr_interventionstartdate@OData.Community.Display.V1.FormattedValue": "9/29/2021",
    "nycsr_interventionstartdate": "2021-09-29T04:00:00Z",
    "nycsr_building.nycsr_address": "100 LUTEN AVENUE",
    "nycsr_building.nycsr_latitude@OData.Community.Display.V1.FormattedValue": "40,528,152.000000",
    "nycsr_building.nycsr_latitude": 40528152,
    "nycsr_building.nycsr_buildingid": "605b4cd6-32f4-ea11-b882-24ee9a37d45c",
    "nycsr_building.nycsr_borough@OData.Community.Display.V1.FormattedValue": "Staten Island",
    "nycsr_building.nycsr_borough": 882450004,
    "nycsr_building.nycsr_longitude@OData.Community.Display.V1.FormattedValue": "-74,193,431.000000",
    "nycsr_building.nycsr_longitude": -74193431,
    "nycsr_building.nycsr_geographicaldistrictcode": "31",
    "nycsr_building.nycsr_buildingname": "TOTTENVILLE HS - S. I.",
    "nycsr_locationsite.nycsr_sitename": "Tottenville High School - R455 - R455 - 31R455 - 100 LUTEN AVENUE"
  },
  {
    "@odata.etag": "W/\"327683811\"",
    "nycsr_admininterventiontype@OData.Community.Display.V1.FormattedValue": "Partial Classroom Quarantine",
    "nycsr_admininterventiontype": 882450001,
    "nycsr_caseid": "d590814a-5520-ec11-b6e6-001dd8305f31",
    "nycsr_interventionenddate@OData.Community.Display.V1.FormattedValue": "10/3/2021",
    "nycsr_interventionenddate": "2021-10-03T04:00:00Z",
    "nycsr_casenumber": "053221",
    "nycsr_interventionstartdate@OData.Community.Display.V1.FormattedValue": "9/29/2021",
    "nycsr_interventionstartdate": "2021-09-29T04:00:00Z",
    "nycsr_building.nycsr_address": "21 JUMEL PLACE",
    "nycsr_building.nycsr_latitude@OData.Community.Display.V1.FormattedValue": "40,839,139.000000",
    "nycsr_building.nycsr_latitude": 40839139,
    "nycsr_building.nycsr_buildingid": "2ce61462-31f4-ea11-b882-24ee9a37d45c",
    "nycsr_building.nycsr_borough@OData.Community.Display.V1.FormattedValue": "Manhattan",
    "nycsr_building.nycsr_borough": 882450000,
    "nycsr_building.nycsr_longitude@OData.Community.Display.V1.FormattedValue": "-73,935,815.000000",
    "nycsr_building.nycsr_longitude": -73935815,
    "nycsr_building.nycsr_geographicaldistrictcode": "6",
    "nycsr_building.nycsr_buildingname": "I.S. 90 - MANHATTAN",
    "nycsr_locationsite.nycsr_sitename": "M.S. 319 - Maria Teresa - M319 - M090 - 06M319 - 21 JUMEL PLACE"
  },
  {
    "@odata.etag": "W/\"327199103\"",
    "nycsr_admininterventiontype@OData.Community.Display.V1.FormattedValue": "Partial Classroom Quarantine",
    "nycsr_admininterventiontype": 882450001,
    "nycsr_caseid": "6eb7a643-5920-ec11-b6e6-001dd8305f31",
    "nycsr_interventionenddate@OData.Community.Display.V1.FormattedValue": "10/7/2021",
    "nycsr_interventionenddate": "2021-10-07T04:00:00Z",
    "nycsr_casenumber": "053233",
    "nycsr_interventionstartdate@OData.Community.Display.V1.FormattedValue": "9/29/2021",
    "nycsr_interventionstartdate": "2021-09-29T04:00:00Z",
    "nycsr_building.nycsr_address": "220 HENRY STREET",
    "nycsr_building.nycsr_latitude@OData.Community.Display.V1.FormattedValue": "40,713,362.000000",
    "nycsr_building.nycsr_latitude": 40713362,
    "nycsr_building.nycsr_buildingid": "affab455-31f4-ea11-b882-24ee9a37d45c",
    "nycsr_building.nycsr_borough@OData.Community.Display.V1.FormattedValue": "Manhattan",
    "nycsr_building.nycsr_borough": 882450000,
    "nycsr_building.nycsr_longitude@OData.Community.Display.V1.FormattedValue": "-73,986,051.000000",
    "nycsr_building.nycsr_longitude": -73986051,
    "nycsr_building.nycsr_geographicaldistrictcode": "1",
    "nycsr_building.nycsr_buildingname": "J.H.S. 56 - MANHATTAN",
    "nycsr_locationsite.nycsr_sitename": "Manhattan Charter School II - M080 - M056 - 84M080 - 220 HENRY STREET"
  },
  {
    "@odata.etag": "W/\"328091417\"",
    "nycsr_admininterventiontype@OData.Community.Display.V1.FormattedValue": "Classroom Closed",
    "nycsr_admininterventiontype": 882450000,
    "nycsr_caseid": "b82a8059-5d20-ec11-b6e6-001dd8305f31",
    "nycsr_interventionenddate@OData.Community.Display.V1.FormattedValue": "10/7/2021",
    "nycsr_interventionenddate": "2021-10-07T04:00:00Z",
    "nycsr_casenumber": "053244",
    "nycsr_interventionstartdate@OData.Community.Display.V1.FormattedValue": "9/30/2021",
    "nycsr_interventionstartdate": "2021-09-30T04:00:00Z",
    "nycsr_building.nycsr_address": "88-08 164TH STREET",
    "nycsr_building.nycsr_latitude@OData.Community.Display.V1.FormattedValue": "40,708,698.000000",
    "nycsr_building.nycsr_latitude": 40708698,
    "nycsr_building.nycsr_buildingid": "d5454b50-32f4-ea11-b882-24ee9a37d45c",
    "nycsr_building.nycsr_borough@OData.Community.Display.V1.FormattedValue": "Queens",
    "nycsr_building.nycsr_borough": 882450003,
    "nycsr_building.nycsr_longitude@OData.Community.Display.V1.FormattedValue": "-73,797,981.000000",
    "nycsr_building.nycsr_longitude": -73797981,
    "nycsr_building.nycsr_geographicaldistrictcode": "28",
    "nycsr_building.nycsr_buildingname": "P.S./ I.S. 314 - Queens",
    "nycsr_locationsite.nycsr_sitename": "The Queens School for Leadership and Excellence - Q349 - Q314 - 28Q349 - 88-08 164TH STREET"
  },
  {
    "@odata.etag": "W/\"327702960\"",
    "nycsr_admininterventiontype@OData.Community.Display.V1.FormattedValue": "Partial Classroom Quarantine",
    "nycsr_admininterventiontype": 882450001,
    "nycsr_caseid": "f87571f1-5e20-ec11-b6e6-001dd8305f31",
    "nycsr_interventionenddate@OData.Community.Display.V1.FormattedValue": "10/4/2021",
    "nycsr_interventionenddate": "2021-10-04T04:00:00Z",
    "nycsr_casenumber": "053256",
    "nycsr_interventionstartdate@OData.Community.Display.V1.FormattedValue": "9/29/2021",
    "nycsr_interventionstartdate": "2021-09-29T04:00:00Z",
    "nycsr_building.nycsr_address": "75-10 21 Avenue",
    "nycsr_building.nycsr_latitude@OData.Community.Display.V1.FormattedValue": "40,769,798.000000",
    "nycsr_building.nycsr_latitude": 40769798,
    "nycsr_building.nycsr_buildingid": "93dc32dc-31f4-ea11-b882-24ee9a37d45c",
    "nycsr_building.nycsr_borough@OData.Community.Display.V1.FormattedValue": "Queens",
    "nycsr_building.nycsr_borough": 882450003,
    "nycsr_building.nycsr_longitude@OData.Community.Display.V1.FormattedValue": "-73,894,108.000000",
    "nycsr_building.nycsr_longitude": -73894108,
    "nycsr_building.nycsr_geographicaldistrictcode": "30",
    "nycsr_building.nycsr_buildingname": "P.S. 2 - QUEENS",
    "nycsr_locationsite.nycsr_sitename": "P.S. 002 Alfred Zimberg - Q002 - Q002 - 30Q002 - 75-10 21 Avenue"
  },
  {
    "@odata.etag": "W/\"327703491\"",
    "nycsr_admininterventiontype@OData.Community.Display.V1.FormattedValue": "Partial Classroom Quarantine",
    "nycsr_admininterventiontype": 882450001,
    "nycsr_caseid": "b5fed9a5-5f20-ec11-b6e6-001dd8305f31",
    "nycsr_interventionenddate@OData.Community.Display.V1.FormattedValue": "10/4/2021",
    "nycsr_interventionenddate": "2021-10-04T04:00:00Z",
    "nycsr_casenumber": "053265",
    "nycsr_interventionstartdate@OData.Community.Display.V1.FormattedValue": "9/29/2021",
    "nycsr_interventionstartdate": "2021-09-29T04:00:00Z",
    "nycsr_building.nycsr_address": "75-10 21 Avenue",
    "nycsr_building.nycsr_latitude@OData.Community.Display.V1.FormattedValue": "40,769,798.000000",
    "nycsr_building.nycsr_latitude": 40769798,
    "nycsr_building.nycsr_buildingid": "93dc32dc-31f4-ea11-b882-24ee9a37d45c",
    "nycsr_building.nycsr_borough@OData.Community.Display.V1.FormattedValue": "Queens",
    "nycsr_building.nycsr_borough": 882450003,
    "nycsr_building.nycsr_longitude@OData.Community.Display.V1.FormattedValue": "-73,894,108.000000",
    "nycsr_building.nycsr_longitude": -73894108,
    "nycsr_building.nycsr_geographicaldistrictcode": "30",
    "nycsr_building.nycsr_buildingname": "P.S. 2 - QUEENS",
    "nycsr_locationsite.nycsr_sitename": "P.S. 002 Alfred Zimberg - Q002 - Q002 - 30Q002 - 75-10 21 Avenue"
  },
  {
    "@odata.etag": "W/\"327199189\"",
    "nycsr_admininterventiontype@OData.Community.Display.V1.FormattedValue": "Non-Classroom Quarantine",
    "nycsr_admininterventiontype": 882450003,
    "nycsr_caseid": "7d81547a-6120-ec11-b6e6-001dd8305f31",
    "nycsr_interventionenddate@OData.Community.Display.V1.FormattedValue": "10/7/2021",
    "nycsr_interventionenddate": "2021-10-07T04:00:00Z",
    "nycsr_casenumber": "053276",
    "nycsr_interventionstartdate@OData.Community.Display.V1.FormattedValue": "9/29/2021",
    "nycsr_interventionstartdate": "2021-09-29T04:00:00Z",
    "nycsr_building.nycsr_address": "525 WEST  50TH STREET",
    "nycsr_building.nycsr_latitude@OData.Community.Display.V1.FormattedValue": "40,765,474.000000",
    "nycsr_building.nycsr_latitude": 40765474,
    "nycsr_building.nycsr_buildingid": "f137fba4-31f4-ea11-b882-24ee9a37d45c",
    "nycsr_building.nycsr_borough@OData.Community.Display.V1.FormattedValue": "Manhattan",
    "nycsr_building.nycsr_borough": 882450000,
    "nycsr_building.nycsr_longitude@OData.Community.Display.V1.FormattedValue": "-73,992,700.000000",
    "nycsr_building.nycsr_longitude": -73992700,
    "nycsr_building.nycsr_geographicaldistrictcode": "2",
    "nycsr_building.nycsr_buildingname": "PARK WEST HS (ECF) - MANHATTAN",
    "nycsr_locationsite.nycsr_sitename": "Manhattan Bridges High School - M542 - M535 - 02M542 - 525 WEST  50TH STREET"
  },
  {
    "@odata.etag": "W/\"327680552\"",
    "nycsr_admininterventiontype@OData.Community.Display.V1.FormattedValue": "Partial Classroom Quarantine",
    "nycsr_admininterventiontype": 882450001,
    "nycsr_caseid": "80329a06-6320-ec11-b6e6-001dd8305f31",
    "nycsr_interventionenddate@OData.Community.Display.V1.FormattedValue": "10/7/2021",
    "nycsr_interventionenddate": "2021-10-07T04:00:00Z",
    "nycsr_casenumber": "053288",
    "nycsr_interventionstartdate@OData.Community.Display.V1.FormattedValue": "9/29/2021",
    "nycsr_interventionstartdate": "2021-09-29T04:00:00Z",
    "nycsr_building.nycsr_address": "1400 PENNSYLVANIA AVENUE",
    "nycsr_building.nycsr_latitude@OData.Community.Display.V1.FormattedValue": "40,646,640.000000",
    "nycsr_building.nycsr_latitude": 40646640,
    "nycsr_building.nycsr_buildingid": "30a198c3-30f4-ea11-b882-24ee9a37d45c",
    "nycsr_building.nycsr_borough@OData.Community.Display.V1.FormattedValue": "Brooklyn",
    "nycsr_building.nycsr_borough": 882450002,
    "nycsr_building.nycsr_longitude@OData.Community.Display.V1.FormattedValue": "-73,881,997.000000",
    "nycsr_building.nycsr_longitude": -73881997,
    "nycsr_building.nycsr_geographicaldistrictcode": "19",
    "nycsr_building.nycsr_buildingname": "P.S. 346 - BROOKLYN",
    "nycsr_locationsite.nycsr_sitename": "P.S. 346 Abe Stark - K346 - K346 - 19K346 - 1400 PENNSYLVANIA AVENUE"
  },
  {
    "@odata.etag": "W/\"327199204\"",
    "nycsr_admininterventiontype@OData.Community.Display.V1.FormattedValue": "Classroom Closed",
    "nycsr_admininterventiontype": 882450000,
    "nycsr_caseid": "28d5d426-6420-ec11-b6e6-001dd8305f31",
    "nycsr_interventionenddate@OData.Community.Display.V1.FormattedValue": "10/4/2021",
    "nycsr_interventionenddate": "2021-10-04T04:00:00Z",
    "nycsr_casenumber": "053294",
    "nycsr_interventionstartdate@OData.Community.Display.V1.FormattedValue": "9/29/2021",
    "nycsr_interventionstartdate": "2021-09-29T04:00:00Z",
    "nycsr_building.nycsr_address": "2512 Marion Avenue",
    "nycsr_building.nycsr_latitude@OData.Community.Display.V1.FormattedValue": "40,861,316.000000",
    "nycsr_building.nycsr_latitude": 40861316,
    "nycsr_building.nycsr_buildingid": "60ffcc6e-33f4-ea11-b882-24ee9a37d45c",
    "nycsr_building.nycsr_borough@OData.Community.Display.V1.FormattedValue": "Bronx",
    "nycsr_building.nycsr_borough": 882450001,
    "nycsr_building.nycsr_longitude@OData.Community.Display.V1.FormattedValue": "-73,893,236.000000",
    "nycsr_building.nycsr_longitude": -73893236,
    "nycsr_building.nycsr_geographicaldistrictcode": "10",
    "nycsr_building.nycsr_buildingname": "PRE-K CENTER @MARION AVENUE - BRONX",
    "nycsr_locationsite.nycsr_sitename": "Rose Hill Pre-K Center - X535 - X444 - 10X535 - 2512 Marion Avenue"
  },
  {
    "@odata.etag": "W/\"327199245\"",
    "nycsr_admininterventiontype@OData.Community.Display.V1.FormattedValue": "Partial Classroom Quarantine",
    "nycsr_admininterventiontype": 882450001,
    "nycsr_caseid": "1267b213-6920-ec11-b6e6-001dd8305f31",
    "nycsr_interventionenddate@OData.Community.Display.V1.FormattedValue": "10/4/2021",
    "nycsr_interventionenddate": "2021-10-04T04:00:00Z",
    "nycsr_casenumber": "053332",
    "nycsr_interventionstartdate@OData.Community.Display.V1.FormattedValue": "9/29/2021",
    "nycsr_interventionstartdate": "2021-09-29T04:00:00Z",
    "nycsr_building.nycsr_address": "470 JACKSON AVENUE",
    "nycsr_building.nycsr_latitude@OData.Community.Display.V1.FormattedValue": "40,811,051.000000",
    "nycsr_building.nycsr_latitude": 40811051,
    "nycsr_building.nycsr_buildingid": "7701ce37-33f4-ea11-b882-24ee9a37d45c",
    "nycsr_building.nycsr_borough@OData.Community.Display.V1.FormattedValue": "Bronx",
    "nycsr_building.nycsr_borough": 882450001,
    "nycsr_building.nycsr_longitude@OData.Community.Display.V1.FormattedValue": "-73,909,363.000000",
    "nycsr_building.nycsr_longitude": -73909363,
    "nycsr_building.nycsr_geographicaldistrictcode": "7",
    "nycsr_building.nycsr_buildingname": "P.S. 754 (OLD IS155) - BRONX",
    "nycsr_locationsite.nycsr_sitename": "J. M. Rapport School Career Development - X754 - X155 - 75X754 - 470 JACKSON AVENUE"
  },
  {
    "@odata.etag": "W/\"327199255\"",
    "nycsr_admininterventiontype@OData.Community.Display.V1.FormattedValue": "Partial Classroom Quarantine",
    "nycsr_admininterventiontype": 882450001,
    "nycsr_caseid": "592d6e6d-6920-ec11-b6e6-001dd8305f31",
    "nycsr_interventionenddate@OData.Community.Display.V1.FormattedValue": "10/7/2021",
    "nycsr_interventionenddate": "2021-10-07T04:00:00Z",
    "nycsr_casenumber": "053337",
    "nycsr_interventionstartdate@OData.Community.Display.V1.FormattedValue": "9/29/2021",
    "nycsr_interventionstartdate": "2021-09-29T04:00:00Z",
    "nycsr_building.nycsr_address": "34-65 192 STREET",
    "nycsr_building.nycsr_latitude@OData.Community.Display.V1.FormattedValue": "40,764,884.000000",
    "nycsr_building.nycsr_latitude": 40764884,
    "nycsr_building.nycsr_buildingid": "befc24e8-31f4-ea11-b882-24ee9a37d45c",
    "nycsr_building.nycsr_borough@OData.Community.Display.V1.FormattedValue": "Queens",
    "nycsr_building.nycsr_borough": 882450003,
    "nycsr_building.nycsr_longitude@OData.Community.Display.V1.FormattedValue": "-73,789,365.000000",
    "nycsr_building.nycsr_longitude": -73789365,
    "nycsr_building.nycsr_geographicaldistrictcode": "25",
    "nycsr_building.nycsr_buildingname": "J.H.S. 25 - QUEENS",
    "nycsr_locationsite.nycsr_sitename": "I.S. 025 Adrien Block - Q025 - Q025 - 25Q025 - 34-65 192 STREET"
  },
  {
    "@odata.etag": "W/\"328139751\"",
    "nycsr_admininterventiontype@OData.Community.Display.V1.FormattedValue": "Partial Classroom Quarantine",
    "nycsr_admininterventiontype": 882450001,
    "nycsr_caseid": "4a44f514-6c20-ec11-b6e6-001dd8305f31",
    "nycsr_interventionenddate@OData.Community.Display.V1.FormattedValue": "10/7/2021",
    "nycsr_interventionenddate": "2021-10-07T04:00:00Z",
    "nycsr_casenumber": "053355",
    "nycsr_interventionstartdate@OData.Community.Display.V1.FormattedValue": "9/30/2021",
    "nycsr_interventionstartdate": "2021-09-30T04:00:00Z",
    "nycsr_building.nycsr_address": "921 EAST 228TH STREET",
    "nycsr_building.nycsr_latitude@OData.Community.Display.V1.FormattedValue": "40,888,242.000000",
    "nycsr_building.nycsr_latitude": 40888242,
    "nycsr_building.nycsr_buildingid": "6ce03d56-33f4-ea11-b882-24ee9a37d45c",
    "nycsr_building.nycsr_borough@OData.Community.Display.V1.FormattedValue": "Bronx",
    "nycsr_building.nycsr_borough": 882450001,
    "nycsr_building.nycsr_longitude@OData.Community.Display.V1.FormattedValue": "-73,852,714.000000",
    "nycsr_building.nycsr_longitude": -73852714,
    "nycsr_building.nycsr_geographicaldistrictcode": "11",
    "nycsr_building.nycsr_buildingname": "I.S./H.S. 362 - BRONX",
    "nycsr_locationsite.nycsr_sitename": "Academy for Scholarship and Entrepreneurship: A College Board School - X270 - X362 - 11X270 - 921 EAST 228TH STREET"
  },
  {
    "@odata.etag": "W/\"327199290\"",
    "nycsr_admininterventiontype@OData.Community.Display.V1.FormattedValue": "Partial Classroom Quarantine",
    "nycsr_admininterventiontype": 882450001,
    "nycsr_caseid": "ccfcfbb0-6c20-ec11-b6e6-001dd8305f31",
    "nycsr_interventionenddate@OData.Community.Display.V1.FormattedValue": "10/8/2021",
    "nycsr_interventionenddate": "2021-10-08T04:00:00Z",
    "nycsr_casenumber": "053365",
    "nycsr_interventionstartdate@OData.Community.Display.V1.FormattedValue": "9/29/2021",
    "nycsr_interventionstartdate": "2021-09-29T04:00:00Z",
    "nycsr_building.nycsr_address": "1840 BOGART AVENUE",
    "nycsr_building.nycsr_latitude@OData.Community.Display.V1.FormattedValue": "40,849,176.000000",
    "nycsr_building.nycsr_latitude": 40849176,
    "nycsr_building.nycsr_buildingid": "f777bb9f-33f4-ea11-b882-24ee9a37d45c",
    "nycsr_building.nycsr_borough@OData.Community.Display.V1.FormattedValue": "Bronx",
    "nycsr_building.nycsr_borough": 882450001,
    "nycsr_building.nycsr_longitude@OData.Community.Display.V1.FormattedValue": "-73,858,769.000000",
    "nycsr_building.nycsr_longitude": -73858769,
    "nycsr_building.nycsr_geographicaldistrictcode": "11",
    "nycsr_building.nycsr_buildingname": "P.S. 83 ANNEX - BRONX",
    "nycsr_locationsite.nycsr_sitename": "P.S. 083 Donald Hertz - X083 - X981 - 11X083 - 1840 BOGART AVENUE"
  },
  {
    "@odata.etag": "W/\"327199305\"",
    "nycsr_admininterventiontype@OData.Community.Display.V1.FormattedValue": "Partial Classroom Quarantine",
    "nycsr_admininterventiontype": 882450001,
    "nycsr_caseid": "d702f248-6e20-ec11-b6e6-001dd8305f31",
    "nycsr_interventionenddate@OData.Community.Display.V1.FormattedValue": "10/4/2021",
    "nycsr_interventionenddate": "2021-10-04T04:00:00Z",
    "nycsr_casenumber": "053379",
    "nycsr_interventionstartdate@OData.Community.Display.V1.FormattedValue": "9/29/2021",
    "nycsr_interventionstartdate": "2021-09-29T04:00:00Z",
    "nycsr_building.nycsr_address": "21-21 DITMARS BOULEVARD",
    "nycsr_building.nycsr_latitude@OData.Community.Display.V1.FormattedValue": "40,780,507.000000",
    "nycsr_building.nycsr_latitude": 40780507,
    "nycsr_building.nycsr_buildingid": "cb2ff20c-32f4-ea11-b882-24ee9a37d45c",
    "nycsr_building.nycsr_borough@OData.Community.Display.V1.FormattedValue": "Queens",
    "nycsr_building.nycsr_borough": 882450003,
    "nycsr_building.nycsr_longitude@OData.Community.Display.V1.FormattedValue": "-73,915,785.000000",
    "nycsr_building.nycsr_longitude": -73915785,
    "nycsr_building.nycsr_geographicaldistrictcode": "30",
    "nycsr_building.nycsr_buildingname": "P.S. 122 - QUEENS",
    "nycsr_locationsite.nycsr_sitename": "P.S. 122 Mamie Fay - Q122 - Q122 - 30Q122 - 21-21 DITMARS BOULEVARD"
  },
  {
    "@odata.etag": "W/\"327888529\"",
    "nycsr_admininterventiontype@OData.Community.Display.V1.FormattedValue": "Partial Classroom Quarantine",
    "nycsr_admininterventiontype": 882450001,
    "nycsr_caseid": "0cb13f69-6f20-ec11-b6e6-001dd8305f31",
    "nycsr_interventionenddate@OData.Community.Display.V1.FormattedValue": "10/3/2021",
    "nycsr_interventionenddate": "2021-10-03T04:00:00Z",
    "nycsr_casenumber": "053388",
    "nycsr_interventionstartdate@OData.Community.Display.V1.FormattedValue": "9/29/2021",
    "nycsr_interventionstartdate": "2021-09-29T04:00:00Z",
    "nycsr_building.nycsr_address": "1560 PURDY STREET",
    "nycsr_building.nycsr_latitude@OData.Community.Display.V1.FormattedValue": "40,838,759.000000",
    "nycsr_building.nycsr_latitude": 40838759,
    "nycsr_building.nycsr_buildingid": "b9689025-33f4-ea11-b882-24ee9a37d45c",
    "nycsr_building.nycsr_borough@OData.Community.Display.V1.FormattedValue": "Bronx",
    "nycsr_building.nycsr_borough": 882450001,
    "nycsr_building.nycsr_longitude@OData.Community.Display.V1.FormattedValue": "-73,853,203.000000",
    "nycsr_building.nycsr_longitude": -73853203,
    "nycsr_building.nycsr_geographicaldistrictcode": "11",
    "nycsr_building.nycsr_buildingname": "I.S. 127 - BRONX",
    "nycsr_locationsite.nycsr_sitename": "J.H.S. 127 The Castle Hill - X127 - X127 - 11X127 - 1560 PURDY STREET"
  },
  {
    "@odata.etag": "W/\"328143651\"",
    "nycsr_admininterventiontype@OData.Community.Display.V1.FormattedValue": "Partial Classroom Quarantine",
    "nycsr_admininterventiontype": 882450001,
    "nycsr_caseid": "9936d448-7120-ec11-b6e6-001dd8305f31",
    "nycsr_interventionenddate@OData.Community.Display.V1.FormattedValue": "10/4/2021",
    "nycsr_interventionenddate": "2021-10-04T04:00:00Z",
    "nycsr_casenumber": "053398",
    "nycsr_interventionstartdate@OData.Community.Display.V1.FormattedValue": "9/30/2021",
    "nycsr_interventionstartdate": "2021-09-30T04:00:00Z",
    "nycsr_building.nycsr_address": "644 Bloomingdale Road",
    "nycsr_building.nycsr_latitude@OData.Community.Display.V1.FormattedValue": "40,541,563.000000",
    "nycsr_building.nycsr_latitude": 40541563,
    "nycsr_building.nycsr_buildingid": "d48521d0-32f4-ea11-b882-24ee9a37d45c",
    "nycsr_building.nycsr_borough@OData.Community.Display.V1.FormattedValue": "Staten Island",
    "nycsr_building.nycsr_borough": 882450004,
    "nycsr_building.nycsr_longitude@OData.Community.Display.V1.FormattedValue": "-74,217,934.000000",
    "nycsr_building.nycsr_longitude": -74217934,
    "nycsr_building.nycsr_geographicaldistrictcode": "31",
    "nycsr_building.nycsr_buildingname": "K.GRIMM SCL FOR LDRSHP&SUSTAINABLTY@SANDY GR -S.I.",
    "nycsr_locationsite.nycsr_sitename": "The Kathleen Grimm School for Leadership and Sustainability - R062 - R062 - 31R062 - 644 Bloomingdale Road"
  },
  {
    "@odata.etag": "W/\"327199346\"",
    "nycsr_admininterventiontype@OData.Community.Display.V1.FormattedValue": "Non-Classroom Quarantine",
    "nycsr_admininterventiontype": 882450003,
    "nycsr_caseid": "e82f875d-7220-ec11-b6e6-001dd8305f31",
    "nycsr_interventionenddate@OData.Community.Display.V1.FormattedValue": "10/4/2021",
    "nycsr_interventionenddate": "2021-10-04T04:00:00Z",
    "nycsr_casenumber": "053406",
    "nycsr_interventionstartdate@OData.Community.Display.V1.FormattedValue": "9/29/2021",
    "nycsr_interventionstartdate": "2021-09-29T04:00:00Z",
    "nycsr_building.nycsr_address": "1007 EVERGREEN AVENUE",
    "nycsr_building.nycsr_latitude@OData.Community.Display.V1.FormattedValue": "40,823,941.000000",
    "nycsr_building.nycsr_latitude": 40823941,
    "nycsr_building.nycsr_buildingid": "6a01ce37-33f4-ea11-b882-24ee9a37d45c",
    "nycsr_building.nycsr_borough@OData.Community.Display.V1.FormattedValue": "Bronx",
    "nycsr_building.nycsr_borough": 882450001,
    "nycsr_building.nycsr_longitude@OData.Community.Display.V1.FormattedValue": "-73,880,479.000000",
    "nycsr_building.nycsr_longitude": -73880479,
    "nycsr_building.nycsr_geographicaldistrictcode": "8",
    "nycsr_building.nycsr_buildingname": "P.S. 152 - BRONX",
    "nycsr_locationsite.nycsr_sitename": "P.S. 152 Evergreen - X152 - X152 - 08X152 - 1007 EVERGREEN AVENUE"
  },
  {
    "@odata.etag": "W/\"327237566\"",
    "nycsr_admininterventiontype@OData.Community.Display.V1.FormattedValue": "Classroom Closed",
    "nycsr_admininterventiontype": 882450000,
    "nycsr_caseid": "1607c9e4-7420-ec11-b6e6-001dd8305f31",
    "nycsr_interventionenddate@OData.Community.Display.V1.FormattedValue": "10/7/2021",
    "nycsr_interventionenddate": "2021-10-07T04:00:00Z",
    "nycsr_casenumber": "053420",
    "nycsr_interventionstartdate@OData.Community.Display.V1.FormattedValue": "9/29/2021",
    "nycsr_interventionstartdate": "2021-09-29T04:00:00Z",
    "nycsr_building.nycsr_address": "101-24 SEAVIEW AVENUE",
    "nycsr_building.nycsr_latitude@OData.Community.Display.V1.FormattedValue": "40,635,542.000000",
    "nycsr_building.nycsr_latitude": 40635542,
    "nycsr_building.nycsr_buildingid": "cd201dab-30f4-ea11-b882-24ee9a37d45c",
    "nycsr_building.nycsr_borough@OData.Community.Display.V1.FormattedValue": "Brooklyn",
    "nycsr_building.nycsr_borough": 882450002,
    "nycsr_building.nycsr_longitude@OData.Community.Display.V1.FormattedValue": "-73,886,373.000000",
    "nycsr_building.nycsr_longitude": -73886373,
    "nycsr_building.nycsr_geographicaldistrictcode": "18",
    "nycsr_building.nycsr_buildingname": "P.S. 272 - BROOKLYN",
    "nycsr_locationsite.nycsr_sitename": "P.S. 272 Curtis Estabrook - K272 - K272 - 18K272 - 101-24 SEAVIEW AVENUE"
  },
  {
    "@odata.etag": "W/\"327199386\"",
    "nycsr_admininterventiontype@OData.Community.Display.V1.FormattedValue": "Classroom Closed",
    "nycsr_admininterventiontype": 882450000,
    "nycsr_caseid": "4eb8022e-7820-ec11-b6e6-001dd8305f31",
    "nycsr_interventionenddate@OData.Community.Display.V1.FormattedValue": "10/8/2021",
    "nycsr_interventionenddate": "2021-10-08T04:00:00Z",
    "nycsr_casenumber": "053441",
    "nycsr_interventionstartdate@OData.Community.Display.V1.FormattedValue": "9/29/2021",
    "nycsr_interventionstartdate": "2021-09-29T04:00:00Z",
    "nycsr_building.nycsr_address": "140 Harvest Avenue",
    "nycsr_building.nycsr_latitude@OData.Community.Display.V1.FormattedValue": "40,627,336.000000",
    "nycsr_building.nycsr_latitude": 40627336,
    "nycsr_building.nycsr_buildingid": "ee4e3585-4afb-ea11-b883-24ee9a37d459",
    "nycsr_building.nycsr_longitude@OData.Community.Display.V1.FormattedValue": "-74,109,969.000000",
    "nycsr_building.nycsr_longitude": -74109969,
    "nycsr_building.nycsr_geographicaldistrictcode": "31",
    "nycsr_building.nycsr_buildingname": "Hugs & Kiddies Early Learning Center",
    "nycsr_locationsite.nycsr_sitename": "Hugs and Kiddies of Staten Island NY LLC - RAIJ - RAIJ -  - 140 Harvest Avenue"
  },
  {
    "@odata.etag": "W/\"327199406\"",
    "nycsr_admininterventiontype@OData.Community.Display.V1.FormattedValue": "Partial Classroom Quarantine",
    "nycsr_admininterventiontype": 882450001,
    "nycsr_caseid": "2291be01-7a20-ec11-b6e6-001dd8305f31",
    "nycsr_interventionenddate@OData.Community.Display.V1.FormattedValue": "10/1/2021",
    "nycsr_interventionenddate": "2021-10-01T04:00:00Z",
    "nycsr_casenumber": "053450",
    "nycsr_interventionstartdate@OData.Community.Display.V1.FormattedValue": "9/29/2021",
    "nycsr_interventionstartdate": "2021-09-29T04:00:00Z",
    "nycsr_building.nycsr_address": "345 BROOK AVENUE",
    "nycsr_building.nycsr_latitude@OData.Community.Display.V1.FormattedValue": "40,810,314.000000",
    "nycsr_building.nycsr_latitude": 40810314,
    "nycsr_building.nycsr_buildingid": "942aa42b-33f4-ea11-b882-24ee9a37d45c",
    "nycsr_building.nycsr_borough@OData.Community.Display.V1.FormattedValue": "Bronx",
    "nycsr_building.nycsr_borough": 882450001,
    "nycsr_building.nycsr_longitude@OData.Community.Display.V1.FormattedValue": "-73,918,774.000000",
    "nycsr_building.nycsr_longitude": -73918774,
    "nycsr_building.nycsr_geographicaldistrictcode": "7",
    "nycsr_building.nycsr_buildingname": "J.H.S. 222 - BRONX",
    "nycsr_locationsite.nycsr_sitename": "Academy of Applied Mathematics and Technology - X343 - X139 - 07X343 - 345 BROOK AVENUE"
  },
  {
    "@odata.etag": "W/\"328091467\"",
    "nycsr_admininterventiontype@OData.Community.Display.V1.FormattedValue": "Partial Classroom Quarantine",
    "nycsr_admininterventiontype": 882450001,
    "nycsr_caseid": "ee674f04-7b20-ec11-b6e6-001dd8305f31",
    "nycsr_interventionenddate@OData.Community.Display.V1.FormattedValue": "10/8/2021",
    "nycsr_interventionenddate": "2021-10-08T04:00:00Z",
    "nycsr_casenumber": "053457",
    "nycsr_interventionstartdate@OData.Community.Display.V1.FormattedValue": "9/30/2021",
    "nycsr_interventionstartdate": "2021-09-30T04:00:00Z",
    "nycsr_building.nycsr_address": "456 WHITE PLAINS ROAD",
    "nycsr_building.nycsr_latitude@OData.Community.Display.V1.FormattedValue": "40,815,043.000000",
    "nycsr_building.nycsr_latitude": 40815043,
    "nycsr_building.nycsr_buildingid": "2a2ed53d-33f4-ea11-b882-24ee9a37d45c",
    "nycsr_building.nycsr_borough@OData.Community.Display.V1.FormattedValue": "Bronx",
    "nycsr_building.nycsr_borough": 882450001,
    "nycsr_building.nycsr_longitude@OData.Community.Display.V1.FormattedValue": "-73,856,070.000000",
    "nycsr_building.nycsr_longitude": -73856070,
    "nycsr_building.nycsr_geographicaldistrictcode": "8",
    "nycsr_building.nycsr_buildingname": "I.S. 174 - BRONX",
    "nycsr_locationsite.nycsr_sitename": "Archimedes Academy for Math, Science and Technology Applications - X367 - X174 - 08X367 - 456 WHITE PLAINS ROAD"
  },
  {
    "@odata.etag": "W/\"327199416\"",
    "nycsr_admininterventiontype@OData.Community.Display.V1.FormattedValue": "Partial Classroom Quarantine",
    "nycsr_admininterventiontype": 882450001,
    "nycsr_caseid": "2fe8321c-7b20-ec11-b6e6-001dd8305f31",
    "nycsr_interventionenddate@OData.Community.Display.V1.FormattedValue": "10/7/2021",
    "nycsr_interventionenddate": "2021-10-07T04:00:00Z",
    "nycsr_casenumber": "053459",
    "nycsr_interventionstartdate@OData.Community.Display.V1.FormattedValue": "9/29/2021",
    "nycsr_interventionstartdate": "2021-09-29T04:00:00Z",
    "nycsr_building.nycsr_address": "1110 BOSTON ROAD",
    "nycsr_building.nycsr_latitude@OData.Community.Display.V1.FormattedValue": "40,827,455.000000",
    "nycsr_building.nycsr_latitude": 40827455,
    "nycsr_building.nycsr_buildingid": "82e03d56-33f4-ea11-b882-24ee9a37d45c",
    "nycsr_building.nycsr_borough@OData.Community.Display.V1.FormattedValue": "Bronx",
    "nycsr_building.nycsr_borough": 882450001,
    "nycsr_building.nycsr_longitude@OData.Community.Display.V1.FormattedValue": "-73,903,920.000000",
    "nycsr_building.nycsr_longitude": -73903920,
    "nycsr_building.nycsr_geographicaldistrictcode": "9",
    "nycsr_building.nycsr_buildingname": "MORRIS HS - X",
    "nycsr_locationsite.nycsr_sitename": "Morris Academy for Collaborative Studies - X297 - X400 - 09X297 - 1110 BOSTON ROAD"
  },
  {
    "@odata.etag": "W/\"327199487\"",
    "nycsr_admininterventiontype@OData.Community.Display.V1.FormattedValue": "Classroom Closed",
    "nycsr_admininterventiontype": 882450000,
    "nycsr_caseid": "27b04712-8320-ec11-b6e6-001dd8305f31",
    "nycsr_interventionenddate@OData.Community.Display.V1.FormattedValue": "10/3/2021",
    "nycsr_interventionenddate": "2021-10-03T04:00:00Z",
    "nycsr_casenumber": "053501",
    "nycsr_interventionstartdate@OData.Community.Display.V1.FormattedValue": "9/29/2021",
    "nycsr_interventionstartdate": "2021-09-29T04:00:00Z",
    "nycsr_building.nycsr_address": "16 CLARKSON STREET",
    "nycsr_building.nycsr_latitude@OData.Community.Display.V1.FormattedValue": "40,729,052.000000",
    "nycsr_building.nycsr_latitude": 40729052,
    "nycsr_building.nycsr_buildingid": "4d0c1bb1-31f4-ea11-b882-24ee9a37d45c",
    "nycsr_building.nycsr_borough@OData.Community.Display.V1.FormattedValue": "Manhattan",
    "nycsr_building.nycsr_borough": 882450000,
    "nycsr_building.nycsr_longitude@OData.Community.Display.V1.FormattedValue": "-74,006,155.000000",
    "nycsr_building.nycsr_longitude": -74006155,
    "nycsr_building.nycsr_geographicaldistrictcode": "2",
    "nycsr_building.nycsr_buildingname": "CITY-AS-SCHOOL(OLD 95) - MANHATTAN",
    "nycsr_locationsite.nycsr_sitename": "Home Instruction - M501 - M641 - 75M501 - 250 WEST HOUSTON STREET"
  },
  {
    "@odata.etag": "W/\"327199497\"",
    "nycsr_admininterventiontype@OData.Community.Display.V1.FormattedValue": "Classroom Closed",
    "nycsr_admininterventiontype": 882450000,
    "nycsr_caseid": "17f14008-8420-ec11-b6e6-001dd8305f31",
    "nycsr_interventionenddate@OData.Community.Display.V1.FormattedValue": "10/4/2021",
    "nycsr_interventionenddate": "2021-10-04T04:00:00Z",
    "nycsr_casenumber": "053507",
    "nycsr_interventionstartdate@OData.Community.Display.V1.FormattedValue": "9/29/2021",
    "nycsr_interventionstartdate": "2021-09-29T04:00:00Z",
    "nycsr_building.nycsr_address": "1400 BENSON AVENUE",
    "nycsr_building.nycsr_latitude@OData.Community.Display.V1.FormattedValue": "40,610,331.000000",
    "nycsr_building.nycsr_latitude": 40610331,
    "nycsr_building.nycsr_buildingid": "f521d292-30f4-ea11-b882-24ee9a37d45c",
    "nycsr_building.nycsr_borough@OData.Community.Display.V1.FormattedValue": "Brooklyn",
    "nycsr_building.nycsr_borough": 882450002,
    "nycsr_building.nycsr_longitude@OData.Community.Display.V1.FormattedValue": "-74,013,585.000000",
    "nycsr_building.nycsr_longitude": -74013585,
    "nycsr_building.nycsr_geographicaldistrictcode": "20",
    "nycsr_building.nycsr_buildingname": "P.S. 229 - BROOKLYN",
    "nycsr_locationsite.nycsr_sitename": "P.S. 229 Dyker - K229 - K229 - 20K229 - 1400 BENSON AVENUE"
  },
  {
    "@odata.etag": "W/\"328180057\"",
    "nycsr_admininterventiontype@OData.Community.Display.V1.FormattedValue": "No Intervention",
    "nycsr_admininterventiontype": 882450002,
    "nycsr_caseid": "da43d034-8520-ec11-b6e6-001dd8305f31",
    "nycsr_interventionenddate@OData.Community.Display.V1.FormattedValue": "10/1/2021",
    "nycsr_interventionenddate": "2021-10-01T04:00:00Z",
    "nycsr_casenumber": "053516",
    "nycsr_interventionstartdate@OData.Community.Display.V1.FormattedValue": "9/30/2021",
    "nycsr_interventionstartdate": "2021-09-30T04:00:00Z",
    "nycsr_building.nycsr_address": "4140 HUTCHINSON RIVER PKWAY EA",
    "nycsr_building.nycsr_latitude@OData.Community.Display.V1.FormattedValue": "40,864,073.000000",
    "nycsr_building.nycsr_latitude": 40864073,
    "nycsr_building.nycsr_buildingid": "9501ce37-33f4-ea11-b882-24ee9a37d45c",
    "nycsr_building.nycsr_borough@OData.Community.Display.V1.FormattedValue": "Bronx",
    "nycsr_building.nycsr_borough": 882450001,
    "nycsr_building.nycsr_longitude@OData.Community.Display.V1.FormattedValue": "-73,823,816.000000",
    "nycsr_building.nycsr_longitude": -73823816,
    "nycsr_building.nycsr_geographicaldistrictcode": "11",
    "nycsr_building.nycsr_buildingname": "P.S. 160 - BRONX",
    "nycsr_locationsite.nycsr_sitename": "P.S. 160 Walt Disney - X160 - X160 - 11X160 - 4140 HUTCHINSON RIVER PKWAY EA"
  },
  {
    "@odata.etag": "W/\"328826310\"",
    "nycsr_admininterventiontype@OData.Community.Display.V1.FormattedValue": "Partial Classroom Quarantine",
    "nycsr_admininterventiontype": 882450001,
    "nycsr_caseid": "d86ae890-8620-ec11-b6e6-001dd8305f31",
    "nycsr_interventionenddate@OData.Community.Display.V1.FormattedValue": "10/7/2021",
    "nycsr_interventionenddate": "2021-10-07T04:00:00Z",
    "nycsr_casenumber": "053528",
    "nycsr_interventionstartdate@OData.Community.Display.V1.FormattedValue": "9/29/2021",
    "nycsr_interventionstartdate": "2021-09-29T04:00:00Z",
    "nycsr_building.nycsr_address": "1-35 57 Avenue",
    "nycsr_building.nycsr_latitude@OData.Community.Display.V1.FormattedValue": "40,738,864.000000",
    "nycsr_building.nycsr_latitude": 40738864,
    "nycsr_building.nycsr_buildingid": "8ca87f90-5a04-ec11-b8b4-24ee9a37d45c",
    "nycsr_building.nycsr_longitude@OData.Community.Display.V1.FormattedValue": "-73,960,836.000000",
    "nycsr_building.nycsr_longitude": -73960836,
    "nycsr_building.nycsr_geographicaldistrictcode": "30",
    "nycsr_building.nycsr_buildingname": "Hunters Point",
    "nycsr_locationsite.nycsr_sitename": "Hunters Point Elementary School - Q384 - Q375 - 30Q384 - 1-35 57 Avenue"
  },
  {
    "@odata.etag": "W/\"327199552\"",
    "nycsr_admininterventiontype@OData.Community.Display.V1.FormattedValue": "Partial Classroom Quarantine",
    "nycsr_admininterventiontype": 882450001,
    "nycsr_caseid": "80ad6a9a-8820-ec11-b6e6-001dd8305f31",
    "nycsr_interventionenddate@OData.Community.Display.V1.FormattedValue": "10/8/2021",
    "nycsr_interventionenddate": "2021-10-08T04:00:00Z",
    "nycsr_casenumber": "053543",
    "nycsr_interventionstartdate@OData.Community.Display.V1.FormattedValue": "9/29/2021",
    "nycsr_interventionstartdate": "2021-09-29T04:00:00Z",
    "nycsr_building.nycsr_address": "713 CATON AVENUE",
    "nycsr_building.nycsr_latitude@OData.Community.Display.V1.FormattedValue": "40,647,598.000000",
    "nycsr_building.nycsr_latitude": 40647598,
    "nycsr_building.nycsr_buildingid": "4488e6db-30f4-ea11-b882-24ee9a37d45c",
    "nycsr_building.nycsr_borough@OData.Community.Display.V1.FormattedValue": "Brooklyn",
    "nycsr_building.nycsr_borough": 882450002,
    "nycsr_building.nycsr_longitude@OData.Community.Display.V1.FormattedValue": "-73,973,363.000000",
    "nycsr_building.nycsr_longitude": -73973363,
    "nycsr_building.nycsr_geographicaldistrictcode": "15",
    "nycsr_building.nycsr_buildingname": "P.S./I.S. 437 - BROOKLYN",
    "nycsr_locationsite.nycsr_sitename": "P.S. 130 The Parkside - K130 - K437 - 15K130 - 713 CATON AVENUE"
  },
  {
    "@odata.etag": "W/\"327199577\"",
    "nycsr_admininterventiontype@OData.Community.Display.V1.FormattedValue": "Classroom Closed",
    "nycsr_admininterventiontype": 882450000,
    "nycsr_caseid": "dc52daef-8920-ec11-b6e6-001dd8305f31",
    "nycsr_interventionenddate@OData.Community.Display.V1.FormattedValue": "10/7/2021",
    "nycsr_interventionenddate": "2021-10-07T04:00:00Z",
    "nycsr_casenumber": "053554",
    "nycsr_interventionstartdate@OData.Community.Display.V1.FormattedValue": "9/29/2021",
    "nycsr_interventionstartdate": "2021-09-29T04:00:00Z",
    "nycsr_building.nycsr_address": "250 Utica Avenue",
    "nycsr_building.nycsr_latitude@OData.Community.Display.V1.FormattedValue": "40,670,110.000000",
    "nycsr_building.nycsr_latitude": 40670110,
    "nycsr_building.nycsr_buildingid": "39217b48-4afb-ea11-b883-24ee9a37d459",
    "nycsr_building.nycsr_longitude@OData.Community.Display.V1.FormattedValue": "-73,931,012.000000",
    "nycsr_building.nycsr_longitude": -73931012,
    "nycsr_building.nycsr_geographicaldistrictcode": "17",
    "nycsr_building.nycsr_buildingname": "BKA of NY LLC",
    "nycsr_locationsite.nycsr_sitename": "BKA of NY LLC - KCME - KCME -  - 250 Utica Avenue"
  },
  {
    "@odata.etag": "W/\"327199587\"",
    "nycsr_admininterventiontype@OData.Community.Display.V1.FormattedValue": "Partial Classroom Quarantine",
    "nycsr_admininterventiontype": 882450001,
    "nycsr_caseid": "284977f7-8a20-ec11-b6e6-001dd8305f31",
    "nycsr_interventionenddate@OData.Community.Display.V1.FormattedValue": "10/3/2021",
    "nycsr_interventionenddate": "2021-10-03T04:00:00Z",
    "nycsr_casenumber": "053559",
    "nycsr_interventionstartdate@OData.Community.Display.V1.FormattedValue": "9/29/2021",
    "nycsr_interventionstartdate": "2021-09-29T04:00:00Z",
    "nycsr_building.nycsr_address": "3000 EAST TREMONT AVENUE",
    "nycsr_building.nycsr_latitude@OData.Community.Display.V1.FormattedValue": "40,839,775.000000",
    "nycsr_building.nycsr_latitude": 40839775,
    "nycsr_building.nycsr_buildingid": "b556635c-33f4-ea11-b882-24ee9a37d45c",
    "nycsr_building.nycsr_borough@OData.Community.Display.V1.FormattedValue": "Bronx",
    "nycsr_building.nycsr_borough": 882450001,
    "nycsr_building.nycsr_longitude@OData.Community.Display.V1.FormattedValue": "-73,839,583.000000",
    "nycsr_building.nycsr_longitude": -73839583,
    "nycsr_building.nycsr_geographicaldistrictcode": "11",
    "nycsr_building.nycsr_buildingname": "HERBERT H. LEHMAN HS - X",
    "nycsr_locationsite.nycsr_sitename": "Schuylerville Preparatory High School - X348 - X405 - 08X348 - 3000 EAST TREMONT AVENUE"
  },
  {
    "@odata.etag": "W/\"327682719\"",
    "nycsr_admininterventiontype@OData.Community.Display.V1.FormattedValue": "Partial Classroom Quarantine",
    "nycsr_admininterventiontype": 882450001,
    "nycsr_caseid": "77e71ebf-8c20-ec11-b6e6-001dd8305f31",
    "nycsr_interventionenddate@OData.Community.Display.V1.FormattedValue": "10/8/2021",
    "nycsr_interventionenddate": "2021-10-08T04:00:00Z",
    "nycsr_casenumber": "053565",
    "nycsr_interventionstartdate@OData.Community.Display.V1.FormattedValue": "9/29/2021",
    "nycsr_interventionstartdate": "2021-09-29T04:00:00Z",
    "nycsr_building.nycsr_address": "165 BROWN PLACE",
    "nycsr_building.nycsr_latitude@OData.Community.Display.V1.FormattedValue": "40,806,452.000000",
    "nycsr_building.nycsr_latitude": 40806452,
    "nycsr_building.nycsr_buildingid": "1803cefa-32f4-ea11-b882-24ee9a37d45c",
    "nycsr_building.nycsr_borough@OData.Community.Display.V1.FormattedValue": "Bronx",
    "nycsr_building.nycsr_borough": 882450001,
    "nycsr_building.nycsr_longitude@OData.Community.Display.V1.FormattedValue": "-73,921,593.000000",
    "nycsr_building.nycsr_longitude": -73921593,
    "nycsr_building.nycsr_geographicaldistrictcode": "7",
    "nycsr_building.nycsr_buildingname": "P.S. 43 - BRONX",
    "nycsr_locationsite.nycsr_sitename": "P.S. 043 Jonas Bronck - X043 - X043 - 07X043 - 165 BROWN PLACE"
  },
  {
    "@odata.etag": "W/\"327199607\"",
    "nycsr_admininterventiontype@OData.Community.Display.V1.FormattedValue": "Partial Classroom Quarantine",
    "nycsr_admininterventiontype": 882450001,
    "nycsr_caseid": "9cad0caf-8d20-ec11-b6e6-001dd8305f31",
    "nycsr_interventionenddate@OData.Community.Display.V1.FormattedValue": "10/5/2021",
    "nycsr_interventionenddate": "2021-10-05T04:00:00Z",
    "nycsr_casenumber": "053570",
    "nycsr_interventionstartdate@OData.Community.Display.V1.FormattedValue": "9/29/2021",
    "nycsr_interventionstartdate": "2021-09-29T04:00:00Z",
    "nycsr_building.nycsr_address": "14-30 BROADWAY",
    "nycsr_building.nycsr_latitude@OData.Community.Display.V1.FormattedValue": "40,765,881.000000",
    "nycsr_building.nycsr_latitude": 40765881,
    "nycsr_building.nycsr_buildingid": "81476368-32f4-ea11-b882-24ee9a37d45c",
    "nycsr_building.nycsr_borough@OData.Community.Display.V1.FormattedValue": "Queens",
    "nycsr_building.nycsr_borough": 882450003,
    "nycsr_building.nycsr_longitude@OData.Community.Display.V1.FormattedValue": "-73,933,907.000000",
    "nycsr_building.nycsr_longitude": -73933907,
    "nycsr_building.nycsr_geographicaldistrictcode": "30",
    "nycsr_building.nycsr_buildingname": "LONG ISLAND CITY HS(NEW)-Q",
    "nycsr_locationsite.nycsr_sitename": "Long Island City High School - Q450 - Q452 - 30Q450 - 14-30 BROADWAY"
  },
  {
    "@odata.etag": "W/\"328144571\"",
    "nycsr_admininterventiontype@OData.Community.Display.V1.FormattedValue": "Classroom Closed",
    "nycsr_admininterventiontype": 882450000,
    "nycsr_caseid": "3907463d-9020-ec11-b6e6-001dd8305f31",
    "nycsr_interventionenddate@OData.Community.Display.V1.FormattedValue": "10/8/2021",
    "nycsr_interventionenddate": "2021-10-08T04:00:00Z",
    "nycsr_casenumber": "053585",
    "nycsr_interventionstartdate@OData.Community.Display.V1.FormattedValue": "9/29/2021",
    "nycsr_interventionstartdate": "2021-09-29T04:00:00Z",
    "nycsr_building.nycsr_address": "984 FAILE STREET",
    "nycsr_building.nycsr_latitude@OData.Community.Display.V1.FormattedValue": "40,822,314.000000",
    "nycsr_building.nycsr_latitude": 40822314,
    "nycsr_building.nycsr_buildingid": "1f0b210d-33f4-ea11-b882-24ee9a37d45c",
    "nycsr_building.nycsr_borough@OData.Community.Display.V1.FormattedValue": "Bronx",
    "nycsr_building.nycsr_borough": 882450001,
    "nycsr_building.nycsr_longitude@OData.Community.Display.V1.FormattedValue": "-73,888,948.000000",
    "nycsr_building.nycsr_longitude": -73888948,
    "nycsr_building.nycsr_geographicaldistrictcode": "8",
    "nycsr_building.nycsr_buildingname": "P.S. 75 - BRONX",
    "nycsr_locationsite.nycsr_sitename": "P.S. 75 School of Research and Discovery - X075 - X075 - 08X075 - 984 FAILE STREET"
  },
  {
    "@odata.etag": "W/\"328564234\"",
    "nycsr_admininterventiontype@OData.Community.Display.V1.FormattedValue": "Classroom Closed",
    "nycsr_admininterventiontype": 882450000,
    "nycsr_caseid": "6baca28b-9420-ec11-b6e6-001dd8305f31",
    "nycsr_interventionenddate@OData.Community.Display.V1.FormattedValue": "10/7/2021",
    "nycsr_interventionenddate": "2021-10-07T04:00:00Z",
    "nycsr_casenumber": "053601",
    "nycsr_interventionstartdate@OData.Community.Display.V1.FormattedValue": "10/1/2021",
    "nycsr_interventionstartdate": "2021-10-01T04:00:00Z",
    "nycsr_building.nycsr_address": "3415 OLINVILLE AVENUE",
    "nycsr_building.nycsr_latitude@OData.Community.Display.V1.FormattedValue": "40,875,789.000000",
    "nycsr_building.nycsr_latitude": 40875789,
    "nycsr_building.nycsr_buildingid": "770a7997-4afb-ea11-b883-24ee9a37d459",
    "nycsr_building.nycsr_longitude@OData.Community.Display.V1.FormattedValue": "-73,868,439.000000",
    "nycsr_building.nycsr_longitude": -73868439,
    "nycsr_building.nycsr_geographicaldistrictcode": "11",
    "nycsr_building.nycsr_buildingname": "MAGGIE ALSTON Day Care, Inc.",
    "nycsr_locationsite.nycsr_sitename": "Mind-Builders Creative Arts Center - XASO - XAGU -  - 3415 OLINVILLE AVENUE"
  },
  {
    "@odata.etag": "W/\"328091533\"",
    "nycsr_admininterventiontype@OData.Community.Display.V1.FormattedValue": "Partial Classroom Quarantine",
    "nycsr_admininterventiontype": 882450001,
    "nycsr_caseid": "2923157a-1621-ec11-b6e6-001dd8305f31",
    "nycsr_interventionenddate@OData.Community.Display.V1.FormattedValue": "10/7/2021",
    "nycsr_interventionenddate": "2021-10-07T04:00:00Z",
    "nycsr_casenumber": "053614",
    "nycsr_interventionstartdate@OData.Community.Display.V1.FormattedValue": "9/30/2021",
    "nycsr_interventionstartdate": "2021-09-30T04:00:00Z",
    "nycsr_building.nycsr_address": "419 East  66 Street",
    "nycsr_building.nycsr_latitude@OData.Community.Display.V1.FormattedValue": "40,763,804.000000",
    "nycsr_building.nycsr_latitude": 40763804,
    "nycsr_building.nycsr_buildingid": "53507380-31f4-ea11-b882-24ee9a37d45c",
    "nycsr_building.nycsr_borough@OData.Community.Display.V1.FormattedValue": "Manhattan",
    "nycsr_building.nycsr_borough": 882450000,
    "nycsr_building.nycsr_longitude@OData.Community.Display.V1.FormattedValue": "-73,957,731.000000",
    "nycsr_building.nycsr_longitude": -73957731,
    "nycsr_building.nycsr_geographicaldistrictcode": "2",
    "nycsr_building.nycsr_buildingname": "P.S. 183 - MANHATTAN",
    "nycsr_locationsite.nycsr_sitename": "P.S. 183 Robert L. Stevenson - M183 - M183 - 02M183 - 419 East  66 Street"
  },
  {
    "@odata.etag": "W/\"328091578\"",
    "nycsr_admininterventiontype@OData.Community.Display.V1.FormattedValue": "Partial Classroom Quarantine",
    "nycsr_admininterventiontype": 882450001,
    "nycsr_caseid": "c1b87bbb-1921-ec11-b6e6-001dd8305f31",
    "nycsr_interventionenddate@OData.Community.Display.V1.FormattedValue": "10/8/2021",
    "nycsr_interventionenddate": "2021-10-08T04:00:00Z",
    "nycsr_casenumber": "053626",
    "nycsr_interventionstartdate@OData.Community.Display.V1.FormattedValue": "9/30/2021",
    "nycsr_interventionstartdate": "2021-09-30T04:00:00Z",
    "nycsr_building.nycsr_address": "120-45 235 Street",
    "nycsr_building.nycsr_latitude@OData.Community.Display.V1.FormattedValue": "40,684,987.000000",
    "nycsr_building.nycsr_latitude": 40684987,
    "nycsr_building.nycsr_buildingid": "990e6e25-32f4-ea11-b882-24ee9a37d45c",
    "nycsr_building.nycsr_borough@OData.Community.Display.V1.FormattedValue": "Queens",
    "nycsr_building.nycsr_borough": 882450003,
    "nycsr_building.nycsr_longitude@OData.Community.Display.V1.FormattedValue": "-73,729,226.000000",
    "nycsr_building.nycsr_longitude": -73729226,
    "nycsr_building.nycsr_geographicaldistrictcode": "29",
    "nycsr_building.nycsr_buildingname": "P.S. 176 - QUEENS",
    "nycsr_locationsite.nycsr_sitename": "P.S. 176 Cambria Heights - Q176 - Q176 - 29Q176 - 120-45 235 Street"
  },
  {
    "@odata.etag": "W/\"328091649\"",
    "nycsr_admininterventiontype@OData.Community.Display.V1.FormattedValue": "Classroom Closed",
    "nycsr_admininterventiontype": 882450000,
    "nycsr_caseid": "3cf6a7d7-1c21-ec11-b6e6-001dd8305f31",
    "nycsr_interventionenddate@OData.Community.Display.V1.FormattedValue": "10/4/2021",
    "nycsr_interventionenddate": "2021-10-04T04:00:00Z",
    "nycsr_casenumber": "053644",
    "nycsr_interventionstartdate@OData.Community.Display.V1.FormattedValue": "9/30/2021",
    "nycsr_interventionstartdate": "2021-09-30T04:00:00Z",
    "nycsr_building.nycsr_address": "2950 WEST  25 STREET",
    "nycsr_building.nycsr_latitude@OData.Community.Display.V1.FormattedValue": "40,574,029.000000",
    "nycsr_building.nycsr_latitude": 40574029,
    "nycsr_building.nycsr_buildingid": "79283fb1-30f4-ea11-b882-24ee9a37d45c",
    "nycsr_building.nycsr_borough@OData.Community.Display.V1.FormattedValue": "Brooklyn",
    "nycsr_building.nycsr_borough": 882450002,
    "nycsr_building.nycsr_longitude@OData.Community.Display.V1.FormattedValue": "-73,992,393.000000",
    "nycsr_building.nycsr_longitude": -73992393,
    "nycsr_building.nycsr_geographicaldistrictcode": "21",
    "nycsr_building.nycsr_buildingname": "P.S. 288 - BROOKLYN",
    "nycsr_locationsite.nycsr_sitename": "P.S. 288 The Shirley Tanyhill - K288 - K288 - 21K288 - 2950 WEST  25 STREET"
  },
  {
    "@odata.etag": "W/\"328091654\"",
    "nycsr_admininterventiontype@OData.Community.Display.V1.FormattedValue": "Partial Classroom Quarantine",
    "nycsr_admininterventiontype": 882450001,
    "nycsr_caseid": "9847e543-1d21-ec11-b6e6-001dd8305f31",
    "nycsr_interventionenddate@OData.Community.Display.V1.FormattedValue": "10/8/2021",
    "nycsr_interventionenddate": "2021-10-08T04:00:00Z",
    "nycsr_casenumber": "053645",
    "nycsr_interventionstartdate@OData.Community.Display.V1.FormattedValue": "9/30/2021",
    "nycsr_interventionstartdate": "2021-09-30T04:00:00Z",
    "nycsr_building.nycsr_address": "335 EAST 152 STREET",
    "nycsr_building.nycsr_latitude@OData.Community.Display.V1.FormattedValue": "40,819,331.000000",
    "nycsr_building.nycsr_latitude": 40819331,
    "nycsr_building.nycsr_buildingid": "ff9dbaee-32f4-ea11-b882-24ee9a37d45c",
    "nycsr_building.nycsr_borough@OData.Community.Display.V1.FormattedValue": "Bronx",
    "nycsr_building.nycsr_borough": 882450001,
    "nycsr_building.nycsr_longitude@OData.Community.Display.V1.FormattedValue": "-73,919,634.000000",
    "nycsr_building.nycsr_longitude": -73919634,
    "nycsr_building.nycsr_geographicaldistrictcode": "7",
    "nycsr_building.nycsr_buildingname": "P.S. 1 - BRONX",
    "nycsr_locationsite.nycsr_sitename": "P.S. 001 Courtlandt School - X001 - X001 - 07X001 - 335 EAST 152 STREET"
  },
  {
    "@odata.etag": "W/\"328091684\"",
    "nycsr_admininterventiontype@OData.Community.Display.V1.FormattedValue": "Partial Classroom Quarantine",
    "nycsr_admininterventiontype": 882450001,
    "nycsr_caseid": "6ae20509-2021-ec11-b6e6-001dd8305f31",
    "nycsr_interventionenddate@OData.Community.Display.V1.FormattedValue": "10/4/2021",
    "nycsr_interventionenddate": "2021-10-04T04:00:00Z",
    "nycsr_casenumber": "053657",
    "nycsr_interventionstartdate@OData.Community.Display.V1.FormattedValue": "9/30/2021",
    "nycsr_interventionstartdate": "2021-09-30T04:00:00Z",
    "nycsr_building.nycsr_address": "790 EAST NEW YORK AVENUE",
    "nycsr_building.nycsr_latitude@OData.Community.Display.V1.FormattedValue": "40,662,092.000000",
    "nycsr_building.nycsr_latitude": 40662092,
    "nycsr_building.nycsr_buildingid": "2ae2abc9-30f4-ea11-b882-24ee9a37d45c",
    "nycsr_building.nycsr_borough@OData.Community.Display.V1.FormattedValue": "Brooklyn",
    "nycsr_building.nycsr_borough": 882450002,
    "nycsr_building.nycsr_longitude@OData.Community.Display.V1.FormattedValue": "-73,936,313.000000",
    "nycsr_building.nycsr_longitude": -73936313,
    "nycsr_building.nycsr_geographicaldistrictcode": "17",
    "nycsr_building.nycsr_buildingname": "I.S. 391 - BROOKLYN",
    "nycsr_locationsite.nycsr_sitename": "Achievement First Crown Heights Charter School - K356 - K391 - 84K356 - 790 EAST NEW YORK AVENUE"
  },
  {
    "@odata.etag": "W/\"328682492\"",
    "nycsr_admininterventiontype@OData.Community.Display.V1.FormattedValue": "Classroom Closed",
    "nycsr_admininterventiontype": 882450000,
    "nycsr_caseid": "018700fb-2221-ec11-b6e6-001dd8305f31",
    "nycsr_interventionenddate@OData.Community.Display.V1.FormattedValue": "10/9/2021",
    "nycsr_interventionenddate": "2021-10-09T04:00:00Z",
    "nycsr_casenumber": "053667",
    "nycsr_interventionstartdate@OData.Community.Display.V1.FormattedValue": "9/30/2021",
    "nycsr_interventionstartdate": "2021-09-30T04:00:00Z",
    "nycsr_building.nycsr_address": "54-25 SKILLMAN AVENUE",
    "nycsr_building.nycsr_latitude@OData.Community.Display.V1.FormattedValue": "40,746,127.000000",
    "nycsr_building.nycsr_latitude": 40746127,
    "nycsr_building.nycsr_buildingid": "fff22ce2-31f4-ea11-b882-24ee9a37d45c",
    "nycsr_building.nycsr_borough@OData.Community.Display.V1.FormattedValue": "Queens",
    "nycsr_building.nycsr_borough": 882450003,
    "nycsr_building.nycsr_longitude@OData.Community.Display.V1.FormattedValue": "-73,909,032.000000",
    "nycsr_building.nycsr_longitude": -73909032,
    "nycsr_building.nycsr_geographicaldistrictcode": "30",
    "nycsr_building.nycsr_buildingname": "P.S. 11 - QUEENS",
    "nycsr_locationsite.nycsr_sitename": "P.S. 011 Kathryn Phelan - Q011 - Q011 - 30Q011 - 54-25 SKILLMAN AVENUE"
  },
  {
    "@odata.etag": "W/\"328091720\"",
    "nycsr_admininterventiontype@OData.Community.Display.V1.FormattedValue": "Partial Classroom Quarantine",
    "nycsr_admininterventiontype": 882450001,
    "nycsr_caseid": "6d27542b-2321-ec11-b6e6-001dd8305f31",
    "nycsr_interventionenddate@OData.Community.Display.V1.FormattedValue": "10/4/2021",
    "nycsr_interventionenddate": "2021-10-04T04:00:00Z",
    "nycsr_casenumber": "053669",
    "nycsr_interventionstartdate@OData.Community.Display.V1.FormattedValue": "9/30/2021",
    "nycsr_interventionstartdate": "2021-09-30T04:00:00Z",
    "nycsr_building.nycsr_address": "64-35 102 STREET",
    "nycsr_building.nycsr_latitude@OData.Community.Display.V1.FormattedValue": "40,731,016.000000",
    "nycsr_building.nycsr_latitude": 40731016,
    "nycsr_building.nycsr_buildingid": "960e6e25-32f4-ea11-b882-24ee9a37d45c",
    "nycsr_building.nycsr_borough@OData.Community.Display.V1.FormattedValue": "Queens",
    "nycsr_building.nycsr_borough": 882450003,
    "nycsr_building.nycsr_longitude@OData.Community.Display.V1.FormattedValue": "-73,852,210.000000",
    "nycsr_building.nycsr_longitude": -73852210,
    "nycsr_building.nycsr_geographicaldistrictcode": "28",
    "nycsr_building.nycsr_buildingname": "P.S. 175 - QUEENS",
    "nycsr_locationsite.nycsr_sitename": "P.S. 175 The Lynn Gross Discovery School - Q175 - Q175 - 28Q175 - 64-35 102 STREET"
  },
  {
    "@odata.etag": "W/\"328745015\"",
    "nycsr_admininterventiontype@OData.Community.Display.V1.FormattedValue": "No Intervention",
    "nycsr_admininterventiontype": 882450002,
    "nycsr_caseid": "12825f31-2321-ec11-b6e6-001dd8305f31",
    "nycsr_interventionenddate@OData.Community.Display.V1.FormattedValue": "10/1/2021",
    "nycsr_interventionenddate": "2021-10-01T04:00:00Z",
    "nycsr_casenumber": "053670",
    "nycsr_interventionstartdate@OData.Community.Display.V1.FormattedValue": "9/30/2021",
    "nycsr_interventionstartdate": "2021-09-30T04:00:00Z",
    "nycsr_building.nycsr_address": "64-35 102 STREET",
    "nycsr_building.nycsr_latitude@OData.Community.Display.V1.FormattedValue": "40,731,016.000000",
    "nycsr_building.nycsr_latitude": 40731016,
    "nycsr_building.nycsr_buildingid": "960e6e25-32f4-ea11-b882-24ee9a37d45c",
    "nycsr_building.nycsr_borough@OData.Community.Display.V1.FormattedValue": "Queens",
    "nycsr_building.nycsr_borough": 882450003,
    "nycsr_building.nycsr_longitude@OData.Community.Display.V1.FormattedValue": "-73,852,210.000000",
    "nycsr_building.nycsr_longitude": -73852210,
    "nycsr_building.nycsr_geographicaldistrictcode": "28",
    "nycsr_building.nycsr_buildingname": "P.S. 175 - QUEENS",
    "nycsr_locationsite.nycsr_sitename": "P.S. 175 The Lynn Gross Discovery School - Q175 - Q175 - 28Q175 - 64-35 102 STREET"
  },
  {
    "@odata.etag": "W/\"328233042\"",
    "nycsr_admininterventiontype@OData.Community.Display.V1.FormattedValue": "Partial Classroom Quarantine",
    "nycsr_admininterventiontype": 882450001,
    "nycsr_caseid": "e2a0998b-2321-ec11-b6e6-001dd8305f31",
    "nycsr_interventionenddate@OData.Community.Display.V1.FormattedValue": "10/7/2021",
    "nycsr_interventionenddate": "2021-10-07T04:00:00Z",
    "nycsr_casenumber": "053672",
    "nycsr_interventionstartdate@OData.Community.Display.V1.FormattedValue": "9/30/2021",
    "nycsr_interventionstartdate": "2021-09-30T04:00:00Z",
    "nycsr_building.nycsr_address": "21-21 DITMARS BOULEVARD",
    "nycsr_building.nycsr_latitude@OData.Community.Display.V1.FormattedValue": "40,780,507.000000",
    "nycsr_building.nycsr_latitude": 40780507,
    "nycsr_building.nycsr_buildingid": "cb2ff20c-32f4-ea11-b882-24ee9a37d45c",
    "nycsr_building.nycsr_borough@OData.Community.Display.V1.FormattedValue": "Queens",
    "nycsr_building.nycsr_borough": 882450003,
    "nycsr_building.nycsr_longitude@OData.Community.Display.V1.FormattedValue": "-73,915,785.000000",
    "nycsr_building.nycsr_longitude": -73915785,
    "nycsr_building.nycsr_geographicaldistrictcode": "30",
    "nycsr_building.nycsr_buildingname": "P.S. 122 - QUEENS",
    "nycsr_locationsite.nycsr_sitename": "P.S. 122 Mamie Fay - Q122 - Q122 - 30Q122 - 21-21 DITMARS BOULEVARD"
  },
  {
    "@odata.etag": "W/\"328091800\"",
    "nycsr_admininterventiontype@OData.Community.Display.V1.FormattedValue": "Partial Classroom Quarantine",
    "nycsr_admininterventiontype": 882450001,
    "nycsr_caseid": "973a77af-2721-ec11-b6e6-001dd8305f31",
    "nycsr_interventionenddate@OData.Community.Display.V1.FormattedValue": "10/1/2021",
    "nycsr_interventionenddate": "2021-10-01T04:00:00Z",
    "nycsr_casenumber": "053705",
    "nycsr_interventionstartdate@OData.Community.Display.V1.FormattedValue": "9/30/2021",
    "nycsr_interventionstartdate": "2021-09-30T04:00:00Z",
    "nycsr_building.nycsr_address": "100 NOLL STREET",
    "nycsr_building.nycsr_latitude@OData.Community.Display.V1.FormattedValue": "40,701,107.000000",
    "nycsr_building.nycsr_latitude": 40701107,
    "nycsr_building.nycsr_buildingid": "d7d27c6d-30f4-ea11-b882-24ee9a37d45c",
    "nycsr_building.nycsr_borough@OData.Community.Display.V1.FormattedValue": "Brooklyn",
    "nycsr_building.nycsr_borough": 882450002,
    "nycsr_building.nycsr_longitude@OData.Community.Display.V1.FormattedValue": "-73,932,388.000000",
    "nycsr_building.nycsr_longitude": -73932388,
    "nycsr_building.nycsr_geographicaldistrictcode": "32",
    "nycsr_building.nycsr_buildingname": "P.S. 145 - BROOKLYN",
    "nycsr_locationsite.nycsr_sitename": "P.S. 145 Andrew Jackson - K145 - K145 - 32K145 - 100 NOLL STREET"
  },
  {
    "@odata.etag": "W/\"328091831\"",
    "nycsr_admininterventiontype@OData.Community.Display.V1.FormattedValue": "Partial Classroom Quarantine",
    "nycsr_admininterventiontype": 882450001,
    "nycsr_caseid": "d4974330-2921-ec11-b6e6-001dd8305f31",
    "nycsr_interventionenddate@OData.Community.Display.V1.FormattedValue": "10/4/2021",
    "nycsr_interventionenddate": "2021-10-04T04:00:00Z",
    "nycsr_casenumber": "053721",
    "nycsr_interventionstartdate@OData.Community.Display.V1.FormattedValue": "9/30/2021",
    "nycsr_interventionstartdate": "2021-09-30T04:00:00Z",
    "nycsr_building.nycsr_address": "1186 Carroll Street",
    "nycsr_building.nycsr_latitude@OData.Community.Display.V1.FormattedValue": "40,666,790.000000",
    "nycsr_building.nycsr_latitude": 40666790,
    "nycsr_building.nycsr_buildingid": "e33159fa-30f4-ea11-b882-24ee9a37d45c",
    "nycsr_building.nycsr_borough@OData.Community.Display.V1.FormattedValue": "Brooklyn",
    "nycsr_building.nycsr_borough": 882450002,
    "nycsr_building.nycsr_longitude@OData.Community.Display.V1.FormattedValue": "-73,951,823.000000",
    "nycsr_building.nycsr_longitude": -73951823,
    "nycsr_building.nycsr_geographicaldistrictcode": "17",
    "nycsr_building.nycsr_buildingname": "MIDDLE COLLEGE HS - BROOKLYN",
    "nycsr_locationsite.nycsr_sitename": "Medgar Evers College Preparatory School - K590 - K590 - 17K590 - 1186 Carroll Street"
  },
  {
    "@odata.etag": "W/\"328091856\"",
    "nycsr_admininterventiontype@OData.Community.Display.V1.FormattedValue": "Partial Classroom Quarantine",
    "nycsr_admininterventiontype": 882450001,
    "nycsr_caseid": "77b0c063-2a21-ec11-b6e6-001dd8305f31",
    "nycsr_interventionenddate@OData.Community.Display.V1.FormattedValue": "10/7/2021",
    "nycsr_interventionenddate": "2021-10-07T04:00:00Z",
    "nycsr_casenumber": "053726",
    "nycsr_interventionstartdate@OData.Community.Display.V1.FormattedValue": "9/30/2021",
    "nycsr_interventionstartdate": "2021-09-30T04:00:00Z",
    "nycsr_building.nycsr_address": "105 East 106th Street",
    "nycsr_building.nycsr_latitude@OData.Community.Display.V1.FormattedValue": "40,792,932.000000",
    "nycsr_building.nycsr_latitude": 40792932,
    "nycsr_building.nycsr_buildingid": "d4ed94c3-31f4-ea11-b882-24ee9a37d45c",
    "nycsr_building.nycsr_borough@OData.Community.Display.V1.FormattedValue": "Manhattan",
    "nycsr_building.nycsr_borough": 882450000,
    "nycsr_building.nycsr_longitude@OData.Community.Display.V1.FormattedValue": "-73,947,171.000000",
    "nycsr_building.nycsr_longitude": -73947171,
    "nycsr_building.nycsr_geographicaldistrictcode": "4",
    "nycsr_building.nycsr_buildingname": "YOUNG WOMEN'S LEADERSHIP HS - M",
    "nycsr_locationsite.nycsr_sitename": "Young Women's Leadership School - M610 - M895 - 04M610 - 105 East 106th Street"
  },
  {
    "@odata.etag": "W/\"328544083\"",
    "nycsr_admininterventiontype@OData.Community.Display.V1.FormattedValue": "Classroom Closed",
    "nycsr_admininterventiontype": 882450000,
    "nycsr_caseid": "8880470a-3221-ec11-b6e6-001dd8305f31",
    "nycsr_interventionenddate@OData.Community.Display.V1.FormattedValue": "10/3/2021",
    "nycsr_interventionenddate": "2021-10-03T04:00:00Z",
    "nycsr_casenumber": "053767",
    "nycsr_interventionstartdate@OData.Community.Display.V1.FormattedValue": "9/30/2021",
    "nycsr_interventionstartdate": "2021-09-30T04:00:00Z",
    "nycsr_building.nycsr_address": "2756 RESERVOIR AVENUE",
    "nycsr_building.nycsr_latitude@OData.Community.Display.V1.FormattedValue": "40,869,061.000000",
    "nycsr_building.nycsr_latitude": 40869061,
    "nycsr_building.nycsr_buildingid": "19474313-33f4-ea11-b882-24ee9a37d45c",
    "nycsr_building.nycsr_borough@OData.Community.Display.V1.FormattedValue": "Bronx",
    "nycsr_building.nycsr_borough": 882450001,
    "nycsr_building.nycsr_longitude@OData.Community.Display.V1.FormattedValue": "-73,897,066.000000",
    "nycsr_building.nycsr_longitude": -73897066,
    "nycsr_building.nycsr_geographicaldistrictcode": "10",
    "nycsr_building.nycsr_buildingname": "P.S. 86 - BRONX",
    "nycsr_locationsite.nycsr_sitename": "P.S. 086 Kingsbridge Heights - X086 - X086 - 10X086 - 2756 RESERVOIR AVENUE"
  },
  {
    "@odata.etag": "W/\"328584390\"",
    "nycsr_admininterventiontype@OData.Community.Display.V1.FormattedValue": "Classroom Closed",
    "nycsr_admininterventiontype": 882450000,
    "nycsr_caseid": "08e7041e-3321-ec11-b6e6-001dd8305f31",
    "nycsr_interventionenddate@OData.Community.Display.V1.FormattedValue": "10/3/2021",
    "nycsr_interventionenddate": "2021-10-03T04:00:00Z",
    "nycsr_casenumber": "053774",
    "nycsr_interventionstartdate@OData.Community.Display.V1.FormattedValue": "9/30/2021",
    "nycsr_interventionstartdate": "2021-09-30T04:00:00Z",
    "nycsr_building.nycsr_address": "545 WILLOUGHBY AVENUE",
    "nycsr_building.nycsr_latitude@OData.Community.Display.V1.FormattedValue": "40,694,470.000000",
    "nycsr_building.nycsr_latitude": 40694470,
    "nycsr_building.nycsr_buildingid": "e5968d36-30f4-ea11-b882-24ee9a37d45c",
    "nycsr_building.nycsr_borough@OData.Community.Display.V1.FormattedValue": "Brooklyn",
    "nycsr_building.nycsr_borough": 882450002,
    "nycsr_building.nycsr_longitude@OData.Community.Display.V1.FormattedValue": "-73,947,256.000000",
    "nycsr_building.nycsr_longitude": -73947256,
    "nycsr_building.nycsr_geographicaldistrictcode": "14",
    "nycsr_building.nycsr_buildingname": "P.S. 23 - BROOKLYN",
    "nycsr_locationsite.nycsr_sitename": "P.S. 023 Carter G. Woodson - K023 - K023 - 14K023 - 545 WILLOUGHBY AVENUE"
  },
  {
    "@odata.etag": "W/\"328092017\"",
    "nycsr_admininterventiontype@OData.Community.Display.V1.FormattedValue": "Non-Classroom Quarantine",
    "nycsr_admininterventiontype": 882450003,
    "nycsr_caseid": "1a1aeb0f-3521-ec11-b6e6-001dd8305f31",
    "nycsr_interventionenddate@OData.Community.Display.V1.FormattedValue": "10/4/2021",
    "nycsr_interventionenddate": "2021-10-04T04:00:00Z",
    "nycsr_casenumber": "053791",
    "nycsr_interventionstartdate@OData.Community.Display.V1.FormattedValue": "9/30/2021",
    "nycsr_interventionstartdate": "2021-09-30T04:00:00Z",
    "nycsr_building.nycsr_address": "2225 WEBSTER AVENUE",
    "nycsr_building.nycsr_latitude@OData.Community.Display.V1.FormattedValue": "40,854,257.000000",
    "nycsr_building.nycsr_latitude": 40854257,
    "nycsr_building.nycsr_buildingid": "8e2aa42b-33f4-ea11-b882-24ee9a37d45c",
    "nycsr_building.nycsr_borough@OData.Community.Display.V1.FormattedValue": "Bronx",
    "nycsr_building.nycsr_borough": 882450001,
    "nycsr_building.nycsr_longitude@OData.Community.Display.V1.FormattedValue": "-73,897,404.000000",
    "nycsr_building.nycsr_longitude": -73897404,
    "nycsr_building.nycsr_geographicaldistrictcode": "10",
    "nycsr_building.nycsr_buildingname": "I.S. 391 (UDC) - BRONX",
    "nycsr_locationsite.nycsr_sitename": "The Angelo Patri Middle School - X391 - X137 - 10X391 - 2225 WEBSTER AVENUE"
  },
  {
    "@odata.etag": "W/\"328684440\"",
    "nycsr_admininterventiontype@OData.Community.Display.V1.FormattedValue": "Partial Classroom Quarantine",
    "nycsr_admininterventiontype": 882450001,
    "nycsr_caseid": "fddac093-3a21-ec11-b6e6-001dd8305f31",
    "nycsr_interventionenddate@OData.Community.Display.V1.FormattedValue": "10/8/2021",
    "nycsr_interventionenddate": "2021-10-08T04:00:00Z",
    "nycsr_casenumber": "053823",
    "nycsr_interventionstartdate@OData.Community.Display.V1.FormattedValue": "10/1/2021",
    "nycsr_interventionstartdate": "2021-10-01T04:00:00Z",
    "nycsr_building.nycsr_address": "30-14 30 STREET",
    "nycsr_building.nycsr_latitude@OData.Community.Display.V1.FormattedValue": "40,766,898.000000",
    "nycsr_building.nycsr_latitude": 40766898,
    "nycsr_building.nycsr_buildingid": "1506003e-32f4-ea11-b882-24ee9a37d45c",
    "nycsr_building.nycsr_borough@OData.Community.Display.V1.FormattedValue": "Queens",
    "nycsr_building.nycsr_borough": 882450003,
    "nycsr_building.nycsr_longitude@OData.Community.Display.V1.FormattedValue": "-73,923,044.000000",
    "nycsr_building.nycsr_longitude": -73923044,
    "nycsr_building.nycsr_geographicaldistrictcode": "30",
    "nycsr_building.nycsr_buildingname": "P.S. 234 - QUEENS",
    "nycsr_locationsite.nycsr_sitename": "P.S. 234 - Q234 - Q234 - 30Q234 - 30-15 29 STREET"
  },
  {
    "@odata.etag": "W/\"328092093\"",
    "nycsr_admininterventiontype@OData.Community.Display.V1.FormattedValue": "Classroom Closed",
    "nycsr_admininterventiontype": 882450000,
    "nycsr_caseid": "baf18b47-3b21-ec11-b6e6-001dd8305f31",
    "nycsr_interventionenddate@OData.Community.Display.V1.FormattedValue": "10/4/2021",
    "nycsr_interventionenddate": "2021-10-04T04:00:00Z",
    "nycsr_casenumber": "053830",
    "nycsr_interventionstartdate@OData.Community.Display.V1.FormattedValue": "9/30/2021",
    "nycsr_interventionstartdate": "2021-09-30T04:00:00Z",
    "nycsr_building.nycsr_address": "88-08 164TH STREET",
    "nycsr_building.nycsr_latitude@OData.Community.Display.V1.FormattedValue": "40,708,698.000000",
    "nycsr_building.nycsr_latitude": 40708698,
    "nycsr_building.nycsr_buildingid": "d5454b50-32f4-ea11-b882-24ee9a37d45c",
    "nycsr_building.nycsr_borough@OData.Community.Display.V1.FormattedValue": "Queens",
    "nycsr_building.nycsr_borough": 882450003,
    "nycsr_building.nycsr_longitude@OData.Community.Display.V1.FormattedValue": "-73,797,981.000000",
    "nycsr_building.nycsr_longitude": -73797981,
    "nycsr_building.nycsr_geographicaldistrictcode": "28",
    "nycsr_building.nycsr_buildingname": "P.S./ I.S. 314 - Queens",
    "nycsr_locationsite.nycsr_sitename": "The Queens School for Leadership and Excellence - Q349 - Q314 - 28Q349 - 88-08 164TH STREET"
  },
  {
    "@odata.etag": "W/\"328092128\"",
    "nycsr_admininterventiontype@OData.Community.Display.V1.FormattedValue": "Partial Classroom Quarantine",
    "nycsr_admininterventiontype": 882450001,
    "nycsr_caseid": "28403e5e-3d21-ec11-b6e6-001dd8305f31",
    "nycsr_interventionenddate@OData.Community.Display.V1.FormattedValue": "10/7/2021",
    "nycsr_interventionenddate": "2021-10-07T04:00:00Z",
    "nycsr_casenumber": "053845",
    "nycsr_interventionstartdate@OData.Community.Display.V1.FormattedValue": "9/30/2021",
    "nycsr_interventionstartdate": "2021-09-30T04:00:00Z",
    "nycsr_building.nycsr_address": "57-00 223RD STREET",
    "nycsr_building.nycsr_latitude@OData.Community.Display.V1.FormattedValue": "40,752,343.000000",
    "nycsr_building.nycsr_latitude": 40752343,
    "nycsr_building.nycsr_buildingid": "86e2635c-32f4-ea11-b882-24ee9a37d45c",
    "nycsr_building.nycsr_borough@OData.Community.Display.V1.FormattedValue": "Queens",
    "nycsr_building.nycsr_borough": 882450003,
    "nycsr_building.nycsr_longitude@OData.Community.Display.V1.FormattedValue": "-73,757,271.000000",
    "nycsr_building.nycsr_longitude": -73757271,
    "nycsr_building.nycsr_geographicaldistrictcode": "26",
    "nycsr_building.nycsr_buildingname": "BENJAMIN N. CARDOZO HS - Q",
    "nycsr_locationsite.nycsr_sitename": "Benjamin N. Cardozo High School - Q415 - Q415 - 26Q415 - 57-00 223RD STREET"
  },
  {
    "@odata.etag": "W/\"328170543\"",
    "nycsr_admininterventiontype@OData.Community.Display.V1.FormattedValue": "Partial Classroom Quarantine",
    "nycsr_admininterventiontype": 882450001,
    "nycsr_caseid": "58f9053e-4021-ec11-b6e6-001dd8305f31",
    "nycsr_interventionenddate@OData.Community.Display.V1.FormattedValue": "10/7/2021",
    "nycsr_interventionenddate": "2021-10-07T04:00:00Z",
    "nycsr_casenumber": "053864",
    "nycsr_interventionstartdate@OData.Community.Display.V1.FormattedValue": "9/30/2021",
    "nycsr_interventionstartdate": "2021-09-30T04:00:00Z",
    "nycsr_building.nycsr_address": "99 TERRACE VIEW AVENUE",
    "nycsr_building.nycsr_latitude@OData.Community.Display.V1.FormattedValue": "40,877,379.000000",
    "nycsr_building.nycsr_latitude": 40877379,
    "nycsr_building.nycsr_buildingid": "9853dd74-33f4-ea11-b882-24ee9a37d45c",
    "nycsr_building.nycsr_borough@OData.Community.Display.V1.FormattedValue": "Bronx",
    "nycsr_building.nycsr_borough": 882450001,
    "nycsr_building.nycsr_longitude@OData.Community.Display.V1.FormattedValue": "-73,912,686.000000",
    "nycsr_building.nycsr_longitude": -73912686,
    "nycsr_building.nycsr_geographicaldistrictcode": "10",
    "nycsr_building.nycsr_buildingname": "JOHN F. KENNEDY HS - X",
    "nycsr_locationsite.nycsr_sitename": "New Visions Charter High School for the Humanities - X553 - X475 - 84X553 - 99 TERRACE VIEW AVENUE"
  },
  {
    "@odata.etag": "W/\"328092180\"",
    "nycsr_admininterventiontype@OData.Community.Display.V1.FormattedValue": "Partial Classroom Quarantine",
    "nycsr_admininterventiontype": 882450001,
    "nycsr_caseid": "834b2c52-4121-ec11-b6e6-001dd8305f31",
    "nycsr_interventionenddate@OData.Community.Display.V1.FormattedValue": "10/1/2021",
    "nycsr_interventionenddate": "2021-10-01T04:00:00Z",
    "nycsr_casenumber": "053874",
    "nycsr_interventionstartdate@OData.Community.Display.V1.FormattedValue": "9/30/2021",
    "nycsr_interventionstartdate": "2021-09-30T04:00:00Z",
    "nycsr_building.nycsr_address": "64 WEST 17 STREET",
    "nycsr_building.nycsr_latitude@OData.Community.Display.V1.FormattedValue": "40,739,145.000000",
    "nycsr_building.nycsr_latitude": 40739145,
    "nycsr_building.nycsr_buildingid": "e3e0838c-31f4-ea11-b882-24ee9a37d45c",
    "nycsr_building.nycsr_borough@OData.Community.Display.V1.FormattedValue": "Manhattan",
    "nycsr_building.nycsr_borough": 882450000,
    "nycsr_building.nycsr_longitude@OData.Community.Display.V1.FormattedValue": "-73,995,534.000000",
    "nycsr_building.nycsr_longitude": -73995534,
    "nycsr_building.nycsr_geographicaldistrictcode": "2",
    "nycsr_building.nycsr_buildingname": "THE SIXTH AVENUE EDUCATIONAL CAMPUS - MANHATTAN",
    "nycsr_locationsite.nycsr_sitename": "Sixth Avenue Elementary School - M340 - M340 - 02M340 - 64 WEST 17 STREET"
  },
  {
    "@odata.etag": "W/\"328092210\"",
    "nycsr_admininterventiontype@OData.Community.Display.V1.FormattedValue": "Partial Classroom Quarantine",
    "nycsr_admininterventiontype": 882450001,
    "nycsr_caseid": "2a68b6cc-4221-ec11-b6e6-001dd8305f31",
    "nycsr_interventionenddate@OData.Community.Display.V1.FormattedValue": "10/7/2021",
    "nycsr_interventionenddate": "2021-10-07T04:00:00Z",
    "nycsr_casenumber": "053882",
    "nycsr_interventionstartdate@OData.Community.Display.V1.FormattedValue": "9/30/2021",
    "nycsr_interventionstartdate": "2021-09-30T04:00:00Z",
    "nycsr_building.nycsr_address": "64 WEST 17 STREET",
    "nycsr_building.nycsr_latitude@OData.Community.Display.V1.FormattedValue": "40,739,145.000000",
    "nycsr_building.nycsr_latitude": 40739145,
    "nycsr_building.nycsr_buildingid": "e3e0838c-31f4-ea11-b882-24ee9a37d45c",
    "nycsr_building.nycsr_borough@OData.Community.Display.V1.FormattedValue": "Manhattan",
    "nycsr_building.nycsr_borough": 882450000,
    "nycsr_building.nycsr_longitude@OData.Community.Display.V1.FormattedValue": "-73,995,534.000000",
    "nycsr_building.nycsr_longitude": -73995534,
    "nycsr_building.nycsr_geographicaldistrictcode": "2",
    "nycsr_building.nycsr_buildingname": "THE SIXTH AVENUE EDUCATIONAL CAMPUS - MANHATTAN",
    "nycsr_locationsite.nycsr_sitename": "Sixth Avenue Elementary School - M340 - M340 - 02M340 - 64 WEST 17 STREET"
  },
  {
    "@odata.etag": "W/\"328679408\"",
    "nycsr_admininterventiontype@OData.Community.Display.V1.FormattedValue": "Partial Classroom Quarantine",
    "nycsr_admininterventiontype": 882450001,
    "nycsr_caseid": "10a78c0b-4721-ec11-b6e6-001dd8305f31",
    "nycsr_interventionenddate@OData.Community.Display.V1.FormattedValue": "10/8/2021",
    "nycsr_interventionenddate": "2021-10-08T04:00:00Z",
    "nycsr_casenumber": "053905",
    "nycsr_interventionstartdate@OData.Community.Display.V1.FormattedValue": "9/30/2021",
    "nycsr_interventionstartdate": "2021-09-30T04:00:00Z",
    "nycsr_building.nycsr_address": "655 PARKSIDE AVENUE",
    "nycsr_building.nycsr_latitude@OData.Community.Display.V1.FormattedValue": "40,656,423.000000",
    "nycsr_building.nycsr_latitude": 40656423,
    "nycsr_building.nycsr_buildingid": "dfc1392a-30f4-ea11-b882-24ee9a37d45c",
    "nycsr_building.nycsr_borough@OData.Community.Display.V1.FormattedValue": "Brooklyn",
    "nycsr_building.nycsr_borough": 882450002,
    "nycsr_building.nycsr_longitude@OData.Community.Display.V1.FormattedValue": "-73,951,575.000000",
    "nycsr_building.nycsr_longitude": -73951575,
    "nycsr_building.nycsr_geographicaldistrictcode": "17",
    "nycsr_building.nycsr_buildingname": "I.S. 2 - BROOKLYN",
    "nycsr_locationsite.nycsr_sitename": "Parkside Preparatory Academy - K002 - K002 - 17K002 - 655 PARKSIDE AVENUE"
  },
  {
    "@odata.etag": "W/\"328092286\"",
    "nycsr_admininterventiontype@OData.Community.Display.V1.FormattedValue": "Partial Classroom Quarantine",
    "nycsr_admininterventiontype": 882450001,
    "nycsr_caseid": "85c08c08-5121-ec11-b6e6-001dd8305f31",
    "nycsr_interventionenddate@OData.Community.Display.V1.FormattedValue": "10/2/2021",
    "nycsr_interventionenddate": "2021-10-02T04:00:00Z",
    "nycsr_casenumber": "053941",
    "nycsr_interventionstartdate@OData.Community.Display.V1.FormattedValue": "9/30/2021",
    "nycsr_interventionstartdate": "2021-09-30T04:00:00Z",
    "nycsr_building.nycsr_address": "2800 OCEAN PARKWAY",
    "nycsr_building.nycsr_latitude@OData.Community.Display.V1.FormattedValue": "40,582,627.000000",
    "nycsr_building.nycsr_latitude": 40582627,
    "nycsr_building.nycsr_buildingid": "518dbfcf-30f4-ea11-b882-24ee9a37d45c",
    "nycsr_building.nycsr_borough@OData.Community.Display.V1.FormattedValue": "Brooklyn",
    "nycsr_building.nycsr_borough": 882450002,
    "nycsr_building.nycsr_longitude@OData.Community.Display.V1.FormattedValue": "-73,968,733.000000",
    "nycsr_building.nycsr_longitude": -73968733,
    "nycsr_building.nycsr_geographicaldistrictcode": "21",
    "nycsr_building.nycsr_buildingname": "ABRAHAM LINCOLN HS - K",
    "nycsr_locationsite.nycsr_sitename": "Abraham Lincoln High School - K410 - K410 - 21K410 - 2800 OCEAN PARKWAY"
  },
  {
    "@odata.etag": "W/\"328723416\"",
    "nycsr_admininterventiontype@OData.Community.Display.V1.FormattedValue": "Classroom Closed",
    "nycsr_admininterventiontype": 882450000,
    "nycsr_caseid": "aa0b88dd-5821-ec11-b6e6-001dd8305f31",
    "nycsr_interventionenddate@OData.Community.Display.V1.FormattedValue": "10/8/2021",
    "nycsr_interventionenddate": "2021-10-08T04:00:00Z",
    "nycsr_casenumber": "053991",
    "nycsr_interventionstartdate@OData.Community.Display.V1.FormattedValue": "10/1/2021",
    "nycsr_interventionstartdate": "2021-10-01T04:00:00Z",
    "nycsr_building.nycsr_address": "2675 EAST  29 STREET",
    "nycsr_building.nycsr_latitude@OData.Community.Display.V1.FormattedValue": "40,588,372.000000",
    "nycsr_building.nycsr_latitude": 40588372,
    "nycsr_building.nycsr_buildingid": "26eabc42-30f4-ea11-b882-24ee9a37d45c",
    "nycsr_building.nycsr_borough@OData.Community.Display.V1.FormattedValue": "Brooklyn",
    "nycsr_building.nycsr_borough": 882450002,
    "nycsr_building.nycsr_longitude@OData.Community.Display.V1.FormattedValue": "-73,940,135.000000",
    "nycsr_building.nycsr_longitude": -73940135,
    "nycsr_building.nycsr_geographicaldistrictcode": "22",
    "nycsr_building.nycsr_buildingname": "P.S. 52 - BROOKLYN",
    "nycsr_locationsite.nycsr_sitename": "P.S. 052 Sheepshead Bay - K052 - K052 - 22K052 - 2675 EAST  29 STREET"
  },
  {
    "@odata.etag": "W/\"328721498\"",
    "nycsr_admininterventiontype@OData.Community.Display.V1.FormattedValue": "Classroom Closed",
    "nycsr_admininterventiontype": 882450000,
    "nycsr_caseid": "0f2d189f-5a21-ec11-b6e6-001dd8305f31",
    "nycsr_interventionenddate@OData.Community.Display.V1.FormattedValue": "10/7/2021",
    "nycsr_interventionenddate": "2021-10-07T04:00:00Z",
    "nycsr_casenumber": "054000",
    "nycsr_interventionstartdate@OData.Community.Display.V1.FormattedValue": "9/30/2021",
    "nycsr_interventionstartdate": "2021-09-30T04:00:00Z",
    "nycsr_building.nycsr_address": "25-05 37 AVENUE",
    "nycsr_building.nycsr_latitude@OData.Community.Display.V1.FormattedValue": "40,757,293.000000",
    "nycsr_building.nycsr_latitude": 40757293,
    "nycsr_building.nycsr_buildingid": "c32ff20c-32f4-ea11-b882-24ee9a37d45c",
    "nycsr_building.nycsr_borough@OData.Community.Display.V1.FormattedValue": "Queens",
    "nycsr_building.nycsr_borough": 882450003,
    "nycsr_building.nycsr_longitude@OData.Community.Display.V1.FormattedValue": "-73,933,562.000000",
    "nycsr_building.nycsr_longitude": -73933562,
    "nycsr_building.nycsr_geographicaldistrictcode": "30",
    "nycsr_building.nycsr_buildingname": "P.S. 112 - QUEENS",
    "nycsr_locationsite.nycsr_sitename": "P.S. 112 Dutch Kills - Q112 - Q112 - 30Q112 - 25-05 37 AVENUE"
  },
  {
    "@odata.etag": "W/\"328724299\"",
    "nycsr_admininterventiontype@OData.Community.Display.V1.FormattedValue": "Partial Classroom Quarantine",
    "nycsr_admininterventiontype": 882450001,
    "nycsr_caseid": "280901b1-5a21-ec11-b6e6-001dd8305f31",
    "nycsr_interventionenddate@OData.Community.Display.V1.FormattedValue": "10/8/2021",
    "nycsr_interventionenddate": "2021-10-08T04:00:00Z",
    "nycsr_casenumber": "054001",
    "nycsr_interventionstartdate@OData.Community.Display.V1.FormattedValue": "9/30/2021",
    "nycsr_interventionstartdate": "2021-09-30T04:00:00Z",
    "nycsr_building.nycsr_address": "77 MARSH AVENUE",
    "nycsr_building.nycsr_latitude@OData.Community.Display.V1.FormattedValue": "40,582,791.000000",
    "nycsr_building.nycsr_latitude": 40582791,
    "nycsr_building.nycsr_buildingid": "2a0410ca-32f4-ea11-b882-24ee9a37d45c",
    "nycsr_building.nycsr_borough@OData.Community.Display.V1.FormattedValue": "Staten Island",
    "nycsr_building.nycsr_borough": 882450004,
    "nycsr_building.nycsr_longitude@OData.Community.Display.V1.FormattedValue": "-74,160,867.000000",
    "nycsr_building.nycsr_longitude": -74160867,
    "nycsr_building.nycsr_geographicaldistrictcode": "31",
    "nycsr_building.nycsr_buildingname": "P.S. 58 - STATEN ISLAND",
    "nycsr_locationsite.nycsr_sitename": "Space Shuttle Columbia School - R058 - R058 - 31R058 - 77 MARSH AVENUE"
  },
  {
    "@odata.etag": "W/\"328268475\"",
    "nycsr_admininterventiontype@OData.Community.Display.V1.FormattedValue": "Partial Classroom Quarantine",
    "nycsr_admininterventiontype": 882450001,
    "nycsr_caseid": "021b03e3-5b21-ec11-b6e6-001dd8305f31",
    "nycsr_interventionenddate@OData.Community.Display.V1.FormattedValue": "10/7/2021",
    "nycsr_interventionenddate": "2021-10-07T04:00:00Z",
    "nycsr_casenumber": "054009",
    "nycsr_interventionstartdate@OData.Community.Display.V1.FormattedValue": "10/1/2021",
    "nycsr_interventionstartdate": "2021-10-01T04:00:00Z",
    "nycsr_building.nycsr_address": "220 EAST  76 STREET",
    "nycsr_building.nycsr_latitude@OData.Community.Display.V1.FormattedValue": "40,771,541.000000",
    "nycsr_building.nycsr_latitude": 40771541,
    "nycsr_building.nycsr_buildingid": "39005d7a-31f4-ea11-b882-24ee9a37d45c",
    "nycsr_building.nycsr_borough@OData.Community.Display.V1.FormattedValue": "Manhattan",
    "nycsr_building.nycsr_borough": 882450000,
    "nycsr_building.nycsr_longitude@OData.Community.Display.V1.FormattedValue": "-73,957,827.000000",
    "nycsr_building.nycsr_longitude": -73957827,
    "nycsr_building.nycsr_geographicaldistrictcode": "2",
    "nycsr_building.nycsr_buildingname": "I.S. 167 - MANHATTAN",
    "nycsr_locationsite.nycsr_sitename": "J.H.S. 167 Robert F. Wagner - M167 - M167 - 02M167 - 220 EAST  76 STREET"
  },
  {
    "@odata.etag": "W/\"328742064\"",
    "nycsr_admininterventiontype@OData.Community.Display.V1.FormattedValue": "Partial Classroom Quarantine",
    "nycsr_admininterventiontype": 882450001,
    "nycsr_caseid": "fe49e124-5f21-ec11-b6e6-001dd8305f31",
    "nycsr_interventionenddate@OData.Community.Display.V1.FormattedValue": "10/7/2021",
    "nycsr_interventionenddate": "2021-10-07T04:00:00Z",
    "nycsr_casenumber": "054019",
    "nycsr_interventionstartdate@OData.Community.Display.V1.FormattedValue": "10/1/2021",
    "nycsr_interventionstartdate": "2021-10-01T04:00:00Z",
    "nycsr_building.nycsr_address": "144-80 BARCLAY AVENUE",
    "nycsr_building.nycsr_latitude@OData.Community.Display.V1.FormattedValue": "40,759,963.000000",
    "nycsr_building.nycsr_latitude": 40759963,
    "nycsr_building.nycsr_buildingid": "6b977d2b-32f4-ea11-b882-24ee9a37d45c",
    "nycsr_building.nycsr_borough@OData.Community.Display.V1.FormattedValue": "Queens",
    "nycsr_building.nycsr_borough": 882450003,
    "nycsr_building.nycsr_longitude@OData.Community.Display.V1.FormattedValue": "-73,818,399.000000",
    "nycsr_building.nycsr_longitude": -73818399,
    "nycsr_building.nycsr_geographicaldistrictcode": "25",
    "nycsr_building.nycsr_buildingname": "J.H.S. 189 - QUEENS",
    "nycsr_locationsite.nycsr_sitename": "J.H.S. 189 Daniel Carter Beard - Q189 - Q189 - 25Q189 - 144-80 BARCLAY AVENUE"
  },
  {
    "@odata.etag": "W/\"328477486\"",
    "nycsr_admininterventiontype@OData.Community.Display.V1.FormattedValue": "Partial Classroom Quarantine",
    "nycsr_admininterventiontype": 882450001,
    "nycsr_caseid": "f5d41034-e221-ec11-b6e6-001dd8305f31",
    "nycsr_interventionenddate@OData.Community.Display.V1.FormattedValue": "10/9/2021",
    "nycsr_interventionenddate": "2021-10-09T04:00:00Z",
    "nycsr_casenumber": "054033",
    "nycsr_interventionstartdate@OData.Community.Display.V1.FormattedValue": "10/1/2021",
    "nycsr_interventionstartdate": "2021-10-01T04:00:00Z",
    "nycsr_building.nycsr_address": "74-10 COMMONWEALTH BOULEVARD",
    "nycsr_building.nycsr_latitude@OData.Community.Display.V1.FormattedValue": "40,746,128.000000",
    "nycsr_building.nycsr_latitude": 40746128,
    "nycsr_building.nycsr_buildingid": "4aa10a44-32f4-ea11-b882-24ee9a37d45c",
    "nycsr_building.nycsr_borough@OData.Community.Display.V1.FormattedValue": "Queens",
    "nycsr_building.nycsr_borough": 882450003,
    "nycsr_building.nycsr_longitude@OData.Community.Display.V1.FormattedValue": "-73,728,415.000000",
    "nycsr_building.nycsr_longitude": -73728415,
    "nycsr_building.nycsr_geographicaldistrictcode": "26",
    "nycsr_building.nycsr_buildingname": "P.S./I.S. 266 - QUEENS",
    "nycsr_locationsite.nycsr_sitename": "P.S./I.S. 266 - Q266 - Q266 - 26Q266 - 74-10 COMMONWEALTH BOULEVARD"
  },
  {
    "@odata.etag": "W/\"328274540\"",
    "nycsr_admininterventiontype@OData.Community.Display.V1.FormattedValue": "Partial Classroom Quarantine",
    "nycsr_admininterventiontype": 882450001,
    "nycsr_caseid": "855a7282-e221-ec11-b6e6-001dd8305f31",
    "nycsr_interventionenddate@OData.Community.Display.V1.FormattedValue": "10/9/2021",
    "nycsr_interventionenddate": "2021-10-09T04:00:00Z",
    "nycsr_casenumber": "054037",
    "nycsr_interventionstartdate@OData.Community.Display.V1.FormattedValue": "10/1/2021",
    "nycsr_interventionstartdate": "2021-10-01T04:00:00Z",
    "nycsr_building.nycsr_address": "800 EAST GUN HILL ROAD",
    "nycsr_building.nycsr_latitude@OData.Community.Display.V1.FormattedValue": "40,875,172.000000",
    "nycsr_building.nycsr_latitude": 40875172,
    "nycsr_building.nycsr_buildingid": "699d7c62-33f4-ea11-b882-24ee9a37d45c",
    "nycsr_building.nycsr_borough@OData.Community.Display.V1.FormattedValue": "Bronx",
    "nycsr_building.nycsr_borough": 882450001,
    "nycsr_building.nycsr_longitude@OData.Community.Display.V1.FormattedValue": "-73,861,649.000000",
    "nycsr_building.nycsr_longitude": -73861649,
    "nycsr_building.nycsr_geographicaldistrictcode": "11",
    "nycsr_building.nycsr_buildingname": "EVANDER CHILDS HS - X",
    "nycsr_locationsite.nycsr_sitename": "High School of Computers and Technology - X275 - X425 - 11X275 - 800 EAST GUN HILL ROAD"
  },
  {
    "@odata.etag": "W/\"328263998\"",
    "nycsr_admininterventiontype@OData.Community.Display.V1.FormattedValue": "Classroom Closed",
    "nycsr_admininterventiontype": 882450000,
    "nycsr_caseid": "641cac19-e421-ec11-b6e6-001dd8305f31",
    "nycsr_interventionenddate@OData.Community.Display.V1.FormattedValue": "10/9/2021",
    "nycsr_interventionenddate": "2021-10-09T04:00:00Z",
    "nycsr_casenumber": "054046",
    "nycsr_interventionstartdate@OData.Community.Display.V1.FormattedValue": "10/1/2021",
    "nycsr_interventionstartdate": "2021-10-01T04:00:00Z",
    "nycsr_building.nycsr_address": "427 38 STREET",
    "nycsr_building.nycsr_latitude@OData.Community.Display.V1.FormattedValue": "40,652,832.000000",
    "nycsr_building.nycsr_latitude": 40652832,
    "nycsr_building.nycsr_buildingid": "ed968d36-30f4-ea11-b882-24ee9a37d45c",
    "nycsr_building.nycsr_borough@OData.Community.Display.V1.FormattedValue": "Brooklyn",
    "nycsr_building.nycsr_borough": 882450002,
    "nycsr_building.nycsr_longitude@OData.Community.Display.V1.FormattedValue": "-74,004,533.000000",
    "nycsr_building.nycsr_longitude": -74004533,
    "nycsr_building.nycsr_geographicaldistrictcode": "15",
    "nycsr_building.nycsr_buildingname": "P.S. 24 - BROOKLYN",
    "nycsr_locationsite.nycsr_sitename": "P.S. 024 - K024 - K024 - 15K024 - 427 38 STREET"
  },
  {
    "@odata.etag": "W/\"328335355\"",
    "nycsr_admininterventiontype@OData.Community.Display.V1.FormattedValue": "Partial Classroom Quarantine",
    "nycsr_admininterventiontype": 882450001,
    "nycsr_caseid": "1e427498-e421-ec11-b6e6-001dd8305f31",
    "nycsr_interventionenddate@OData.Community.Display.V1.FormattedValue": "10/9/2021",
    "nycsr_interventionenddate": "2021-10-09T04:00:00Z",
    "nycsr_casenumber": "054050",
    "nycsr_interventionstartdate@OData.Community.Display.V1.FormattedValue": "10/1/2021",
    "nycsr_interventionstartdate": "2021-10-01T04:00:00Z",
    "nycsr_building.nycsr_address": "730 BRYANT AVENUE",
    "nycsr_building.nycsr_latitude@OData.Community.Display.V1.FormattedValue": "40,815,827.000000",
    "nycsr_building.nycsr_latitude": 40815827,
    "nycsr_building.nycsr_buildingid": "f9d10307-33f4-ea11-b882-24ee9a37d45c",
    "nycsr_building.nycsr_borough@OData.Community.Display.V1.FormattedValue": "Bronx",
    "nycsr_building.nycsr_borough": 882450001,
    "nycsr_building.nycsr_longitude@OData.Community.Display.V1.FormattedValue": "-73,885,284.000000",
    "nycsr_building.nycsr_longitude": -73885284,
    "nycsr_building.nycsr_geographicaldistrictcode": "8",
    "nycsr_building.nycsr_buildingname": "I.S. 201 - BRONX",
    "nycsr_locationsite.nycsr_sitename": "Bronx Academy for Multi-Media - X424 - X074 - 08X424 - 730 BRYANT AVENUE"
  },
  {
    "@odata.etag": "W/\"328364921\"",
    "nycsr_admininterventiontype@OData.Community.Display.V1.FormattedValue": "Partial Classroom Quarantine",
    "nycsr_admininterventiontype": 882450001,
    "nycsr_caseid": "f3b6e4e4-e521-ec11-b6e6-001dd8305f31",
    "nycsr_interventionenddate@OData.Community.Display.V1.FormattedValue": "10/9/2021",
    "nycsr_interventionenddate": "2021-10-09T04:00:00Z",
    "nycsr_casenumber": "054053",
    "nycsr_interventionstartdate@OData.Community.Display.V1.FormattedValue": "10/1/2021",
    "nycsr_interventionstartdate": "2021-10-01T04:00:00Z",
    "nycsr_building.nycsr_address": "3710 BARNES AVENUE",
    "nycsr_building.nycsr_latitude@OData.Community.Display.V1.FormattedValue": "40,880,649.000000",
    "nycsr_building.nycsr_latitude": 40880649,
    "nycsr_building.nycsr_buildingid": "520d6d19-33f4-ea11-b882-24ee9a37d45c",
    "nycsr_building.nycsr_borough@OData.Community.Display.V1.FormattedValue": "Bronx",
    "nycsr_building.nycsr_borough": 882450001,
    "nycsr_building.nycsr_longitude@OData.Community.Display.V1.FormattedValue": "-73,860,126.000000",
    "nycsr_building.nycsr_longitude": -73860126,
    "nycsr_building.nycsr_geographicaldistrictcode": "11",
    "nycsr_building.nycsr_buildingname": "I.S. 113 - BRONX",
    "nycsr_locationsite.nycsr_sitename": "Leaders of Tomorrow - X370 - X113 - 11X370 - 3710 BARNES AVENUE"
  },
  {
    "@odata.etag": "W/\"328769514\"",
    "nycsr_admininterventiontype@OData.Community.Display.V1.FormattedValue": "Non-Classroom Quarantine",
    "nycsr_admininterventiontype": 882450003,
    "nycsr_caseid": "0f2713d9-e721-ec11-b6e6-001dd8305f31",
    "nycsr_interventionenddate@OData.Community.Display.V1.FormattedValue": "10/8/2021",
    "nycsr_interventionenddate": "2021-10-08T04:00:00Z",
    "nycsr_casenumber": "054058",
    "nycsr_interventionstartdate@OData.Community.Display.V1.FormattedValue": "10/1/2021",
    "nycsr_interventionstartdate": "2021-10-01T04:00:00Z",
    "nycsr_building.nycsr_address": "1420 EAST  68 STREET",
    "nycsr_building.nycsr_latitude@OData.Community.Display.V1.FormattedValue": "40,620,537.000000",
    "nycsr_building.nycsr_latitude": 40620537,
    "nycsr_building.nycsr_buildingid": "8b03194f-30f4-ea11-b882-24ee9a37d45c",
    "nycsr_building.nycsr_borough@OData.Community.Display.V1.FormattedValue": "Brooklyn",
    "nycsr_building.nycsr_borough": 882450002,
    "nycsr_building.nycsr_longitude@OData.Community.Display.V1.FormattedValue": "-73,912,914.000000",
    "nycsr_building.nycsr_longitude": -73912914,
    "nycsr_building.nycsr_geographicaldistrictcode": "22",
    "nycsr_building.nycsr_buildingname": "I.S. 78 - BROOKLYN",
    "nycsr_locationsite.nycsr_sitename": "J.H.S. 078 Roy H. Mann - K078 - K078 - 22K078 - 1420 EAST  68 STREET"
  },
  {
    "@odata.etag": "W/\"328767309\"",
    "nycsr_admininterventiontype@OData.Community.Display.V1.FormattedValue": "Partial Classroom Quarantine",
    "nycsr_admininterventiontype": 882450001,
    "nycsr_caseid": "830423ee-ec21-ec11-b6e6-001dd8305f31",
    "nycsr_interventionenddate@OData.Community.Display.V1.FormattedValue": "10/9/2021",
    "nycsr_interventionenddate": "2021-10-09T04:00:00Z",
    "nycsr_casenumber": "054075",
    "nycsr_interventionstartdate@OData.Community.Display.V1.FormattedValue": "10/1/2021",
    "nycsr_interventionstartdate": "2021-10-01T04:00:00Z",
    "nycsr_building.nycsr_address": "176 EAST 115 STREET",
    "nycsr_building.nycsr_latitude@OData.Community.Display.V1.FormattedValue": "40,797,205.000000",
    "nycsr_building.nycsr_latitude": 40797205,
    "nycsr_building.nycsr_buildingid": "bcfab455-31f4-ea11-b882-24ee9a37d45c",
    "nycsr_building.nycsr_borough@OData.Community.Display.V1.FormattedValue": "Manhattan",
    "nycsr_building.nycsr_borough": 882450000,
    "nycsr_building.nycsr_longitude@OData.Community.Display.V1.FormattedValue": "-73,941,598.000000",
    "nycsr_building.nycsr_longitude": -73941598,
    "nycsr_building.nycsr_geographicaldistrictcode": "4",
    "nycsr_building.nycsr_buildingname": "P.S. 57 - MANHATTAN",
    "nycsr_locationsite.nycsr_sitename": "James Weldon Johnson - M057 - M057 - 04M057 - 176 EAST 115 STREET"
  },
  {
    "@odata.etag": "W/\"328392269\"",
    "nycsr_admininterventiontype@OData.Community.Display.V1.FormattedValue": "No Intervention",
    "nycsr_admininterventiontype": 882450002,
    "nycsr_caseid": "37b43c08-ee21-ec11-b6e6-001dd8305f31",
    "nycsr_interventionenddate@OData.Community.Display.V1.FormattedValue": "10/1/2021",
    "nycsr_interventionenddate": "2021-10-01T04:00:00Z",
    "nycsr_casenumber": "054076",
    "nycsr_interventionstartdate@OData.Community.Display.V1.FormattedValue": "9/30/2021",
    "nycsr_interventionstartdate": "2021-09-30T04:00:00Z",
    "nycsr_building.nycsr_address": "147-36 26 AVENUE",
    "nycsr_building.nycsr_latitude@OData.Community.Display.V1.FormattedValue": "40,774,134.000000",
    "nycsr_building.nycsr_latitude": 40774134,
    "nycsr_building.nycsr_buildingid": "adfc24e8-31f4-ea11-b882-24ee9a37d45c",
    "nycsr_building.nycsr_borough@OData.Community.Display.V1.FormattedValue": "Queens",
    "nycsr_building.nycsr_borough": 882450003,
    "nycsr_building.nycsr_longitude@OData.Community.Display.V1.FormattedValue": "-73,818,581.000000",
    "nycsr_building.nycsr_longitude": -73818581,
    "nycsr_building.nycsr_geographicaldistrictcode": "25",
    "nycsr_building.nycsr_buildingname": "P.S. 21 - QUEENS",
    "nycsr_locationsite.nycsr_sitename": "P.S. 021 Edward Hart - Q021 - Q021 - 25Q021 - 147-36 26 AVENUE"
  },
  {
    "@odata.etag": "W/\"328398585\"",
    "nycsr_admininterventiontype@OData.Community.Display.V1.FormattedValue": "Partial Classroom Quarantine",
    "nycsr_admininterventiontype": 882450001,
    "nycsr_caseid": "98e03c38-ee21-ec11-b6e6-001dd8305f31",
    "nycsr_interventionenddate@OData.Community.Display.V1.FormattedValue": "10/4/2021",
    "nycsr_interventionenddate": "2021-10-04T04:00:00Z",
    "nycsr_casenumber": "054077",
    "nycsr_interventionstartdate@OData.Community.Display.V1.FormattedValue": "10/1/2021",
    "nycsr_interventionstartdate": "2021-10-01T04:00:00Z",
    "nycsr_building.nycsr_address": "3000 EAST TREMONT AVENUE",
    "nycsr_building.nycsr_latitude@OData.Community.Display.V1.FormattedValue": "40,839,775.000000",
    "nycsr_building.nycsr_latitude": 40839775,
    "nycsr_building.nycsr_buildingid": "b556635c-33f4-ea11-b882-24ee9a37d45c",
    "nycsr_building.nycsr_borough@OData.Community.Display.V1.FormattedValue": "Bronx",
    "nycsr_building.nycsr_borough": 882450001,
    "nycsr_building.nycsr_longitude@OData.Community.Display.V1.FormattedValue": "-73,839,583.000000",
    "nycsr_building.nycsr_longitude": -73839583,
    "nycsr_building.nycsr_geographicaldistrictcode": "11",
    "nycsr_building.nycsr_buildingname": "HERBERT H. LEHMAN HS - X",
    "nycsr_locationsite.nycsr_sitename": "Schuylerville Preparatory High School - X348 - X405 - 08X348 - 3000 EAST TREMONT AVENUE"
  },
  {
    "@odata.etag": "W/\"328536777\"",
    "nycsr_admininterventiontype@OData.Community.Display.V1.FormattedValue": "Partial Classroom Quarantine",
    "nycsr_admininterventiontype": 882450001,
    "nycsr_caseid": "d5dcd23f-ef21-ec11-b6e6-001dd8305f31",
    "nycsr_interventionenddate@OData.Community.Display.V1.FormattedValue": "10/4/2021",
    "nycsr_interventionenddate": "2021-10-04T04:00:00Z",
    "nycsr_casenumber": "054081",
    "nycsr_interventionstartdate@OData.Community.Display.V1.FormattedValue": "10/1/2021",
    "nycsr_interventionstartdate": "2021-10-01T04:00:00Z",
    "nycsr_building.nycsr_address": "3000 EAST TREMONT AVENUE",
    "nycsr_building.nycsr_latitude@OData.Community.Display.V1.FormattedValue": "40,839,775.000000",
    "nycsr_building.nycsr_latitude": 40839775,
    "nycsr_building.nycsr_buildingid": "b556635c-33f4-ea11-b882-24ee9a37d45c",
    "nycsr_building.nycsr_borough@OData.Community.Display.V1.FormattedValue": "Bronx",
    "nycsr_building.nycsr_borough": 882450001,
    "nycsr_building.nycsr_longitude@OData.Community.Display.V1.FormattedValue": "-73,839,583.000000",
    "nycsr_building.nycsr_longitude": -73839583,
    "nycsr_building.nycsr_geographicaldistrictcode": "11",
    "nycsr_building.nycsr_buildingname": "HERBERT H. LEHMAN HS - X",
    "nycsr_locationsite.nycsr_sitename": "Schuylerville Preparatory High School - X348 - X405 - 08X348 - 3000 EAST TREMONT AVENUE"
  },
  {
    "@odata.etag": "W/\"328381096\"",
    "nycsr_admininterventiontype@OData.Community.Display.V1.FormattedValue": "Partial Classroom Quarantine",
    "nycsr_admininterventiontype": 882450001,
    "nycsr_caseid": "61eab589-f021-ec11-b6e6-001dd8305f31",
    "nycsr_interventionenddate@OData.Community.Display.V1.FormattedValue": "10/4/2021",
    "nycsr_interventionenddate": "2021-10-04T04:00:00Z",
    "nycsr_casenumber": "054085",
    "nycsr_interventionstartdate@OData.Community.Display.V1.FormattedValue": "10/1/2021",
    "nycsr_interventionstartdate": "2021-10-01T04:00:00Z",
    "nycsr_building.nycsr_address": "3000 EAST TREMONT AVENUE",
    "nycsr_building.nycsr_latitude@OData.Community.Display.V1.FormattedValue": "40,839,775.000000",
    "nycsr_building.nycsr_latitude": 40839775,
    "nycsr_building.nycsr_buildingid": "b556635c-33f4-ea11-b882-24ee9a37d45c",
    "nycsr_building.nycsr_borough@OData.Community.Display.V1.FormattedValue": "Bronx",
    "nycsr_building.nycsr_borough": 882450001,
    "nycsr_building.nycsr_longitude@OData.Community.Display.V1.FormattedValue": "-73,839,583.000000",
    "nycsr_building.nycsr_longitude": -73839583,
    "nycsr_building.nycsr_geographicaldistrictcode": "11",
    "nycsr_building.nycsr_buildingname": "HERBERT H. LEHMAN HS - X",
    "nycsr_locationsite.nycsr_sitename": "Schuylerville Preparatory High School - X348 - X405 - 08X348 - 3000 EAST TREMONT AVENUE"
  },
  {
    "@odata.etag": "W/\"328532264\"",
    "nycsr_admininterventiontype@OData.Community.Display.V1.FormattedValue": "Classroom Closed",
    "nycsr_admininterventiontype": 882450000,
    "nycsr_caseid": "004f8543-f121-ec11-b6e6-001dd8305f31",
    "nycsr_interventionenddate@OData.Community.Display.V1.FormattedValue": "10/9/2021",
    "nycsr_interventionenddate": "2021-10-09T04:00:00Z",
    "nycsr_casenumber": "054096",
    "nycsr_interventionstartdate@OData.Community.Display.V1.FormattedValue": "10/1/2021",
    "nycsr_interventionstartdate": "2021-10-01T04:00:00Z",
    "nycsr_building.nycsr_address": "216 CLAWSON STREET",
    "nycsr_building.nycsr_latitude@OData.Community.Display.V1.FormattedValue": "40,573,599.000000",
    "nycsr_building.nycsr_latitude": 40573599,
    "nycsr_building.nycsr_buildingid": "0e0410ca-32f4-ea11-b882-24ee9a37d45c",
    "nycsr_building.nycsr_borough@OData.Community.Display.V1.FormattedValue": "Staten Island",
    "nycsr_building.nycsr_borough": 882450004,
    "nycsr_building.nycsr_longitude@OData.Community.Display.V1.FormattedValue": "-74,108,492.000000",
    "nycsr_building.nycsr_longitude": -74108492,
    "nycsr_building.nycsr_geographicaldistrictcode": "31",
    "nycsr_building.nycsr_buildingname": "P.S. 41 - STATEN ISLAND",
    "nycsr_locationsite.nycsr_sitename": "DYCD - The Stephanie A. Vierno School - 125500 - 216 Clawson Street"
  },
  {
    "@odata.etag": "W/\"328771120\"",
    "nycsr_admininterventiontype@OData.Community.Display.V1.FormattedValue": "Partial Classroom Quarantine",
    "nycsr_admininterventiontype": 882450001,
    "nycsr_caseid": "126c4262-f421-ec11-b6e6-001dd8305f31",
    "nycsr_interventionenddate@OData.Community.Display.V1.FormattedValue": "10/3/2021",
    "nycsr_interventionenddate": "2021-10-03T04:00:00Z",
    "nycsr_casenumber": "054116",
    "nycsr_interventionstartdate@OData.Community.Display.V1.FormattedValue": "10/1/2021",
    "nycsr_interventionstartdate": "2021-10-01T04:00:00Z",
    "nycsr_building.nycsr_address": "923 JEROME STREET",
    "nycsr_building.nycsr_latitude@OData.Community.Display.V1.FormattedValue": "40,658,500.000000",
    "nycsr_building.nycsr_latitude": 40658500,
    "nycsr_building.nycsr_buildingid": "cb201dab-30f4-ea11-b882-24ee9a37d45c",
    "nycsr_building.nycsr_borough@OData.Community.Display.V1.FormattedValue": "Brooklyn",
    "nycsr_building.nycsr_borough": 882450002,
    "nycsr_building.nycsr_longitude@OData.Community.Display.V1.FormattedValue": "-73,879,276.000000",
    "nycsr_building.nycsr_longitude": -73879276,
    "nycsr_building.nycsr_geographicaldistrictcode": "19",
    "nycsr_building.nycsr_buildingname": "P.S. 273 - BROOKLYN",
    "nycsr_locationsite.nycsr_sitename": "P.S. 273 Wortman - K273 - K273 - 19K273 - 923 JEROME STREET"
  },
  {
    "@odata.etag": "W/\"328769475\"",
    "nycsr_admininterventiontype@OData.Community.Display.V1.FormattedValue": "Classroom Closed",
    "nycsr_admininterventiontype": 882450000,
    "nycsr_caseid": "77083074-f421-ec11-b6e6-001dd8305f31",
    "nycsr_interventionenddate@OData.Community.Display.V1.FormattedValue": "10/9/2021",
    "nycsr_interventionenddate": "2021-10-09T04:00:00Z",
    "nycsr_casenumber": "054117",
    "nycsr_interventionstartdate@OData.Community.Display.V1.FormattedValue": "10/1/2021",
    "nycsr_interventionstartdate": "2021-10-01T04:00:00Z",
    "nycsr_building.nycsr_address": "196-25 PECK AVENUE",
    "nycsr_building.nycsr_latitude@OData.Community.Display.V1.FormattedValue": "40,741,700.000000",
    "nycsr_building.nycsr_latitude": 40741700,
    "nycsr_building.nycsr_buildingid": "9c0e6e25-32f4-ea11-b882-24ee9a37d45c",
    "nycsr_building.nycsr_borough@OData.Community.Display.V1.FormattedValue": "Queens",
    "nycsr_building.nycsr_borough": 882450003,
    "nycsr_building.nycsr_longitude@OData.Community.Display.V1.FormattedValue": "-73,778,118.000000",
    "nycsr_building.nycsr_longitude": -73778118,
    "nycsr_building.nycsr_geographicaldistrictcode": "26",
    "nycsr_building.nycsr_buildingname": "P.S. 179 - QUEENS",
    "nycsr_locationsite.nycsr_sitename": "P.S. Q004 - Q004 - Q179 - 75Q004 - 196-25 PECK AVENUE"
  },
  {
    "@odata.etag": "W/\"328467931\"",
    "nycsr_admininterventiontype@OData.Community.Display.V1.FormattedValue": "Classroom Closed",
    "nycsr_admininterventiontype": 882450000,
    "nycsr_caseid": "014ce621-f721-ec11-b6e6-001dd8305f31",
    "nycsr_interventionenddate@OData.Community.Display.V1.FormattedValue": "10/9/2021",
    "nycsr_interventionenddate": "2021-10-09T04:00:00Z",
    "nycsr_casenumber": "054123",
    "nycsr_interventionstartdate@OData.Community.Display.V1.FormattedValue": "10/1/2021",
    "nycsr_interventionstartdate": "2021-10-01T04:00:00Z",
    "nycsr_building.nycsr_address": "545 WILLOUGHBY AVENUE",
    "nycsr_building.nycsr_latitude@OData.Community.Display.V1.FormattedValue": "40,694,470.000000",
    "nycsr_building.nycsr_latitude": 40694470,
    "nycsr_building.nycsr_buildingid": "e5968d36-30f4-ea11-b882-24ee9a37d45c",
    "nycsr_building.nycsr_borough@OData.Community.Display.V1.FormattedValue": "Brooklyn",
    "nycsr_building.nycsr_borough": 882450002,
    "nycsr_building.nycsr_longitude@OData.Community.Display.V1.FormattedValue": "-73,947,256.000000",
    "nycsr_building.nycsr_longitude": -73947256,
    "nycsr_building.nycsr_geographicaldistrictcode": "14",
    "nycsr_building.nycsr_buildingname": "P.S. 23 - BROOKLYN",
    "nycsr_locationsite.nycsr_sitename": "P.S. 023 Carter G. Woodson - K023 - K023 - 14K023 - 545 WILLOUGHBY AVENUE"
  },
  {
    "@odata.etag": "W/\"328492322\"",
    "nycsr_admininterventiontype@OData.Community.Display.V1.FormattedValue": "Classroom Closed",
    "nycsr_admininterventiontype": 882450000,
    "nycsr_caseid": "152bcdf2-fc21-ec11-b6e6-001dd8305f31",
    "nycsr_interventionenddate@OData.Community.Display.V1.FormattedValue": "10/9/2021",
    "nycsr_interventionenddate": "2021-10-09T04:00:00Z",
    "nycsr_casenumber": "054149",
    "nycsr_interventionstartdate@OData.Community.Display.V1.FormattedValue": "10/1/2021",
    "nycsr_interventionstartdate": "2021-10-01T04:00:00Z",
    "nycsr_building.nycsr_address": "317 Hoyt Street",
    "nycsr_building.nycsr_latitude@OData.Community.Display.V1.FormattedValue": "40,680,159.000000",
    "nycsr_building.nycsr_latitude": 40680159,
    "nycsr_building.nycsr_buildingid": "f41aad3c-30f4-ea11-b882-24ee9a37d45c",
    "nycsr_building.nycsr_borough@OData.Community.Display.V1.FormattedValue": "Brooklyn",
    "nycsr_building.nycsr_borough": 882450002,
    "nycsr_building.nycsr_longitude@OData.Community.Display.V1.FormattedValue": "-73,991,141.000000",
    "nycsr_building.nycsr_longitude": -73991141,
    "nycsr_building.nycsr_geographicaldistrictcode": "15",
    "nycsr_building.nycsr_buildingname": "P.S. 32 - BROOKLYN",
    "nycsr_locationsite.nycsr_sitename": "P.S. 032 Samuel Mills Sprole - K032 - K032 - 15K032 - 317 Hoyt Street"
  },
  {
    "@odata.etag": "W/\"328498511\"",
    "nycsr_admininterventiontype@OData.Community.Display.V1.FormattedValue": "No Intervention",
    "nycsr_admininterventiontype": 882450002,
    "nycsr_caseid": "3a3b71ca-fd21-ec11-b6e6-001dd8305f31",
    "nycsr_interventionenddate@OData.Community.Display.V1.FormattedValue": "10/1/2021",
    "nycsr_interventionenddate": "2021-10-01T04:00:00Z",
    "nycsr_casenumber": "054153",
    "nycsr_interventionstartdate@OData.Community.Display.V1.FormattedValue": "9/30/2021",
    "nycsr_interventionstartdate": "2021-09-30T04:00:00Z",
    "nycsr_building.nycsr_address": "68-10 CENTRAL AVE",
    "nycsr_building.nycsr_latitude@OData.Community.Display.V1.FormattedValue": "40,703,503.000000",
    "nycsr_building.nycsr_latitude": 40703503,
    "nycsr_building.nycsr_buildingid": "207eed06-32f4-ea11-b882-24ee9a37d45c",
    "nycsr_building.nycsr_borough@OData.Community.Display.V1.FormattedValue": "Queens",
    "nycsr_building.nycsr_borough": 882450003,
    "nycsr_building.nycsr_longitude@OData.Community.Display.V1.FormattedValue": "-73,883,995.000000",
    "nycsr_building.nycsr_longitude": -73883995,
    "nycsr_building.nycsr_geographicaldistrictcode": "24",
    "nycsr_building.nycsr_buildingname": "P.S. 91 - QUEENS",
    "nycsr_locationsite.nycsr_sitename": "P.S. 091 Richard Arkwright - Q091 - Q091 - 24Q091 - 68-10 CENTRAL AVE"
  },
  {
    "@odata.etag": "W/\"328527698\"",
    "nycsr_admininterventiontype@OData.Community.Display.V1.FormattedValue": "Partial Classroom Quarantine",
    "nycsr_admininterventiontype": 882450001,
    "nycsr_caseid": "515e1c9e-ff21-ec11-b6e6-001dd8305f31",
    "nycsr_interventionenddate@OData.Community.Display.V1.FormattedValue": "10/7/2021",
    "nycsr_interventionenddate": "2021-10-07T04:00:00Z",
    "nycsr_casenumber": "054167",
    "nycsr_interventionstartdate@OData.Community.Display.V1.FormattedValue": "10/1/2021",
    "nycsr_interventionstartdate": "2021-10-01T04:00:00Z",
    "nycsr_building.nycsr_address": "144 KEATING PLACE",
    "nycsr_building.nycsr_latitude@OData.Community.Display.V1.FormattedValue": "40,591,480.000000",
    "nycsr_building.nycsr_latitude": 40591480,
    "nycsr_building.nycsr_buildingid": "dd8521d0-32f4-ea11-b882-24ee9a37d45c",
    "nycsr_building.nycsr_borough@OData.Community.Display.V1.FormattedValue": "Staten Island",
    "nycsr_building.nycsr_borough": 882450004,
    "nycsr_building.nycsr_longitude@OData.Community.Display.V1.FormattedValue": "-74,157,327.000000",
    "nycsr_building.nycsr_longitude": -74157327,
    "nycsr_building.nycsr_geographicaldistrictcode": "31",
    "nycsr_building.nycsr_buildingname": "P.S. 69 - STATEN ISLAND",
    "nycsr_locationsite.nycsr_sitename": "P.S. 069 Daniel D. Tompkins - R069 - R069 - 31R069 - 144 KEATING PLACE"
  },
  {
    "@odata.etag": "W/\"328754321\"",
    "nycsr_admininterventiontype@OData.Community.Display.V1.FormattedValue": "Partial Classroom Quarantine",
    "nycsr_admininterventiontype": 882450001,
    "nycsr_caseid": "d4e57bfd-0222-ec11-b6e6-001dd8305f31",
    "nycsr_interventionenddate@OData.Community.Display.V1.FormattedValue": "10/7/2021",
    "nycsr_interventionenddate": "2021-10-07T04:00:00Z",
    "nycsr_casenumber": "054184",
    "nycsr_interventionstartdate@OData.Community.Display.V1.FormattedValue": "10/1/2021",
    "nycsr_interventionstartdate": "2021-10-01T04:00:00Z",
    "nycsr_building.nycsr_address": "470 JACKSON AVENUE",
    "nycsr_building.nycsr_latitude@OData.Community.Display.V1.FormattedValue": "40,811,051.000000",
    "nycsr_building.nycsr_latitude": 40811051,
    "nycsr_building.nycsr_buildingid": "7701ce37-33f4-ea11-b882-24ee9a37d45c",
    "nycsr_building.nycsr_borough@OData.Community.Display.V1.FormattedValue": "Bronx",
    "nycsr_building.nycsr_borough": 882450001,
    "nycsr_building.nycsr_longitude@OData.Community.Display.V1.FormattedValue": "-73,909,363.000000",
    "nycsr_building.nycsr_longitude": -73909363,
    "nycsr_building.nycsr_geographicaldistrictcode": "7",
    "nycsr_building.nycsr_buildingname": "P.S. 754 (OLD IS155) - BRONX",
    "nycsr_locationsite.nycsr_sitename": "J. M. Rapport School Career Development - X754 - X155 - 75X754 - 470 JACKSON AVENUE"
  },
  {
    "@odata.etag": "W/\"328782109\"",
    "nycsr_admininterventiontype@OData.Community.Display.V1.FormattedValue": "Classroom Closed",
    "nycsr_admininterventiontype": 882450000,
    "nycsr_caseid": "9c9fcb7b-0622-ec11-b6e6-001dd8305f31",
    "nycsr_interventionenddate@OData.Community.Display.V1.FormattedValue": "10/9/2021",
    "nycsr_interventionenddate": "2021-10-09T04:00:00Z",
    "nycsr_casenumber": "054207",
    "nycsr_interventionstartdate@OData.Community.Display.V1.FormattedValue": "10/1/2021",
    "nycsr_interventionstartdate": "2021-10-01T04:00:00Z",
    "nycsr_building.nycsr_address": "8413 Avenue K",
    "nycsr_building.nycsr_latitude@OData.Community.Display.V1.FormattedValue": "40,634,322.000000",
    "nycsr_building.nycsr_latitude": 40634322,
    "nycsr_building.nycsr_buildingid": "dedfede7-49fb-ea11-b883-24ee9a37d459",
    "nycsr_building.nycsr_longitude@OData.Community.Display.V1.FormattedValue": "-73,906,387.000000",
    "nycsr_building.nycsr_longitude": -73906387,
    "nycsr_building.nycsr_geographicaldistrictcode": "18",
    "nycsr_building.nycsr_buildingname": "Little Einsteins Learning Center",
    "nycsr_locationsite.nycsr_sitename": "Little Einsteins Learning Center - KCIC - KCIC -  - 8413 Avenue K"
  },
  {
    "@odata.etag": "W/\"328653404\"",
    "nycsr_admininterventiontype@OData.Community.Display.V1.FormattedValue": "Classroom Closed",
    "nycsr_admininterventiontype": 882450000,
    "nycsr_caseid": "cb89bb8d-0e22-ec11-b6e6-001dd8305f31",
    "nycsr_interventionenddate@OData.Community.Display.V1.FormattedValue": "10/10/2021",
    "nycsr_interventionenddate": "2021-10-10T04:00:00Z",
    "nycsr_casenumber": "054239",
    "nycsr_interventionstartdate@OData.Community.Display.V1.FormattedValue": "10/1/2021",
    "nycsr_interventionstartdate": "2021-10-01T04:00:00Z",
    "nycsr_building.nycsr_address": "3117 AVENUE W",
    "nycsr_building.nycsr_latitude@OData.Community.Display.V1.FormattedValue": "40,598,069.000000",
    "nycsr_building.nycsr_latitude": 40598069,
    "nycsr_building.nycsr_buildingid": "ecb98b86-30f4-ea11-b882-24ee9a37d45c",
    "nycsr_building.nycsr_borough@OData.Community.Display.V1.FormattedValue": "Brooklyn",
    "nycsr_building.nycsr_borough": 882450002,
    "nycsr_building.nycsr_longitude@OData.Community.Display.V1.FormattedValue": "-73,934,163.000000",
    "nycsr_building.nycsr_longitude": -73934163,
    "nycsr_building.nycsr_geographicaldistrictcode": "22",
    "nycsr_building.nycsr_buildingname": "P.S. 194 - BROOKLYN",
    "nycsr_locationsite.nycsr_sitename": "P.S. 194 Raoul Wallenberg - K194 - K194 - 22K194 - 3117 AVENUE W"
  },
  {
    "@odata.etag": "W/\"328745799\"",
    "nycsr_admininterventiontype@OData.Community.Display.V1.FormattedValue": "No Intervention",
    "nycsr_admininterventiontype": 882450002,
    "nycsr_caseid": "1bcc228d-1422-ec11-b6e6-001dd8305f31",
    "nycsr_interventionenddate@OData.Community.Display.V1.FormattedValue": "10/1/2021",
    "nycsr_interventionenddate": "2021-10-01T04:00:00Z",
    "nycsr_casenumber": "054260",
    "nycsr_interventionstartdate@OData.Community.Display.V1.FormattedValue": "9/30/2021",
    "nycsr_interventionstartdate": "2021-09-30T04:00:00Z",
    "nycsr_building.nycsr_address": "41-15 104 STREET",
    "nycsr_building.nycsr_latitude@OData.Community.Display.V1.FormattedValue": "40,748,996.000000",
    "nycsr_building.nycsr_latitude": 40748996,
    "nycsr_building.nycsr_buildingid": "b672c880-32f4-ea11-b882-24ee9a37d45c",
    "nycsr_building.nycsr_borough@OData.Community.Display.V1.FormattedValue": "Queens",
    "nycsr_building.nycsr_borough": 882450003,
    "nycsr_building.nycsr_longitude@OData.Community.Display.V1.FormattedValue": "-73,860,547.000000",
    "nycsr_building.nycsr_longitude": -73860547,
    "nycsr_building.nycsr_geographicaldistrictcode": "24",
    "nycsr_building.nycsr_buildingname": "P.S. 16 (OLD Q721 SPED) - QUEENS",
    "nycsr_locationsite.nycsr_sitename": "P.S. Q016 The Nancy DeBenedittis School - Q016 - Q721 - 24Q016 - 41-15 104 STREET"
  },
  {
    "@odata.etag": "W/\"328793529\"",
    "nycsr_admininterventiontype@OData.Community.Display.V1.FormattedValue": "Partial Classroom Quarantine",
    "nycsr_admininterventiontype": 882450001,
    "nycsr_caseid": "785e8777-1c22-ec11-b6e6-001dd8305f31",
    "nycsr_interventionenddate@OData.Community.Display.V1.FormattedValue": "10/9/2021",
    "nycsr_interventionenddate": "2021-10-09T04:00:00Z",
    "nycsr_casenumber": "054296",
    "nycsr_interventionstartdate@OData.Community.Display.V1.FormattedValue": "10/1/2021",
    "nycsr_interventionstartdate": "2021-10-01T04:00:00Z",
    "nycsr_building.nycsr_address": "465 NEW DORP LANE",
    "nycsr_building.nycsr_latitude@OData.Community.Display.V1.FormattedValue": "40,570,909.000000",
    "nycsr_building.nycsr_latitude": 40570909,
    "nycsr_building.nycsr_buildingid": "fb8521d0-32f4-ea11-b882-24ee9a37d45c",
    "nycsr_building.nycsr_borough@OData.Community.Display.V1.FormattedValue": "Staten Island",
    "nycsr_building.nycsr_borough": 882450004,
    "nycsr_building.nycsr_longitude@OData.Community.Display.V1.FormattedValue": "-74,105,878.000000",
    "nycsr_building.nycsr_longitude": -74105878,
    "nycsr_building.nycsr_geographicaldistrictcode": "31",
    "nycsr_building.nycsr_buildingname": "NEW DORP HS (NEW) - S. I.",
    "nycsr_locationsite.nycsr_sitename": "New Dorp High School - R440 - R435 - 31R440 - 465 NEW DORP LANE"
  },
  {
    "@odata.etag": "W/\"325739815\"",
    "nycsr_admininterventiontype@OData.Community.Display.V1.FormattedValue": "Partial Classroom Quarantine",
    "nycsr_admininterventiontype": 882450001,
    "nycsr_caseid": "4fd32b57-d61e-ec11-b6e6-001dd830657f",
    "nycsr_interventionenddate@OData.Community.Display.V1.FormattedValue": "10/4/2021",
    "nycsr_interventionenddate": "2021-10-04T04:00:00Z",
    "nycsr_casenumber": "052465",
    "nycsr_interventionstartdate@OData.Community.Display.V1.FormattedValue": "9/27/2021",
    "nycsr_interventionstartdate": "2021-09-27T04:00:00Z",
    "nycsr_building.nycsr_address": "465 NEW DORP LANE",
    "nycsr_building.nycsr_latitude@OData.Community.Display.V1.FormattedValue": "40,570,909.000000",
    "nycsr_building.nycsr_latitude": 40570909,
    "nycsr_building.nycsr_buildingid": "fb8521d0-32f4-ea11-b882-24ee9a37d45c",
    "nycsr_building.nycsr_borough@OData.Community.Display.V1.FormattedValue": "Staten Island",
    "nycsr_building.nycsr_borough": 882450004,
    "nycsr_building.nycsr_longitude@OData.Community.Display.V1.FormattedValue": "-74,105,878.000000",
    "nycsr_building.nycsr_longitude": -74105878,
    "nycsr_building.nycsr_geographicaldistrictcode": "31",
    "nycsr_building.nycsr_buildingname": "NEW DORP HS (NEW) - S. I.",
    "nycsr_locationsite.nycsr_sitename": "New Dorp High School - R440 - R435 - 31R440 - 465 NEW DORP LANE"
  },
  {
    "@odata.etag": "W/\"324596804\"",
    "nycsr_admininterventiontype@OData.Community.Display.V1.FormattedValue": "Classroom Closed",
    "nycsr_admininterventiontype": 882450000,
    "nycsr_caseid": "0d5bcfaa-da1e-ec11-b6e6-001dd830657f",
    "nycsr_interventionenddate@OData.Community.Display.V1.FormattedValue": "10/4/2021",
    "nycsr_interventionenddate": "2021-10-04T04:00:00Z",
    "nycsr_casenumber": "052471",
    "nycsr_interventionstartdate@OData.Community.Display.V1.FormattedValue": "9/27/2021",
    "nycsr_interventionstartdate": "2021-09-27T04:00:00Z",
    "nycsr_building.nycsr_address": "165 BROWN PLACE",
    "nycsr_building.nycsr_latitude@OData.Community.Display.V1.FormattedValue": "40,806,452.000000",
    "nycsr_building.nycsr_latitude": 40806452,
    "nycsr_building.nycsr_buildingid": "1803cefa-32f4-ea11-b882-24ee9a37d45c",
    "nycsr_building.nycsr_borough@OData.Community.Display.V1.FormattedValue": "Bronx",
    "nycsr_building.nycsr_borough": 882450001,
    "nycsr_building.nycsr_longitude@OData.Community.Display.V1.FormattedValue": "-73,921,593.000000",
    "nycsr_building.nycsr_longitude": -73921593,
    "nycsr_building.nycsr_geographicaldistrictcode": "7",
    "nycsr_building.nycsr_buildingname": "P.S. 43 - BRONX",
    "nycsr_locationsite.nycsr_sitename": "P.S. 043 Jonas Bronck - X043 - X043 - 07X043 - 165 BROWN PLACE"
  },
  {
    "@odata.etag": "W/\"324807669\"",
    "nycsr_admininterventiontype@OData.Community.Display.V1.FormattedValue": "Classroom Closed",
    "nycsr_admininterventiontype": 882450000,
    "nycsr_caseid": "edef12fe-dd1e-ec11-b6e6-001dd830657f",
    "nycsr_interventionenddate@OData.Community.Display.V1.FormattedValue": "10/4/2021",
    "nycsr_interventionenddate": "2021-10-04T04:00:00Z",
    "nycsr_casenumber": "052487",
    "nycsr_interventionstartdate@OData.Community.Display.V1.FormattedValue": "9/27/2021",
    "nycsr_interventionstartdate": "2021-09-27T04:00:00Z",
    "nycsr_building.nycsr_address": "25-05 37 AVENUE",
    "nycsr_building.nycsr_latitude@OData.Community.Display.V1.FormattedValue": "40,757,293.000000",
    "nycsr_building.nycsr_latitude": 40757293,
    "nycsr_building.nycsr_buildingid": "c32ff20c-32f4-ea11-b882-24ee9a37d45c",
    "nycsr_building.nycsr_borough@OData.Community.Display.V1.FormattedValue": "Queens",
    "nycsr_building.nycsr_borough": 882450003,
    "nycsr_building.nycsr_longitude@OData.Community.Display.V1.FormattedValue": "-73,933,562.000000",
    "nycsr_building.nycsr_longitude": -73933562,
    "nycsr_building.nycsr_geographicaldistrictcode": "30",
    "nycsr_building.nycsr_buildingname": "P.S. 112 - QUEENS",
    "nycsr_locationsite.nycsr_sitename": "P.S. 112 Dutch Kills - Q112 - Q112 - 30Q112 - 25-05 37 AVENUE"
  },
  {
    "@odata.etag": "W/\"324595472\"",
    "nycsr_admininterventiontype@OData.Community.Display.V1.FormattedValue": "Classroom Closed",
    "nycsr_admininterventiontype": 882450000,
    "nycsr_caseid": "11a27877-df1e-ec11-b6e6-001dd830657f",
    "nycsr_interventionenddate@OData.Community.Display.V1.FormattedValue": "10/2/2021",
    "nycsr_interventionenddate": "2021-10-02T04:00:00Z",
    "nycsr_casenumber": "052492",
    "nycsr_interventionstartdate@OData.Community.Display.V1.FormattedValue": "9/27/2021",
    "nycsr_interventionstartdate": "2021-09-27T04:00:00Z",
    "nycsr_building.nycsr_address": "1573 MADISON AVENUE",
    "nycsr_building.nycsr_latitude@OData.Community.Display.V1.FormattedValue": "40,793,649.000000",
    "nycsr_building.nycsr_latitude": 40793649,
    "nycsr_building.nycsr_buildingid": "98886843-31f4-ea11-b882-24ee9a37d45c",
    "nycsr_building.nycsr_borough@OData.Community.Display.V1.FormattedValue": "Manhattan",
    "nycsr_building.nycsr_borough": 882450000,
    "nycsr_building.nycsr_longitude@OData.Community.Display.V1.FormattedValue": "-73,948,488.000000",
    "nycsr_building.nycsr_longitude": -73948488,
    "nycsr_building.nycsr_geographicaldistrictcode": "4",
    "nycsr_building.nycsr_buildingname": "I.S. 13 - MANHATTAN",
    "nycsr_locationsite.nycsr_sitename": "East Harlem Scholars Academy Charter School II - M168 - M013 - 84M168 - 1573 MADISON AVENUE"
  },
  {
    "@odata.etag": "W/\"324866148\"",
    "nycsr_admininterventiontype@OData.Community.Display.V1.FormattedValue": "Classroom Closed",
    "nycsr_admininterventiontype": 882450000,
    "nycsr_caseid": "d36bdf06-e01e-ec11-b6e6-001dd830657f",
    "nycsr_interventionenddate@OData.Community.Display.V1.FormattedValue": "10/2/2021",
    "nycsr_interventionenddate": "2021-10-02T04:00:00Z",
    "nycsr_casenumber": "052499",
    "nycsr_interventionstartdate@OData.Community.Display.V1.FormattedValue": "9/27/2021",
    "nycsr_interventionstartdate": "2021-09-27T04:00:00Z",
    "nycsr_building.nycsr_address": "1573 MADISON AVENUE",
    "nycsr_building.nycsr_latitude@OData.Community.Display.V1.FormattedValue": "40,793,649.000000",
    "nycsr_building.nycsr_latitude": 40793649,
    "nycsr_building.nycsr_buildingid": "98886843-31f4-ea11-b882-24ee9a37d45c",
    "nycsr_building.nycsr_borough@OData.Community.Display.V1.FormattedValue": "Manhattan",
    "nycsr_building.nycsr_borough": 882450000,
    "nycsr_building.nycsr_longitude@OData.Community.Display.V1.FormattedValue": "-73,948,488.000000",
    "nycsr_building.nycsr_longitude": -73948488,
    "nycsr_building.nycsr_geographicaldistrictcode": "4",
    "nycsr_building.nycsr_buildingname": "I.S. 13 - MANHATTAN",
    "nycsr_locationsite.nycsr_sitename": "East Harlem Scholars Academy Charter School II - M168 - M013 - 84M168 - 1573 MADISON AVENUE"
  },
  {
    "@odata.etag": "W/\"325502216\"",
    "nycsr_admininterventiontype@OData.Community.Display.V1.FormattedValue": "Classroom Closed",
    "nycsr_admininterventiontype": 882450000,
    "nycsr_caseid": "2ad4bbb6-e01e-ec11-b6e6-001dd830657f",
    "nycsr_interventionenddate@OData.Community.Display.V1.FormattedValue": "10/2/2021",
    "nycsr_interventionenddate": "2021-10-02T04:00:00Z",
    "nycsr_casenumber": "052503",
    "nycsr_interventionstartdate@OData.Community.Display.V1.FormattedValue": "9/27/2021",
    "nycsr_interventionstartdate": "2021-09-27T04:00:00Z",
    "nycsr_building.nycsr_address": "1573 MADISON AVENUE",
    "nycsr_building.nycsr_latitude@OData.Community.Display.V1.FormattedValue": "40,793,649.000000",
    "nycsr_building.nycsr_latitude": 40793649,
    "nycsr_building.nycsr_buildingid": "98886843-31f4-ea11-b882-24ee9a37d45c",
    "nycsr_building.nycsr_borough@OData.Community.Display.V1.FormattedValue": "Manhattan",
    "nycsr_building.nycsr_borough": 882450000,
    "nycsr_building.nycsr_longitude@OData.Community.Display.V1.FormattedValue": "-73,948,488.000000",
    "nycsr_building.nycsr_longitude": -73948488,
    "nycsr_building.nycsr_geographicaldistrictcode": "4",
    "nycsr_building.nycsr_buildingname": "I.S. 13 - MANHATTAN",
    "nycsr_locationsite.nycsr_sitename": "East Harlem Scholars Academy Charter School II - M168 - M013 - 84M168 - 1573 MADISON AVENUE"
  },
  {
    "@odata.etag": "W/\"324663688\"",
    "nycsr_admininterventiontype@OData.Community.Display.V1.FormattedValue": "Classroom Closed",
    "nycsr_admininterventiontype": 882450000,
    "nycsr_caseid": "3a47f37a-e11e-ec11-b6e6-001dd830657f",
    "nycsr_interventionenddate@OData.Community.Display.V1.FormattedValue": "10/1/2021",
    "nycsr_interventionenddate": "2021-10-01T04:00:00Z",
    "nycsr_casenumber": "052508",
    "nycsr_interventionstartdate@OData.Community.Display.V1.FormattedValue": "9/27/2021",
    "nycsr_interventionstartdate": "2021-09-27T04:00:00Z",
    "nycsr_building.nycsr_address": "1573 MADISON AVENUE",
    "nycsr_building.nycsr_latitude@OData.Community.Display.V1.FormattedValue": "40,793,649.000000",
    "nycsr_building.nycsr_latitude": 40793649,
    "nycsr_building.nycsr_buildingid": "98886843-31f4-ea11-b882-24ee9a37d45c",
    "nycsr_building.nycsr_borough@OData.Community.Display.V1.FormattedValue": "Manhattan",
    "nycsr_building.nycsr_borough": 882450000,
    "nycsr_building.nycsr_longitude@OData.Community.Display.V1.FormattedValue": "-73,948,488.000000",
    "nycsr_building.nycsr_longitude": -73948488,
    "nycsr_building.nycsr_geographicaldistrictcode": "4",
    "nycsr_building.nycsr_buildingname": "I.S. 13 - MANHATTAN",
    "nycsr_locationsite.nycsr_sitename": "East Harlem Scholars Academy Charter School II - M168 - M013 - 84M168 - 1573 MADISON AVENUE"
  },
  {
    "@odata.etag": "W/\"324660629\"",
    "nycsr_admininterventiontype@OData.Community.Display.V1.FormattedValue": "Classroom Closed",
    "nycsr_admininterventiontype": 882450000,
    "nycsr_caseid": "477a2727-e21e-ec11-b6e6-001dd830657f",
    "nycsr_interventionenddate@OData.Community.Display.V1.FormattedValue": "10/2/2021",
    "nycsr_interventionenddate": "2021-10-02T04:00:00Z",
    "nycsr_casenumber": "052512",
    "nycsr_interventionstartdate@OData.Community.Display.V1.FormattedValue": "9/27/2021",
    "nycsr_interventionstartdate": "2021-09-27T04:00:00Z",
    "nycsr_building.nycsr_address": "1573 MADISON AVENUE",
    "nycsr_building.nycsr_latitude@OData.Community.Display.V1.FormattedValue": "40,793,649.000000",
    "nycsr_building.nycsr_latitude": 40793649,
    "nycsr_building.nycsr_buildingid": "98886843-31f4-ea11-b882-24ee9a37d45c",
    "nycsr_building.nycsr_borough@OData.Community.Display.V1.FormattedValue": "Manhattan",
    "nycsr_building.nycsr_borough": 882450000,
    "nycsr_building.nycsr_longitude@OData.Community.Display.V1.FormattedValue": "-73,948,488.000000",
    "nycsr_building.nycsr_longitude": -73948488,
    "nycsr_building.nycsr_geographicaldistrictcode": "4",
    "nycsr_building.nycsr_buildingname": "I.S. 13 - MANHATTAN",
    "nycsr_locationsite.nycsr_sitename": "East Harlem Scholars Academy Charter School II - M168 - M013 - 84M168 - 1573 MADISON AVENUE"
  },
  {
    "@odata.etag": "W/\"325766847\"",
    "nycsr_admininterventiontype@OData.Community.Display.V1.FormattedValue": "Classroom Closed",
    "nycsr_admininterventiontype": 882450000,
    "nycsr_caseid": "3d2484dc-e21e-ec11-b6e6-001dd830657f",
    "nycsr_interventionenddate@OData.Community.Display.V1.FormattedValue": "10/3/2021",
    "nycsr_interventionenddate": "2021-10-03T04:00:00Z",
    "nycsr_casenumber": "052515",
    "nycsr_interventionstartdate@OData.Community.Display.V1.FormattedValue": "9/27/2021",
    "nycsr_interventionstartdate": "2021-09-27T04:00:00Z",
    "nycsr_building.nycsr_address": "1573 MADISON AVENUE",
    "nycsr_building.nycsr_latitude@OData.Community.Display.V1.FormattedValue": "40,793,649.000000",
    "nycsr_building.nycsr_latitude": 40793649,
    "nycsr_building.nycsr_buildingid": "98886843-31f4-ea11-b882-24ee9a37d45c",
    "nycsr_building.nycsr_borough@OData.Community.Display.V1.FormattedValue": "Manhattan",
    "nycsr_building.nycsr_borough": 882450000,
    "nycsr_building.nycsr_longitude@OData.Community.Display.V1.FormattedValue": "-73,948,488.000000",
    "nycsr_building.nycsr_longitude": -73948488,
    "nycsr_building.nycsr_geographicaldistrictcode": "4",
    "nycsr_building.nycsr_buildingname": "I.S. 13 - MANHATTAN",
    "nycsr_locationsite.nycsr_sitename": "East Harlem Scholars Academy Charter School II - M168 - M013 - 84M168 - 1573 MADISON AVENUE"
  },
  {
    "@odata.etag": "W/\"325860766\"",
    "nycsr_admininterventiontype@OData.Community.Display.V1.FormattedValue": "Partial Classroom Quarantine",
    "nycsr_admininterventiontype": 882450001,
    "nycsr_caseid": "5bae2477-e31e-ec11-b6e6-001dd830657f",
    "nycsr_interventionenddate@OData.Community.Display.V1.FormattedValue": "10/3/2021",
    "nycsr_interventionenddate": "2021-10-03T04:00:00Z",
    "nycsr_casenumber": "052519",
    "nycsr_interventionstartdate@OData.Community.Display.V1.FormattedValue": "9/28/2021",
    "nycsr_interventionstartdate": "2021-09-28T04:00:00Z",
    "nycsr_building.nycsr_address": "1573 MADISON AVENUE",
    "nycsr_building.nycsr_latitude@OData.Community.Display.V1.FormattedValue": "40,793,649.000000",
    "nycsr_building.nycsr_latitude": 40793649,
    "nycsr_building.nycsr_buildingid": "98886843-31f4-ea11-b882-24ee9a37d45c",
    "nycsr_building.nycsr_borough@OData.Community.Display.V1.FormattedValue": "Manhattan",
    "nycsr_building.nycsr_borough": 882450000,
    "nycsr_building.nycsr_longitude@OData.Community.Display.V1.FormattedValue": "-73,948,488.000000",
    "nycsr_building.nycsr_longitude": -73948488,
    "nycsr_building.nycsr_geographicaldistrictcode": "4",
    "nycsr_building.nycsr_buildingname": "I.S. 13 - MANHATTAN",
    "nycsr_locationsite.nycsr_sitename": "East Harlem Scholars Academy Charter School II - M168 - M013 - 84M168 - 1573 MADISON AVENUE"
  },
  {
    "@odata.etag": "W/\"324595704\"",
    "nycsr_admininterventiontype@OData.Community.Display.V1.FormattedValue": "Classroom Closed",
    "nycsr_admininterventiontype": 882450000,
    "nycsr_caseid": "66c9593d-ee1e-ec11-b6e6-001dd830657f",
    "nycsr_interventionenddate@OData.Community.Display.V1.FormattedValue": "10/3/2021",
    "nycsr_interventionenddate": "2021-10-03T04:00:00Z",
    "nycsr_casenumber": "052552",
    "nycsr_interventionstartdate@OData.Community.Display.V1.FormattedValue": "9/27/2021",
    "nycsr_interventionstartdate": "2021-09-27T04:00:00Z",
    "nycsr_building.nycsr_address": "147-36 26 AVENUE",
    "nycsr_building.nycsr_latitude@OData.Community.Display.V1.FormattedValue": "40,774,134.000000",
    "nycsr_building.nycsr_latitude": 40774134,
    "nycsr_building.nycsr_buildingid": "adfc24e8-31f4-ea11-b882-24ee9a37d45c",
    "nycsr_building.nycsr_borough@OData.Community.Display.V1.FormattedValue": "Queens",
    "nycsr_building.nycsr_borough": 882450003,
    "nycsr_building.nycsr_longitude@OData.Community.Display.V1.FormattedValue": "-73,818,581.000000",
    "nycsr_building.nycsr_longitude": -73818581,
    "nycsr_building.nycsr_geographicaldistrictcode": "25",
    "nycsr_building.nycsr_buildingname": "P.S. 21 - QUEENS",
    "nycsr_locationsite.nycsr_sitename": "P.S. 021 Edward Hart - Q021 - Q021 - 25Q021 - 147-36 26 AVENUE"
  },
  {
    "@odata.etag": "W/\"325465784\"",
    "nycsr_admininterventiontype@OData.Community.Display.V1.FormattedValue": "Classroom Closed",
    "nycsr_admininterventiontype": 882450000,
    "nycsr_caseid": "15a8e64c-f41e-ec11-b6e6-001dd830657f",
    "nycsr_interventionenddate@OData.Community.Display.V1.FormattedValue": "10/1/2021",
    "nycsr_interventionenddate": "2021-10-01T04:00:00Z",
    "nycsr_casenumber": "052565",
    "nycsr_interventionstartdate@OData.Community.Display.V1.FormattedValue": "9/27/2021",
    "nycsr_interventionstartdate": "2021-09-27T04:00:00Z",
    "nycsr_building.nycsr_address": "330 RUGBY ROAD",
    "nycsr_building.nycsr_latitude@OData.Community.Display.V1.FormattedValue": "40,641,340.000000",
    "nycsr_building.nycsr_latitude": 40641340,
    "nycsr_building.nycsr_buildingid": "cad27c6d-30f4-ea11-b882-24ee9a37d45c",
    "nycsr_building.nycsr_borough@OData.Community.Display.V1.FormattedValue": "Brooklyn",
    "nycsr_building.nycsr_borough": 882450002,
    "nycsr_building.nycsr_longitude@OData.Community.Display.V1.FormattedValue": "-73,965,862.000000",
    "nycsr_building.nycsr_longitude": -73965862,
    "nycsr_building.nycsr_geographicaldistrictcode": "22",
    "nycsr_building.nycsr_buildingname": "P.S. 139 - BROOKLYN",
    "nycsr_locationsite.nycsr_sitename": "P.S. 139 Alexine A. Fenty - K139 - K139 - 22K139 - 330 RUGBY ROAD"
  },
  {
    "@odata.etag": "W/\"324595770\"",
    "nycsr_admininterventiontype@OData.Community.Display.V1.FormattedValue": "Classroom Closed",
    "nycsr_admininterventiontype": 882450000,
    "nycsr_caseid": "ef283941-f61e-ec11-b6e6-001dd830657f",
    "nycsr_interventionenddate@OData.Community.Display.V1.FormattedValue": "10/3/2021",
    "nycsr_interventionenddate": "2021-10-03T04:00:00Z",
    "nycsr_casenumber": "052573",
    "nycsr_interventionstartdate@OData.Community.Display.V1.FormattedValue": "9/27/2021",
    "nycsr_interventionstartdate": "2021-09-27T04:00:00Z",
    "nycsr_building.nycsr_address": "2380 MARION AVENUE",
    "nycsr_building.nycsr_latitude@OData.Community.Display.V1.FormattedValue": "40,857,998.000000",
    "nycsr_building.nycsr_latitude": 40857998,
    "nycsr_building.nycsr_buildingid": "5145378b-4afb-ea11-b883-24ee9a37d459",
    "nycsr_building.nycsr_longitude@OData.Community.Display.V1.FormattedValue": "-73,895,287.000000",
    "nycsr_building.nycsr_longitude": -73895287,
    "nycsr_building.nycsr_geographicaldistrictcode": "10",
    "nycsr_building.nycsr_buildingname": "ROUND-THE-CLOCK NURSERY, INC.",
    "nycsr_locationsite.nycsr_sitename": "ROUND-THE-CLOCK NURSERY, INC. - XAPH - XAPH -  - 2380 MARION AVENUE"
  },
  {
    "@odata.etag": "W/\"325860982\"",
    "nycsr_admininterventiontype@OData.Community.Display.V1.FormattedValue": "Classroom Closed",
    "nycsr_admininterventiontype": 882450000,
    "nycsr_caseid": "20e17b3e-8d1f-ec11-b6e6-001dd830657f",
    "nycsr_interventionenddate@OData.Community.Display.V1.FormattedValue": "10/4/2021",
    "nycsr_interventionenddate": "2021-10-04T04:00:00Z",
    "nycsr_casenumber": "052650",
    "nycsr_interventionstartdate@OData.Community.Display.V1.FormattedValue": "9/28/2021",
    "nycsr_interventionstartdate": "2021-09-28T04:00:00Z",
    "nycsr_building.nycsr_address": "160 Beach   29 Street",
    "nycsr_building.nycsr_latitude@OData.Community.Display.V1.FormattedValue": "40,594,018.600000",
    "nycsr_building.nycsr_latitude": 40594018.6,
    "nycsr_building.nycsr_buildingid": "f2725f21-bb09-eb11-b884-24ee9a37d459",
    "nycsr_building.nycsr_longitude@OData.Community.Display.V1.FormattedValue": "-73,761,378.000000",
    "nycsr_building.nycsr_longitude": -73761378,
    "nycsr_building.nycsr_geographicaldistrictcode": "Q043",
    "nycsr_building.nycsr_buildingname": "PS 43 - FY 22",
    "nycsr_locationsite.nycsr_sitename": "DYCD - PS 43 - FY 22 - 99345-5 - 160 Beach   29 Street"
  },
  {
    "@odata.etag": "W/\"327279132\"",
    "nycsr_admininterventiontype@OData.Community.Display.V1.FormattedValue": "Partial Classroom Quarantine",
    "nycsr_admininterventiontype": 882450001,
    "nycsr_caseid": "c65952a8-901f-ec11-b6e6-001dd830657f",
    "nycsr_interventionenddate@OData.Community.Display.V1.FormattedValue": "10/4/2021",
    "nycsr_interventionenddate": "2021-10-04T04:00:00Z",
    "nycsr_casenumber": "052662",
    "nycsr_interventionstartdate@OData.Community.Display.V1.FormattedValue": "9/28/2021",
    "nycsr_interventionstartdate": "2021-09-28T04:00:00Z",
    "nycsr_building.nycsr_address": "33-09 35 AVENUE",
    "nycsr_building.nycsr_latitude@OData.Community.Display.V1.FormattedValue": "40,757,497.000000",
    "nycsr_building.nycsr_latitude": 40757497,
    "nycsr_building.nycsr_buildingid": "7a0e6e25-32f4-ea11-b882-24ee9a37d45c",
    "nycsr_building.nycsr_borough@OData.Community.Display.V1.FormattedValue": "Queens",
    "nycsr_building.nycsr_borough": 882450003,
    "nycsr_building.nycsr_longitude@OData.Community.Display.V1.FormattedValue": "-73,926,249.000000",
    "nycsr_building.nycsr_longitude": -73926249,
    "nycsr_building.nycsr_geographicaldistrictcode": "30",
    "nycsr_building.nycsr_buildingname": "P.S. 166 - QUEENS",
    "nycsr_locationsite.nycsr_sitename": "P.S. 166 Henry Gradstein - Q166 - Q166 - 30Q166 - 33-09 35 AVENUE"
  },
  {
    "@odata.etag": "W/\"326852263\"",
    "nycsr_admininterventiontype@OData.Community.Display.V1.FormattedValue": "Partial Classroom Quarantine",
    "nycsr_admininterventiontype": 882450001,
    "nycsr_caseid": "378ab5ae-931f-ec11-b6e6-001dd830657f",
    "nycsr_interventionenddate@OData.Community.Display.V1.FormattedValue": "10/3/2021",
    "nycsr_interventionenddate": "2021-10-03T04:00:00Z",
    "nycsr_casenumber": "052691",
    "nycsr_interventionstartdate@OData.Community.Display.V1.FormattedValue": "9/28/2021",
    "nycsr_interventionstartdate": "2021-09-28T04:00:00Z",
    "nycsr_building.nycsr_address": "1-35 57 Avenue",
    "nycsr_building.nycsr_latitude@OData.Community.Display.V1.FormattedValue": "40,738,864.000000",
    "nycsr_building.nycsr_latitude": 40738864,
    "nycsr_building.nycsr_buildingid": "8ca87f90-5a04-ec11-b8b4-24ee9a37d45c",
    "nycsr_building.nycsr_longitude@OData.Community.Display.V1.FormattedValue": "-73,960,836.000000",
    "nycsr_building.nycsr_longitude": -73960836,
    "nycsr_building.nycsr_geographicaldistrictcode": "30",
    "nycsr_building.nycsr_buildingname": "Hunters Point",
    "nycsr_locationsite.nycsr_sitename": "Hunters Point Elementary School - Q384 - Q375 - 30Q384 - 1-35 57 Avenue"
  },
  {
    "@odata.etag": "W/\"325861143\"",
    "nycsr_admininterventiontype@OData.Community.Display.V1.FormattedValue": "Classroom Closed",
    "nycsr_admininterventiontype": 882450000,
    "nycsr_caseid": "949defe0-931f-ec11-b6e6-001dd830657f",
    "nycsr_interventionenddate@OData.Community.Display.V1.FormattedValue": "10/3/2021",
    "nycsr_interventionenddate": "2021-10-03T04:00:00Z",
    "nycsr_casenumber": "052694",
    "nycsr_interventionstartdate@OData.Community.Display.V1.FormattedValue": "9/28/2021",
    "nycsr_interventionstartdate": "2021-09-28T04:00:00Z",
    "nycsr_building.nycsr_address": "101-33 124 STREET",
    "nycsr_building.nycsr_latitude@OData.Community.Display.V1.FormattedValue": "40,690,439.000000",
    "nycsr_building.nycsr_latitude": 40690439,
    "nycsr_building.nycsr_buildingid": "fb9b4c1f-32f4-ea11-b882-24ee9a37d45c",
    "nycsr_building.nycsr_borough@OData.Community.Display.V1.FormattedValue": "Queens",
    "nycsr_building.nycsr_borough": 882450003,
    "nycsr_building.nycsr_longitude@OData.Community.Display.V1.FormattedValue": "-73,821,080.000000",
    "nycsr_building.nycsr_longitude": -73821080,
    "nycsr_building.nycsr_geographicaldistrictcode": "28",
    "nycsr_building.nycsr_buildingname": "P.S. 161 - QUEENS",
    "nycsr_locationsite.nycsr_sitename": "P.S. 161 Arthur Ashe School - Q161 - Q161 - 28Q161 - 101-33 124 STREET"
  },
  {
    "@odata.etag": "W/\"326858078\"",
    "nycsr_admininterventiontype@OData.Community.Display.V1.FormattedValue": "Partial Classroom Quarantine",
    "nycsr_admininterventiontype": 882450001,
    "nycsr_caseid": "d7eec5e3-941f-ec11-b6e6-001dd830657f",
    "nycsr_interventionenddate@OData.Community.Display.V1.FormattedValue": "10/4/2021",
    "nycsr_interventionenddate": "2021-10-04T04:00:00Z",
    "nycsr_casenumber": "052699",
    "nycsr_interventionstartdate@OData.Community.Display.V1.FormattedValue": "9/28/2021",
    "nycsr_interventionstartdate": "2021-09-28T04:00:00Z",
    "nycsr_building.nycsr_address": "160 BEACH  29 STREET",
    "nycsr_building.nycsr_latitude@OData.Community.Display.V1.FormattedValue": "40,593,480.000000",
    "nycsr_building.nycsr_latitude": 40593480,
    "nycsr_building.nycsr_buildingid": "ee8442ee-31f4-ea11-b882-24ee9a37d45c",
    "nycsr_building.nycsr_borough@OData.Community.Display.V1.FormattedValue": "Queens",
    "nycsr_building.nycsr_borough": 882450003,
    "nycsr_building.nycsr_longitude@OData.Community.Display.V1.FormattedValue": "-73,761,086.000000",
    "nycsr_building.nycsr_longitude": -73761086,
    "nycsr_building.nycsr_geographicaldistrictcode": "27",
    "nycsr_building.nycsr_buildingname": "P.S. 43 - QUEENS",
    "nycsr_locationsite.nycsr_sitename": "P.S. 043 - Q043 - Q043 - 27Q043 - 160 BEACH  29 STREET"
  },
  {
    "@odata.etag": "W/\"326946151\"",
    "nycsr_admininterventiontype@OData.Community.Display.V1.FormattedValue": "Non-Classroom Quarantine",
    "nycsr_admininterventiontype": 882450003,
    "nycsr_caseid": "8e4e7065-961f-ec11-b6e6-001dd830657f",
    "nycsr_interventionenddate@OData.Community.Display.V1.FormattedValue": "10/4/2021",
    "nycsr_interventionenddate": "2021-10-04T04:00:00Z",
    "nycsr_casenumber": "052712",
    "nycsr_interventionstartdate@OData.Community.Display.V1.FormattedValue": "9/28/2021",
    "nycsr_interventionstartdate": "2021-09-28T04:00:00Z",
    "nycsr_building.nycsr_address": "162-02 HILLSIDE AVENUE",
    "nycsr_building.nycsr_latitude@OData.Community.Display.V1.FormattedValue": "40,708,204.000000",
    "nycsr_building.nycsr_latitude": 40708204,
    "nycsr_building.nycsr_buildingid": "39b4977a-32f4-ea11-b882-24ee9a37d45c",
    "nycsr_building.nycsr_borough@OData.Community.Display.V1.FormattedValue": "Queens",
    "nycsr_building.nycsr_borough": 882450003,
    "nycsr_building.nycsr_longitude@OData.Community.Display.V1.FormattedValue": "-73,799,532.000000",
    "nycsr_building.nycsr_longitude": -73799532,
    "nycsr_building.nycsr_geographicaldistrictcode": "28",
    "nycsr_building.nycsr_buildingname": "AUX. SERV. - JAMAICA LEARN CT - Q",
    "nycsr_locationsite.nycsr_sitename": "Pathways to Graduation - Q950 - Q595 - 79Q950 - 162-02 HILLSIDE AVENUE"
  },
  {
    "@odata.etag": "W/\"325861209\"",
    "nycsr_admininterventiontype@OData.Community.Display.V1.FormattedValue": "Non-Classroom Quarantine",
    "nycsr_admininterventiontype": 882450003,
    "nycsr_caseid": "98cc4312-981f-ec11-b6e6-001dd830657f",
    "nycsr_interventionenddate@OData.Community.Display.V1.FormattedValue": "10/4/2021",
    "nycsr_interventionenddate": "2021-10-04T04:00:00Z",
    "nycsr_casenumber": "052726",
    "nycsr_interventionstartdate@OData.Community.Display.V1.FormattedValue": "9/28/2021",
    "nycsr_interventionstartdate": "2021-09-28T04:00:00Z",
    "nycsr_building.nycsr_address": "549 AUDUBON AVENUE",
    "nycsr_building.nycsr_latitude@OData.Community.Display.V1.FormattedValue": "40,856,532.000000",
    "nycsr_building.nycsr_latitude": 40856532,
    "nycsr_building.nycsr_buildingid": "25a6ba98-31f4-ea11-b882-24ee9a37d45c",
    "nycsr_building.nycsr_borough@OData.Community.Display.V1.FormattedValue": "Manhattan",
    "nycsr_building.nycsr_borough": 882450000,
    "nycsr_building.nycsr_longitude@OData.Community.Display.V1.FormattedValue": "-73,926,060.000000",
    "nycsr_building.nycsr_longitude": -73926060,
    "nycsr_building.nycsr_geographicaldistrictcode": "6",
    "nycsr_building.nycsr_buildingname": "G. WASHINGTON HS EDUC. CAMPUS - M",
    "nycsr_locationsite.nycsr_sitename": "The College Academy - M462 - M465 - 06M462 - 549 AUDUBON AVENUE"
  },
  {
    "@odata.etag": "W/\"326856886\"",
    "nycsr_admininterventiontype@OData.Community.Display.V1.FormattedValue": "Partial Classroom Quarantine",
    "nycsr_admininterventiontype": 882450001,
    "nycsr_caseid": "2c25cf92-9a1f-ec11-b6e6-001dd830657f",
    "nycsr_interventionenddate@OData.Community.Display.V1.FormattedValue": "10/2/2021",
    "nycsr_interventionenddate": "2021-10-02T04:00:00Z",
    "nycsr_casenumber": "052752",
    "nycsr_interventionstartdate@OData.Community.Display.V1.FormattedValue": "9/28/2021",
    "nycsr_interventionstartdate": "2021-09-28T04:00:00Z",
    "nycsr_building.nycsr_address": "145 STANTON STREET",
    "nycsr_building.nycsr_latitude@OData.Community.Display.V1.FormattedValue": "40,720,040.000000",
    "nycsr_building.nycsr_latitude": 40720040,
    "nycsr_building.nycsr_buildingid": "29767649-31f4-ea11-b882-24ee9a37d45c",
    "nycsr_building.nycsr_borough@OData.Community.Display.V1.FormattedValue": "Manhattan",
    "nycsr_building.nycsr_borough": 882450000,
    "nycsr_building.nycsr_longitude@OData.Community.Display.V1.FormattedValue": "-73,986,038.000000",
    "nycsr_building.nycsr_longitude": -73986038,
    "nycsr_building.nycsr_geographicaldistrictcode": "1",
    "nycsr_building.nycsr_buildingname": "J.H.S. 25 - MANHATTAN",
    "nycsr_locationsite.nycsr_sitename": "School for Global Leaders - M378 - M025 - 01M378 - 145 STANTON STREET"
  },
  {
    "@odata.etag": "W/\"326855731\"",
    "nycsr_admininterventiontype@OData.Community.Display.V1.FormattedValue": "Partial Classroom Quarantine",
    "nycsr_admininterventiontype": 882450001,
    "nycsr_caseid": "c96e7bd0-9a1f-ec11-b6e6-001dd830657f",
    "nycsr_interventionenddate@OData.Community.Display.V1.FormattedValue": "10/4/2021",
    "nycsr_interventionenddate": "2021-10-04T04:00:00Z",
    "nycsr_casenumber": "052754",
    "nycsr_interventionstartdate@OData.Community.Display.V1.FormattedValue": "9/28/2021",
    "nycsr_interventionstartdate": "2021-09-28T04:00:00Z",
    "nycsr_building.nycsr_address": "67-25 51 ROAD",
    "nycsr_building.nycsr_latitude@OData.Community.Display.V1.FormattedValue": "40,734,682.000000",
    "nycsr_building.nycsr_latitude": 40734682,
    "nycsr_building.nycsr_buildingid": "0106003e-32f4-ea11-b882-24ee9a37d45c",
    "nycsr_building.nycsr_borough@OData.Community.Display.V1.FormattedValue": "Queens",
    "nycsr_building.nycsr_borough": 882450003,
    "nycsr_building.nycsr_longitude@OData.Community.Display.V1.FormattedValue": "-73,897,108.000000",
    "nycsr_building.nycsr_longitude": -73897108,
    "nycsr_building.nycsr_geographicaldistrictcode": "24",
    "nycsr_building.nycsr_buildingname": "P.S. 229 - QUEENS",
    "nycsr_locationsite.nycsr_sitename": "P.S. 229 Emanuel Kaplan - Q229 - Q229 - 24Q229 - 67-25 51 ROAD"
  },
  {
    "@odata.etag": "W/\"326856258\"",
    "nycsr_admininterventiontype@OData.Community.Display.V1.FormattedValue": "Partial Classroom Quarantine",
    "nycsr_admininterventiontype": 882450001,
    "nycsr_caseid": "9d5fe2fc-9b1f-ec11-b6e6-001dd830657f",
    "nycsr_interventionenddate@OData.Community.Display.V1.FormattedValue": "10/3/2021",
    "nycsr_interventionenddate": "2021-10-03T04:00:00Z",
    "nycsr_casenumber": "052762",
    "nycsr_interventionstartdate@OData.Community.Display.V1.FormattedValue": "9/28/2021",
    "nycsr_interventionstartdate": "2021-09-28T04:00:00Z",
    "nycsr_building.nycsr_address": "832 MARCY AVENUE",
    "nycsr_building.nycsr_latitude@OData.Community.Display.V1.FormattedValue": "40,684,654.000000",
    "nycsr_building.nycsr_latitude": 40684654,
    "nycsr_building.nycsr_buildingid": "050ae2e1-30f4-ea11-b882-24ee9a37d45c",
    "nycsr_building.nycsr_borough@OData.Community.Display.V1.FormattedValue": "Brooklyn",
    "nycsr_building.nycsr_borough": 882450002,
    "nycsr_building.nycsr_longitude@OData.Community.Display.V1.FormattedValue": "-73,947,873.000000",
    "nycsr_building.nycsr_longitude": -73947873,
    "nycsr_building.nycsr_geographicaldistrictcode": "13",
    "nycsr_building.nycsr_buildingname": "BOYS HS (OLD) - K",
    "nycsr_locationsite.nycsr_sitename": "Leadership Prep Bedford Stuyvesant Uncommon Prep Charter School - K517 - K458 - 84K517 - 832 MARCY AVENUE"
  },
  {
    "@odata.etag": "W/\"328133718\"",
    "nycsr_admininterventiontype@OData.Community.Display.V1.FormattedValue": "Partial Classroom Quarantine",
    "nycsr_admininterventiontype": 882450001,
    "nycsr_caseid": "df982365-9e1f-ec11-b6e6-001dd830657f",
    "nycsr_interventionenddate@OData.Community.Display.V1.FormattedValue": "10/1/2021",
    "nycsr_interventionenddate": "2021-10-01T04:00:00Z",
    "nycsr_casenumber": "052788",
    "nycsr_interventionstartdate@OData.Community.Display.V1.FormattedValue": "9/29/2021",
    "nycsr_interventionstartdate": "2021-09-29T04:00:00Z",
    "nycsr_building.nycsr_address": "99 TERRACE VIEW AVENUE",
    "nycsr_building.nycsr_latitude@OData.Community.Display.V1.FormattedValue": "40,877,379.000000",
    "nycsr_building.nycsr_latitude": 40877379,
    "nycsr_building.nycsr_buildingid": "9853dd74-33f4-ea11-b882-24ee9a37d45c",
    "nycsr_building.nycsr_borough@OData.Community.Display.V1.FormattedValue": "Bronx",
    "nycsr_building.nycsr_borough": 882450001,
    "nycsr_building.nycsr_longitude@OData.Community.Display.V1.FormattedValue": "-73,912,686.000000",
    "nycsr_building.nycsr_longitude": -73912686,
    "nycsr_building.nycsr_geographicaldistrictcode": "10",
    "nycsr_building.nycsr_buildingname": "JOHN F. KENNEDY HS - X",
    "nycsr_locationsite.nycsr_sitename": "Marble Hill High School for International Studies - X477 - X475 - 10X477 - 99 TERRACE VIEW AVENUE"
  },
  {
    "@odata.etag": "W/\"325861420\"",
    "nycsr_admininterventiontype@OData.Community.Display.V1.FormattedValue": "Classroom Closed",
    "nycsr_admininterventiontype": 882450000,
    "nycsr_caseid": "7c011534-9f1f-ec11-b6e6-001dd830657f",
    "nycsr_interventionenddate@OData.Community.Display.V1.FormattedValue": "10/3/2021",
    "nycsr_interventionenddate": "2021-10-03T04:00:00Z",
    "nycsr_casenumber": "052795",
    "nycsr_interventionstartdate@OData.Community.Display.V1.FormattedValue": "9/28/2021",
    "nycsr_interventionstartdate": "2021-09-28T04:00:00Z",
    "nycsr_building.nycsr_address": "330 ALABAMA AVENUE",
    "nycsr_building.nycsr_latitude@OData.Community.Display.V1.FormattedValue": "40,667,985.000000",
    "nycsr_building.nycsr_latitude": 40667985,
    "nycsr_building.nycsr_buildingid": "0ca198c3-30f4-ea11-b882-24ee9a37d45c",
    "nycsr_building.nycsr_borough@OData.Community.Display.V1.FormattedValue": "Brooklyn",
    "nycsr_building.nycsr_borough": 882450002,
    "nycsr_building.nycsr_longitude@OData.Community.Display.V1.FormattedValue": "-73,898,249.000000",
    "nycsr_building.nycsr_longitude": -73898249,
    "nycsr_building.nycsr_geographicaldistrictcode": "19",
    "nycsr_building.nycsr_buildingname": "P.S. 328 - BROOKLYN",
    "nycsr_locationsite.nycsr_sitename": "Hyde Leadership Charter School- Brooklyn - K769 - K328 - 84K769 - 330 ALABAMA AVENUE"
  },
  {
    "@odata.etag": "W/\"327679627\"",
    "nycsr_admininterventiontype@OData.Community.Display.V1.FormattedValue": "Classroom Closed",
    "nycsr_admininterventiontype": 882450000,
    "nycsr_caseid": "61753c57-a01f-ec11-b6e6-001dd830657f",
    "nycsr_interventionenddate@OData.Community.Display.V1.FormattedValue": "10/7/2021",
    "nycsr_interventionenddate": "2021-10-07T04:00:00Z",
    "nycsr_casenumber": "052806",
    "nycsr_interventionstartdate@OData.Community.Display.V1.FormattedValue": "9/28/2021",
    "nycsr_interventionstartdate": "2021-09-28T04:00:00Z",
    "nycsr_building.nycsr_address": "126-22 150TH STREET",
    "nycsr_building.nycsr_latitude@OData.Community.Display.V1.FormattedValue": "40,672,379.000000",
    "nycsr_building.nycsr_latitude": 40672379,
    "nycsr_building.nycsr_buildingid": "4c332a24-4afb-ea11-b883-24ee9a37d459",
    "nycsr_building.nycsr_longitude@OData.Community.Display.V1.FormattedValue": "-73,788,713.000000",
    "nycsr_building.nycsr_longitude": -73788713,
    "nycsr_building.nycsr_geographicaldistrictcode": "27",
    "nycsr_building.nycsr_buildingname": "SUNSHINE DEVELOPMENTAL SCHOOL",
    "nycsr_locationsite.nycsr_sitename": "Sunshine Developmental School - QANH - QANH -  - 126-22 150TH STREET"
  },
  {
    "@odata.etag": "W/\"327198851\"",
    "nycsr_admininterventiontype@OData.Community.Display.V1.FormattedValue": "Partial Classroom Quarantine",
    "nycsr_admininterventiontype": 882450001,
    "nycsr_caseid": "d3907793-a21f-ec11-b6e6-001dd830657f",
    "nycsr_interventionenddate@OData.Community.Display.V1.FormattedValue": "10/4/2021",
    "nycsr_interventionenddate": "2021-10-04T04:00:00Z",
    "nycsr_casenumber": "052840",
    "nycsr_interventionstartdate@OData.Community.Display.V1.FormattedValue": "9/29/2021",
    "nycsr_interventionstartdate": "2021-09-29T04:00:00Z",
    "nycsr_building.nycsr_address": "2100 LAFONTAINE AVENUE",
    "nycsr_building.nycsr_latitude@OData.Community.Display.V1.FormattedValue": "40,850,131.000000",
    "nycsr_building.nycsr_latitude": 40850131,
    "nycsr_building.nycsr_buildingid": "049ebaee-32f4-ea11-b882-24ee9a37d45c",
    "nycsr_building.nycsr_borough@OData.Community.Display.V1.FormattedValue": "Bronx",
    "nycsr_building.nycsr_borough": 882450001,
    "nycsr_building.nycsr_longitude@OData.Community.Display.V1.FormattedValue": "-73,891,630.000000",
    "nycsr_building.nycsr_longitude": -73891630,
    "nycsr_building.nycsr_geographicaldistrictcode": "10",
    "nycsr_building.nycsr_buildingname": "P.S. 3 - BRONX",
    "nycsr_locationsite.nycsr_sitename": "P.S. 3 Raul Julia Micro Society - X003 - X003 - 10X003 - 2100 LAFONTAINE AVENUE"
  },
  {
    "@odata.etag": "W/\"327131123\"",
    "nycsr_admininterventiontype@OData.Community.Display.V1.FormattedValue": "Partial Classroom Quarantine",
    "nycsr_admininterventiontype": 882450001,
    "nycsr_caseid": "42e0925b-a31f-ec11-b6e6-001dd830657f",
    "nycsr_interventionenddate@OData.Community.Display.V1.FormattedValue": "10/2/2021",
    "nycsr_interventionenddate": "2021-10-02T04:00:00Z",
    "nycsr_casenumber": "052852",
    "nycsr_interventionstartdate@OData.Community.Display.V1.FormattedValue": "9/28/2021",
    "nycsr_interventionstartdate": "2021-09-28T04:00:00Z",
    "nycsr_building.nycsr_address": "1025 MORRISON AVENUE",
    "nycsr_building.nycsr_latitude@OData.Community.Display.V1.FormattedValue": "40,824,989.000000",
    "nycsr_building.nycsr_latitude": 40824989,
    "nycsr_building.nycsr_buildingid": "2378931f-33f4-ea11-b882-24ee9a37d45c",
    "nycsr_building.nycsr_borough@OData.Community.Display.V1.FormattedValue": "Bronx",
    "nycsr_building.nycsr_borough": 882450001,
    "nycsr_building.nycsr_longitude@OData.Community.Display.V1.FormattedValue": "-73,874,162.000000",
    "nycsr_building.nycsr_longitude": -73874162,
    "nycsr_building.nycsr_geographicaldistrictcode": "8",
    "nycsr_building.nycsr_buildingname": "I.S. 123 - BRONX",
    "nycsr_locationsite.nycsr_sitename": "J.H.S. 123 James M. Kieran - X123 - X123 - 08X123 - 1025 MORRISON AVENUE"
  },
  {
    "@odata.etag": "W/\"325861546\"",
    "nycsr_admininterventiontype@OData.Community.Display.V1.FormattedValue": "Non-Classroom Quarantine",
    "nycsr_admininterventiontype": 882450003,
    "nycsr_caseid": "14fc74bd-a31f-ec11-b6e6-001dd830657f",
    "nycsr_interventionenddate@OData.Community.Display.V1.FormattedValue": "10/4/2021",
    "nycsr_interventionenddate": "2021-10-04T04:00:00Z",
    "nycsr_casenumber": "052858",
    "nycsr_interventionstartdate@OData.Community.Display.V1.FormattedValue": "9/28/2021",
    "nycsr_interventionstartdate": "2021-09-28T04:00:00Z",
    "nycsr_building.nycsr_address": "48-10 31 AVENUE",
    "nycsr_building.nycsr_latitude@OData.Community.Display.V1.FormattedValue": "40,757,072.000000",
    "nycsr_building.nycsr_latitude": 40757072,
    "nycsr_building.nycsr_buildingid": "d8b66262-32f4-ea11-b882-24ee9a37d45c",
    "nycsr_building.nycsr_borough@OData.Community.Display.V1.FormattedValue": "Queens",
    "nycsr_building.nycsr_borough": 882450003,
    "nycsr_building.nycsr_longitude@OData.Community.Display.V1.FormattedValue": "-73,911,165.000000",
    "nycsr_building.nycsr_longitude": -73911165,
    "nycsr_building.nycsr_geographicaldistrictcode": "30",
    "nycsr_building.nycsr_buildingname": "WILLIAM C. BRYANT HS - Q",
    "nycsr_locationsite.nycsr_sitename": "William Cullen Bryant High School - Q445 - Q445 - 30Q445 - 48-10 31 AVENUE"
  },
  {
    "@odata.etag": "W/\"325861551\"",
    "nycsr_admininterventiontype@OData.Community.Display.V1.FormattedValue": "Partial Classroom Quarantine",
    "nycsr_admininterventiontype": 882450001,
    "nycsr_caseid": "01be13e2-a31f-ec11-b6e6-001dd830657f",
    "nycsr_interventionenddate@OData.Community.Display.V1.FormattedValue": "10/7/2021",
    "nycsr_interventionenddate": "2021-10-07T04:00:00Z",
    "nycsr_casenumber": "052860",
    "nycsr_interventionstartdate@OData.Community.Display.V1.FormattedValue": "9/28/2021",
    "nycsr_interventionstartdate": "2021-09-28T04:00:00Z",
    "nycsr_building.nycsr_address": "180 7 AVENUE",
    "nycsr_building.nycsr_latitude@OData.Community.Display.V1.FormattedValue": "40,671,816.000000",
    "nycsr_building.nycsr_latitude": 40671816,
    "nycsr_building.nycsr_buildingid": "ade657bd-30f4-ea11-b882-24ee9a37d45c",
    "nycsr_building.nycsr_borough@OData.Community.Display.V1.FormattedValue": "Brooklyn",
    "nycsr_building.nycsr_borough": 882450002,
    "nycsr_building.nycsr_longitude@OData.Community.Display.V1.FormattedValue": "-73,978,633.000000",
    "nycsr_building.nycsr_longitude": -73978633,
    "nycsr_building.nycsr_geographicaldistrictcode": "15",
    "nycsr_building.nycsr_buildingname": "P.S. 321 - BROOKLYN",
    "nycsr_locationsite.nycsr_sitename": "P.S. 321 William Penn - K321 - K321 - 15K321 - 180 7 AVENUE"
  },
  {
    "@odata.etag": "W/\"325861556\"",
    "nycsr_admininterventiontype@OData.Community.Display.V1.FormattedValue": "Partial Classroom Quarantine",
    "nycsr_admininterventiontype": 882450001,
    "nycsr_caseid": "2ee78f3d-a41f-ec11-b6e6-001dd830657f",
    "nycsr_interventionenddate@OData.Community.Display.V1.FormattedValue": "10/4/2021",
    "nycsr_interventionenddate": "2021-10-04T04:00:00Z",
    "nycsr_casenumber": "052863",
    "nycsr_interventionstartdate@OData.Community.Display.V1.FormattedValue": "9/28/2021",
    "nycsr_interventionstartdate": "2021-09-28T04:00:00Z",
    "nycsr_building.nycsr_address": "48-10 31 AVENUE",
    "nycsr_building.nycsr_latitude@OData.Community.Display.V1.FormattedValue": "40,757,072.000000",
    "nycsr_building.nycsr_latitude": 40757072,
    "nycsr_building.nycsr_buildingid": "d8b66262-32f4-ea11-b882-24ee9a37d45c",
    "nycsr_building.nycsr_borough@OData.Community.Display.V1.FormattedValue": "Queens",
    "nycsr_building.nycsr_borough": 882450003,
    "nycsr_building.nycsr_longitude@OData.Community.Display.V1.FormattedValue": "-73,911,165.000000",
    "nycsr_building.nycsr_longitude": -73911165,
    "nycsr_building.nycsr_geographicaldistrictcode": "30",
    "nycsr_building.nycsr_buildingname": "WILLIAM C. BRYANT HS - Q",
    "nycsr_locationsite.nycsr_sitename": "William Cullen Bryant High School - Q445 - Q445 - 30Q445 - 48-10 31 AVENUE"
  },
  {
    "@odata.etag": "W/\"325861612\"",
    "nycsr_admininterventiontype@OData.Community.Display.V1.FormattedValue": "Classroom Closed",
    "nycsr_admininterventiontype": 882450000,
    "nycsr_caseid": "87fc8d1a-a61f-ec11-b6e6-001dd830657f",
    "nycsr_interventionenddate@OData.Community.Display.V1.FormattedValue": "10/4/2021",
    "nycsr_interventionenddate": "2021-10-04T04:00:00Z",
    "nycsr_casenumber": "052888",
    "nycsr_interventionstartdate@OData.Community.Display.V1.FormattedValue": "9/28/2021",
    "nycsr_interventionstartdate": "2021-09-28T04:00:00Z",
    "nycsr_building.nycsr_address": "134 WEST 122 STREET",
    "nycsr_building.nycsr_latitude@OData.Community.Display.V1.FormattedValue": "40,806,055.000000",
    "nycsr_building.nycsr_latitude": 40806055,
    "nycsr_building.nycsr_buildingid": "459f4974-31f4-ea11-b882-24ee9a37d45c",
    "nycsr_building.nycsr_borough@OData.Community.Display.V1.FormattedValue": "Manhattan",
    "nycsr_building.nycsr_borough": 882450000,
    "nycsr_building.nycsr_longitude@OData.Community.Display.V1.FormattedValue": "-73,948,385.000000",
    "nycsr_building.nycsr_longitude": -73948385,
    "nycsr_building.nycsr_geographicaldistrictcode": "3",
    "nycsr_building.nycsr_buildingname": "P.S. 242 (OLD P144) - MANHATTAN",
    "nycsr_locationsite.nycsr_sitename": "P.S. 242 - The Young Diplomats Magnet Academy - M242 - M144 - 03M242 - 134 WEST 122 STREET"
  },
  {
    "@odata.etag": "W/\"327134934\"",
    "nycsr_admininterventiontype@OData.Community.Display.V1.FormattedValue": "Partial Classroom Quarantine",
    "nycsr_admininterventiontype": 882450001,
    "nycsr_caseid": "02aa1932-a81f-ec11-b6e6-001dd830657f",
    "nycsr_interventionenddate@OData.Community.Display.V1.FormattedValue": "10/4/2021",
    "nycsr_interventionenddate": "2021-10-04T04:00:00Z",
    "nycsr_casenumber": "052912",
    "nycsr_interventionstartdate@OData.Community.Display.V1.FormattedValue": "9/28/2021",
    "nycsr_interventionstartdate": "2021-09-28T04:00:00Z",
    "nycsr_building.nycsr_address": "100 LUTEN AVENUE",
    "nycsr_building.nycsr_latitude@OData.Community.Display.V1.FormattedValue": "40,528,152.000000",
    "nycsr_building.nycsr_latitude": 40528152,
    "nycsr_building.nycsr_buildingid": "605b4cd6-32f4-ea11-b882-24ee9a37d45c",
    "nycsr_building.nycsr_borough@OData.Community.Display.V1.FormattedValue": "Staten Island",
    "nycsr_building.nycsr_borough": 882450004,
    "nycsr_building.nycsr_longitude@OData.Community.Display.V1.FormattedValue": "-74,193,431.000000",
    "nycsr_building.nycsr_longitude": -74193431,
    "nycsr_building.nycsr_geographicaldistrictcode": "31",
    "nycsr_building.nycsr_buildingname": "TOTTENVILLE HS - S. I.",
    "nycsr_locationsite.nycsr_sitename": "Tottenville High School - R455 - R455 - 31R455 - 100 LUTEN AVENUE"
  },
  {
    "@odata.etag": "W/\"327198861\"",
    "nycsr_admininterventiontype@OData.Community.Display.V1.FormattedValue": "Partial Classroom Quarantine",
    "nycsr_admininterventiontype": 882450001,
    "nycsr_caseid": "337758ca-a81f-ec11-b6e6-001dd830657f",
    "nycsr_interventionenddate@OData.Community.Display.V1.FormattedValue": "10/4/2021",
    "nycsr_interventionenddate": "2021-10-04T04:00:00Z",
    "nycsr_casenumber": "052918",
    "nycsr_interventionstartdate@OData.Community.Display.V1.FormattedValue": "9/29/2021",
    "nycsr_interventionstartdate": "2021-09-29T04:00:00Z",
    "nycsr_building.nycsr_address": "349 CABRINI BOULEVARD",
    "nycsr_building.nycsr_latitude@OData.Community.Display.V1.FormattedValue": "40,856,239.000000",
    "nycsr_building.nycsr_latitude": 40856239,
    "nycsr_building.nycsr_buildingid": "59507380-31f4-ea11-b882-24ee9a37d45c",
    "nycsr_building.nycsr_borough@OData.Community.Display.V1.FormattedValue": "Manhattan",
    "nycsr_building.nycsr_borough": 882450000,
    "nycsr_building.nycsr_longitude@OData.Community.Display.V1.FormattedValue": "-73,936,840.000000",
    "nycsr_building.nycsr_longitude": -73936840,
    "nycsr_building.nycsr_geographicaldistrictcode": "6",
    "nycsr_building.nycsr_buildingname": "P.S./I.S. 187 - MANHATTAN",
    "nycsr_locationsite.nycsr_sitename": "P.S./I.S. 187 Hudson Cliffs - M187 - M187 - 06M187 - 349 CABRINI BOULEVARD"
  },
  {
    "@odata.etag": "W/\"326025604\"",
    "nycsr_admininterventiontype@OData.Community.Display.V1.FormattedValue": "Classroom Closed",
    "nycsr_admininterventiontype": 882450000,
    "nycsr_caseid": "c7919a45-aa1f-ec11-b6e6-001dd830657f",
    "nycsr_interventionenddate@OData.Community.Display.V1.FormattedValue": "10/1/2021",
    "nycsr_interventionenddate": "2021-10-01T04:00:00Z",
    "nycsr_casenumber": "052933",
    "nycsr_interventionstartdate@OData.Community.Display.V1.FormattedValue": "9/28/2021",
    "nycsr_interventionstartdate": "2021-09-28T04:00:00Z",
    "nycsr_building.nycsr_address": "980 MACE AVENUE",
    "nycsr_building.nycsr_latitude@OData.Community.Display.V1.FormattedValue": "40,862,481.000000",
    "nycsr_building.nycsr_latitude": 40862481,
    "nycsr_building.nycsr_buildingid": "22474313-33f4-ea11-b882-24ee9a37d45c",
    "nycsr_building.nycsr_borough@OData.Community.Display.V1.FormattedValue": "Bronx",
    "nycsr_building.nycsr_borough": 882450001,
    "nycsr_building.nycsr_longitude@OData.Community.Display.V1.FormattedValue": "-73,859,254.000000",
    "nycsr_building.nycsr_longitude": -73859254,
    "nycsr_building.nycsr_geographicaldistrictcode": "11",
    "nycsr_building.nycsr_buildingname": "P.S. 89 - BRONX",
    "nycsr_locationsite.nycsr_sitename": "P.S. 089 Bronx - X089 - X089 - 11X089 - 980 MACE AVENUE"
  },
  {
    "@odata.etag": "W/\"327198871\"",
    "nycsr_admininterventiontype@OData.Community.Display.V1.FormattedValue": "Partial Classroom Quarantine",
    "nycsr_admininterventiontype": 882450001,
    "nycsr_caseid": "25199ff1-aa1f-ec11-b6e6-001dd830657f",
    "nycsr_interventionenddate@OData.Community.Display.V1.FormattedValue": "10/4/2021",
    "nycsr_interventionenddate": "2021-10-04T04:00:00Z",
    "nycsr_casenumber": "052941",
    "nycsr_interventionstartdate@OData.Community.Display.V1.FormattedValue": "9/29/2021",
    "nycsr_interventionstartdate": "2021-09-29T04:00:00Z",
    "nycsr_building.nycsr_address": "349 CABRINI BOULEVARD",
    "nycsr_building.nycsr_latitude@OData.Community.Display.V1.FormattedValue": "40,856,239.000000",
    "nycsr_building.nycsr_latitude": 40856239,
    "nycsr_building.nycsr_buildingid": "59507380-31f4-ea11-b882-24ee9a37d45c",
    "nycsr_building.nycsr_borough@OData.Community.Display.V1.FormattedValue": "Manhattan",
    "nycsr_building.nycsr_borough": 882450000,
    "nycsr_building.nycsr_longitude@OData.Community.Display.V1.FormattedValue": "-73,936,840.000000",
    "nycsr_building.nycsr_longitude": -73936840,
    "nycsr_building.nycsr_geographicaldistrictcode": "6",
    "nycsr_building.nycsr_buildingname": "P.S./I.S. 187 - MANHATTAN",
    "nycsr_locationsite.nycsr_sitename": "DYCD - P.S./I.S. 187 Hudson Cliffs - 124305 - 349 CABRINI BOULEVARD"
  },
  {
    "@odata.etag": "W/\"327137604\"",
    "nycsr_admininterventiontype@OData.Community.Display.V1.FormattedValue": "Classroom Closed",
    "nycsr_admininterventiontype": 882450000,
    "nycsr_caseid": "adee8671-ac1f-ec11-b6e6-001dd830657f",
    "nycsr_interventionenddate@OData.Community.Display.V1.FormattedValue": "10/2/2021",
    "nycsr_interventionenddate": "2021-10-02T04:00:00Z",
    "nycsr_casenumber": "052952",
    "nycsr_interventionstartdate@OData.Community.Display.V1.FormattedValue": "9/28/2021",
    "nycsr_interventionstartdate": "2021-09-28T04:00:00Z",
    "nycsr_building.nycsr_address": "6006 23 AVENUE",
    "nycsr_building.nycsr_latitude@OData.Community.Display.V1.FormattedValue": "40,615,405.000000",
    "nycsr_building.nycsr_latitude": 40615405,
    "nycsr_building.nycsr_buildingid": "eb21d292-30f4-ea11-b882-24ee9a37d45c",
    "nycsr_building.nycsr_borough@OData.Community.Display.V1.FormattedValue": "Brooklyn",
    "nycsr_building.nycsr_borough": 882450002,
    "nycsr_building.nycsr_longitude@OData.Community.Display.V1.FormattedValue": "-73,977,099.000000",
    "nycsr_building.nycsr_longitude": -73977099,
    "nycsr_building.nycsr_geographicaldistrictcode": "21",
    "nycsr_building.nycsr_buildingname": "P.S. 226 - BROOKLYN",
    "nycsr_locationsite.nycsr_sitename": "P.S. 226 Alfred De B. Mason - K226 - K226 - 21K226 - 6006 23 AVENUE"
  },
  {
    "@odata.etag": "W/\"327198897\"",
    "nycsr_admininterventiontype@OData.Community.Display.V1.FormattedValue": "Partial Classroom Quarantine",
    "nycsr_admininterventiontype": 882450001,
    "nycsr_caseid": "36ef49a8-b11f-ec11-b6e6-001dd830657f",
    "nycsr_interventionenddate@OData.Community.Display.V1.FormattedValue": "10/4/2021",
    "nycsr_interventionenddate": "2021-10-04T04:00:00Z",
    "nycsr_casenumber": "052997",
    "nycsr_interventionstartdate@OData.Community.Display.V1.FormattedValue": "9/29/2021",
    "nycsr_interventionstartdate": "2021-09-29T04:00:00Z",
    "nycsr_building.nycsr_address": "4812 9TH AVENUE",
    "nycsr_building.nycsr_latitude@OData.Community.Display.V1.FormattedValue": "40,640,997.000000",
    "nycsr_building.nycsr_latitude": 40640997,
    "nycsr_building.nycsr_buildingid": "695bc58c-30f4-ea11-b882-24ee9a37d45c",
    "nycsr_building.nycsr_borough@OData.Community.Display.V1.FormattedValue": "Brooklyn",
    "nycsr_building.nycsr_borough": 882450002,
    "nycsr_building.nycsr_longitude@OData.Community.Display.V1.FormattedValue": "-74,001,250.000000",
    "nycsr_building.nycsr_longitude": -74001250,
    "nycsr_building.nycsr_geographicaldistrictcode": "20",
    "nycsr_building.nycsr_buildingname": "I.S. 220 - BROOKLYN",
    "nycsr_locationsite.nycsr_sitename": "J.H.S. 220 John J. Pershing - K220 - K220 - 20K220 - 4812 9TH AVENUE"
  },
  {
    "@odata.etag": "W/\"327145609\"",
    "nycsr_admininterventiontype@OData.Community.Display.V1.FormattedValue": "Partial Classroom Quarantine",
    "nycsr_admininterventiontype": 882450001,
    "nycsr_caseid": "ff0c2c0a-b21f-ec11-b6e6-001dd830657f",
    "nycsr_interventionenddate@OData.Community.Display.V1.FormattedValue": "10/4/2021",
    "nycsr_interventionenddate": "2021-10-04T04:00:00Z",
    "nycsr_casenumber": "053002",
    "nycsr_interventionstartdate@OData.Community.Display.V1.FormattedValue": "9/28/2021",
    "nycsr_interventionstartdate": "2021-09-28T04:00:00Z",
    "nycsr_building.nycsr_address": "2780 RESERVOIR AVENUE",
    "nycsr_building.nycsr_latitude@OData.Community.Display.V1.FormattedValue": "40,869,061.000000",
    "nycsr_building.nycsr_latitude": 40869061,
    "nycsr_building.nycsr_buildingid": "a13aa668-33f4-ea11-b882-24ee9a37d45c",
    "nycsr_building.nycsr_borough@OData.Community.Display.V1.FormattedValue": "Bronx",
    "nycsr_building.nycsr_borough": 882450001,
    "nycsr_building.nycsr_longitude@OData.Community.Display.V1.FormattedValue": "-73,897,066.000000",
    "nycsr_building.nycsr_longitude": -73897066,
    "nycsr_building.nycsr_geographicaldistrictcode": "10",
    "nycsr_building.nycsr_buildingname": "WALTON HS - X",
    "nycsr_locationsite.nycsr_sitename": "International School for Liberal Arts - X342 - X430 - 10X342 - 2780 RESERVOIR AVENUE"
  },
  {
    "@odata.etag": "W/\"327146745\"",
    "nycsr_admininterventiontype@OData.Community.Display.V1.FormattedValue": "Partial Classroom Quarantine",
    "nycsr_admininterventiontype": 882450001,
    "nycsr_caseid": "de75f290-b41f-ec11-b6e6-001dd830657f",
    "nycsr_interventionenddate@OData.Community.Display.V1.FormattedValue": "10/3/2021",
    "nycsr_interventionenddate": "2021-10-03T04:00:00Z",
    "nycsr_casenumber": "053017",
    "nycsr_interventionstartdate@OData.Community.Display.V1.FormattedValue": "9/28/2021",
    "nycsr_interventionstartdate": "2021-09-28T04:00:00Z",
    "nycsr_building.nycsr_address": "421 W 219th St",
    "nycsr_building.nycsr_latitude@OData.Community.Display.V1.FormattedValue": "40,871,673.000000",
    "nycsr_building.nycsr_latitude": 40871673,
    "nycsr_building.nycsr_buildingid": "f4ed94c3-31f4-ea11-b882-24ee9a37d45c",
    "nycsr_building.nycsr_borough@OData.Community.Display.V1.FormattedValue": "Manhattan",
    "nycsr_building.nycsr_borough": 882450000,
    "nycsr_building.nycsr_longitude@OData.Community.Display.V1.FormattedValue": "-73,912,339.000000",
    "nycsr_building.nycsr_longitude": -73912339,
    "nycsr_building.nycsr_geographicaldistrictcode": "6",
    "nycsr_building.nycsr_buildingname": "P.S./IS 278 - MANHATTAN",
    "nycsr_locationsite.nycsr_sitename": "Paula Hedbavny School - M278 - M918 - 06M278 - 421 W 219th St"
  },
  {
    "@odata.etag": "W/\"327744965\"",
    "nycsr_admininterventiontype@OData.Community.Display.V1.FormattedValue": "Partial Classroom Quarantine",
    "nycsr_admininterventiontype": 882450001,
    "nycsr_caseid": "c8f320c8-b41f-ec11-b6e6-001dd830657f",
    "nycsr_interventionenddate@OData.Community.Display.V1.FormattedValue": "10/4/2021",
    "nycsr_interventionenddate": "2021-10-04T04:00:00Z",
    "nycsr_casenumber": "053019",
    "nycsr_interventionstartdate@OData.Community.Display.V1.FormattedValue": "9/29/2021",
    "nycsr_interventionstartdate": "2021-09-29T04:00:00Z",
    "nycsr_building.nycsr_address": "984 FAILE STREET",
    "nycsr_building.nycsr_latitude@OData.Community.Display.V1.FormattedValue": "40,822,314.000000",
    "nycsr_building.nycsr_latitude": 40822314,
    "nycsr_building.nycsr_buildingid": "1f0b210d-33f4-ea11-b882-24ee9a37d45c",
    "nycsr_building.nycsr_borough@OData.Community.Display.V1.FormattedValue": "Bronx",
    "nycsr_building.nycsr_borough": 882450001,
    "nycsr_building.nycsr_longitude@OData.Community.Display.V1.FormattedValue": "-73,888,948.000000",
    "nycsr_building.nycsr_longitude": -73888948,
    "nycsr_building.nycsr_geographicaldistrictcode": "8",
    "nycsr_building.nycsr_buildingname": "P.S. 75 - BRONX",
    "nycsr_locationsite.nycsr_sitename": "The Vida Bogart School for All Children - X352 - X075 - 75X352 - 984 FAILE STREET"
  },
  {
    "@odata.etag": "W/\"326060107\"",
    "nycsr_admininterventiontype@OData.Community.Display.V1.FormattedValue": "Partial Classroom Quarantine",
    "nycsr_admininterventiontype": 882450001,
    "nycsr_caseid": "f976d222-b51f-ec11-b6e6-001dd830657f",
    "nycsr_interventionenddate@OData.Community.Display.V1.FormattedValue": "10/4/2021",
    "nycsr_interventionenddate": "2021-10-04T04:00:00Z",
    "nycsr_casenumber": "053021",
    "nycsr_interventionstartdate@OData.Community.Display.V1.FormattedValue": "9/28/2021",
    "nycsr_interventionstartdate": "2021-09-28T04:00:00Z",
    "nycsr_building.nycsr_address": "800 HOME STREET",
    "nycsr_building.nycsr_latitude@OData.Community.Display.V1.FormattedValue": "40,826,933.000000",
    "nycsr_building.nycsr_latitude": 40826933,
    "nycsr_building.nycsr_buildingid": "8601ce37-33f4-ea11-b882-24ee9a37d45c",
    "nycsr_building.nycsr_borough@OData.Community.Display.V1.FormattedValue": "Bronx",
    "nycsr_building.nycsr_borough": 882450001,
    "nycsr_building.nycsr_longitude@OData.Community.Display.V1.FormattedValue": "-73,900,593.000000",
    "nycsr_building.nycsr_longitude": -73900593,
    "nycsr_building.nycsr_geographicaldistrictcode": "12",
    "nycsr_building.nycsr_buildingname": "I.S. 158 - BRONX",
    "nycsr_locationsite.nycsr_sitename": "Bronx Career and College Preparatory High School - X479 - X158 - 12X479 - 800 HOME STREET"
  },
  {
    "@odata.etag": "W/\"327147071\"",
    "nycsr_admininterventiontype@OData.Community.Display.V1.FormattedValue": "Classroom Closed",
    "nycsr_admininterventiontype": 882450000,
    "nycsr_caseid": "784a5b8a-b81f-ec11-b6e6-001dd830657f",
    "nycsr_interventionenddate@OData.Community.Display.V1.FormattedValue": "10/7/2021",
    "nycsr_interventionenddate": "2021-10-07T04:00:00Z",
    "nycsr_casenumber": "053038",
    "nycsr_interventionstartdate@OData.Community.Display.V1.FormattedValue": "9/28/2021",
    "nycsr_interventionstartdate": "2021-09-28T04:00:00Z",
    "nycsr_building.nycsr_address": "538 WEST 55TH STREET",
    "nycsr_building.nycsr_latitude@OData.Community.Display.V1.FormattedValue": "40,768,430.000000",
    "nycsr_building.nycsr_latitude": 40768430,
    "nycsr_building.nycsr_buildingid": "e99aeff9-49fb-ea11-b883-24ee9a37d459",
    "nycsr_building.nycsr_longitude@OData.Community.Display.V1.FormattedValue": "-73,991,945.000000",
    "nycsr_building.nycsr_longitude": -73991945,
    "nycsr_building.nycsr_geographicaldistrictcode": "2",
    "nycsr_building.nycsr_buildingname": "YWCA POLLY DODGE EARLY LEARNING CENTER",
    "nycsr_locationsite.nycsr_sitename": "YWCA POLLY DODGE EARLY LEARNING CENTER - MAUT - MAUT -  - 538 WEST 55TH STREET"
  },
  {
    "@odata.etag": "W/\"327198922\"",
    "nycsr_admininterventiontype@OData.Community.Display.V1.FormattedValue": "Classroom Closed",
    "nycsr_admininterventiontype": 882450000,
    "nycsr_caseid": "d22bf96f-ba1f-ec11-b6e6-001dd830657f",
    "nycsr_interventionenddate@OData.Community.Display.V1.FormattedValue": "10/4/2021",
    "nycsr_interventionenddate": "2021-10-04T04:00:00Z",
    "nycsr_casenumber": "053047",
    "nycsr_interventionstartdate@OData.Community.Display.V1.FormattedValue": "9/29/2021",
    "nycsr_interventionstartdate": "2021-09-29T04:00:00Z",
    "nycsr_building.nycsr_address": "88-08 164TH STREET",
    "nycsr_building.nycsr_latitude@OData.Community.Display.V1.FormattedValue": "40,708,698.000000",
    "nycsr_building.nycsr_latitude": 40708698,
    "nycsr_building.nycsr_buildingid": "d5454b50-32f4-ea11-b882-24ee9a37d45c",
    "nycsr_building.nycsr_borough@OData.Community.Display.V1.FormattedValue": "Queens",
    "nycsr_building.nycsr_borough": 882450003,
    "nycsr_building.nycsr_longitude@OData.Community.Display.V1.FormattedValue": "-73,797,981.000000",
    "nycsr_building.nycsr_longitude": -73797981,
    "nycsr_building.nycsr_geographicaldistrictcode": "28",
    "nycsr_building.nycsr_buildingname": "P.S./ I.S. 314 - Queens",
    "nycsr_locationsite.nycsr_sitename": "The Queens School for Leadership and Excellence - Q349 - Q314 - 28Q349 - 88-08 164TH STREET"
  },
  {
    "@odata.etag": "W/\"325861975\"",
    "nycsr_admininterventiontype@OData.Community.Display.V1.FormattedValue": "Partial Classroom Quarantine",
    "nycsr_admininterventiontype": 882450001,
    "nycsr_caseid": "e25e4244-be1f-ec11-b6e6-001dd830657f",
    "nycsr_interventionenddate@OData.Community.Display.V1.FormattedValue": "10/4/2021",
    "nycsr_interventionenddate": "2021-10-04T04:00:00Z",
    "nycsr_casenumber": "053088",
    "nycsr_interventionstartdate@OData.Community.Display.V1.FormattedValue": "9/28/2021",
    "nycsr_interventionstartdate": "2021-09-28T04:00:00Z",
    "nycsr_building.nycsr_address": "45-57 UNION STREET",
    "nycsr_building.nycsr_latitude@OData.Community.Display.V1.FormattedValue": "40,751,972.000000",
    "nycsr_building.nycsr_latitude": 40751972,
    "nycsr_building.nycsr_buildingid": "b6fc24e8-31f4-ea11-b882-24ee9a37d45c",
    "nycsr_building.nycsr_borough@OData.Community.Display.V1.FormattedValue": "Queens",
    "nycsr_building.nycsr_borough": 882450003,
    "nycsr_building.nycsr_longitude@OData.Community.Display.V1.FormattedValue": "-73,818,100.000000",
    "nycsr_building.nycsr_longitude": -73818100,
    "nycsr_building.nycsr_geographicaldistrictcode": "25",
    "nycsr_building.nycsr_buildingname": "P.S. 24 - QUEENS",
    "nycsr_locationsite.nycsr_sitename": "P.S. 024 Andrew Jackson - Q024 - Q024 - 25Q024 - 45-57 UNION STREET"
  },
  {
    "@odata.etag": "W/\"328188447\"",
    "nycsr_admininterventiontype@OData.Community.Display.V1.FormattedValue": "Classroom Closed",
    "nycsr_admininterventiontype": 882450000,
    "nycsr_caseid": "faaa4bd7-c61f-ec11-b6e6-001dd830657f",
    "nycsr_interventionenddate@OData.Community.Display.V1.FormattedValue": "10/4/2021",
    "nycsr_interventionenddate": "2021-10-04T04:00:00Z",
    "nycsr_casenumber": "053160",
    "nycsr_interventionstartdate@OData.Community.Display.V1.FormattedValue": "9/30/2021",
    "nycsr_interventionstartdate": "2021-09-30T04:00:00Z",
    "nycsr_building.nycsr_address": "12 PEARL STREET",
    "nycsr_building.nycsr_latitude@OData.Community.Display.V1.FormattedValue": "40,627,539.000000",
    "nycsr_building.nycsr_latitude": 40627539,
    "nycsr_building.nycsr_buildingid": "90e55380-49fb-ea11-b883-24ee9a37d459",
    "nycsr_building.nycsr_longitude@OData.Community.Display.V1.FormattedValue": "-74,084,951.000000",
    "nycsr_building.nycsr_longitude": -74084951,
    "nycsr_building.nycsr_geographicaldistrictcode": "31",
    "nycsr_building.nycsr_buildingname": "12 PEARL STREET",
    "nycsr_locationsite.nycsr_sitename": "APRIL OROZCO GRISALES - FL1 - RAHM - RAFB -  - 12 PEARL STREET"
  },
  {
    "@odata.etag": "W/\"325862106\"",
    "nycsr_admininterventiontype@OData.Community.Display.V1.FormattedValue": "Partial Classroom Quarantine",
    "nycsr_admininterventiontype": 882450001,
    "nycsr_caseid": "6736d119-c81f-ec11-b6e6-001dd830657f",
    "nycsr_interventionenddate@OData.Community.Display.V1.FormattedValue": "10/3/2021",
    "nycsr_interventionenddate": "2021-10-03T04:00:00Z",
    "nycsr_casenumber": "053172",
    "nycsr_interventionstartdate@OData.Community.Display.V1.FormattedValue": "9/28/2021",
    "nycsr_interventionstartdate": "2021-09-28T04:00:00Z",
    "nycsr_building.nycsr_address": "50 AVENUE X",
    "nycsr_building.nycsr_latitude@OData.Community.Display.V1.FormattedValue": "40,588,070.000000",
    "nycsr_building.nycsr_latitude": 40588070,
    "nycsr_building.nycsr_buildingid": "05fc3df4-30f4-ea11-b882-24ee9a37d45c",
    "nycsr_building.nycsr_borough@OData.Community.Display.V1.FormattedValue": "Brooklyn",
    "nycsr_building.nycsr_borough": 882450002,
    "nycsr_building.nycsr_longitude@OData.Community.Display.V1.FormattedValue": "-73,981,925.000000",
    "nycsr_building.nycsr_longitude": -73981925,
    "nycsr_building.nycsr_geographicaldistrictcode": "21",
    "nycsr_building.nycsr_buildingname": "JOHN DEWEY HS - K",
    "nycsr_locationsite.nycsr_sitename": "John Dewey High School - K540 - K540 - 21K540 - 50 AVENUE X"
  },
  {
    "@odata.etag": "W/\"327199008\"",
    "nycsr_admininterventiontype@OData.Community.Display.V1.FormattedValue": "Classroom Closed",
    "nycsr_admininterventiontype": 882450000,
    "nycsr_caseid": "f2ea6513-4f20-ec11-b6e6-001dd830657f",
    "nycsr_interventionenddate@OData.Community.Display.V1.FormattedValue": "10/4/2021",
    "nycsr_interventionenddate": "2021-10-04T04:00:00Z",
    "nycsr_casenumber": "053204",
    "nycsr_interventionstartdate@OData.Community.Display.V1.FormattedValue": "9/29/2021",
    "nycsr_interventionstartdate": "2021-09-29T04:00:00Z",
    "nycsr_building.nycsr_address": "3010 Briggs Avenue",
    "nycsr_building.nycsr_latitude@OData.Community.Display.V1.FormattedValue": "40,872,611.414500",
    "nycsr_building.nycsr_latitude": 40872611.4145,
    "nycsr_building.nycsr_buildingid": "e2e1350f-bb09-eb11-b884-24ee9a37d459",
    "nycsr_building.nycsr_longitude@OData.Community.Display.V1.FormattedValue": "-73,883,574.372504",
    "nycsr_building.nycsr_longitude": -73883574.372504,
    "nycsr_building.nycsr_geographicaldistrictcode": "X008",
    "nycsr_building.nycsr_buildingname": "PS 8 Isaac Varian",
    "nycsr_locationsite.nycsr_sitename": "DYCD - PS 8 Isaac Varian - 99313-2 - 3010 Briggs Avenue"
  },
  {
    "@odata.etag": "W/\"328562414\"",
    "nycsr_admininterventiontype@OData.Community.Display.V1.FormattedValue": "Classroom Closed",
    "nycsr_admininterventiontype": 882450000,
    "nycsr_caseid": "99319abe-6320-ec11-b6e6-001dd830657f",
    "nycsr_interventionenddate@OData.Community.Display.V1.FormattedValue": "10/3/2021",
    "nycsr_interventionenddate": "2021-10-03T04:00:00Z",
    "nycsr_casenumber": "053292",
    "nycsr_interventionstartdate@OData.Community.Display.V1.FormattedValue": "9/30/2021",
    "nycsr_interventionstartdate": "2021-09-30T04:00:00Z",
    "nycsr_building.nycsr_address": "69-01 34TH AVENUE",
    "nycsr_building.nycsr_latitude@OData.Community.Display.V1.FormattedValue": "40,752,773.000000",
    "nycsr_building.nycsr_latitude": 40752773,
    "nycsr_building.nycsr_buildingid": "abeb6056-32f4-ea11-b882-24ee9a37d45c",
    "nycsr_building.nycsr_borough@OData.Community.Display.V1.FormattedValue": "Queens",
    "nycsr_building.nycsr_borough": 882450003,
    "nycsr_building.nycsr_longitude@OData.Community.Display.V1.FormattedValue": "-73,896,705.000000",
    "nycsr_building.nycsr_longitude": -73896705,
    "nycsr_building.nycsr_geographicaldistrictcode": "30",
    "nycsr_building.nycsr_buildingname": "P.S. 398 - QUEENS",
    "nycsr_locationsite.nycsr_sitename": "The Hector Figueroa School - Q398 - Q398 - 30Q398 - 69-01 34TH AVENUE"
  },
  {
    "@odata.etag": "W/\"327199250\"",
    "nycsr_admininterventiontype@OData.Community.Display.V1.FormattedValue": "Partial Classroom Quarantine",
    "nycsr_admininterventiontype": 882450001,
    "nycsr_caseid": "63ed5444-6920-ec11-b6e6-001dd830657f",
    "nycsr_interventionenddate@OData.Community.Display.V1.FormattedValue": "10/7/2021",
    "nycsr_interventionenddate": "2021-10-07T04:00:00Z",
    "nycsr_casenumber": "053335",
    "nycsr_interventionstartdate@OData.Community.Display.V1.FormattedValue": "9/29/2021",
    "nycsr_interventionstartdate": "2021-09-29T04:00:00Z",
    "nycsr_building.nycsr_address": "1400 PENNSYLVANIA AVENUE",
    "nycsr_building.nycsr_latitude@OData.Community.Display.V1.FormattedValue": "40,646,640.000000",
    "nycsr_building.nycsr_latitude": 40646640,
    "nycsr_building.nycsr_buildingid": "30a198c3-30f4-ea11-b882-24ee9a37d45c",
    "nycsr_building.nycsr_borough@OData.Community.Display.V1.FormattedValue": "Brooklyn",
    "nycsr_building.nycsr_borough": 882450002,
    "nycsr_building.nycsr_longitude@OData.Community.Display.V1.FormattedValue": "-73,881,997.000000",
    "nycsr_building.nycsr_longitude": -73881997,
    "nycsr_building.nycsr_geographicaldistrictcode": "19",
    "nycsr_building.nycsr_buildingname": "P.S. 346 - BROOKLYN",
    "nycsr_locationsite.nycsr_sitename": "P.S. 346 Abe Stark - K346 - K346 - 19K346 - 1400 PENNSYLVANIA AVENUE"
  },
  {
    "@odata.etag": "W/\"328091442\"",
    "nycsr_admininterventiontype@OData.Community.Display.V1.FormattedValue": "Partial Classroom Quarantine",
    "nycsr_admininterventiontype": 882450001,
    "nycsr_caseid": "fd0b32ee-6c20-ec11-b6e6-001dd830657f",
    "nycsr_interventionenddate@OData.Community.Display.V1.FormattedValue": "10/3/2021",
    "nycsr_interventionenddate": "2021-10-03T04:00:00Z",
    "nycsr_casenumber": "053367",
    "nycsr_interventionstartdate@OData.Community.Display.V1.FormattedValue": "9/30/2021",
    "nycsr_interventionstartdate": "2021-09-30T04:00:00Z",
    "nycsr_building.nycsr_address": "101-01 ROCKAWAY BOULEVARD",
    "nycsr_building.nycsr_latitude@OData.Community.Display.V1.FormattedValue": "40,680,065.000000",
    "nycsr_building.nycsr_latitude": 40680065,
    "nycsr_building.nycsr_buildingid": "6abc9674-32f4-ea11-b882-24ee9a37d45c",
    "nycsr_building.nycsr_borough@OData.Community.Display.V1.FormattedValue": "Queens",
    "nycsr_building.nycsr_borough": 882450003,
    "nycsr_building.nycsr_longitude@OData.Community.Display.V1.FormattedValue": "-73,838,616.000000",
    "nycsr_building.nycsr_longitude": -73838616,
    "nycsr_building.nycsr_geographicaldistrictcode": "27",
    "nycsr_building.nycsr_buildingname": "JOHN ADAMS HS - QUEENS",
    "nycsr_locationsite.nycsr_sitename": "John Adams High School - Q480 - Q480 - 27Q480 - 101-01 ROCKAWAY BOULEVARD"
  },
  {
    "@odata.etag": "W/\"327199300\"",
    "nycsr_admininterventiontype@OData.Community.Display.V1.FormattedValue": "Partial Classroom Quarantine",
    "nycsr_admininterventiontype": 882450001,
    "nycsr_caseid": "2d6a1421-6e20-ec11-b6e6-001dd830657f",
    "nycsr_interventionenddate@OData.Community.Display.V1.FormattedValue": "10/3/2021",
    "nycsr_interventionenddate": "2021-10-03T04:00:00Z",
    "nycsr_casenumber": "053377",
    "nycsr_interventionstartdate@OData.Community.Display.V1.FormattedValue": "9/29/2021",
    "nycsr_interventionstartdate": "2021-09-29T04:00:00Z",
    "nycsr_building.nycsr_address": "101-01 ROCKAWAY BOULEVARD",
    "nycsr_building.nycsr_latitude@OData.Community.Display.V1.FormattedValue": "40,680,065.000000",
    "nycsr_building.nycsr_latitude": 40680065,
    "nycsr_building.nycsr_buildingid": "6abc9674-32f4-ea11-b882-24ee9a37d45c",
    "nycsr_building.nycsr_borough@OData.Community.Display.V1.FormattedValue": "Queens",
    "nycsr_building.nycsr_borough": 882450003,
    "nycsr_building.nycsr_longitude@OData.Community.Display.V1.FormattedValue": "-73,838,616.000000",
    "nycsr_building.nycsr_longitude": -73838616,
    "nycsr_building.nycsr_geographicaldistrictcode": "27",
    "nycsr_building.nycsr_buildingname": "JOHN ADAMS HS - QUEENS",
    "nycsr_locationsite.nycsr_sitename": "John Adams High School - Q480 - Q480 - 27Q480 - 101-01 ROCKAWAY BOULEVARD"
  },
  {
    "@odata.etag": "W/\"328073971\"",
    "nycsr_admininterventiontype@OData.Community.Display.V1.FormattedValue": "Partial Classroom Quarantine",
    "nycsr_admininterventiontype": 882450001,
    "nycsr_caseid": "76fae8ab-7b20-ec11-b6e6-001dd830657f",
    "nycsr_interventionenddate@OData.Community.Display.V1.FormattedValue": "10/7/2021",
    "nycsr_interventionenddate": "2021-10-07T04:00:00Z",
    "nycsr_casenumber": "053461",
    "nycsr_interventionstartdate@OData.Community.Display.V1.FormattedValue": "9/29/2021",
    "nycsr_interventionstartdate": "2021-09-29T04:00:00Z",
    "nycsr_building.nycsr_address": "4600 BROADWAY",
    "nycsr_building.nycsr_latitude@OData.Community.Display.V1.FormattedValue": "40,860,951.000000",
    "nycsr_building.nycsr_latitude": 40860951,
    "nycsr_building.nycsr_buildingid": "978d8486-31f4-ea11-b882-24ee9a37d45c",
    "nycsr_building.nycsr_borough@OData.Community.Display.V1.FormattedValue": "Manhattan",
    "nycsr_building.nycsr_borough": 882450000,
    "nycsr_building.nycsr_longitude@OData.Community.Display.V1.FormattedValue": "-73,930,082.000000",
    "nycsr_building.nycsr_longitude": -73930082,
    "nycsr_building.nycsr_geographicaldistrictcode": "6",
    "nycsr_building.nycsr_buildingname": "I.S. 218 - MANHATTAN",
    "nycsr_locationsite.nycsr_sitename": "City College Academy of the Arts - M293 - M218 - 06M293 - 4600 BROADWAY"
  },
  {
    "@odata.etag": "W/\"328091478\"",
    "nycsr_admininterventiontype@OData.Community.Display.V1.FormattedValue": "Partial Classroom Quarantine",
    "nycsr_admininterventiontype": 882450001,
    "nycsr_caseid": "f7d829d1-7b20-ec11-b6e6-001dd830657f",
    "nycsr_interventionenddate@OData.Community.Display.V1.FormattedValue": "10/4/2021",
    "nycsr_interventionenddate": "2021-10-04T04:00:00Z",
    "nycsr_casenumber": "053463",
    "nycsr_interventionstartdate@OData.Community.Display.V1.FormattedValue": "9/30/2021",
    "nycsr_interventionstartdate": "2021-09-30T04:00:00Z",
    "nycsr_building.nycsr_address": "360 EAST 145 STREET",
    "nycsr_building.nycsr_latitude@OData.Community.Display.V1.FormattedValue": "40,813,612.000000",
    "nycsr_building.nycsr_latitude": 40813612,
    "nycsr_building.nycsr_buildingid": "bcbfa431-33f4-ea11-b882-24ee9a37d45c",
    "nycsr_building.nycsr_borough@OData.Community.Display.V1.FormattedValue": "Bronx",
    "nycsr_building.nycsr_borough": 882450001,
    "nycsr_building.nycsr_longitude@OData.Community.Display.V1.FormattedValue": "-73,920,851.000000",
    "nycsr_building.nycsr_longitude": -73920851,
    "nycsr_building.nycsr_geographicaldistrictcode": "7",
    "nycsr_building.nycsr_buildingname": "J.H.S. 149 - BRONX",
    "nycsr_locationsite.nycsr_sitename": "South Bronx Preparatory: A College Board School - X221 - X149 - 07X221 - 360 EAST 145 STREET"
  },
  {
    "@odata.etag": "W/\"328029819\"",
    "nycsr_admininterventiontype@OData.Community.Display.V1.FormattedValue": "Partial Classroom Quarantine",
    "nycsr_admininterventiontype": 882450001,
    "nycsr_caseid": "2df53450-7c20-ec11-b6e6-001dd830657f",
    "nycsr_interventionenddate@OData.Community.Display.V1.FormattedValue": "10/4/2021",
    "nycsr_interventionenddate": "2021-10-04T04:00:00Z",
    "nycsr_casenumber": "053465",
    "nycsr_interventionstartdate@OData.Community.Display.V1.FormattedValue": "9/29/2021",
    "nycsr_interventionstartdate": "2021-09-29T04:00:00Z",
    "nycsr_building.nycsr_address": "21 JUMEL PLACE",
    "nycsr_building.nycsr_latitude@OData.Community.Display.V1.FormattedValue": "40,839,139.000000",
    "nycsr_building.nycsr_latitude": 40839139,
    "nycsr_building.nycsr_buildingid": "2ce61462-31f4-ea11-b882-24ee9a37d45c",
    "nycsr_building.nycsr_borough@OData.Community.Display.V1.FormattedValue": "Manhattan",
    "nycsr_building.nycsr_borough": 882450000,
    "nycsr_building.nycsr_longitude@OData.Community.Display.V1.FormattedValue": "-73,935,815.000000",
    "nycsr_building.nycsr_longitude": -73935815,
    "nycsr_building.nycsr_geographicaldistrictcode": "6",
    "nycsr_building.nycsr_buildingname": "I.S. 90 - MANHATTAN",
    "nycsr_locationsite.nycsr_sitename": "M.S. 319 - Maria Teresa - M319 - M090 - 06M319 - 21 JUMEL PLACE"
  },
  {
    "@odata.etag": "W/\"327199446\"",
    "nycsr_admininterventiontype@OData.Community.Display.V1.FormattedValue": "Partial Classroom Quarantine",
    "nycsr_admininterventiontype": 882450001,
    "nycsr_caseid": "bacbc658-7e20-ec11-b6e6-001dd830657f",
    "nycsr_interventionenddate@OData.Community.Display.V1.FormattedValue": "10/8/2021",
    "nycsr_interventionenddate": "2021-10-08T04:00:00Z",
    "nycsr_casenumber": "053472",
    "nycsr_interventionstartdate@OData.Community.Display.V1.FormattedValue": "9/29/2021",
    "nycsr_interventionstartdate": "2021-09-29T04:00:00Z",
    "nycsr_building.nycsr_address": "8787 24 AVENUE",
    "nycsr_building.nycsr_latitude@OData.Community.Display.V1.FormattedValue": "40,594,648.000000",
    "nycsr_building.nycsr_latitude": 40594648,
    "nycsr_building.nycsr_buildingid": "f2201dab-30f4-ea11-b882-24ee9a37d45c",
    "nycsr_building.nycsr_borough@OData.Community.Display.V1.FormattedValue": "Brooklyn",
    "nycsr_building.nycsr_borough": 882450002,
    "nycsr_building.nycsr_longitude@OData.Community.Display.V1.FormattedValue": "-73,993,565.000000",
    "nycsr_building.nycsr_longitude": -73993565,
    "nycsr_building.nycsr_geographicaldistrictcode": "21",
    "nycsr_building.nycsr_buildingname": "I.S. 281 - BROOKLYN",
    "nycsr_locationsite.nycsr_sitename": "I.S. 281 Joseph B Cavallaro - K281 - K281 - 21K281 - 8787 24 AVENUE"
  },
  {
    "@odata.etag": "W/\"328091483\"",
    "nycsr_admininterventiontype@OData.Community.Display.V1.FormattedValue": "Classroom Closed",
    "nycsr_admininterventiontype": 882450000,
    "nycsr_caseid": "fa2192c4-8020-ec11-b6e6-001dd830657f",
    "nycsr_interventionenddate@OData.Community.Display.V1.FormattedValue": "10/8/2021",
    "nycsr_interventionenddate": "2021-10-08T04:00:00Z",
    "nycsr_casenumber": "053483",
    "nycsr_interventionstartdate@OData.Community.Display.V1.FormattedValue": "9/30/2021",
    "nycsr_interventionstartdate": "2021-09-30T04:00:00Z",
    "nycsr_building.nycsr_address": "60-02 60 LANE",
    "nycsr_building.nycsr_latitude@OData.Community.Display.V1.FormattedValue": "40,716,296.000000",
    "nycsr_building.nycsr_latitude": 40716296,
    "nycsr_building.nycsr_buildingid": "e19b4c1f-32f4-ea11-b882-24ee9a37d45c",
    "nycsr_building.nycsr_borough@OData.Community.Display.V1.FormattedValue": "Queens",
    "nycsr_building.nycsr_borough": 882450003,
    "nycsr_building.nycsr_longitude@OData.Community.Display.V1.FormattedValue": "-73,904,463.000000",
    "nycsr_building.nycsr_longitude": -73904463,
    "nycsr_building.nycsr_geographicaldistrictcode": "24",
    "nycsr_building.nycsr_buildingname": "P.S. 153 - QUEENS",
    "nycsr_locationsite.nycsr_sitename": "P.S. 153 Maspeth Elem - Q153 - Q153 - 24Q153 - 60-02 60 LANE"
  },
  {
    "@odata.etag": "W/\"327709755\"",
    "nycsr_admininterventiontype@OData.Community.Display.V1.FormattedValue": "Partial Classroom Quarantine",
    "nycsr_admininterventiontype": 882450001,
    "nycsr_caseid": "c3791a50-8120-ec11-b6e6-001dd830657f",
    "nycsr_interventionenddate@OData.Community.Display.V1.FormattedValue": "10/7/2021",
    "nycsr_interventionenddate": "2021-10-07T04:00:00Z",
    "nycsr_casenumber": "053485",
    "nycsr_interventionstartdate@OData.Community.Display.V1.FormattedValue": "9/29/2021",
    "nycsr_interventionstartdate": "2021-09-29T04:00:00Z",
    "nycsr_building.nycsr_address": "111 EAST  33RD STREET",
    "nycsr_building.nycsr_latitude@OData.Community.Display.V1.FormattedValue": "40,746,510.000000",
    "nycsr_building.nycsr_latitude": 40746510,
    "nycsr_building.nycsr_buildingid": "a0d810ab-31f4-ea11-b882-24ee9a37d45c",
    "nycsr_building.nycsr_borough@OData.Community.Display.V1.FormattedValue": "Manhattan",
    "nycsr_building.nycsr_borough": 882450000,
    "nycsr_building.nycsr_longitude@OData.Community.Display.V1.FormattedValue": "-73,981,070.000000",
    "nycsr_building.nycsr_longitude": -73981070,
    "nycsr_building.nycsr_geographicaldistrictcode": "2",
    "nycsr_building.nycsr_buildingname": "NORMAN THOMAS HS (ECF) - MANHATTAN",
    "nycsr_locationsite.nycsr_sitename": "Success Academy Charter School - Harlem 3 - M385 - M620 - 84M385 - 111 EAST  33RD STREET"
  },
  {
    "@odata.etag": "W/\"327947347\"",
    "nycsr_admininterventiontype@OData.Community.Display.V1.FormattedValue": "Partial Classroom Quarantine",
    "nycsr_admininterventiontype": 882450001,
    "nycsr_caseid": "2a2b15ff-8120-ec11-b6e6-001dd830657f",
    "nycsr_interventionenddate@OData.Community.Display.V1.FormattedValue": "10/4/2021",
    "nycsr_interventionenddate": "2021-10-04T04:00:00Z",
    "nycsr_casenumber": "053494",
    "nycsr_interventionstartdate@OData.Community.Display.V1.FormattedValue": "9/29/2021",
    "nycsr_interventionstartdate": "2021-09-29T04:00:00Z",
    "nycsr_building.nycsr_address": "111 EAST  33RD STREET",
    "nycsr_building.nycsr_latitude@OData.Community.Display.V1.FormattedValue": "40,746,510.000000",
    "nycsr_building.nycsr_latitude": 40746510,
    "nycsr_building.nycsr_buildingid": "a0d810ab-31f4-ea11-b882-24ee9a37d45c",
    "nycsr_building.nycsr_borough@OData.Community.Display.V1.FormattedValue": "Manhattan",
    "nycsr_building.nycsr_borough": 882450000,
    "nycsr_building.nycsr_longitude@OData.Community.Display.V1.FormattedValue": "-73,981,070.000000",
    "nycsr_building.nycsr_longitude": -73981070,
    "nycsr_building.nycsr_geographicaldistrictcode": "2",
    "nycsr_building.nycsr_buildingname": "NORMAN THOMAS HS (ECF) - MANHATTAN",
    "nycsr_locationsite.nycsr_sitename": "Success Academy Charter School - Harlem 1 - M351 - M620 - 84M351 - 111 EAST  33RD STREET"
  },
  {
    "@odata.etag": "W/\"327684948\"",
    "nycsr_admininterventiontype@OData.Community.Display.V1.FormattedValue": "Partial Classroom Quarantine",
    "nycsr_admininterventiontype": 882450001,
    "nycsr_caseid": "728e0f0a-8520-ec11-b6e6-001dd830657f",
    "nycsr_interventionenddate@OData.Community.Display.V1.FormattedValue": "10/3/2021",
    "nycsr_interventionenddate": "2021-10-03T04:00:00Z",
    "nycsr_casenumber": "053514",
    "nycsr_interventionstartdate@OData.Community.Display.V1.FormattedValue": "9/29/2021",
    "nycsr_interventionstartdate": "2021-09-29T04:00:00Z",
    "nycsr_building.nycsr_address": "225 ADELPHI STREET",
    "nycsr_building.nycsr_latitude@OData.Community.Display.V1.FormattedValue": "40,690,742.000000",
    "nycsr_building.nycsr_latitude": 40690742,
    "nycsr_building.nycsr_buildingid": "d1968d36-30f4-ea11-b882-24ee9a37d45c",
    "nycsr_building.nycsr_borough@OData.Community.Display.V1.FormattedValue": "Brooklyn",
    "nycsr_building.nycsr_borough": 882450002,
    "nycsr_building.nycsr_longitude@OData.Community.Display.V1.FormattedValue": "-73,970,896.000000",
    "nycsr_building.nycsr_longitude": -73970896,
    "nycsr_building.nycsr_geographicaldistrictcode": "13",
    "nycsr_building.nycsr_buildingname": "P.S. 20 - BROOKLYN",
    "nycsr_locationsite.nycsr_sitename": "P.S. 020 Clinton Hill - K020 - K020 - 13K020 - 225 ADELPHI STREET"
  },
  {
    "@odata.etag": "W/\"328590445\"",
    "nycsr_admininterventiontype@OData.Community.Display.V1.FormattedValue": "Partial Classroom Quarantine",
    "nycsr_admininterventiontype": 882450001,
    "nycsr_caseid": "46593dda-1521-ec11-b6e6-001dd830657f",
    "nycsr_interventionenddate@OData.Community.Display.V1.FormattedValue": "10/8/2021",
    "nycsr_interventionenddate": "2021-10-08T04:00:00Z",
    "nycsr_casenumber": "053612",
    "nycsr_interventionstartdate@OData.Community.Display.V1.FormattedValue": "9/30/2021",
    "nycsr_interventionstartdate": "2021-09-30T04:00:00Z",
    "nycsr_building.nycsr_address": "154-60 17 AVENUE",
    "nycsr_building.nycsr_latitude@OData.Community.Display.V1.FormattedValue": "40,783,231.000000",
    "nycsr_building.nycsr_latitude": 40783231,
    "nycsr_building.nycsr_buildingid": "8a977d2b-32f4-ea11-b882-24ee9a37d45c",
    "nycsr_building.nycsr_borough@OData.Community.Display.V1.FormattedValue": "Queens",
    "nycsr_building.nycsr_borough": 882450003,
    "nycsr_building.nycsr_longitude@OData.Community.Display.V1.FormattedValue": "-73,806,990.000000",
    "nycsr_building.nycsr_longitude": -73806990,
    "nycsr_building.nycsr_geographicaldistrictcode": "25",
    "nycsr_building.nycsr_buildingname": "J.H.S. 194 - QUEENS",
    "nycsr_locationsite.nycsr_sitename": "J.H.S. 194 William Carr - Q194 - Q194 - 25Q194 - 154-60 17 AVENUE"
  },
  {
    "@odata.etag": "W/\"328091568\"",
    "nycsr_admininterventiontype@OData.Community.Display.V1.FormattedValue": "Classroom Closed",
    "nycsr_admininterventiontype": 882450000,
    "nycsr_caseid": "d173b66d-1821-ec11-b6e6-001dd830657f",
    "nycsr_interventionenddate@OData.Community.Display.V1.FormattedValue": "10/7/2021",
    "nycsr_interventionenddate": "2021-10-07T04:00:00Z",
    "nycsr_casenumber": "053622",
    "nycsr_interventionstartdate@OData.Community.Display.V1.FormattedValue": "9/30/2021",
    "nycsr_interventionstartdate": "2021-09-30T04:00:00Z",
    "nycsr_building.nycsr_address": "984 FAILE STREET",
    "nycsr_building.nycsr_latitude@OData.Community.Display.V1.FormattedValue": "40,822,314.000000",
    "nycsr_building.nycsr_latitude": 40822314,
    "nycsr_building.nycsr_buildingid": "1f0b210d-33f4-ea11-b882-24ee9a37d45c",
    "nycsr_building.nycsr_borough@OData.Community.Display.V1.FormattedValue": "Bronx",
    "nycsr_building.nycsr_borough": 882450001,
    "nycsr_building.nycsr_longitude@OData.Community.Display.V1.FormattedValue": "-73,888,948.000000",
    "nycsr_building.nycsr_longitude": -73888948,
    "nycsr_building.nycsr_geographicaldistrictcode": "8",
    "nycsr_building.nycsr_buildingname": "P.S. 75 - BRONX",
    "nycsr_locationsite.nycsr_sitename": "The Vida Bogart School for All Children - X352 - X075 - 75X352 - 984 FAILE STREET"
  },
  {
    "@odata.etag": "W/\"328091599\"",
    "nycsr_admininterventiontype@OData.Community.Display.V1.FormattedValue": "Classroom Closed",
    "nycsr_admininterventiontype": 882450000,
    "nycsr_caseid": "48ef7b3b-1a21-ec11-b6e6-001dd830657f",
    "nycsr_interventionenddate@OData.Community.Display.V1.FormattedValue": "10/4/2021",
    "nycsr_interventionenddate": "2021-10-04T04:00:00Z",
    "nycsr_casenumber": "053632",
    "nycsr_interventionstartdate@OData.Community.Display.V1.FormattedValue": "9/30/2021",
    "nycsr_interventionstartdate": "2021-09-30T04:00:00Z",
    "nycsr_building.nycsr_address": "89-14 PARSONS BOULEVARD",
    "nycsr_building.nycsr_latitude@OData.Community.Display.V1.FormattedValue": "40,705,525.000000",
    "nycsr_building.nycsr_latitude": 40705525,
    "nycsr_building.nycsr_buildingid": "99eb6056-32f4-ea11-b882-24ee9a37d45c",
    "nycsr_building.nycsr_borough@OData.Community.Display.V1.FormattedValue": "Queens",
    "nycsr_building.nycsr_borough": 882450003,
    "nycsr_building.nycsr_longitude@OData.Community.Display.V1.FormattedValue": "-73,802,503.000000",
    "nycsr_building.nycsr_longitude": -73802503,
    "nycsr_building.nycsr_geographicaldistrictcode": "28",
    "nycsr_building.nycsr_buildingname": "PRE-K CENTER @ 89-14 PARSONS BOULEVARD - QUEENS",
    "nycsr_locationsite.nycsr_sitename": "The Ezra Jack Keats Pre-K Center - Q335 - Q382 - 28Q335 - 89-14 PARSONS BOULEVARD"
  },
  {
    "@odata.etag": "W/\"328091836\"",
    "nycsr_admininterventiontype@OData.Community.Display.V1.FormattedValue": "Partial Classroom Quarantine",
    "nycsr_admininterventiontype": 882450001,
    "nycsr_caseid": "c7349d87-2921-ec11-b6e6-001dd830657f",
    "nycsr_interventionenddate@OData.Community.Display.V1.FormattedValue": "10/7/2021",
    "nycsr_interventionenddate": "2021-10-07T04:00:00Z",
    "nycsr_casenumber": "053722",
    "nycsr_interventionstartdate@OData.Community.Display.V1.FormattedValue": "9/30/2021",
    "nycsr_interventionstartdate": "2021-09-30T04:00:00Z",
    "nycsr_building.nycsr_address": "240 EAST 172 STREET",
    "nycsr_building.nycsr_latitude@OData.Community.Display.V1.FormattedValue": "40,839,307.000000",
    "nycsr_building.nycsr_latitude": 40839307,
    "nycsr_building.nycsr_buildingid": "c856635c-33f4-ea11-b882-24ee9a37d45c",
    "nycsr_building.nycsr_borough@OData.Community.Display.V1.FormattedValue": "Bronx",
    "nycsr_building.nycsr_borough": 882450001,
    "nycsr_building.nycsr_longitude@OData.Community.Display.V1.FormattedValue": "-73,911,366.000000",
    "nycsr_building.nycsr_longitude": -73911366,
    "nycsr_building.nycsr_geographicaldistrictcode": "9",
    "nycsr_building.nycsr_buildingname": "WILLIAM H. TAFT HS - X",
    "nycsr_locationsite.nycsr_sitename": "Claremont International HS - X564 - X410 - 09X564 - 240 EAST 172 STREET"
  },
  {
    "@odata.etag": "W/\"328091942\"",
    "nycsr_admininterventiontype@OData.Community.Display.V1.FormattedValue": "Partial Classroom Quarantine",
    "nycsr_admininterventiontype": 882450001,
    "nycsr_caseid": "0baa90ee-3021-ec11-b6e6-001dd830657f",
    "nycsr_interventionenddate@OData.Community.Display.V1.FormattedValue": "10/8/2021",
    "nycsr_interventionenddate": "2021-10-08T04:00:00Z",
    "nycsr_casenumber": "053759",
    "nycsr_interventionstartdate@OData.Community.Display.V1.FormattedValue": "9/30/2021",
    "nycsr_interventionstartdate": "2021-09-30T04:00:00Z",
    "nycsr_building.nycsr_address": "401 WEST 164 STREET",
    "nycsr_building.nycsr_latitude@OData.Community.Display.V1.FormattedValue": "40,836,982.000000",
    "nycsr_building.nycsr_latitude": 40836982,
    "nycsr_building.nycsr_buildingid": "2a005d7a-31f4-ea11-b882-24ee9a37d45c",
    "nycsr_building.nycsr_borough@OData.Community.Display.V1.FormattedValue": "Manhattan",
    "nycsr_building.nycsr_borough": 882450000,
    "nycsr_building.nycsr_longitude@OData.Community.Display.V1.FormattedValue": "-73,937,263.000000",
    "nycsr_building.nycsr_longitude": -73937263,
    "nycsr_building.nycsr_geographicaldistrictcode": "6",
    "nycsr_building.nycsr_buildingname": "I.S. 164 - MANHATTAN",
    "nycsr_locationsite.nycsr_sitename": "WHIN Music Community Charter School - M338 - M164 - 84M338 - 401 WEST 164 STREET"
  },
  {
    "@odata.etag": "W/\"328091982\"",
    "nycsr_admininterventiontype@OData.Community.Display.V1.FormattedValue": "Classroom Closed",
    "nycsr_admininterventiontype": 882450000,
    "nycsr_caseid": "46343fb0-3321-ec11-b6e6-001dd830657f",
    "nycsr_interventionenddate@OData.Community.Display.V1.FormattedValue": "10/9/2021",
    "nycsr_interventionenddate": "2021-10-09T04:00:00Z",
    "nycsr_casenumber": "053776",
    "nycsr_interventionstartdate@OData.Community.Display.V1.FormattedValue": "9/30/2021",
    "nycsr_interventionstartdate": "2021-09-30T04:00:00Z",
    "nycsr_building.nycsr_address": "36-36 10 Street",
    "nycsr_building.nycsr_latitude@OData.Community.Display.V1.FormattedValue": "40,760,862.000000",
    "nycsr_building.nycsr_latitude": 40760862,
    "nycsr_building.nycsr_buildingid": "d2e8ce00-32f4-ea11-b882-24ee9a37d45c",
    "nycsr_building.nycsr_borough@OData.Community.Display.V1.FormattedValue": "Queens",
    "nycsr_building.nycsr_borough": 882450003,
    "nycsr_building.nycsr_longitude@OData.Community.Display.V1.FormattedValue": "-73,941,630.000000",
    "nycsr_building.nycsr_longitude": -73941630,
    "nycsr_building.nycsr_geographicaldistrictcode": "30",
    "nycsr_building.nycsr_buildingname": "P.S. 76 - QUEENS",
    "nycsr_locationsite.nycsr_sitename": "P.S. 076 William Hallet - Q076 - Q076 - 30Q076 - 36-36 10 Street"
  },
  {
    "@odata.etag": "W/\"328092108\"",
    "nycsr_admininterventiontype@OData.Community.Display.V1.FormattedValue": "Partial Classroom Quarantine",
    "nycsr_admininterventiontype": 882450001,
    "nycsr_caseid": "56cd5ecc-3b21-ec11-b6e6-001dd830657f",
    "nycsr_interventionenddate@OData.Community.Display.V1.FormattedValue": "10/7/2021",
    "nycsr_interventionenddate": "2021-10-07T04:00:00Z",
    "nycsr_casenumber": "053833",
    "nycsr_interventionstartdate@OData.Community.Display.V1.FormattedValue": "9/30/2021",
    "nycsr_interventionstartdate": "2021-09-30T04:00:00Z",
    "nycsr_building.nycsr_address": "164 bruckner boulevard",
    "nycsr_building.nycsr_latitude@OData.Community.Display.V1.FormattedValue": "40,803,052.000000",
    "nycsr_building.nycsr_latitude": 40803052,
    "nycsr_building.nycsr_buildingid": "a0845cb8-33f4-ea11-b882-24ee9a37d45c",
    "nycsr_building.nycsr_borough@OData.Community.Display.V1.FormattedValue": "Bronx",
    "nycsr_building.nycsr_borough": 882450001,
    "nycsr_building.nycsr_longitude@OData.Community.Display.V1.FormattedValue": "-73,918,037.000000",
    "nycsr_building.nycsr_longitude": -73918037,
    "nycsr_building.nycsr_geographicaldistrictcode": "7",
    "nycsr_building.nycsr_buildingname": "SOUTH BRONX CHARTER SCHOOL",
    "nycsr_locationsite.nycsr_sitename": "South Bronx Charter School for International Cultures and the Arts - X309 - XAXD - 84X309 - 164 bruckner boulevard"
  },
  {
    "@odata.etag": "W/\"328092220\"",
    "nycsr_admininterventiontype@OData.Community.Display.V1.FormattedValue": "Partial Classroom Quarantine",
    "nycsr_admininterventiontype": 882450001,
    "nycsr_caseid": "c3910fc9-4321-ec11-b6e6-001dd830657f",
    "nycsr_interventionenddate@OData.Community.Display.V1.FormattedValue": "10/9/2021",
    "nycsr_interventionenddate": "2021-10-09T04:00:00Z",
    "nycsr_casenumber": "053887",
    "nycsr_interventionstartdate@OData.Community.Display.V1.FormattedValue": "9/30/2021",
    "nycsr_interventionstartdate": "2021-09-30T04:00:00Z",
    "nycsr_building.nycsr_address": "2111 CROTONA AVENUE",
    "nycsr_building.nycsr_latitude@OData.Community.Display.V1.FormattedValue": "40,848,748.000000",
    "nycsr_building.nycsr_latitude": 40848748,
    "nycsr_building.nycsr_buildingid": "6c36d900-33f4-ea11-b882-24ee9a37d45c",
    "nycsr_building.nycsr_borough@OData.Community.Display.V1.FormattedValue": "Bronx",
    "nycsr_building.nycsr_borough": 882450001,
    "nycsr_building.nycsr_longitude@OData.Community.Display.V1.FormattedValue": "-73,888,987.000000",
    "nycsr_building.nycsr_longitude": -73888987,
    "nycsr_building.nycsr_geographicaldistrictcode": "12",
    "nycsr_building.nycsr_buildingname": "P.S. 57 - BRONX",
    "nycsr_locationsite.nycsr_sitename": "Frederick Douglass Academy V. Middle School - X273 - X057 - 12X273 - 2111 CROTONA AVENUE"
  },
  {
    "@odata.etag": "W/\"328092245\"",
    "nycsr_admininterventiontype@OData.Community.Display.V1.FormattedValue": "Non-Classroom Quarantine",
    "nycsr_admininterventiontype": 882450003,
    "nycsr_caseid": "42848ea9-4721-ec11-b6e6-001dd830657f",
    "nycsr_interventionenddate@OData.Community.Display.V1.FormattedValue": "10/7/2021",
    "nycsr_interventionenddate": "2021-10-07T04:00:00Z",
    "nycsr_casenumber": "053907",
    "nycsr_interventionstartdate@OData.Community.Display.V1.FormattedValue": "9/30/2021",
    "nycsr_interventionstartdate": "2021-09-30T04:00:00Z",
    "nycsr_building.nycsr_address": "174-10 67 AVENUE",
    "nycsr_building.nycsr_latitude@OData.Community.Display.V1.FormattedValue": "40,734,097.000000",
    "nycsr_building.nycsr_latitude": 40734097,
    "nycsr_building.nycsr_buildingid": "900e6e25-32f4-ea11-b882-24ee9a37d45c",
    "nycsr_building.nycsr_borough@OData.Community.Display.V1.FormattedValue": "Queens",
    "nycsr_building.nycsr_borough": 882450003,
    "nycsr_building.nycsr_longitude@OData.Community.Display.V1.FormattedValue": "-73,795,651.000000",
    "nycsr_building.nycsr_longitude": -73795651,
    "nycsr_building.nycsr_geographicaldistrictcode": "26",
    "nycsr_building.nycsr_buildingname": "P.S. 173 - QUEENS",
    "nycsr_locationsite.nycsr_sitename": "P.S. 173 Fresh Meadows - Q173 - Q173 - 26Q173 - 174-10 67 AVENUE"
  },
  {
    "@odata.etag": "W/\"328724564\"",
    "nycsr_admininterventiontype@OData.Community.Display.V1.FormattedValue": "Classroom Closed",
    "nycsr_admininterventiontype": 882450000,
    "nycsr_caseid": "7c2a4957-df21-ec11-b6e6-001dd830657f",
    "nycsr_interventionenddate@OData.Community.Display.V1.FormattedValue": "10/9/2021",
    "nycsr_interventionenddate": "2021-10-09T04:00:00Z",
    "nycsr_casenumber": "054025",
    "nycsr_interventionstartdate@OData.Community.Display.V1.FormattedValue": "10/1/2021",
    "nycsr_interventionstartdate": "2021-10-01T04:00:00Z",
    "nycsr_building.nycsr_address": "1250 WARD AVENUE",
    "nycsr_building.nycsr_latitude@OData.Community.Display.V1.FormattedValue": "40,830,811.000000",
    "nycsr_building.nycsr_latitude": 40830811,
    "nycsr_building.nycsr_buildingid": "230b210d-33f4-ea11-b882-24ee9a37d45c",
    "nycsr_building.nycsr_borough@OData.Community.Display.V1.FormattedValue": "Bronx",
    "nycsr_building.nycsr_borough": 882450001,
    "nycsr_building.nycsr_longitude@OData.Community.Display.V1.FormattedValue": "-73,877,305.000000",
    "nycsr_building.nycsr_longitude": -73877305,
    "nycsr_building.nycsr_geographicaldistrictcode": "12",
    "nycsr_building.nycsr_buildingname": "P.S. 195 - BRONX",
    "nycsr_locationsite.nycsr_sitename": "P.S. 195 - X195 - X077 - 12X195 - 1250 WARD AVENUE"
  },
  {
    "@odata.etag": "W/\"328726823\"",
    "nycsr_admininterventiontype@OData.Community.Display.V1.FormattedValue": "Classroom Closed",
    "nycsr_admininterventiontype": 882450000,
    "nycsr_caseid": "38e1ea97-e021-ec11-b6e6-001dd830657f",
    "nycsr_interventionenddate@OData.Community.Display.V1.FormattedValue": "10/9/2021",
    "nycsr_interventionenddate": "2021-10-09T04:00:00Z",
    "nycsr_casenumber": "054030",
    "nycsr_interventionstartdate@OData.Community.Display.V1.FormattedValue": "10/1/2021",
    "nycsr_interventionstartdate": "2021-10-01T04:00:00Z",
    "nycsr_building.nycsr_address": "984 FAILE STREET",
    "nycsr_building.nycsr_latitude@OData.Community.Display.V1.FormattedValue": "40,822,314.000000",
    "nycsr_building.nycsr_latitude": 40822314,
    "nycsr_building.nycsr_buildingid": "1f0b210d-33f4-ea11-b882-24ee9a37d45c",
    "nycsr_building.nycsr_borough@OData.Community.Display.V1.FormattedValue": "Bronx",
    "nycsr_building.nycsr_borough": 882450001,
    "nycsr_building.nycsr_longitude@OData.Community.Display.V1.FormattedValue": "-73,888,948.000000",
    "nycsr_building.nycsr_longitude": -73888948,
    "nycsr_building.nycsr_geographicaldistrictcode": "8",
    "nycsr_building.nycsr_buildingname": "P.S. 75 - BRONX",
    "nycsr_locationsite.nycsr_sitename": "The Vida Bogart School for All Children - X352 - X075 - 75X352 - 984 FAILE STREET"
  },
  {
    "@odata.etag": "W/\"328730335\"",
    "nycsr_admininterventiontype@OData.Community.Display.V1.FormattedValue": "Partial Classroom Quarantine",
    "nycsr_admininterventiontype": 882450001,
    "nycsr_caseid": "8459fb63-e221-ec11-b6e6-001dd830657f",
    "nycsr_interventionenddate@OData.Community.Display.V1.FormattedValue": "10/9/2021",
    "nycsr_interventionenddate": "2021-10-09T04:00:00Z",
    "nycsr_casenumber": "054035",
    "nycsr_interventionstartdate@OData.Community.Display.V1.FormattedValue": "10/1/2021",
    "nycsr_interventionstartdate": "2021-10-01T04:00:00Z",
    "nycsr_building.nycsr_address": "1307 CENTRAL AVENUE",
    "nycsr_building.nycsr_latitude@OData.Community.Display.V1.FormattedValue": "40,607,247.000000",
    "nycsr_building.nycsr_latitude": 40607247,
    "nycsr_building.nycsr_buildingid": "30a10a44-32f4-ea11-b882-24ee9a37d45c",
    "nycsr_building.nycsr_borough@OData.Community.Display.V1.FormattedValue": "Queens",
    "nycsr_building.nycsr_borough": 882450003,
    "nycsr_building.nycsr_longitude@OData.Community.Display.V1.FormattedValue": "-73,748,799.000000",
    "nycsr_building.nycsr_longitude": -73748799,
    "nycsr_building.nycsr_geographicaldistrictcode": "27",
    "nycsr_building.nycsr_buildingname": "P.S. 253 -QUEENS",
    "nycsr_locationsite.nycsr_sitename": "P.S. 253 - Q253 - Q253 - 27Q253 - 1307 CENTRAL AVENUE"
  },
  {
    "@odata.etag": "W/\"328740711\"",
    "nycsr_admininterventiontype@OData.Community.Display.V1.FormattedValue": "Classroom Closed",
    "nycsr_admininterventiontype": 882450000,
    "nycsr_caseid": "2af1016a-e221-ec11-b6e6-001dd830657f",
    "nycsr_interventionenddate@OData.Community.Display.V1.FormattedValue": "10/9/2021",
    "nycsr_interventionenddate": "2021-10-09T04:00:00Z",
    "nycsr_casenumber": "054036",
    "nycsr_interventionstartdate@OData.Community.Display.V1.FormattedValue": "10/1/2021",
    "nycsr_interventionstartdate": "2021-10-01T04:00:00Z",
    "nycsr_building.nycsr_address": "1307 CENTRAL AVENUE",
    "nycsr_building.nycsr_latitude@OData.Community.Display.V1.FormattedValue": "40,607,247.000000",
    "nycsr_building.nycsr_latitude": 40607247,
    "nycsr_building.nycsr_buildingid": "30a10a44-32f4-ea11-b882-24ee9a37d45c",
    "nycsr_building.nycsr_borough@OData.Community.Display.V1.FormattedValue": "Queens",
    "nycsr_building.nycsr_borough": 882450003,
    "nycsr_building.nycsr_longitude@OData.Community.Display.V1.FormattedValue": "-73,748,799.000000",
    "nycsr_building.nycsr_longitude": -73748799,
    "nycsr_building.nycsr_geographicaldistrictcode": "27",
    "nycsr_building.nycsr_buildingname": "P.S. 253 -QUEENS",
    "nycsr_locationsite.nycsr_sitename": "P.S. 253 - Q253 - Q253 - 27Q253 - 1307 CENTRAL AVENUE"
  },
  {
    "@odata.etag": "W/\"328767533\"",
    "nycsr_admininterventiontype@OData.Community.Display.V1.FormattedValue": "Partial Classroom Quarantine",
    "nycsr_admininterventiontype": 882450001,
    "nycsr_caseid": "3e8ad5bc-e221-ec11-b6e6-001dd830657f",
    "nycsr_interventionenddate@OData.Community.Display.V1.FormattedValue": "10/9/2021",
    "nycsr_interventionenddate": "2021-10-09T04:00:00Z",
    "nycsr_casenumber": "054038",
    "nycsr_interventionstartdate@OData.Community.Display.V1.FormattedValue": "10/1/2021",
    "nycsr_interventionstartdate": "2021-10-01T04:00:00Z",
    "nycsr_building.nycsr_address": "450 PACIFIC STREET",
    "nycsr_building.nycsr_latitude@OData.Community.Display.V1.FormattedValue": "40,684,945.000000",
    "nycsr_building.nycsr_latitude": 40684945,
    "nycsr_building.nycsr_buildingid": "061bad3c-30f4-ea11-b882-24ee9a37d45c",
    "nycsr_building.nycsr_borough@OData.Community.Display.V1.FormattedValue": "Brooklyn",
    "nycsr_building.nycsr_borough": 882450002,
    "nycsr_building.nycsr_longitude@OData.Community.Display.V1.FormattedValue": "-73,982,826.000000",
    "nycsr_building.nycsr_longitude": -73982826,
    "nycsr_building.nycsr_geographicaldistrictcode": "15",
    "nycsr_building.nycsr_buildingname": "P.S. 38 - BROOKLYN",
    "nycsr_locationsite.nycsr_sitename": "P.S. 038 The Pacific - K038 - K038 - 15K038 - 450 PACIFIC STREET"
  },
  {
    "@odata.etag": "W/\"328634392\"",
    "nycsr_admininterventiontype@OData.Community.Display.V1.FormattedValue": "Partial Classroom Quarantine",
    "nycsr_admininterventiontype": 882450001,
    "nycsr_caseid": "db7b3dff-e521-ec11-b6e6-001dd830657f",
    "nycsr_interventionenddate@OData.Community.Display.V1.FormattedValue": "10/1/2021",
    "nycsr_interventionenddate": "2021-10-01T04:00:00Z",
    "nycsr_casenumber": "054055",
    "nycsr_interventionstartdate@OData.Community.Display.V1.FormattedValue": "10/1/2021",
    "nycsr_interventionstartdate": "2021-10-01T04:00:00Z",
    "nycsr_building.nycsr_address": "40 IRVING PLACE",
    "nycsr_building.nycsr_latitude@OData.Community.Display.V1.FormattedValue": "40,735,361.000000",
    "nycsr_building.nycsr_latitude": 40735361,
    "nycsr_building.nycsr_buildingid": "16a6ba98-31f4-ea11-b882-24ee9a37d45c",
    "nycsr_building.nycsr_borough@OData.Community.Display.V1.FormattedValue": "Manhattan",
    "nycsr_building.nycsr_borough": 882450000,
    "nycsr_building.nycsr_longitude@OData.Community.Display.V1.FormattedValue": "-73,987,064.000000",
    "nycsr_building.nycsr_longitude": -73987064,
    "nycsr_building.nycsr_geographicaldistrictcode": "2",
    "nycsr_building.nycsr_buildingname": "WASHINGTON IRVING HS - MANHATTAN",
    "nycsr_locationsite.nycsr_sitename": "The High School For Language And Diplomacy - M399 - M460 - 02M399 - 40 IRVING PLACE"
  },
  {
    "@odata.etag": "W/\"328385366\"",
    "nycsr_admininterventiontype@OData.Community.Display.V1.FormattedValue": "Partial Classroom Quarantine",
    "nycsr_admininterventiontype": 882450001,
    "nycsr_caseid": "ead64e55-ea21-ec11-b6e6-001dd830657f",
    "nycsr_interventionenddate@OData.Community.Display.V1.FormattedValue": "10/2/2021",
    "nycsr_interventionenddate": "2021-10-02T04:00:00Z",
    "nycsr_casenumber": "054068",
    "nycsr_interventionstartdate@OData.Community.Display.V1.FormattedValue": "10/1/2021",
    "nycsr_interventionstartdate": "2021-10-01T04:00:00Z",
    "nycsr_building.nycsr_address": "333 MIDLAND AVENUE",
    "nycsr_building.nycsr_latitude@OData.Community.Display.V1.FormattedValue": "40,576,728.000000",
    "nycsr_building.nycsr_latitude": 40576728,
    "nycsr_building.nycsr_buildingid": "2b7c21b7-32f4-ea11-b882-24ee9a37d45c",
    "nycsr_building.nycsr_borough@OData.Community.Display.V1.FormattedValue": "Staten Island",
    "nycsr_building.nycsr_borough": 882450004,
    "nycsr_building.nycsr_longitude@OData.Community.Display.V1.FormattedValue": "-74,099,685.000000",
    "nycsr_building.nycsr_longitude": -74099685,
    "nycsr_building.nycsr_geographicaldistrictcode": "31",
    "nycsr_building.nycsr_buildingname": "I.S. 2 - STATEN ISLAND",
    "nycsr_locationsite.nycsr_sitename": "I.S. R002 George L. Egbert - R002 - R002 - 31R002 - 333 MIDLAND AVENUE"
  },
  {
    "@odata.etag": "W/\"328426510\"",
    "nycsr_admininterventiontype@OData.Community.Display.V1.FormattedValue": "Classroom Closed",
    "nycsr_admininterventiontype": 882450000,
    "nycsr_caseid": "64572101-eb21-ec11-b6e6-001dd830657f",
    "nycsr_interventionenddate@OData.Community.Display.V1.FormattedValue": "10/9/2021",
    "nycsr_interventionenddate": "2021-10-09T04:00:00Z",
    "nycsr_casenumber": "054069",
    "nycsr_interventionstartdate@OData.Community.Display.V1.FormattedValue": "10/1/2021",
    "nycsr_interventionstartdate": "2021-10-01T04:00:00Z",
    "nycsr_building.nycsr_address": "91 HENDERSON AVENUE",
    "nycsr_building.nycsr_latitude@OData.Community.Display.V1.FormattedValue": "40,641,180.000000",
    "nycsr_building.nycsr_latitude": 40641180,
    "nycsr_building.nycsr_buildingid": "97a9d9c3-32f4-ea11-b882-24ee9a37d45c",
    "nycsr_building.nycsr_borough@OData.Community.Display.V1.FormattedValue": "Staten Island",
    "nycsr_building.nycsr_borough": 882450004,
    "nycsr_building.nycsr_longitude@OData.Community.Display.V1.FormattedValue": "-74,095,454.000000",
    "nycsr_building.nycsr_longitude": -74095454,
    "nycsr_building.nycsr_geographicaldistrictcode": "31",
    "nycsr_building.nycsr_buildingname": "P.S. 373 (OLD P40) - STATEN ISLAND",
    "nycsr_locationsite.nycsr_sitename": "P.S. R373 - R373 - R040 - 75R373 - 91 HENDERSON AVENUE"
  },
  {
    "@odata.etag": "W/\"328429375\"",
    "nycsr_admininterventiontype@OData.Community.Display.V1.FormattedValue": "Partial Classroom Quarantine",
    "nycsr_admininterventiontype": 882450001,
    "nycsr_caseid": "057e22e1-f021-ec11-b6e6-001dd830657f",
    "nycsr_interventionenddate@OData.Community.Display.V1.FormattedValue": "10/8/2021",
    "nycsr_interventionenddate": "2021-10-08T04:00:00Z",
    "nycsr_casenumber": "054089",
    "nycsr_interventionstartdate@OData.Community.Display.V1.FormattedValue": "10/1/2021",
    "nycsr_interventionstartdate": "2021-10-01T04:00:00Z",
    "nycsr_building.nycsr_address": "11 CLOVE LAKE PLACE",
    "nycsr_building.nycsr_latitude@OData.Community.Display.V1.FormattedValue": "40,628,291.000000",
    "nycsr_building.nycsr_latitude": 40628291,
    "nycsr_building.nycsr_buildingid": "78a9d9c3-32f4-ea11-b882-24ee9a37d45c",
    "nycsr_building.nycsr_borough@OData.Community.Display.V1.FormattedValue": "Staten Island",
    "nycsr_building.nycsr_borough": 882450004,
    "nycsr_building.nycsr_longitude@OData.Community.Display.V1.FormattedValue": "-74,117,818.000000",
    "nycsr_building.nycsr_longitude": -74117818,
    "nycsr_building.nycsr_geographicaldistrictcode": "31",
    "nycsr_building.nycsr_buildingname": "I.S. 27 - STATEN ISLAND",
    "nycsr_locationsite.nycsr_sitename": "I.S. 027 Anning S. Prall - R027 - R027 - 31R027 - 11 CLOVE LAKE PLACE"
  },
  {
    "@odata.etag": "W/\"328490453\"",
    "nycsr_admininterventiontype@OData.Community.Display.V1.FormattedValue": "Partial Classroom Quarantine",
    "nycsr_admininterventiontype": 882450001,
    "nycsr_caseid": "81bfbc05-f821-ec11-b6e6-001dd830657f",
    "nycsr_interventionenddate@OData.Community.Display.V1.FormattedValue": "10/10/2021",
    "nycsr_interventionenddate": "2021-10-10T04:00:00Z",
    "nycsr_casenumber": "054124",
    "nycsr_interventionstartdate@OData.Community.Display.V1.FormattedValue": "10/1/2021",
    "nycsr_interventionstartdate": "2021-10-01T04:00:00Z",
    "nycsr_building.nycsr_address": "411 PEARL STREET",
    "nycsr_building.nycsr_latitude@OData.Community.Display.V1.FormattedValue": "40,711,441.000000",
    "nycsr_building.nycsr_latitude": 40711441,
    "nycsr_building.nycsr_buildingid": "e037fba4-31f4-ea11-b882-24ee9a37d45c",
    "nycsr_building.nycsr_borough@OData.Community.Display.V1.FormattedValue": "Manhattan",
    "nycsr_building.nycsr_borough": 882450000,
    "nycsr_building.nycsr_longitude@OData.Community.Display.V1.FormattedValue": "-74,000,851.000000",
    "nycsr_building.nycsr_longitude": -74000851,
    "nycsr_building.nycsr_geographicaldistrictcode": "2",
    "nycsr_building.nycsr_buildingname": "MURRY BERGTRAUM HS (ECF) - M",
    "nycsr_locationsite.nycsr_sitename": "The Urban Assembly School for Emergency Management - M135 - M520 - 02M135 - 411 PEARL STREET"
  },
  {
    "@odata.etag": "W/\"328750623\"",
    "nycsr_admininterventiontype@OData.Community.Display.V1.FormattedValue": "Classroom Closed",
    "nycsr_admininterventiontype": 882450000,
    "nycsr_caseid": "1e9045b6-f821-ec11-b6e6-001dd830657f",
    "nycsr_interventionenddate@OData.Community.Display.V1.FormattedValue": "10/9/2021",
    "nycsr_interventionenddate": "2021-10-09T04:00:00Z",
    "nycsr_casenumber": "054128",
    "nycsr_interventionstartdate@OData.Community.Display.V1.FormattedValue": "10/1/2021",
    "nycsr_interventionstartdate": "2021-10-01T04:00:00Z",
    "nycsr_building.nycsr_address": "261 EAST 163 STREET",
    "nycsr_building.nycsr_latitude@OData.Community.Display.V1.FormattedValue": "40,828,009.000000",
    "nycsr_building.nycsr_latitude": 40828009,
    "nycsr_building.nycsr_buildingid": "fd02cefa-32f4-ea11-b882-24ee9a37d45c",
    "nycsr_building.nycsr_borough@OData.Community.Display.V1.FormattedValue": "Bronx",
    "nycsr_building.nycsr_borough": 882450001,
    "nycsr_building.nycsr_longitude@OData.Community.Display.V1.FormattedValue": "-73,917,705.000000",
    "nycsr_building.nycsr_longitude": -73917705,
    "nycsr_building.nycsr_geographicaldistrictcode": "9",
    "nycsr_building.nycsr_buildingname": "P.S. 35 - BRONX",
    "nycsr_locationsite.nycsr_sitename": "P.S. 035 Franz Siegel - X035 - X035 - 09X035 - 261 EAST 163 STREET"
  },
  {
    "@odata.etag": "W/\"328499500\"",
    "nycsr_admininterventiontype@OData.Community.Display.V1.FormattedValue": "Partial Classroom Quarantine",
    "nycsr_admininterventiontype": 882450001,
    "nycsr_caseid": "072e0f7e-fc21-ec11-b6e6-001dd830657f",
    "nycsr_interventionenddate@OData.Community.Display.V1.FormattedValue": "10/10/2021",
    "nycsr_interventionenddate": "2021-10-10T04:00:00Z",
    "nycsr_casenumber": "054146",
    "nycsr_interventionstartdate@OData.Community.Display.V1.FormattedValue": "10/1/2021",
    "nycsr_interventionstartdate": "2021-10-01T04:00:00Z",
    "nycsr_building.nycsr_address": "240 EAST 109 STREET",
    "nycsr_building.nycsr_latitude@OData.Community.Display.V1.FormattedValue": "40,792,556.000000",
    "nycsr_building.nycsr_latitude": 40792556,
    "nycsr_building.nycsr_buildingid": "1b6e3d68-31f4-ea11-b882-24ee9a37d45c",
    "nycsr_building.nycsr_borough@OData.Community.Display.V1.FormattedValue": "Manhattan",
    "nycsr_building.nycsr_borough": 882450000,
    "nycsr_building.nycsr_longitude@OData.Community.Display.V1.FormattedValue": "-73,942,285.000000",
    "nycsr_building.nycsr_longitude": -73942285,
    "nycsr_building.nycsr_geographicaldistrictcode": "4",
    "nycsr_building.nycsr_buildingname": "J.H.S. 117 - MANHATTAN",
    "nycsr_locationsite.nycsr_sitename": "Esperanza Preparatory Academy - M372 - M117 - 04M372 - 240 EAST 109 STREET"
  },
  {
    "@odata.etag": "W/\"328762756\"",
    "nycsr_admininterventiontype@OData.Community.Display.V1.FormattedValue": "Classroom Closed",
    "nycsr_admininterventiontype": 882450000,
    "nycsr_caseid": "d4c43562-ff21-ec11-b6e6-001dd830657f",
    "nycsr_interventionenddate@OData.Community.Display.V1.FormattedValue": "10/8/2021",
    "nycsr_interventionenddate": "2021-10-08T04:00:00Z",
    "nycsr_casenumber": "054164",
    "nycsr_interventionstartdate@OData.Community.Display.V1.FormattedValue": "10/1/2021",
    "nycsr_interventionstartdate": "2021-10-01T04:00:00Z",
    "nycsr_building.nycsr_address": "1535 RICHMOND AVENUE",
    "nycsr_building.nycsr_latitude@OData.Community.Display.V1.FormattedValue": "40,610,497.000000",
    "nycsr_building.nycsr_latitude": 40610497,
    "nycsr_building.nycsr_buildingid": "f18521d0-32f4-ea11-b882-24ee9a37d45c",
    "nycsr_building.nycsr_borough@OData.Community.Display.V1.FormattedValue": "Staten Island",
    "nycsr_building.nycsr_borough": 882450004,
    "nycsr_building.nycsr_longitude@OData.Community.Display.V1.FormattedValue": "-74,159,152.000000",
    "nycsr_building.nycsr_longitude": -74159152,
    "nycsr_building.nycsr_geographicaldistrictcode": "31",
    "nycsr_building.nycsr_buildingname": "3K CENTER @ 1535 RICHMOND AVENUE - STATEN ISLAND",
    "nycsr_locationsite.nycsr_sitename": "The Richmond Pre-K Center - R066 - R090 - 31R066 - 1535 RICHMOND AVENUE"
  },
  {
    "@odata.etag": "W/\"328835092\"",
    "nycsr_admininterventiontype@OData.Community.Display.V1.FormattedValue": "Partial Classroom Quarantine",
    "nycsr_admininterventiontype": 882450001,
    "nycsr_caseid": "850cbdce-ff21-ec11-b6e6-001dd830657f",
    "nycsr_interventionenddate@OData.Community.Display.V1.FormattedValue": "10/4/2021",
    "nycsr_interventionenddate": "2021-10-04T04:00:00Z",
    "nycsr_casenumber": "054169",
    "nycsr_interventionstartdate@OData.Community.Display.V1.FormattedValue": "10/1/2021",
    "nycsr_interventionstartdate": "2021-10-01T04:00:00Z",
    "nycsr_building.nycsr_address": "3740 BAYCHESTER AVENUE",
    "nycsr_building.nycsr_latitude@OData.Community.Display.V1.FormattedValue": "40,884,371.000000",
    "nycsr_building.nycsr_latitude": 40884371,
    "nycsr_building.nycsr_buildingid": "4d0d6d19-33f4-ea11-b882-24ee9a37d45c",
    "nycsr_building.nycsr_borough@OData.Community.Display.V1.FormattedValue": "Bronx",
    "nycsr_building.nycsr_borough": 882450001,
    "nycsr_building.nycsr_longitude@OData.Community.Display.V1.FormattedValue": "-73,839,288.000000",
    "nycsr_building.nycsr_longitude": -73839288,
    "nycsr_building.nycsr_geographicaldistrictcode": "11",
    "nycsr_building.nycsr_buildingname": "P.S. 111 - BRONX",
    "nycsr_locationsite.nycsr_sitename": "Bronx Charter School for Better Learning - X718 - X111 - 84X718 - 3740 BAYCHESTER AVENUE"
  },
  {
    "@odata.etag": "W/\"328771311\"",
    "nycsr_admininterventiontype@OData.Community.Display.V1.FormattedValue": "Partial Classroom Quarantine",
    "nycsr_admininterventiontype": 882450001,
    "nycsr_caseid": "e74a9933-0122-ec11-b6e6-001dd830657f",
    "nycsr_interventionenddate@OData.Community.Display.V1.FormattedValue": "10/9/2021",
    "nycsr_interventionenddate": "2021-10-09T04:00:00Z",
    "nycsr_casenumber": "054175",
    "nycsr_interventionstartdate@OData.Community.Display.V1.FormattedValue": "10/1/2021",
    "nycsr_interventionstartdate": "2021-10-01T04:00:00Z",
    "nycsr_building.nycsr_address": "66-56 FOREST AVENUE",
    "nycsr_building.nycsr_latitude@OData.Community.Display.V1.FormattedValue": "40,705,609.000000",
    "nycsr_building.nycsr_latitude": 40705609,
    "nycsr_building.nycsr_buildingid": "0f7eed06-32f4-ea11-b882-24ee9a37d45c",
    "nycsr_building.nycsr_borough@OData.Community.Display.V1.FormattedValue": "Queens",
    "nycsr_building.nycsr_borough": 882450003,
    "nycsr_building.nycsr_longitude@OData.Community.Display.V1.FormattedValue": "-73,903,057.000000",
    "nycsr_building.nycsr_longitude": -73903057,
    "nycsr_building.nycsr_geographicaldistrictcode": "24",
    "nycsr_building.nycsr_buildingname": "I.S. 93 - QUEENS",
    "nycsr_locationsite.nycsr_sitename": "I.S. 093 Ridgewood - Q093 - Q093 - 24Q093 - 66-56 FOREST AVENUE"
  },
  {
    "@odata.etag": "W/\"328673215\"",
    "nycsr_admininterventiontype@OData.Community.Display.V1.FormattedValue": "Partial Classroom Quarantine",
    "nycsr_admininterventiontype": 882450001,
    "nycsr_caseid": "f1b240a9-0422-ec11-b6e6-001dd830657f",
    "nycsr_interventionenddate@OData.Community.Display.V1.FormattedValue": "10/9/2021",
    "nycsr_interventionenddate": "2021-10-09T04:00:00Z",
    "nycsr_casenumber": "054195",
    "nycsr_interventionstartdate@OData.Community.Display.V1.FormattedValue": "10/1/2021",
    "nycsr_interventionstartdate": "2021-10-01T04:00:00Z",
    "nycsr_building.nycsr_address": "4715 18 AVENUE",
    "nycsr_building.nycsr_latitude@OData.Community.Display.V1.FormattedValue": "40,628,800.000000",
    "nycsr_building.nycsr_latitude": 40628800,
    "nycsr_building.nycsr_buildingid": "e5b36d80-30f4-ea11-b882-24ee9a37d45c",
    "nycsr_building.nycsr_borough@OData.Community.Display.V1.FormattedValue": "Brooklyn",
    "nycsr_building.nycsr_borough": 882450002,
    "nycsr_building.nycsr_longitude@OData.Community.Display.V1.FormattedValue": "-73,979,540.000000",
    "nycsr_building.nycsr_longitude": -73979540,
    "nycsr_building.nycsr_geographicaldistrictcode": "20",
    "nycsr_building.nycsr_buildingname": "P.S. 192 - BROOKLYN",
    "nycsr_locationsite.nycsr_sitename": "P.S. 192 - The Magnet School for Math and Science Inquiry - K192 - K192 - 20K192 - 4715 18 AVENUE"
  },
  {
    "@odata.etag": "W/\"328758567\"",
    "nycsr_admininterventiontype@OData.Community.Display.V1.FormattedValue": "Partial Classroom Quarantine",
    "nycsr_admininterventiontype": 882450001,
    "nycsr_caseid": "f92b5b82-0522-ec11-b6e6-001dd830657f",
    "nycsr_interventionenddate@OData.Community.Display.V1.FormattedValue": "10/9/2021",
    "nycsr_interventionenddate": "2021-10-09T04:00:00Z",
    "nycsr_casenumber": "054199",
    "nycsr_interventionstartdate@OData.Community.Display.V1.FormattedValue": "10/1/2021",
    "nycsr_interventionstartdate": "2021-10-01T04:00:00Z",
    "nycsr_building.nycsr_address": "4715 18 AVENUE",
    "nycsr_building.nycsr_latitude@OData.Community.Display.V1.FormattedValue": "40,628,800.000000",
    "nycsr_building.nycsr_latitude": 40628800,
    "nycsr_building.nycsr_buildingid": "e5b36d80-30f4-ea11-b882-24ee9a37d45c",
    "nycsr_building.nycsr_borough@OData.Community.Display.V1.FormattedValue": "Brooklyn",
    "nycsr_building.nycsr_borough": 882450002,
    "nycsr_building.nycsr_longitude@OData.Community.Display.V1.FormattedValue": "-73,979,540.000000",
    "nycsr_building.nycsr_longitude": -73979540,
    "nycsr_building.nycsr_geographicaldistrictcode": "20",
    "nycsr_building.nycsr_buildingname": "P.S. 192 - BROOKLYN",
    "nycsr_locationsite.nycsr_sitename": "P.S. 192 - The Magnet School for Math and Science Inquiry - K192 - K192 - 20K192 - 4715 18 AVENUE"
  },
  {
    "@odata.etag": "W/\"328770089\"",
    "nycsr_admininterventiontype@OData.Community.Display.V1.FormattedValue": "Classroom Closed",
    "nycsr_admininterventiontype": 882450000,
    "nycsr_caseid": "fac6c281-0c22-ec11-b6e6-001dd830657f",
    "nycsr_interventionenddate@OData.Community.Display.V1.FormattedValue": "10/10/2021",
    "nycsr_interventionenddate": "2021-10-10T04:00:00Z",
    "nycsr_casenumber": "054230",
    "nycsr_interventionstartdate@OData.Community.Display.V1.FormattedValue": "10/1/2021",
    "nycsr_interventionstartdate": "2021-10-01T04:00:00Z",
    "nycsr_building.nycsr_address": "1684 WHITE PLAINS ROAD",
    "nycsr_building.nycsr_latitude@OData.Community.Display.V1.FormattedValue": "40,843,531.000000",
    "nycsr_building.nycsr_latitude": 40843531,
    "nycsr_building.nycsr_buildingid": "daba3c50-33f4-ea11-b882-24ee9a37d45c",
    "nycsr_building.nycsr_borough@OData.Community.Display.V1.FormattedValue": "Bronx",
    "nycsr_building.nycsr_borough": 882450001,
    "nycsr_building.nycsr_longitude@OData.Community.Display.V1.FormattedValue": "-73,865,498.000000",
    "nycsr_building.nycsr_longitude": -73865498,
    "nycsr_building.nycsr_geographicaldistrictcode": "11",
    "nycsr_building.nycsr_buildingname": "P.S. 311 - BRONX",
    "nycsr_locationsite.nycsr_sitename": "The STEAM Bridge School - X481 - X311 - 11X481 - 1684 WHITE PLAINS ROAD"
  },
  {
    "@odata.etag": "W/\"328747481\"",
    "nycsr_admininterventiontype@OData.Community.Display.V1.FormattedValue": "No Intervention",
    "nycsr_admininterventiontype": 882450002,
    "nycsr_caseid": "9bb49598-1422-ec11-b6e6-001dd830657f",
    "nycsr_interventionenddate@OData.Community.Display.V1.FormattedValue": "10/1/2021",
    "nycsr_interventionenddate": "2021-10-01T04:00:00Z",
    "nycsr_casenumber": "054261",
    "nycsr_interventionstartdate@OData.Community.Display.V1.FormattedValue": "9/30/2021",
    "nycsr_interventionstartdate": "2021-09-30T04:00:00Z",
    "nycsr_building.nycsr_address": "86-35 235 COURT",
    "nycsr_building.nycsr_latitude@OData.Community.Display.V1.FormattedValue": "40,731,853.000000",
    "nycsr_building.nycsr_latitude": 40731853,
    "nycsr_building.nycsr_buildingid": "16f32ce2-31f4-ea11-b882-24ee9a37d45c",
    "nycsr_building.nycsr_borough@OData.Community.Display.V1.FormattedValue": "Queens",
    "nycsr_building.nycsr_borough": 882450003,
    "nycsr_building.nycsr_longitude@OData.Community.Display.V1.FormattedValue": "-73,732,290.000000",
    "nycsr_building.nycsr_longitude": -73732290,
    "nycsr_building.nycsr_geographicaldistrictcode": "26",
    "nycsr_building.nycsr_buildingname": "P.S. 18 - QUEENS",
    "nycsr_locationsite.nycsr_sitename": "P.S. 018 Winchester - Q018 - Q018 - 26Q018 - 86-35 235 COURT"
  },
  {
    "@odata.etag": "W/\"328781975\"",
    "nycsr_admininterventiontype@OData.Community.Display.V1.FormattedValue": "Partial Classroom Quarantine",
    "nycsr_admininterventiontype": 882450001,
    "nycsr_caseid": "302c1e9d-1722-ec11-b6e6-001dd830657f",
    "nycsr_interventionenddate@OData.Community.Display.V1.FormattedValue": "10/7/2021",
    "nycsr_interventionenddate": "2021-10-07T04:00:00Z",
    "nycsr_casenumber": "054273",
    "nycsr_interventionstartdate@OData.Community.Display.V1.FormattedValue": "10/1/2021",
    "nycsr_interventionstartdate": "2021-10-01T04:00:00Z",
    "nycsr_building.nycsr_address": "12-45 CLINTONVILLE STREET",
    "nycsr_building.nycsr_latitude@OData.Community.Display.V1.FormattedValue": "40,790,146.000000",
    "nycsr_building.nycsr_latitude": 40790146,
    "nycsr_building.nycsr_buildingid": "4f332a24-4afb-ea11-b883-24ee9a37d459",
    "nycsr_building.nycsr_longitude@OData.Community.Display.V1.FormattedValue": "-73,811,314.000000",
    "nycsr_building.nycsr_longitude": -73811314,
    "nycsr_building.nycsr_geographicaldistrictcode": "25",
    "nycsr_building.nycsr_buildingname": "PEE WEE FOLKS",
    "nycsr_locationsite.nycsr_sitename": "PEE WEE FOLKS - QAUC - QAUC -  - 12-45 CLINTONVILLE STREET"
  },
  {
    "@odata.etag": "W/\"328789150\"",
    "nycsr_admininterventiontype@OData.Community.Display.V1.FormattedValue": "Classroom Closed",
    "nycsr_admininterventiontype": 882450000,
    "nycsr_caseid": "5dfc0ce6-1722-ec11-b6e6-001dd830657f",
    "nycsr_interventionenddate@OData.Community.Display.V1.FormattedValue": "10/9/2021",
    "nycsr_interventionenddate": "2021-10-09T04:00:00Z",
    "nycsr_casenumber": "054276",
    "nycsr_interventionstartdate@OData.Community.Display.V1.FormattedValue": "10/1/2021",
    "nycsr_interventionstartdate": "2021-10-01T04:00:00Z",
    "nycsr_building.nycsr_address": "147-36 26 AVENUE",
    "nycsr_building.nycsr_latitude@OData.Community.Display.V1.FormattedValue": "40,774,134.000000",
    "nycsr_building.nycsr_latitude": 40774134,
    "nycsr_building.nycsr_buildingid": "adfc24e8-31f4-ea11-b882-24ee9a37d45c",
    "nycsr_building.nycsr_borough@OData.Community.Display.V1.FormattedValue": "Queens",
    "nycsr_building.nycsr_borough": 882450003,
    "nycsr_building.nycsr_longitude@OData.Community.Display.V1.FormattedValue": "-73,818,581.000000",
    "nycsr_building.nycsr_longitude": -73818581,
    "nycsr_building.nycsr_geographicaldistrictcode": "25",
    "nycsr_building.nycsr_buildingname": "P.S. 21 - QUEENS",
    "nycsr_locationsite.nycsr_sitename": "P.S. 021 Edward Hart - Q021 - Q021 - 25Q021 - 147-36 26 AVENUE"
  },
  {
    "@odata.etag": "W/\"324596878\"",
    "nycsr_admininterventiontype@OData.Community.Display.V1.FormattedValue": "Partial Classroom Quarantine",
    "nycsr_admininterventiontype": 882450001,
    "nycsr_caseid": "55a0b098-d41e-ec11-b6e6-001dd83068fb",
    "nycsr_interventionenddate@OData.Community.Display.V1.FormattedValue": "10/4/2021",
    "nycsr_interventionenddate": "2021-10-04T04:00:00Z",
    "nycsr_casenumber": "052461",
    "nycsr_interventionstartdate@OData.Community.Display.V1.FormattedValue": "9/27/2021",
    "nycsr_interventionstartdate": "2021-09-27T04:00:00Z",
    "nycsr_building.nycsr_address": "50 AVENUE X",
    "nycsr_building.nycsr_latitude@OData.Community.Display.V1.FormattedValue": "40,588,070.000000",
    "nycsr_building.nycsr_latitude": 40588070,
    "nycsr_building.nycsr_buildingid": "05fc3df4-30f4-ea11-b882-24ee9a37d45c",
    "nycsr_building.nycsr_borough@OData.Community.Display.V1.FormattedValue": "Brooklyn",
    "nycsr_building.nycsr_borough": 882450002,
    "nycsr_building.nycsr_longitude@OData.Community.Display.V1.FormattedValue": "-73,981,925.000000",
    "nycsr_building.nycsr_longitude": -73981925,
    "nycsr_building.nycsr_geographicaldistrictcode": "21",
    "nycsr_building.nycsr_buildingname": "JOHN DEWEY HS - K",
    "nycsr_locationsite.nycsr_sitename": "John Dewey High School - K540 - K540 - 21K540 - 50 AVENUE X"
  },
  {
    "@odata.etag": "W/\"325737896\"",
    "nycsr_admininterventiontype@OData.Community.Display.V1.FormattedValue": "Classroom Closed",
    "nycsr_admininterventiontype": 882450000,
    "nycsr_caseid": "9e2e9612-d71e-ec11-b6e6-001dd83068fb",
    "nycsr_interventionenddate@OData.Community.Display.V1.FormattedValue": "10/4/2021",
    "nycsr_interventionenddate": "2021-10-04T04:00:00Z",
    "nycsr_casenumber": "052466",
    "nycsr_interventionstartdate@OData.Community.Display.V1.FormattedValue": "9/27/2021",
    "nycsr_interventionstartdate": "2021-09-27T04:00:00Z",
    "nycsr_building.nycsr_address": "91-02 88 AVENUE",
    "nycsr_building.nycsr_latitude@OData.Community.Display.V1.FormattedValue": "40,691,467.000000",
    "nycsr_building.nycsr_latitude": 40691467,
    "nycsr_building.nycsr_buildingid": "8e8946f4-31f4-ea11-b882-24ee9a37d45c",
    "nycsr_building.nycsr_borough@OData.Community.Display.V1.FormattedValue": "Queens",
    "nycsr_building.nycsr_borough": 882450003,
    "nycsr_building.nycsr_longitude@OData.Community.Display.V1.FormattedValue": "-73,852,792.000000",
    "nycsr_building.nycsr_longitude": -73852792,
    "nycsr_building.nycsr_geographicaldistrictcode": "27",
    "nycsr_building.nycsr_buildingname": "P.S. 60 - QUEENS",
    "nycsr_locationsite.nycsr_sitename": "P.S. 060 Woodhaven - Q060 - Q060 - 27Q060 - 91-02 88 AVENUE"
  },
  {
    "@odata.etag": "W/\"324595381\"",
    "nycsr_admininterventiontype@OData.Community.Display.V1.FormattedValue": "Classroom Closed",
    "nycsr_admininterventiontype": 882450000,
    "nycsr_caseid": "9085d833-d91e-ec11-b6e6-001dd83068fb",
    "nycsr_interventionenddate@OData.Community.Display.V1.FormattedValue": "10/4/2021",
    "nycsr_interventionenddate": "2021-10-04T04:00:00Z",
    "nycsr_casenumber": "052470",
    "nycsr_interventionstartdate@OData.Community.Display.V1.FormattedValue": "9/27/2021",
    "nycsr_interventionstartdate": "2021-09-27T04:00:00Z",
    "nycsr_building.nycsr_address": "5601 16 AVENUE",
    "nycsr_building.nycsr_latitude@OData.Community.Display.V1.FormattedValue": "40,626,454.000000",
    "nycsr_building.nycsr_latitude": 40626454,
    "nycsr_building.nycsr_buildingid": "b8b36d80-30f4-ea11-b882-24ee9a37d45c",
    "nycsr_building.nycsr_borough@OData.Community.Display.V1.FormattedValue": "Brooklyn",
    "nycsr_building.nycsr_borough": 882450002,
    "nycsr_building.nycsr_longitude@OData.Community.Display.V1.FormattedValue": "-73,989,250.000000",
    "nycsr_building.nycsr_longitude": -73989250,
    "nycsr_building.nycsr_geographicaldistrictcode": "20",
    "nycsr_building.nycsr_buildingname": "P.S. 180 - BROOKLYN",
    "nycsr_locationsite.nycsr_sitename": "P.S. K231 - K231 - K180 - 75K231 - 5601 16 AVENUE"
  },
  {
    "@odata.etag": "W/\"328833352\"",
    "nycsr_admininterventiontype@OData.Community.Display.V1.FormattedValue": "Classroom Closed",
    "nycsr_admininterventiontype": 882450000,
    "nycsr_caseid": "04658ff9-df1e-ec11-b6e6-001dd83068fb",
    "nycsr_interventionenddate@OData.Community.Display.V1.FormattedValue": "10/3/2021",
    "nycsr_interventionenddate": "2021-10-03T04:00:00Z",
    "nycsr_casenumber": "052498",
    "nycsr_interventionstartdate@OData.Community.Display.V1.FormattedValue": "9/27/2021",
    "nycsr_interventionstartdate": "2021-09-27T04:00:00Z",
    "nycsr_building.nycsr_address": "51 JEFFERSON STREET",
    "nycsr_building.nycsr_latitude@OData.Community.Display.V1.FormattedValue": "40,590,887.000000",
    "nycsr_building.nycsr_latitude": 40590887,
    "nycsr_building.nycsr_buildingid": "4efdc1bd-32f4-ea11-b882-24ee9a37d45c",
    "nycsr_building.nycsr_borough@OData.Community.Display.V1.FormattedValue": "Staten Island",
    "nycsr_building.nycsr_borough": 882450004,
    "nycsr_building.nycsr_longitude@OData.Community.Display.V1.FormattedValue": "-74,098,252.000000",
    "nycsr_building.nycsr_longitude": -74098252,
    "nycsr_building.nycsr_geographicaldistrictcode": "31",
    "nycsr_building.nycsr_buildingname": "P.S. 11 - STATEN ISLAND",
    "nycsr_locationsite.nycsr_sitename": "P.S. 11 Thomas Dongan School - R011 - R011 - 31R011 - 51 JEFFERSON STREET"
  },
  {
    "@odata.etag": "W/\"325761962\"",
    "nycsr_admininterventiontype@OData.Community.Display.V1.FormattedValue": "Classroom Closed",
    "nycsr_admininterventiontype": 882450000,
    "nycsr_caseid": "5c696fbc-e11e-ec11-b6e6-001dd83068fb",
    "nycsr_interventionenddate@OData.Community.Display.V1.FormattedValue": "10/4/2021",
    "nycsr_interventionenddate": "2021-10-04T04:00:00Z",
    "nycsr_casenumber": "052510",
    "nycsr_interventionstartdate@OData.Community.Display.V1.FormattedValue": "9/27/2021",
    "nycsr_interventionstartdate": "2021-09-27T04:00:00Z",
    "nycsr_building.nycsr_address": "138-01 77 AVENUE",
    "nycsr_building.nycsr_latitude@OData.Community.Display.V1.FormattedValue": "40,721,514.000000",
    "nycsr_building.nycsr_latitude": 40721514,
    "nycsr_building.nycsr_buildingid": "ff9b4c1f-32f4-ea11-b882-24ee9a37d45c",
    "nycsr_building.nycsr_borough@OData.Community.Display.V1.FormattedValue": "Queens",
    "nycsr_building.nycsr_borough": 882450003,
    "nycsr_building.nycsr_longitude@OData.Community.Display.V1.FormattedValue": "-73,823,569.000000",
    "nycsr_building.nycsr_longitude": -73823569,
    "nycsr_building.nycsr_geographicaldistrictcode": "25",
    "nycsr_building.nycsr_buildingname": "P.S. 164 - QUEENS",
    "nycsr_locationsite.nycsr_sitename": "P.S. 164 Queens Valley - Q164 - Q164 - 25Q164 - 138-01 77 AVENUE"
  },
  {
    "@odata.etag": "W/\"327007805\"",
    "nycsr_admininterventiontype@OData.Community.Display.V1.FormattedValue": "Partial Classroom Quarantine",
    "nycsr_admininterventiontype": 882450001,
    "nycsr_caseid": "f4a6344f-e21e-ec11-b6e6-001dd83068fb",
    "nycsr_interventionenddate@OData.Community.Display.V1.FormattedValue": "10/4/2021",
    "nycsr_interventionenddate": "2021-10-04T04:00:00Z",
    "nycsr_casenumber": "052514",
    "nycsr_interventionstartdate@OData.Community.Display.V1.FormattedValue": "9/27/2021",
    "nycsr_interventionstartdate": "2021-09-27T04:00:00Z",
    "nycsr_building.nycsr_address": "111 EAST  33RD STREET",
    "nycsr_building.nycsr_latitude@OData.Community.Display.V1.FormattedValue": "40,746,510.000000",
    "nycsr_building.nycsr_latitude": 40746510,
    "nycsr_building.nycsr_buildingid": "a0d810ab-31f4-ea11-b882-24ee9a37d45c",
    "nycsr_building.nycsr_borough@OData.Community.Display.V1.FormattedValue": "Manhattan",
    "nycsr_building.nycsr_borough": 882450000,
    "nycsr_building.nycsr_longitude@OData.Community.Display.V1.FormattedValue": "-73,981,070.000000",
    "nycsr_building.nycsr_longitude": -73981070,
    "nycsr_building.nycsr_geographicaldistrictcode": "2",
    "nycsr_building.nycsr_buildingname": "NORMAN THOMAS HS (ECF) - MANHATTAN",
    "nycsr_locationsite.nycsr_sitename": "Manhattan Academy For Arts & Language - M427 - M620 - 02M427 - 111 EAST  33RD STREET"
  },
  {
    "@odata.etag": "W/\"327137050\"",
    "nycsr_admininterventiontype@OData.Community.Display.V1.FormattedValue": "Classroom Closed",
    "nycsr_admininterventiontype": 882450000,
    "nycsr_caseid": "10c1b99c-e41e-ec11-b6e6-001dd83068fb",
    "nycsr_interventionenddate@OData.Community.Display.V1.FormattedValue": "10/3/2021",
    "nycsr_interventionenddate": "2021-10-03T04:00:00Z",
    "nycsr_casenumber": "052527",
    "nycsr_interventionstartdate@OData.Community.Display.V1.FormattedValue": "9/27/2021",
    "nycsr_interventionstartdate": "2021-09-27T04:00:00Z",
    "nycsr_building.nycsr_address": "725 EAST  23 STREET",
    "nycsr_building.nycsr_latitude@OData.Community.Display.V1.FormattedValue": "40,632,619.000000",
    "nycsr_building.nycsr_latitude": 40632619,
    "nycsr_building.nycsr_buildingid": "efd27c6d-30f4-ea11-b882-24ee9a37d45c",
    "nycsr_building.nycsr_borough@OData.Community.Display.V1.FormattedValue": "Brooklyn",
    "nycsr_building.nycsr_borough": 882450002,
    "nycsr_building.nycsr_longitude@OData.Community.Display.V1.FormattedValue": "-73,954,269.000000",
    "nycsr_building.nycsr_longitude": -73954269,
    "nycsr_building.nycsr_geographicaldistrictcode": "22",
    "nycsr_building.nycsr_buildingname": "P.S. 152 - BROOKLYN",
    "nycsr_locationsite.nycsr_sitename": "P.S. K315 - K315 - K152 - 22K315 - 2310 GLENWOOD ROAD"
  },
  {
    "@odata.etag": "W/\"327142741\"",
    "nycsr_admininterventiontype@OData.Community.Display.V1.FormattedValue": "Partial Classroom Quarantine",
    "nycsr_admininterventiontype": 882450001,
    "nycsr_caseid": "e71247a2-e61e-ec11-b6e6-001dd83068fb",
    "nycsr_interventionenddate@OData.Community.Display.V1.FormattedValue": "10/4/2021",
    "nycsr_interventionenddate": "2021-10-04T04:00:00Z",
    "nycsr_casenumber": "052533",
    "nycsr_interventionstartdate@OData.Community.Display.V1.FormattedValue": "9/27/2021",
    "nycsr_interventionstartdate": "2021-09-27T04:00:00Z",
    "nycsr_building.nycsr_address": "544 7TH AVENUE",
    "nycsr_building.nycsr_latitude@OData.Community.Display.V1.FormattedValue": "40,660,805.000000",
    "nycsr_building.nycsr_latitude": 40660805,
    "nycsr_building.nycsr_buildingid": "76d92255-30f4-ea11-b882-24ee9a37d45c",
    "nycsr_building.nycsr_borough@OData.Community.Display.V1.FormattedValue": "Brooklyn",
    "nycsr_building.nycsr_borough": 882450002,
    "nycsr_building.nycsr_longitude@OData.Community.Display.V1.FormattedValue": "-73,988,743.000000",
    "nycsr_building.nycsr_longitude": -73988743,
    "nycsr_building.nycsr_geographicaldistrictcode": "15",
    "nycsr_building.nycsr_buildingname": "I.S. 88 - BROOKLYN",
    "nycsr_locationsite.nycsr_sitename": "J.H.S. 088 Peter Rouget - K088 - K088 - 15K088 - 544 7TH AVENUE"
  },
  {
    "@odata.etag": "W/\"324596943\"",
    "nycsr_admininterventiontype@OData.Community.Display.V1.FormattedValue": "Classroom Closed",
    "nycsr_admininterventiontype": 882450000,
    "nycsr_caseid": "72ac4d77-ea1e-ec11-b6e6-001dd83068fb",
    "nycsr_interventionenddate@OData.Community.Display.V1.FormattedValue": "10/4/2021",
    "nycsr_interventionenddate": "2021-10-04T04:00:00Z",
    "nycsr_casenumber": "052540",
    "nycsr_interventionstartdate@OData.Community.Display.V1.FormattedValue": "9/27/2021",
    "nycsr_interventionstartdate": "2021-09-27T04:00:00Z",
    "nycsr_building.nycsr_address": "1075 PUGSLEY AVENUE",
    "nycsr_building.nycsr_latitude@OData.Community.Display.V1.FormattedValue": "40,828,474.000000",
    "nycsr_building.nycsr_latitude": 40828474,
    "nycsr_building.nycsr_buildingid": "0f78931f-33f4-ea11-b882-24ee9a37d45c",
    "nycsr_building.nycsr_borough@OData.Community.Display.V1.FormattedValue": "Bronx",
    "nycsr_building.nycsr_borough": 882450001,
    "nycsr_building.nycsr_longitude@OData.Community.Display.V1.FormattedValue": "-73,857,392.000000",
    "nycsr_building.nycsr_longitude": -73857392,
    "nycsr_building.nycsr_geographicaldistrictcode": "8",
    "nycsr_building.nycsr_buildingname": "P.S. 119 - BRONX",
    "nycsr_locationsite.nycsr_sitename": "The Dr. Emmett W. Bassett School - X119 - X119 - 08X119 - 1075 PUGSLEY AVENUE"
  },
  {
    "@odata.etag": "W/\"325854157\"",
    "nycsr_admininterventiontype@OData.Community.Display.V1.FormattedValue": "Partial Classroom Quarantine",
    "nycsr_admininterventiontype": 882450001,
    "nycsr_caseid": "8d95b899-ed1e-ec11-b6e6-001dd83068fb",
    "nycsr_interventionenddate@OData.Community.Display.V1.FormattedValue": "10/4/2021",
    "nycsr_interventionenddate": "2021-10-04T04:00:00Z",
    "nycsr_casenumber": "052549",
    "nycsr_interventionstartdate@OData.Community.Display.V1.FormattedValue": "9/27/2021",
    "nycsr_interventionstartdate": "2021-09-27T04:00:00Z",
    "nycsr_building.nycsr_address": "58-20 UTOPIA PARKWAY",
    "nycsr_building.nycsr_latitude@OData.Community.Display.V1.FormattedValue": "40,740,875.000000",
    "nycsr_building.nycsr_latitude": 40740875,
    "nycsr_building.nycsr_buildingid": "bcb66262-32f4-ea11-b882-24ee9a37d45c",
    "nycsr_building.nycsr_borough@OData.Community.Display.V1.FormattedValue": "Queens",
    "nycsr_building.nycsr_borough": 882450003,
    "nycsr_building.nycsr_longitude@OData.Community.Display.V1.FormattedValue": "-73,795,049.000000",
    "nycsr_building.nycsr_longitude": -73795049,
    "nycsr_building.nycsr_geographicaldistrictcode": "26",
    "nycsr_building.nycsr_buildingname": "FRANCIS LEWIS HS - Q",
    "nycsr_locationsite.nycsr_sitename": "Francis Lewis High School - Q430 - Q430 - 26Q430 - 58-20 UTOPIA PARKWAY"
  },
  {
    "@odata.etag": "W/\"327247556\"",
    "nycsr_admininterventiontype@OData.Community.Display.V1.FormattedValue": "Partial Classroom Quarantine",
    "nycsr_admininterventiontype": 882450001,
    "nycsr_caseid": "60c5ed97-f01e-ec11-b6e6-001dd83068fb",
    "nycsr_interventionenddate@OData.Community.Display.V1.FormattedValue": "10/4/2021",
    "nycsr_interventionenddate": "2021-10-04T04:00:00Z",
    "nycsr_casenumber": "052556",
    "nycsr_interventionstartdate@OData.Community.Display.V1.FormattedValue": "9/27/2021",
    "nycsr_interventionstartdate": "2021-09-27T04:00:00Z",
    "nycsr_building.nycsr_address": "100-00 BEACH CHANNEL DRIVE",
    "nycsr_building.nycsr_latitude@OData.Community.Display.V1.FormattedValue": "40,586,012.000000",
    "nycsr_building.nycsr_latitude": 40586012,
    "nycsr_building.nycsr_buildingid": "71e2635c-32f4-ea11-b882-24ee9a37d45c",
    "nycsr_building.nycsr_borough@OData.Community.Display.V1.FormattedValue": "Queens",
    "nycsr_building.nycsr_borough": 882450003,
    "nycsr_building.nycsr_longitude@OData.Community.Display.V1.FormattedValue": "-73,825,317.000000",
    "nycsr_building.nycsr_longitude": -73825317,
    "nycsr_building.nycsr_geographicaldistrictcode": "27",
    "nycsr_building.nycsr_buildingname": "Beach Channel Educational Campus",
    "nycsr_locationsite.nycsr_sitename": "Rockaway Park High School for Environmental Sustainability - Q324 - Q410 - 27Q324 - 100-00 BEACH CHANNEL DRIVE"
  },
  {
    "@odata.etag": "W/\"327666906\"",
    "nycsr_admininterventiontype@OData.Community.Display.V1.FormattedValue": "Partial Classroom Quarantine",
    "nycsr_admininterventiontype": 882450001,
    "nycsr_caseid": "ae434bab-f41e-ec11-b6e6-001dd83068fb",
    "nycsr_interventionenddate@OData.Community.Display.V1.FormattedValue": "10/4/2021",
    "nycsr_interventionenddate": "2021-10-04T04:00:00Z",
    "nycsr_casenumber": "052566",
    "nycsr_interventionstartdate@OData.Community.Display.V1.FormattedValue": "9/27/2021",
    "nycsr_interventionstartdate": "2021-09-27T04:00:00Z",
    "nycsr_building.nycsr_address": "800 VAN SICLEN AVE",
    "nycsr_building.nycsr_latitude@OData.Community.Display.V1.FormattedValue": "40,659,934.000000",
    "nycsr_building.nycsr_latitude": 40659934,
    "nycsr_building.nycsr_buildingid": "41ebaa73-30f4-ea11-b882-24ee9a37d45c",
    "nycsr_building.nycsr_borough@OData.Community.Display.V1.FormattedValue": "Brooklyn",
    "nycsr_building.nycsr_borough": 882450002,
    "nycsr_building.nycsr_longitude@OData.Community.Display.V1.FormattedValue": "-73,885,704.000000",
    "nycsr_building.nycsr_longitude": -73885704,
    "nycsr_building.nycsr_geographicaldistrictcode": "19",
    "nycsr_building.nycsr_buildingname": "I.S. 166 - BROOKLYN",
    "nycsr_locationsite.nycsr_sitename": "Van Siclen Community Middle School - K654 - K166 - 19K654 - 800 VAN SICLEN AVE"
  },
  {
    "@odata.etag": "W/\"325406029\"",
    "nycsr_admininterventiontype@OData.Community.Display.V1.FormattedValue": "Partial Classroom Quarantine",
    "nycsr_admininterventiontype": 882450001,
    "nycsr_caseid": "5da1693f-f61e-ec11-b6e6-001dd83068fb",
    "nycsr_interventionenddate@OData.Community.Display.V1.FormattedValue": "10/4/2021",
    "nycsr_interventionenddate": "2021-10-04T04:00:00Z",
    "nycsr_casenumber": "052572",
    "nycsr_interventionstartdate@OData.Community.Display.V1.FormattedValue": "9/27/2021",
    "nycsr_interventionstartdate": "2021-09-27T04:00:00Z",
    "nycsr_building.nycsr_address": "150 ALBANY AVENUE",
    "nycsr_building.nycsr_latitude@OData.Community.Display.V1.FormattedValue": "40,675,905.000000",
    "nycsr_building.nycsr_latitude": 40675905,
    "nycsr_building.nycsr_buildingid": "23416e00-31f4-ea11-b882-24ee9a37d45c",
    "nycsr_building.nycsr_borough@OData.Community.Display.V1.FormattedValue": "Brooklyn",
    "nycsr_building.nycsr_borough": 882450002,
    "nycsr_building.nycsr_longitude@OData.Community.Display.V1.FormattedValue": "-73,939,282.000000",
    "nycsr_building.nycsr_longitude": -73939282,
    "nycsr_building.nycsr_geographicaldistrictcode": "17",
    "nycsr_building.nycsr_buildingname": "ROBESON HS COMP&BUS TC (A HML)-K",
    "nycsr_locationsite.nycsr_sitename": "Pathways in Technology Early College High School (P-Tech) - K122 - K625 - 17K122 - 150 ALBANY AVENUE"
  },
  {
    "@odata.etag": "W/\"324597763\"",
    "nycsr_admininterventiontype@OData.Community.Display.V1.FormattedValue": "Non-Classroom Quarantine",
    "nycsr_admininterventiontype": 882450003,
    "nycsr_caseid": "1cf6bfe6-f91e-ec11-b6e6-001dd83068fb",
    "nycsr_interventionenddate@OData.Community.Display.V1.FormattedValue": "10/3/2021",
    "nycsr_interventionenddate": "2021-10-03T04:00:00Z",
    "nycsr_casenumber": "052578",
    "nycsr_interventionstartdate@OData.Community.Display.V1.FormattedValue": "9/27/2021",
    "nycsr_interventionstartdate": "2021-09-27T04:00:00Z",
    "nycsr_building.nycsr_address": "105 East 106th Street",
    "nycsr_building.nycsr_latitude@OData.Community.Display.V1.FormattedValue": "40,792,932.000000",
    "nycsr_building.nycsr_latitude": 40792932,
    "nycsr_building.nycsr_buildingid": "d4ed94c3-31f4-ea11-b882-24ee9a37d45c",
    "nycsr_building.nycsr_borough@OData.Community.Display.V1.FormattedValue": "Manhattan",
    "nycsr_building.nycsr_borough": 882450000,
    "nycsr_building.nycsr_longitude@OData.Community.Display.V1.FormattedValue": "-73,947,171.000000",
    "nycsr_building.nycsr_longitude": -73947171,
    "nycsr_building.nycsr_geographicaldistrictcode": "4",
    "nycsr_building.nycsr_buildingname": "YOUNG WOMEN'S LEADERSHIP HS - M",
    "nycsr_locationsite.nycsr_sitename": "Young Women's Leadership School - M610 - M895 - 04M610 - 105 East 106th Street"
  },
  {
    "@odata.etag": "W/\"325137983\"",
    "nycsr_admininterventiontype@OData.Community.Display.V1.FormattedValue": "Classroom Closed",
    "nycsr_admininterventiontype": 882450000,
    "nycsr_caseid": "de5b89b8-fa1e-ec11-b6e6-001dd83068fb",
    "nycsr_interventionenddate@OData.Community.Display.V1.FormattedValue": "10/3/2021",
    "nycsr_interventionenddate": "2021-10-03T04:00:00Z",
    "nycsr_casenumber": "052581",
    "nycsr_interventionstartdate@OData.Community.Display.V1.FormattedValue": "9/27/2021",
    "nycsr_interventionstartdate": "2021-09-27T04:00:00Z",
    "nycsr_building.nycsr_address": "425 EAST 35TH STREET",
    "nycsr_building.nycsr_latitude@OData.Community.Display.V1.FormattedValue": "40,744,288.000000",
    "nycsr_building.nycsr_latitude": 40744288,
    "nycsr_building.nycsr_buildingid": "cde0838c-31f4-ea11-b882-24ee9a37d45c",
    "nycsr_building.nycsr_borough@OData.Community.Display.V1.FormattedValue": "Manhattan",
    "nycsr_building.nycsr_borough": 882450000,
    "nycsr_building.nycsr_longitude@OData.Community.Display.V1.FormattedValue": "-73,972,592.000000",
    "nycsr_building.nycsr_longitude": -73972592,
    "nycsr_building.nycsr_geographicaldistrictcode": "2",
    "nycsr_building.nycsr_buildingname": "P.S. 281 - MANHATTAN",
    "nycsr_locationsite.nycsr_sitename": "The River School - M281 - M281 - 02M281 - 425 EAST 35TH STREET"
  },
  {
    "@odata.etag": "W/\"325148147\"",
    "nycsr_admininterventiontype@OData.Community.Display.V1.FormattedValue": "Classroom Closed",
    "nycsr_admininterventiontype": 882450000,
    "nycsr_caseid": "49eee85d-fb1e-ec11-b6e6-001dd83068fb",
    "nycsr_interventionenddate@OData.Community.Display.V1.FormattedValue": "10/3/2021",
    "nycsr_interventionenddate": "2021-10-03T04:00:00Z",
    "nycsr_casenumber": "052583",
    "nycsr_interventionstartdate@OData.Community.Display.V1.FormattedValue": "9/27/2021",
    "nycsr_interventionstartdate": "2021-09-27T04:00:00Z",
    "nycsr_building.nycsr_address": "425 EAST 35TH STREET",
    "nycsr_building.nycsr_latitude@OData.Community.Display.V1.FormattedValue": "40,744,288.000000",
    "nycsr_building.nycsr_latitude": 40744288,
    "nycsr_building.nycsr_buildingid": "cde0838c-31f4-ea11-b882-24ee9a37d45c",
    "nycsr_building.nycsr_borough@OData.Community.Display.V1.FormattedValue": "Manhattan",
    "nycsr_building.nycsr_borough": 882450000,
    "nycsr_building.nycsr_longitude@OData.Community.Display.V1.FormattedValue": "-73,972,592.000000",
    "nycsr_building.nycsr_longitude": -73972592,
    "nycsr_building.nycsr_geographicaldistrictcode": "2",
    "nycsr_building.nycsr_buildingname": "P.S. 281 - MANHATTAN",
    "nycsr_locationsite.nycsr_sitename": "The River School - M281 - M281 - 02M281 - 425 EAST 35TH STREET"
  },
  {
    "@odata.etag": "W/\"325760998\"",
    "nycsr_admininterventiontype@OData.Community.Display.V1.FormattedValue": "Classroom Closed",
    "nycsr_admininterventiontype": 882450000,
    "nycsr_caseid": "daea9193-fb1e-ec11-b6e6-001dd83068fb",
    "nycsr_interventionenddate@OData.Community.Display.V1.FormattedValue": "10/2/2021",
    "nycsr_interventionenddate": "2021-10-02T04:00:00Z",
    "nycsr_casenumber": "052584",
    "nycsr_interventionstartdate@OData.Community.Display.V1.FormattedValue": "9/27/2021",
    "nycsr_interventionstartdate": "2021-09-27T04:00:00Z",
    "nycsr_building.nycsr_address": "22 East 128 Street",
    "nycsr_building.nycsr_latitude@OData.Community.Display.V1.FormattedValue": "40,807,692.000000",
    "nycsr_building.nycsr_latitude": 40807692,
    "nycsr_building.nycsr_buildingid": "dfed94c3-31f4-ea11-b882-24ee9a37d45c",
    "nycsr_building.nycsr_borough@OData.Community.Display.V1.FormattedValue": "Manhattan",
    "nycsr_building.nycsr_borough": 882450000,
    "nycsr_building.nycsr_longitude@OData.Community.Display.V1.FormattedValue": "-73,939,974.000000",
    "nycsr_building.nycsr_longitude": -73939974,
    "nycsr_building.nycsr_geographicaldistrictcode": "5",
    "nycsr_building.nycsr_buildingname": "HARLEM RENAISSANCE HS (OLD M24)-M",
    "nycsr_locationsite.nycsr_sitename": "LYFE - M984 - M911 - 79M984 - 22 East 128 Street"
  },
  {
    "@odata.etag": "W/\"324595826\"",
    "nycsr_admininterventiontype@OData.Community.Display.V1.FormattedValue": "Classroom Closed",
    "nycsr_admininterventiontype": 882450000,
    "nycsr_caseid": "56c9fcef-fc1e-ec11-b6e6-001dd83068fb",
    "nycsr_interventionenddate@OData.Community.Display.V1.FormattedValue": "10/4/2021",
    "nycsr_interventionenddate": "2021-10-04T04:00:00Z",
    "nycsr_casenumber": "052589",
    "nycsr_interventionstartdate@OData.Community.Display.V1.FormattedValue": "9/27/2021",
    "nycsr_interventionstartdate": "2021-09-27T04:00:00Z",
    "nycsr_building.nycsr_address": "109-59 INWOOD STREET",
    "nycsr_building.nycsr_latitude@OData.Community.Display.V1.FormattedValue": "40,688,373.000000",
    "nycsr_building.nycsr_latitude": 40688373,
    "nycsr_building.nycsr_buildingid": "ee9b4c1f-32f4-ea11-b882-24ee9a37d45c",
    "nycsr_building.nycsr_borough@OData.Community.Display.V1.FormattedValue": "Queens",
    "nycsr_building.nycsr_borough": 882450003,
    "nycsr_building.nycsr_longitude@OData.Community.Display.V1.FormattedValue": "-73,799,685.000000",
    "nycsr_building.nycsr_longitude": -73799685,
    "nycsr_building.nycsr_geographicaldistrictcode": "28",
    "nycsr_building.nycsr_buildingname": "P.S. 160 - QUEENS",
    "nycsr_locationsite.nycsr_sitename": "P.S. 160 Walter Francis Bishop - Q160 - Q160 - 28Q160 - 109-59 INWOOD STREET"
  },
  {
    "@odata.etag": "W/\"325860836\"",
    "nycsr_admininterventiontype@OData.Community.Display.V1.FormattedValue": "Classroom Closed",
    "nycsr_admininterventiontype": 882450000,
    "nycsr_caseid": "793022c1-851f-ec11-b6e6-001dd83068fb",
    "nycsr_interventionenddate@OData.Community.Display.V1.FormattedValue": "10/4/2021",
    "nycsr_interventionenddate": "2021-10-04T04:00:00Z",
    "nycsr_casenumber": "052612",
    "nycsr_interventionstartdate@OData.Community.Display.V1.FormattedValue": "9/28/2021",
    "nycsr_interventionstartdate": "2021-09-28T04:00:00Z",
    "nycsr_building.nycsr_address": "255 IONIA AVENUE",
    "nycsr_building.nycsr_latitude@OData.Community.Display.V1.FormattedValue": "40,543,433.000000",
    "nycsr_building.nycsr_latitude": 40543433,
    "nycsr_building.nycsr_buildingid": "8ba9d9c3-32f4-ea11-b882-24ee9a37d45c",
    "nycsr_building.nycsr_borough@OData.Community.Display.V1.FormattedValue": "Staten Island",
    "nycsr_building.nycsr_borough": 882450004,
    "nycsr_building.nycsr_longitude@OData.Community.Display.V1.FormattedValue": "-74,182,548.000000",
    "nycsr_building.nycsr_longitude": -74182548,
    "nycsr_building.nycsr_geographicaldistrictcode": "31",
    "nycsr_building.nycsr_buildingname": "P.S. 36 - STATEN ISLAND",
    "nycsr_locationsite.nycsr_sitename": "P.S. 036 J. C. Drumgoole - R036 - R036 - 31R036 - 255 IONIA AVENUE"
  },
  {
    "@odata.etag": "W/\"327112617\"",
    "nycsr_admininterventiontype@OData.Community.Display.V1.FormattedValue": "Partial Classroom Quarantine",
    "nycsr_admininterventiontype": 882450001,
    "nycsr_caseid": "803cee84-861f-ec11-b6e6-001dd83068fb",
    "nycsr_interventionenddate@OData.Community.Display.V1.FormattedValue": "10/4/2021",
    "nycsr_interventionenddate": "2021-10-04T04:00:00Z",
    "nycsr_casenumber": "052618",
    "nycsr_interventionstartdate@OData.Community.Display.V1.FormattedValue": "9/28/2021",
    "nycsr_interventionstartdate": "2021-09-28T04:00:00Z",
    "nycsr_building.nycsr_address": "577 EAST 179 STREET",
    "nycsr_building.nycsr_latitude@OData.Community.Display.V1.FormattedValue": "40,848,702.000000",
    "nycsr_building.nycsr_latitude": 40848702,
    "nycsr_building.nycsr_buildingid": "0b78931f-33f4-ea11-b882-24ee9a37d45c",
    "nycsr_building.nycsr_borough@OData.Community.Display.V1.FormattedValue": "Bronx",
    "nycsr_building.nycsr_borough": 882450001,
    "nycsr_building.nycsr_longitude@OData.Community.Display.V1.FormattedValue": "-73,892,482.000000",
    "nycsr_building.nycsr_longitude": -73892482,
    "nycsr_building.nycsr_geographicaldistrictcode": "10",
    "nycsr_building.nycsr_buildingname": "I.S. 118 - BRONX",
    "nycsr_locationsite.nycsr_sitename": "J.H.S. 118 William W. Niles - X118 - X118 - 10X118 - 577 EAST 179 STREET"
  },
  {
    "@odata.etag": "W/\"325860881\"",
    "nycsr_admininterventiontype@OData.Community.Display.V1.FormattedValue": "Partial Classroom Quarantine",
    "nycsr_admininterventiontype": 882450001,
    "nycsr_caseid": "e44240b6-871f-ec11-b6e6-001dd83068fb",
    "nycsr_interventionenddate@OData.Community.Display.V1.FormattedValue": "10/4/2021",
    "nycsr_interventionenddate": "2021-10-04T04:00:00Z",
    "nycsr_casenumber": "052624",
    "nycsr_interventionstartdate@OData.Community.Display.V1.FormattedValue": "9/28/2021",
    "nycsr_interventionstartdate": "2021-09-28T04:00:00Z",
    "nycsr_building.nycsr_address": "35 SNYDER AVENUE",
    "nycsr_building.nycsr_latitude@OData.Community.Display.V1.FormattedValue": "40,648,949.000000",
    "nycsr_building.nycsr_latitude": 40648949,
    "nycsr_building.nycsr_buildingid": "0e04d718-31f4-ea11-b882-24ee9a37d45c",
    "nycsr_building.nycsr_borough@OData.Community.Display.V1.FormattedValue": "Brooklyn",
    "nycsr_building.nycsr_borough": 882450002,
    "nycsr_building.nycsr_longitude@OData.Community.Display.V1.FormattedValue": "-73,956,928.000000",
    "nycsr_building.nycsr_longitude": -73956928,
    "nycsr_building.nycsr_geographicaldistrictcode": "17",
    "nycsr_building.nycsr_buildingname": "P.S. 369 AX-(OL 396X/FLTB TN HL)-K",
    "nycsr_locationsite.nycsr_sitename": "P.S. 373 - Brooklyn Transition Center - K373 - K877 - 75K373 - 35 SNYDER AVENUE"
  },
  {
    "@odata.etag": "W/\"326848439\"",
    "nycsr_admininterventiontype@OData.Community.Display.V1.FormattedValue": "Partial Classroom Quarantine",
    "nycsr_admininterventiontype": 882450001,
    "nycsr_caseid": "2262b337-881f-ec11-b6e6-001dd83068fb",
    "nycsr_interventionenddate@OData.Community.Display.V1.FormattedValue": "10/4/2021",
    "nycsr_interventionenddate": "2021-10-04T04:00:00Z",
    "nycsr_casenumber": "052627",
    "nycsr_interventionstartdate@OData.Community.Display.V1.FormattedValue": "9/28/2021",
    "nycsr_interventionstartdate": "2021-09-28T04:00:00Z",
    "nycsr_building.nycsr_address": "77-02 37 AVENUE",
    "nycsr_building.nycsr_latitude@OData.Community.Display.V1.FormattedValue": "40,748,804.000000",
    "nycsr_building.nycsr_latitude": 40748804,
    "nycsr_building.nycsr_buildingid": "682f77fa-31f4-ea11-b882-24ee9a37d45c",
    "nycsr_building.nycsr_borough@OData.Community.Display.V1.FormattedValue": "Queens",
    "nycsr_building.nycsr_borough": 882450003,
    "nycsr_building.nycsr_longitude@OData.Community.Display.V1.FormattedValue": "-73,888,457.000000",
    "nycsr_building.nycsr_longitude": -73888457,
    "nycsr_building.nycsr_geographicaldistrictcode": "30",
    "nycsr_building.nycsr_buildingname": "P.S. 69 - QUEENS",
    "nycsr_locationsite.nycsr_sitename": "P.S. 069 Jackson Heights - Q069 - Q069 - 30Q069 - 77-02 37 AVENUE"
  },
  {
    "@odata.etag": "W/\"325860907\"",
    "nycsr_admininterventiontype@OData.Community.Display.V1.FormattedValue": "Partial Classroom Quarantine",
    "nycsr_admininterventiontype": 882450001,
    "nycsr_caseid": "27bb0fa5-881f-ec11-b6e6-001dd83068fb",
    "nycsr_interventionenddate@OData.Community.Display.V1.FormattedValue": "10/2/2021",
    "nycsr_interventionenddate": "2021-10-02T04:00:00Z",
    "nycsr_casenumber": "052630",
    "nycsr_interventionstartdate@OData.Community.Display.V1.FormattedValue": "9/28/2021",
    "nycsr_interventionstartdate": "2021-09-28T04:00:00Z",
    "nycsr_building.nycsr_address": "108-10 109 AVENUE",
    "nycsr_building.nycsr_latitude@OData.Community.Display.V1.FormattedValue": "40,679,083.000000",
    "nycsr_building.nycsr_latitude": 40679083,
    "nycsr_building.nycsr_buildingid": "b92ff20c-32f4-ea11-b882-24ee9a37d45c",
    "nycsr_building.nycsr_borough@OData.Community.Display.V1.FormattedValue": "Queens",
    "nycsr_building.nycsr_borough": 882450003,
    "nycsr_building.nycsr_longitude@OData.Community.Display.V1.FormattedValue": "-73,831,025.000000",
    "nycsr_building.nycsr_longitude": -73831025,
    "nycsr_building.nycsr_geographicaldistrictcode": "27",
    "nycsr_building.nycsr_buildingname": "P.S. 108 - QUEENS",
    "nycsr_locationsite.nycsr_sitename": "P.S. 108 Captain Vincent G. Fowler - Q108 - Q108 - 27Q108 - 108-10 109 AVENUE"
  },
  {
    "@odata.etag": "W/\"325860927\"",
    "nycsr_admininterventiontype@OData.Community.Display.V1.FormattedValue": "Partial Classroom Quarantine",
    "nycsr_admininterventiontype": 882450001,
    "nycsr_caseid": "43826221-891f-ec11-b6e6-001dd83068fb",
    "nycsr_interventionenddate@OData.Community.Display.V1.FormattedValue": "10/4/2021",
    "nycsr_interventionenddate": "2021-10-04T04:00:00Z",
    "nycsr_casenumber": "052634",
    "nycsr_interventionstartdate@OData.Community.Display.V1.FormattedValue": "9/28/2021",
    "nycsr_interventionstartdate": "2021-09-28T04:00:00Z",
    "nycsr_building.nycsr_address": "257 NORTH  6 STREET",
    "nycsr_building.nycsr_latitude@OData.Community.Display.V1.FormattedValue": "40,715,561.000000",
    "nycsr_building.nycsr_latitude": 40715561,
    "nycsr_building.nycsr_buildingid": "29416e00-31f4-ea11-b882-24ee9a37d45c",
    "nycsr_building.nycsr_borough@OData.Community.Display.V1.FormattedValue": "Brooklyn",
    "nycsr_building.nycsr_borough": 882450002,
    "nycsr_building.nycsr_longitude@OData.Community.Display.V1.FormattedValue": "-73,954,815.000000",
    "nycsr_building.nycsr_longitude": -73954815,
    "nycsr_building.nycsr_geographicaldistrictcode": "14",
    "nycsr_building.nycsr_buildingname": "HARRY VANARSDALE VOC H (WHITNEY)-K",
    "nycsr_locationsite.nycsr_sitename": "Williamsburg Preparatory School - K561 - K650 - 14K561 - 257 NORTH  6 STREET"
  },
  {
    "@odata.etag": "W/\"327675733\"",
    "nycsr_admininterventiontype@OData.Community.Display.V1.FormattedValue": "Partial Classroom Quarantine",
    "nycsr_admininterventiontype": 882450001,
    "nycsr_caseid": "efb852c4-8c1f-ec11-b6e6-001dd83068fb",
    "nycsr_interventionenddate@OData.Community.Display.V1.FormattedValue": "10/4/2021",
    "nycsr_interventionenddate": "2021-10-04T04:00:00Z",
    "nycsr_casenumber": "052647",
    "nycsr_interventionstartdate@OData.Community.Display.V1.FormattedValue": "9/29/2021",
    "nycsr_interventionstartdate": "2021-09-29T04:00:00Z",
    "nycsr_building.nycsr_address": "320 EAST  96 STREET",
    "nycsr_building.nycsr_latitude@OData.Community.Display.V1.FormattedValue": "40,783,286.000000",
    "nycsr_building.nycsr_latitude": 40783286,
    "nycsr_building.nycsr_buildingid": "570c1bb1-31f4-ea11-b882-24ee9a37d45c",
    "nycsr_building.nycsr_borough@OData.Community.Display.V1.FormattedValue": "Manhattan",
    "nycsr_building.nycsr_borough": 882450000,
    "nycsr_building.nycsr_longitude@OData.Community.Display.V1.FormattedValue": "-73,945,933.000000",
    "nycsr_building.nycsr_longitude": -73945933,
    "nycsr_building.nycsr_geographicaldistrictcode": "2",
    "nycsr_building.nycsr_buildingname": "OLD MANHATTAN VOC/TECH HS - M",
    "nycsr_locationsite.nycsr_sitename": "The High School for Climate Justice - M655 - M645 - 02M655 - 320 EAST  96 STREET"
  },
  {
    "@odata.etag": "W/\"325860987\"",
    "nycsr_admininterventiontype@OData.Community.Display.V1.FormattedValue": "Non-Classroom Quarantine",
    "nycsr_admininterventiontype": 882450003,
    "nycsr_caseid": "ca1f3b5b-8d1f-ec11-b6e6-001dd83068fb",
    "nycsr_interventionenddate@OData.Community.Display.V1.FormattedValue": "10/4/2021",
    "nycsr_interventionenddate": "2021-10-04T04:00:00Z",
    "nycsr_casenumber": "052651",
    "nycsr_interventionstartdate@OData.Community.Display.V1.FormattedValue": "9/28/2021",
    "nycsr_interventionstartdate": "2021-09-28T04:00:00Z",
    "nycsr_building.nycsr_address": "421 EAST 106 STREET",
    "nycsr_building.nycsr_latitude@OData.Community.Display.V1.FormattedValue": "40,789,535.000000",
    "nycsr_building.nycsr_latitude": 40789535,
    "nycsr_building.nycsr_buildingid": "4f9f4974-31f4-ea11-b882-24ee9a37d45c",
    "nycsr_building.nycsr_borough@OData.Community.Display.V1.FormattedValue": "Manhattan",
    "nycsr_building.nycsr_borough": 882450000,
    "nycsr_building.nycsr_longitude@OData.Community.Display.V1.FormattedValue": "-73,938,727.000000",
    "nycsr_building.nycsr_longitude": -73938727,
    "nycsr_building.nycsr_geographicaldistrictcode": "4",
    "nycsr_building.nycsr_buildingname": "P.S. 146 - MANHATTAN",
    "nycsr_locationsite.nycsr_sitename": "P.S. 146 Ann M. Short - M146 - M146 - 04M146 - 421 EAST 106 STREET"
  },
  {
    "@odata.etag": "W/\"327677707\"",
    "nycsr_admininterventiontype@OData.Community.Display.V1.FormattedValue": "Partial Classroom Quarantine",
    "nycsr_admininterventiontype": 882450001,
    "nycsr_caseid": "80a1bc06-911f-ec11-b6e6-001dd83068fb",
    "nycsr_interventionenddate@OData.Community.Display.V1.FormattedValue": "10/4/2021",
    "nycsr_interventionenddate": "2021-10-04T04:00:00Z",
    "nycsr_casenumber": "052666",
    "nycsr_interventionstartdate@OData.Community.Display.V1.FormattedValue": "9/28/2021",
    "nycsr_interventionstartdate": "2021-09-28T04:00:00Z",
    "nycsr_building.nycsr_address": "134-01 CRONSTON AVENUE",
    "nycsr_building.nycsr_latitude@OData.Community.Display.V1.FormattedValue": "40,577,552.000000",
    "nycsr_building.nycsr_latitude": 40577552,
    "nycsr_building.nycsr_buildingid": "c12ff20c-32f4-ea11-b882-24ee9a37d45c",
    "nycsr_building.nycsr_borough@OData.Community.Display.V1.FormattedValue": "Queens",
    "nycsr_building.nycsr_borough": 882450003,
    "nycsr_building.nycsr_longitude@OData.Community.Display.V1.FormattedValue": "-73,854,364.000000",
    "nycsr_building.nycsr_longitude": -73854364,
    "nycsr_building.nycsr_geographicaldistrictcode": "27",
    "nycsr_building.nycsr_buildingname": "P.S. 114 - QUEENS",
    "nycsr_locationsite.nycsr_sitename": "P.S./M.S. 114 Belle Harbor - Q114 - Q114 - 27Q114 - 134-01 CRONSTON AVENUE"
  },
  {
    "@odata.etag": "W/\"325861043\"",
    "nycsr_admininterventiontype@OData.Community.Display.V1.FormattedValue": "Partial Classroom Quarantine",
    "nycsr_admininterventiontype": 882450001,
    "nycsr_caseid": "fbd27c33-911f-ec11-b6e6-001dd83068fb",
    "nycsr_interventionenddate@OData.Community.Display.V1.FormattedValue": "10/4/2021",
    "nycsr_interventionenddate": "2021-10-04T04:00:00Z",
    "nycsr_casenumber": "052667",
    "nycsr_interventionstartdate@OData.Community.Display.V1.FormattedValue": "9/28/2021",
    "nycsr_interventionstartdate": "2021-09-28T04:00:00Z",
    "nycsr_building.nycsr_address": "500 19 STREET",
    "nycsr_building.nycsr_latitude@OData.Community.Display.V1.FormattedValue": "40,656,952.000000",
    "nycsr_building.nycsr_latitude": 40656952,
    "nycsr_building.nycsr_buildingid": "ed201dab-30f4-ea11-b882-24ee9a37d45c",
    "nycsr_building.nycsr_borough@OData.Community.Display.V1.FormattedValue": "Brooklyn",
    "nycsr_building.nycsr_borough": 882450002,
    "nycsr_building.nycsr_longitude@OData.Community.Display.V1.FormattedValue": "-73,983,116.000000",
    "nycsr_building.nycsr_longitude": -73983116,
    "nycsr_building.nycsr_geographicaldistrictcode": "15",
    "nycsr_building.nycsr_buildingname": "PRE-K CENTER @ 500 19TH STREET - BROOKLYN",
    "nycsr_locationsite.nycsr_sitename": "M.S. 442 Carroll Gardens School for Innovation - K442 - K280 - 15K442 - 500 19 STREET"
  },
  {
    "@odata.etag": "W/\"327066258\"",
    "nycsr_admininterventiontype@OData.Community.Display.V1.FormattedValue": "Partial Classroom Quarantine",
    "nycsr_admininterventiontype": 882450001,
    "nycsr_caseid": "08630a32-921f-ec11-b6e6-001dd83068fb",
    "nycsr_interventionenddate@OData.Community.Display.V1.FormattedValue": "10/3/2021",
    "nycsr_interventionenddate": "2021-10-03T04:00:00Z",
    "nycsr_casenumber": "052673",
    "nycsr_interventionstartdate@OData.Community.Display.V1.FormattedValue": "9/28/2021",
    "nycsr_interventionstartdate": "2021-09-28T04:00:00Z",
    "nycsr_building.nycsr_address": "185 WADSWORTH AVENUE",
    "nycsr_building.nycsr_latitude@OData.Community.Display.V1.FormattedValue": "40,850,561.000000",
    "nycsr_building.nycsr_latitude": 40850561,
    "nycsr_building.nycsr_buildingid": "10cf496e-31f4-ea11-b882-24ee9a37d45c",
    "nycsr_building.nycsr_borough@OData.Community.Display.V1.FormattedValue": "Manhattan",
    "nycsr_building.nycsr_borough": 882450000,
    "nycsr_building.nycsr_longitude@OData.Community.Display.V1.FormattedValue": "-73,933,964.000000",
    "nycsr_building.nycsr_longitude": -73933964,
    "nycsr_building.nycsr_geographicaldistrictcode": "6",
    "nycsr_building.nycsr_buildingname": "P.S. 132 - MANHATTAN",
    "nycsr_locationsite.nycsr_sitename": "Dos Puentes Elementary School - M103 - M132 - 06M103 - 185 WADSWORTH AVENUE"
  },
  {
    "@odata.etag": "W/\"326849100\"",
    "nycsr_admininterventiontype@OData.Community.Display.V1.FormattedValue": "Partial Classroom Quarantine",
    "nycsr_admininterventiontype": 882450001,
    "nycsr_caseid": "7c65338c-931f-ec11-b6e6-001dd83068fb",
    "nycsr_interventionenddate@OData.Community.Display.V1.FormattedValue": "10/3/2021",
    "nycsr_interventionenddate": "2021-10-03T04:00:00Z",
    "nycsr_casenumber": "052688",
    "nycsr_interventionstartdate@OData.Community.Display.V1.FormattedValue": "9/28/2021",
    "nycsr_interventionstartdate": "2021-09-28T04:00:00Z",
    "nycsr_building.nycsr_address": "120 WEST 231 STREET",
    "nycsr_building.nycsr_latitude@OData.Community.Display.V1.FormattedValue": "40,875,636.000000",
    "nycsr_building.nycsr_latitude": 40875636,
    "nycsr_building.nycsr_buildingid": "ad2aa42b-33f4-ea11-b882-24ee9a37d45c",
    "nycsr_building.nycsr_borough@OData.Community.Display.V1.FormattedValue": "Bronx",
    "nycsr_building.nycsr_borough": 882450001,
    "nycsr_building.nycsr_longitude@OData.Community.Display.V1.FormattedValue": "-73,901,565.000000",
    "nycsr_building.nycsr_longitude": -73901565,
    "nycsr_building.nycsr_geographicaldistrictcode": "10",
    "nycsr_building.nycsr_buildingname": "I.S. 143 - BRONX",
    "nycsr_locationsite.nycsr_sitename": "The Marie Curie School for Medicine, Nursing, and Health Professions - X237 - X143 - 10X237 - 120 WEST 231 STREET"
  },
  {
    "@odata.etag": "W/\"325861133\"",
    "nycsr_admininterventiontype@OData.Community.Display.V1.FormattedValue": "Non-Classroom Quarantine",
    "nycsr_admininterventiontype": 882450003,
    "nycsr_caseid": "60df2da5-931f-ec11-b6e6-001dd83068fb",
    "nycsr_interventionenddate@OData.Community.Display.V1.FormattedValue": "10/3/2021",
    "nycsr_interventionenddate": "2021-10-03T04:00:00Z",
    "nycsr_casenumber": "052689",
    "nycsr_interventionstartdate@OData.Community.Display.V1.FormattedValue": "9/28/2021",
    "nycsr_interventionstartdate": "2021-09-28T04:00:00Z",
    "nycsr_building.nycsr_address": "155 TOMPKINS AVENUE",
    "nycsr_building.nycsr_latitude@OData.Community.Display.V1.FormattedValue": "40,620,835.000000",
    "nycsr_building.nycsr_latitude": 40620835,
    "nycsr_building.nycsr_buildingid": "66be7adc-32f4-ea11-b882-24ee9a37d45c",
    "nycsr_building.nycsr_borough@OData.Community.Display.V1.FormattedValue": "Staten Island",
    "nycsr_building.nycsr_borough": 882450004,
    "nycsr_building.nycsr_longitude@OData.Community.Display.V1.FormattedValue": "-74,077,054.000000",
    "nycsr_building.nycsr_longitude": -74077054,
    "nycsr_building.nycsr_geographicaldistrictcode": "31",
    "nycsr_building.nycsr_buildingname": "P.S. 722 (OTC) - STATEN ISLAND",
    "nycsr_locationsite.nycsr_sitename": "The Richard H. Hungerford School - R721 - R722 - 75R721 - 155 TOMPKINS AVENUE"
  },
  {
    "@odata.etag": "W/\"326851162\"",
    "nycsr_admininterventiontype@OData.Community.Display.V1.FormattedValue": "Partial Classroom Quarantine",
    "nycsr_admininterventiontype": 882450001,
    "nycsr_caseid": "ef30daf4-941f-ec11-b6e6-001dd83068fb",
    "nycsr_interventionenddate@OData.Community.Display.V1.FormattedValue": "10/4/2021",
    "nycsr_interventionenddate": "2021-10-04T04:00:00Z",
    "nycsr_casenumber": "052700",
    "nycsr_interventionstartdate@OData.Community.Display.V1.FormattedValue": "9/28/2021",
    "nycsr_interventionstartdate": "2021-09-28T04:00:00Z",
    "nycsr_building.nycsr_address": "223 GRAHAM AVENUE",
    "nycsr_building.nycsr_latitude@OData.Community.Display.V1.FormattedValue": "40,709,765.000000",
    "nycsr_building.nycsr_latitude": 40709765,
    "nycsr_building.nycsr_buildingid": "14eabc42-30f4-ea11-b882-24ee9a37d45c",
    "nycsr_building.nycsr_borough@OData.Community.Display.V1.FormattedValue": "Brooklyn",
    "nycsr_building.nycsr_borough": 882450002,
    "nycsr_building.nycsr_longitude@OData.Community.Display.V1.FormattedValue": "-73,944,463.000000",
    "nycsr_building.nycsr_longitude": -73944463,
    "nycsr_building.nycsr_geographicaldistrictcode": "14",
    "nycsr_building.nycsr_buildingname": "I.S. 49 - BROOKLYN",
    "nycsr_locationsite.nycsr_sitename": "Brooklyn Latin School, The - K449 - K049 - 14K449 - 223 GRAHAM AVENUE"
  },
  {
    "@odata.etag": "W/\"325861159\"",
    "nycsr_admininterventiontype@OData.Community.Display.V1.FormattedValue": "Partial Classroom Quarantine",
    "nycsr_admininterventiontype": 882450001,
    "nycsr_caseid": "287ad2fa-941f-ec11-b6e6-001dd83068fb",
    "nycsr_interventionenddate@OData.Community.Display.V1.FormattedValue": "10/4/2021",
    "nycsr_interventionenddate": "2021-10-04T04:00:00Z",
    "nycsr_casenumber": "052701",
    "nycsr_interventionstartdate@OData.Community.Display.V1.FormattedValue": "9/28/2021",
    "nycsr_interventionstartdate": "2021-09-28T04:00:00Z",
    "nycsr_building.nycsr_address": "150-91 87 ROAD",
    "nycsr_building.nycsr_latitude@OData.Community.Display.V1.FormattedValue": "40,708,409.000000",
    "nycsr_building.nycsr_latitude": 40708409,
    "nycsr_building.nycsr_buildingid": "9d72c880-32f4-ea11-b882-24ee9a37d45c",
    "nycsr_building.nycsr_borough@OData.Community.Display.V1.FormattedValue": "Queens",
    "nycsr_building.nycsr_borough": 882450003,
    "nycsr_building.nycsr_longitude@OData.Community.Display.V1.FormattedValue": "-73,804,166.000000",
    "nycsr_building.nycsr_longitude": -73804166,
    "nycsr_building.nycsr_geographicaldistrictcode": "28",
    "nycsr_building.nycsr_buildingname": "YOUNG WOMENS' LEADERSHIP SCHOOL - QUEENS",
    "nycsr_locationsite.nycsr_sitename": "Young Women's Leadership School, Queens - Q896 - Q680 - 28Q896 - 150-91 87 ROAD"
  },
  {
    "@odata.etag": "W/\"327008510\"",
    "nycsr_admininterventiontype@OData.Community.Display.V1.FormattedValue": "Partial Classroom Quarantine",
    "nycsr_admininterventiontype": 882450001,
    "nycsr_caseid": "33bca032-951f-ec11-b6e6-001dd83068fb",
    "nycsr_interventionenddate@OData.Community.Display.V1.FormattedValue": "10/3/2021",
    "nycsr_interventionenddate": "2021-10-03T04:00:00Z",
    "nycsr_casenumber": "052704",
    "nycsr_interventionstartdate@OData.Community.Display.V1.FormattedValue": "9/28/2021",
    "nycsr_interventionstartdate": "2021-09-28T04:00:00Z",
    "nycsr_building.nycsr_address": "1375 Mace Avenue",
    "nycsr_building.nycsr_latitude@OData.Community.Display.V1.FormattedValue": "40,863,524.000000",
    "nycsr_building.nycsr_latitude": 40863524,
    "nycsr_building.nycsr_buildingid": "41474313-33f4-ea11-b882-24ee9a37d45c",
    "nycsr_building.nycsr_borough@OData.Community.Display.V1.FormattedValue": "Bronx",
    "nycsr_building.nycsr_borough": 882450001,
    "nycsr_building.nycsr_longitude@OData.Community.Display.V1.FormattedValue": "-73,846,768.000000",
    "nycsr_building.nycsr_longitude": -73846768,
    "nycsr_building.nycsr_geographicaldistrictcode": "11",
    "nycsr_building.nycsr_buildingname": "P.S. 97 - BRONX",
    "nycsr_locationsite.nycsr_sitename": "P.S. 097 Bronx - X097 - X097 - 11X097 - 1375 Mace Avenue"
  },
  {
    "@odata.etag": "W/\"326892255\"",
    "nycsr_admininterventiontype@OData.Community.Display.V1.FormattedValue": "Partial Classroom Quarantine",
    "nycsr_admininterventiontype": 882450001,
    "nycsr_caseid": "45308f7f-971f-ec11-b6e6-001dd83068fb",
    "nycsr_interventionenddate@OData.Community.Display.V1.FormattedValue": "10/2/2021",
    "nycsr_interventionenddate": "2021-10-02T04:00:00Z",
    "nycsr_casenumber": "052719",
    "nycsr_interventionstartdate@OData.Community.Display.V1.FormattedValue": "9/28/2021",
    "nycsr_interventionstartdate": "2021-09-28T04:00:00Z",
    "nycsr_building.nycsr_address": "100 LUTEN AVENUE",
    "nycsr_building.nycsr_latitude@OData.Community.Display.V1.FormattedValue": "40,528,152.000000",
    "nycsr_building.nycsr_latitude": 40528152,
    "nycsr_building.nycsr_buildingid": "605b4cd6-32f4-ea11-b882-24ee9a37d45c",
    "nycsr_building.nycsr_borough@OData.Community.Display.V1.FormattedValue": "Staten Island",
    "nycsr_building.nycsr_borough": 882450004,
    "nycsr_building.nycsr_longitude@OData.Community.Display.V1.FormattedValue": "-74,193,431.000000",
    "nycsr_building.nycsr_longitude": -74193431,
    "nycsr_building.nycsr_geographicaldistrictcode": "31",
    "nycsr_building.nycsr_buildingname": "TOTTENVILLE HS - S. I.",
    "nycsr_locationsite.nycsr_sitename": "Tottenville High School - R455 - R455 - 31R455 - 100 LUTEN AVENUE"
  },
  {
    "@odata.etag": "W/\"326000583\"",
    "nycsr_admininterventiontype@OData.Community.Display.V1.FormattedValue": "Partial Classroom Quarantine",
    "nycsr_admininterventiontype": 882450001,
    "nycsr_caseid": "610e46ff-971f-ec11-b6e6-001dd83068fb",
    "nycsr_interventionenddate@OData.Community.Display.V1.FormattedValue": "10/4/2021",
    "nycsr_interventionenddate": "2021-10-04T04:00:00Z",
    "nycsr_casenumber": "052725",
    "nycsr_interventionstartdate@OData.Community.Display.V1.FormattedValue": "9/28/2021",
    "nycsr_interventionstartdate": "2021-09-28T04:00:00Z",
    "nycsr_building.nycsr_address": "211 DANIEL LOW TERRACE",
    "nycsr_building.nycsr_latitude@OData.Community.Display.V1.FormattedValue": "40,638,993.000000",
    "nycsr_building.nycsr_latitude": 40638993,
    "nycsr_building.nycsr_buildingid": "86be7adc-32f4-ea11-b882-24ee9a37d45c",
    "nycsr_building.nycsr_borough@OData.Community.Display.V1.FormattedValue": "Staten Island",
    "nycsr_building.nycsr_borough": 882450004,
    "nycsr_building.nycsr_longitude@OData.Community.Display.V1.FormattedValue": "-74,079,438.000000",
    "nycsr_building.nycsr_longitude": -74079438,
    "nycsr_building.nycsr_geographicaldistrictcode": "31",
    "nycsr_building.nycsr_buildingname": "P.S. 74 - STATEN ISLAND",
    "nycsr_locationsite.nycsr_sitename": "P.S. 74 Future Leaders Elementary School - R074 - R831 - 31R074 - 211 DANIEL LOW TERRACE"
  },
  {
    "@odata.etag": "W/\"327113094\"",
    "nycsr_admininterventiontype@OData.Community.Display.V1.FormattedValue": "Partial Classroom Quarantine",
    "nycsr_admininterventiontype": 882450001,
    "nycsr_caseid": "e8fd8e23-981f-ec11-b6e6-001dd83068fb",
    "nycsr_interventionenddate@OData.Community.Display.V1.FormattedValue": "10/2/2021",
    "nycsr_interventionenddate": "2021-10-02T04:00:00Z",
    "nycsr_casenumber": "052728",
    "nycsr_interventionstartdate@OData.Community.Display.V1.FormattedValue": "9/28/2021",
    "nycsr_interventionstartdate": "2021-09-28T04:00:00Z",
    "nycsr_building.nycsr_address": "100 LUTEN AVENUE",
    "nycsr_building.nycsr_latitude@OData.Community.Display.V1.FormattedValue": "40,528,152.000000",
    "nycsr_building.nycsr_latitude": 40528152,
    "nycsr_building.nycsr_buildingid": "605b4cd6-32f4-ea11-b882-24ee9a37d45c",
    "nycsr_building.nycsr_borough@OData.Community.Display.V1.FormattedValue": "Staten Island",
    "nycsr_building.nycsr_borough": 882450004,
    "nycsr_building.nycsr_longitude@OData.Community.Display.V1.FormattedValue": "-74,193,431.000000",
    "nycsr_building.nycsr_longitude": -74193431,
    "nycsr_building.nycsr_geographicaldistrictcode": "31",
    "nycsr_building.nycsr_buildingname": "TOTTENVILLE HS - S. I.",
    "nycsr_locationsite.nycsr_sitename": "Tottenville High School - R455 - R455 - 31R455 - 100 LUTEN AVENUE"
  },
  {
    "@odata.etag": "W/\"327113538\"",
    "nycsr_admininterventiontype@OData.Community.Display.V1.FormattedValue": "Classroom Closed",
    "nycsr_admininterventiontype": 882450000,
    "nycsr_caseid": "1690203c-981f-ec11-b6e6-001dd83068fb",
    "nycsr_interventionenddate@OData.Community.Display.V1.FormattedValue": "10/4/2021",
    "nycsr_interventionenddate": "2021-10-04T04:00:00Z",
    "nycsr_casenumber": "052729",
    "nycsr_interventionstartdate@OData.Community.Display.V1.FormattedValue": "9/28/2021",
    "nycsr_interventionstartdate": "2021-09-28T04:00:00Z",
    "nycsr_building.nycsr_address": "1001 EAST 100 STREET",
    "nycsr_building.nycsr_latitude@OData.Community.Display.V1.FormattedValue": "40,642,931.000000",
    "nycsr_building.nycsr_latitude": 40642931,
    "nycsr_building.nycsr_buildingid": "22ba8b86-30f4-ea11-b882-24ee9a37d45c",
    "nycsr_building.nycsr_borough@OData.Community.Display.V1.FormattedValue": "Brooklyn",
    "nycsr_building.nycsr_borough": 882450002,
    "nycsr_building.nycsr_longitude@OData.Community.Display.V1.FormattedValue": "-73,895,224.000000",
    "nycsr_building.nycsr_longitude": -73895224,
    "nycsr_building.nycsr_geographicaldistrictcode": "18",
    "nycsr_building.nycsr_buildingname": "I.S. 211 - BROOKLYN",
    "nycsr_locationsite.nycsr_sitename": "Leadership Prep Canarsie Charter School (Leadership Prep CS 4) - K724 - K211 - 84K724 - 1001 EAST 100 STREET"
  },
  {
    "@odata.etag": "W/\"325861224\"",
    "nycsr_admininterventiontype@OData.Community.Display.V1.FormattedValue": "Partial Classroom Quarantine",
    "nycsr_admininterventiontype": 882450001,
    "nycsr_caseid": "3ef90755-981f-ec11-b6e6-001dd83068fb",
    "nycsr_interventionenddate@OData.Community.Display.V1.FormattedValue": "10/1/2021",
    "nycsr_interventionenddate": "2021-10-01T04:00:00Z",
    "nycsr_casenumber": "052730",
    "nycsr_interventionstartdate@OData.Community.Display.V1.FormattedValue": "9/28/2021",
    "nycsr_interventionstartdate": "2021-09-28T04:00:00Z",
    "nycsr_building.nycsr_address": "2401 NEPTUNE AVENUE",
    "nycsr_building.nycsr_latitude@OData.Community.Display.V1.FormattedValue": "40,578,640.000000",
    "nycsr_building.nycsr_latitude": 40578640,
    "nycsr_building.nycsr_buildingid": "6ca5db98-30f4-ea11-b882-24ee9a37d45c",
    "nycsr_building.nycsr_borough@OData.Community.Display.V1.FormattedValue": "Brooklyn",
    "nycsr_building.nycsr_borough": 882450002,
    "nycsr_building.nycsr_longitude@OData.Community.Display.V1.FormattedValue": "-73,992,447.000000",
    "nycsr_building.nycsr_longitude": -73992447,
    "nycsr_building.nycsr_geographicaldistrictcode": "21",
    "nycsr_building.nycsr_buildingname": "I.S. 239 - BROOKLYN",
    "nycsr_locationsite.nycsr_sitename": "Mark Twain I.S. 239 for the Gifted & Talented - K239 - K239 - 21K239 - 2401 NEPTUNE AVENUE"
  },
  {
    "@odata.etag": "W/\"327094521\"",
    "nycsr_admininterventiontype@OData.Community.Display.V1.FormattedValue": "Partial Classroom Quarantine",
    "nycsr_admininterventiontype": 882450001,
    "nycsr_caseid": "2a6754c3-981f-ec11-b6e6-001dd83068fb",
    "nycsr_interventionenddate@OData.Community.Display.V1.FormattedValue": "10/3/2021",
    "nycsr_interventionenddate": "2021-10-03T04:00:00Z",
    "nycsr_casenumber": "052732",
    "nycsr_interventionstartdate@OData.Community.Display.V1.FormattedValue": "9/28/2021",
    "nycsr_interventionstartdate": "2021-09-28T04:00:00Z",
    "nycsr_building.nycsr_address": "100 LUTEN AVENUE",
    "nycsr_building.nycsr_latitude@OData.Community.Display.V1.FormattedValue": "40,528,152.000000",
    "nycsr_building.nycsr_latitude": 40528152,
    "nycsr_building.nycsr_buildingid": "605b4cd6-32f4-ea11-b882-24ee9a37d45c",
    "nycsr_building.nycsr_borough@OData.Community.Display.V1.FormattedValue": "Staten Island",
    "nycsr_building.nycsr_borough": 882450004,
    "nycsr_building.nycsr_longitude@OData.Community.Display.V1.FormattedValue": "-74,193,431.000000",
    "nycsr_building.nycsr_longitude": -74193431,
    "nycsr_building.nycsr_geographicaldistrictcode": "31",
    "nycsr_building.nycsr_buildingname": "TOTTENVILLE HS - S. I.",
    "nycsr_locationsite.nycsr_sitename": "Tottenville High School - R455 - R455 - 31R455 - 100 LUTEN AVENUE"
  },
  {
    "@odata.etag": "W/\"325861249\"",
    "nycsr_admininterventiontype@OData.Community.Display.V1.FormattedValue": "Partial Classroom Quarantine",
    "nycsr_admininterventiontype": 882450001,
    "nycsr_caseid": "b87841db-981f-ec11-b6e6-001dd83068fb",
    "nycsr_interventionenddate@OData.Community.Display.V1.FormattedValue": "10/3/2021",
    "nycsr_interventionenddate": "2021-10-03T04:00:00Z",
    "nycsr_casenumber": "052735",
    "nycsr_interventionstartdate@OData.Community.Display.V1.FormattedValue": "9/28/2021",
    "nycsr_interventionstartdate": "2021-09-28T04:00:00Z",
    "nycsr_building.nycsr_address": "778 FOREST AVENUE",
    "nycsr_building.nycsr_latitude@OData.Community.Display.V1.FormattedValue": "40,818,703.000000",
    "nycsr_building.nycsr_latitude": 40818703,
    "nycsr_building.nycsr_buildingid": "f88a0044-33f4-ea11-b882-24ee9a37d45c",
    "nycsr_building.nycsr_borough@OData.Community.Display.V1.FormattedValue": "Bronx",
    "nycsr_building.nycsr_borough": 882450001,
    "nycsr_building.nycsr_longitude@OData.Community.Display.V1.FormattedValue": "-73,905,389.000000",
    "nycsr_building.nycsr_longitude": -73905389,
    "nycsr_building.nycsr_geographicaldistrictcode": "7",
    "nycsr_building.nycsr_buildingname": "I.S. 184 - BRONX",
    "nycsr_locationsite.nycsr_sitename": "Academy of Public Relations - X298 - X184 - 07X298 - 778 FOREST AVENUE"
  },
  {
    "@odata.etag": "W/\"326295415\"",
    "nycsr_admininterventiontype@OData.Community.Display.V1.FormattedValue": "Partial Classroom Quarantine",
    "nycsr_admininterventiontype": 882450001,
    "nycsr_caseid": "c0eea093-9a1f-ec11-b6e6-001dd83068fb",
    "nycsr_interventionenddate@OData.Community.Display.V1.FormattedValue": "10/4/2021",
    "nycsr_interventionenddate": "2021-10-04T04:00:00Z",
    "nycsr_casenumber": "052753",
    "nycsr_interventionstartdate@OData.Community.Display.V1.FormattedValue": "9/28/2021",
    "nycsr_interventionstartdate": "2021-09-28T04:00:00Z",
    "nycsr_building.nycsr_address": "516 EAST TREMONT AVENUE",
    "nycsr_building.nycsr_latitude@OData.Community.Display.V1.FormattedValue": "40,846,495.000000",
    "nycsr_building.nycsr_latitude": 40846495,
    "nycsr_building.nycsr_buildingid": "48ff3d8d-33f4-ea11-b882-24ee9a37d45c",
    "nycsr_building.nycsr_borough@OData.Community.Display.V1.FormattedValue": "Bronx",
    "nycsr_building.nycsr_borough": 882450001,
    "nycsr_building.nycsr_longitude@OData.Community.Display.V1.FormattedValue": "-73,896,596.000000",
    "nycsr_building.nycsr_longitude": -73896596,
    "nycsr_building.nycsr_geographicaldistrictcode": "9",
    "nycsr_building.nycsr_buildingname": "Arthur Avenue Educational Building",
    "nycsr_locationsite.nycsr_sitename": "P.S. 723 - X723 - X909 - 75X723 - 516 EAST TREMONT AVENUE"
  },
  {
    "@odata.etag": "W/\"325861310\"",
    "nycsr_admininterventiontype@OData.Community.Display.V1.FormattedValue": "Partial Classroom Quarantine",
    "nycsr_admininterventiontype": 882450001,
    "nycsr_caseid": "cf647337-9b1f-ec11-b6e6-001dd83068fb",
    "nycsr_interventionenddate@OData.Community.Display.V1.FormattedValue": "10/3/2021",
    "nycsr_interventionenddate": "2021-10-03T04:00:00Z",
    "nycsr_casenumber": "052758",
    "nycsr_interventionstartdate@OData.Community.Display.V1.FormattedValue": "9/28/2021",
    "nycsr_interventionstartdate": "2021-09-28T04:00:00Z",
    "nycsr_building.nycsr_address": "160-05 HIGHLAND AVENUE",
    "nycsr_building.nycsr_latitude@OData.Community.Display.V1.FormattedValue": "40,709,461.000000",
    "nycsr_building.nycsr_latitude": 40709461,
    "nycsr_building.nycsr_buildingid": "8fbc9674-32f4-ea11-b882-24ee9a37d45c",
    "nycsr_building.nycsr_borough@OData.Community.Display.V1.FormattedValue": "Queens",
    "nycsr_building.nycsr_borough": 882450003,
    "nycsr_building.nycsr_longitude@OData.Community.Display.V1.FormattedValue": "-73,803,001.000000",
    "nycsr_building.nycsr_longitude": -73803001,
    "nycsr_building.nycsr_geographicaldistrictcode": "28",
    "nycsr_building.nycsr_buildingname": "HILLCREST HS - Q",
    "nycsr_locationsite.nycsr_sitename": "Hillcrest High School - Q505 - Q505 - 28Q505 - 160-05 HIGHLAND AVENUE"
  },
  {
    "@odata.etag": "W/\"326859892\"",
    "nycsr_admininterventiontype@OData.Community.Display.V1.FormattedValue": "Partial Classroom Quarantine",
    "nycsr_admininterventiontype": 882450001,
    "nycsr_caseid": "48919d9d-9c1f-ec11-b6e6-001dd83068fb",
    "nycsr_interventionenddate@OData.Community.Display.V1.FormattedValue": "10/4/2021",
    "nycsr_interventionenddate": "2021-10-04T04:00:00Z",
    "nycsr_casenumber": "052768",
    "nycsr_interventionstartdate@OData.Community.Display.V1.FormattedValue": "9/28/2021",
    "nycsr_interventionstartdate": "2021-09-28T04:00:00Z",
    "nycsr_building.nycsr_address": "1300 GREENE AVENUE",
    "nycsr_building.nycsr_latitude@OData.Community.Display.V1.FormattedValue": "40,697,898.000000",
    "nycsr_building.nycsr_latitude": 40697898,
    "nycsr_building.nycsr_buildingid": "1de2abc9-30f4-ea11-b882-24ee9a37d45c",
    "nycsr_building.nycsr_borough@OData.Community.Display.V1.FormattedValue": "Brooklyn",
    "nycsr_building.nycsr_borough": 882450002,
    "nycsr_building.nycsr_longitude@OData.Community.Display.V1.FormattedValue": "-73,919,088.000000",
    "nycsr_building.nycsr_longitude": -73919088,
    "nycsr_building.nycsr_geographicaldistrictcode": "32",
    "nycsr_building.nycsr_buildingname": "I.S. 383 - BROOKLYN",
    "nycsr_locationsite.nycsr_sitename": "J.H.S. 383 Philippa Schuyler - K383 - K383 - 32K383 - 1300 GREENE AVENUE"
  },
  {
    "@odata.etag": "W/\"326861346\"",
    "nycsr_admininterventiontype@OData.Community.Display.V1.FormattedValue": "Partial Classroom Quarantine",
    "nycsr_admininterventiontype": 882450001,
    "nycsr_caseid": "8018e0da-9d1f-ec11-b6e6-001dd83068fb",
    "nycsr_interventionenddate@OData.Community.Display.V1.FormattedValue": "10/4/2021",
    "nycsr_interventionenddate": "2021-10-04T04:00:00Z",
    "nycsr_casenumber": "052783",
    "nycsr_interventionstartdate@OData.Community.Display.V1.FormattedValue": "9/28/2021",
    "nycsr_interventionstartdate": "2021-09-28T04:00:00Z",
    "nycsr_building.nycsr_address": "46-35 OCEANIA STREET",
    "nycsr_building.nycsr_latitude@OData.Community.Display.V1.FormattedValue": "40,756,562.000000",
    "nycsr_building.nycsr_latitude": 40756562,
    "nycsr_building.nycsr_buildingid": "f39b4c1f-32f4-ea11-b882-24ee9a37d45c",
    "nycsr_building.nycsr_borough@OData.Community.Display.V1.FormattedValue": "Queens",
    "nycsr_building.nycsr_borough": 882450003,
    "nycsr_building.nycsr_longitude@OData.Community.Display.V1.FormattedValue": "-73,771,878.000000",
    "nycsr_building.nycsr_longitude": -73771878,
    "nycsr_building.nycsr_geographicaldistrictcode": "26",
    "nycsr_building.nycsr_buildingname": "J.H.S. 158 - QUEENS",
    "nycsr_locationsite.nycsr_sitename": "M.S. 158 Marie Curie - Q158 - Q158 - 26Q158 - 46-35 OCEANIA STREET"
  },
  {
    "@odata.etag": "W/\"326862152\"",
    "nycsr_admininterventiontype@OData.Community.Display.V1.FormattedValue": "Partial Classroom Quarantine",
    "nycsr_admininterventiontype": 882450001,
    "nycsr_caseid": "9429cdf2-9d1f-ec11-b6e6-001dd83068fb",
    "nycsr_interventionenddate@OData.Community.Display.V1.FormattedValue": "10/4/2021",
    "nycsr_interventionenddate": "2021-10-04T04:00:00Z",
    "nycsr_casenumber": "052785",
    "nycsr_interventionstartdate@OData.Community.Display.V1.FormattedValue": "9/28/2021",
    "nycsr_interventionstartdate": "2021-09-28T04:00:00Z",
    "nycsr_building.nycsr_address": "43-18 97TH PLACE",
    "nycsr_building.nycsr_latitude@OData.Community.Display.V1.FormattedValue": "40,745,995.000000",
    "nycsr_building.nycsr_latitude": 40745995,
    "nycsr_building.nycsr_buildingid": "de454b50-32f4-ea11-b882-24ee9a37d45c",
    "nycsr_building.nycsr_borough@OData.Community.Display.V1.FormattedValue": "Queens",
    "nycsr_building.nycsr_borough": 882450003,
    "nycsr_building.nycsr_longitude@OData.Community.Display.V1.FormattedValue": "-73,866,372.000000",
    "nycsr_building.nycsr_longitude": -73866372,
    "nycsr_building.nycsr_geographicaldistrictcode": "24",
    "nycsr_building.nycsr_buildingname": "P.S. 315 - Queens",
    "nycsr_locationsite.nycsr_sitename": "P.S. 110 - Q110 - Q315 - 24Q110 - 43-18 97TH PLACE"
  },
  {
    "@odata.etag": "W/\"325861435\"",
    "nycsr_admininterventiontype@OData.Community.Display.V1.FormattedValue": "Classroom Closed",
    "nycsr_admininterventiontype": 882450000,
    "nycsr_caseid": "5cdc2a62-9f1f-ec11-b6e6-001dd83068fb",
    "nycsr_interventionenddate@OData.Community.Display.V1.FormattedValue": "10/7/2021",
    "nycsr_interventionenddate": "2021-10-07T04:00:00Z",
    "nycsr_casenumber": "052798",
    "nycsr_interventionstartdate@OData.Community.Display.V1.FormattedValue": "9/28/2021",
    "nycsr_interventionstartdate": "2021-09-28T04:00:00Z",
    "nycsr_building.nycsr_address": "31-15 140 STREET",
    "nycsr_building.nycsr_latitude@OData.Community.Display.V1.FormattedValue": "40,770,215.000000",
    "nycsr_building.nycsr_latitude": 40770215,
    "nycsr_building.nycsr_buildingid": "feb6c337-32f4-ea11-b882-24ee9a37d45c",
    "nycsr_building.nycsr_borough@OData.Community.Display.V1.FormattedValue": "Queens",
    "nycsr_building.nycsr_borough": 882450003,
    "nycsr_building.nycsr_longitude@OData.Community.Display.V1.FormattedValue": "-73,827,606.000000",
    "nycsr_building.nycsr_longitude": -73827606,
    "nycsr_building.nycsr_geographicaldistrictcode": "25",
    "nycsr_building.nycsr_buildingname": "P.S. 214 - QUEENS",
    "nycsr_locationsite.nycsr_sitename": "P.S. 214 Cadwallader Colden - Q214 - Q214 - 25Q214 - 31-15 140 STREET"
  },
  {
    "@odata.etag": "W/\"325861471\"",
    "nycsr_admininterventiontype@OData.Community.Display.V1.FormattedValue": "Classroom Closed",
    "nycsr_admininterventiontype": 882450000,
    "nycsr_caseid": "3bd776b2-a01f-ec11-b6e6-001dd83068fb",
    "nycsr_interventionenddate@OData.Community.Display.V1.FormattedValue": "10/4/2021",
    "nycsr_interventionenddate": "2021-10-04T04:00:00Z",
    "nycsr_casenumber": "052811",
    "nycsr_interventionstartdate@OData.Community.Display.V1.FormattedValue": "9/28/2021",
    "nycsr_interventionstartdate": "2021-09-28T04:00:00Z",
    "nycsr_building.nycsr_address": "7103 Avenue T",
    "nycsr_building.nycsr_latitude@OData.Community.Display.V1.FormattedValue": "40,622,442.000000",
    "nycsr_building.nycsr_latitude": 40622442,
    "nycsr_building.nycsr_buildingid": "87e657bd-30f4-ea11-b882-24ee9a37d45c",
    "nycsr_building.nycsr_borough@OData.Community.Display.V1.FormattedValue": "Brooklyn",
    "nycsr_building.nycsr_borough": 882450002,
    "nycsr_building.nycsr_longitude@OData.Community.Display.V1.FormattedValue": "-73,909,554.000000",
    "nycsr_building.nycsr_longitude": -73909554,
    "nycsr_building.nycsr_geographicaldistrictcode": "22",
    "nycsr_building.nycsr_buildingname": "P.S. 312 - BROOKLYN",
    "nycsr_locationsite.nycsr_sitename": "P.S. 312 Bergen Beach - K312 - K312 - 22K312 - 7103 Avenue T"
  },
  {
    "@odata.etag": "W/\"325861476\"",
    "nycsr_admininterventiontype@OData.Community.Display.V1.FormattedValue": "Partial Classroom Quarantine",
    "nycsr_admininterventiontype": 882450001,
    "nycsr_caseid": "307664c4-a01f-ec11-b6e6-001dd83068fb",
    "nycsr_interventionenddate@OData.Community.Display.V1.FormattedValue": "10/4/2021",
    "nycsr_interventionenddate": "2021-10-04T04:00:00Z",
    "nycsr_casenumber": "052813",
    "nycsr_interventionstartdate@OData.Community.Display.V1.FormattedValue": "9/28/2021",
    "nycsr_interventionstartdate": "2021-09-28T04:00:00Z",
    "nycsr_building.nycsr_address": "4143 THIRD AVENUE",
    "nycsr_building.nycsr_latitude@OData.Community.Display.V1.FormattedValue": "40,845,366.000000",
    "nycsr_building.nycsr_latitude": 40845366,
    "nycsr_building.nycsr_buildingid": "8b53dd74-33f4-ea11-b882-24ee9a37d45c",
    "nycsr_building.nycsr_borough@OData.Community.Display.V1.FormattedValue": "Bronx",
    "nycsr_building.nycsr_borough": 882450001,
    "nycsr_building.nycsr_longitude@OData.Community.Display.V1.FormattedValue": "-73,897,479.000000",
    "nycsr_building.nycsr_longitude": -73897479,
    "nycsr_building.nycsr_geographicaldistrictcode": "9",
    "nycsr_building.nycsr_buildingname": "Eagle Academy For Young Men - Bronx",
    "nycsr_locationsite.nycsr_sitename": "Eagle Academy for Young Men - X231 - X465 - 09X231 - 4143 THIRD AVENUE"
  },
  {
    "@odata.etag": "W/\"327119829\"",
    "nycsr_admininterventiontype@OData.Community.Display.V1.FormattedValue": "Partial Classroom Quarantine",
    "nycsr_admininterventiontype": 882450001,
    "nycsr_caseid": "2b1b38cb-a01f-ec11-b6e6-001dd83068fb",
    "nycsr_interventionenddate@OData.Community.Display.V1.FormattedValue": "10/5/2021",
    "nycsr_interventionenddate": "2021-10-05T04:00:00Z",
    "nycsr_casenumber": "052814",
    "nycsr_interventionstartdate@OData.Community.Display.V1.FormattedValue": "9/28/2021",
    "nycsr_interventionstartdate": "2021-09-28T04:00:00Z",
    "nycsr_building.nycsr_address": "143-26 101 AVENUE",
    "nycsr_building.nycsr_latitude@OData.Community.Display.V1.FormattedValue": "40,695,237.622281",
    "nycsr_building.nycsr_latitude": 40695237.622281,
    "nycsr_building.nycsr_buildingid": "d5cd0c6a-ba09-eb11-b884-24ee9a37d459",
    "nycsr_building.nycsr_longitude@OData.Community.Display.V1.FormattedValue": "-73,807,364.151906",
    "nycsr_building.nycsr_longitude": -73807364.151906,
    "nycsr_building.nycsr_geographicaldistrictcode": "Q050",
    "nycsr_building.nycsr_buildingname": "P.S. 050 Talfourd Lawn Elementary School",
    "nycsr_locationsite.nycsr_sitename": "DYCD - P.S. 050 Talfourd Lawn Elementary School - 126017 - 143-26 101 AVENUE"
  },
  {
    "@odata.etag": "W/\"327147667\"",
    "nycsr_admininterventiontype@OData.Community.Display.V1.FormattedValue": "Partial Classroom Quarantine",
    "nycsr_admininterventiontype": 882450001,
    "nycsr_caseid": "5ffda10d-a11f-ec11-b6e6-001dd83068fb",
    "nycsr_interventionenddate@OData.Community.Display.V1.FormattedValue": "10/4/2021",
    "nycsr_interventionenddate": "2021-10-04T04:00:00Z",
    "nycsr_casenumber": "052822",
    "nycsr_interventionstartdate@OData.Community.Display.V1.FormattedValue": "9/28/2021",
    "nycsr_interventionstartdate": "2021-09-28T04:00:00Z",
    "nycsr_building.nycsr_address": "845 EAST  96 STREET",
    "nycsr_building.nycsr_latitude@OData.Community.Display.V1.FormattedValue": "40,648,749.000000",
    "nycsr_building.nycsr_latitude": 40648749,
    "nycsr_building.nycsr_buildingid": "cc79df48-30f4-ea11-b882-24ee9a37d45c",
    "nycsr_building.nycsr_borough@OData.Community.Display.V1.FormattedValue": "Brooklyn",
    "nycsr_building.nycsr_borough": 882450002,
    "nycsr_building.nycsr_longitude@OData.Community.Display.V1.FormattedValue": "-73,907,064.000000",
    "nycsr_building.nycsr_longitude": -73907064,
    "nycsr_building.nycsr_geographicaldistrictcode": "18",
    "nycsr_building.nycsr_buildingname": "P.S. 66 - BROOKLYN",
    "nycsr_locationsite.nycsr_sitename": "P.S. 66 - K066 - K066 - 18K066 - 845 EAST  96 STREET"
  },
  {
    "@odata.etag": "W/\"326016543\"",
    "nycsr_admininterventiontype@OData.Community.Display.V1.FormattedValue": "Partial Classroom Quarantine",
    "nycsr_admininterventiontype": 882450001,
    "nycsr_caseid": "1f8abf46-a21f-ec11-b6e6-001dd83068fb",
    "nycsr_interventionenddate@OData.Community.Display.V1.FormattedValue": "10/1/2021",
    "nycsr_interventionenddate": "2021-10-01T04:00:00Z",
    "nycsr_casenumber": "052837",
    "nycsr_interventionstartdate@OData.Community.Display.V1.FormattedValue": "9/28/2021",
    "nycsr_interventionstartdate": "2021-09-28T04:00:00Z",
    "nycsr_building.nycsr_address": "845 EAST  96 STREET",
    "nycsr_building.nycsr_latitude@OData.Community.Display.V1.FormattedValue": "40,648,749.000000",
    "nycsr_building.nycsr_latitude": 40648749,
    "nycsr_building.nycsr_buildingid": "cc79df48-30f4-ea11-b882-24ee9a37d45c",
    "nycsr_building.nycsr_borough@OData.Community.Display.V1.FormattedValue": "Brooklyn",
    "nycsr_building.nycsr_borough": 882450002,
    "nycsr_building.nycsr_longitude@OData.Community.Display.V1.FormattedValue": "-73,907,064.000000",
    "nycsr_building.nycsr_longitude": -73907064,
    "nycsr_building.nycsr_geographicaldistrictcode": "18",
    "nycsr_building.nycsr_buildingname": "P.S. 66 - BROOKLYN",
    "nycsr_locationsite.nycsr_sitename": "P.S. 66 - K066 - K066 - 18K066 - 845 EAST  96 STREET"
  },
  {
    "@odata.etag": "W/\"325861576\"",
    "nycsr_admininterventiontype@OData.Community.Display.V1.FormattedValue": "Classroom Closed",
    "nycsr_admininterventiontype": 882450000,
    "nycsr_caseid": "95006095-a41f-ec11-b6e6-001dd83068fb",
    "nycsr_interventionenddate@OData.Community.Display.V1.FormattedValue": "10/4/2021",
    "nycsr_interventionenddate": "2021-10-04T04:00:00Z",
    "nycsr_casenumber": "052869",
    "nycsr_interventionstartdate@OData.Community.Display.V1.FormattedValue": "9/28/2021",
    "nycsr_interventionstartdate": "2021-09-28T04:00:00Z",
    "nycsr_building.nycsr_address": "1050 Targee Street",
    "nycsr_building.nycsr_latitude@OData.Community.Display.V1.FormattedValue": "40,603,492.000000",
    "nycsr_building.nycsr_latitude": 40603492,
    "nycsr_building.nycsr_buildingid": "db8521d0-32f4-ea11-b882-24ee9a37d45c",
    "nycsr_building.nycsr_borough@OData.Community.Display.V1.FormattedValue": "Staten Island",
    "nycsr_building.nycsr_borough": 882450004,
    "nycsr_building.nycsr_longitude@OData.Community.Display.V1.FormattedValue": "-74,091,239.000000",
    "nycsr_building.nycsr_longitude": -74091239,
    "nycsr_building.nycsr_geographicaldistrictcode": "31",
    "nycsr_building.nycsr_buildingname": "P.S./I.S. 48 - Staten Island",
    "nycsr_locationsite.nycsr_sitename": "P.S. 048 William G. Wilcox - R048 - R071 - 31R048 - 1050 Targee Street"
  },
  {
    "@odata.etag": "W/\"327132166\"",
    "nycsr_admininterventiontype@OData.Community.Display.V1.FormattedValue": "Partial Classroom Quarantine",
    "nycsr_admininterventiontype": 882450001,
    "nycsr_caseid": "79fcae07-a61f-ec11-b6e6-001dd83068fb",
    "nycsr_interventionenddate@OData.Community.Display.V1.FormattedValue": "10/3/2021",
    "nycsr_interventionenddate": "2021-10-03T04:00:00Z",
    "nycsr_casenumber": "052885",
    "nycsr_interventionstartdate@OData.Community.Display.V1.FormattedValue": "9/28/2021",
    "nycsr_interventionstartdate": "2021-09-28T04:00:00Z",
    "nycsr_building.nycsr_address": "70 Tompkins Avenue",
    "nycsr_building.nycsr_latitude@OData.Community.Display.V1.FormattedValue": "40,696,698.000000",
    "nycsr_building.nycsr_latitude": 40696698,
    "nycsr_building.nycsr_buildingid": "eb1aad3c-30f4-ea11-b882-24ee9a37d45c",
    "nycsr_building.nycsr_borough@OData.Community.Display.V1.FormattedValue": "Brooklyn",
    "nycsr_building.nycsr_borough": 882450002,
    "nycsr_building.nycsr_longitude@OData.Community.Display.V1.FormattedValue": "-73,947,557.000000",
    "nycsr_building.nycsr_longitude": -73947557,
    "nycsr_building.nycsr_geographicaldistrictcode": "14",
    "nycsr_building.nycsr_buildingname": "I.S. 33 - BROOKLYN",
    "nycsr_locationsite.nycsr_sitename": "Success Academy Charter School - Bed-Stuy 1 - K367 - K033 - 84K367 - 70 Tompkins Avenue"
  },
  {
    "@odata.etag": "W/\"327133845\"",
    "nycsr_admininterventiontype@OData.Community.Display.V1.FormattedValue": "Classroom Closed",
    "nycsr_admininterventiontype": 882450000,
    "nycsr_caseid": "63ea21f9-a61f-ec11-b6e6-001dd83068fb",
    "nycsr_interventionenddate@OData.Community.Display.V1.FormattedValue": "10/1/2021",
    "nycsr_interventionenddate": "2021-10-01T04:00:00Z",
    "nycsr_casenumber": "052897",
    "nycsr_interventionstartdate@OData.Community.Display.V1.FormattedValue": "9/28/2021",
    "nycsr_interventionstartdate": "2021-09-28T04:00:00Z",
    "nycsr_building.nycsr_address": "3301 QUENTIN ROAD",
    "nycsr_building.nycsr_latitude@OData.Community.Display.V1.FormattedValue": "40,614,005.000000",
    "nycsr_building.nycsr_latitude": 40614005,
    "nycsr_building.nycsr_buildingid": "dc21d292-30f4-ea11-b882-24ee9a37d45c",
    "nycsr_building.nycsr_borough@OData.Community.Display.V1.FormattedValue": "Brooklyn",
    "nycsr_building.nycsr_borough": 882450002,
    "nycsr_building.nycsr_longitude@OData.Community.Display.V1.FormattedValue": "-73,939,205.000000",
    "nycsr_building.nycsr_longitude": -73939205,
    "nycsr_building.nycsr_geographicaldistrictcode": "22",
    "nycsr_building.nycsr_buildingname": "P.S. 222 - BROOKLYN",
    "nycsr_locationsite.nycsr_sitename": "P.S. 222 Katherine R. Snyder - K222 - K222 - 22K222 - 3301 QUENTIN ROAD"
  },
  {
    "@odata.etag": "W/\"325861658\"",
    "nycsr_admininterventiontype@OData.Community.Display.V1.FormattedValue": "Classroom Closed",
    "nycsr_admininterventiontype": 882450000,
    "nycsr_caseid": "add546c9-a71f-ec11-b6e6-001dd83068fb",
    "nycsr_interventionenddate@OData.Community.Display.V1.FormattedValue": "10/4/2021",
    "nycsr_interventionenddate": "2021-10-04T04:00:00Z",
    "nycsr_casenumber": "052907",
    "nycsr_interventionstartdate@OData.Community.Display.V1.FormattedValue": "9/28/2021",
    "nycsr_interventionstartdate": "2021-09-28T04:00:00Z",
    "nycsr_building.nycsr_address": "3301 QUENTIN ROAD",
    "nycsr_building.nycsr_latitude@OData.Community.Display.V1.FormattedValue": "40,614,005.000000",
    "nycsr_building.nycsr_latitude": 40614005,
    "nycsr_building.nycsr_buildingid": "dc21d292-30f4-ea11-b882-24ee9a37d45c",
    "nycsr_building.nycsr_borough@OData.Community.Display.V1.FormattedValue": "Brooklyn",
    "nycsr_building.nycsr_borough": 882450002,
    "nycsr_building.nycsr_longitude@OData.Community.Display.V1.FormattedValue": "-73,939,205.000000",
    "nycsr_building.nycsr_longitude": -73939205,
    "nycsr_building.nycsr_geographicaldistrictcode": "22",
    "nycsr_building.nycsr_buildingname": "P.S. 222 - BROOKLYN",
    "nycsr_locationsite.nycsr_sitename": "P.S. 222 Katherine R. Snyder - K222 - K222 - 22K222 - 3301 QUENTIN ROAD"
  },
  {
    "@odata.etag": "W/\"327149527\"",
    "nycsr_admininterventiontype@OData.Community.Display.V1.FormattedValue": "Classroom Closed",
    "nycsr_admininterventiontype": 882450000,
    "nycsr_caseid": "800e841b-aa1f-ec11-b6e6-001dd83068fb",
    "nycsr_interventionenddate@OData.Community.Display.V1.FormattedValue": "10/3/2021",
    "nycsr_interventionenddate": "2021-10-03T04:00:00Z",
    "nycsr_casenumber": "052929",
    "nycsr_interventionstartdate@OData.Community.Display.V1.FormattedValue": "9/28/2021",
    "nycsr_interventionstartdate": "2021-09-28T04:00:00Z",
    "nycsr_building.nycsr_address": "1580 DEAN STREET",
    "nycsr_building.nycsr_latitude@OData.Community.Display.V1.FormattedValue": "40,675,675.000000",
    "nycsr_building.nycsr_latitude": 40675675,
    "nycsr_building.nycsr_buildingid": "7aa5db98-30f4-ea11-b882-24ee9a37d45c",
    "nycsr_building.nycsr_borough@OData.Community.Display.V1.FormattedValue": "Brooklyn",
    "nycsr_building.nycsr_borough": 882450002,
    "nycsr_building.nycsr_longitude@OData.Community.Display.V1.FormattedValue": "-73,935,093.000000",
    "nycsr_building.nycsr_longitude": -73935093,
    "nycsr_building.nycsr_geographicaldistrictcode": "16",
    "nycsr_building.nycsr_buildingname": "P.S. 243 - BROOKLYN",
    "nycsr_locationsite.nycsr_sitename": "P.S. 243K- The Weeksville School - K243 - K243 - 16K243 - 1580 DEAN STREET"
  },
  {
    "@odata.etag": "W/\"325861683\"",
    "nycsr_admininterventiontype@OData.Community.Display.V1.FormattedValue": "Partial Classroom Quarantine",
    "nycsr_admininterventiontype": 882450001,
    "nycsr_caseid": "28ef4234-aa1f-ec11-b6e6-001dd83068fb",
    "nycsr_interventionenddate@OData.Community.Display.V1.FormattedValue": "10/3/2021",
    "nycsr_interventionenddate": "2021-10-03T04:00:00Z",
    "nycsr_casenumber": "052931",
    "nycsr_interventionstartdate@OData.Community.Display.V1.FormattedValue": "9/28/2021",
    "nycsr_interventionstartdate": "2021-09-28T04:00:00Z",
    "nycsr_building.nycsr_address": "1181 NELSON AVENUE",
    "nycsr_building.nycsr_latitude@OData.Community.Display.V1.FormattedValue": "40,837,338.000000",
    "nycsr_building.nycsr_latitude": 40837338,
    "nycsr_building.nycsr_buildingid": "4b45378b-4afb-ea11-b883-24ee9a37d459",
    "nycsr_building.nycsr_longitude@OData.Community.Display.V1.FormattedValue": "-73,926,063.000000",
    "nycsr_building.nycsr_longitude": -73926063,
    "nycsr_building.nycsr_geographicaldistrictcode": "9",
    "nycsr_building.nycsr_buildingname": "HIGHBRIDGE ADVISORY COUNCIL",
    "nycsr_locationsite.nycsr_sitename": "Highbridge Advisory Council - XAIN - XAIN -  - 1181 NELSON AVENUE"
  },
  {
    "@odata.etag": "W/\"325861708\"",
    "nycsr_admininterventiontype@OData.Community.Display.V1.FormattedValue": "Non-Classroom Quarantine",
    "nycsr_admininterventiontype": 882450003,
    "nycsr_caseid": "448dc5f6-aa1f-ec11-b6e6-001dd83068fb",
    "nycsr_interventionenddate@OData.Community.Display.V1.FormattedValue": "10/3/2021",
    "nycsr_interventionenddate": "2021-10-03T04:00:00Z",
    "nycsr_casenumber": "052943",
    "nycsr_interventionstartdate@OData.Community.Display.V1.FormattedValue": "9/28/2021",
    "nycsr_interventionstartdate": "2021-09-28T04:00:00Z",
    "nycsr_building.nycsr_address": "50 AVENUE X",
    "nycsr_building.nycsr_latitude@OData.Community.Display.V1.FormattedValue": "40,588,070.000000",
    "nycsr_building.nycsr_latitude": 40588070,
    "nycsr_building.nycsr_buildingid": "05fc3df4-30f4-ea11-b882-24ee9a37d45c",
    "nycsr_building.nycsr_borough@OData.Community.Display.V1.FormattedValue": "Brooklyn",
    "nycsr_building.nycsr_borough": 882450002,
    "nycsr_building.nycsr_longitude@OData.Community.Display.V1.FormattedValue": "-73,981,925.000000",
    "nycsr_building.nycsr_longitude": -73981925,
    "nycsr_building.nycsr_geographicaldistrictcode": "21",
    "nycsr_building.nycsr_buildingname": "JOHN DEWEY HS - K",
    "nycsr_locationsite.nycsr_sitename": "John Dewey High School - K540 - K540 - 21K540 - 50 AVENUE X"
  },
  {
    "@odata.etag": "W/\"327139723\"",
    "nycsr_admininterventiontype@OData.Community.Display.V1.FormattedValue": "Classroom Closed",
    "nycsr_admininterventiontype": 882450000,
    "nycsr_caseid": "8b66ae5e-ab1f-ec11-b6e6-001dd83068fb",
    "nycsr_interventionenddate@OData.Community.Display.V1.FormattedValue": "10/1/2021",
    "nycsr_interventionenddate": "2021-10-01T04:00:00Z",
    "nycsr_casenumber": "052946",
    "nycsr_interventionstartdate@OData.Community.Display.V1.FormattedValue": "9/28/2021",
    "nycsr_interventionstartdate": "2021-09-28T04:00:00Z",
    "nycsr_building.nycsr_address": "233-15 MERRICK BOULEVARD",
    "nycsr_building.nycsr_latitude@OData.Community.Display.V1.FormattedValue": "40,675,070.000000",
    "nycsr_building.nycsr_latitude": 40675070,
    "nycsr_building.nycsr_buildingid": "52a10a44-32f4-ea11-b882-24ee9a37d45c",
    "nycsr_building.nycsr_borough@OData.Community.Display.V1.FormattedValue": "Queens",
    "nycsr_building.nycsr_borough": 882450003,
    "nycsr_building.nycsr_longitude@OData.Community.Display.V1.FormattedValue": "-73,736,232.000000",
    "nycsr_building.nycsr_longitude": -73736232,
    "nycsr_building.nycsr_geographicaldistrictcode": "29",
    "nycsr_building.nycsr_buildingname": "P.S. 270 - QUEENS",
    "nycsr_locationsite.nycsr_sitename": "The Gordon Parks School - Q270 - Q270 - 29Q270 - 233-15 MERRICK BOULEVARD"
  },
  {
    "@odata.etag": "W/\"326134508\"",
    "nycsr_admininterventiontype@OData.Community.Display.V1.FormattedValue": "Partial Classroom Quarantine",
    "nycsr_admininterventiontype": 882450001,
    "nycsr_caseid": "72e39d52-ac1f-ec11-b6e6-001dd83068fb",
    "nycsr_interventionenddate@OData.Community.Display.V1.FormattedValue": "10/3/2021",
    "nycsr_interventionenddate": "2021-10-03T04:00:00Z",
    "nycsr_casenumber": "052951",
    "nycsr_interventionstartdate@OData.Community.Display.V1.FormattedValue": "9/28/2021",
    "nycsr_interventionstartdate": "2021-09-28T04:00:00Z",
    "nycsr_building.nycsr_address": "1200 MANOR ROAD",
    "nycsr_building.nycsr_latitude@OData.Community.Display.V1.FormattedValue": "40,588,985.000000",
    "nycsr_building.nycsr_latitude": 40588985,
    "nycsr_building.nycsr_buildingid": "5abe7adc-32f4-ea11-b882-24ee9a37d45c",
    "nycsr_building.nycsr_borough@OData.Community.Display.V1.FormattedValue": "Staten Island",
    "nycsr_building.nycsr_borough": 882450004,
    "nycsr_building.nycsr_longitude@OData.Community.Display.V1.FormattedValue": "-74,130,819.000000",
    "nycsr_building.nycsr_longitude": -74130819,
    "nycsr_building.nycsr_geographicaldistrictcode": "31",
    "nycsr_building.nycsr_buildingname": "SUSAN E. WAGNER HS - S. I.",
    "nycsr_locationsite.nycsr_sitename": "Susan E. Wagner High School - R460 - R460 - 31R460 - 1200 MANOR ROAD"
  },
  {
    "@odata.etag": "W/\"325861734\"",
    "nycsr_admininterventiontype@OData.Community.Display.V1.FormattedValue": "Partial Classroom Quarantine",
    "nycsr_admininterventiontype": 882450001,
    "nycsr_caseid": "0cf9e082-ac1f-ec11-b6e6-001dd83068fb",
    "nycsr_interventionenddate@OData.Community.Display.V1.FormattedValue": "10/7/2021",
    "nycsr_interventionenddate": "2021-10-07T04:00:00Z",
    "nycsr_casenumber": "052953",
    "nycsr_interventionstartdate@OData.Community.Display.V1.FormattedValue": "9/28/2021",
    "nycsr_interventionstartdate": "2021-09-28T04:00:00Z",
    "nycsr_building.nycsr_address": "48-01 90 STREET",
    "nycsr_building.nycsr_latitude@OData.Community.Display.V1.FormattedValue": "40,740,824.000000",
    "nycsr_building.nycsr_latitude": 40740824,
    "nycsr_building.nycsr_buildingid": "8c476368-32f4-ea11-b882-24ee9a37d45c",
    "nycsr_building.nycsr_borough@OData.Community.Display.V1.FormattedValue": "Queens",
    "nycsr_building.nycsr_borough": 882450003,
    "nycsr_building.nycsr_longitude@OData.Community.Display.V1.FormattedValue": "-73,874,129.000000",
    "nycsr_building.nycsr_longitude": -73874129,
    "nycsr_building.nycsr_geographicaldistrictcode": "24",
    "nycsr_building.nycsr_buildingname": "NEWTOWN HS - Q",
    "nycsr_locationsite.nycsr_sitename": "Newtown High School - Q455 - Q455 - 24Q455 - 48-01 90 STREET"
  },
  {
    "@odata.etag": "W/\"327150138\"",
    "nycsr_admininterventiontype@OData.Community.Display.V1.FormattedValue": "Partial Classroom Quarantine",
    "nycsr_admininterventiontype": 882450001,
    "nycsr_caseid": "d0eeaf22-ad1f-ec11-b6e6-001dd83068fb",
    "nycsr_interventionenddate@OData.Community.Display.V1.FormattedValue": "10/1/2021",
    "nycsr_interventionenddate": "2021-10-01T04:00:00Z",
    "nycsr_casenumber": "052958",
    "nycsr_interventionstartdate@OData.Community.Display.V1.FormattedValue": "9/28/2021",
    "nycsr_interventionstartdate": "2021-09-28T04:00:00Z",
    "nycsr_building.nycsr_address": "1866 EAST  17 STREET",
    "nycsr_building.nycsr_latitude@OData.Community.Display.V1.FormattedValue": "40,604,461.000000",
    "nycsr_building.nycsr_latitude": 40604461,
    "nycsr_building.nycsr_buildingid": "a883ff9e-30f4-ea11-b882-24ee9a37d45c",
    "nycsr_building.nycsr_borough@OData.Community.Display.V1.FormattedValue": "Brooklyn",
    "nycsr_building.nycsr_borough": 882450002,
    "nycsr_building.nycsr_longitude@OData.Community.Display.V1.FormattedValue": "-73,955,891.000000",
    "nycsr_building.nycsr_longitude": -73955891,
    "nycsr_building.nycsr_geographicaldistrictcode": "22",
    "nycsr_building.nycsr_buildingname": "P.S. 255 - BROOKLYN",
    "nycsr_locationsite.nycsr_sitename": "P.S. 255 Barbara Reing School - K255 - K255 - 22K255 - 1866 EAST  17 STREET"
  },
  {
    "@odata.etag": "W/\"327133626\"",
    "nycsr_admininterventiontype@OData.Community.Display.V1.FormattedValue": "Classroom Closed",
    "nycsr_admininterventiontype": 882450000,
    "nycsr_caseid": "de90991c-af1f-ec11-b6e6-001dd83068fb",
    "nycsr_interventionenddate@OData.Community.Display.V1.FormattedValue": "10/3/2021",
    "nycsr_interventionenddate": "2021-10-03T04:00:00Z",
    "nycsr_casenumber": "052973",
    "nycsr_interventionstartdate@OData.Community.Display.V1.FormattedValue": "9/28/2021",
    "nycsr_interventionstartdate": "2021-09-28T04:00:00Z",
    "nycsr_building.nycsr_address": "610 HENRY STREET",
    "nycsr_building.nycsr_latitude@OData.Community.Display.V1.FormattedValue": "40,679,462.000000",
    "nycsr_building.nycsr_latitude": 40679462,
    "nycsr_building.nycsr_buildingid": "cfd27c6d-30f4-ea11-b882-24ee9a37d45c",
    "nycsr_building.nycsr_borough@OData.Community.Display.V1.FormattedValue": "Brooklyn",
    "nycsr_building.nycsr_borough": 882450002,
    "nycsr_building.nycsr_longitude@OData.Community.Display.V1.FormattedValue": "-74,002,022.000000",
    "nycsr_building.nycsr_longitude": -74002022,
    "nycsr_building.nycsr_geographicaldistrictcode": "15",
    "nycsr_building.nycsr_buildingname": "J.H.S. 142 - BROOKLYN",
    "nycsr_locationsite.nycsr_sitename": "The Brooklyn New School, P.S. 146 - K146 - K142 - 15K146 - 610 HENRY STREET"
  },
  {
    "@odata.etag": "W/\"326858138\"",
    "nycsr_admininterventiontype@OData.Community.Display.V1.FormattedValue": "Partial Classroom Quarantine",
    "nycsr_admininterventiontype": 882450001,
    "nycsr_caseid": "6c926d3f-b01f-ec11-b6e6-001dd83068fb",
    "nycsr_interventionenddate@OData.Community.Display.V1.FormattedValue": "10/4/2021",
    "nycsr_interventionenddate": "2021-10-04T04:00:00Z",
    "nycsr_casenumber": "052982",
    "nycsr_interventionstartdate@OData.Community.Display.V1.FormattedValue": "9/28/2021",
    "nycsr_interventionstartdate": "2021-09-28T04:00:00Z",
    "nycsr_building.nycsr_address": "455 HUGUENOT AVENUE",
    "nycsr_building.nycsr_latitude@OData.Community.Display.V1.FormattedValue": "40,544,535.000000",
    "nycsr_building.nycsr_latitude": 40544535,
    "nycsr_building.nycsr_buildingid": "e28521d0-32f4-ea11-b882-24ee9a37d45c",
    "nycsr_building.nycsr_borough@OData.Community.Display.V1.FormattedValue": "Staten Island",
    "nycsr_building.nycsr_borough": 882450004,
    "nycsr_building.nycsr_longitude@OData.Community.Display.V1.FormattedValue": "-74,197,033.000000",
    "nycsr_building.nycsr_longitude": -74197033,
    "nycsr_building.nycsr_geographicaldistrictcode": "31",
    "nycsr_building.nycsr_buildingname": "I.S. 75 - STATEN ISLAND",
    "nycsr_locationsite.nycsr_sitename": "I.S. 075 Frank D. Paulo - R075 - R075 - 31R075 - 455 HUGUENOT AVENUE"
  },
  {
    "@odata.etag": "W/\"327142841\"",
    "nycsr_admininterventiontype@OData.Community.Display.V1.FormattedValue": "Classroom Closed",
    "nycsr_admininterventiontype": 882450000,
    "nycsr_caseid": "8d37fbef-b01f-ec11-b6e6-001dd83068fb",
    "nycsr_interventionenddate@OData.Community.Display.V1.FormattedValue": "10/7/2021",
    "nycsr_interventionenddate": "2021-10-07T04:00:00Z",
    "nycsr_casenumber": "052987",
    "nycsr_interventionstartdate@OData.Community.Display.V1.FormattedValue": "9/28/2021",
    "nycsr_interventionstartdate": "2021-09-28T04:00:00Z",
    "nycsr_building.nycsr_address": "46-08 5TH STREET",
    "nycsr_building.nycsr_latitude@OData.Community.Display.V1.FormattedValue": "40,747,077.000000",
    "nycsr_building.nycsr_latitude": 40747077,
    "nycsr_building.nycsr_buildingid": "cf454b50-32f4-ea11-b882-24ee9a37d45c",
    "nycsr_building.nycsr_borough@OData.Community.Display.V1.FormattedValue": "Queens",
    "nycsr_building.nycsr_borough": 882450003,
    "nycsr_building.nycsr_longitude@OData.Community.Display.V1.FormattedValue": "-73,955,145.000000",
    "nycsr_building.nycsr_longitude": -73955145,
    "nycsr_building.nycsr_geographicaldistrictcode": "30",
    "nycsr_building.nycsr_buildingname": "P.S./.IS. 78 - QUEENS",
    "nycsr_locationsite.nycsr_sitename": "The Riverview School - Q277 - Q312 - 75Q277 - 46-08 5TH STREET"
  },
  {
    "@odata.etag": "W/\"327198892\"",
    "nycsr_admininterventiontype@OData.Community.Display.V1.FormattedValue": "Partial Classroom Quarantine",
    "nycsr_admininterventiontype": 882450001,
    "nycsr_caseid": "4eebf868-b11f-ec11-b6e6-001dd83068fb",
    "nycsr_interventionenddate@OData.Community.Display.V1.FormattedValue": "10/4/2021",
    "nycsr_interventionenddate": "2021-10-04T04:00:00Z",
    "nycsr_casenumber": "052994",
    "nycsr_interventionstartdate@OData.Community.Display.V1.FormattedValue": "9/29/2021",
    "nycsr_interventionstartdate": "2021-09-29T04:00:00Z",
    "nycsr_building.nycsr_address": "21-27 HIMROD STREET",
    "nycsr_building.nycsr_latitude@OData.Community.Display.V1.FormattedValue": "40,711,881.000000",
    "nycsr_building.nycsr_latitude": 40711881,
    "nycsr_building.nycsr_buildingid": "74bc9674-32f4-ea11-b882-24ee9a37d45c",
    "nycsr_building.nycsr_borough@OData.Community.Display.V1.FormattedValue": "Queens",
    "nycsr_building.nycsr_borough": 882450003,
    "nycsr_building.nycsr_longitude@OData.Community.Display.V1.FormattedValue": "-73,909,202.000000",
    "nycsr_building.nycsr_longitude": -73909202,
    "nycsr_building.nycsr_geographicaldistrictcode": "24",
    "nycsr_building.nycsr_buildingname": "GROVER CLEVELAND HS - Q",
    "nycsr_locationsite.nycsr_sitename": "Grover Cleveland High School - Q485 - Q485 - 24Q485 - 21-27 HIMROD STREET"
  },
  {
    "@odata.etag": "W/\"326274403\"",
    "nycsr_admininterventiontype@OData.Community.Display.V1.FormattedValue": "Partial Classroom Quarantine",
    "nycsr_admininterventiontype": 882450001,
    "nycsr_caseid": "18984bac-b21f-ec11-b6e6-001dd83068fb",
    "nycsr_interventionenddate@OData.Community.Display.V1.FormattedValue": "10/4/2021",
    "nycsr_interventionenddate": "2021-10-04T04:00:00Z",
    "nycsr_casenumber": "053007",
    "nycsr_interventionstartdate@OData.Community.Display.V1.FormattedValue": "9/28/2021",
    "nycsr_interventionstartdate": "2021-09-28T04:00:00Z",
    "nycsr_building.nycsr_address": "456 WHITE PLAINS ROAD",
    "nycsr_building.nycsr_latitude@OData.Community.Display.V1.FormattedValue": "40,815,043.000000",
    "nycsr_building.nycsr_latitude": 40815043,
    "nycsr_building.nycsr_buildingid": "2a2ed53d-33f4-ea11-b882-24ee9a37d45c",
    "nycsr_building.nycsr_borough@OData.Community.Display.V1.FormattedValue": "Bronx",
    "nycsr_building.nycsr_borough": 882450001,
    "nycsr_building.nycsr_longitude@OData.Community.Display.V1.FormattedValue": "-73,856,070.000000",
    "nycsr_building.nycsr_longitude": -73856070,
    "nycsr_building.nycsr_geographicaldistrictcode": "8",
    "nycsr_building.nycsr_buildingname": "I.S. 174 - BRONX",
    "nycsr_locationsite.nycsr_sitename": "Women's Academy of Excellence - X282 - X174 - 08X282 - 456 WHITE PLAINS ROAD"
  },
  {
    "@odata.etag": "W/\"328506182\"",
    "nycsr_admininterventiontype@OData.Community.Display.V1.FormattedValue": "Partial Classroom Quarantine",
    "nycsr_admininterventiontype": 882450001,
    "nycsr_caseid": "7d5c38a6-b31f-ec11-b6e6-001dd83068fb",
    "nycsr_interventionenddate@OData.Community.Display.V1.FormattedValue": "10/3/2021",
    "nycsr_interventionenddate": "2021-10-03T04:00:00Z",
    "nycsr_casenumber": "053013",
    "nycsr_interventionstartdate@OData.Community.Display.V1.FormattedValue": "9/30/2021",
    "nycsr_interventionstartdate": "2021-09-30T04:00:00Z",
    "nycsr_building.nycsr_address": "100 LUTEN AVENUE",
    "nycsr_building.nycsr_latitude@OData.Community.Display.V1.FormattedValue": "40,528,152.000000",
    "nycsr_building.nycsr_latitude": 40528152,
    "nycsr_building.nycsr_buildingid": "605b4cd6-32f4-ea11-b882-24ee9a37d45c",
    "nycsr_building.nycsr_borough@OData.Community.Display.V1.FormattedValue": "Staten Island",
    "nycsr_building.nycsr_borough": 882450004,
    "nycsr_building.nycsr_longitude@OData.Community.Display.V1.FormattedValue": "-74,193,431.000000",
    "nycsr_building.nycsr_longitude": -74193431,
    "nycsr_building.nycsr_geographicaldistrictcode": "31",
    "nycsr_building.nycsr_buildingname": "TOTTENVILLE HS - S. I.",
    "nycsr_locationsite.nycsr_sitename": "Tottenville High School - R455 - R455 - 31R455 - 100 LUTEN AVENUE"
  },
  {
    "@odata.etag": "W/\"327150859\"",
    "nycsr_admininterventiontype@OData.Community.Display.V1.FormattedValue": "Partial Classroom Quarantine",
    "nycsr_admininterventiontype": 882450001,
    "nycsr_caseid": "e9fd1537-b51f-ec11-b6e6-001dd83068fb",
    "nycsr_interventionenddate@OData.Community.Display.V1.FormattedValue": "10/4/2021",
    "nycsr_interventionenddate": "2021-10-04T04:00:00Z",
    "nycsr_casenumber": "053023",
    "nycsr_interventionstartdate@OData.Community.Display.V1.FormattedValue": "9/28/2021",
    "nycsr_interventionstartdate": "2021-09-28T04:00:00Z",
    "nycsr_building.nycsr_address": "99 AVENUE P",
    "nycsr_building.nycsr_latitude@OData.Community.Display.V1.FormattedValue": "40,608,135.000000",
    "nycsr_building.nycsr_latitude": 40608135,
    "nycsr_building.nycsr_buildingid": "c10d3c5b-30f4-ea11-b882-24ee9a37d45c",
    "nycsr_building.nycsr_borough@OData.Community.Display.V1.FormattedValue": "Brooklyn",
    "nycsr_building.nycsr_borough": 882450002,
    "nycsr_building.nycsr_longitude@OData.Community.Display.V1.FormattedValue": "-73,984,985.000000",
    "nycsr_building.nycsr_longitude": -73984985,
    "nycsr_building.nycsr_geographicaldistrictcode": "21",
    "nycsr_building.nycsr_buildingname": "I.S. 96 - BROOKLYN",
    "nycsr_locationsite.nycsr_sitename": "I.S. 096 Seth Low - K096 - K096 - 21K096 - 99 AVENUE P"
  },
  {
    "@odata.etag": "W/\"327151815\"",
    "nycsr_admininterventiontype@OData.Community.Display.V1.FormattedValue": "Classroom Closed",
    "nycsr_admininterventiontype": 882450000,
    "nycsr_caseid": "8311c0ae-b61f-ec11-b6e6-001dd83068fb",
    "nycsr_interventionenddate@OData.Community.Display.V1.FormattedValue": "10/4/2021",
    "nycsr_interventionenddate": "2021-10-04T04:00:00Z",
    "nycsr_casenumber": "053030",
    "nycsr_interventionstartdate@OData.Community.Display.V1.FormattedValue": "9/28/2021",
    "nycsr_interventionstartdate": "2021-09-28T04:00:00Z",
    "nycsr_building.nycsr_address": "171-11 35 AVENUE",
    "nycsr_building.nycsr_latitude@OData.Community.Display.V1.FormattedValue": "40,765,459.000000",
    "nycsr_building.nycsr_latitude": 40765459,
    "nycsr_building.nycsr_buildingid": "ca8442ee-31f4-ea11-b882-24ee9a37d45c",
    "nycsr_building.nycsr_borough@OData.Community.Display.V1.FormattedValue": "Queens",
    "nycsr_building.nycsr_borough": 882450003,
    "nycsr_building.nycsr_longitude@OData.Community.Display.V1.FormattedValue": "-73,794,323.000000",
    "nycsr_building.nycsr_longitude": -73794323,
    "nycsr_building.nycsr_geographicaldistrictcode": "25",
    "nycsr_building.nycsr_buildingname": "P.S. 32 - QUEENS",
    "nycsr_locationsite.nycsr_sitename": "P.S. 032 State Street - Q032 - Q032 - 25Q032 - 171-11 35 AVENUE"
  },
  {
    "@odata.etag": "W/\"325861915\"",
    "nycsr_admininterventiontype@OData.Community.Display.V1.FormattedValue": "Partial Classroom Quarantine",
    "nycsr_admininterventiontype": 882450001,
    "nycsr_caseid": "8b1d7f31-b81f-ec11-b6e6-001dd83068fb",
    "nycsr_interventionenddate@OData.Community.Display.V1.FormattedValue": "10/3/2021",
    "nycsr_interventionenddate": "2021-10-03T04:00:00Z",
    "nycsr_casenumber": "053036",
    "nycsr_interventionstartdate@OData.Community.Display.V1.FormattedValue": "9/28/2021",
    "nycsr_interventionstartdate": "2021-09-28T04:00:00Z",
    "nycsr_building.nycsr_address": "730 BRYANT AVENUE",
    "nycsr_building.nycsr_latitude@OData.Community.Display.V1.FormattedValue": "40,815,827.000000",
    "nycsr_building.nycsr_latitude": 40815827,
    "nycsr_building.nycsr_buildingid": "f9d10307-33f4-ea11-b882-24ee9a37d45c",
    "nycsr_building.nycsr_borough@OData.Community.Display.V1.FormattedValue": "Bronx",
    "nycsr_building.nycsr_borough": 882450001,
    "nycsr_building.nycsr_longitude@OData.Community.Display.V1.FormattedValue": "-73,885,284.000000",
    "nycsr_building.nycsr_longitude": -73885284,
    "nycsr_building.nycsr_geographicaldistrictcode": "8",
    "nycsr_building.nycsr_buildingname": "I.S. 201 - BRONX",
    "nycsr_locationsite.nycsr_sitename": "Bronx Academy for Multi-Media - X424 - X074 - 08X424 - 730 BRYANT AVENUE"
  },
  {
    "@odata.etag": "W/\"327198932\"",
    "nycsr_admininterventiontype@OData.Community.Display.V1.FormattedValue": "Partial Classroom Quarantine",
    "nycsr_admininterventiontype": 882450001,
    "nycsr_caseid": "c01b1cd4-bd1f-ec11-b6e6-001dd83068fb",
    "nycsr_interventionenddate@OData.Community.Display.V1.FormattedValue": "10/4/2021",
    "nycsr_interventionenddate": "2021-10-04T04:00:00Z",
    "nycsr_casenumber": "053082",
    "nycsr_interventionstartdate@OData.Community.Display.V1.FormattedValue": "9/29/2021",
    "nycsr_interventionstartdate": "2021-09-29T04:00:00Z",
    "nycsr_building.nycsr_address": "147-36 26 AVENUE",
    "nycsr_building.nycsr_latitude@OData.Community.Display.V1.FormattedValue": "40,774,134.000000",
    "nycsr_building.nycsr_latitude": 40774134,
    "nycsr_building.nycsr_buildingid": "adfc24e8-31f4-ea11-b882-24ee9a37d45c",
    "nycsr_building.nycsr_borough@OData.Community.Display.V1.FormattedValue": "Queens",
    "nycsr_building.nycsr_borough": 882450003,
    "nycsr_building.nycsr_longitude@OData.Community.Display.V1.FormattedValue": "-73,818,581.000000",
    "nycsr_building.nycsr_longitude": -73818581,
    "nycsr_building.nycsr_geographicaldistrictcode": "25",
    "nycsr_building.nycsr_buildingname": "P.S. 21 - QUEENS",
    "nycsr_locationsite.nycsr_sitename": "P.S. 021 Edward Hart - Q021 - Q021 - 25Q021 - 147-36 26 AVENUE"
  },
  {
    "@odata.etag": "W/\"327152186\"",
    "nycsr_admininterventiontype@OData.Community.Display.V1.FormattedValue": "Partial Classroom Quarantine",
    "nycsr_admininterventiontype": 882450001,
    "nycsr_caseid": "18ecd6fe-bd1f-ec11-b6e6-001dd83068fb",
    "nycsr_interventionenddate@OData.Community.Display.V1.FormattedValue": "10/7/2021",
    "nycsr_interventionenddate": "2021-10-07T04:00:00Z",
    "nycsr_casenumber": "053084",
    "nycsr_interventionstartdate@OData.Community.Display.V1.FormattedValue": "9/28/2021",
    "nycsr_interventionstartdate": "2021-09-28T04:00:00Z",
    "nycsr_building.nycsr_address": "2756 RESERVOIR AVENUE",
    "nycsr_building.nycsr_latitude@OData.Community.Display.V1.FormattedValue": "40,869,061.000000",
    "nycsr_building.nycsr_latitude": 40869061,
    "nycsr_building.nycsr_buildingid": "19474313-33f4-ea11-b882-24ee9a37d45c",
    "nycsr_building.nycsr_borough@OData.Community.Display.V1.FormattedValue": "Bronx",
    "nycsr_building.nycsr_borough": 882450001,
    "nycsr_building.nycsr_longitude@OData.Community.Display.V1.FormattedValue": "-73,897,066.000000",
    "nycsr_building.nycsr_longitude": -73897066,
    "nycsr_building.nycsr_geographicaldistrictcode": "10",
    "nycsr_building.nycsr_buildingname": "P.S. 86 - BRONX",
    "nycsr_locationsite.nycsr_sitename": "P.S. 086 Kingsbridge Heights - X086 - X086 - 10X086 - 2756 RESERVOIR AVENUE"
  },
  {
    "@odata.etag": "W/\"327153114\"",
    "nycsr_admininterventiontype@OData.Community.Display.V1.FormattedValue": "Classroom Closed",
    "nycsr_admininterventiontype": 882450000,
    "nycsr_caseid": "2bbae8c6-be1f-ec11-b6e6-001dd83068fb",
    "nycsr_interventionenddate@OData.Community.Display.V1.FormattedValue": "10/4/2021",
    "nycsr_interventionenddate": "2021-10-04T04:00:00Z",
    "nycsr_casenumber": "053091",
    "nycsr_interventionstartdate@OData.Community.Display.V1.FormattedValue": "9/28/2021",
    "nycsr_interventionstartdate": "2021-09-28T04:00:00Z",
    "nycsr_building.nycsr_address": "147-36 26 AVENUE",
    "nycsr_building.nycsr_latitude@OData.Community.Display.V1.FormattedValue": "40,774,134.000000",
    "nycsr_building.nycsr_latitude": 40774134,
    "nycsr_building.nycsr_buildingid": "adfc24e8-31f4-ea11-b882-24ee9a37d45c",
    "nycsr_building.nycsr_borough@OData.Community.Display.V1.FormattedValue": "Queens",
    "nycsr_building.nycsr_borough": 882450003,
    "nycsr_building.nycsr_longitude@OData.Community.Display.V1.FormattedValue": "-73,818,581.000000",
    "nycsr_building.nycsr_longitude": -73818581,
    "nycsr_building.nycsr_geographicaldistrictcode": "25",
    "nycsr_building.nycsr_buildingname": "P.S. 21 - QUEENS",
    "nycsr_locationsite.nycsr_sitename": "P.S. 021 Edward Hart - Q021 - Q021 - 25Q021 - 147-36 26 AVENUE"
  },
  {
    "@odata.etag": "W/\"327198937\"",
    "nycsr_admininterventiontype@OData.Community.Display.V1.FormattedValue": "Partial Classroom Quarantine",
    "nycsr_admininterventiontype": 882450001,
    "nycsr_caseid": "5fd4735f-bf1f-ec11-b6e6-001dd83068fb",
    "nycsr_interventionenddate@OData.Community.Display.V1.FormattedValue": "10/4/2021",
    "nycsr_interventionenddate": "2021-10-04T04:00:00Z",
    "nycsr_casenumber": "053098",
    "nycsr_interventionstartdate@OData.Community.Display.V1.FormattedValue": "9/29/2021",
    "nycsr_interventionstartdate": "2021-09-29T04:00:00Z",
    "nycsr_building.nycsr_address": "138-01 77 AVENUE",
    "nycsr_building.nycsr_latitude@OData.Community.Display.V1.FormattedValue": "40,721,514.000000",
    "nycsr_building.nycsr_latitude": 40721514,
    "nycsr_building.nycsr_buildingid": "ff9b4c1f-32f4-ea11-b882-24ee9a37d45c",
    "nycsr_building.nycsr_borough@OData.Community.Display.V1.FormattedValue": "Queens",
    "nycsr_building.nycsr_borough": 882450003,
    "nycsr_building.nycsr_longitude@OData.Community.Display.V1.FormattedValue": "-73,823,569.000000",
    "nycsr_building.nycsr_longitude": -73823569,
    "nycsr_building.nycsr_geographicaldistrictcode": "25",
    "nycsr_building.nycsr_buildingname": "P.S. 164 - QUEENS",
    "nycsr_locationsite.nycsr_sitename": "P.S. 164 Queens Valley - Q164 - Q164 - 25Q164 - 138-01 77 AVENUE"
  },
  {
    "@odata.etag": "W/\"327153327\"",
    "nycsr_admininterventiontype@OData.Community.Display.V1.FormattedValue": "Classroom Closed",
    "nycsr_admininterventiontype": 882450000,
    "nycsr_caseid": "a864ae6b-bf1f-ec11-b6e6-001dd83068fb",
    "nycsr_interventionenddate@OData.Community.Display.V1.FormattedValue": "10/4/2021",
    "nycsr_interventionenddate": "2021-10-04T04:00:00Z",
    "nycsr_casenumber": "053099",
    "nycsr_interventionstartdate@OData.Community.Display.V1.FormattedValue": "9/28/2021",
    "nycsr_interventionstartdate": "2021-09-28T04:00:00Z",
    "nycsr_building.nycsr_address": "4862 BROADWAY",
    "nycsr_building.nycsr_latitude@OData.Community.Display.V1.FormattedValue": "40,866,381.000000",
    "nycsr_building.nycsr_latitude": 40866381,
    "nycsr_building.nycsr_buildingid": "46507380-31f4-ea11-b882-24ee9a37d45c",
    "nycsr_building.nycsr_borough@OData.Community.Display.V1.FormattedValue": "Manhattan",
    "nycsr_building.nycsr_borough": 882450000,
    "nycsr_building.nycsr_longitude@OData.Community.Display.V1.FormattedValue": "-73,923,818.000000",
    "nycsr_building.nycsr_longitude": -73923818,
    "nycsr_building.nycsr_geographicaldistrictcode": "6",
    "nycsr_building.nycsr_buildingname": "P.S./I.S. 176 - MANHATTAN",
    "nycsr_locationsite.nycsr_sitename": "Muscota - M314 - M176 - 06M314 - 4862 BROADWAY"
  },
  {
    "@odata.etag": "W/\"326825902\"",
    "nycsr_admininterventiontype@OData.Community.Display.V1.FormattedValue": "Non-Classroom Quarantine",
    "nycsr_admininterventiontype": 882450003,
    "nycsr_caseid": "c46393d1-c01f-ec11-b6e6-001dd83068fb",
    "nycsr_interventionenddate@OData.Community.Display.V1.FormattedValue": "10/4/2021",
    "nycsr_interventionenddate": "2021-10-04T04:00:00Z",
    "nycsr_casenumber": "053111",
    "nycsr_interventionstartdate@OData.Community.Display.V1.FormattedValue": "9/28/2021",
    "nycsr_interventionstartdate": "2021-09-28T04:00:00Z",
    "nycsr_building.nycsr_address": "133-40 79TH STREET",
    "nycsr_building.nycsr_latitude@OData.Community.Display.V1.FormattedValue": "40,671,903.000000",
    "nycsr_building.nycsr_latitude": 40671903,
    "nycsr_building.nycsr_buildingid": "2c02926e-32f4-ea11-b882-24ee9a37d45c",
    "nycsr_building.nycsr_borough@OData.Community.Display.V1.FormattedValue": "Queens",
    "nycsr_building.nycsr_borough": 882450003,
    "nycsr_building.nycsr_longitude@OData.Community.Display.V1.FormattedValue": "-73,857,176.000000",
    "nycsr_building.nycsr_longitude": -73857176,
    "nycsr_building.nycsr_geographicaldistrictcode": "27",
    "nycsr_building.nycsr_buildingname": "3K CENTER @ 133-40 79TH STREET - QUEENS",
    "nycsr_locationsite.nycsr_sitename": "Curious Young Learners Pre-K Center - Q336 - Q473 - 27Q336 - 133-40 79TH STREET"
  },
  {
    "@odata.etag": "W/\"328318465\"",
    "nycsr_admininterventiontype@OData.Community.Display.V1.FormattedValue": "Partial Classroom Quarantine",
    "nycsr_admininterventiontype": 882450001,
    "nycsr_caseid": "7f42f3f6-c01f-ec11-b6e6-001dd83068fb",
    "nycsr_interventionenddate@OData.Community.Display.V1.FormattedValue": "10/4/2021",
    "nycsr_interventionenddate": "2021-10-04T04:00:00Z",
    "nycsr_casenumber": "053112",
    "nycsr_interventionstartdate@OData.Community.Display.V1.FormattedValue": "9/28/2021",
    "nycsr_interventionstartdate": "2021-09-28T04:00:00Z",
    "nycsr_building.nycsr_address": "149-11 MELBOURNE AVENUE",
    "nycsr_building.nycsr_latitude@OData.Community.Display.V1.FormattedValue": "40,737,038.000000",
    "nycsr_building.nycsr_latitude": 40737038,
    "nycsr_building.nycsr_buildingid": "1db4977a-32f4-ea11-b882-24ee9a37d45c",
    "nycsr_building.nycsr_borough@OData.Community.Display.V1.FormattedValue": "Queens",
    "nycsr_building.nycsr_borough": 882450003,
    "nycsr_building.nycsr_longitude@OData.Community.Display.V1.FormattedValue": "-73,821,532.000000",
    "nycsr_building.nycsr_longitude": -73821532,
    "nycsr_building.nycsr_geographicaldistrictcode": "25",
    "nycsr_building.nycsr_buildingname": "TOWNSEND HARRIS HS - Q",
    "nycsr_locationsite.nycsr_sitename": "Townsend Harris High School - Q525 - Q515 - 25Q525 - 149-11 MELBOURNE AVENUE"
  },
  {
    "@odata.etag": "W/\"325862036\"",
    "nycsr_admininterventiontype@OData.Community.Display.V1.FormattedValue": "Partial Classroom Quarantine",
    "nycsr_admininterventiontype": 882450001,
    "nycsr_caseid": "99726264-c31f-ec11-b6e6-001dd83068fb",
    "nycsr_interventionenddate@OData.Community.Display.V1.FormattedValue": "10/4/2021",
    "nycsr_interventionenddate": "2021-10-04T04:00:00Z",
    "nycsr_casenumber": "053135",
    "nycsr_interventionstartdate@OData.Community.Display.V1.FormattedValue": "9/28/2021",
    "nycsr_interventionstartdate": "2021-09-28T04:00:00Z",
    "nycsr_building.nycsr_address": "33 FERNDALE AVENUE",
    "nycsr_building.nycsr_latitude@OData.Community.Display.V1.FormattedValue": "40,592,132.000000",
    "nycsr_building.nycsr_latitude": 40592132,
    "nycsr_building.nycsr_buildingid": "e48521d0-32f4-ea11-b882-24ee9a37d45c",
    "nycsr_building.nycsr_borough@OData.Community.Display.V1.FormattedValue": "Staten Island",
    "nycsr_building.nycsr_borough": 882450004,
    "nycsr_building.nycsr_longitude@OData.Community.Display.V1.FormattedValue": "-74,158,618.000000",
    "nycsr_building.nycsr_longitude": -74158618,
    "nycsr_building.nycsr_geographicaldistrictcode": "31",
    "nycsr_building.nycsr_buildingname": "I.S. 72 - STATEN ISLAND",
    "nycsr_locationsite.nycsr_sitename": "I.S. 072 Rocco Laurie - R072 - R072 - 31R072 - 33 FERNDALE AVENUE"
  },
  {
    "@odata.etag": "W/\"326848205\"",
    "nycsr_admininterventiontype@OData.Community.Display.V1.FormattedValue": "Partial Classroom Quarantine",
    "nycsr_admininterventiontype": 882450001,
    "nycsr_caseid": "67fe0192-c41f-ec11-b6e6-001dd83068fb",
    "nycsr_interventionenddate@OData.Community.Display.V1.FormattedValue": "10/7/2021",
    "nycsr_interventionenddate": "2021-10-07T04:00:00Z",
    "nycsr_casenumber": "053145",
    "nycsr_interventionstartdate@OData.Community.Display.V1.FormattedValue": "9/28/2021",
    "nycsr_interventionstartdate": "2021-09-28T04:00:00Z",
    "nycsr_building.nycsr_address": "905 WINTHROP STREET",
    "nycsr_building.nycsr_latitude@OData.Community.Display.V1.FormattedValue": "40,659,088.000000",
    "nycsr_building.nycsr_latitude": 40659088,
    "nycsr_building.nycsr_buildingid": "0222d292-30f4-ea11-b882-24ee9a37d45c",
    "nycsr_building.nycsr_borough@OData.Community.Display.V1.FormattedValue": "Brooklyn",
    "nycsr_building.nycsr_borough": 882450002,
    "nycsr_building.nycsr_longitude@OData.Community.Display.V1.FormattedValue": "-73,928,744.000000",
    "nycsr_building.nycsr_longitude": -73928744,
    "nycsr_building.nycsr_geographicaldistrictcode": "18",
    "nycsr_building.nycsr_buildingname": "I.S. 232 - BROOKLYN",
    "nycsr_locationsite.nycsr_sitename": "Kings Collegiate Charter School - K608 - K232 - 84K608 - 905 WINTHROP STREET"
  },
  {
    "@odata.etag": "W/\"326796022\"",
    "nycsr_admininterventiontype@OData.Community.Display.V1.FormattedValue": "Partial Classroom Quarantine",
    "nycsr_admininterventiontype": 882450001,
    "nycsr_caseid": "209c2704-c71f-ec11-b6e6-001dd83068fb",
    "nycsr_interventionenddate@OData.Community.Display.V1.FormattedValue": "10/2/2021",
    "nycsr_interventionenddate": "2021-10-02T04:00:00Z",
    "nycsr_casenumber": "053163",
    "nycsr_interventionstartdate@OData.Community.Display.V1.FormattedValue": "9/28/2021",
    "nycsr_interventionstartdate": "2021-09-28T04:00:00Z",
    "nycsr_building.nycsr_address": "34-65 192 STREET",
    "nycsr_building.nycsr_latitude@OData.Community.Display.V1.FormattedValue": "40,764,884.000000",
    "nycsr_building.nycsr_latitude": 40764884,
    "nycsr_building.nycsr_buildingid": "befc24e8-31f4-ea11-b882-24ee9a37d45c",
    "nycsr_building.nycsr_borough@OData.Community.Display.V1.FormattedValue": "Queens",
    "nycsr_building.nycsr_borough": 882450003,
    "nycsr_building.nycsr_longitude@OData.Community.Display.V1.FormattedValue": "-73,789,365.000000",
    "nycsr_building.nycsr_longitude": -73789365,
    "nycsr_building.nycsr_geographicaldistrictcode": "25",
    "nycsr_building.nycsr_buildingname": "J.H.S. 25 - QUEENS",
    "nycsr_locationsite.nycsr_sitename": "I.S. 025 Adrien Block - Q025 - Q025 - 25Q025 - 34-65 192 STREET"
  },
  {
    "@odata.etag": "W/\"327198957\"",
    "nycsr_admininterventiontype@OData.Community.Display.V1.FormattedValue": "Classroom Closed",
    "nycsr_admininterventiontype": 882450000,
    "nycsr_caseid": "24745d28-c71f-ec11-b6e6-001dd83068fb",
    "nycsr_interventionenddate@OData.Community.Display.V1.FormattedValue": "10/3/2021",
    "nycsr_interventionenddate": "2021-10-03T04:00:00Z",
    "nycsr_casenumber": "053164",
    "nycsr_interventionstartdate@OData.Community.Display.V1.FormattedValue": "9/29/2021",
    "nycsr_interventionstartdate": "2021-09-29T04:00:00Z",
    "nycsr_building.nycsr_address": "140 Harvest Avenue",
    "nycsr_building.nycsr_latitude@OData.Community.Display.V1.FormattedValue": "40,627,336.000000",
    "nycsr_building.nycsr_latitude": 40627336,
    "nycsr_building.nycsr_buildingid": "ee4e3585-4afb-ea11-b883-24ee9a37d459",
    "nycsr_building.nycsr_longitude@OData.Community.Display.V1.FormattedValue": "-74,109,969.000000",
    "nycsr_building.nycsr_longitude": -74109969,
    "nycsr_building.nycsr_geographicaldistrictcode": "31",
    "nycsr_building.nycsr_buildingname": "Hugs & Kiddies Early Learning Center",
    "nycsr_locationsite.nycsr_sitename": "Hugs and Kiddies of Staten Island NY LLC - RAIJ - RAIJ -  - 140 Harvest Avenue"
  },
  {
    "@odata.etag": "W/\"327198972\"",
    "nycsr_admininterventiontype@OData.Community.Display.V1.FormattedValue": "Partial Classroom Quarantine",
    "nycsr_admininterventiontype": 882450001,
    "nycsr_caseid": "f23227ec-d11f-ec11-b6e6-001dd83068fb",
    "nycsr_interventionenddate@OData.Community.Display.V1.FormattedValue": "10/4/2021",
    "nycsr_interventionenddate": "2021-10-04T04:00:00Z",
    "nycsr_casenumber": "053191",
    "nycsr_interventionstartdate@OData.Community.Display.V1.FormattedValue": "9/29/2021",
    "nycsr_interventionstartdate": "2021-09-29T04:00:00Z",
    "nycsr_building.nycsr_address": "419 WAVERLY AVENUE",
    "nycsr_building.nycsr_latitude@OData.Community.Display.V1.FormattedValue": "40,685,896.000000",
    "nycsr_building.nycsr_latitude": 40685896,
    "nycsr_building.nycsr_buildingid": "e0f57030-30f4-ea11-b882-24ee9a37d45c",
    "nycsr_building.nycsr_borough@OData.Community.Display.V1.FormattedValue": "Brooklyn",
    "nycsr_building.nycsr_borough": 882450002,
    "nycsr_building.nycsr_longitude@OData.Community.Display.V1.FormattedValue": "-73,965,890.000000",
    "nycsr_building.nycsr_longitude": -73965890,
    "nycsr_building.nycsr_geographicaldistrictcode": "13",
    "nycsr_building.nycsr_buildingname": "P.S. 11 - BROOKLYN",
    "nycsr_locationsite.nycsr_sitename": "P.S. 011 Purvis J. Behan - K011 - K011 - 13K011 - 419 WAVERLY AVENUE"
  },
  {
    "@odata.etag": "W/\"326055187\"",
    "nycsr_admininterventiontype@OData.Community.Display.V1.FormattedValue": "Classroom Closed",
    "nycsr_admininterventiontype": 882450000,
    "nycsr_caseid": "7f5a95bd-d21f-ec11-b6e6-001dd83068fb",
    "nycsr_interventionenddate@OData.Community.Display.V1.FormattedValue": "10/3/2021",
    "nycsr_interventionenddate": "2021-10-03T04:00:00Z",
    "nycsr_casenumber": "053192",
    "nycsr_interventionstartdate@OData.Community.Display.V1.FormattedValue": "9/28/2021",
    "nycsr_interventionstartdate": "2021-09-28T04:00:00Z",
    "nycsr_building.nycsr_address": "419 WAVERLY AVENUE",
    "nycsr_building.nycsr_latitude@OData.Community.Display.V1.FormattedValue": "40,685,896.000000",
    "nycsr_building.nycsr_latitude": 40685896,
    "nycsr_building.nycsr_buildingid": "e0f57030-30f4-ea11-b882-24ee9a37d45c",
    "nycsr_building.nycsr_borough@OData.Community.Display.V1.FormattedValue": "Brooklyn",
    "nycsr_building.nycsr_borough": 882450002,
    "nycsr_building.nycsr_longitude@OData.Community.Display.V1.FormattedValue": "-73,965,890.000000",
    "nycsr_building.nycsr_longitude": -73965890,
    "nycsr_building.nycsr_geographicaldistrictcode": "13",
    "nycsr_building.nycsr_buildingname": "P.S. 11 - BROOKLYN",
    "nycsr_locationsite.nycsr_sitename": "P.S. 011 Purvis J. Behan - K011 - K011 - 13K011 - 419 WAVERLY AVENUE"
  },
  {
    "@odata.etag": "W/\"327199038\"",
    "nycsr_admininterventiontype@OData.Community.Display.V1.FormattedValue": "Partial Classroom Quarantine",
    "nycsr_admininterventiontype": 882450001,
    "nycsr_caseid": "b0f2c83f-5220-ec11-b6e6-001dd83068fb",
    "nycsr_interventionenddate@OData.Community.Display.V1.FormattedValue": "10/4/2021",
    "nycsr_interventionenddate": "2021-10-04T04:00:00Z",
    "nycsr_casenumber": "053212",
    "nycsr_interventionstartdate@OData.Community.Display.V1.FormattedValue": "9/29/2021",
    "nycsr_interventionstartdate": "2021-09-29T04:00:00Z",
    "nycsr_building.nycsr_address": "125 STUYVESANT AVENUE",
    "nycsr_building.nycsr_latitude@OData.Community.Display.V1.FormattedValue": "40,691,467.000000",
    "nycsr_building.nycsr_latitude": 40691467,
    "nycsr_building.nycsr_buildingid": "ae79df48-30f4-ea11-b882-24ee9a37d45c",
    "nycsr_building.nycsr_borough@OData.Community.Display.V1.FormattedValue": "Brooklyn",
    "nycsr_building.nycsr_borough": 882450002,
    "nycsr_building.nycsr_longitude@OData.Community.Display.V1.FormattedValue": "-73,932,254.000000",
    "nycsr_building.nycsr_longitude": -73932254,
    "nycsr_building.nycsr_geographicaldistrictcode": "16",
    "nycsr_building.nycsr_buildingname": "J.H.S. 57 - BROOKLYN",
    "nycsr_locationsite.nycsr_sitename": "Brooklyn Emerging Leaders Academy Charter School - K892 - K057 - 84K892 - 125 STUYVESANT AVENUE"
  },
  {
    "@odata.etag": "W/\"327199063\"",
    "nycsr_admininterventiontype@OData.Community.Display.V1.FormattedValue": "Partial Classroom Quarantine",
    "nycsr_admininterventiontype": 882450001,
    "nycsr_caseid": "4a531286-5520-ec11-b6e6-001dd83068fb",
    "nycsr_interventionenddate@OData.Community.Display.V1.FormattedValue": "10/4/2021",
    "nycsr_interventionenddate": "2021-10-04T04:00:00Z",
    "nycsr_casenumber": "053222",
    "nycsr_interventionstartdate@OData.Community.Display.V1.FormattedValue": "9/29/2021",
    "nycsr_interventionstartdate": "2021-09-29T04:00:00Z",
    "nycsr_building.nycsr_address": "198 Forsyth Street",
    "nycsr_building.nycsr_latitude@OData.Community.Display.V1.FormattedValue": "40,722,415.000000",
    "nycsr_building.nycsr_latitude": 40722415,
    "nycsr_building.nycsr_buildingid": "d737fba4-31f4-ea11-b882-24ee9a37d45c",
    "nycsr_building.nycsr_borough@OData.Community.Display.V1.FormattedValue": "Manhattan",
    "nycsr_building.nycsr_borough": 882450000,
    "nycsr_building.nycsr_longitude@OData.Community.Display.V1.FormattedValue": "-73,990,468.000000",
    "nycsr_building.nycsr_longitude": -73990468,
    "nycsr_building.nycsr_geographicaldistrictcode": "1",
    "nycsr_building.nycsr_buildingname": "FORSYTH HS (AUXSVC-OLD 91) - M",
    "nycsr_locationsite.nycsr_sitename": "Cascades High School - M650 - M510 - 01M650 - 198 Forsyth Street"
  },
  {
    "@odata.etag": "W/\"328753515\"",
    "nycsr_admininterventiontype@OData.Community.Display.V1.FormattedValue": "Partial Classroom Quarantine",
    "nycsr_admininterventiontype": 882450001,
    "nycsr_caseid": "49800b4e-5720-ec11-b6e6-001dd83068fb",
    "nycsr_interventionenddate@OData.Community.Display.V1.FormattedValue": "10/4/2021",
    "nycsr_interventionenddate": "2021-10-04T04:00:00Z",
    "nycsr_casenumber": "053227",
    "nycsr_interventionstartdate@OData.Community.Display.V1.FormattedValue": "9/29/2021",
    "nycsr_interventionstartdate": "2021-09-29T04:00:00Z",
    "nycsr_building.nycsr_address": "1680 LEXINGTON AVENUE",
    "nycsr_building.nycsr_latitude@OData.Community.Display.V1.FormattedValue": "40,791,966.000000",
    "nycsr_building.nycsr_latitude": 40791966,
    "nycsr_building.nycsr_buildingid": "61e61462-31f4-ea11-b882-24ee9a37d45c",
    "nycsr_building.nycsr_borough@OData.Community.Display.V1.FormattedValue": "Manhattan",
    "nycsr_building.nycsr_borough": 882450000,
    "nycsr_building.nycsr_longitude@OData.Community.Display.V1.FormattedValue": "-73,946,879.000000",
    "nycsr_building.nycsr_longitude": -73946879,
    "nycsr_building.nycsr_geographicaldistrictcode": "4",
    "nycsr_building.nycsr_buildingname": "THE HERITAGE SCHOOL - MANHATTAN",
    "nycsr_locationsite.nycsr_sitename": "Heritage School, The - M680 - M107 - 04M680 - 1680 LEXINGTON AVENUE"
  },
  {
    "@odata.etag": "W/\"327675196\"",
    "nycsr_admininterventiontype@OData.Community.Display.V1.FormattedValue": "Partial Classroom Quarantine",
    "nycsr_admininterventiontype": 882450001,
    "nycsr_caseid": "05d70d6f-5920-ec11-b6e6-001dd83068fb",
    "nycsr_interventionenddate@OData.Community.Display.V1.FormattedValue": "10/7/2021",
    "nycsr_interventionenddate": "2021-10-07T04:00:00Z",
    "nycsr_casenumber": "053236",
    "nycsr_interventionstartdate@OData.Community.Display.V1.FormattedValue": "9/29/2021",
    "nycsr_interventionstartdate": "2021-09-29T04:00:00Z",
    "nycsr_building.nycsr_address": "154-60 17 AVENUE",
    "nycsr_building.nycsr_latitude@OData.Community.Display.V1.FormattedValue": "40,783,231.000000",
    "nycsr_building.nycsr_latitude": 40783231,
    "nycsr_building.nycsr_buildingid": "8a977d2b-32f4-ea11-b882-24ee9a37d45c",
    "nycsr_building.nycsr_borough@OData.Community.Display.V1.FormattedValue": "Queens",
    "nycsr_building.nycsr_borough": 882450003,
    "nycsr_building.nycsr_longitude@OData.Community.Display.V1.FormattedValue": "-73,806,990.000000",
    "nycsr_building.nycsr_longitude": -73806990,
    "nycsr_building.nycsr_geographicaldistrictcode": "25",
    "nycsr_building.nycsr_buildingname": "J.H.S. 194 - QUEENS",
    "nycsr_locationsite.nycsr_sitename": "J.H.S. 194 William Carr - Q194 - Q194 - 25Q194 - 154-60 17 AVENUE"
  },
  {
    "@odata.etag": "W/\"327199124\"",
    "nycsr_admininterventiontype@OData.Community.Display.V1.FormattedValue": "Partial Classroom Quarantine",
    "nycsr_admininterventiontype": 882450001,
    "nycsr_caseid": "2eefddbd-5b20-ec11-b6e6-001dd83068fb",
    "nycsr_interventionenddate@OData.Community.Display.V1.FormattedValue": "10/2/2021",
    "nycsr_interventionenddate": "2021-10-02T04:00:00Z",
    "nycsr_casenumber": "053239",
    "nycsr_interventionstartdate@OData.Community.Display.V1.FormattedValue": "9/29/2021",
    "nycsr_interventionstartdate": "2021-09-29T04:00:00Z",
    "nycsr_building.nycsr_address": "91-37 222 STREET",
    "nycsr_building.nycsr_latitude@OData.Community.Display.V1.FormattedValue": "40,727,172.000000",
    "nycsr_building.nycsr_latitude": 40727172,
    "nycsr_building.nycsr_buildingid": "cd8442ee-31f4-ea11-b882-24ee9a37d45c",
    "nycsr_building.nycsr_borough@OData.Community.Display.V1.FormattedValue": "Queens",
    "nycsr_building.nycsr_borough": 882450003,
    "nycsr_building.nycsr_longitude@OData.Community.Display.V1.FormattedValue": "-73,734,102.000000",
    "nycsr_building.nycsr_longitude": -73734102,
    "nycsr_building.nycsr_geographicaldistrictcode": "29",
    "nycsr_building.nycsr_buildingname": "P.S. 33 - QUEENS",
    "nycsr_locationsite.nycsr_sitename": "P.S. 033 Edward M. Funk - Q033 - Q033 - 29Q033 - 91-37 222 STREET"
  },
  {
    "@odata.etag": "W/\"328768293\"",
    "nycsr_admininterventiontype@OData.Community.Display.V1.FormattedValue": "Classroom Closed",
    "nycsr_admininterventiontype": 882450000,
    "nycsr_caseid": "65019045-5f20-ec11-b6e6-001dd83068fb",
    "nycsr_interventionenddate@OData.Community.Display.V1.FormattedValue": "10/4/2021",
    "nycsr_interventionenddate": "2021-10-04T04:00:00Z",
    "nycsr_casenumber": "053262",
    "nycsr_interventionstartdate@OData.Community.Display.V1.FormattedValue": "9/29/2021",
    "nycsr_interventionstartdate": "2021-09-29T04:00:00Z",
    "nycsr_building.nycsr_address": "35-59 81ST STREET",
    "nycsr_building.nycsr_latitude@OData.Community.Display.V1.FormattedValue": "40,749,934.000000",
    "nycsr_building.nycsr_latitude": 40749934,
    "nycsr_building.nycsr_buildingid": "d511f898-32f4-ea11-b882-24ee9a37d45c",
    "nycsr_building.nycsr_borough@OData.Community.Display.V1.FormattedValue": "Queens",
    "nycsr_building.nycsr_borough": 882450003,
    "nycsr_building.nycsr_longitude@OData.Community.Display.V1.FormattedValue": "-73,884,817.000000",
    "nycsr_building.nycsr_longitude": -73884817,
    "nycsr_building.nycsr_geographicaldistrictcode": "30",
    "nycsr_building.nycsr_buildingname": "RENAISSANCE CHARTER SCHOOL - Q",
    "nycsr_locationsite.nycsr_sitename": "Renaissance Charter School - Q705 - Q885 - 84Q705 - 35-59 81ST STREET"
  },
  {
    "@odata.etag": "W/\"327199169\"",
    "nycsr_admininterventiontype@OData.Community.Display.V1.FormattedValue": "Classroom Closed",
    "nycsr_admininterventiontype": 882450000,
    "nycsr_caseid": "74aa46ad-5f20-ec11-b6e6-001dd83068fb",
    "nycsr_interventionenddate@OData.Community.Display.V1.FormattedValue": "10/7/2021",
    "nycsr_interventionenddate": "2021-10-07T04:00:00Z",
    "nycsr_casenumber": "053266",
    "nycsr_interventionstartdate@OData.Community.Display.V1.FormattedValue": "9/29/2021",
    "nycsr_interventionstartdate": "2021-09-29T04:00:00Z",
    "nycsr_building.nycsr_address": "104-12 SPRINGFIELD BLVD",
    "nycsr_building.nycsr_latitude@OData.Community.Display.V1.FormattedValue": "40,710,986.000000",
    "nycsr_building.nycsr_latitude": 40710986,
    "nycsr_building.nycsr_buildingid": "1bbef08c-32f4-ea11-b882-24ee9a37d45c",
    "nycsr_building.nycsr_borough@OData.Community.Display.V1.FormattedValue": "Queens",
    "nycsr_building.nycsr_borough": 882450003,
    "nycsr_building.nycsr_longitude@OData.Community.Display.V1.FormattedValue": "-73,737,702.000000",
    "nycsr_building.nycsr_longitude": -73737702,
    "nycsr_building.nycsr_geographicaldistrictcode": "29",
    "nycsr_building.nycsr_buildingname": "P.S. 34 MINISCHOOL - QUEENS",
    "nycsr_locationsite.nycsr_sitename": "P.S. 034 John Harvard - Q034 - Q834 - 29Q034 - 104-12 SPRINGFIELD BLVD"
  },
  {
    "@odata.etag": "W/\"327199179\"",
    "nycsr_admininterventiontype@OData.Community.Display.V1.FormattedValue": "Partial Classroom Quarantine",
    "nycsr_admininterventiontype": 882450001,
    "nycsr_caseid": "1160e007-6020-ec11-b6e6-001dd83068fb",
    "nycsr_interventionenddate@OData.Community.Display.V1.FormattedValue": "10/4/2021",
    "nycsr_interventionenddate": "2021-10-04T04:00:00Z",
    "nycsr_casenumber": "053271",
    "nycsr_interventionstartdate@OData.Community.Display.V1.FormattedValue": "9/29/2021",
    "nycsr_interventionstartdate": "2021-09-29T04:00:00Z",
    "nycsr_building.nycsr_address": "50-51 98TH STREET",
    "nycsr_building.nycsr_latitude@OData.Community.Display.V1.FormattedValue": "40,741,139.000000",
    "nycsr_building.nycsr_latitude": 40741139,
    "nycsr_building.nycsr_buildingid": "30c73b4a-32f4-ea11-b882-24ee9a37d45c",
    "nycsr_building.nycsr_borough@OData.Community.Display.V1.FormattedValue": "Queens",
    "nycsr_building.nycsr_borough": 882450003,
    "nycsr_building.nycsr_longitude@OData.Community.Display.V1.FormattedValue": "-73,863,408.000000",
    "nycsr_building.nycsr_longitude": -73863408,
    "nycsr_building.nycsr_geographicaldistrictcode": "24",
    "nycsr_building.nycsr_buildingname": "P.S./ I.S. 298 - QUEENS",
    "nycsr_locationsite.nycsr_sitename": "Elm Tree Elementary School - Q211 - Q298 - 24Q211 - 50-51 98TH STREET"
  },
  {
    "@odata.etag": "W/\"327678557\"",
    "nycsr_admininterventiontype@OData.Community.Display.V1.FormattedValue": "Partial Classroom Quarantine",
    "nycsr_admininterventiontype": 882450001,
    "nycsr_caseid": "42115a44-6720-ec11-b6e6-001dd83068fb",
    "nycsr_interventionenddate@OData.Community.Display.V1.FormattedValue": "10/4/2021",
    "nycsr_interventionenddate": "2021-10-04T04:00:00Z",
    "nycsr_casenumber": "053321",
    "nycsr_interventionstartdate@OData.Community.Display.V1.FormattedValue": "9/29/2021",
    "nycsr_interventionstartdate": "2021-09-29T04:00:00Z",
    "nycsr_building.nycsr_address": "55-20 METROPOLITAN AVENUE",
    "nycsr_building.nycsr_latitude@OData.Community.Display.V1.FormattedValue": "40,713,030.000000",
    "nycsr_building.nycsr_latitude": 40713030,
    "nycsr_building.nycsr_buildingid": "24c73b4a-32f4-ea11-b882-24ee9a37d45c",
    "nycsr_building.nycsr_borough@OData.Community.Display.V1.FormattedValue": "Queens",
    "nycsr_building.nycsr_borough": 882450003,
    "nycsr_building.nycsr_longitude@OData.Community.Display.V1.FormattedValue": "-73,908,307.000000",
    "nycsr_building.nycsr_longitude": -73908307,
    "nycsr_building.nycsr_geographicaldistrictcode": "24",
    "nycsr_building.nycsr_buildingname": "THE GERALDINE FERRARO CAMPUS - QUEENS",
    "nycsr_locationsite.nycsr_sitename": "A.C.E. Academy for Scholars at the Geraldine Ferraro Campus - Q290 - Q290 - 24Q290 - 55-20 METROPOLITAN AVENUE"
  },
  {
    "@odata.etag": "W/\"327463482\"",
    "nycsr_admininterventiontype@OData.Community.Display.V1.FormattedValue": "Partial Classroom Quarantine",
    "nycsr_admininterventiontype": 882450001,
    "nycsr_caseid": "0aeb3af6-6920-ec11-b6e6-001dd83068fb",
    "nycsr_interventionenddate@OData.Community.Display.V1.FormattedValue": "10/4/2021",
    "nycsr_interventionenddate": "2021-10-04T04:00:00Z",
    "nycsr_casenumber": "053339",
    "nycsr_interventionstartdate@OData.Community.Display.V1.FormattedValue": "9/29/2021",
    "nycsr_interventionstartdate": "2021-09-29T04:00:00Z",
    "nycsr_building.nycsr_address": "3540 Bivona Street",
    "nycsr_building.nycsr_latitude@OData.Community.Display.V1.FormattedValue": "40,882,980.000000",
    "nycsr_building.nycsr_latitude": 40882980,
    "nycsr_building.nycsr_buildingid": "aaeb0e7b-33f4-ea11-b882-24ee9a37d45c",
    "nycsr_building.nycsr_borough@OData.Community.Display.V1.FormattedValue": "Bronx",
    "nycsr_building.nycsr_borough": 882450001,
    "nycsr_building.nycsr_longitude@OData.Community.Display.V1.FormattedValue": "-73,831,856.000000",
    "nycsr_building.nycsr_longitude": -73831856,
    "nycsr_building.nycsr_geographicaldistrictcode": "11",
    "nycsr_building.nycsr_buildingname": "P.S. 723 - BRONX",
    "nycsr_locationsite.nycsr_sitename": "P.S. 723 - X723 - X701 - 75X723 - 3540 Bivona Street"
  },
  {
    "@odata.etag": "W/\"327199280\"",
    "nycsr_admininterventiontype@OData.Community.Display.V1.FormattedValue": "Partial Classroom Quarantine",
    "nycsr_admininterventiontype": 882450001,
    "nycsr_caseid": "107c7b47-6c20-ec11-b6e6-001dd83068fb",
    "nycsr_interventionenddate@OData.Community.Display.V1.FormattedValue": "10/4/2021",
    "nycsr_interventionenddate": "2021-10-04T04:00:00Z",
    "nycsr_casenumber": "053360",
    "nycsr_interventionstartdate@OData.Community.Display.V1.FormattedValue": "9/29/2021",
    "nycsr_interventionstartdate": "2021-09-29T04:00:00Z",
    "nycsr_building.nycsr_address": "66-56 FOREST AVENUE",
    "nycsr_building.nycsr_latitude@OData.Community.Display.V1.FormattedValue": "40,705,609.000000",
    "nycsr_building.nycsr_latitude": 40705609,
    "nycsr_building.nycsr_buildingid": "0f7eed06-32f4-ea11-b882-24ee9a37d45c",
    "nycsr_building.nycsr_borough@OData.Community.Display.V1.FormattedValue": "Queens",
    "nycsr_building.nycsr_borough": 882450003,
    "nycsr_building.nycsr_longitude@OData.Community.Display.V1.FormattedValue": "-73,903,057.000000",
    "nycsr_building.nycsr_longitude": -73903057,
    "nycsr_building.nycsr_geographicaldistrictcode": "24",
    "nycsr_building.nycsr_buildingname": "I.S. 93 - QUEENS",
    "nycsr_locationsite.nycsr_sitename": "I.S. 093 Ridgewood - Q093 - Q093 - 24Q093 - 66-56 FOREST AVENUE"
  },
  {
    "@odata.etag": "W/\"328091447\"",
    "nycsr_admininterventiontype@OData.Community.Display.V1.FormattedValue": "Non-Classroom Quarantine",
    "nycsr_admininterventiontype": 882450003,
    "nycsr_caseid": "bb10d11c-6f20-ec11-b6e6-001dd83068fb",
    "nycsr_interventionenddate@OData.Community.Display.V1.FormattedValue": "10/7/2021",
    "nycsr_interventionenddate": "2021-10-07T04:00:00Z",
    "nycsr_casenumber": "053386",
    "nycsr_interventionstartdate@OData.Community.Display.V1.FormattedValue": "9/30/2021",
    "nycsr_interventionstartdate": "2021-09-30T04:00:00Z",
    "nycsr_building.nycsr_address": "29-66 137 STREET",
    "nycsr_building.nycsr_latitude@OData.Community.Display.V1.FormattedValue": "40,769,752.000000",
    "nycsr_building.nycsr_latitude": 40769752,
    "nycsr_building.nycsr_buildingid": "2d06003e-32f4-ea11-b882-24ee9a37d45c",
    "nycsr_building.nycsr_borough@OData.Community.Display.V1.FormattedValue": "Queens",
    "nycsr_building.nycsr_borough": 882450003,
    "nycsr_building.nycsr_longitude@OData.Community.Display.V1.FormattedValue": "-73,832,005.000000",
    "nycsr_building.nycsr_longitude": -73832005,
    "nycsr_building.nycsr_geographicaldistrictcode": "25",
    "nycsr_building.nycsr_buildingname": "P.S. 242 - (ECC) - QUEENS",
    "nycsr_locationsite.nycsr_sitename": "P.S. 242 Leonard P. Stavisky Early Childhood School - Q242 - Q242 - 25Q242 - 29-66 137 STREET"
  },
  {
    "@odata.etag": "W/\"327199320\"",
    "nycsr_admininterventiontype@OData.Community.Display.V1.FormattedValue": "Partial Classroom Quarantine",
    "nycsr_admininterventiontype": 882450001,
    "nycsr_caseid": "76e29ae9-7020-ec11-b6e6-001dd83068fb",
    "nycsr_interventionenddate@OData.Community.Display.V1.FormattedValue": "10/3/2021",
    "nycsr_interventionenddate": "2021-10-03T04:00:00Z",
    "nycsr_casenumber": "053394",
    "nycsr_interventionstartdate@OData.Community.Display.V1.FormattedValue": "9/29/2021",
    "nycsr_interventionstartdate": "2021-09-29T04:00:00Z",
    "nycsr_building.nycsr_address": "132-15 218 STREET",
    "nycsr_building.nycsr_latitude@OData.Community.Display.V1.FormattedValue": "40,681,948.000000",
    "nycsr_building.nycsr_latitude": 40681948,
    "nycsr_building.nycsr_buildingid": "12af0313-32f4-ea11-b882-24ee9a37d45c",
    "nycsr_building.nycsr_borough@OData.Community.Display.V1.FormattedValue": "Queens",
    "nycsr_building.nycsr_borough": 882450003,
    "nycsr_building.nycsr_longitude@OData.Community.Display.V1.FormattedValue": "-73,749,300.000000",
    "nycsr_building.nycsr_longitude": -73749300,
    "nycsr_building.nycsr_geographicaldistrictcode": "29",
    "nycsr_building.nycsr_buildingname": "P.S. 132 - QUEENS",
    "nycsr_locationsite.nycsr_sitename": "P.S. 132 Ralph Bunche - Q132 - Q132 - 29Q132 - 132-15 218 STREET"
  },
  {
    "@odata.etag": "W/\"327199356\"",
    "nycsr_admininterventiontype@OData.Community.Display.V1.FormattedValue": "Classroom Closed",
    "nycsr_admininterventiontype": 882450000,
    "nycsr_caseid": "c08bb4d3-7420-ec11-b6e6-001dd83068fb",
    "nycsr_interventionenddate@OData.Community.Display.V1.FormattedValue": "10/4/2021",
    "nycsr_interventionenddate": "2021-10-04T04:00:00Z",
    "nycsr_casenumber": "053419",
    "nycsr_interventionstartdate@OData.Community.Display.V1.FormattedValue": "9/29/2021",
    "nycsr_interventionstartdate": "2021-09-29T04:00:00Z",
    "nycsr_building.nycsr_address": "45-50 195 STREET",
    "nycsr_building.nycsr_latitude@OData.Community.Display.V1.FormattedValue": "40,754,435.000000",
    "nycsr_building.nycsr_latitude": 40754435,
    "nycsr_building.nycsr_buildingid": "71ce9ac9-49fb-ea11-b883-24ee9a37d459",
    "nycsr_building.nycsr_longitude@OData.Community.Display.V1.FormattedValue": "-73,786,532.000000",
    "nycsr_building.nycsr_longitude": -73786532,
    "nycsr_building.nycsr_geographicaldistrictcode": "25",
    "nycsr_building.nycsr_buildingname": "SAINT KEVIN SCHOOL",
    "nycsr_locationsite.nycsr_sitename": "Saint Kevin Catholic Academy - QAFY - QAFY -  - 45-50 195 STREET"
  },
  {
    "@odata.etag": "W/\"328076226\"",
    "nycsr_admininterventiontype@OData.Community.Display.V1.FormattedValue": "Partial Classroom Quarantine",
    "nycsr_admininterventiontype": 882450001,
    "nycsr_caseid": "d673b7e3-7620-ec11-b6e6-001dd83068fb",
    "nycsr_interventionenddate@OData.Community.Display.V1.FormattedValue": "10/4/2021",
    "nycsr_interventionenddate": "2021-10-04T04:00:00Z",
    "nycsr_casenumber": "053431",
    "nycsr_interventionstartdate@OData.Community.Display.V1.FormattedValue": "9/29/2021",
    "nycsr_interventionstartdate": "2021-09-29T04:00:00Z",
    "nycsr_building.nycsr_address": "105 East 106th Street",
    "nycsr_building.nycsr_latitude@OData.Community.Display.V1.FormattedValue": "40,792,932.000000",
    "nycsr_building.nycsr_latitude": 40792932,
    "nycsr_building.nycsr_buildingid": "d4ed94c3-31f4-ea11-b882-24ee9a37d45c",
    "nycsr_building.nycsr_borough@OData.Community.Display.V1.FormattedValue": "Manhattan",
    "nycsr_building.nycsr_borough": 882450000,
    "nycsr_building.nycsr_longitude@OData.Community.Display.V1.FormattedValue": "-73,947,171.000000",
    "nycsr_building.nycsr_longitude": -73947171,
    "nycsr_building.nycsr_geographicaldistrictcode": "4",
    "nycsr_building.nycsr_buildingname": "YOUNG WOMEN'S LEADERSHIP HS - M",
    "nycsr_locationsite.nycsr_sitename": "Young Women's Leadership School - M610 - M895 - 04M610 - 105 East 106th Street"
  },
  {
    "@odata.etag": "W/\"327199391\"",
    "nycsr_admininterventiontype@OData.Community.Display.V1.FormattedValue": "Partial Classroom Quarantine",
    "nycsr_admininterventiontype": 882450001,
    "nycsr_caseid": "cd151239-7820-ec11-b6e6-001dd83068fb",
    "nycsr_interventionenddate@OData.Community.Display.V1.FormattedValue": "10/7/2021",
    "nycsr_interventionenddate": "2021-10-07T04:00:00Z",
    "nycsr_casenumber": "053442",
    "nycsr_interventionstartdate@OData.Community.Display.V1.FormattedValue": "9/29/2021",
    "nycsr_interventionstartdate": "2021-09-29T04:00:00Z",
    "nycsr_building.nycsr_address": "510 WAVERLY AVENUE",
    "nycsr_building.nycsr_latitude@OData.Community.Display.V1.FormattedValue": "40,682,422.000000",
    "nycsr_building.nycsr_latitude": 40682422,
    "nycsr_building.nycsr_buildingid": "8228a20c-31f4-ea11-b882-24ee9a37d45c",
    "nycsr_building.nycsr_borough@OData.Community.Display.V1.FormattedValue": "Brooklyn",
    "nycsr_building.nycsr_borough": 882450002,
    "nycsr_building.nycsr_longitude@OData.Community.Display.V1.FormattedValue": "-73,965,928.000000",
    "nycsr_building.nycsr_longitude": -73965928,
    "nycsr_building.nycsr_geographicaldistrictcode": "13",
    "nycsr_building.nycsr_buildingname": "ACHIEVEMENT FIRST ENDEAVOR CHARTER SCHOOL - K",
    "nycsr_locationsite.nycsr_sitename": "Achievement First Endeavor Charter School - K508 - K784 - 84K508 - 510 WAVERLY AVENUE"
  },
  {
    "@odata.etag": "W/\"327199396\"",
    "nycsr_admininterventiontype@OData.Community.Display.V1.FormattedValue": "Partial Classroom Quarantine",
    "nycsr_admininterventiontype": 882450001,
    "nycsr_caseid": "71cb2fb5-7920-ec11-b6e6-001dd83068fb",
    "nycsr_interventionenddate@OData.Community.Display.V1.FormattedValue": "10/4/2021",
    "nycsr_interventionenddate": "2021-10-04T04:00:00Z",
    "nycsr_casenumber": "053448",
    "nycsr_interventionstartdate@OData.Community.Display.V1.FormattedValue": "9/29/2021",
    "nycsr_interventionstartdate": "2021-09-29T04:00:00Z",
    "nycsr_building.nycsr_address": "510 WAVERLY AVENUE",
    "nycsr_building.nycsr_latitude@OData.Community.Display.V1.FormattedValue": "40,682,422.000000",
    "nycsr_building.nycsr_latitude": 40682422,
    "nycsr_building.nycsr_buildingid": "8228a20c-31f4-ea11-b882-24ee9a37d45c",
    "nycsr_building.nycsr_borough@OData.Community.Display.V1.FormattedValue": "Brooklyn",
    "nycsr_building.nycsr_borough": 882450002,
    "nycsr_building.nycsr_longitude@OData.Community.Display.V1.FormattedValue": "-73,965,928.000000",
    "nycsr_building.nycsr_longitude": -73965928,
    "nycsr_building.nycsr_geographicaldistrictcode": "13",
    "nycsr_building.nycsr_buildingname": "ACHIEVEMENT FIRST ENDEAVOR CHARTER SCHOOL - K",
    "nycsr_locationsite.nycsr_sitename": "Achievement First Endeavor Charter School - K508 - K784 - 84K508 - 510 WAVERLY AVENUE"
  },
  {
    "@odata.etag": "W/\"327199421\"",
    "nycsr_admininterventiontype@OData.Community.Display.V1.FormattedValue": "Partial Classroom Quarantine",
    "nycsr_admininterventiontype": 882450001,
    "nycsr_caseid": "a4984c7d-7b20-ec11-b6e6-001dd83068fb",
    "nycsr_interventionenddate@OData.Community.Display.V1.FormattedValue": "10/7/2021",
    "nycsr_interventionenddate": "2021-10-07T04:00:00Z",
    "nycsr_casenumber": "053460",
    "nycsr_interventionstartdate@OData.Community.Display.V1.FormattedValue": "9/29/2021",
    "nycsr_interventionstartdate": "2021-09-29T04:00:00Z",
    "nycsr_building.nycsr_address": "510 WAVERLY AVENUE",
    "nycsr_building.nycsr_latitude@OData.Community.Display.V1.FormattedValue": "40,682,422.000000",
    "nycsr_building.nycsr_latitude": 40682422,
    "nycsr_building.nycsr_buildingid": "8228a20c-31f4-ea11-b882-24ee9a37d45c",
    "nycsr_building.nycsr_borough@OData.Community.Display.V1.FormattedValue": "Brooklyn",
    "nycsr_building.nycsr_borough": 882450002,
    "nycsr_building.nycsr_longitude@OData.Community.Display.V1.FormattedValue": "-73,965,928.000000",
    "nycsr_building.nycsr_longitude": -73965928,
    "nycsr_building.nycsr_geographicaldistrictcode": "13",
    "nycsr_building.nycsr_buildingname": "ACHIEVEMENT FIRST ENDEAVOR CHARTER SCHOOL - K",
    "nycsr_locationsite.nycsr_sitename": "Achievement First Endeavor Charter School - K508 - K784 - 84K508 - 510 WAVERLY AVENUE"
  },
  {
    "@odata.etag": "W/\"328091493\"",
    "nycsr_admininterventiontype@OData.Community.Display.V1.FormattedValue": "Partial Classroom Quarantine",
    "nycsr_admininterventiontype": 882450001,
    "nycsr_caseid": "70ca835d-8820-ec11-b6e6-001dd83068fb",
    "nycsr_interventionenddate@OData.Community.Display.V1.FormattedValue": "10/3/2021",
    "nycsr_interventionenddate": "2021-10-03T04:00:00Z",
    "nycsr_casenumber": "053540",
    "nycsr_interventionstartdate@OData.Community.Display.V1.FormattedValue": "9/30/2021",
    "nycsr_interventionstartdate": "2021-09-30T04:00:00Z",
    "nycsr_building.nycsr_address": "1010 REV. J. A. POLITE AVENUE",
    "nycsr_building.nycsr_latitude@OData.Community.Display.V1.FormattedValue": "40,823,124.000000",
    "nycsr_building.nycsr_latitude": 40823124,
    "nycsr_building.nycsr_buildingid": "8ce03d56-33f4-ea11-b882-24ee9a37d45c",
    "nycsr_building.nycsr_borough@OData.Community.Display.V1.FormattedValue": "Bronx",
    "nycsr_building.nycsr_borough": 882450001,
    "nycsr_building.nycsr_longitude@OData.Community.Display.V1.FormattedValue": "-73,898,265.000000",
    "nycsr_building.nycsr_longitude": -73898265,
    "nycsr_building.nycsr_geographicaldistrictcode": "12",
    "nycsr_building.nycsr_buildingname": "BRONX REGIONAL HS (OLD 133) - X",
    "nycsr_locationsite.nycsr_sitename": "New Visions A.I.M. Charter High School II - X200 - X401 - 84X200 - 1010 REV. J. A. POLITE AVENUE"
  },
  {
    "@odata.etag": "W/\"327262343\"",
    "nycsr_admininterventiontype@OData.Community.Display.V1.FormattedValue": "Partial Classroom Quarantine",
    "nycsr_admininterventiontype": 882450001,
    "nycsr_caseid": "3380b969-8820-ec11-b6e6-001dd83068fb",
    "nycsr_interventionenddate@OData.Community.Display.V1.FormattedValue": "10/7/2021",
    "nycsr_interventionenddate": "2021-10-07T04:00:00Z",
    "nycsr_casenumber": "053541",
    "nycsr_interventionstartdate@OData.Community.Display.V1.FormattedValue": "9/29/2021",
    "nycsr_interventionstartdate": "2021-09-29T04:00:00Z",
    "nycsr_building.nycsr_address": "1601 80 STREET",
    "nycsr_building.nycsr_latitude@OData.Community.Display.V1.FormattedValue": "40,613,041.000000",
    "nycsr_building.nycsr_latitude": 40613041,
    "nycsr_building.nycsr_buildingid": "5488e6db-30f4-ea11-b882-24ee9a37d45c",
    "nycsr_building.nycsr_borough@OData.Community.Display.V1.FormattedValue": "Brooklyn",
    "nycsr_building.nycsr_borough": 882450002,
    "nycsr_building.nycsr_longitude@OData.Community.Display.V1.FormattedValue": "-74,002,308.000000",
    "nycsr_building.nycsr_longitude": -74002308,
    "nycsr_building.nycsr_geographicaldistrictcode": "20",
    "nycsr_building.nycsr_buildingname": "NEW UTRECHT HS - K",
    "nycsr_locationsite.nycsr_sitename": "New Utrecht High School - K445 - K445 - 20K445 - 1601 80 STREET"
  },
  {
    "@odata.etag": "W/\"327686614\"",
    "nycsr_admininterventiontype@OData.Community.Display.V1.FormattedValue": "Partial Classroom Quarantine",
    "nycsr_admininterventiontype": 882450001,
    "nycsr_caseid": "f43e6f9e-8920-ec11-b6e6-001dd83068fb",
    "nycsr_interventionenddate@OData.Community.Display.V1.FormattedValue": "10/8/2021",
    "nycsr_interventionenddate": "2021-10-08T04:00:00Z",
    "nycsr_casenumber": "053549",
    "nycsr_interventionstartdate@OData.Community.Display.V1.FormattedValue": "9/29/2021",
    "nycsr_interventionstartdate": "2021-09-29T04:00:00Z",
    "nycsr_building.nycsr_address": "58 LAWRENCE AVENUE",
    "nycsr_building.nycsr_latitude@OData.Community.Display.V1.FormattedValue": "40,628,419.000000",
    "nycsr_building.nycsr_latitude": 40628419,
    "nycsr_building.nycsr_buildingid": "1f0410ca-32f4-ea11-b882-24ee9a37d45c",
    "nycsr_building.nycsr_borough@OData.Community.Display.V1.FormattedValue": "Staten Island",
    "nycsr_building.nycsr_borough": 882450004,
    "nycsr_building.nycsr_longitude@OData.Community.Display.V1.FormattedValue": "-74,107,537.000000",
    "nycsr_building.nycsr_longitude": -74107537,
    "nycsr_building.nycsr_geographicaldistrictcode": "31",
    "nycsr_building.nycsr_buildingname": "P.S. 45 - STATEN ISLAND",
    "nycsr_locationsite.nycsr_sitename": "P.S. 045 John Tyler - R045 - R045 - 31R045 - 58 LAWRENCE AVENUE"
  },
  {
    "@odata.etag": "W/\"327199582\"",
    "nycsr_admininterventiontype@OData.Community.Display.V1.FormattedValue": "Partial Classroom Quarantine",
    "nycsr_admininterventiontype": 882450001,
    "nycsr_caseid": "bb86ec18-8a20-ec11-b6e6-001dd83068fb",
    "nycsr_interventionenddate@OData.Community.Display.V1.FormattedValue": "10/4/2021",
    "nycsr_interventionenddate": "2021-10-04T04:00:00Z",
    "nycsr_casenumber": "053556",
    "nycsr_interventionstartdate@OData.Community.Display.V1.FormattedValue": "9/29/2021",
    "nycsr_interventionstartdate": "2021-09-29T04:00:00Z",
    "nycsr_building.nycsr_address": "1700 3 AVENUE",
    "nycsr_building.nycsr_latitude@OData.Community.Display.V1.FormattedValue": "40,785,018.000000",
    "nycsr_building.nycsr_latitude": 40785018,
    "nycsr_building.nycsr_buildingid": "7f8d8486-31f4-ea11-b882-24ee9a37d45c",
    "nycsr_building.nycsr_borough@OData.Community.Display.V1.FormattedValue": "Manhattan",
    "nycsr_building.nycsr_borough": 882450000,
    "nycsr_building.nycsr_longitude@OData.Community.Display.V1.FormattedValue": "-73,950,420.000000",
    "nycsr_building.nycsr_longitude": -73950420,
    "nycsr_building.nycsr_geographicaldistrictcode": "2",
    "nycsr_building.nycsr_buildingname": "P.S. 198 - MANHATTAN",
    "nycsr_locationsite.nycsr_sitename": "P.S. 198 Isador E. Ida Straus - M198 - M198 - 02M198 - 1700 3 AVENUE"
  },
  {
    "@odata.etag": "W/\"327252743\"",
    "nycsr_admininterventiontype@OData.Community.Display.V1.FormattedValue": "Partial Classroom Quarantine",
    "nycsr_admininterventiontype": 882450001,
    "nycsr_caseid": "d172cb02-8d20-ec11-b6e6-001dd83068fb",
    "nycsr_interventionenddate@OData.Community.Display.V1.FormattedValue": "10/7/2021",
    "nycsr_interventionenddate": "2021-10-07T04:00:00Z",
    "nycsr_casenumber": "053568",
    "nycsr_interventionstartdate@OData.Community.Display.V1.FormattedValue": "9/29/2021",
    "nycsr_interventionstartdate": "2021-09-29T04:00:00Z",
    "nycsr_building.nycsr_address": "100 WEST MOSHOLU PARKWAY SOUTH",
    "nycsr_building.nycsr_latitude@OData.Community.Display.V1.FormattedValue": "40,879,958.000000",
    "nycsr_building.nycsr_latitude": 40879958,
    "nycsr_building.nycsr_buildingid": "4cffcc6e-33f4-ea11-b882-24ee9a37d45c",
    "nycsr_building.nycsr_borough@OData.Community.Display.V1.FormattedValue": "Bronx",
    "nycsr_building.nycsr_borough": 882450001,
    "nycsr_building.nycsr_longitude@OData.Community.Display.V1.FormattedValue": "-73,889,011.000000",
    "nycsr_building.nycsr_longitude": -73889011,
    "nycsr_building.nycsr_geographicaldistrictcode": "10",
    "nycsr_building.nycsr_buildingname": "DEWITT CLINTON HS - X",
    "nycsr_locationsite.nycsr_sitename": "World View High School - X353 - X440 - 10X353 - 100 WEST MOSHOLU PARKWAY SOUTH"
  },
  {
    "@odata.etag": "W/\"327686988\"",
    "nycsr_admininterventiontype@OData.Community.Display.V1.FormattedValue": "Partial Classroom Quarantine",
    "nycsr_admininterventiontype": 882450001,
    "nycsr_caseid": "4482feaf-9020-ec11-b6e6-001dd83068fb",
    "nycsr_interventionenddate@OData.Community.Display.V1.FormattedValue": "10/7/2021",
    "nycsr_interventionenddate": "2021-10-07T04:00:00Z",
    "nycsr_casenumber": "053586",
    "nycsr_interventionstartdate@OData.Community.Display.V1.FormattedValue": "9/29/2021",
    "nycsr_interventionstartdate": "2021-09-29T04:00:00Z",
    "nycsr_building.nycsr_address": "170 GATES AVENUE",
    "nycsr_building.nycsr_latitude@OData.Community.Display.V1.FormattedValue": "40,684,286.000000",
    "nycsr_building.nycsr_latitude": 40684286,
    "nycsr_building.nycsr_buildingid": "39eabc42-30f4-ea11-b882-24ee9a37d45c",
    "nycsr_building.nycsr_borough@OData.Community.Display.V1.FormattedValue": "Brooklyn",
    "nycsr_building.nycsr_borough": 882450002,
    "nycsr_building.nycsr_longitude@OData.Community.Display.V1.FormattedValue": "-73,960,536.000000",
    "nycsr_building.nycsr_longitude": -73960536,
    "nycsr_building.nycsr_geographicaldistrictcode": "13",
    "nycsr_building.nycsr_buildingname": "P.S. 56 - BROOKLYN",
    "nycsr_locationsite.nycsr_sitename": "The Urban Assembly Unison School - K351 - K056 - 13K351 - 170 GATES AVENUE"
  },
  {
    "@odata.etag": "W/\"328091503\"",
    "nycsr_admininterventiontype@OData.Community.Display.V1.FormattedValue": "Partial Classroom Quarantine",
    "nycsr_admininterventiontype": 882450001,
    "nycsr_caseid": "28c70583-9220-ec11-b6e6-001dd83068fb",
    "nycsr_interventionenddate@OData.Community.Display.V1.FormattedValue": "10/7/2021",
    "nycsr_interventionenddate": "2021-10-07T04:00:00Z",
    "nycsr_casenumber": "053594",
    "nycsr_interventionstartdate@OData.Community.Display.V1.FormattedValue": "9/30/2021",
    "nycsr_interventionstartdate": "2021-09-30T04:00:00Z",
    "nycsr_building.nycsr_address": "51-60 MARATHON PARKWAY",
    "nycsr_building.nycsr_latitude@OData.Community.Display.V1.FormattedValue": "40,762,241.000000",
    "nycsr_building.nycsr_latitude": 40762241,
    "nycsr_building.nycsr_buildingid": "732f77fa-31f4-ea11-b882-24ee9a37d45c",
    "nycsr_building.nycsr_borough@OData.Community.Display.V1.FormattedValue": "Queens",
    "nycsr_building.nycsr_borough": 882450003,
    "nycsr_building.nycsr_longitude@OData.Community.Display.V1.FormattedValue": "-73,734,832.000000",
    "nycsr_building.nycsr_longitude": -73734832,
    "nycsr_building.nycsr_geographicaldistrictcode": "26",
    "nycsr_building.nycsr_buildingname": "J.H.S. 67 - QUEENS",
    "nycsr_locationsite.nycsr_sitename": "J.H.S. 067 Louis Pasteur - Q067 - Q067 - 26Q067 - 51-60 MARATHON PARKWAY"
  },
  {
    "@odata.etag": "W/\"328091548\"",
    "nycsr_admininterventiontype@OData.Community.Display.V1.FormattedValue": "Classroom Closed",
    "nycsr_admininterventiontype": 882450000,
    "nycsr_caseid": "cf843a07-1721-ec11-b6e6-001dd83068fb",
    "nycsr_interventionenddate@OData.Community.Display.V1.FormattedValue": "10/8/2021",
    "nycsr_interventionenddate": "2021-10-08T04:00:00Z",
    "nycsr_casenumber": "053617",
    "nycsr_interventionstartdate@OData.Community.Display.V1.FormattedValue": "9/30/2021",
    "nycsr_interventionstartdate": "2021-09-30T04:00:00Z",
    "nycsr_building.nycsr_address": "545 WILLOUGHBY AVENUE",
    "nycsr_building.nycsr_latitude@OData.Community.Display.V1.FormattedValue": "40,694,470.000000",
    "nycsr_building.nycsr_latitude": 40694470,
    "nycsr_building.nycsr_buildingid": "e5968d36-30f4-ea11-b882-24ee9a37d45c",
    "nycsr_building.nycsr_borough@OData.Community.Display.V1.FormattedValue": "Brooklyn",
    "nycsr_building.nycsr_borough": 882450002,
    "nycsr_building.nycsr_longitude@OData.Community.Display.V1.FormattedValue": "-73,947,256.000000",
    "nycsr_building.nycsr_longitude": -73947256,
    "nycsr_building.nycsr_geographicaldistrictcode": "14",
    "nycsr_building.nycsr_buildingname": "P.S. 23 - BROOKLYN",
    "nycsr_locationsite.nycsr_sitename": "P.S. 023 Carter G. Woodson - K023 - K023 - 14K023 - 545 WILLOUGHBY AVENUE"
  },
  {
    "@odata.etag": "W/\"328091563\"",
    "nycsr_admininterventiontype@OData.Community.Display.V1.FormattedValue": "Classroom Closed",
    "nycsr_admininterventiontype": 882450000,
    "nycsr_caseid": "0391a459-1821-ec11-b6e6-001dd83068fb",
    "nycsr_interventionenddate@OData.Community.Display.V1.FormattedValue": "10/2/2021",
    "nycsr_interventionenddate": "2021-10-02T04:00:00Z",
    "nycsr_casenumber": "053621",
    "nycsr_interventionstartdate@OData.Community.Display.V1.FormattedValue": "9/30/2021",
    "nycsr_interventionstartdate": "2021-09-30T04:00:00Z",
    "nycsr_building.nycsr_address": "2545 GUNTHER AVENUE",
    "nycsr_building.nycsr_latitude@OData.Community.Display.V1.FormattedValue": "40,863,842.000000",
    "nycsr_building.nycsr_latitude": 40863842,
    "nycsr_building.nycsr_buildingid": "b22aa42b-33f4-ea11-b882-24ee9a37d45c",
    "nycsr_building.nycsr_borough@OData.Community.Display.V1.FormattedValue": "Bronx",
    "nycsr_building.nycsr_borough": 882450001,
    "nycsr_building.nycsr_longitude@OData.Community.Display.V1.FormattedValue": "-73,836,525.000000",
    "nycsr_building.nycsr_longitude": -73836525,
    "nycsr_building.nycsr_geographicaldistrictcode": "11",
    "nycsr_building.nycsr_buildingname": "I.S. 144 - BRONX",
    "nycsr_locationsite.nycsr_sitename": "Bronx Charter School for Better Learning II - X484 - X144 - 84X484 - 2545 GUNTHER AVENUE"
  },
  {
    "@odata.etag": "W/\"328091604\"",
    "nycsr_admininterventiontype@OData.Community.Display.V1.FormattedValue": "Classroom Closed",
    "nycsr_admininterventiontype": 882450000,
    "nycsr_caseid": "a4617960-1a21-ec11-b6e6-001dd83068fb",
    "nycsr_interventionenddate@OData.Community.Display.V1.FormattedValue": "10/4/2021",
    "nycsr_interventionenddate": "2021-10-04T04:00:00Z",
    "nycsr_casenumber": "053633",
    "nycsr_interventionstartdate@OData.Community.Display.V1.FormattedValue": "9/30/2021",
    "nycsr_interventionstartdate": "2021-09-30T04:00:00Z",
    "nycsr_building.nycsr_address": "1595 BATHGATE AVENUE",
    "nycsr_building.nycsr_latitude@OData.Community.Display.V1.FormattedValue": "40,839,508.000000",
    "nycsr_building.nycsr_latitude": 40839508,
    "nycsr_building.nycsr_buildingid": "e177bb9f-33f4-ea11-b882-24ee9a37d45c",
    "nycsr_building.nycsr_borough@OData.Community.Display.V1.FormattedValue": "Bronx",
    "nycsr_building.nycsr_borough": 882450001,
    "nycsr_building.nycsr_longitude@OData.Community.Display.V1.FormattedValue": "-73,901,774.000000",
    "nycsr_building.nycsr_longitude": -73901774,
    "nycsr_building.nycsr_geographicaldistrictcode": "9",
    "nycsr_building.nycsr_buildingname": "BATHGATE HS - BRONX",
    "nycsr_locationsite.nycsr_sitename": "Urban Assembly School for Applied Math and Science, The - X241 - X970 - 09X241 - 1595 BATHGATE AVENUE"
  },
  {
    "@odata.etag": "W/\"328091609\"",
    "nycsr_admininterventiontype@OData.Community.Display.V1.FormattedValue": "Classroom Closed",
    "nycsr_admininterventiontype": 882450000,
    "nycsr_caseid": "21e1ca98-1a21-ec11-b6e6-001dd83068fb",
    "nycsr_interventionenddate@OData.Community.Display.V1.FormattedValue": "10/8/2021",
    "nycsr_interventionenddate": "2021-10-08T04:00:00Z",
    "nycsr_casenumber": "053634",
    "nycsr_interventionstartdate@OData.Community.Display.V1.FormattedValue": "9/30/2021",
    "nycsr_interventionstartdate": "2021-09-30T04:00:00Z",
    "nycsr_building.nycsr_address": "3829 AVENUE K",
    "nycsr_building.nycsr_latitude@OData.Community.Display.V1.FormattedValue": "40,626,038.000000",
    "nycsr_building.nycsr_latitude": 40626038,
    "nycsr_building.nycsr_buildingid": "b4315367-30f4-ea11-b882-24ee9a37d45c",
    "nycsr_building.nycsr_borough@OData.Community.Display.V1.FormattedValue": "Brooklyn",
    "nycsr_building.nycsr_borough": 882450002,
    "nycsr_building.nycsr_longitude@OData.Community.Display.V1.FormattedValue": "-73,938,733.000000",
    "nycsr_building.nycsr_longitude": -73938733,
    "nycsr_building.nycsr_geographicaldistrictcode": "22",
    "nycsr_building.nycsr_buildingname": "P.S. 119 - BROOKLYN",
    "nycsr_locationsite.nycsr_sitename": "P.S. 119 Amersfort - K119 - K119 - 22K119 - 3829 AVENUE K"
  },
  {
    "@odata.etag": "W/\"328651206\"",
    "nycsr_admininterventiontype@OData.Community.Display.V1.FormattedValue": "Classroom Closed",
    "nycsr_admininterventiontype": 882450000,
    "nycsr_caseid": "1f334b86-1f21-ec11-b6e6-001dd83068fb",
    "nycsr_interventionenddate@OData.Community.Display.V1.FormattedValue": "10/4/2021",
    "nycsr_interventionenddate": "2021-10-04T04:00:00Z",
    "nycsr_casenumber": "053654",
    "nycsr_interventionstartdate@OData.Community.Display.V1.FormattedValue": "10/1/2021",
    "nycsr_interventionstartdate": "2021-10-01T04:00:00Z",
    "nycsr_building.nycsr_address": "86-35 235 COURT",
    "nycsr_building.nycsr_latitude@OData.Community.Display.V1.FormattedValue": "40,731,853.000000",
    "nycsr_building.nycsr_latitude": 40731853,
    "nycsr_building.nycsr_buildingid": "16f32ce2-31f4-ea11-b882-24ee9a37d45c",
    "nycsr_building.nycsr_borough@OData.Community.Display.V1.FormattedValue": "Queens",
    "nycsr_building.nycsr_borough": 882450003,
    "nycsr_building.nycsr_longitude@OData.Community.Display.V1.FormattedValue": "-73,732,290.000000",
    "nycsr_building.nycsr_longitude": -73732290,
    "nycsr_building.nycsr_geographicaldistrictcode": "26",
    "nycsr_building.nycsr_buildingname": "P.S. 18 - QUEENS",
    "nycsr_locationsite.nycsr_sitename": "P.S. 018 Winchester - Q018 - Q018 - 26Q018 - 86-35 235 COURT"
  },
  {
    "@odata.etag": "W/\"328091690\"",
    "nycsr_admininterventiontype@OData.Community.Display.V1.FormattedValue": "Non-Classroom Quarantine",
    "nycsr_admininterventiontype": 882450003,
    "nycsr_caseid": "bc1d27f4-2021-ec11-b6e6-001dd83068fb",
    "nycsr_interventionenddate@OData.Community.Display.V1.FormattedValue": "10/4/2021",
    "nycsr_interventionenddate": "2021-10-04T04:00:00Z",
    "nycsr_casenumber": "053660",
    "nycsr_interventionstartdate@OData.Community.Display.V1.FormattedValue": "9/30/2021",
    "nycsr_interventionstartdate": "2021-09-30T04:00:00Z",
    "nycsr_building.nycsr_address": "112 SCHERMERHORN STREET",
    "nycsr_building.nycsr_latitude@OData.Community.Display.V1.FormattedValue": "40,690,007.000000",
    "nycsr_building.nycsr_latitude": 40690007,
    "nycsr_building.nycsr_buildingid": "f7fb3df4-30f4-ea11-b882-24ee9a37d45c",
    "nycsr_building.nycsr_borough@OData.Community.Display.V1.FormattedValue": "Brooklyn",
    "nycsr_building.nycsr_borough": 882450002,
    "nycsr_building.nycsr_longitude@OData.Community.Display.V1.FormattedValue": "-73,989,369.000000",
    "nycsr_building.nycsr_longitude": -73989369,
    "nycsr_building.nycsr_geographicaldistrictcode": "15",
    "nycsr_building.nycsr_buildingname": "PACIFIC ALT HS - K",
    "nycsr_locationsite.nycsr_sitename": "Brooklyn Frontiers High School - K423 - K520 - 15K423 - 112 SCHERMERHORN STREET"
  },
  {
    "@odata.etag": "W/\"328091700\"",
    "nycsr_admininterventiontype@OData.Community.Display.V1.FormattedValue": "Classroom Closed",
    "nycsr_admininterventiontype": 882450000,
    "nycsr_caseid": "10d4dc4b-2221-ec11-b6e6-001dd83068fb",
    "nycsr_interventionenddate@OData.Community.Display.V1.FormattedValue": "10/4/2021",
    "nycsr_interventionenddate": "2021-10-04T04:00:00Z",
    "nycsr_casenumber": "053663",
    "nycsr_interventionstartdate@OData.Community.Display.V1.FormattedValue": "9/30/2021",
    "nycsr_interventionstartdate": "2021-09-30T04:00:00Z",
    "nycsr_building.nycsr_address": "757 WORTMAN AVENUE",
    "nycsr_building.nycsr_latitude@OData.Community.Display.V1.FormattedValue": "40,664,143.000000",
    "nycsr_building.nycsr_latitude": 40664143,
    "nycsr_building.nycsr_buildingid": "e121d292-30f4-ea11-b882-24ee9a37d45c",
    "nycsr_building.nycsr_borough@OData.Community.Display.V1.FormattedValue": "Brooklyn",
    "nycsr_building.nycsr_borough": 882450002,
    "nycsr_building.nycsr_longitude@OData.Community.Display.V1.FormattedValue": "-73,866,542.000000",
    "nycsr_building.nycsr_longitude": -73866542,
    "nycsr_building.nycsr_geographicaldistrictcode": "19",
    "nycsr_building.nycsr_buildingname": "P.S. 224 - BROOKLYN",
    "nycsr_locationsite.nycsr_sitename": "P.S. 224 Hale A. Woodruff - K224 - K224 - 19K224 - 757 WORTMAN AVENUE"
  },
  {
    "@odata.etag": "W/\"328091740\"",
    "nycsr_admininterventiontype@OData.Community.Display.V1.FormattedValue": "Partial Classroom Quarantine",
    "nycsr_admininterventiontype": 882450001,
    "nycsr_caseid": "9b5e8675-2421-ec11-b6e6-001dd83068fb",
    "nycsr_interventionenddate@OData.Community.Display.V1.FormattedValue": "10/8/2021",
    "nycsr_interventionenddate": "2021-10-08T04:00:00Z",
    "nycsr_casenumber": "053676",
    "nycsr_interventionstartdate@OData.Community.Display.V1.FormattedValue": "9/30/2021",
    "nycsr_interventionstartdate": "2021-09-30T04:00:00Z",
    "nycsr_building.nycsr_address": "977 FOX STREET",
    "nycsr_building.nycsr_latitude@OData.Community.Display.V1.FormattedValue": "40,822,056.000000",
    "nycsr_building.nycsr_latitude": 40822056,
    "nycsr_building.nycsr_buildingid": "fd77931f-33f4-ea11-b882-24ee9a37d45c",
    "nycsr_building.nycsr_borough@OData.Community.Display.V1.FormattedValue": "Bronx",
    "nycsr_building.nycsr_borough": 882450001,
    "nycsr_building.nycsr_longitude@OData.Community.Display.V1.FormattedValue": "-73,894,368.000000",
    "nycsr_building.nycsr_longitude": -73894368,
    "nycsr_building.nycsr_geographicaldistrictcode": "12",
    "nycsr_building.nycsr_buildingname": "I.S. 216 - BRONX",
    "nycsr_locationsite.nycsr_sitename": "South Bronx Classical Charter School - X346 - X116 - 84X346 - 977 FOX STREET"
  },
  {
    "@odata.etag": "W/\"328232961\"",
    "nycsr_admininterventiontype@OData.Community.Display.V1.FormattedValue": "No Intervention",
    "nycsr_admininterventiontype": 882450002,
    "nycsr_caseid": "bba77e7b-2421-ec11-b6e6-001dd83068fb",
    "nycsr_interventionenddate@OData.Community.Display.V1.FormattedValue": "10/1/2021",
    "nycsr_interventionenddate": "2021-10-01T04:00:00Z",
    "nycsr_casenumber": "053677",
    "nycsr_interventionstartdate@OData.Community.Display.V1.FormattedValue": "9/30/2021",
    "nycsr_interventionstartdate": "2021-09-30T04:00:00Z",
    "nycsr_building.nycsr_address": "100 LUTEN AVENUE",
    "nycsr_building.nycsr_latitude@OData.Community.Display.V1.FormattedValue": "40,528,152.000000",
    "nycsr_building.nycsr_latitude": 40528152,
    "nycsr_building.nycsr_buildingid": "605b4cd6-32f4-ea11-b882-24ee9a37d45c",
    "nycsr_building.nycsr_borough@OData.Community.Display.V1.FormattedValue": "Staten Island",
    "nycsr_building.nycsr_borough": 882450004,
    "nycsr_building.nycsr_longitude@OData.Community.Display.V1.FormattedValue": "-74,193,431.000000",
    "nycsr_building.nycsr_longitude": -74193431,
    "nycsr_building.nycsr_geographicaldistrictcode": "31",
    "nycsr_building.nycsr_buildingname": "TOTTENVILLE HS - S. I.",
    "nycsr_locationsite.nycsr_sitename": "Tottenville High School - R455 - R455 - 31R455 - 100 LUTEN AVENUE"
  },
  {
    "@odata.etag": "W/\"328685486\"",
    "nycsr_admininterventiontype@OData.Community.Display.V1.FormattedValue": "Partial Classroom Quarantine",
    "nycsr_admininterventiontype": 882450001,
    "nycsr_caseid": "69047a03-2621-ec11-b6e6-001dd83068fb",
    "nycsr_interventionenddate@OData.Community.Display.V1.FormattedValue": "10/4/2021",
    "nycsr_interventionenddate": "2021-10-04T04:00:00Z",
    "nycsr_casenumber": "053690",
    "nycsr_interventionstartdate@OData.Community.Display.V1.FormattedValue": "9/30/2021",
    "nycsr_interventionstartdate": "2021-09-30T04:00:00Z",
    "nycsr_building.nycsr_address": "127 EAST  22 STREET",
    "nycsr_building.nycsr_latitude@OData.Community.Display.V1.FormattedValue": "40,739,121.000000",
    "nycsr_building.nycsr_latitude": 40739121,
    "nycsr_building.nycsr_buildingid": "680c1bb1-31f4-ea11-b882-24ee9a37d45c",
    "nycsr_building.nycsr_borough@OData.Community.Display.V1.FormattedValue": "Manhattan",
    "nycsr_building.nycsr_borough": 882450000,
    "nycsr_building.nycsr_longitude@OData.Community.Display.V1.FormattedValue": "-73,985,323.000000",
    "nycsr_building.nycsr_longitude": -73985323,
    "nycsr_building.nycsr_geographicaldistrictcode": "2",
    "nycsr_building.nycsr_buildingname": "SCHL OF THE FUTURE (OLD BACON) - M",
    "nycsr_locationsite.nycsr_sitename": "School of the Future High School - M413 - M660 - 02M413 - 127 EAST  22 STREET"
  },
  {
    "@odata.etag": "W/\"328407957\"",
    "nycsr_admininterventiontype@OData.Community.Display.V1.FormattedValue": "Partial Classroom Quarantine",
    "nycsr_admininterventiontype": 882450001,
    "nycsr_caseid": "83e2cae9-2721-ec11-b6e6-001dd83068fb",
    "nycsr_interventionenddate@OData.Community.Display.V1.FormattedValue": "10/4/2021",
    "nycsr_interventionenddate": "2021-10-04T04:00:00Z",
    "nycsr_casenumber": "053708",
    "nycsr_interventionstartdate@OData.Community.Display.V1.FormattedValue": "10/1/2021",
    "nycsr_interventionstartdate": "2021-10-01T04:00:00Z",
    "nycsr_building.nycsr_address": "916 EAGLE AVENUE",
    "nycsr_building.nycsr_latitude@OData.Community.Display.V1.FormattedValue": "40,823,318.000000",
    "nycsr_building.nycsr_latitude": 40823318,
    "nycsr_building.nycsr_buildingid": "9f2aa42b-33f4-ea11-b882-24ee9a37d45c",
    "nycsr_building.nycsr_borough@OData.Community.Display.V1.FormattedValue": "Bronx",
    "nycsr_building.nycsr_borough": 882450001,
    "nycsr_building.nycsr_longitude@OData.Community.Display.V1.FormattedValue": "-73,907,489.000000",
    "nycsr_building.nycsr_longitude": -73907489,
    "nycsr_building.nycsr_geographicaldistrictcode": "8",
    "nycsr_building.nycsr_buildingname": "P.S. 140 - BRONX",
    "nycsr_locationsite.nycsr_sitename": "P.S. X140 The Eagle School - X140 - X140 - 08X140 - 916 EAGLE AVENUE"
  },
  {
    "@odata.etag": "W/\"328091811\"",
    "nycsr_admininterventiontype@OData.Community.Display.V1.FormattedValue": "Partial Classroom Quarantine",
    "nycsr_admininterventiontype": 882450001,
    "nycsr_caseid": "3afd5f64-2821-ec11-b6e6-001dd83068fb",
    "nycsr_interventionenddate@OData.Community.Display.V1.FormattedValue": "10/4/2021",
    "nycsr_interventionenddate": "2021-10-04T04:00:00Z",
    "nycsr_casenumber": "053712",
    "nycsr_interventionstartdate@OData.Community.Display.V1.FormattedValue": "9/30/2021",
    "nycsr_interventionstartdate": "2021-09-30T04:00:00Z",
    "nycsr_building.nycsr_address": "800 VAN SICLEN AVE",
    "nycsr_building.nycsr_latitude@OData.Community.Display.V1.FormattedValue": "40,659,934.000000",
    "nycsr_building.nycsr_latitude": 40659934,
    "nycsr_building.nycsr_buildingid": "41ebaa73-30f4-ea11-b882-24ee9a37d45c",
    "nycsr_building.nycsr_borough@OData.Community.Display.V1.FormattedValue": "Brooklyn",
    "nycsr_building.nycsr_borough": 882450002,
    "nycsr_building.nycsr_longitude@OData.Community.Display.V1.FormattedValue": "-73,885,704.000000",
    "nycsr_building.nycsr_longitude": -73885704,
    "nycsr_building.nycsr_geographicaldistrictcode": "19",
    "nycsr_building.nycsr_buildingname": "I.S. 166 - BROOKLYN",
    "nycsr_locationsite.nycsr_sitename": "Achievement First Linden Charter School - K788 - K166 - 84K788 - 800 VAN SICLEN AVE"
  },
  {
    "@odata.etag": "W/\"328091821\"",
    "nycsr_admininterventiontype@OData.Community.Display.V1.FormattedValue": "Non-Classroom Quarantine",
    "nycsr_admininterventiontype": 882450003,
    "nycsr_caseid": "09b73fd9-2821-ec11-b6e6-001dd83068fb",
    "nycsr_interventionenddate@OData.Community.Display.V1.FormattedValue": "10/8/2021",
    "nycsr_interventionenddate": "2021-10-08T04:00:00Z",
    "nycsr_casenumber": "053718",
    "nycsr_interventionstartdate@OData.Community.Display.V1.FormattedValue": "9/30/2021",
    "nycsr_interventionstartdate": "2021-09-30T04:00:00Z",
    "nycsr_building.nycsr_address": "123 RIDGE STREET",
    "nycsr_building.nycsr_latitude@OData.Community.Display.V1.FormattedValue": "40,719,148.000000",
    "nycsr_building.nycsr_latitude": 40719148,
    "nycsr_building.nycsr_buildingid": "3a9f4974-31f4-ea11-b882-24ee9a37d45c",
    "nycsr_building.nycsr_borough@OData.Community.Display.V1.FormattedValue": "Manhattan",
    "nycsr_building.nycsr_borough": 882450000,
    "nycsr_building.nycsr_longitude@OData.Community.Display.V1.FormattedValue": "-73,983,769.000000",
    "nycsr_building.nycsr_longitude": -73983769,
    "nycsr_building.nycsr_geographicaldistrictcode": "1",
    "nycsr_building.nycsr_buildingname": "P.S. 140 - MANHATTAN",
    "nycsr_locationsite.nycsr_sitename": "P.S. 140 Nathan Straus - M140 - M140 - 01M140 - 123 RIDGE STREET"
  },
  {
    "@odata.etag": "W/\"328565710\"",
    "nycsr_admininterventiontype@OData.Community.Display.V1.FormattedValue": "Partial Classroom Quarantine",
    "nycsr_admininterventiontype": 882450001,
    "nycsr_caseid": "462ca1b2-2a21-ec11-b6e6-001dd83068fb",
    "nycsr_interventionenddate@OData.Community.Display.V1.FormattedValue": "10/4/2021",
    "nycsr_interventionenddate": "2021-10-04T04:00:00Z",
    "nycsr_casenumber": "053730",
    "nycsr_interventionstartdate@OData.Community.Display.V1.FormattedValue": "9/30/2021",
    "nycsr_interventionstartdate": "2021-09-30T04:00:00Z",
    "nycsr_building.nycsr_address": "120 EAST 184 STREET",
    "nycsr_building.nycsr_latitude@OData.Community.Display.V1.FormattedValue": "40,859,496.000000",
    "nycsr_building.nycsr_latitude": 40859496,
    "nycsr_building.nycsr_buildingid": "5b0d6d19-33f4-ea11-b882-24ee9a37d45c",
    "nycsr_building.nycsr_borough@OData.Community.Display.V1.FormattedValue": "Bronx",
    "nycsr_building.nycsr_borough": 882450001,
    "nycsr_building.nycsr_longitude@OData.Community.Display.V1.FormattedValue": "-73,900,490.000000",
    "nycsr_building.nycsr_longitude": -73900490,
    "nycsr_building.nycsr_geographicaldistrictcode": "10",
    "nycsr_building.nycsr_buildingname": "I.S. 399 (OLD X HS/X115) - BRONX",
    "nycsr_locationsite.nycsr_sitename": "Academy For Personal Leadership And Excellence - X363 - X115 - 10X363 - 120 EAST 184 STREET"
  },
  {
    "@odata.etag": "W/\"328652667\"",
    "nycsr_admininterventiontype@OData.Community.Display.V1.FormattedValue": "Partial Classroom Quarantine",
    "nycsr_admininterventiontype": 882450001,
    "nycsr_caseid": "0824fe08-2b21-ec11-b6e6-001dd83068fb",
    "nycsr_interventionenddate@OData.Community.Display.V1.FormattedValue": "10/7/2021",
    "nycsr_interventionenddate": "2021-10-07T04:00:00Z",
    "nycsr_casenumber": "053732",
    "nycsr_interventionstartdate@OData.Community.Display.V1.FormattedValue": "9/30/2021",
    "nycsr_interventionstartdate": "2021-09-30T04:00:00Z",
    "nycsr_building.nycsr_address": "590 SHEFFIELD AVENUE",
    "nycsr_building.nycsr_latitude@OData.Community.Display.V1.FormattedValue": "40,662,243.000000",
    "nycsr_building.nycsr_latitude": 40662243,
    "nycsr_building.nycsr_buildingid": "dbb36d80-30f4-ea11-b882-24ee9a37d45c",
    "nycsr_building.nycsr_borough@OData.Community.Display.V1.FormattedValue": "Brooklyn",
    "nycsr_building.nycsr_borough": 882450002,
    "nycsr_building.nycsr_longitude@OData.Community.Display.V1.FormattedValue": "-73,894,877.000000",
    "nycsr_building.nycsr_longitude": -73894877,
    "nycsr_building.nycsr_geographicaldistrictcode": "19",
    "nycsr_building.nycsr_buildingname": "P.S. 190 - BROOKLYN",
    "nycsr_locationsite.nycsr_sitename": "Legacy School of the Arts - K907 - K190 - 19K907 - 590 SHEFFIELD AVENUE"
  },
  {
    "@odata.etag": "W/\"328091881\"",
    "nycsr_admininterventiontype@OData.Community.Display.V1.FormattedValue": "Partial Classroom Quarantine",
    "nycsr_admininterventiontype": 882450001,
    "nycsr_caseid": "46988334-2b21-ec11-b6e6-001dd83068fb",
    "nycsr_interventionenddate@OData.Community.Display.V1.FormattedValue": "10/7/2021",
    "nycsr_interventionenddate": "2021-10-07T04:00:00Z",
    "nycsr_casenumber": "053733",
    "nycsr_interventionstartdate@OData.Community.Display.V1.FormattedValue": "9/30/2021",
    "nycsr_interventionstartdate": "2021-09-30T04:00:00Z",
    "nycsr_building.nycsr_address": "4200 16 AVENUE",
    "nycsr_building.nycsr_latitude@OData.Community.Display.V1.FormattedValue": "40,635,100.000000",
    "nycsr_building.nycsr_latitude": 40635100,
    "nycsr_building.nycsr_buildingid": "735bc58c-30f4-ea11-b882-24ee9a37d45c",
    "nycsr_building.nycsr_borough@OData.Community.Display.V1.FormattedValue": "Brooklyn",
    "nycsr_building.nycsr_borough": 882450002,
    "nycsr_building.nycsr_longitude@OData.Community.Display.V1.FormattedValue": "-73,982,424.000000",
    "nycsr_building.nycsr_longitude": -73982424,
    "nycsr_building.nycsr_geographicaldistrictcode": "20",
    "nycsr_building.nycsr_buildingname": "I.S. 223 - BROOKLYN",
    "nycsr_locationsite.nycsr_sitename": "Urban Assembly School for Leadership and Empowerment - K609 - K223 - 20K609 - 4200 16 AVENUE"
  },
  {
    "@odata.etag": "W/\"328548063\"",
    "nycsr_admininterventiontype@OData.Community.Display.V1.FormattedValue": "Partial Classroom Quarantine",
    "nycsr_admininterventiontype": 882450001,
    "nycsr_caseid": "8c8261c6-3321-ec11-b6e6-001dd83068fb",
    "nycsr_interventionenddate@OData.Community.Display.V1.FormattedValue": "10/8/2021",
    "nycsr_interventionenddate": "2021-10-08T04:00:00Z",
    "nycsr_casenumber": "053777",
    "nycsr_interventionstartdate@OData.Community.Display.V1.FormattedValue": "9/30/2021",
    "nycsr_interventionstartdate": "2021-09-30T04:00:00Z",
    "nycsr_building.nycsr_address": "1580 DEAN STREET",
    "nycsr_building.nycsr_latitude@OData.Community.Display.V1.FormattedValue": "40,675,675.000000",
    "nycsr_building.nycsr_latitude": 40675675,
    "nycsr_building.nycsr_buildingid": "7aa5db98-30f4-ea11-b882-24ee9a37d45c",
    "nycsr_building.nycsr_borough@OData.Community.Display.V1.FormattedValue": "Brooklyn",
    "nycsr_building.nycsr_borough": 882450002,
    "nycsr_building.nycsr_longitude@OData.Community.Display.V1.FormattedValue": "-73,935,093.000000",
    "nycsr_building.nycsr_longitude": -73935093,
    "nycsr_building.nycsr_geographicaldistrictcode": "16",
    "nycsr_building.nycsr_buildingname": "P.S. 243 - BROOKLYN",
    "nycsr_locationsite.nycsr_sitename": "P.S. 243K- The Weeksville School - K243 - K243 - 16K243 - 1580 DEAN STREET"
  },
  {
    "@odata.etag": "W/\"328241251\"",
    "nycsr_admininterventiontype@OData.Community.Display.V1.FormattedValue": "Classroom Closed",
    "nycsr_admininterventiontype": 882450000,
    "nycsr_caseid": "83779a34-3721-ec11-b6e6-001dd83068fb",
    "nycsr_interventionenddate@OData.Community.Display.V1.FormattedValue": "10/9/2021",
    "nycsr_interventionenddate": "2021-10-09T04:00:00Z",
    "nycsr_casenumber": "053807",
    "nycsr_interventionstartdate@OData.Community.Display.V1.FormattedValue": "9/30/2021",
    "nycsr_interventionstartdate": "2021-09-30T04:00:00Z",
    "nycsr_building.nycsr_address": "1684 WHITE PLAINS ROAD",
    "nycsr_building.nycsr_latitude@OData.Community.Display.V1.FormattedValue": "40,843,531.000000",
    "nycsr_building.nycsr_latitude": 40843531,
    "nycsr_building.nycsr_buildingid": "daba3c50-33f4-ea11-b882-24ee9a37d45c",
    "nycsr_building.nycsr_borough@OData.Community.Display.V1.FormattedValue": "Bronx",
    "nycsr_building.nycsr_borough": 882450001,
    "nycsr_building.nycsr_longitude@OData.Community.Display.V1.FormattedValue": "-73,865,498.000000",
    "nycsr_building.nycsr_longitude": -73865498,
    "nycsr_building.nycsr_geographicaldistrictcode": "11",
    "nycsr_building.nycsr_buildingname": "P.S. 311 - BRONX",
    "nycsr_locationsite.nycsr_sitename": "The STEAM Bridge School - X481 - X311 - 11X481 - 1684 WHITE PLAINS ROAD"
  },
  {
    "@odata.etag": "W/\"328649744\"",
    "nycsr_admininterventiontype@OData.Community.Display.V1.FormattedValue": "Classroom Closed",
    "nycsr_admininterventiontype": 882450000,
    "nycsr_caseid": "e97cebe9-3c21-ec11-b6e6-001dd83068fb",
    "nycsr_interventionenddate@OData.Community.Display.V1.FormattedValue": "10/8/2021",
    "nycsr_interventionenddate": "2021-10-08T04:00:00Z",
    "nycsr_casenumber": "053842",
    "nycsr_interventionstartdate@OData.Community.Display.V1.FormattedValue": "9/30/2021",
    "nycsr_interventionstartdate": "2021-09-30T04:00:00Z",
    "nycsr_building.nycsr_address": "1657 VICTORY BOULEVARD",
    "nycsr_building.nycsr_latitude@OData.Community.Display.V1.FormattedValue": "40,613,792.000000",
    "nycsr_building.nycsr_latitude": 40613792,
    "nycsr_building.nycsr_buildingid": "abc9a854-4afb-ea11-b883-24ee9a37d459",
    "nycsr_building.nycsr_longitude@OData.Community.Display.V1.FormattedValue": "-74,118,931.000000",
    "nycsr_building.nycsr_longitude": -74118931,
    "nycsr_building.nycsr_geographicaldistrictcode": "31",
    "nycsr_building.nycsr_buildingname": "CASTLETON HILL MORAVIAN PRE SCHOOL",
    "nycsr_locationsite.nycsr_sitename": "Castleton Hill Moravian Pre School - RADP - RADP -  - 1657 VICTORY BOULEVARD"
  },
  {
    "@odata.etag": "W/\"328240517\"",
    "nycsr_admininterventiontype@OData.Community.Display.V1.FormattedValue": "Classroom Closed",
    "nycsr_admininterventiontype": 882450000,
    "nycsr_caseid": "77f12e7a-4021-ec11-b6e6-001dd83068fb",
    "nycsr_interventionenddate@OData.Community.Display.V1.FormattedValue": "10/7/2021",
    "nycsr_interventionenddate": "2021-10-07T04:00:00Z",
    "nycsr_casenumber": "053866",
    "nycsr_interventionstartdate@OData.Community.Display.V1.FormattedValue": "9/30/2021",
    "nycsr_interventionstartdate": "2021-09-30T04:00:00Z",
    "nycsr_building.nycsr_address": "3010 BRIGGS AVENUE",
    "nycsr_building.nycsr_latitude@OData.Community.Display.V1.FormattedValue": "40,872,259.000000",
    "nycsr_building.nycsr_latitude": 40872259,
    "nycsr_building.nycsr_buildingid": "1b9ebaee-32f4-ea11-b882-24ee9a37d45c",
    "nycsr_building.nycsr_borough@OData.Community.Display.V1.FormattedValue": "Bronx",
    "nycsr_building.nycsr_borough": 882450001,
    "nycsr_building.nycsr_longitude@OData.Community.Display.V1.FormattedValue": "-73,883,339.000000",
    "nycsr_building.nycsr_longitude": -73883339,
    "nycsr_building.nycsr_geographicaldistrictcode": "10",
    "nycsr_building.nycsr_buildingname": "P.S. 8 - BRONX",
    "nycsr_locationsite.nycsr_sitename": "P.S. 008 Isaac Varian - X008 - X008 - 10X008 - 3010 BRIGGS AVENUE"
  },
  {
    "@odata.etag": "W/\"328840424\"",
    "nycsr_admininterventiontype@OData.Community.Display.V1.FormattedValue": "Partial Classroom Quarantine",
    "nycsr_admininterventiontype": 882450001,
    "nycsr_caseid": "1914daa0-5121-ec11-b6e6-001dd83068fb",
    "nycsr_interventionenddate@OData.Community.Display.V1.FormattedValue": "10/8/2021",
    "nycsr_interventionenddate": "2021-10-08T04:00:00Z",
    "nycsr_casenumber": "053945",
    "nycsr_interventionstartdate@OData.Community.Display.V1.FormattedValue": "10/1/2021",
    "nycsr_interventionstartdate": "2021-10-01T04:00:00Z",
    "nycsr_building.nycsr_address": "1186 Carroll Street",
    "nycsr_building.nycsr_latitude@OData.Community.Display.V1.FormattedValue": "40,666,790.000000",
    "nycsr_building.nycsr_latitude": 40666790,
    "nycsr_building.nycsr_buildingid": "e33159fa-30f4-ea11-b882-24ee9a37d45c",
    "nycsr_building.nycsr_borough@OData.Community.Display.V1.FormattedValue": "Brooklyn",
    "nycsr_building.nycsr_borough": 882450002,
    "nycsr_building.nycsr_longitude@OData.Community.Display.V1.FormattedValue": "-73,951,823.000000",
    "nycsr_building.nycsr_longitude": -73951823,
    "nycsr_building.nycsr_geographicaldistrictcode": "17",
    "nycsr_building.nycsr_buildingname": "MIDDLE COLLEGE HS - BROOKLYN",
    "nycsr_locationsite.nycsr_sitename": "Medgar Evers College Preparatory School - K590 - K590 - 17K590 - 1186 Carroll Street"
  },
  {
    "@odata.etag": "W/\"328092291\"",
    "nycsr_admininterventiontype@OData.Community.Display.V1.FormattedValue": "Classroom Closed",
    "nycsr_admininterventiontype": 882450000,
    "nycsr_caseid": "338cf3b9-5121-ec11-b6e6-001dd83068fb",
    "nycsr_interventionenddate@OData.Community.Display.V1.FormattedValue": "10/8/2021",
    "nycsr_interventionenddate": "2021-10-08T04:00:00Z",
    "nycsr_casenumber": "053947",
    "nycsr_interventionstartdate@OData.Community.Display.V1.FormattedValue": "9/30/2021",
    "nycsr_interventionstartdate": "2021-09-30T04:00:00Z",
    "nycsr_building.nycsr_address": "1001 EAST  45 STREET",
    "nycsr_building.nycsr_latitude@OData.Community.Display.V1.FormattedValue": "40,635,842.000000",
    "nycsr_building.nycsr_latitude": 40635842,
    "nycsr_building.nycsr_buildingid": "2fe2abc9-30f4-ea11-b882-24ee9a37d45c",
    "nycsr_building.nycsr_borough@OData.Community.Display.V1.FormattedValue": "Brooklyn",
    "nycsr_building.nycsr_borough": 882450002,
    "nycsr_building.nycsr_longitude@OData.Community.Display.V1.FormattedValue": "-73,933,099.000000",
    "nycsr_building.nycsr_longitude": -73933099,
    "nycsr_building.nycsr_geographicaldistrictcode": "22",
    "nycsr_building.nycsr_buildingname": "P.S./I.S. 395 - BROOKLYN",
    "nycsr_locationsite.nycsr_sitename": "P.S. 109 - K109 - K395 - 22K109 - 1001 EAST  45 STREET"
  },
  {
    "@odata.etag": "W/\"328678259\"",
    "nycsr_admininterventiontype@OData.Community.Display.V1.FormattedValue": "Partial Classroom Quarantine",
    "nycsr_admininterventiontype": 882450001,
    "nycsr_caseid": "1868d085-5421-ec11-b6e6-001dd83068fb",
    "nycsr_interventionenddate@OData.Community.Display.V1.FormattedValue": "10/9/2021",
    "nycsr_interventionenddate": "2021-10-09T04:00:00Z",
    "nycsr_casenumber": "053968",
    "nycsr_interventionstartdate@OData.Community.Display.V1.FormattedValue": "9/30/2021",
    "nycsr_interventionstartdate": "2021-09-30T04:00:00Z",
    "nycsr_building.nycsr_address": "713 CATON AVENUE",
    "nycsr_building.nycsr_latitude@OData.Community.Display.V1.FormattedValue": "40,647,598.000000",
    "nycsr_building.nycsr_latitude": 40647598,
    "nycsr_building.nycsr_buildingid": "4488e6db-30f4-ea11-b882-24ee9a37d45c",
    "nycsr_building.nycsr_borough@OData.Community.Display.V1.FormattedValue": "Brooklyn",
    "nycsr_building.nycsr_borough": 882450002,
    "nycsr_building.nycsr_longitude@OData.Community.Display.V1.FormattedValue": "-73,973,363.000000",
    "nycsr_building.nycsr_longitude": -73973363,
    "nycsr_building.nycsr_geographicaldistrictcode": "15",
    "nycsr_building.nycsr_buildingname": "P.S./I.S. 437 - BROOKLYN",
    "nycsr_locationsite.nycsr_sitename": "M.S. 839 - K839 - K437 - 15K839 - 713 CATON AVENUE"
  },
  {
    "@odata.etag": "W/\"328279459\"",
    "nycsr_admininterventiontype@OData.Community.Display.V1.FormattedValue": "Partial Classroom Quarantine",
    "nycsr_admininterventiontype": 882450001,
    "nycsr_caseid": "9bd37988-5a21-ec11-b6e6-001dd83068fb",
    "nycsr_interventionenddate@OData.Community.Display.V1.FormattedValue": "10/4/2021",
    "nycsr_interventionenddate": "2021-10-04T04:00:00Z",
    "nycsr_casenumber": "053998",
    "nycsr_interventionstartdate@OData.Community.Display.V1.FormattedValue": "10/1/2021",
    "nycsr_interventionstartdate": "2021-10-01T04:00:00Z",
    "nycsr_building.nycsr_address": "3040 ROBERTS AVENUE",
    "nycsr_building.nycsr_latitude@OData.Community.Display.V1.FormattedValue": "40,845,379.000000",
    "nycsr_building.nycsr_latitude": 40845379,
    "nycsr_building.nycsr_buildingid": "e3d10307-33f4-ea11-b882-24ee9a37d45c",
    "nycsr_building.nycsr_borough@OData.Community.Display.V1.FormattedValue": "Bronx",
    "nycsr_building.nycsr_borough": 882450001,
    "nycsr_building.nycsr_longitude@OData.Community.Display.V1.FormattedValue": "-73,829,562.000000",
    "nycsr_building.nycsr_longitude": -73829562,
    "nycsr_building.nycsr_geographicaldistrictcode": "8",
    "nycsr_building.nycsr_buildingname": "P.S. 71 - BRONX",
    "nycsr_locationsite.nycsr_sitename": "P.S. 071 Rose E. Scala - X071 - X071 - 08X071 - 3040 ROBERTS AVENUE"
  },
  {
    "@odata.etag": "W/\"328685527\"",
    "nycsr_admininterventiontype@OData.Community.Display.V1.FormattedValue": "Non-Classroom Quarantine",
    "nycsr_admininterventiontype": 882450003,
    "nycsr_caseid": "8c34aa9a-5a21-ec11-b6e6-001dd83068fb",
    "nycsr_interventionenddate@OData.Community.Display.V1.FormattedValue": "10/4/2021",
    "nycsr_interventionenddate": "2021-10-04T04:00:00Z",
    "nycsr_casenumber": "053999",
    "nycsr_interventionstartdate@OData.Community.Display.V1.FormattedValue": "10/1/2021",
    "nycsr_interventionstartdate": "2021-10-01T04:00:00Z",
    "nycsr_building.nycsr_address": "57-40 MARATHON PARKWAY",
    "nycsr_building.nycsr_latitude@OData.Community.Display.V1.FormattedValue": "40,758,808.000000",
    "nycsr_building.nycsr_latitude": 40758808,
    "nycsr_building.nycsr_buildingid": "11b7c337-32f4-ea11-b882-24ee9a37d45c",
    "nycsr_building.nycsr_borough@OData.Community.Display.V1.FormattedValue": "Queens",
    "nycsr_building.nycsr_borough": 882450003,
    "nycsr_building.nycsr_longitude@OData.Community.Display.V1.FormattedValue": "-73,731,518.000000",
    "nycsr_building.nycsr_longitude": -73731518,
    "nycsr_building.nycsr_geographicaldistrictcode": "26",
    "nycsr_building.nycsr_buildingname": "P.S. 221 - QUEENS",
    "nycsr_locationsite.nycsr_sitename": "P.S. 221 The North Hills School - Q221 - Q221 - 26Q221 - 57-40 MARATHON PARKWAY"
  },
  {
    "@odata.etag": "W/\"328298095\"",
    "nycsr_admininterventiontype@OData.Community.Display.V1.FormattedValue": "Classroom Closed",
    "nycsr_admininterventiontype": 882450000,
    "nycsr_caseid": "b3c8f059-de21-ec11-b6e6-001dd83068fb",
    "nycsr_interventionenddate@OData.Community.Display.V1.FormattedValue": "10/9/2021",
    "nycsr_interventionenddate": "2021-10-09T04:00:00Z",
    "nycsr_casenumber": "054021",
    "nycsr_interventionstartdate@OData.Community.Display.V1.FormattedValue": "10/1/2021",
    "nycsr_interventionstartdate": "2021-10-01T04:00:00Z",
    "nycsr_building.nycsr_address": "4211 14 AVENUE",
    "nycsr_building.nycsr_latitude@OData.Community.Display.V1.FormattedValue": "40,637,101.000000",
    "nycsr_building.nycsr_latitude": 40637101,
    "nycsr_building.nycsr_buildingid": "36ebaa73-30f4-ea11-b882-24ee9a37d45c",
    "nycsr_building.nycsr_borough@OData.Community.Display.V1.FormattedValue": "Brooklyn",
    "nycsr_building.nycsr_borough": 882450002,
    "nycsr_building.nycsr_longitude@OData.Community.Display.V1.FormattedValue": "-73,985,739.000000",
    "nycsr_building.nycsr_longitude": -73985739,
    "nycsr_building.nycsr_geographicaldistrictcode": "20",
    "nycsr_building.nycsr_buildingname": "P.S. 164 - BROOKLYN",
    "nycsr_locationsite.nycsr_sitename": "P.S. 164 Caesar Rodney - K164 - K164 - 20K164 - 4211 14 AVENUE"
  },
  {
    "@odata.etag": "W/\"328725174\"",
    "nycsr_admininterventiontype@OData.Community.Display.V1.FormattedValue": "Partial Classroom Quarantine",
    "nycsr_admininterventiontype": 882450001,
    "nycsr_caseid": "841e1f67-e021-ec11-b6e6-001dd83068fb",
    "nycsr_interventionenddate@OData.Community.Display.V1.FormattedValue": "10/3/2021",
    "nycsr_interventionenddate": "2021-10-03T04:00:00Z",
    "nycsr_casenumber": "054028",
    "nycsr_interventionstartdate@OData.Community.Display.V1.FormattedValue": "10/1/2021",
    "nycsr_interventionstartdate": "2021-10-01T04:00:00Z",
    "nycsr_building.nycsr_address": "237 7 AVENUE",
    "nycsr_building.nycsr_latitude@OData.Community.Display.V1.FormattedValue": "40,669,255.000000",
    "nycsr_building.nycsr_latitude": 40669255,
    "nycsr_building.nycsr_buildingid": "929c11e8-30f4-ea11-b882-24ee9a37d45c",
    "nycsr_building.nycsr_borough@OData.Community.Display.V1.FormattedValue": "Brooklyn",
    "nycsr_building.nycsr_borough": 882450002,
    "nycsr_building.nycsr_longitude@OData.Community.Display.V1.FormattedValue": "-73,978,580.000000",
    "nycsr_building.nycsr_longitude": -73978580,
    "nycsr_building.nycsr_geographicaldistrictcode": "15",
    "nycsr_building.nycsr_buildingname": "John Jay Educational Campus",
    "nycsr_locationsite.nycsr_sitename": "Park Slope Collegiate - K464 - K460 - 15K464 - 237 7 AVENUE"
  },
  {
    "@odata.etag": "W/\"328728321\"",
    "nycsr_admininterventiontype@OData.Community.Display.V1.FormattedValue": "Partial Classroom Quarantine",
    "nycsr_admininterventiontype": 882450001,
    "nycsr_caseid": "19998a52-e221-ec11-b6e6-001dd83068fb",
    "nycsr_interventionenddate@OData.Community.Display.V1.FormattedValue": "10/7/2021",
    "nycsr_interventionenddate": "2021-10-07T04:00:00Z",
    "nycsr_casenumber": "054034",
    "nycsr_interventionstartdate@OData.Community.Display.V1.FormattedValue": "10/1/2021",
    "nycsr_interventionstartdate": "2021-10-01T04:00:00Z",
    "nycsr_building.nycsr_address": "157 WILSON STREET",
    "nycsr_building.nycsr_latitude@OData.Community.Display.V1.FormattedValue": "40,706,069.000000",
    "nycsr_building.nycsr_latitude": 40706069,
    "nycsr_building.nycsr_buildingid": "f9f57030-30f4-ea11-b882-24ee9a37d45c",
    "nycsr_building.nycsr_borough@OData.Community.Display.V1.FormattedValue": "Brooklyn",
    "nycsr_building.nycsr_borough": 882450002,
    "nycsr_building.nycsr_longitude@OData.Community.Display.V1.FormattedValue": "-73,962,049.000000",
    "nycsr_building.nycsr_longitude": -73962049,
    "nycsr_building.nycsr_geographicaldistrictcode": "14",
    "nycsr_building.nycsr_buildingname": "P.S. 16 - BROOKLYN",
    "nycsr_locationsite.nycsr_sitename": "P.S. 016 Leonard Dunkly - K016 - K016 - 14K016 - 157 WILSON STREET"
  },
  {
    "@odata.etag": "W/\"328731962\"",
    "nycsr_admininterventiontype@OData.Community.Display.V1.FormattedValue": "Classroom Closed",
    "nycsr_admininterventiontype": 882450000,
    "nycsr_caseid": "a72936db-e321-ec11-b6e6-001dd83068fb",
    "nycsr_interventionenddate@OData.Community.Display.V1.FormattedValue": "10/8/2021",
    "nycsr_interventionenddate": "2021-10-08T04:00:00Z",
    "nycsr_casenumber": "054044",
    "nycsr_interventionstartdate@OData.Community.Display.V1.FormattedValue": "10/1/2021",
    "nycsr_interventionstartdate": "2021-10-01T04:00:00Z",
    "nycsr_building.nycsr_address": "4305 7 AVENUE",
    "nycsr_building.nycsr_latitude@OData.Community.Display.V1.FormattedValue": "40,645,825.000000",
    "nycsr_building.nycsr_latitude": 40645825,
    "nycsr_building.nycsr_buildingid": "55ebaa73-30f4-ea11-b882-24ee9a37d45c",
    "nycsr_building.nycsr_borough@OData.Community.Display.V1.FormattedValue": "Brooklyn",
    "nycsr_building.nycsr_borough": 882450002,
    "nycsr_building.nycsr_longitude@OData.Community.Display.V1.FormattedValue": "-74,001,700.000000",
    "nycsr_building.nycsr_longitude": -74001700,
    "nycsr_building.nycsr_geographicaldistrictcode": "15",
    "nycsr_building.nycsr_buildingname": "P.S. 169 - BROOKLYN",
    "nycsr_locationsite.nycsr_sitename": "P.S. 169 Sunset Park - K169 - K169 - 15K169 - 4305 7 AVENUE"
  },
  {
    "@odata.etag": "W/\"328764901\"",
    "nycsr_admininterventiontype@OData.Community.Display.V1.FormattedValue": "Partial Classroom Quarantine",
    "nycsr_admininterventiontype": 882450001,
    "nycsr_caseid": "10cb0755-e421-ec11-b6e6-001dd83068fb",
    "nycsr_interventionenddate@OData.Community.Display.V1.FormattedValue": "10/9/2021",
    "nycsr_interventionenddate": "2021-10-09T04:00:00Z",
    "nycsr_casenumber": "054049",
