"@odata.etag","nycsr_admininterventiontype@OData.Community.Display.V1.FormattedValue","nycsr_admininterventiontype","nycsr_caseid","nycsr_interventionenddate@OData.Community.Display.V1.FormattedValue","nycsr_interventionenddate","nycsr_casenumber","nycsr_interventionstartdate@OData.Community.Display.V1.FormattedValue","nycsr_interventionstartdate","nycsr_building.nycsr_address","nycsr_building.nycsr_latitude@OData.Community.Display.V1.FormattedValue","nycsr_building.nycsr_latitude","nycsr_building.nycsr_buildingid","nycsr_building.nycsr_borough@OData.Community.Display.V1.FormattedValue","nycsr_building.nycsr_borough","nycsr_building.nycsr_longitude@OData.Community.Display.V1.FormattedValue","nycsr_building.nycsr_longitude","nycsr_building.nycsr_geographicaldistrictcode","nycsr_building.nycsr_buildingname","nycsr_locationsite.nycsr_sitename"
"W/""324596738""","Partial Classroom Quarantine",882450001,"d95b5103-d51e-ec11-b6e6-001dd8305f31","10/4/2021","2021-10-04T04:00:00Z","052462","9/27/2021","2021-09-27T04:00:00Z","321 Palmetto Street","40,697,378.000000",40697378,"10fc3df4-30f4-ea11-b882-24ee9a37d45c","Brooklyn",882450002,"-73,913,172.000000",-73913172,"32","ALL CITY LEADERSHIP SECONDARY SCHOOL - BROOKLYN","All City Leadership Secondary School - K554 - K554 - 32K554 - 321 Palmetto Street"
"W/""326014583""","Partial Classroom Quarantine",882450001,"2a701b7a-d81e-ec11-b6e6-001dd8305f31","10/4/2021","2021-10-04T04:00:00Z","052469","9/27/2021","2021-09-27T04:00:00Z","230-17 HILLSIDE AVENUE","40,733,888.000000",40733888,"c4b66262-32f4-ea11-b882-24ee9a37d45c","Queens",882450003,"-73,739,726.000000",-73739726,"26","MARTIN VAN BUREN HS - QUEENS","Business Technology Early College High School - Q315 - Q435 - 26Q315 - 230-17 HILLSIDE AVENUE"
"W/""324595436""","Non-Classroom Quarantine",882450003,"3803b199-dd1e-ec11-b6e6-001dd8305f31","10/4/2021","2021-10-04T04:00:00Z","052484","9/27/2021","2021-09-27T04:00:00Z","1581 VICTORY BOULEVARD","40,614,039.000000",40614039,"7ba9d9c3-32f4-ea11-b882-24ee9a37d45c","Staten Island",882450004,"-74,116,197.000000",-74116197,"31","P.S. 29 - STATEN ISLAND","P.S. 029 Bardwell - R029 - R029 - 31R029 - 1581 VICTORY BOULEVARD"
"W/""326845572""","Classroom Closed",882450000,"ad149600-de1e-ec11-b6e6-001dd8305f31","10/4/2021","2021-10-04T04:00:00Z","052488","9/27/2021","2021-09-27T04:00:00Z","1500 EAST  92 STREET","40,634,861.000000",40634861,"2fe85c61-30f4-ea11-b882-24ee9a37d45c","Brooklyn",882450002,"-73,897,896.000000",-73897896,"18","P.S. 115 - BROOKLYN","P.S. 115 Daniel Mucatel School - K115 - K115 - 18K115 - 1500 EAST  92 STREET"
"W/""324595462""","Non-Classroom Quarantine",882450003,"9ba1b437-de1e-ec11-b6e6-001dd8305f31","10/4/2021","2021-10-04T04:00:00Z","052490","9/27/2021","2021-09-27T04:00:00Z","112 SCHERMERHORN STREET","40,690,007.000000",40690007,"f7fb3df4-30f4-ea11-b882-24ee9a37d45c","Brooklyn",882450002,"-73,989,369.000000",-73989369,"15","PACIFIC ALT HS - K","Brooklyn Frontiers High School - K423 - K520 - 15K423 - 112 SCHERMERHORN STREET"
"W/""324595467""","Partial Classroom Quarantine",882450001,"c6b899bc-de1e-ec11-b6e6-001dd8305f31","10/4/2021","2021-10-04T04:00:00Z","052491","9/27/2021","2021-09-27T04:00:00Z","345 DEAN STREET","40,683,951.000000",40683951,"30416e00-31f4-ea11-b882-24ee9a37d45c","Brooklyn",882450002,"-73,980,266.000000",-73980266,"15","BKLYN HS OF THE ARTS (OL S J HL)-K","Brooklyn High School of the Arts - K656 - K655 - 15K656 - 345 DEAN STREET"
"W/""325404528""","Classroom Closed",882450000,"ae7c67da-df1e-ec11-b6e6-001dd8305f31","10/4/2021","2021-10-04T04:00:00Z","052495","9/27/2021","2021-09-27T04:00:00Z","1500 EAST  92 STREET","40,634,861.000000",40634861,"2fe85c61-30f4-ea11-b882-24ee9a37d45c","Brooklyn",882450002,"-73,897,896.000000",-73897896,"18","P.S. 115 - BROOKLYN","P.S. 115 Daniel Mucatel School - K115 - K115 - 18K115 - 1500 EAST  92 STREET"
"W/""325135770""","Classroom Closed",882450000,"9fe838f1-e01e-ec11-b6e6-001dd8305f31","10/3/2021","2021-10-03T04:00:00Z","052505","9/27/2021","2021-09-27T04:00:00Z","250 KRAMER AVENUE","40,541,856.000000",40541856,"3e0410ca-32f4-ea11-b882-24ee9a37d45c","Staten Island",882450004,"-74,213,943.000000",-74213943,"31","P.S. 56 - STATEN ISLAND","P.S. 56 The Louis Desario School - R056 - R056 - 31R056 - 250 KRAMER AVENUE"
"W/""324595538""","Partial Classroom Quarantine",882450001,"1577ca09-e11e-ec11-b6e6-001dd8305f31","10/4/2021","2021-10-04T04:00:00Z","052506","9/27/2021","2021-09-27T04:00:00Z","1200 MANOR ROAD","40,588,985.000000",40588985,"5abe7adc-32f4-ea11-b882-24ee9a37d45c","Staten Island",882450004,"-74,130,819.000000",-74130819,"31","SUSAN E. WAGNER HS - S. I.","Susan E. Wagner High School - R460 - R460 - 31R460 - 1200 MANOR ROAD"
"W/""324686435""","Classroom Closed",882450000,"bb7cb982-e11e-ec11-b6e6-001dd8305f31","10/4/2021","2021-10-04T04:00:00Z","052509","9/27/2021","2021-09-27T04:00:00Z","420 BEACH  51 STREET","40,595,911.000000",40595911,"b02ff20c-32f4-ea11-b882-24ee9a37d45c","Queens",882450003,"-73,780,961.000000",-73780961,"27","P.S. 105 - QUEENS","P.S. 105 The Bay School - Q105 - Q105 - 27Q105 - 420 BEACH  51 STREET"
"W/""324595603""","Partial Classroom Quarantine",882450001,"95c9599e-e31e-ec11-b6e6-001dd8305f31","10/4/2021","2021-10-04T04:00:00Z","052521","9/27/2021","2021-09-27T04:00:00Z","101 WARREN STREET","40,620,443.000000",40620443,"190410ca-32f4-ea11-b882-24ee9a37d45c","Staten Island",882450004,"-74,080,695.000000",-74080695,"31","I.S. 49 - STATEN ISLAND","The Eagle Academy for Young Men of Staten Island - R028 - R049 - 31R028 - 101 WARREN STREET"
"W/""325860771""","Partial Classroom Quarantine",882450001,"f9fc291f-e41e-ec11-b6e6-001dd8305f31","10/2/2021","2021-10-02T04:00:00Z","052523","9/28/2021","2021-09-28T04:00:00Z","522 WEST 44TH STREET","40,760,858.000000",40760858,"e7ed94c3-31f4-ea11-b882-24ee9a37d45c","Manhattan",882450000,"-73,996,262.000000",-73996262,"2","BEACON HIGH SCHOOL - MANHATTAN","Beacon High School - M479 - M912 - 03M479 - 522 WEST 44TH STREET"
"W/""325744740""","Classroom Closed",882450000,"41d82c44-e41e-ec11-b6e6-001dd8305f31","10/3/2021","2021-10-03T04:00:00Z","052524","9/27/2021","2021-09-27T04:00:00Z","249 EAST 17TH STREET","40,644,927.000000",40644927,"432f7d06-31f4-ea11-b882-24ee9a37d45c","Brooklyn",882450002,"-73,962,743.000000",-73962743,"22","P.S. 245 - BROOKLYN","P.S. 245 - K245 - K735 - 22K245 - 249 EAST 17TH STREET"
"W/""325860776""","Non-Classroom Quarantine",882450003,"54177de4-e61e-ec11-b6e6-001dd8305f31","10/2/2021","2021-10-02T04:00:00Z","052534","9/28/2021","2021-09-28T04:00:00Z","522 WEST 44TH STREET","40,760,858.000000",40760858,"e7ed94c3-31f4-ea11-b882-24ee9a37d45c","Manhattan",882450000,"-73,996,262.000000",-73996262,"2","BEACON HIGH SCHOOL - MANHATTAN","Beacon High School - M479 - M912 - 03M479 - 522 WEST 44TH STREET"
"W/""324685615""","Classroom Closed",882450000,"0e2b0fca-eb1e-ec11-b6e6-001dd8305f31","10/4/2021","2021-10-04T04:00:00Z","052546","9/27/2021","2021-09-27T04:00:00Z","349 CABRINI BOULEVARD","40,856,239.000000",40856239,"59507380-31f4-ea11-b882-24ee9a37d45c","Manhattan",882450000,"-73,936,840.000000",-73936840,"6","P.S./I.S. 187 - MANHATTAN","P.S./I.S. 187 Hudson Cliffs - M187 - M187 - 06M187 - 349 CABRINI BOULEVARD"
"W/""325296038""","Partial Classroom Quarantine",882450001,"43410c2b-ec1e-ec11-b6e6-001dd8305f31","10/3/2021","2021-10-03T04:00:00Z","052547","9/27/2021","2021-09-27T04:00:00Z","800 HOME STREET","40,826,933.000000",40826933,"8601ce37-33f4-ea11-b882-24ee9a37d45c","Bronx",882450001,"-73,900,593.000000",-73900593,"12","I.S. 158 - BRONX","Bronx Career and College Preparatory High School - X479 - X158 - 12X479 - 800 HOME STREET"
"W/""324597628""","Classroom Closed",882450000,"33647abf-ee1e-ec11-b6e6-001dd8305f31","10/3/2021","2021-10-03T04:00:00Z","052554","9/27/2021","2021-09-27T04:00:00Z","144 KEATING PLACE","40,591,480.000000",40591480,"dd8521d0-32f4-ea11-b882-24ee9a37d45c","Staten Island",882450004,"-74,157,327.000000",-74157327,"31","P.S. 69 - STATEN ISLAND","P.S. 069 Daniel D. Tompkins - R069 - R069 - 31R069 - 144 KEATING PLACE"
"W/""324685368""","Partial Classroom Quarantine",882450001,"7d3a6756-f11e-ec11-b6e6-001dd8305f31","10/4/2021","2021-10-04T04:00:00Z","052557","9/27/2021","2021-09-27T04:00:00Z","237 7 AVENUE","40,669,255.000000",40669255,"929c11e8-30f4-ea11-b882-24ee9a37d45c","Brooklyn",882450002,"-73,978,580.000000",-73978580,"15","John Jay Educational Campus","Park Slope Collegiate - K464 - K460 - 15K464 - 237 7 AVENUE"
"W/""325405337""","Classroom Closed",882450000,"f41daf64-f51e-ec11-b6e6-001dd8305f31","10/4/2021","2021-10-04T04:00:00Z","052567","9/27/2021","2021-09-27T04:00:00Z","557 PENNSYLVANIA AVENUE","40,664,067.000000",40664067,"e7f57030-30f4-ea11-b882-24ee9a37d45c","Brooklyn",882450002,"-73,893,328.000000",-73893328,"19","P.S. 13 - BROOKLYN","P.S. 013 Roberto Clemente - K013 - K013 - 19K013 - 557 PENNSYLVANIA AVENUE"
"W/""325500810""","Classroom Closed",882450000,"6423edbf-f51e-ec11-b6e6-001dd8305f31","10/1/2021","2021-10-01T04:00:00Z","052571","9/27/2021","2021-09-27T04:00:00Z","825 HICKSVILLE ROAD","40,599,664.000000",40599664,"93977d2b-32f4-ea11-b882-24ee9a37d45c","Queens",882450003,"-73,744,128.000000",-73744128,"27","P.S. 197 - QUEENS","P.S. 197 The Ocean School - Q197 - Q197 - 27Q197 - 825 HICKSVILLE ROAD"
"W/""327673015""","Partial Classroom Quarantine",882450001,"bb9068b1-fa1e-ec11-b6e6-001dd8305f31","10/4/2021","2021-10-04T04:00:00Z","052580","9/29/2021","2021-09-29T04:00:00Z","120 EAST 184 STREET","40,859,496.000000",40859496,"5b0d6d19-33f4-ea11-b882-24ee9a37d45c","Bronx",882450001,"-73,900,490.000000",-73900490,"10","I.S. 399 (OLD X HS/X115) - BRONX","Academy For Personal Leadership And Excellence - X363 - X115 - 10X363 - 120 EAST 184 STREET"
"W/""324595816""","Non-Classroom Quarantine",882450003,"3e81168c-fc1e-ec11-b6e6-001dd8305f31","10/4/2021","2021-10-04T04:00:00Z","052587","9/27/2021","2021-09-27T04:00:00Z","51-60 MARATHON PARKWAY","40,762,241.000000",40762241,"732f77fa-31f4-ea11-b882-24ee9a37d45c","Queens",882450003,"-73,734,832.000000",-73734832,"26","J.H.S. 67 - QUEENS","J.H.S. 067 Louis Pasteur - Q067 - Q067 - 26Q067 - 51-60 MARATHON PARKWAY"
"W/""325860796""","Partial Classroom Quarantine",882450001,"1d209336-831f-ec11-b6e6-001dd8305f31","10/4/2021","2021-10-04T04:00:00Z","052601","9/28/2021","2021-09-28T04:00:00Z","90-15 SUTTER AVENUE","40,676,978.000000",40676978,"6a2f77fa-31f4-ea11-b882-24ee9a37d45c","Queens",882450003,"-73,846,796.000000",-73846796,"27","P.S. 63 - QUEENS","P.S. 063 Old South - Q063 - Q063 - 27Q063 - 90-15 SUTTER AVENUE"
"W/""325860801""","Classroom Closed",882450000,"77042f3d-841f-ec11-b6e6-001dd8305f31","10/4/2021","2021-10-04T04:00:00Z","052603","9/28/2021","2021-09-28T04:00:00Z","131 NORMAN AVENUE","40,726,378.000000",40726378,"f91aad3c-30f4-ea11-b882-24ee9a37d45c","Brooklyn",882450002,"-73,949,756.000000",-73949756,"14","P.S. 34 - BROOKLYN","P.S. 034 Oliver H. Perry - K034 - K034 - 14K034 - 131 NORMAN AVENUE"
"W/""325860821""","Partial Classroom Quarantine",882450001,"17150ef3-841f-ec11-b6e6-001dd8305f31","10/4/2021","2021-10-04T04:00:00Z","052607","9/28/2021","2021-09-28T04:00:00Z","131 NORMAN AVENUE","40,726,378.000000",40726378,"f91aad3c-30f4-ea11-b882-24ee9a37d45c","Brooklyn",882450002,"-73,949,756.000000",-73949756,"14","P.S. 34 - BROOKLYN","P.S. 034 Oliver H. Perry - K034 - K034 - 14K034 - 131 NORMAN AVENUE"
"W/""325860871""","Classroom Closed",882450000,"d5598b90-871f-ec11-b6e6-001dd8305f31","10/2/2021","2021-10-02T04:00:00Z","052622","9/28/2021","2021-09-28T04:00:00Z","1800 Utica Avenue","40,628,417.000000",40628417,"17d8cf12-31f4-ea11-b882-24ee9a37d45c","Brooklyn",882450002,"-73,928,250.000000",-73928250,"22","P.S. 326 - BROOKLYN","P.S. 326 - K326 - K852 - 22K326 - 1800 Utica Avenue"
"W/""325860917""","Classroom Closed",882450000,"ca0e43f1-881f-ec11-b6e6-001dd8305f31","10/2/2021","2021-10-02T04:00:00Z","052632","9/28/2021","2021-09-28T04:00:00Z","1800 Utica Avenue","40,628,417.000000",40628417,"17d8cf12-31f4-ea11-b882-24ee9a37d45c","Brooklyn",882450002,"-73,928,250.000000",-73928250,"22","P.S. 326 - BROOKLYN","P.S. 326 - K326 - K852 - 22K326 - 1800 Utica Avenue"
"W/""326846248""","Partial Classroom Quarantine",882450001,"7d83ee7f-931f-ec11-b6e6-001dd8305f31","10/4/2021","2021-10-04T04:00:00Z","052686","9/28/2021","2021-09-28T04:00:00Z","91-30 METROPOLITAN AVENUE","40,708,431.000000",40708431,"a372c880-32f4-ea11-b882-24ee9a37d45c","Queens",882450003,"-73,855,543.000000",-73855543,"28","METROPOLITAN AVENUE CAMPUS - QUEENS","P.S. Q233 - Q233 - Q686 - 75Q233 - 91-30 METROPOLITAN AVENUE"
"W/""327198826""","Partial Classroom Quarantine",882450001,"fd1c4baa-961f-ec11-b6e6-001dd8305f31","10/4/2021","2021-10-04T04:00:00Z","052714","9/29/2021","2021-09-29T04:00:00Z","19 EAST 103 STREET","40,792,302.000000",40792302,"42005d7a-31f4-ea11-b882-24ee9a37d45c","Manhattan",882450000,"-73,951,425.000000",-73951425,"4","P.S. 171 - MANHATTAN","P.S. 171 Patrick Henry - M171 - M171 - 04M171 - 19 EAST 103 STREET"
"W/""326073155""","Classroom Closed",882450000,"130d6ae1-991f-ec11-b6e6-001dd8305f31","10/4/2021","2021-10-04T04:00:00Z","052746","9/28/2021","2021-09-28T04:00:00Z","3047 BRUCKNER BOULEVARD","40,835,318.000000",40835318,"2a9ebaee-32f4-ea11-b882-24ee9a37d45c","Bronx",882450001,"-73,826,277.000000",-73826277,"8","P.S. 14 - BRONX","P.S. X014 Senator John Calandra - X014 - X014 - 08X014 - 3047 BRUCKNER BOULEVARD"
"W/""325861315""","Non-Classroom Quarantine",882450003,"70366c86-9b1f-ec11-b6e6-001dd8305f31","10/4/2021","2021-10-04T04:00:00Z","052760","9/28/2021","2021-09-28T04:00:00Z","4202 EIGHTH AVENUE","40,645,521.000000",40645521,"63275a30-4afb-ea11-b883-24ee9a37d459",,,"-73,999,155.000000",-73999155,"15","BCA Bay Ridge DCC","BCA Bay Ridge DCC - KBUJ - KBTX -  - 4202 EIGHTH AVENUE"
"W/""327119069""","Non-Classroom Quarantine",882450003,"a80ce038-9e1f-ec11-b6e6-001dd8305f31","10/4/2021","2021-10-04T04:00:00Z","052787","9/28/2021","2021-09-28T04:00:00Z","300 ADELPHI STREET","40,688,769.000000",40688769,"1fe85c61-30f4-ea11-b882-24ee9a37d45c","Brooklyn",882450002,"-73,971,474.000000",-73971474,"13","I.S. 113 - BROOKLYN","Compass Charter School - K789 - K113 - 84K789 - 300 ADELPHI STREET"
"W/""325861461""","Classroom Closed",882450000,"36f99b67-a01f-ec11-b6e6-001dd8305f31","10/3/2021","2021-10-03T04:00:00Z","052807","9/28/2021","2021-09-28T04:00:00Z","2944 PITKIN AVENUE","40,675,881.000000",40675881,"4b5bc58c-30f4-ea11-b882-24ee9a37d45c","Brooklyn",882450002,"-73,862,961.000000",-73862961,"19","P.S. 214 - BROOKLYN","P.S. 214 Michael Friedsam - K214 - K214 - 19K214 - 2944 PITKIN AVENUE"
"W/""325861571""","Partial Classroom Quarantine",882450001,"6ee63193-a41f-ec11-b6e6-001dd8305f31","10/4/2021","2021-10-04T04:00:00Z","052868","9/28/2021","2021-09-28T04:00:00Z","1801 AVENUE Y","40,591,103.000000",40591103,"a583ff9e-30f4-ea11-b882-24ee9a37d45c","Brooklyn",882450002,"-73,951,550.000000",-73951550,"22","P.S. 254 - BROOKLYN","P.S. 254 Dag Hammarskjold - K254 - K254 - 22K254 - 1801 AVENUE Y"
"W/""325861581""","Classroom Closed",882450000,"ee2c2a99-a41f-ec11-b6e6-001dd8305f31","10/4/2021","2021-10-04T04:00:00Z","052870","9/28/2021","2021-09-28T04:00:00Z","1801 AVENUE Y","40,591,103.000000",40591103,"a583ff9e-30f4-ea11-b882-24ee9a37d45c","Brooklyn",882450002,"-73,951,550.000000",-73951550,"22","P.S. 254 - BROOKLYN","P.S. 254 Dag Hammarskjold - K254 - K254 - 22K254 - 1801 AVENUE Y"
"W/""325861587""","Classroom Closed",882450000,"042d2a99-a41f-ec11-b6e6-001dd8305f31","10/4/2021","2021-10-04T04:00:00Z","052871","9/28/2021","2021-09-28T04:00:00Z","1801 AVENUE Y","40,591,103.000000",40591103,"a583ff9e-30f4-ea11-b882-24ee9a37d45c","Brooklyn",882450002,"-73,951,550.000000",-73951550,"22","P.S. 254 - BROOKLYN","P.S. 254 Dag Hammarskjold - K254 - K254 - 22K254 - 1801 AVENUE Y"
"W/""325861627""","Non-Classroom Quarantine",882450003,"a914738a-a61f-ec11-b6e6-001dd8305f31","10/3/2021","2021-10-03T04:00:00Z","052893","9/28/2021","2021-09-28T04:00:00Z","320 BEACH 104TH STREET","40,584,543.000000",40584543,"a50e6e25-32f4-ea11-b882-24ee9a37d45c","Queens",882450003,"-73,825,162.000000",-73825162,"27","I.S. 323 (OLD IS 180) - QUEENS","Scholars' Academy - Q323 - Q180 - 27Q323 - 320 BEACH 104TH STREET"
"W/""327144015""","Classroom Closed",882450000,"e642369a-ad1f-ec11-b6e6-001dd8305f31","10/4/2021","2021-10-04T04:00:00Z","052962","9/28/2021","2021-09-28T04:00:00Z","60-02 60 LANE","40,716,296.000000",40716296,"e19b4c1f-32f4-ea11-b882-24ee9a37d45c","Queens",882450003,"-73,904,463.000000",-73904463,"24","P.S. 153 - QUEENS","P.S. 153 Maspeth Elem - Q153 - Q153 - 24Q153 - 60-02 60 LANE"
"W/""325861799""","Partial Classroom Quarantine",882450001,"62b2c9ff-b01f-ec11-b6e6-001dd8305f31","10/4/2021","2021-10-04T04:00:00Z","052988","9/28/2021","2021-09-28T04:00:00Z","144 KEATING PLACE","40,591,480.000000",40591480,"dd8521d0-32f4-ea11-b882-24ee9a37d45c","Staten Island",882450004,"-74,157,327.000000",-74157327,"31","P.S. 69 - STATEN ISLAND","P.S. 069 Daniel D. Tompkins - R069 - R069 - 31R069 - 144 KEATING PLACE"
"W/""325861804""","Partial Classroom Quarantine",882450001,"81b2c9ff-b01f-ec11-b6e6-001dd8305f31","10/4/2021","2021-10-04T04:00:00Z","052989","9/28/2021","2021-09-28T04:00:00Z","144 KEATING PLACE","40,591,480.000000",40591480,"dd8521d0-32f4-ea11-b882-24ee9a37d45c","Staten Island",882450004,"-74,157,327.000000",-74157327,"31","P.S. 69 - STATEN ISLAND","P.S. 069 Daniel D. Tompkins - R069 - R069 - 31R069 - 144 KEATING PLACE"
"W/""325861809""","Partial Classroom Quarantine",882450001,"90b2c9ff-b01f-ec11-b6e6-001dd8305f31","10/4/2021","2021-10-04T04:00:00Z","052990","9/28/2021","2021-09-28T04:00:00Z","144 KEATING PLACE","40,591,480.000000",40591480,"dd8521d0-32f4-ea11-b882-24ee9a37d45c","Staten Island",882450004,"-74,157,327.000000",-74157327,"31","P.S. 69 - STATEN ISLAND","P.S. 069 Daniel D. Tompkins - R069 - R069 - 31R069 - 144 KEATING PLACE"
"W/""327459601""","Classroom Closed",882450000,"72383eb9-bb1f-ec11-b6e6-001dd8305f31","10/3/2021","2021-10-03T04:00:00Z","053063","9/28/2021","2021-09-28T04:00:00Z","545 WILLOUGHBY AVENUE","40,694,470.000000",40694470,"e5968d36-30f4-ea11-b882-24ee9a37d45c","Brooklyn",882450002,"-73,947,256.000000",-73947256,"14","P.S. 23 - BROOKLYN","P.S. 023 Carter G. Woodson - K023 - K023 - 14K023 - 545 WILLOUGHBY AVENUE"
"W/""328863368""","Partial Classroom Quarantine",882450001,"0b52ca16-c11f-ec11-b6e6-001dd8305f31","10/3/2021","2021-10-03T04:00:00Z","053115","9/28/2021","2021-09-28T04:00:00Z","925 ASTOR AVENUE","40,860,443.000000",40860443,"439d7c62-33f4-ea11-b882-24ee9a37d45c","Bronx",882450001,"-73,860,729.000000",-73860729,"11","CHRISTOPHER COLUMBUS HS - X","Collegiate Institute for Math and Science - X288 - X415 - 11X288 - 925 ASTOR AVENUE"
"W/""325862026""","Classroom Closed",882450000,"5b1fafcc-c21f-ec11-b6e6-001dd8305f31","10/4/2021","2021-10-04T04:00:00Z","053131","9/28/2021","2021-09-28T04:00:00Z","19 EAST 103 STREET","40,792,302.000000",40792302,"42005d7a-31f4-ea11-b882-24ee9a37d45c","Manhattan",882450000,"-73,951,425.000000",-73951425,"4","P.S. 171 - MANHATTAN","P.S. 171 Patrick Henry - M171 - M171 - 04M171 - 19 EAST 103 STREET"
"W/""326891702""","Partial Classroom Quarantine",882450001,"5e1de13a-c71f-ec11-b6e6-001dd8305f31","10/7/2021","2021-10-07T04:00:00Z","053166","9/28/2021","2021-09-28T04:00:00Z","237 7 AVENUE","40,669,255.000000",40669255,"929c11e8-30f4-ea11-b882-24ee9a37d45c","Brooklyn",882450002,"-73,978,580.000000",-73978580,"15","John Jay Educational Campus","John Jay School for Law - K462 - K460 - 15K462 - 237 7 AVENUE"
"W/""327199028""","Partial Classroom Quarantine",882450001,"2f5d84cd-5020-ec11-b6e6-001dd8305f31","10/7/2021","2021-10-07T04:00:00Z","053210","9/29/2021","2021-09-29T04:00:00Z","150 WEST 105 STREET","40,799,098.000000",40799098,"4a9f4974-31f4-ea11-b882-24ee9a37d45c","Manhattan",882450000,"-73,965,611.000000",-73965611,"3","P.S. 145 - MANHATTAN","West Prep Academy - M421 - M145 - 03M421 - 150 WEST 105 STREET"
"W/""328525974""","Partial Classroom Quarantine",882450001,"34c58823-5420-ec11-b6e6-001dd8305f31","10/7/2021","2021-10-07T04:00:00Z","053217","9/29/2021","2021-09-29T04:00:00Z","100 LUTEN AVENUE","40,528,152.000000",40528152,"605b4cd6-32f4-ea11-b882-24ee9a37d45c","Staten Island",882450004,"-74,193,431.000000",-74193431,"31","TOTTENVILLE HS - S. I.","Tottenville High School - R455 - R455 - 31R455 - 100 LUTEN AVENUE"
"W/""327683811""","Partial Classroom Quarantine",882450001,"d590814a-5520-ec11-b6e6-001dd8305f31","10/3/2021","2021-10-03T04:00:00Z","053221","9/29/2021","2021-09-29T04:00:00Z","21 JUMEL PLACE","40,839,139.000000",40839139,"2ce61462-31f4-ea11-b882-24ee9a37d45c","Manhattan",882450000,"-73,935,815.000000",-73935815,"6","I.S. 90 - MANHATTAN","M.S. 319 - Maria Teresa - M319 - M090 - 06M319 - 21 JUMEL PLACE"
"W/""327199103""","Partial Classroom Quarantine",882450001,"6eb7a643-5920-ec11-b6e6-001dd8305f31","10/7/2021","2021-10-07T04:00:00Z","053233","9/29/2021","2021-09-29T04:00:00Z","220 HENRY STREET","40,713,362.000000",40713362,"affab455-31f4-ea11-b882-24ee9a37d45c","Manhattan",882450000,"-73,986,051.000000",-73986051,"1","J.H.S. 56 - MANHATTAN","Manhattan Charter School II - M080 - M056 - 84M080 - 220 HENRY STREET"
"W/""328091417""","Classroom Closed",882450000,"b82a8059-5d20-ec11-b6e6-001dd8305f31","10/7/2021","2021-10-07T04:00:00Z","053244","9/30/2021","2021-09-30T04:00:00Z","88-08 164TH STREET","40,708,698.000000",40708698,"d5454b50-32f4-ea11-b882-24ee9a37d45c","Queens",882450003,"-73,797,981.000000",-73797981,"28","P.S./ I.S. 314 - Queens","The Queens School for Leadership and Excellence - Q349 - Q314 - 28Q349 - 88-08 164TH STREET"
"W/""327702960""","Partial Classroom Quarantine",882450001,"f87571f1-5e20-ec11-b6e6-001dd8305f31","10/4/2021","2021-10-04T04:00:00Z","053256","9/29/2021","2021-09-29T04:00:00Z","75-10 21 Avenue","40,769,798.000000",40769798,"93dc32dc-31f4-ea11-b882-24ee9a37d45c","Queens",882450003,"-73,894,108.000000",-73894108,"30","P.S. 2 - QUEENS","P.S. 002 Alfred Zimberg - Q002 - Q002 - 30Q002 - 75-10 21 Avenue"
"W/""327703491""","Partial Classroom Quarantine",882450001,"b5fed9a5-5f20-ec11-b6e6-001dd8305f31","10/4/2021","2021-10-04T04:00:00Z","053265","9/29/2021","2021-09-29T04:00:00Z","75-10 21 Avenue","40,769,798.000000",40769798,"93dc32dc-31f4-ea11-b882-24ee9a37d45c","Queens",882450003,"-73,894,108.000000",-73894108,"30","P.S. 2 - QUEENS","P.S. 002 Alfred Zimberg - Q002 - Q002 - 30Q002 - 75-10 21 Avenue"
"W/""327199189""","Non-Classroom Quarantine",882450003,"7d81547a-6120-ec11-b6e6-001dd8305f31","10/7/2021","2021-10-07T04:00:00Z","053276","9/29/2021","2021-09-29T04:00:00Z","525 WEST  50TH STREET","40,765,474.000000",40765474,"f137fba4-31f4-ea11-b882-24ee9a37d45c","Manhattan",882450000,"-73,992,700.000000",-73992700,"2","PARK WEST HS (ECF) - MANHATTAN","Manhattan Bridges High School - M542 - M535 - 02M542 - 525 WEST  50TH STREET"
"W/""327680552""","Partial Classroom Quarantine",882450001,"80329a06-6320-ec11-b6e6-001dd8305f31","10/7/2021","2021-10-07T04:00:00Z","053288","9/29/2021","2021-09-29T04:00:00Z","1400 PENNSYLVANIA AVENUE","40,646,640.000000",40646640,"30a198c3-30f4-ea11-b882-24ee9a37d45c","Brooklyn",882450002,"-73,881,997.000000",-73881997,"19","P.S. 346 - BROOKLYN","P.S. 346 Abe Stark - K346 - K346 - 19K346 - 1400 PENNSYLVANIA AVENUE"
"W/""327199204""","Classroom Closed",882450000,"28d5d426-6420-ec11-b6e6-001dd8305f31","10/4/2021","2021-10-04T04:00:00Z","053294","9/29/2021","2021-09-29T04:00:00Z","2512 Marion Avenue","40,861,316.000000",40861316,"60ffcc6e-33f4-ea11-b882-24ee9a37d45c","Bronx",882450001,"-73,893,236.000000",-73893236,"10","PRE-K CENTER @MARION AVENUE - BRONX","Rose Hill Pre-K Center - X535 - X444 - 10X535 - 2512 Marion Avenue"
"W/""327199245""","Partial Classroom Quarantine",882450001,"1267b213-6920-ec11-b6e6-001dd8305f31","10/4/2021","2021-10-04T04:00:00Z","053332","9/29/2021","2021-09-29T04:00:00Z","470 JACKSON AVENUE","40,811,051.000000",40811051,"7701ce37-33f4-ea11-b882-24ee9a37d45c","Bronx",882450001,"-73,909,363.000000",-73909363,"7","P.S. 754 (OLD IS155) - BRONX","J. M. Rapport School Career Development - X754 - X155 - 75X754 - 470 JACKSON AVENUE"
"W/""327199255""","Partial Classroom Quarantine",882450001,"592d6e6d-6920-ec11-b6e6-001dd8305f31","10/7/2021","2021-10-07T04:00:00Z","053337","9/29/2021","2021-09-29T04:00:00Z","34-65 192 STREET","40,764,884.000000",40764884,"befc24e8-31f4-ea11-b882-24ee9a37d45c","Queens",882450003,"-73,789,365.000000",-73789365,"25","J.H.S. 25 - QUEENS","I.S. 025 Adrien Block - Q025 - Q025 - 25Q025 - 34-65 192 STREET"
"W/""328139751""","Partial Classroom Quarantine",882450001,"4a44f514-6c20-ec11-b6e6-001dd8305f31","10/7/2021","2021-10-07T04:00:00Z","053355","9/30/2021","2021-09-30T04:00:00Z","921 EAST 228TH STREET","40,888,242.000000",40888242,"6ce03d56-33f4-ea11-b882-24ee9a37d45c","Bronx",882450001,"-73,852,714.000000",-73852714,"11","I.S./H.S. 362 - BRONX","Academy for Scholarship and Entrepreneurship: A College Board School - X270 - X362 - 11X270 - 921 EAST 228TH STREET"
"W/""327199290""","Partial Classroom Quarantine",882450001,"ccfcfbb0-6c20-ec11-b6e6-001dd8305f31","10/8/2021","2021-10-08T04:00:00Z","053365","9/29/2021","2021-09-29T04:00:00Z","1840 BOGART AVENUE","40,849,176.000000",40849176,"f777bb9f-33f4-ea11-b882-24ee9a37d45c","Bronx",882450001,"-73,858,769.000000",-73858769,"11","P.S. 83 ANNEX - BRONX","P.S. 083 Donald Hertz - X083 - X981 - 11X083 - 1840 BOGART AVENUE"
"W/""327199305""","Partial Classroom Quarantine",882450001,"d702f248-6e20-ec11-b6e6-001dd8305f31","10/4/2021","2021-10-04T04:00:00Z","053379","9/29/2021","2021-09-29T04:00:00Z","21-21 DITMARS BOULEVARD","40,780,507.000000",40780507,"cb2ff20c-32f4-ea11-b882-24ee9a37d45c","Queens",882450003,"-73,915,785.000000",-73915785,"30","P.S. 122 - QUEENS","P.S. 122 Mamie Fay - Q122 - Q122 - 30Q122 - 21-21 DITMARS BOULEVARD"
"W/""327888529""","Partial Classroom Quarantine",882450001,"0cb13f69-6f20-ec11-b6e6-001dd8305f31","10/3/2021","2021-10-03T04:00:00Z","053388","9/29/2021","2021-09-29T04:00:00Z","1560 PURDY STREET","40,838,759.000000",40838759,"b9689025-33f4-ea11-b882-24ee9a37d45c","Bronx",882450001,"-73,853,203.000000",-73853203,"11","I.S. 127 - BRONX","J.H.S. 127 The Castle Hill - X127 - X127 - 11X127 - 1560 PURDY STREET"
"W/""328143651""","Partial Classroom Quarantine",882450001,"9936d448-7120-ec11-b6e6-001dd8305f31","10/4/2021","2021-10-04T04:00:00Z","053398","9/30/2021","2021-09-30T04:00:00Z","644 Bloomingdale Road","40,541,563.000000",40541563,"d48521d0-32f4-ea11-b882-24ee9a37d45c","Staten Island",882450004,"-74,217,934.000000",-74217934,"31","K.GRIMM SCL FOR LDRSHP&SUSTAINABLTY@SANDY GR -S.I.","The Kathleen Grimm School for Leadership and Sustainability - R062 - R062 - 31R062 - 644 Bloomingdale Road"
"W/""327199346""","Non-Classroom Quarantine",882450003,"e82f875d-7220-ec11-b6e6-001dd8305f31","10/4/2021","2021-10-04T04:00:00Z","053406","9/29/2021","2021-09-29T04:00:00Z","1007 EVERGREEN AVENUE","40,823,941.000000",40823941,"6a01ce37-33f4-ea11-b882-24ee9a37d45c","Bronx",882450001,"-73,880,479.000000",-73880479,"8","P.S. 152 - BRONX","P.S. 152 Evergreen - X152 - X152 - 08X152 - 1007 EVERGREEN AVENUE"
"W/""327237566""","Classroom Closed",882450000,"1607c9e4-7420-ec11-b6e6-001dd8305f31","10/7/2021","2021-10-07T04:00:00Z","053420","9/29/2021","2021-09-29T04:00:00Z","101-24 SEAVIEW AVENUE","40,635,542.000000",40635542,"cd201dab-30f4-ea11-b882-24ee9a37d45c","Brooklyn",882450002,"-73,886,373.000000",-73886373,"18","P.S. 272 - BROOKLYN","P.S. 272 Curtis Estabrook - K272 - K272 - 18K272 - 101-24 SEAVIEW AVENUE"
"W/""327199386""","Classroom Closed",882450000,"4eb8022e-7820-ec11-b6e6-001dd8305f31","10/8/2021","2021-10-08T04:00:00Z","053441","9/29/2021","2021-09-29T04:00:00Z","140 Harvest Avenue","40,627,336.000000",40627336,"ee4e3585-4afb-ea11-b883-24ee9a37d459",,,"-74,109,969.000000",-74109969,"31","Hugs & Kiddies Early Learning Center","Hugs and Kiddies of Staten Island NY LLC - RAIJ - RAIJ -  - 140 Harvest Avenue"
"W/""327199406""","Partial Classroom Quarantine",882450001,"2291be01-7a20-ec11-b6e6-001dd8305f31","10/1/2021","2021-10-01T04:00:00Z","053450","9/29/2021","2021-09-29T04:00:00Z","345 BROOK AVENUE","40,810,314.000000",40810314,"942aa42b-33f4-ea11-b882-24ee9a37d45c","Bronx",882450001,"-73,918,774.000000",-73918774,"7","J.H.S. 222 - BRONX","Academy of Applied Mathematics and Technology - X343 - X139 - 07X343 - 345 BROOK AVENUE"
"W/""328091467""","Partial Classroom Quarantine",882450001,"ee674f04-7b20-ec11-b6e6-001dd8305f31","10/8/2021","2021-10-08T04:00:00Z","053457","9/30/2021","2021-09-30T04:00:00Z","456 WHITE PLAINS ROAD","40,815,043.000000",40815043,"2a2ed53d-33f4-ea11-b882-24ee9a37d45c","Bronx",882450001,"-73,856,070.000000",-73856070,"8","I.S. 174 - BRONX","Archimedes Academy for Math, Science and Technology Applications - X367 - X174 - 08X367 - 456 WHITE PLAINS ROAD"
"W/""327199416""","Partial Classroom Quarantine",882450001,"2fe8321c-7b20-ec11-b6e6-001dd8305f31","10/7/2021","2021-10-07T04:00:00Z","053459","9/29/2021","2021-09-29T04:00:00Z","1110 BOSTON ROAD","40,827,455.000000",40827455,"82e03d56-33f4-ea11-b882-24ee9a37d45c","Bronx",882450001,"-73,903,920.000000",-73903920,"9","MORRIS HS - X","Morris Academy for Collaborative Studies - X297 - X400 - 09X297 - 1110 BOSTON ROAD"
"W/""327199487""","Classroom Closed",882450000,"27b04712-8320-ec11-b6e6-001dd8305f31","10/3/2021","2021-10-03T04:00:00Z","053501","9/29/2021","2021-09-29T04:00:00Z","16 CLARKSON STREET","40,729,052.000000",40729052,"4d0c1bb1-31f4-ea11-b882-24ee9a37d45c","Manhattan",882450000,"-74,006,155.000000",-74006155,"2","CITY-AS-SCHOOL(OLD 95) - MANHATTAN","Home Instruction - M501 - M641 - 75M501 - 250 WEST HOUSTON STREET"
"W/""327199497""","Classroom Closed",882450000,"17f14008-8420-ec11-b6e6-001dd8305f31","10/4/2021","2021-10-04T04:00:00Z","053507","9/29/2021","2021-09-29T04:00:00Z","1400 BENSON AVENUE","40,610,331.000000",40610331,"f521d292-30f4-ea11-b882-24ee9a37d45c","Brooklyn",882450002,"-74,013,585.000000",-74013585,"20","P.S. 229 - BROOKLYN","P.S. 229 Dyker - K229 - K229 - 20K229 - 1400 BENSON AVENUE"
"W/""328180057""","No Intervention",882450002,"da43d034-8520-ec11-b6e6-001dd8305f31","10/1/2021","2021-10-01T04:00:00Z","053516","9/30/2021","2021-09-30T04:00:00Z","4140 HUTCHINSON RIVER PKWAY EA","40,864,073.000000",40864073,"9501ce37-33f4-ea11-b882-24ee9a37d45c","Bronx",882450001,"-73,823,816.000000",-73823816,"11","P.S. 160 - BRONX","P.S. 160 Walt Disney - X160 - X160 - 11X160 - 4140 HUTCHINSON RIVER PKWAY EA"
"W/""328826310""","Partial Classroom Quarantine",882450001,"d86ae890-8620-ec11-b6e6-001dd8305f31","10/7/2021","2021-10-07T04:00:00Z","053528","9/29/2021","2021-09-29T04:00:00Z","1-35 57 Avenue","40,738,864.000000",40738864,"8ca87f90-5a04-ec11-b8b4-24ee9a37d45c",,,"-73,960,836.000000",-73960836,"30","Hunters Point","Hunters Point Elementary School - Q384 - Q375 - 30Q384 - 1-35 57 Avenue"
"W/""327199552""","Partial Classroom Quarantine",882450001,"80ad6a9a-8820-ec11-b6e6-001dd8305f31","10/8/2021","2021-10-08T04:00:00Z","053543","9/29/2021","2021-09-29T04:00:00Z","713 CATON AVENUE","40,647,598.000000",40647598,"4488e6db-30f4-ea11-b882-24ee9a37d45c","Brooklyn",882450002,"-73,973,363.000000",-73973363,"15","P.S./I.S. 437 - BROOKLYN","P.S. 130 The Parkside - K130 - K437 - 15K130 - 713 CATON AVENUE"
"W/""327199577""","Classroom Closed",882450000,"dc52daef-8920-ec11-b6e6-001dd8305f31","10/7/2021","2021-10-07T04:00:00Z","053554","9/29/2021","2021-09-29T04:00:00Z","250 Utica Avenue","40,670,110.000000",40670110,"39217b48-4afb-ea11-b883-24ee9a37d459",,,"-73,931,012.000000",-73931012,"17","BKA of NY LLC","BKA of NY LLC - KCME - KCME -  - 250 Utica Avenue"
"W/""327199587""","Partial Classroom Quarantine",882450001,"284977f7-8a20-ec11-b6e6-001dd8305f31","10/3/2021","2021-10-03T04:00:00Z","053559","9/29/2021","2021-09-29T04:00:00Z","3000 EAST TREMONT AVENUE","40,839,775.000000",40839775,"b556635c-33f4-ea11-b882-24ee9a37d45c","Bronx",882450001,"-73,839,583.000000",-73839583,"11","HERBERT H. LEHMAN HS - X","Schuylerville Preparatory High School - X348 - X405 - 08X348 - 3000 EAST TREMONT AVENUE"
"W/""327682719""","Partial Classroom Quarantine",882450001,"77e71ebf-8c20-ec11-b6e6-001dd8305f31","10/8/2021","2021-10-08T04:00:00Z","053565","9/29/2021","2021-09-29T04:00:00Z","165 BROWN PLACE","40,806,452.000000",40806452,"1803cefa-32f4-ea11-b882-24ee9a37d45c","Bronx",882450001,"-73,921,593.000000",-73921593,"7","P.S. 43 - BRONX","P.S. 043 Jonas Bronck - X043 - X043 - 07X043 - 165 BROWN PLACE"
"W/""327199607""","Partial Classroom Quarantine",882450001,"9cad0caf-8d20-ec11-b6e6-001dd8305f31","10/5/2021","2021-10-05T04:00:00Z","053570","9/29/2021","2021-09-29T04:00:00Z","14-30 BROADWAY","40,765,881.000000",40765881,"81476368-32f4-ea11-b882-24ee9a37d45c","Queens",882450003,"-73,933,907.000000",-73933907,"30","LONG ISLAND CITY HS(NEW)-Q","Long Island City High School - Q450 - Q452 - 30Q450 - 14-30 BROADWAY"
"W/""328144571""","Classroom Closed",882450000,"3907463d-9020-ec11-b6e6-001dd8305f31","10/8/2021","2021-10-08T04:00:00Z","053585","9/29/2021","2021-09-29T04:00:00Z","984 FAILE STREET","40,822,314.000000",40822314,"1f0b210d-33f4-ea11-b882-24ee9a37d45c","Bronx",882450001,"-73,888,948.000000",-73888948,"8","P.S. 75 - BRONX","P.S. 75 School of Research and Discovery - X075 - X075 - 08X075 - 984 FAILE STREET"
"W/""328564234""","Classroom Closed",882450000,"6baca28b-9420-ec11-b6e6-001dd8305f31","10/7/2021","2021-10-07T04:00:00Z","053601","10/1/2021","2021-10-01T04:00:00Z","3415 OLINVILLE AVENUE","40,875,789.000000",40875789,"770a7997-4afb-ea11-b883-24ee9a37d459",,,"-73,868,439.000000",-73868439,"11","MAGGIE ALSTON Day Care, Inc.","Mind-Builders Creative Arts Center - XASO - XAGU -  - 3415 OLINVILLE AVENUE"
"W/""328091533""","Partial Classroom Quarantine",882450001,"2923157a-1621-ec11-b6e6-001dd8305f31","10/7/2021","2021-10-07T04:00:00Z","053614","9/30/2021","2021-09-30T04:00:00Z","419 East  66 Street","40,763,804.000000",40763804,"53507380-31f4-ea11-b882-24ee9a37d45c","Manhattan",882450000,"-73,957,731.000000",-73957731,"2","P.S. 183 - MANHATTAN","P.S. 183 Robert L. Stevenson - M183 - M183 - 02M183 - 419 East  66 Street"
"W/""328091578""","Partial Classroom Quarantine",882450001,"c1b87bbb-1921-ec11-b6e6-001dd8305f31","10/8/2021","2021-10-08T04:00:00Z","053626","9/30/2021","2021-09-30T04:00:00Z","120-45 235 Street","40,684,987.000000",40684987,"990e6e25-32f4-ea11-b882-24ee9a37d45c","Queens",882450003,"-73,729,226.000000",-73729226,"29","P.S. 176 - QUEENS","P.S. 176 Cambria Heights - Q176 - Q176 - 29Q176 - 120-45 235 Street"
"W/""328091649""","Classroom Closed",882450000,"3cf6a7d7-1c21-ec11-b6e6-001dd8305f31","10/4/2021","2021-10-04T04:00:00Z","053644","9/30/2021","2021-09-30T04:00:00Z","2950 WEST  25 STREET","40,574,029.000000",40574029,"79283fb1-30f4-ea11-b882-24ee9a37d45c","Brooklyn",882450002,"-73,992,393.000000",-73992393,"21","P.S. 288 - BROOKLYN","P.S. 288 The Shirley Tanyhill - K288 - K288 - 21K288 - 2950 WEST  25 STREET"
"W/""328091654""","Partial Classroom Quarantine",882450001,"9847e543-1d21-ec11-b6e6-001dd8305f31","10/8/2021","2021-10-08T04:00:00Z","053645","9/30/2021","2021-09-30T04:00:00Z","335 EAST 152 STREET","40,819,331.000000",40819331,"ff9dbaee-32f4-ea11-b882-24ee9a37d45c","Bronx",882450001,"-73,919,634.000000",-73919634,"7","P.S. 1 - BRONX","P.S. 001 Courtlandt School - X001 - X001 - 07X001 - 335 EAST 152 STREET"
"W/""328091684""","Partial Classroom Quarantine",882450001,"6ae20509-2021-ec11-b6e6-001dd8305f31","10/4/2021","2021-10-04T04:00:00Z","053657","9/30/2021","2021-09-30T04:00:00Z","790 EAST NEW YORK AVENUE","40,662,092.000000",40662092,"2ae2abc9-30f4-ea11-b882-24ee9a37d45c","Brooklyn",882450002,"-73,936,313.000000",-73936313,"17","I.S. 391 - BROOKLYN","Achievement First Crown Heights Charter School - K356 - K391 - 84K356 - 790 EAST NEW YORK AVENUE"
"W/""328682492""","Classroom Closed",882450000,"018700fb-2221-ec11-b6e6-001dd8305f31","10/9/2021","2021-10-09T04:00:00Z","053667","9/30/2021","2021-09-30T04:00:00Z","54-25 SKILLMAN AVENUE","40,746,127.000000",40746127,"fff22ce2-31f4-ea11-b882-24ee9a37d45c","Queens",882450003,"-73,909,032.000000",-73909032,"30","P.S. 11 - QUEENS","P.S. 011 Kathryn Phelan - Q011 - Q011 - 30Q011 - 54-25 SKILLMAN AVENUE"
"W/""328091720""","Partial Classroom Quarantine",882450001,"6d27542b-2321-ec11-b6e6-001dd8305f31","10/4/2021","2021-10-04T04:00:00Z","053669","9/30/2021","2021-09-30T04:00:00Z","64-35 102 STREET","40,731,016.000000",40731016,"960e6e25-32f4-ea11-b882-24ee9a37d45c","Queens",882450003,"-73,852,210.000000",-73852210,"28","P.S. 175 - QUEENS","P.S. 175 The Lynn Gross Discovery School - Q175 - Q175 - 28Q175 - 64-35 102 STREET"
"W/""328745015""","No Intervention",882450002,"12825f31-2321-ec11-b6e6-001dd8305f31","10/1/2021","2021-10-01T04:00:00Z","053670","9/30/2021","2021-09-30T04:00:00Z","64-35 102 STREET","40,731,016.000000",40731016,"960e6e25-32f4-ea11-b882-24ee9a37d45c","Queens",882450003,"-73,852,210.000000",-73852210,"28","P.S. 175 - QUEENS","P.S. 175 The Lynn Gross Discovery School - Q175 - Q175 - 28Q175 - 64-35 102 STREET"
"W/""328233042""","Partial Classroom Quarantine",882450001,"e2a0998b-2321-ec11-b6e6-001dd8305f31","10/7/2021","2021-10-07T04:00:00Z","053672","9/30/2021","2021-09-30T04:00:00Z","21-21 DITMARS BOULEVARD","40,780,507.000000",40780507,"cb2ff20c-32f4-ea11-b882-24ee9a37d45c","Queens",882450003,"-73,915,785.000000",-73915785,"30","P.S. 122 - QUEENS","P.S. 122 Mamie Fay - Q122 - Q122 - 30Q122 - 21-21 DITMARS BOULEVARD"
"W/""328091800""","Partial Classroom Quarantine",882450001,"973a77af-2721-ec11-b6e6-001dd8305f31","10/1/2021","2021-10-01T04:00:00Z","053705","9/30/2021","2021-09-30T04:00:00Z","100 NOLL STREET","40,701,107.000000",40701107,"d7d27c6d-30f4-ea11-b882-24ee9a37d45c","Brooklyn",882450002,"-73,932,388.000000",-73932388,"32","P.S. 145 - BROOKLYN","P.S. 145 Andrew Jackson - K145 - K145 - 32K145 - 100 NOLL STREET"
"W/""328091831""","Partial Classroom Quarantine",882450001,"d4974330-2921-ec11-b6e6-001dd8305f31","10/4/2021","2021-10-04T04:00:00Z","053721","9/30/2021","2021-09-30T04:00:00Z","1186 Carroll Street","40,666,790.000000",40666790,"e33159fa-30f4-ea11-b882-24ee9a37d45c","Brooklyn",882450002,"-73,951,823.000000",-73951823,"17","MIDDLE COLLEGE HS - BROOKLYN","Medgar Evers College Preparatory School - K590 - K590 - 17K590 - 1186 Carroll Street"
"W/""328091856""","Partial Classroom Quarantine",882450001,"77b0c063-2a21-ec11-b6e6-001dd8305f31","10/7/2021","2021-10-07T04:00:00Z","053726","9/30/2021","2021-09-30T04:00:00Z","105 East 106th Street","40,792,932.000000",40792932,"d4ed94c3-31f4-ea11-b882-24ee9a37d45c","Manhattan",882450000,"-73,947,171.000000",-73947171,"4","YOUNG WOMEN'S LEADERSHIP HS - M","Young Women's Leadership School - M610 - M895 - 04M610 - 105 East 106th Street"
"W/""328544083""","Classroom Closed",882450000,"8880470a-3221-ec11-b6e6-001dd8305f31","10/3/2021","2021-10-03T04:00:00Z","053767","9/30/2021","2021-09-30T04:00:00Z","2756 RESERVOIR AVENUE","40,869,061.000000",40869061,"19474313-33f4-ea11-b882-24ee9a37d45c","Bronx",882450001,"-73,897,066.000000",-73897066,"10","P.S. 86 - BRONX","P.S. 086 Kingsbridge Heights - X086 - X086 - 10X086 - 2756 RESERVOIR AVENUE"
"W/""328584390""","Classroom Closed",882450000,"08e7041e-3321-ec11-b6e6-001dd8305f31","10/3/2021","2021-10-03T04:00:00Z","053774","9/30/2021","2021-09-30T04:00:00Z","545 WILLOUGHBY AVENUE","40,694,470.000000",40694470,"e5968d36-30f4-ea11-b882-24ee9a37d45c","Brooklyn",882450002,"-73,947,256.000000",-73947256,"14","P.S. 23 - BROOKLYN","P.S. 023 Carter G. Woodson - K023 - K023 - 14K023 - 545 WILLOUGHBY AVENUE"
"W/""328092017""","Non-Classroom Quarantine",882450003,"1a1aeb0f-3521-ec11-b6e6-001dd8305f31","10/4/2021","2021-10-04T04:00:00Z","053791","9/30/2021","2021-09-30T04:00:00Z","2225 WEBSTER AVENUE","40,854,257.000000",40854257,"8e2aa42b-33f4-ea11-b882-24ee9a37d45c","Bronx",882450001,"-73,897,404.000000",-73897404,"10","I.S. 391 (UDC) - BRONX","The Angelo Patri Middle School - X391 - X137 - 10X391 - 2225 WEBSTER AVENUE"
"W/""328684440""","Partial Classroom Quarantine",882450001,"fddac093-3a21-ec11-b6e6-001dd8305f31","10/8/2021","2021-10-08T04:00:00Z","053823","10/1/2021","2021-10-01T04:00:00Z","30-14 30 STREET","40,766,898.000000",40766898,"1506003e-32f4-ea11-b882-24ee9a37d45c","Queens",882450003,"-73,923,044.000000",-73923044,"30","P.S. 234 - QUEENS","P.S. 234 - Q234 - Q234 - 30Q234 - 30-15 29 STREET"
"W/""328092093""","Classroom Closed",882450000,"baf18b47-3b21-ec11-b6e6-001dd8305f31","10/4/2021","2021-10-04T04:00:00Z","053830","9/30/2021","2021-09-30T04:00:00Z","88-08 164TH STREET","40,708,698.000000",40708698,"d5454b50-32f4-ea11-b882-24ee9a37d45c","Queens",882450003,"-73,797,981.000000",-73797981,"28","P.S./ I.S. 314 - Queens","The Queens School for Leadership and Excellence - Q349 - Q314 - 28Q349 - 88-08 164TH STREET"
"W/""328092128""","Partial Classroom Quarantine",882450001,"28403e5e-3d21-ec11-b6e6-001dd8305f31","10/7/2021","2021-10-07T04:00:00Z","053845","9/30/2021","2021-09-30T04:00:00Z","57-00 223RD STREET","40,752,343.000000",40752343,"86e2635c-32f4-ea11-b882-24ee9a37d45c","Queens",882450003,"-73,757,271.000000",-73757271,"26","BENJAMIN N. CARDOZO HS - Q","Benjamin N. Cardozo High School - Q415 - Q415 - 26Q415 - 57-00 223RD STREET"
"W/""328170543""","Partial Classroom Quarantine",882450001,"58f9053e-4021-ec11-b6e6-001dd8305f31","10/7/2021","2021-10-07T04:00:00Z","053864","9/30/2021","2021-09-30T04:00:00Z","99 TERRACE VIEW AVENUE","40,877,379.000000",40877379,"9853dd74-33f4-ea11-b882-24ee9a37d45c","Bronx",882450001,"-73,912,686.000000",-73912686,"10","JOHN F. KENNEDY HS - X","New Visions Charter High School for the Humanities - X553 - X475 - 84X553 - 99 TERRACE VIEW AVENUE"
"W/""328092180""","Partial Classroom Quarantine",882450001,"834b2c52-4121-ec11-b6e6-001dd8305f31","10/1/2021","2021-10-01T04:00:00Z","053874","9/30/2021","2021-09-30T04:00:00Z","64 WEST 17 STREET","40,739,145.000000",40739145,"e3e0838c-31f4-ea11-b882-24ee9a37d45c","Manhattan",882450000,"-73,995,534.000000",-73995534,"2","THE SIXTH AVENUE EDUCATIONAL CAMPUS - MANHATTAN","Sixth Avenue Elementary School - M340 - M340 - 02M340 - 64 WEST 17 STREET"
"W/""328092210""","Partial Classroom Quarantine",882450001,"2a68b6cc-4221-ec11-b6e6-001dd8305f31","10/7/2021","2021-10-07T04:00:00Z","053882","9/30/2021","2021-09-30T04:00:00Z","64 WEST 17 STREET","40,739,145.000000",40739145,"e3e0838c-31f4-ea11-b882-24ee9a37d45c","Manhattan",882450000,"-73,995,534.000000",-73995534,"2","THE SIXTH AVENUE EDUCATIONAL CAMPUS - MANHATTAN","Sixth Avenue Elementary School - M340 - M340 - 02M340 - 64 WEST 17 STREET"
"W/""328679408""","Partial Classroom Quarantine",882450001,"10a78c0b-4721-ec11-b6e6-001dd8305f31","10/8/2021","2021-10-08T04:00:00Z","053905","9/30/2021","2021-09-30T04:00:00Z","655 PARKSIDE AVENUE","40,656,423.000000",40656423,"dfc1392a-30f4-ea11-b882-24ee9a37d45c","Brooklyn",882450002,"-73,951,575.000000",-73951575,"17","I.S. 2 - BROOKLYN","Parkside Preparatory Academy - K002 - K002 - 17K002 - 655 PARKSIDE AVENUE"
"W/""328092286""","Partial Classroom Quarantine",882450001,"85c08c08-5121-ec11-b6e6-001dd8305f31","10/2/2021","2021-10-02T04:00:00Z","053941","9/30/2021","2021-09-30T04:00:00Z","2800 OCEAN PARKWAY","40,582,627.000000",40582627,"518dbfcf-30f4-ea11-b882-24ee9a37d45c","Brooklyn",882450002,"-73,968,733.000000",-73968733,"21","ABRAHAM LINCOLN HS - K","Abraham Lincoln High School - K410 - K410 - 21K410 - 2800 OCEAN PARKWAY"
"W/""328723416""","Classroom Closed",882450000,"aa0b88dd-5821-ec11-b6e6-001dd8305f31","10/8/2021","2021-10-08T04:00:00Z","053991","10/1/2021","2021-10-01T04:00:00Z","2675 EAST  29 STREET","40,588,372.000000",40588372,"26eabc42-30f4-ea11-b882-24ee9a37d45c","Brooklyn",882450002,"-73,940,135.000000",-73940135,"22","P.S. 52 - BROOKLYN","P.S. 052 Sheepshead Bay - K052 - K052 - 22K052 - 2675 EAST  29 STREET"
"W/""328721498""","Classroom Closed",882450000,"0f2d189f-5a21-ec11-b6e6-001dd8305f31","10/7/2021","2021-10-07T04:00:00Z","054000","9/30/2021","2021-09-30T04:00:00Z","25-05 37 AVENUE","40,757,293.000000",40757293,"c32ff20c-32f4-ea11-b882-24ee9a37d45c","Queens",882450003,"-73,933,562.000000",-73933562,"30","P.S. 112 - QUEENS","P.S. 112 Dutch Kills - Q112 - Q112 - 30Q112 - 25-05 37 AVENUE"
"W/""328724299""","Partial Classroom Quarantine",882450001,"280901b1-5a21-ec11-b6e6-001dd8305f31","10/8/2021","2021-10-08T04:00:00Z","054001","9/30/2021","2021-09-30T04:00:00Z","77 MARSH AVENUE","40,582,791.000000",40582791,"2a0410ca-32f4-ea11-b882-24ee9a37d45c","Staten Island",882450004,"-74,160,867.000000",-74160867,"31","P.S. 58 - STATEN ISLAND","Space Shuttle Columbia School - R058 - R058 - 31R058 - 77 MARSH AVENUE"
"W/""328268475""","Partial Classroom Quarantine",882450001,"021b03e3-5b21-ec11-b6e6-001dd8305f31","10/7/2021","2021-10-07T04:00:00Z","054009","10/1/2021","2021-10-01T04:00:00Z","220 EAST  76 STREET","40,771,541.000000",40771541,"39005d7a-31f4-ea11-b882-24ee9a37d45c","Manhattan",882450000,"-73,957,827.000000",-73957827,"2","I.S. 167 - MANHATTAN","J.H.S. 167 Robert F. Wagner - M167 - M167 - 02M167 - 220 EAST  76 STREET"
"W/""328742064""","Partial Classroom Quarantine",882450001,"fe49e124-5f21-ec11-b6e6-001dd8305f31","10/7/2021","2021-10-07T04:00:00Z","054019","10/1/2021","2021-10-01T04:00:00Z","144-80 BARCLAY AVENUE","40,759,963.000000",40759963,"6b977d2b-32f4-ea11-b882-24ee9a37d45c","Queens",882450003,"-73,818,399.000000",-73818399,"25","J.H.S. 189 - QUEENS","J.H.S. 189 Daniel Carter Beard - Q189 - Q189 - 25Q189 - 144-80 BARCLAY AVENUE"
"W/""328477486""","Partial Classroom Quarantine",882450001,"f5d41034-e221-ec11-b6e6-001dd8305f31","10/9/2021","2021-10-09T04:00:00Z","054033","10/1/2021","2021-10-01T04:00:00Z","74-10 COMMONWEALTH BOULEVARD","40,746,128.000000",40746128,"4aa10a44-32f4-ea11-b882-24ee9a37d45c","Queens",882450003,"-73,728,415.000000",-73728415,"26","P.S./I.S. 266 - QUEENS","P.S./I.S. 266 - Q266 - Q266 - 26Q266 - 74-10 COMMONWEALTH BOULEVARD"
"W/""328274540""","Partial Classroom Quarantine",882450001,"855a7282-e221-ec11-b6e6-001dd8305f31","10/9/2021","2021-10-09T04:00:00Z","054037","10/1/2021","2021-10-01T04:00:00Z","800 EAST GUN HILL ROAD","40,875,172.000000",40875172,"699d7c62-33f4-ea11-b882-24ee9a37d45c","Bronx",882450001,"-73,861,649.000000",-73861649,"11","EVANDER CHILDS HS - X","High School of Computers and Technology - X275 - X425 - 11X275 - 800 EAST GUN HILL ROAD"
"W/""328263998""","Classroom Closed",882450000,"641cac19-e421-ec11-b6e6-001dd8305f31","10/9/2021","2021-10-09T04:00:00Z","054046","10/1/2021","2021-10-01T04:00:00Z","427 38 STREET","40,652,832.000000",40652832,"ed968d36-30f4-ea11-b882-24ee9a37d45c","Brooklyn",882450002,"-74,004,533.000000",-74004533,"15","P.S. 24 - BROOKLYN","P.S. 024 - K024 - K024 - 15K024 - 427 38 STREET"
"W/""328335355""","Partial Classroom Quarantine",882450001,"1e427498-e421-ec11-b6e6-001dd8305f31","10/9/2021","2021-10-09T04:00:00Z","054050","10/1/2021","2021-10-01T04:00:00Z","730 BRYANT AVENUE","40,815,827.000000",40815827,"f9d10307-33f4-ea11-b882-24ee9a37d45c","Bronx",882450001,"-73,885,284.000000",-73885284,"8","I.S. 201 - BRONX","Bronx Academy for Multi-Media - X424 - X074 - 08X424 - 730 BRYANT AVENUE"
"W/""328364921""","Partial Classroom Quarantine",882450001,"f3b6e4e4-e521-ec11-b6e6-001dd8305f31","10/9/2021","2021-10-09T04:00:00Z","054053","10/1/2021","2021-10-01T04:00:00Z","3710 BARNES AVENUE","40,880,649.000000",40880649,"520d6d19-33f4-ea11-b882-24ee9a37d45c","Bronx",882450001,"-73,860,126.000000",-73860126,"11","I.S. 113 - BRONX","Leaders of Tomorrow - X370 - X113 - 11X370 - 3710 BARNES AVENUE"
"W/""328769514""","Non-Classroom Quarantine",882450003,"0f2713d9-e721-ec11-b6e6-001dd8305f31","10/8/2021","2021-10-08T04:00:00Z","054058","10/1/2021","2021-10-01T04:00:00Z","1420 EAST  68 STREET","40,620,537.000000",40620537,"8b03194f-30f4-ea11-b882-24ee9a37d45c","Brooklyn",882450002,"-73,912,914.000000",-73912914,"22","I.S. 78 - BROOKLYN","J.H.S. 078 Roy H. Mann - K078 - K078 - 22K078 - 1420 EAST  68 STREET"
"W/""328767309""","Partial Classroom Quarantine",882450001,"830423ee-ec21-ec11-b6e6-001dd8305f31","10/9/2021","2021-10-09T04:00:00Z","054075","10/1/2021","2021-10-01T04:00:00Z","176 EAST 115 STREET","40,797,205.000000",40797205,"bcfab455-31f4-ea11-b882-24ee9a37d45c","Manhattan",882450000,"-73,941,598.000000",-73941598,"4","P.S. 57 - MANHATTAN","James Weldon Johnson - M057 - M057 - 04M057 - 176 EAST 115 STREET"
"W/""328392269""","No Intervention",882450002,"37b43c08-ee21-ec11-b6e6-001dd8305f31","10/1/2021","2021-10-01T04:00:00Z","054076","9/30/2021","2021-09-30T04:00:00Z","147-36 26 AVENUE","40,774,134.000000",40774134,"adfc24e8-31f4-ea11-b882-24ee9a37d45c","Queens",882450003,"-73,818,581.000000",-73818581,"25","P.S. 21 - QUEENS","P.S. 021 Edward Hart - Q021 - Q021 - 25Q021 - 147-36 26 AVENUE"
"W/""328398585""","Partial Classroom Quarantine",882450001,"98e03c38-ee21-ec11-b6e6-001dd8305f31","10/4/2021","2021-10-04T04:00:00Z","054077","10/1/2021","2021-10-01T04:00:00Z","3000 EAST TREMONT AVENUE","40,839,775.000000",40839775,"b556635c-33f4-ea11-b882-24ee9a37d45c","Bronx",882450001,"-73,839,583.000000",-73839583,"11","HERBERT H. LEHMAN HS - X","Schuylerville Preparatory High School - X348 - X405 - 08X348 - 3000 EAST TREMONT AVENUE"
"W/""328536777""","Partial Classroom Quarantine",882450001,"d5dcd23f-ef21-ec11-b6e6-001dd8305f31","10/4/2021","2021-10-04T04:00:00Z","054081","10/1/2021","2021-10-01T04:00:00Z","3000 EAST TREMONT AVENUE","40,839,775.000000",40839775,"b556635c-33f4-ea11-b882-24ee9a37d45c","Bronx",882450001,"-73,839,583.000000",-73839583,"11","HERBERT H. LEHMAN HS - X","Schuylerville Preparatory High School - X348 - X405 - 08X348 - 3000 EAST TREMONT AVENUE"
"W/""328381096""","Partial Classroom Quarantine",882450001,"61eab589-f021-ec11-b6e6-001dd8305f31","10/4/2021","2021-10-04T04:00:00Z","054085","10/1/2021","2021-10-01T04:00:00Z","3000 EAST TREMONT AVENUE","40,839,775.000000",40839775,"b556635c-33f4-ea11-b882-24ee9a37d45c","Bronx",882450001,"-73,839,583.000000",-73839583,"11","HERBERT H. LEHMAN HS - X","Schuylerville Preparatory High School - X348 - X405 - 08X348 - 3000 EAST TREMONT AVENUE"
"W/""328532264""","Classroom Closed",882450000,"004f8543-f121-ec11-b6e6-001dd8305f31","10/9/2021","2021-10-09T04:00:00Z","054096","10/1/2021","2021-10-01T04:00:00Z","216 CLAWSON STREET","40,573,599.000000",40573599,"0e0410ca-32f4-ea11-b882-24ee9a37d45c","Staten Island",882450004,"-74,108,492.000000",-74108492,"31","P.S. 41 - STATEN ISLAND","DYCD - The Stephanie A. Vierno School - 125500 - 216 Clawson Street"
"W/""328771120""","Partial Classroom Quarantine",882450001,"126c4262-f421-ec11-b6e6-001dd8305f31","10/3/2021","2021-10-03T04:00:00Z","054116","10/1/2021","2021-10-01T04:00:00Z","923 JEROME STREET","40,658,500.000000",40658500,"cb201dab-30f4-ea11-b882-24ee9a37d45c","Brooklyn",882450002,"-73,879,276.000000",-73879276,"19","P.S. 273 - BROOKLYN","P.S. 273 Wortman - K273 - K273 - 19K273 - 923 JEROME STREET"
"W/""328769475""","Classroom Closed",882450000,"77083074-f421-ec11-b6e6-001dd8305f31","10/9/2021","2021-10-09T04:00:00Z","054117","10/1/2021","2021-10-01T04:00:00Z","196-25 PECK AVENUE","40,741,700.000000",40741700,"9c0e6e25-32f4-ea11-b882-24ee9a37d45c","Queens",882450003,"-73,778,118.000000",-73778118,"26","P.S. 179 - QUEENS","P.S. Q004 - Q004 - Q179 - 75Q004 - 196-25 PECK AVENUE"
"W/""328467931""","Classroom Closed",882450000,"014ce621-f721-ec11-b6e6-001dd8305f31","10/9/2021","2021-10-09T04:00:00Z","054123","10/1/2021","2021-10-01T04:00:00Z","545 WILLOUGHBY AVENUE","40,694,470.000000",40694470,"e5968d36-30f4-ea11-b882-24ee9a37d45c","Brooklyn",882450002,"-73,947,256.000000",-73947256,"14","P.S. 23 - BROOKLYN","P.S. 023 Carter G. Woodson - K023 - K023 - 14K023 - 545 WILLOUGHBY AVENUE"
"W/""328492322""","Classroom Closed",882450000,"152bcdf2-fc21-ec11-b6e6-001dd8305f31","10/9/2021","2021-10-09T04:00:00Z","054149","10/1/2021","2021-10-01T04:00:00Z","317 Hoyt Street","40,680,159.000000",40680159,"f41aad3c-30f4-ea11-b882-24ee9a37d45c","Brooklyn",882450002,"-73,991,141.000000",-73991141,"15","P.S. 32 - BROOKLYN","P.S. 032 Samuel Mills Sprole - K032 - K032 - 15K032 - 317 Hoyt Street"
"W/""328498511""","No Intervention",882450002,"3a3b71ca-fd21-ec11-b6e6-001dd8305f31","10/1/2021","2021-10-01T04:00:00Z","054153","9/30/2021","2021-09-30T04:00:00Z","68-10 CENTRAL AVE","40,703,503.000000",40703503,"207eed06-32f4-ea11-b882-24ee9a37d45c","Queens",882450003,"-73,883,995.000000",-73883995,"24","P.S. 91 - QUEENS","P.S. 091 Richard Arkwright - Q091 - Q091 - 24Q091 - 68-10 CENTRAL AVE"
"W/""328527698""","Partial Classroom Quarantine",882450001,"515e1c9e-ff21-ec11-b6e6-001dd8305f31","10/7/2021","2021-10-07T04:00:00Z","054167","10/1/2021","2021-10-01T04:00:00Z","144 KEATING PLACE","40,591,480.000000",40591480,"dd8521d0-32f4-ea11-b882-24ee9a37d45c","Staten Island",882450004,"-74,157,327.000000",-74157327,"31","P.S. 69 - STATEN ISLAND","P.S. 069 Daniel D. Tompkins - R069 - R069 - 31R069 - 144 KEATING PLACE"
"W/""328754321""","Partial Classroom Quarantine",882450001,"d4e57bfd-0222-ec11-b6e6-001dd8305f31","10/7/2021","2021-10-07T04:00:00Z","054184","10/1/2021","2021-10-01T04:00:00Z","470 JACKSON AVENUE","40,811,051.000000",40811051,"7701ce37-33f4-ea11-b882-24ee9a37d45c","Bronx",882450001,"-73,909,363.000000",-73909363,"7","P.S. 754 (OLD IS155) - BRONX","J. M. Rapport School Career Development - X754 - X155 - 75X754 - 470 JACKSON AVENUE"
"W/""328782109""","Classroom Closed",882450000,"9c9fcb7b-0622-ec11-b6e6-001dd8305f31","10/9/2021","2021-10-09T04:00:00Z","054207","10/1/2021","2021-10-01T04:00:00Z","8413 Avenue K","40,634,322.000000",40634322,"dedfede7-49fb-ea11-b883-24ee9a37d459",,,"-73,906,387.000000",-73906387,"18","Little Einsteins Learning Center","Little Einsteins Learning Center - KCIC - KCIC -  - 8413 Avenue K"
"W/""328653404""","Classroom Closed",882450000,"cb89bb8d-0e22-ec11-b6e6-001dd8305f31","10/10/2021","2021-10-10T04:00:00Z","054239","10/1/2021","2021-10-01T04:00:00Z","3117 AVENUE W","40,598,069.000000",40598069,"ecb98b86-30f4-ea11-b882-24ee9a37d45c","Brooklyn",882450002,"-73,934,163.000000",-73934163,"22","P.S. 194 - BROOKLYN","P.S. 194 Raoul Wallenberg - K194 - K194 - 22K194 - 3117 AVENUE W"
"W/""328745799""","No Intervention",882450002,"1bcc228d-1422-ec11-b6e6-001dd8305f31","10/1/2021","2021-10-01T04:00:00Z","054260","9/30/2021","2021-09-30T04:00:00Z","41-15 104 STREET","40,748,996.000000",40748996,"b672c880-32f4-ea11-b882-24ee9a37d45c","Queens",882450003,"-73,860,547.000000",-73860547,"24","P.S. 16 (OLD Q721 SPED) - QUEENS","P.S. Q016 The Nancy DeBenedittis School - Q016 - Q721 - 24Q016 - 41-15 104 STREET"
"W/""328793529""","Partial Classroom Quarantine",882450001,"785e8777-1c22-ec11-b6e6-001dd8305f31","10/9/2021","2021-10-09T04:00:00Z","054296","10/1/2021","2021-10-01T04:00:00Z","465 NEW DORP LANE","40,570,909.000000",40570909,"fb8521d0-32f4-ea11-b882-24ee9a37d45c","Staten Island",882450004,"-74,105,878.000000",-74105878,"31","NEW DORP HS (NEW) - S. I.","New Dorp High School - R440 - R435 - 31R440 - 465 NEW DORP LANE"
"W/""325739815""","Partial Classroom Quarantine",882450001,"4fd32b57-d61e-ec11-b6e6-001dd830657f","10/4/2021","2021-10-04T04:00:00Z","052465","9/27/2021","2021-09-27T04:00:00Z","465 NEW DORP LANE","40,570,909.000000",40570909,"fb8521d0-32f4-ea11-b882-24ee9a37d45c","Staten Island",882450004,"-74,105,878.000000",-74105878,"31","NEW DORP HS (NEW) - S. I.","New Dorp High School - R440 - R435 - 31R440 - 465 NEW DORP LANE"
"W/""324596804""","Classroom Closed",882450000,"0d5bcfaa-da1e-ec11-b6e6-001dd830657f","10/4/2021","2021-10-04T04:00:00Z","052471","9/27/2021","2021-09-27T04:00:00Z","165 BROWN PLACE","40,806,452.000000",40806452,"1803cefa-32f4-ea11-b882-24ee9a37d45c","Bronx",882450001,"-73,921,593.000000",-73921593,"7","P.S. 43 - BRONX","P.S. 043 Jonas Bronck - X043 - X043 - 07X043 - 165 BROWN PLACE"
"W/""324807669""","Classroom Closed",882450000,"edef12fe-dd1e-ec11-b6e6-001dd830657f","10/4/2021","2021-10-04T04:00:00Z","052487","9/27/2021","2021-09-27T04:00:00Z","25-05 37 AVENUE","40,757,293.000000",40757293,"c32ff20c-32f4-ea11-b882-24ee9a37d45c","Queens",882450003,"-73,933,562.000000",-73933562,"30","P.S. 112 - QUEENS","P.S. 112 Dutch Kills - Q112 - Q112 - 30Q112 - 25-05 37 AVENUE"
"W/""324595472""","Classroom Closed",882450000,"11a27877-df1e-ec11-b6e6-001dd830657f","10/2/2021","2021-10-02T04:00:00Z","052492","9/27/2021","2021-09-27T04:00:00Z","1573 MADISON AVENUE","40,793,649.000000",40793649,"98886843-31f4-ea11-b882-24ee9a37d45c","Manhattan",882450000,"-73,948,488.000000",-73948488,"4","I.S. 13 - MANHATTAN","East Harlem Scholars Academy Charter School II - M168 - M013 - 84M168 - 1573 MADISON AVENUE"
"W/""324866148""","Classroom Closed",882450000,"d36bdf06-e01e-ec11-b6e6-001dd830657f","10/2/2021","2021-10-02T04:00:00Z","052499","9/27/2021","2021-09-27T04:00:00Z","1573 MADISON AVENUE","40,793,649.000000",40793649,"98886843-31f4-ea11-b882-24ee9a37d45c","Manhattan",882450000,"-73,948,488.000000",-73948488,"4","I.S. 13 - MANHATTAN","East Harlem Scholars Academy Charter School II - M168 - M013 - 84M168 - 1573 MADISON AVENUE"
"W/""325502216""","Classroom Closed",882450000,"2ad4bbb6-e01e-ec11-b6e6-001dd830657f","10/2/2021","2021-10-02T04:00:00Z","052503","9/27/2021","2021-09-27T04:00:00Z","1573 MADISON AVENUE","40,793,649.000000",40793649,"98886843-31f4-ea11-b882-24ee9a37d45c","Manhattan",882450000,"-73,948,488.000000",-73948488,"4","I.S. 13 - MANHATTAN","East Harlem Scholars Academy Charter School II - M168 - M013 - 84M168 - 1573 MADISON AVENUE"
"W/""324663688""","Classroom Closed",882450000,"3a47f37a-e11e-ec11-b6e6-001dd830657f","10/1/2021","2021-10-01T04:00:00Z","052508","9/27/2021","2021-09-27T04:00:00Z","1573 MADISON AVENUE","40,793,649.000000",40793649,"98886843-31f4-ea11-b882-24ee9a37d45c","Manhattan",882450000,"-73,948,488.000000",-73948488,"4","I.S. 13 - MANHATTAN","East Harlem Scholars Academy Charter School II - M168 - M013 - 84M168 - 1573 MADISON AVENUE"
"W/""324660629""","Classroom Closed",882450000,"477a2727-e21e-ec11-b6e6-001dd830657f","10/2/2021","2021-10-02T04:00:00Z","052512","9/27/2021","2021-09-27T04:00:00Z","1573 MADISON AVENUE","40,793,649.000000",40793649,"98886843-31f4-ea11-b882-24ee9a37d45c","Manhattan",882450000,"-73,948,488.000000",-73948488,"4","I.S. 13 - MANHATTAN","East Harlem Scholars Academy Charter School II - M168 - M013 - 84M168 - 1573 MADISON AVENUE"
"W/""325766847""","Classroom Closed",882450000,"3d2484dc-e21e-ec11-b6e6-001dd830657f","10/3/2021","2021-10-03T04:00:00Z","052515","9/27/2021","2021-09-27T04:00:00Z","1573 MADISON AVENUE","40,793,649.000000",40793649,"98886843-31f4-ea11-b882-24ee9a37d45c","Manhattan",882450000,"-73,948,488.000000",-73948488,"4","I.S. 13 - MANHATTAN","East Harlem Scholars Academy Charter School II - M168 - M013 - 84M168 - 1573 MADISON AVENUE"
"W/""325860766""","Partial Classroom Quarantine",882450001,"5bae2477-e31e-ec11-b6e6-001dd830657f","10/3/2021","2021-10-03T04:00:00Z","052519","9/28/2021","2021-09-28T04:00:00Z","1573 MADISON AVENUE","40,793,649.000000",40793649,"98886843-31f4-ea11-b882-24ee9a37d45c","Manhattan",882450000,"-73,948,488.000000",-73948488,"4","I.S. 13 - MANHATTAN","East Harlem Scholars Academy Charter School II - M168 - M013 - 84M168 - 1573 MADISON AVENUE"
"W/""324595704""","Classroom Closed",882450000,"66c9593d-ee1e-ec11-b6e6-001dd830657f","10/3/2021","2021-10-03T04:00:00Z","052552","9/27/2021","2021-09-27T04:00:00Z","147-36 26 AVENUE","40,774,134.000000",40774134,"adfc24e8-31f4-ea11-b882-24ee9a37d45c","Queens",882450003,"-73,818,581.000000",-73818581,"25","P.S. 21 - QUEENS","P.S. 021 Edward Hart - Q021 - Q021 - 25Q021 - 147-36 26 AVENUE"
"W/""325465784""","Classroom Closed",882450000,"15a8e64c-f41e-ec11-b6e6-001dd830657f","10/1/2021","2021-10-01T04:00:00Z","052565","9/27/2021","2021-09-27T04:00:00Z","330 RUGBY ROAD","40,641,340.000000",40641340,"cad27c6d-30f4-ea11-b882-24ee9a37d45c","Brooklyn",882450002,"-73,965,862.000000",-73965862,"22","P.S. 139 - BROOKLYN","P.S. 139 Alexine A. Fenty - K139 - K139 - 22K139 - 330 RUGBY ROAD"
"W/""324595770""","Classroom Closed",882450000,"ef283941-f61e-ec11-b6e6-001dd830657f","10/3/2021","2021-10-03T04:00:00Z","052573","9/27/2021","2021-09-27T04:00:00Z","2380 MARION AVENUE","40,857,998.000000",40857998,"5145378b-4afb-ea11-b883-24ee9a37d459",,,"-73,895,287.000000",-73895287,"10","ROUND-THE-CLOCK NURSERY, INC.","ROUND-THE-CLOCK NURSERY, INC. - XAPH - XAPH -  - 2380 MARION AVENUE"
"W/""325860982""","Classroom Closed",882450000,"20e17b3e-8d1f-ec11-b6e6-001dd830657f","10/4/2021","2021-10-04T04:00:00Z","052650","9/28/2021","2021-09-28T04:00:00Z","160 Beach   29 Street","40,594,018.600000",40594018.6,"f2725f21-bb09-eb11-b884-24ee9a37d459",,,"-73,761,378.000000",-73761378,"Q043","PS 43 - FY 22","DYCD - PS 43 - FY 22 - 99345-5 - 160 Beach   29 Street"
"W/""327279132""","Partial Classroom Quarantine",882450001,"c65952a8-901f-ec11-b6e6-001dd830657f","10/4/2021","2021-10-04T04:00:00Z","052662","9/28/2021","2021-09-28T04:00:00Z","33-09 35 AVENUE","40,757,497.000000",40757497,"7a0e6e25-32f4-ea11-b882-24ee9a37d45c","Queens",882450003,"-73,926,249.000000",-73926249,"30","P.S. 166 - QUEENS","P.S. 166 Henry Gradstein - Q166 - Q166 - 30Q166 - 33-09 35 AVENUE"
"W/""326852263""","Partial Classroom Quarantine",882450001,"378ab5ae-931f-ec11-b6e6-001dd830657f","10/3/2021","2021-10-03T04:00:00Z","052691","9/28/2021","2021-09-28T04:00:00Z","1-35 57 Avenue","40,738,864.000000",40738864,"8ca87f90-5a04-ec11-b8b4-24ee9a37d45c",,,"-73,960,836.000000",-73960836,"30","Hunters Point","Hunters Point Elementary School - Q384 - Q375 - 30Q384 - 1-35 57 Avenue"
"W/""325861143""","Classroom Closed",882450000,"949defe0-931f-ec11-b6e6-001dd830657f","10/3/2021","2021-10-03T04:00:00Z","052694","9/28/2021","2021-09-28T04:00:00Z","101-33 124 STREET","40,690,439.000000",40690439,"fb9b4c1f-32f4-ea11-b882-24ee9a37d45c","Queens",882450003,"-73,821,080.000000",-73821080,"28","P.S. 161 - QUEENS","P.S. 161 Arthur Ashe School - Q161 - Q161 - 28Q161 - 101-33 124 STREET"
"W/""326858078""","Partial Classroom Quarantine",882450001,"d7eec5e3-941f-ec11-b6e6-001dd830657f","10/4/2021","2021-10-04T04:00:00Z","052699","9/28/2021","2021-09-28T04:00:00Z","160 BEACH  29 STREET","40,593,480.000000",40593480,"ee8442ee-31f4-ea11-b882-24ee9a37d45c","Queens",882450003,"-73,761,086.000000",-73761086,"27","P.S. 43 - QUEENS","P.S. 043 - Q043 - Q043 - 27Q043 - 160 BEACH  29 STREET"
"W/""326946151""","Non-Classroom Quarantine",882450003,"8e4e7065-961f-ec11-b6e6-001dd830657f","10/4/2021","2021-10-04T04:00:00Z","052712","9/28/2021","2021-09-28T04:00:00Z","162-02 HILLSIDE AVENUE","40,708,204.000000",40708204,"39b4977a-32f4-ea11-b882-24ee9a37d45c","Queens",882450003,"-73,799,532.000000",-73799532,"28","AUX. SERV. - JAMAICA LEARN CT - Q","Pathways to Graduation - Q950 - Q595 - 79Q950 - 162-02 HILLSIDE AVENUE"
"W/""325861209""","Non-Classroom Quarantine",882450003,"98cc4312-981f-ec11-b6e6-001dd830657f","10/4/2021","2021-10-04T04:00:00Z","052726","9/28/2021","2021-09-28T04:00:00Z","549 AUDUBON AVENUE","40,856,532.000000",40856532,"25a6ba98-31f4-ea11-b882-24ee9a37d45c","Manhattan",882450000,"-73,926,060.000000",-73926060,"6","G. WASHINGTON HS EDUC. CAMPUS - M","The College Academy - M462 - M465 - 06M462 - 549 AUDUBON AVENUE"
"W/""326856886""","Partial Classroom Quarantine",882450001,"2c25cf92-9a1f-ec11-b6e6-001dd830657f","10/2/2021","2021-10-02T04:00:00Z","052752","9/28/2021","2021-09-28T04:00:00Z","145 STANTON STREET","40,720,040.000000",40720040,"29767649-31f4-ea11-b882-24ee9a37d45c","Manhattan",882450000,"-73,986,038.000000",-73986038,"1","J.H.S. 25 - MANHATTAN","School for Global Leaders - M378 - M025 - 01M378 - 145 STANTON STREET"
"W/""326855731""","Partial Classroom Quarantine",882450001,"c96e7bd0-9a1f-ec11-b6e6-001dd830657f","10/4/2021","2021-10-04T04:00:00Z","052754","9/28/2021","2021-09-28T04:00:00Z","67-25 51 ROAD","40,734,682.000000",40734682,"0106003e-32f4-ea11-b882-24ee9a37d45c","Queens",882450003,"-73,897,108.000000",-73897108,"24","P.S. 229 - QUEENS","P.S. 229 Emanuel Kaplan - Q229 - Q229 - 24Q229 - 67-25 51 ROAD"
"W/""326856258""","Partial Classroom Quarantine",882450001,"9d5fe2fc-9b1f-ec11-b6e6-001dd830657f","10/3/2021","2021-10-03T04:00:00Z","052762","9/28/2021","2021-09-28T04:00:00Z","832 MARCY AVENUE","40,684,654.000000",40684654,"050ae2e1-30f4-ea11-b882-24ee9a37d45c","Brooklyn",882450002,"-73,947,873.000000",-73947873,"13","BOYS HS (OLD) - K","Leadership Prep Bedford Stuyvesant Uncommon Prep Charter School - K517 - K458 - 84K517 - 832 MARCY AVENUE"
"W/""328133718""","Partial Classroom Quarantine",882450001,"df982365-9e1f-ec11-b6e6-001dd830657f","10/1/2021","2021-10-01T04:00:00Z","052788","9/29/2021","2021-09-29T04:00:00Z","99 TERRACE VIEW AVENUE","40,877,379.000000",40877379,"9853dd74-33f4-ea11-b882-24ee9a37d45c","Bronx",882450001,"-73,912,686.000000",-73912686,"10","JOHN F. KENNEDY HS - X","Marble Hill High School for International Studies - X477 - X475 - 10X477 - 99 TERRACE VIEW AVENUE"
"W/""325861420""","Classroom Closed",882450000,"7c011534-9f1f-ec11-b6e6-001dd830657f","10/3/2021","2021-10-03T04:00:00Z","052795","9/28/2021","2021-09-28T04:00:00Z","330 ALABAMA AVENUE","40,667,985.000000",40667985,"0ca198c3-30f4-ea11-b882-24ee9a37d45c","Brooklyn",882450002,"-73,898,249.000000",-73898249,"19","P.S. 328 - BROOKLYN","Hyde Leadership Charter School- Brooklyn - K769 - K328 - 84K769 - 330 ALABAMA AVENUE"
"W/""327679627""","Classroom Closed",882450000,"61753c57-a01f-ec11-b6e6-001dd830657f","10/7/2021","2021-10-07T04:00:00Z","052806","9/28/2021","2021-09-28T04:00:00Z","126-22 150TH STREET","40,672,379.000000",40672379,"4c332a24-4afb-ea11-b883-24ee9a37d459",,,"-73,788,713.000000",-73788713,"27","SUNSHINE DEVELOPMENTAL SCHOOL","Sunshine Developmental School - QANH - QANH -  - 126-22 150TH STREET"
"W/""327198851""","Partial Classroom Quarantine",882450001,"d3907793-a21f-ec11-b6e6-001dd830657f","10/4/2021","2021-10-04T04:00:00Z","052840","9/29/2021","2021-09-29T04:00:00Z","2100 LAFONTAINE AVENUE","40,850,131.000000",40850131,"049ebaee-32f4-ea11-b882-24ee9a37d45c","Bronx",882450001,"-73,891,630.000000",-73891630,"10","P.S. 3 - BRONX","P.S. 3 Raul Julia Micro Society - X003 - X003 - 10X003 - 2100 LAFONTAINE AVENUE"
"W/""327131123""","Partial Classroom Quarantine",882450001,"42e0925b-a31f-ec11-b6e6-001dd830657f","10/2/2021","2021-10-02T04:00:00Z","052852","9/28/2021","2021-09-28T04:00:00Z","1025 MORRISON AVENUE","40,824,989.000000",40824989,"2378931f-33f4-ea11-b882-24ee9a37d45c","Bronx",882450001,"-73,874,162.000000",-73874162,"8","I.S. 123 - BRONX","J.H.S. 123 James M. Kieran - X123 - X123 - 08X123 - 1025 MORRISON AVENUE"
"W/""325861546""","Non-Classroom Quarantine",882450003,"14fc74bd-a31f-ec11-b6e6-001dd830657f","10/4/2021","2021-10-04T04:00:00Z","052858","9/28/2021","2021-09-28T04:00:00Z","48-10 31 AVENUE","40,757,072.000000",40757072,"d8b66262-32f4-ea11-b882-24ee9a37d45c","Queens",882450003,"-73,911,165.000000",-73911165,"30","WILLIAM C. BRYANT HS - Q","William Cullen Bryant High School - Q445 - Q445 - 30Q445 - 48-10 31 AVENUE"
"W/""325861551""","Partial Classroom Quarantine",882450001,"01be13e2-a31f-ec11-b6e6-001dd830657f","10/7/2021","2021-10-07T04:00:00Z","052860","9/28/2021","2021-09-28T04:00:00Z","180 7 AVENUE","40,671,816.000000",40671816,"ade657bd-30f4-ea11-b882-24ee9a37d45c","Brooklyn",882450002,"-73,978,633.000000",-73978633,"15","P.S. 321 - BROOKLYN","P.S. 321 William Penn - K321 - K321 - 15K321 - 180 7 AVENUE"
"W/""325861556""","Partial Classroom Quarantine",882450001,"2ee78f3d-a41f-ec11-b6e6-001dd830657f","10/4/2021","2021-10-04T04:00:00Z","052863","9/28/2021","2021-09-28T04:00:00Z","48-10 31 AVENUE","40,757,072.000000",40757072,"d8b66262-32f4-ea11-b882-24ee9a37d45c","Queens",882450003,"-73,911,165.000000",-73911165,"30","WILLIAM C. BRYANT HS - Q","William Cullen Bryant High School - Q445 - Q445 - 30Q445 - 48-10 31 AVENUE"
"W/""325861612""","Classroom Closed",882450000,"87fc8d1a-a61f-ec11-b6e6-001dd830657f","10/4/2021","2021-10-04T04:00:00Z","052888","9/28/2021","2021-09-28T04:00:00Z","134 WEST 122 STREET","40,806,055.000000",40806055,"459f4974-31f4-ea11-b882-24ee9a37d45c","Manhattan",882450000,"-73,948,385.000000",-73948385,"3","P.S. 242 (OLD P144) - MANHATTAN","P.S. 242 - The Young Diplomats Magnet Academy - M242 - M144 - 03M242 - 134 WEST 122 STREET"
"W/""327134934""","Partial Classroom Quarantine",882450001,"02aa1932-a81f-ec11-b6e6-001dd830657f","10/4/2021","2021-10-04T04:00:00Z","052912","9/28/2021","2021-09-28T04:00:00Z","100 LUTEN AVENUE","40,528,152.000000",40528152,"605b4cd6-32f4-ea11-b882-24ee9a37d45c","Staten Island",882450004,"-74,193,431.000000",-74193431,"31","TOTTENVILLE HS - S. I.","Tottenville High School - R455 - R455 - 31R455 - 100 LUTEN AVENUE"
"W/""327198861""","Partial Classroom Quarantine",882450001,"337758ca-a81f-ec11-b6e6-001dd830657f","10/4/2021","2021-10-04T04:00:00Z","052918","9/29/2021","2021-09-29T04:00:00Z","349 CABRINI BOULEVARD","40,856,239.000000",40856239,"59507380-31f4-ea11-b882-24ee9a37d45c","Manhattan",882450000,"-73,936,840.000000",-73936840,"6","P.S./I.S. 187 - MANHATTAN","P.S./I.S. 187 Hudson Cliffs - M187 - M187 - 06M187 - 349 CABRINI BOULEVARD"
"W/""326025604""","Classroom Closed",882450000,"c7919a45-aa1f-ec11-b6e6-001dd830657f","10/1/2021","2021-10-01T04:00:00Z","052933","9/28/2021","2021-09-28T04:00:00Z","980 MACE AVENUE","40,862,481.000000",40862481,"22474313-33f4-ea11-b882-24ee9a37d45c","Bronx",882450001,"-73,859,254.000000",-73859254,"11","P.S. 89 - BRONX","P.S. 089 Bronx - X089 - X089 - 11X089 - 980 MACE AVENUE"
"W/""327198871""","Partial Classroom Quarantine",882450001,"25199ff1-aa1f-ec11-b6e6-001dd830657f","10/4/2021","2021-10-04T04:00:00Z","052941","9/29/2021","2021-09-29T04:00:00Z","349 CABRINI BOULEVARD","40,856,239.000000",40856239,"59507380-31f4-ea11-b882-24ee9a37d45c","Manhattan",882450000,"-73,936,840.000000",-73936840,"6","P.S./I.S. 187 - MANHATTAN","DYCD - P.S./I.S. 187 Hudson Cliffs - 124305 - 349 CABRINI BOULEVARD"
"W/""327137604""","Classroom Closed",882450000,"adee8671-ac1f-ec11-b6e6-001dd830657f","10/2/2021","2021-10-02T04:00:00Z","052952","9/28/2021","2021-09-28T04:00:00Z","6006 23 AVENUE","40,615,405.000000",40615405,"eb21d292-30f4-ea11-b882-24ee9a37d45c","Brooklyn",882450002,"-73,977,099.000000",-73977099,"21","P.S. 226 - BROOKLYN","P.S. 226 Alfred De B. Mason - K226 - K226 - 21K226 - 6006 23 AVENUE"
"W/""327198897""","Partial Classroom Quarantine",882450001,"36ef49a8-b11f-ec11-b6e6-001dd830657f","10/4/2021","2021-10-04T04:00:00Z","052997","9/29/2021","2021-09-29T04:00:00Z","4812 9TH AVENUE","40,640,997.000000",40640997,"695bc58c-30f4-ea11-b882-24ee9a37d45c","Brooklyn",882450002,"-74,001,250.000000",-74001250,"20","I.S. 220 - BROOKLYN","J.H.S. 220 John J. Pershing - K220 - K220 - 20K220 - 4812 9TH AVENUE"
"W/""327145609""","Partial Classroom Quarantine",882450001,"ff0c2c0a-b21f-ec11-b6e6-001dd830657f","10/4/2021","2021-10-04T04:00:00Z","053002","9/28/2021","2021-09-28T04:00:00Z","2780 RESERVOIR AVENUE","40,869,061.000000",40869061,"a13aa668-33f4-ea11-b882-24ee9a37d45c","Bronx",882450001,"-73,897,066.000000",-73897066,"10","WALTON HS - X","International School for Liberal Arts - X342 - X430 - 10X342 - 2780 RESERVOIR AVENUE"
"W/""327146745""","Partial Classroom Quarantine",882450001,"de75f290-b41f-ec11-b6e6-001dd830657f","10/3/2021","2021-10-03T04:00:00Z","053017","9/28/2021","2021-09-28T04:00:00Z","421 W 219th St","40,871,673.000000",40871673,"f4ed94c3-31f4-ea11-b882-24ee9a37d45c","Manhattan",882450000,"-73,912,339.000000",-73912339,"6","P.S./IS 278 - MANHATTAN","Paula Hedbavny School - M278 - M918 - 06M278 - 421 W 219th St"
"W/""327744965""","Partial Classroom Quarantine",882450001,"c8f320c8-b41f-ec11-b6e6-001dd830657f","10/4/2021","2021-10-04T04:00:00Z","053019","9/29/2021","2021-09-29T04:00:00Z","984 FAILE STREET","40,822,314.000000",40822314,"1f0b210d-33f4-ea11-b882-24ee9a37d45c","Bronx",882450001,"-73,888,948.000000",-73888948,"8","P.S. 75 - BRONX","The Vida Bogart School for All Children - X352 - X075 - 75X352 - 984 FAILE STREET"
"W/""326060107""","Partial Classroom Quarantine",882450001,"f976d222-b51f-ec11-b6e6-001dd830657f","10/4/2021","2021-10-04T04:00:00Z","053021","9/28/2021","2021-09-28T04:00:00Z","800 HOME STREET","40,826,933.000000",40826933,"8601ce37-33f4-ea11-b882-24ee9a37d45c","Bronx",882450001,"-73,900,593.000000",-73900593,"12","I.S. 158 - BRONX","Bronx Career and College Preparatory High School - X479 - X158 - 12X479 - 800 HOME STREET"
"W/""327147071""","Classroom Closed",882450000,"784a5b8a-b81f-ec11-b6e6-001dd830657f","10/7/2021","2021-10-07T04:00:00Z","053038","9/28/2021","2021-09-28T04:00:00Z","538 WEST 55TH STREET","40,768,430.000000",40768430,"e99aeff9-49fb-ea11-b883-24ee9a37d459",,,"-73,991,945.000000",-73991945,"2","YWCA POLLY DODGE EARLY LEARNING CENTER","YWCA POLLY DODGE EARLY LEARNING CENTER - MAUT - MAUT -  - 538 WEST 55TH STREET"
"W/""327198922""","Classroom Closed",882450000,"d22bf96f-ba1f-ec11-b6e6-001dd830657f","10/4/2021","2021-10-04T04:00:00Z","053047","9/29/2021","2021-09-29T04:00:00Z","88-08 164TH STREET","40,708,698.000000",40708698,"d5454b50-32f4-ea11-b882-24ee9a37d45c","Queens",882450003,"-73,797,981.000000",-73797981,"28","P.S./ I.S. 314 - Queens","The Queens School for Leadership and Excellence - Q349 - Q314 - 28Q349 - 88-08 164TH STREET"
"W/""325861975""","Partial Classroom Quarantine",882450001,"e25e4244-be1f-ec11-b6e6-001dd830657f","10/4/2021","2021-10-04T04:00:00Z","053088","9/28/2021","2021-09-28T04:00:00Z","45-57 UNION STREET","40,751,972.000000",40751972,"b6fc24e8-31f4-ea11-b882-24ee9a37d45c","Queens",882450003,"-73,818,100.000000",-73818100,"25","P.S. 24 - QUEENS","P.S. 024 Andrew Jackson - Q024 - Q024 - 25Q024 - 45-57 UNION STREET"
"W/""328188447""","Classroom Closed",882450000,"faaa4bd7-c61f-ec11-b6e6-001dd830657f","10/4/2021","2021-10-04T04:00:00Z","053160","9/30/2021","2021-09-30T04:00:00Z","12 PEARL STREET","40,627,539.000000",40627539,"90e55380-49fb-ea11-b883-24ee9a37d459",,,"-74,084,951.000000",-74084951,"31","12 PEARL STREET","APRIL OROZCO GRISALES - FL1 - RAHM - RAFB -  - 12 PEARL STREET"
"W/""325862106""","Partial Classroom Quarantine",882450001,"6736d119-c81f-ec11-b6e6-001dd830657f","10/3/2021","2021-10-03T04:00:00Z","053172","9/28/2021","2021-09-28T04:00:00Z","50 AVENUE X","40,588,070.000000",40588070,"05fc3df4-30f4-ea11-b882-24ee9a37d45c","Brooklyn",882450002,"-73,981,925.000000",-73981925,"21","JOHN DEWEY HS - K","John Dewey High School - K540 - K540 - 21K540 - 50 AVENUE X"
"W/""327199008""","Classroom Closed",882450000,"f2ea6513-4f20-ec11-b6e6-001dd830657f","10/4/2021","2021-10-04T04:00:00Z","053204","9/29/2021","2021-09-29T04:00:00Z","3010 Briggs Avenue","40,872,611.414500",40872611.4145,"e2e1350f-bb09-eb11-b884-24ee9a37d459",,,"-73,883,574.372504",-73883574.372504,"X008","PS 8 Isaac Varian","DYCD - PS 8 Isaac Varian - 99313-2 - 3010 Briggs Avenue"
"W/""328562414""","Classroom Closed",882450000,"99319abe-6320-ec11-b6e6-001dd830657f","10/3/2021","2021-10-03T04:00:00Z","053292","9/30/2021","2021-09-30T04:00:00Z","69-01 34TH AVENUE","40,752,773.000000",40752773,"abeb6056-32f4-ea11-b882-24ee9a37d45c","Queens",882450003,"-73,896,705.000000",-73896705,"30","P.S. 398 - QUEENS","The Hector Figueroa School - Q398 - Q398 - 30Q398 - 69-01 34TH AVENUE"
"W/""327199250""","Partial Classroom Quarantine",882450001,"63ed5444-6920-ec11-b6e6-001dd830657f","10/7/2021","2021-10-07T04:00:00Z","053335","9/29/2021","2021-09-29T04:00:00Z","1400 PENNSYLVANIA AVENUE","40,646,640.000000",40646640,"30a198c3-30f4-ea11-b882-24ee9a37d45c","Brooklyn",882450002,"-73,881,997.000000",-73881997,"19","P.S. 346 - BROOKLYN","P.S. 346 Abe Stark - K346 - K346 - 19K346 - 1400 PENNSYLVANIA AVENUE"
"W/""328091442""","Partial Classroom Quarantine",882450001,"fd0b32ee-6c20-ec11-b6e6-001dd830657f","10/3/2021","2021-10-03T04:00:00Z","053367","9/30/2021","2021-09-30T04:00:00Z","101-01 ROCKAWAY BOULEVARD","40,680,065.000000",40680065,"6abc9674-32f4-ea11-b882-24ee9a37d45c","Queens",882450003,"-73,838,616.000000",-73838616,"27","JOHN ADAMS HS - QUEENS","John Adams High School - Q480 - Q480 - 27Q480 - 101-01 ROCKAWAY BOULEVARD"
"W/""327199300""","Partial Classroom Quarantine",882450001,"2d6a1421-6e20-ec11-b6e6-001dd830657f","10/3/2021","2021-10-03T04:00:00Z","053377","9/29/2021","2021-09-29T04:00:00Z","101-01 ROCKAWAY BOULEVARD","40,680,065.000000",40680065,"6abc9674-32f4-ea11-b882-24ee9a37d45c","Queens",882450003,"-73,838,616.000000",-73838616,"27","JOHN ADAMS HS - QUEENS","John Adams High School - Q480 - Q480 - 27Q480 - 101-01 ROCKAWAY BOULEVARD"
"W/""328073971""","Partial Classroom Quarantine",882450001,"76fae8ab-7b20-ec11-b6e6-001dd830657f","10/7/2021","2021-10-07T04:00:00Z","053461","9/29/2021","2021-09-29T04:00:00Z","4600 BROADWAY","40,860,951.000000",40860951,"978d8486-31f4-ea11-b882-24ee9a37d45c","Manhattan",882450000,"-73,930,082.000000",-73930082,"6","I.S. 218 - MANHATTAN","City College Academy of the Arts - M293 - M218 - 06M293 - 4600 BROADWAY"
"W/""328091478""","Partial Classroom Quarantine",882450001,"f7d829d1-7b20-ec11-b6e6-001dd830657f","10/4/2021","2021-10-04T04:00:00Z","053463","9/30/2021","2021-09-30T04:00:00Z","360 EAST 145 STREET","40,813,612.000000",40813612,"bcbfa431-33f4-ea11-b882-24ee9a37d45c","Bronx",882450001,"-73,920,851.000000",-73920851,"7","J.H.S. 149 - BRONX","South Bronx Preparatory: A College Board School - X221 - X149 - 07X221 - 360 EAST 145 STREET"
"W/""328029819""","Partial Classroom Quarantine",882450001,"2df53450-7c20-ec11-b6e6-001dd830657f","10/4/2021","2021-10-04T04:00:00Z","053465","9/29/2021","2021-09-29T04:00:00Z","21 JUMEL PLACE","40,839,139.000000",40839139,"2ce61462-31f4-ea11-b882-24ee9a37d45c","Manhattan",882450000,"-73,935,815.000000",-73935815,"6","I.S. 90 - MANHATTAN","M.S. 319 - Maria Teresa - M319 - M090 - 06M319 - 21 JUMEL PLACE"
"W/""327199446""","Partial Classroom Quarantine",882450001,"bacbc658-7e20-ec11-b6e6-001dd830657f","10/8/2021","2021-10-08T04:00:00Z","053472","9/29/2021","2021-09-29T04:00:00Z","8787 24 AVENUE","40,594,648.000000",40594648,"f2201dab-30f4-ea11-b882-24ee9a37d45c","Brooklyn",882450002,"-73,993,565.000000",-73993565,"21","I.S. 281 - BROOKLYN","I.S. 281 Joseph B Cavallaro - K281 - K281 - 21K281 - 8787 24 AVENUE"
"W/""328091483""","Classroom Closed",882450000,"fa2192c4-8020-ec11-b6e6-001dd830657f","10/8/2021","2021-10-08T04:00:00Z","053483","9/30/2021","2021-09-30T04:00:00Z","60-02 60 LANE","40,716,296.000000",40716296,"e19b4c1f-32f4-ea11-b882-24ee9a37d45c","Queens",882450003,"-73,904,463.000000",-73904463,"24","P.S. 153 - QUEENS","P.S. 153 Maspeth Elem - Q153 - Q153 - 24Q153 - 60-02 60 LANE"
"W/""327709755""","Partial Classroom Quarantine",882450001,"c3791a50-8120-ec11-b6e6-001dd830657f","10/7/2021","2021-10-07T04:00:00Z","053485","9/29/2021","2021-09-29T04:00:00Z","111 EAST  33RD STREET","40,746,510.000000",40746510,"a0d810ab-31f4-ea11-b882-24ee9a37d45c","Manhattan",882450000,"-73,981,070.000000",-73981070,"2","NORMAN THOMAS HS (ECF) - MANHATTAN","Success Academy Charter School - Harlem 3 - M385 - M620 - 84M385 - 111 EAST  33RD STREET"
"W/""327947347""","Partial Classroom Quarantine",882450001,"2a2b15ff-8120-ec11-b6e6-001dd830657f","10/4/2021","2021-10-04T04:00:00Z","053494","9/29/2021","2021-09-29T04:00:00Z","111 EAST  33RD STREET","40,746,510.000000",40746510,"a0d810ab-31f4-ea11-b882-24ee9a37d45c","Manhattan",882450000,"-73,981,070.000000",-73981070,"2","NORMAN THOMAS HS (ECF) - MANHATTAN","Success Academy Charter School - Harlem 1 - M351 - M620 - 84M351 - 111 EAST  33RD STREET"
"W/""327684948""","Partial Classroom Quarantine",882450001,"728e0f0a-8520-ec11-b6e6-001dd830657f","10/3/2021","2021-10-03T04:00:00Z","053514","9/29/2021","2021-09-29T04:00:00Z","225 ADELPHI STREET","40,690,742.000000",40690742,"d1968d36-30f4-ea11-b882-24ee9a37d45c","Brooklyn",882450002,"-73,970,896.000000",-73970896,"13","P.S. 20 - BROOKLYN","P.S. 020 Clinton Hill - K020 - K020 - 13K020 - 225 ADELPHI STREET"
"W/""328590445""","Partial Classroom Quarantine",882450001,"46593dda-1521-ec11-b6e6-001dd830657f","10/8/2021","2021-10-08T04:00:00Z","053612","9/30/2021","2021-09-30T04:00:00Z","154-60 17 AVENUE","40,783,231.000000",40783231,"8a977d2b-32f4-ea11-b882-24ee9a37d45c","Queens",882450003,"-73,806,990.000000",-73806990,"25","J.H.S. 194 - QUEENS","J.H.S. 194 William Carr - Q194 - Q194 - 25Q194 - 154-60 17 AVENUE"
"W/""328091568""","Classroom Closed",882450000,"d173b66d-1821-ec11-b6e6-001dd830657f","10/7/2021","2021-10-07T04:00:00Z","053622","9/30/2021","2021-09-30T04:00:00Z","984 FAILE STREET","40,822,314.000000",40822314,"1f0b210d-33f4-ea11-b882-24ee9a37d45c","Bronx",882450001,"-73,888,948.000000",-73888948,"8","P.S. 75 - BRONX","The Vida Bogart School for All Children - X352 - X075 - 75X352 - 984 FAILE STREET"
"W/""328091599""","Classroom Closed",882450000,"48ef7b3b-1a21-ec11-b6e6-001dd830657f","10/4/2021","2021-10-04T04:00:00Z","053632","9/30/2021","2021-09-30T04:00:00Z","89-14 PARSONS BOULEVARD","40,705,525.000000",40705525,"99eb6056-32f4-ea11-b882-24ee9a37d45c","Queens",882450003,"-73,802,503.000000",-73802503,"28","PRE-K CENTER @ 89-14 PARSONS BOULEVARD - QUEENS","The Ezra Jack Keats Pre-K Center - Q335 - Q382 - 28Q335 - 89-14 PARSONS BOULEVARD"
"W/""328091836""","Partial Classroom Quarantine",882450001,"c7349d87-2921-ec11-b6e6-001dd830657f","10/7/2021","2021-10-07T04:00:00Z","053722","9/30/2021","2021-09-30T04:00:00Z","240 EAST 172 STREET","40,839,307.000000",40839307,"c856635c-33f4-ea11-b882-24ee9a37d45c","Bronx",882450001,"-73,911,366.000000",-73911366,"9","WILLIAM H. TAFT HS - X","Claremont International HS - X564 - X410 - 09X564 - 240 EAST 172 STREET"
"W/""328091942""","Partial Classroom Quarantine",882450001,"0baa90ee-3021-ec11-b6e6-001dd830657f","10/8/2021","2021-10-08T04:00:00Z","053759","9/30/2021","2021-09-30T04:00:00Z","401 WEST 164 STREET","40,836,982.000000",40836982,"2a005d7a-31f4-ea11-b882-24ee9a37d45c","Manhattan",882450000,"-73,937,263.000000",-73937263,"6","I.S. 164 - MANHATTAN","WHIN Music Community Charter School - M338 - M164 - 84M338 - 401 WEST 164 STREET"
"W/""328091982""","Classroom Closed",882450000,"46343fb0-3321-ec11-b6e6-001dd830657f","10/9/2021","2021-10-09T04:00:00Z","053776","9/30/2021","2021-09-30T04:00:00Z","36-36 10 Street","40,760,862.000000",40760862,"d2e8ce00-32f4-ea11-b882-24ee9a37d45c","Queens",882450003,"-73,941,630.000000",-73941630,"30","P.S. 76 - QUEENS","P.S. 076 William Hallet - Q076 - Q076 - 30Q076 - 36-36 10 Street"
"W/""328092108""","Partial Classroom Quarantine",882450001,"56cd5ecc-3b21-ec11-b6e6-001dd830657f","10/7/2021","2021-10-07T04:00:00Z","053833","9/30/2021","2021-09-30T04:00:00Z","164 bruckner boulevard","40,803,052.000000",40803052,"a0845cb8-33f4-ea11-b882-24ee9a37d45c","Bronx",882450001,"-73,918,037.000000",-73918037,"7","SOUTH BRONX CHARTER SCHOOL","South Bronx Charter School for International Cultures and the Arts - X309 - XAXD - 84X309 - 164 bruckner boulevard"
"W/""328092220""","Partial Classroom Quarantine",882450001,"c3910fc9-4321-ec11-b6e6-001dd830657f","10/9/2021","2021-10-09T04:00:00Z","053887","9/30/2021","2021-09-30T04:00:00Z","2111 CROTONA AVENUE","40,848,748.000000",40848748,"6c36d900-33f4-ea11-b882-24ee9a37d45c","Bronx",882450001,"-73,888,987.000000",-73888987,"12","P.S. 57 - BRONX","Frederick Douglass Academy V. Middle School - X273 - X057 - 12X273 - 2111 CROTONA AVENUE"
"W/""328092245""","Non-Classroom Quarantine",882450003,"42848ea9-4721-ec11-b6e6-001dd830657f","10/7/2021","2021-10-07T04:00:00Z","053907","9/30/2021","2021-09-30T04:00:00Z","174-10 67 AVENUE","40,734,097.000000",40734097,"900e6e25-32f4-ea11-b882-24ee9a37d45c","Queens",882450003,"-73,795,651.000000",-73795651,"26","P.S. 173 - QUEENS","P.S. 173 Fresh Meadows - Q173 - Q173 - 26Q173 - 174-10 67 AVENUE"
"W/""328724564""","Classroom Closed",882450000,"7c2a4957-df21-ec11-b6e6-001dd830657f","10/9/2021","2021-10-09T04:00:00Z","054025","10/1/2021","2021-10-01T04:00:00Z","1250 WARD AVENUE","40,830,811.000000",40830811,"230b210d-33f4-ea11-b882-24ee9a37d45c","Bronx",882450001,"-73,877,305.000000",-73877305,"12","P.S. 195 - BRONX","P.S. 195 - X195 - X077 - 12X195 - 1250 WARD AVENUE"
"W/""328726823""","Classroom Closed",882450000,"38e1ea97-e021-ec11-b6e6-001dd830657f","10/9/2021","2021-10-09T04:00:00Z","054030","10/1/2021","2021-10-01T04:00:00Z","984 FAILE STREET","40,822,314.000000",40822314,"1f0b210d-33f4-ea11-b882-24ee9a37d45c","Bronx",882450001,"-73,888,948.000000",-73888948,"8","P.S. 75 - BRONX","The Vida Bogart School for All Children - X352 - X075 - 75X352 - 984 FAILE STREET"
"W/""328730335""","Partial Classroom Quarantine",882450001,"8459fb63-e221-ec11-b6e6-001dd830657f","10/9/2021","2021-10-09T04:00:00Z","054035","10/1/2021","2021-10-01T04:00:00Z","1307 CENTRAL AVENUE","40,607,247.000000",40607247,"30a10a44-32f4-ea11-b882-24ee9a37d45c","Queens",882450003,"-73,748,799.000000",-73748799,"27","P.S. 253 -QUEENS","P.S. 253 - Q253 - Q253 - 27Q253 - 1307 CENTRAL AVENUE"
"W/""328740711""","Classroom Closed",882450000,"2af1016a-e221-ec11-b6e6-001dd830657f","10/9/2021","2021-10-09T04:00:00Z","054036","10/1/2021","2021-10-01T04:00:00Z","1307 CENTRAL AVENUE","40,607,247.000000",40607247,"30a10a44-32f4-ea11-b882-24ee9a37d45c","Queens",882450003,"-73,748,799.000000",-73748799,"27","P.S. 253 -QUEENS","P.S. 253 - Q253 - Q253 - 27Q253 - 1307 CENTRAL AVENUE"
"W/""328767533""","Partial Classroom Quarantine",882450001,"3e8ad5bc-e221-ec11-b6e6-001dd830657f","10/9/2021","2021-10-09T04:00:00Z","054038","10/1/2021","2021-10-01T04:00:00Z","450 PACIFIC STREET","40,684,945.000000",40684945,"061bad3c-30f4-ea11-b882-24ee9a37d45c","Brooklyn",882450002,"-73,982,826.000000",-73982826,"15","P.S. 38 - BROOKLYN","P.S. 038 The Pacific - K038 - K038 - 15K038 - 450 PACIFIC STREET"
"W/""328634392""","Partial Classroom Quarantine",882450001,"db7b3dff-e521-ec11-b6e6-001dd830657f","10/1/2021","2021-10-01T04:00:00Z","054055","10/1/2021","2021-10-01T04:00:00Z","40 IRVING PLACE","40,735,361.000000",40735361,"16a6ba98-31f4-ea11-b882-24ee9a37d45c","Manhattan",882450000,"-73,987,064.000000",-73987064,"2","WASHINGTON IRVING HS - MANHATTAN","The High School For Language And Diplomacy - M399 - M460 - 02M399 - 40 IRVING PLACE"
"W/""328385366""","Partial Classroom Quarantine",882450001,"ead64e55-ea21-ec11-b6e6-001dd830657f","10/2/2021","2021-10-02T04:00:00Z","054068","10/1/2021","2021-10-01T04:00:00Z","333 MIDLAND AVENUE","40,576,728.000000",40576728,"2b7c21b7-32f4-ea11-b882-24ee9a37d45c","Staten Island",882450004,"-74,099,685.000000",-74099685,"31","I.S. 2 - STATEN ISLAND","I.S. R002 George L. Egbert - R002 - R002 - 31R002 - 333 MIDLAND AVENUE"
"W/""328426510""","Classroom Closed",882450000,"64572101-eb21-ec11-b6e6-001dd830657f","10/9/2021","2021-10-09T04:00:00Z","054069","10/1/2021","2021-10-01T04:00:00Z","91 HENDERSON AVENUE","40,641,180.000000",40641180,"97a9d9c3-32f4-ea11-b882-24ee9a37d45c","Staten Island",882450004,"-74,095,454.000000",-74095454,"31","P.S. 373 (OLD P40) - STATEN ISLAND","P.S. R373 - R373 - R040 - 75R373 - 91 HENDERSON AVENUE"
"W/""328429375""","Partial Classroom Quarantine",882450001,"057e22e1-f021-ec11-b6e6-001dd830657f","10/8/2021","2021-10-08T04:00:00Z","054089","10/1/2021","2021-10-01T04:00:00Z","11 CLOVE LAKE PLACE","40,628,291.000000",40628291,"78a9d9c3-32f4-ea11-b882-24ee9a37d45c","Staten Island",882450004,"-74,117,818.000000",-74117818,"31","I.S. 27 - STATEN ISLAND","I.S. 027 Anning S. Prall - R027 - R027 - 31R027 - 11 CLOVE LAKE PLACE"
"W/""328490453""","Partial Classroom Quarantine",882450001,"81bfbc05-f821-ec11-b6e6-001dd830657f","10/10/2021","2021-10-10T04:00:00Z","054124","10/1/2021","2021-10-01T04:00:00Z","411 PEARL STREET","40,711,441.000000",40711441,"e037fba4-31f4-ea11-b882-24ee9a37d45c","Manhattan",882450000,"-74,000,851.000000",-74000851,"2","MURRY BERGTRAUM HS (ECF) - M","The Urban Assembly School for Emergency Management - M135 - M520 - 02M135 - 411 PEARL STREET"
"W/""328750623""","Classroom Closed",882450000,"1e9045b6-f821-ec11-b6e6-001dd830657f","10/9/2021","2021-10-09T04:00:00Z","054128","10/1/2021","2021-10-01T04:00:00Z","261 EAST 163 STREET","40,828,009.000000",40828009,"fd02cefa-32f4-ea11-b882-24ee9a37d45c","Bronx",882450001,"-73,917,705.000000",-73917705,"9","P.S. 35 - BRONX","P.S. 035 Franz Siegel - X035 - X035 - 09X035 - 261 EAST 163 STREET"
"W/""328499500""","Partial Classroom Quarantine",882450001,"072e0f7e-fc21-ec11-b6e6-001dd830657f","10/10/2021","2021-10-10T04:00:00Z","054146","10/1/2021","2021-10-01T04:00:00Z","240 EAST 109 STREET","40,792,556.000000",40792556,"1b6e3d68-31f4-ea11-b882-24ee9a37d45c","Manhattan",882450000,"-73,942,285.000000",-73942285,"4","J.H.S. 117 - MANHATTAN","Esperanza Preparatory Academy - M372 - M117 - 04M372 - 240 EAST 109 STREET"
"W/""328762756""","Classroom Closed",882450000,"d4c43562-ff21-ec11-b6e6-001dd830657f","10/8/2021","2021-10-08T04:00:00Z","054164","10/1/2021","2021-10-01T04:00:00Z","1535 RICHMOND AVENUE","40,610,497.000000",40610497,"f18521d0-32f4-ea11-b882-24ee9a37d45c","Staten Island",882450004,"-74,159,152.000000",-74159152,"31","3K CENTER @ 1535 RICHMOND AVENUE - STATEN ISLAND","The Richmond Pre-K Center - R066 - R090 - 31R066 - 1535 RICHMOND AVENUE"
"W/""328835092""","Partial Classroom Quarantine",882450001,"850cbdce-ff21-ec11-b6e6-001dd830657f","10/4/2021","2021-10-04T04:00:00Z","054169","10/1/2021","2021-10-01T04:00:00Z","3740 BAYCHESTER AVENUE","40,884,371.000000",40884371,"4d0d6d19-33f4-ea11-b882-24ee9a37d45c","Bronx",882450001,"-73,839,288.000000",-73839288,"11","P.S. 111 - BRONX","Bronx Charter School for Better Learning - X718 - X111 - 84X718 - 3740 BAYCHESTER AVENUE"
"W/""328771311""","Partial Classroom Quarantine",882450001,"e74a9933-0122-ec11-b6e6-001dd830657f","10/9/2021","2021-10-09T04:00:00Z","054175","10/1/2021","2021-10-01T04:00:00Z","66-56 FOREST AVENUE","40,705,609.000000",40705609,"0f7eed06-32f4-ea11-b882-24ee9a37d45c","Queens",882450003,"-73,903,057.000000",-73903057,"24","I.S. 93 - QUEENS","I.S. 093 Ridgewood - Q093 - Q093 - 24Q093 - 66-56 FOREST AVENUE"
"W/""328673215""","Partial Classroom Quarantine",882450001,"f1b240a9-0422-ec11-b6e6-001dd830657f","10/9/2021","2021-10-09T04:00:00Z","054195","10/1/2021","2021-10-01T04:00:00Z","4715 18 AVENUE","40,628,800.000000",40628800,"e5b36d80-30f4-ea11-b882-24ee9a37d45c","Brooklyn",882450002,"-73,979,540.000000",-73979540,"20","P.S. 192 - BROOKLYN","P.S. 192 - The Magnet School for Math and Science Inquiry - K192 - K192 - 20K192 - 4715 18 AVENUE"
"W/""328758567""","Partial Classroom Quarantine",882450001,"f92b5b82-0522-ec11-b6e6-001dd830657f","10/9/2021","2021-10-09T04:00:00Z","054199","10/1/2021","2021-10-01T04:00:00Z","4715 18 AVENUE","40,628,800.000000",40628800,"e5b36d80-30f4-ea11-b882-24ee9a37d45c","Brooklyn",882450002,"-73,979,540.000000",-73979540,"20","P.S. 192 - BROOKLYN","P.S. 192 - The Magnet School for Math and Science Inquiry - K192 - K192 - 20K192 - 4715 18 AVENUE"
"W/""328770089""","Classroom Closed",882450000,"fac6c281-0c22-ec11-b6e6-001dd830657f","10/10/2021","2021-10-10T04:00:00Z","054230","10/1/2021","2021-10-01T04:00:00Z","1684 WHITE PLAINS ROAD","40,843,531.000000",40843531,"daba3c50-33f4-ea11-b882-24ee9a37d45c","Bronx",882450001,"-73,865,498.000000",-73865498,"11","P.S. 311 - BRONX","The STEAM Bridge School - X481 - X311 - 11X481 - 1684 WHITE PLAINS ROAD"
"W/""328747481""","No Intervention",882450002,"9bb49598-1422-ec11-b6e6-001dd830657f","10/1/2021","2021-10-01T04:00:00Z","054261","9/30/2021","2021-09-30T04:00:00Z","86-35 235 COURT","40,731,853.000000",40731853,"16f32ce2-31f4-ea11-b882-24ee9a37d45c","Queens",882450003,"-73,732,290.000000",-73732290,"26","P.S. 18 - QUEENS","P.S. 018 Winchester - Q018 - Q018 - 26Q018 - 86-35 235 COURT"
"W/""328781975""","Partial Classroom Quarantine",882450001,"302c1e9d-1722-ec11-b6e6-001dd830657f","10/7/2021","2021-10-07T04:00:00Z","054273","10/1/2021","2021-10-01T04:00:00Z","12-45 CLINTONVILLE STREET","40,790,146.000000",40790146,"4f332a24-4afb-ea11-b883-24ee9a37d459",,,"-73,811,314.000000",-73811314,"25","PEE WEE FOLKS","PEE WEE FOLKS - QAUC - QAUC -  - 12-45 CLINTONVILLE STREET"
"W/""328789150""","Classroom Closed",882450000,"5dfc0ce6-1722-ec11-b6e6-001dd830657f","10/9/2021","2021-10-09T04:00:00Z","054276","10/1/2021","2021-10-01T04:00:00Z","147-36 26 AVENUE","40,774,134.000000",40774134,"adfc24e8-31f4-ea11-b882-24ee9a37d45c","Queens",882450003,"-73,818,581.000000",-73818581,"25","P.S. 21 - QUEENS","P.S. 021 Edward Hart - Q021 - Q021 - 25Q021 - 147-36 26 AVENUE"
"W/""324596878""","Partial Classroom Quarantine",882450001,"55a0b098-d41e-ec11-b6e6-001dd83068fb","10/4/2021","2021-10-04T04:00:00Z","052461","9/27/2021","2021-09-27T04:00:00Z","50 AVENUE X","40,588,070.000000",40588070,"05fc3df4-30f4-ea11-b882-24ee9a37d45c","Brooklyn",882450002,"-73,981,925.000000",-73981925,"21","JOHN DEWEY HS - K","John Dewey High School - K540 - K540 - 21K540 - 50 AVENUE X"
"W/""325737896""","Classroom Closed",882450000,"9e2e9612-d71e-ec11-b6e6-001dd83068fb","10/4/2021","2021-10-04T04:00:00Z","052466","9/27/2021","2021-09-27T04:00:00Z","91-02 88 AVENUE","40,691,467.000000",40691467,"8e8946f4-31f4-ea11-b882-24ee9a37d45c","Queens",882450003,"-73,852,792.000000",-73852792,"27","P.S. 60 - QUEENS","P.S. 060 Woodhaven - Q060 - Q060 - 27Q060 - 91-02 88 AVENUE"
"W/""324595381""","Classroom Closed",882450000,"9085d833-d91e-ec11-b6e6-001dd83068fb","10/4/2021","2021-10-04T04:00:00Z","052470","9/27/2021","2021-09-27T04:00:00Z","5601 16 AVENUE","40,626,454.000000",40626454,"b8b36d80-30f4-ea11-b882-24ee9a37d45c","Brooklyn",882450002,"-73,989,250.000000",-73989250,"20","P.S. 180 - BROOKLYN","P.S. K231 - K231 - K180 - 75K231 - 5601 16 AVENUE"
"W/""328833352""","Classroom Closed",882450000,"04658ff9-df1e-ec11-b6e6-001dd83068fb","10/3/2021","2021-10-03T04:00:00Z","052498","9/27/2021","2021-09-27T04:00:00Z","51 JEFFERSON STREET","40,590,887.000000",40590887,"4efdc1bd-32f4-ea11-b882-24ee9a37d45c","Staten Island",882450004,"-74,098,252.000000",-74098252,"31","P.S. 11 - STATEN ISLAND","P.S. 11 Thomas Dongan School - R011 - R011 - 31R011 - 51 JEFFERSON STREET"
"W/""325761962""","Classroom Closed",882450000,"5c696fbc-e11e-ec11-b6e6-001dd83068fb","10/4/2021","2021-10-04T04:00:00Z","052510","9/27/2021","2021-09-27T04:00:00Z","138-01 77 AVENUE","40,721,514.000000",40721514,"ff9b4c1f-32f4-ea11-b882-24ee9a37d45c","Queens",882450003,"-73,823,569.000000",-73823569,"25","P.S. 164 - QUEENS","P.S. 164 Queens Valley - Q164 - Q164 - 25Q164 - 138-01 77 AVENUE"
"W/""327007805""","Partial Classroom Quarantine",882450001,"f4a6344f-e21e-ec11-b6e6-001dd83068fb","10/4/2021","2021-10-04T04:00:00Z","052514","9/27/2021","2021-09-27T04:00:00Z","111 EAST  33RD STREET","40,746,510.000000",40746510,"a0d810ab-31f4-ea11-b882-24ee9a37d45c","Manhattan",882450000,"-73,981,070.000000",-73981070,"2","NORMAN THOMAS HS (ECF) - MANHATTAN","Manhattan Academy For Arts & Language - M427 - M620 - 02M427 - 111 EAST  33RD STREET"
"W/""327137050""","Classroom Closed",882450000,"10c1b99c-e41e-ec11-b6e6-001dd83068fb","10/3/2021","2021-10-03T04:00:00Z","052527","9/27/2021","2021-09-27T04:00:00Z","725 EAST  23 STREET","40,632,619.000000",40632619,"efd27c6d-30f4-ea11-b882-24ee9a37d45c","Brooklyn",882450002,"-73,954,269.000000",-73954269,"22","P.S. 152 - BROOKLYN","P.S. K315 - K315 - K152 - 22K315 - 2310 GLENWOOD ROAD"
"W/""327142741""","Partial Classroom Quarantine",882450001,"e71247a2-e61e-ec11-b6e6-001dd83068fb","10/4/2021","2021-10-04T04:00:00Z","052533","9/27/2021","2021-09-27T04:00:00Z","544 7TH AVENUE","40,660,805.000000",40660805,"76d92255-30f4-ea11-b882-24ee9a37d45c","Brooklyn",882450002,"-73,988,743.000000",-73988743,"15","I.S. 88 - BROOKLYN","J.H.S. 088 Peter Rouget - K088 - K088 - 15K088 - 544 7TH AVENUE"
"W/""324596943""","Classroom Closed",882450000,"72ac4d77-ea1e-ec11-b6e6-001dd83068fb","10/4/2021","2021-10-04T04:00:00Z","052540","9/27/2021","2021-09-27T04:00:00Z","1075 PUGSLEY AVENUE","40,828,474.000000",40828474,"0f78931f-33f4-ea11-b882-24ee9a37d45c","Bronx",882450001,"-73,857,392.000000",-73857392,"8","P.S. 119 - BRONX","The Dr. Emmett W. Bassett School - X119 - X119 - 08X119 - 1075 PUGSLEY AVENUE"
"W/""325854157""","Partial Classroom Quarantine",882450001,"8d95b899-ed1e-ec11-b6e6-001dd83068fb","10/4/2021","2021-10-04T04:00:00Z","052549","9/27/2021","2021-09-27T04:00:00Z","58-20 UTOPIA PARKWAY","40,740,875.000000",40740875,"bcb66262-32f4-ea11-b882-24ee9a37d45c","Queens",882450003,"-73,795,049.000000",-73795049,"26","FRANCIS LEWIS HS - Q","Francis Lewis High School - Q430 - Q430 - 26Q430 - 58-20 UTOPIA PARKWAY"
"W/""327247556""","Partial Classroom Quarantine",882450001,"60c5ed97-f01e-ec11-b6e6-001dd83068fb","10/4/2021","2021-10-04T04:00:00Z","052556","9/27/2021","2021-09-27T04:00:00Z","100-00 BEACH CHANNEL DRIVE","40,586,012.000000",40586012,"71e2635c-32f4-ea11-b882-24ee9a37d45c","Queens",882450003,"-73,825,317.000000",-73825317,"27","Beach Channel Educational Campus","Rockaway Park High School for Environmental Sustainability - Q324 - Q410 - 27Q324 - 100-00 BEACH CHANNEL DRIVE"
"W/""327666906""","Partial Classroom Quarantine",882450001,"ae434bab-f41e-ec11-b6e6-001dd83068fb","10/4/2021","2021-10-04T04:00:00Z","052566","9/27/2021","2021-09-27T04:00:00Z","800 VAN SICLEN AVE","40,659,934.000000",40659934,"41ebaa73-30f4-ea11-b882-24ee9a37d45c","Brooklyn",882450002,"-73,885,704.000000",-73885704,"19","I.S. 166 - BROOKLYN","Van Siclen Community Middle School - K654 - K166 - 19K654 - 800 VAN SICLEN AVE"
"W/""325406029""","Partial Classroom Quarantine",882450001,"5da1693f-f61e-ec11-b6e6-001dd83068fb","10/4/2021","2021-10-04T04:00:00Z","052572","9/27/2021","2021-09-27T04:00:00Z","150 ALBANY AVENUE","40,675,905.000000",40675905,"23416e00-31f4-ea11-b882-24ee9a37d45c","Brooklyn",882450002,"-73,939,282.000000",-73939282,"17","ROBESON HS COMP&BUS TC (A HML)-K","Pathways in Technology Early College High School (P-Tech) - K122 - K625 - 17K122 - 150 ALBANY AVENUE"
"W/""324597763""","Non-Classroom Quarantine",882450003,"1cf6bfe6-f91e-ec11-b6e6-001dd83068fb","10/3/2021","2021-10-03T04:00:00Z","052578","9/27/2021","2021-09-27T04:00:00Z","105 East 106th Street","40,792,932.000000",40792932,"d4ed94c3-31f4-ea11-b882-24ee9a37d45c","Manhattan",882450000,"-73,947,171.000000",-73947171,"4","YOUNG WOMEN'S LEADERSHIP HS - M","Young Women's Leadership School - M610 - M895 - 04M610 - 105 East 106th Street"
"W/""325137983""","Classroom Closed",882450000,"de5b89b8-fa1e-ec11-b6e6-001dd83068fb","10/3/2021","2021-10-03T04:00:00Z","052581","9/27/2021","2021-09-27T04:00:00Z","425 EAST 35TH STREET","40,744,288.000000",40744288,"cde0838c-31f4-ea11-b882-24ee9a37d45c","Manhattan",882450000,"-73,972,592.000000",-73972592,"2","P.S. 281 - MANHATTAN","The River School - M281 - M281 - 02M281 - 425 EAST 35TH STREET"
"W/""325148147""","Classroom Closed",882450000,"49eee85d-fb1e-ec11-b6e6-001dd83068fb","10/3/2021","2021-10-03T04:00:00Z","052583","9/27/2021","2021-09-27T04:00:00Z","425 EAST 35TH STREET","40,744,288.000000",40744288,"cde0838c-31f4-ea11-b882-24ee9a37d45c","Manhattan",882450000,"-73,972,592.000000",-73972592,"2","P.S. 281 - MANHATTAN","The River School - M281 - M281 - 02M281 - 425 EAST 35TH STREET"
"W/""325760998""","Classroom Closed",882450000,"daea9193-fb1e-ec11-b6e6-001dd83068fb","10/2/2021","2021-10-02T04:00:00Z","052584","9/27/2021","2021-09-27T04:00:00Z","22 East 128 Street","40,807,692.000000",40807692,"dfed94c3-31f4-ea11-b882-24ee9a37d45c","Manhattan",882450000,"-73,939,974.000000",-73939974,"5","HARLEM RENAISSANCE HS (OLD M24)-M","LYFE - M984 - M911 - 79M984 - 22 East 128 Street"
"W/""324595826""","Classroom Closed",882450000,"56c9fcef-fc1e-ec11-b6e6-001dd83068fb","10/4/2021","2021-10-04T04:00:00Z","052589","9/27/2021","2021-09-27T04:00:00Z","109-59 INWOOD STREET","40,688,373.000000",40688373,"ee9b4c1f-32f4-ea11-b882-24ee9a37d45c","Queens",882450003,"-73,799,685.000000",-73799685,"28","P.S. 160 - QUEENS","P.S. 160 Walter Francis Bishop - Q160 - Q160 - 28Q160 - 109-59 INWOOD STREET"
"W/""325860836""","Classroom Closed",882450000,"793022c1-851f-ec11-b6e6-001dd83068fb","10/4/2021","2021-10-04T04:00:00Z","052612","9/28/2021","2021-09-28T04:00:00Z","255 IONIA AVENUE","40,543,433.000000",40543433,"8ba9d9c3-32f4-ea11-b882-24ee9a37d45c","Staten Island",882450004,"-74,182,548.000000",-74182548,"31","P.S. 36 - STATEN ISLAND","P.S. 036 J. C. Drumgoole - R036 - R036 - 31R036 - 255 IONIA AVENUE"
"W/""327112617""","Partial Classroom Quarantine",882450001,"803cee84-861f-ec11-b6e6-001dd83068fb","10/4/2021","2021-10-04T04:00:00Z","052618","9/28/2021","2021-09-28T04:00:00Z","577 EAST 179 STREET","40,848,702.000000",40848702,"0b78931f-33f4-ea11-b882-24ee9a37d45c","Bronx",882450001,"-73,892,482.000000",-73892482,"10","I.S. 118 - BRONX","J.H.S. 118 William W. Niles - X118 - X118 - 10X118 - 577 EAST 179 STREET"
"W/""325860881""","Partial Classroom Quarantine",882450001,"e44240b6-871f-ec11-b6e6-001dd83068fb","10/4/2021","2021-10-04T04:00:00Z","052624","9/28/2021","2021-09-28T04:00:00Z","35 SNYDER AVENUE","40,648,949.000000",40648949,"0e04d718-31f4-ea11-b882-24ee9a37d45c","Brooklyn",882450002,"-73,956,928.000000",-73956928,"17","P.S. 369 AX-(OL 396X/FLTB TN HL)-K","P.S. 373 - Brooklyn Transition Center - K373 - K877 - 75K373 - 35 SNYDER AVENUE"
"W/""326848439""","Partial Classroom Quarantine",882450001,"2262b337-881f-ec11-b6e6-001dd83068fb","10/4/2021","2021-10-04T04:00:00Z","052627","9/28/2021","2021-09-28T04:00:00Z","77-02 37 AVENUE","40,748,804.000000",40748804,"682f77fa-31f4-ea11-b882-24ee9a37d45c","Queens",882450003,"-73,888,457.000000",-73888457,"30","P.S. 69 - QUEENS","P.S. 069 Jackson Heights - Q069 - Q069 - 30Q069 - 77-02 37 AVENUE"
"W/""325860907""","Partial Classroom Quarantine",882450001,"27bb0fa5-881f-ec11-b6e6-001dd83068fb","10/2/2021","2021-10-02T04:00:00Z","052630","9/28/2021","2021-09-28T04:00:00Z","108-10 109 AVENUE","40,679,083.000000",40679083,"b92ff20c-32f4-ea11-b882-24ee9a37d45c","Queens",882450003,"-73,831,025.000000",-73831025,"27","P.S. 108 - QUEENS","P.S. 108 Captain Vincent G. Fowler - Q108 - Q108 - 27Q108 - 108-10 109 AVENUE"
"W/""325860927""","Partial Classroom Quarantine",882450001,"43826221-891f-ec11-b6e6-001dd83068fb","10/4/2021","2021-10-04T04:00:00Z","052634","9/28/2021","2021-09-28T04:00:00Z","257 NORTH  6 STREET","40,715,561.000000",40715561,"29416e00-31f4-ea11-b882-24ee9a37d45c","Brooklyn",882450002,"-73,954,815.000000",-73954815,"14","HARRY VANARSDALE VOC H (WHITNEY)-K","Williamsburg Preparatory School - K561 - K650 - 14K561 - 257 NORTH  6 STREET"
"W/""327675733""","Partial Classroom Quarantine",882450001,"efb852c4-8c1f-ec11-b6e6-001dd83068fb","10/4/2021","2021-10-04T04:00:00Z","052647","9/29/2021","2021-09-29T04:00:00Z","320 EAST  96 STREET","40,783,286.000000",40783286,"570c1bb1-31f4-ea11-b882-24ee9a37d45c","Manhattan",882450000,"-73,945,933.000000",-73945933,"2","OLD MANHATTAN VOC/TECH HS - M","The High School for Climate Justice - M655 - M645 - 02M655 - 320 EAST  96 STREET"
"W/""325860987""","Non-Classroom Quarantine",882450003,"ca1f3b5b-8d1f-ec11-b6e6-001dd83068fb","10/4/2021","2021-10-04T04:00:00Z","052651","9/28/2021","2021-09-28T04:00:00Z","421 EAST 106 STREET","40,789,535.000000",40789535,"4f9f4974-31f4-ea11-b882-24ee9a37d45c","Manhattan",882450000,"-73,938,727.000000",-73938727,"4","P.S. 146 - MANHATTAN","P.S. 146 Ann M. Short - M146 - M146 - 04M146 - 421 EAST 106 STREET"
"W/""327677707""","Partial Classroom Quarantine",882450001,"80a1bc06-911f-ec11-b6e6-001dd83068fb","10/4/2021","2021-10-04T04:00:00Z","052666","9/28/2021","2021-09-28T04:00:00Z","134-01 CRONSTON AVENUE","40,577,552.000000",40577552,"c12ff20c-32f4-ea11-b882-24ee9a37d45c","Queens",882450003,"-73,854,364.000000",-73854364,"27","P.S. 114 - QUEENS","P.S./M.S. 114 Belle Harbor - Q114 - Q114 - 27Q114 - 134-01 CRONSTON AVENUE"
"W/""325861043""","Partial Classroom Quarantine",882450001,"fbd27c33-911f-ec11-b6e6-001dd83068fb","10/4/2021","2021-10-04T04:00:00Z","052667","9/28/2021","2021-09-28T04:00:00Z","500 19 STREET","40,656,952.000000",40656952,"ed201dab-30f4-ea11-b882-24ee9a37d45c","Brooklyn",882450002,"-73,983,116.000000",-73983116,"15","PRE-K CENTER @ 500 19TH STREET - BROOKLYN","M.S. 442 Carroll Gardens School for Innovation - K442 - K280 - 15K442 - 500 19 STREET"
"W/""327066258""","Partial Classroom Quarantine",882450001,"08630a32-921f-ec11-b6e6-001dd83068fb","10/3/2021","2021-10-03T04:00:00Z","052673","9/28/2021","2021-09-28T04:00:00Z","185 WADSWORTH AVENUE","40,850,561.000000",40850561,"10cf496e-31f4-ea11-b882-24ee9a37d45c","Manhattan",882450000,"-73,933,964.000000",-73933964,"6","P.S. 132 - MANHATTAN","Dos Puentes Elementary School - M103 - M132 - 06M103 - 185 WADSWORTH AVENUE"
"W/""326849100""","Partial Classroom Quarantine",882450001,"7c65338c-931f-ec11-b6e6-001dd83068fb","10/3/2021","2021-10-03T04:00:00Z","052688","9/28/2021","2021-09-28T04:00:00Z","120 WEST 231 STREET","40,875,636.000000",40875636,"ad2aa42b-33f4-ea11-b882-24ee9a37d45c","Bronx",882450001,"-73,901,565.000000",-73901565,"10","I.S. 143 - BRONX","The Marie Curie School for Medicine, Nursing, and Health Professions - X237 - X143 - 10X237 - 120 WEST 231 STREET"
"W/""325861133""","Non-Classroom Quarantine",882450003,"60df2da5-931f-ec11-b6e6-001dd83068fb","10/3/2021","2021-10-03T04:00:00Z","052689","9/28/2021","2021-09-28T04:00:00Z","155 TOMPKINS AVENUE","40,620,835.000000",40620835,"66be7adc-32f4-ea11-b882-24ee9a37d45c","Staten Island",882450004,"-74,077,054.000000",-74077054,"31","P.S. 722 (OTC) - STATEN ISLAND","The Richard H. Hungerford School - R721 - R722 - 75R721 - 155 TOMPKINS AVENUE"
"W/""326851162""","Partial Classroom Quarantine",882450001,"ef30daf4-941f-ec11-b6e6-001dd83068fb","10/4/2021","2021-10-04T04:00:00Z","052700","9/28/2021","2021-09-28T04:00:00Z","223 GRAHAM AVENUE","40,709,765.000000",40709765,"14eabc42-30f4-ea11-b882-24ee9a37d45c","Brooklyn",882450002,"-73,944,463.000000",-73944463,"14","I.S. 49 - BROOKLYN","Brooklyn Latin School, The - K449 - K049 - 14K449 - 223 GRAHAM AVENUE"
"W/""325861159""","Partial Classroom Quarantine",882450001,"287ad2fa-941f-ec11-b6e6-001dd83068fb","10/4/2021","2021-10-04T04:00:00Z","052701","9/28/2021","2021-09-28T04:00:00Z","150-91 87 ROAD","40,708,409.000000",40708409,"9d72c880-32f4-ea11-b882-24ee9a37d45c","Queens",882450003,"-73,804,166.000000",-73804166,"28","YOUNG WOMENS' LEADERSHIP SCHOOL - QUEENS","Young Women's Leadership School, Queens - Q896 - Q680 - 28Q896 - 150-91 87 ROAD"
"W/""327008510""","Partial Classroom Quarantine",882450001,"33bca032-951f-ec11-b6e6-001dd83068fb","10/3/2021","2021-10-03T04:00:00Z","052704","9/28/2021","2021-09-28T04:00:00Z","1375 Mace Avenue","40,863,524.000000",40863524,"41474313-33f4-ea11-b882-24ee9a37d45c","Bronx",882450001,"-73,846,768.000000",-73846768,"11","P.S. 97 - BRONX","P.S. 097 Bronx - X097 - X097 - 11X097 - 1375 Mace Avenue"
"W/""326892255""","Partial Classroom Quarantine",882450001,"45308f7f-971f-ec11-b6e6-001dd83068fb","10/2/2021","2021-10-02T04:00:00Z","052719","9/28/2021","2021-09-28T04:00:00Z","100 LUTEN AVENUE","40,528,152.000000",40528152,"605b4cd6-32f4-ea11-b882-24ee9a37d45c","Staten Island",882450004,"-74,193,431.000000",-74193431,"31","TOTTENVILLE HS - S. I.","Tottenville High School - R455 - R455 - 31R455 - 100 LUTEN AVENUE"
"W/""326000583""","Partial Classroom Quarantine",882450001,"610e46ff-971f-ec11-b6e6-001dd83068fb","10/4/2021","2021-10-04T04:00:00Z","052725","9/28/2021","2021-09-28T04:00:00Z","211 DANIEL LOW TERRACE","40,638,993.000000",40638993,"86be7adc-32f4-ea11-b882-24ee9a37d45c","Staten Island",882450004,"-74,079,438.000000",-74079438,"31","P.S. 74 - STATEN ISLAND","P.S. 74 Future Leaders Elementary School - R074 - R831 - 31R074 - 211 DANIEL LOW TERRACE"
"W/""327113094""","Partial Classroom Quarantine",882450001,"e8fd8e23-981f-ec11-b6e6-001dd83068fb","10/2/2021","2021-10-02T04:00:00Z","052728","9/28/2021","2021-09-28T04:00:00Z","100 LUTEN AVENUE","40,528,152.000000",40528152,"605b4cd6-32f4-ea11-b882-24ee9a37d45c","Staten Island",882450004,"-74,193,431.000000",-74193431,"31","TOTTENVILLE HS - S. I.","Tottenville High School - R455 - R455 - 31R455 - 100 LUTEN AVENUE"
"W/""327113538""","Classroom Closed",882450000,"1690203c-981f-ec11-b6e6-001dd83068fb","10/4/2021","2021-10-04T04:00:00Z","052729","9/28/2021","2021-09-28T04:00:00Z","1001 EAST 100 STREET","40,642,931.000000",40642931,"22ba8b86-30f4-ea11-b882-24ee9a37d45c","Brooklyn",882450002,"-73,895,224.000000",-73895224,"18","I.S. 211 - BROOKLYN","Leadership Prep Canarsie Charter School (Leadership Prep CS 4) - K724 - K211 - 84K724 - 1001 EAST 100 STREET"
"W/""325861224""","Partial Classroom Quarantine",882450001,"3ef90755-981f-ec11-b6e6-001dd83068fb","10/1/2021","2021-10-01T04:00:00Z","052730","9/28/2021","2021-09-28T04:00:00Z","2401 NEPTUNE AVENUE","40,578,640.000000",40578640,"6ca5db98-30f4-ea11-b882-24ee9a37d45c","Brooklyn",882450002,"-73,992,447.000000",-73992447,"21","I.S. 239 - BROOKLYN","Mark Twain I.S. 239 for the Gifted & Talented - K239 - K239 - 21K239 - 2401 NEPTUNE AVENUE"
"W/""327094521""","Partial Classroom Quarantine",882450001,"2a6754c3-981f-ec11-b6e6-001dd83068fb","10/3/2021","2021-10-03T04:00:00Z","052732","9/28/2021","2021-09-28T04:00:00Z","100 LUTEN AVENUE","40,528,152.000000",40528152,"605b4cd6-32f4-ea11-b882-24ee9a37d45c","Staten Island",882450004,"-74,193,431.000000",-74193431,"31","TOTTENVILLE HS - S. I.","Tottenville High School - R455 - R455 - 31R455 - 100 LUTEN AVENUE"
"W/""325861249""","Partial Classroom Quarantine",882450001,"b87841db-981f-ec11-b6e6-001dd83068fb","10/3/2021","2021-10-03T04:00:00Z","052735","9/28/2021","2021-09-28T04:00:00Z","778 FOREST AVENUE","40,818,703.000000",40818703,"f88a0044-33f4-ea11-b882-24ee9a37d45c","Bronx",882450001,"-73,905,389.000000",-73905389,"7","I.S. 184 - BRONX","Academy of Public Relations - X298 - X184 - 07X298 - 778 FOREST AVENUE"
"W/""326295415""","Partial Classroom Quarantine",882450001,"c0eea093-9a1f-ec11-b6e6-001dd83068fb","10/4/2021","2021-10-04T04:00:00Z","052753","9/28/2021","2021-09-28T04:00:00Z","516 EAST TREMONT AVENUE","40,846,495.000000",40846495,"48ff3d8d-33f4-ea11-b882-24ee9a37d45c","Bronx",882450001,"-73,896,596.000000",-73896596,"9","Arthur Avenue Educational Building","P.S. 723 - X723 - X909 - 75X723 - 516 EAST TREMONT AVENUE"
"W/""325861310""","Partial Classroom Quarantine",882450001,"cf647337-9b1f-ec11-b6e6-001dd83068fb","10/3/2021","2021-10-03T04:00:00Z","052758","9/28/2021","2021-09-28T04:00:00Z","160-05 HIGHLAND AVENUE","40,709,461.000000",40709461,"8fbc9674-32f4-ea11-b882-24ee9a37d45c","Queens",882450003,"-73,803,001.000000",-73803001,"28","HILLCREST HS - Q","Hillcrest High School - Q505 - Q505 - 28Q505 - 160-05 HIGHLAND AVENUE"
"W/""326859892""","Partial Classroom Quarantine",882450001,"48919d9d-9c1f-ec11-b6e6-001dd83068fb","10/4/2021","2021-10-04T04:00:00Z","052768","9/28/2021","2021-09-28T04:00:00Z","1300 GREENE AVENUE","40,697,898.000000",40697898,"1de2abc9-30f4-ea11-b882-24ee9a37d45c","Brooklyn",882450002,"-73,919,088.000000",-73919088,"32","I.S. 383 - BROOKLYN","J.H.S. 383 Philippa Schuyler - K383 - K383 - 32K383 - 1300 GREENE AVENUE"
"W/""326861346""","Partial Classroom Quarantine",882450001,"8018e0da-9d1f-ec11-b6e6-001dd83068fb","10/4/2021","2021-10-04T04:00:00Z","052783","9/28/2021","2021-09-28T04:00:00Z","46-35 OCEANIA STREET","40,756,562.000000",40756562,"f39b4c1f-32f4-ea11-b882-24ee9a37d45c","Queens",882450003,"-73,771,878.000000",-73771878,"26","J.H.S. 158 - QUEENS","M.S. 158 Marie Curie - Q158 - Q158 - 26Q158 - 46-35 OCEANIA STREET"
"W/""326862152""","Partial Classroom Quarantine",882450001,"9429cdf2-9d1f-ec11-b6e6-001dd83068fb","10/4/2021","2021-10-04T04:00:00Z","052785","9/28/2021","2021-09-28T04:00:00Z","43-18 97TH PLACE","40,745,995.000000",40745995,"de454b50-32f4-ea11-b882-24ee9a37d45c","Queens",882450003,"-73,866,372.000000",-73866372,"24","P.S. 315 - Queens","P.S. 110 - Q110 - Q315 - 24Q110 - 43-18 97TH PLACE"
"W/""325861435""","Classroom Closed",882450000,"5cdc2a62-9f1f-ec11-b6e6-001dd83068fb","10/7/2021","2021-10-07T04:00:00Z","052798","9/28/2021","2021-09-28T04:00:00Z","31-15 140 STREET","40,770,215.000000",40770215,"feb6c337-32f4-ea11-b882-24ee9a37d45c","Queens",882450003,"-73,827,606.000000",-73827606,"25","P.S. 214 - QUEENS","P.S. 214 Cadwallader Colden - Q214 - Q214 - 25Q214 - 31-15 140 STREET"
"W/""325861471""","Classroom Closed",882450000,"3bd776b2-a01f-ec11-b6e6-001dd83068fb","10/4/2021","2021-10-04T04:00:00Z","052811","9/28/2021","2021-09-28T04:00:00Z","7103 Avenue T","40,622,442.000000",40622442,"87e657bd-30f4-ea11-b882-24ee9a37d45c","Brooklyn",882450002,"-73,909,554.000000",-73909554,"22","P.S. 312 - BROOKLYN","P.S. 312 Bergen Beach - K312 - K312 - 22K312 - 7103 Avenue T"
"W/""325861476""","Partial Classroom Quarantine",882450001,"307664c4-a01f-ec11-b6e6-001dd83068fb","10/4/2021","2021-10-04T04:00:00Z","052813","9/28/2021","2021-09-28T04:00:00Z","4143 THIRD AVENUE","40,845,366.000000",40845366,"8b53dd74-33f4-ea11-b882-24ee9a37d45c","Bronx",882450001,"-73,897,479.000000",-73897479,"9","Eagle Academy For Young Men - Bronx","Eagle Academy for Young Men - X231 - X465 - 09X231 - 4143 THIRD AVENUE"
"W/""327119829""","Partial Classroom Quarantine",882450001,"2b1b38cb-a01f-ec11-b6e6-001dd83068fb","10/5/2021","2021-10-05T04:00:00Z","052814","9/28/2021","2021-09-28T04:00:00Z","143-26 101 AVENUE","40,695,237.622281",40695237.622281,"d5cd0c6a-ba09-eb11-b884-24ee9a37d459",,,"-73,807,364.151906",-73807364.151906,"Q050","P.S. 050 Talfourd Lawn Elementary School","DYCD - P.S. 050 Talfourd Lawn Elementary School - 126017 - 143-26 101 AVENUE"
"W/""327147667""","Partial Classroom Quarantine",882450001,"5ffda10d-a11f-ec11-b6e6-001dd83068fb","10/4/2021","2021-10-04T04:00:00Z","052822","9/28/2021","2021-09-28T04:00:00Z","845 EAST  96 STREET","40,648,749.000000",40648749,"cc79df48-30f4-ea11-b882-24ee9a37d45c","Brooklyn",882450002,"-73,907,064.000000",-73907064,"18","P.S. 66 - BROOKLYN","P.S. 66 - K066 - K066 - 18K066 - 845 EAST  96 STREET"
"W/""326016543""","Partial Classroom Quarantine",882450001,"1f8abf46-a21f-ec11-b6e6-001dd83068fb","10/1/2021","2021-10-01T04:00:00Z","052837","9/28/2021","2021-09-28T04:00:00Z","845 EAST  96 STREET","40,648,749.000000",40648749,"cc79df48-30f4-ea11-b882-24ee9a37d45c","Brooklyn",882450002,"-73,907,064.000000",-73907064,"18","P.S. 66 - BROOKLYN","P.S. 66 - K066 - K066 - 18K066 - 845 EAST  96 STREET"
"W/""325861576""","Classroom Closed",882450000,"95006095-a41f-ec11-b6e6-001dd83068fb","10/4/2021","2021-10-04T04:00:00Z","052869","9/28/2021","2021-09-28T04:00:00Z","1050 Targee Street","40,603,492.000000",40603492,"db8521d0-32f4-ea11-b882-24ee9a37d45c","Staten Island",882450004,"-74,091,239.000000",-74091239,"31","P.S./I.S. 48 - Staten Island","P.S. 048 William G. Wilcox - R048 - R071 - 31R048 - 1050 Targee Street"
"W/""327132166""","Partial Classroom Quarantine",882450001,"79fcae07-a61f-ec11-b6e6-001dd83068fb","10/3/2021","2021-10-03T04:00:00Z","052885","9/28/2021","2021-09-28T04:00:00Z","70 Tompkins Avenue","40,696,698.000000",40696698,"eb1aad3c-30f4-ea11-b882-24ee9a37d45c","Brooklyn",882450002,"-73,947,557.000000",-73947557,"14","I.S. 33 - BROOKLYN","Success Academy Charter School - Bed-Stuy 1 - K367 - K033 - 84K367 - 70 Tompkins Avenue"
"W/""327133845""","Classroom Closed",882450000,"63ea21f9-a61f-ec11-b6e6-001dd83068fb","10/1/2021","2021-10-01T04:00:00Z","052897","9/28/2021","2021-09-28T04:00:00Z","3301 QUENTIN ROAD","40,614,005.000000",40614005,"dc21d292-30f4-ea11-b882-24ee9a37d45c","Brooklyn",882450002,"-73,939,205.000000",-73939205,"22","P.S. 222 - BROOKLYN","P.S. 222 Katherine R. Snyder - K222 - K222 - 22K222 - 3301 QUENTIN ROAD"
"W/""325861658""","Classroom Closed",882450000,"add546c9-a71f-ec11-b6e6-001dd83068fb","10/4/2021","2021-10-04T04:00:00Z","052907","9/28/2021","2021-09-28T04:00:00Z","3301 QUENTIN ROAD","40,614,005.000000",40614005,"dc21d292-30f4-ea11-b882-24ee9a37d45c","Brooklyn",882450002,"-73,939,205.000000",-73939205,"22","P.S. 222 - BROOKLYN","P.S. 222 Katherine R. Snyder - K222 - K222 - 22K222 - 3301 QUENTIN ROAD"
"W/""327149527""","Classroom Closed",882450000,"800e841b-aa1f-ec11-b6e6-001dd83068fb","10/3/2021","2021-10-03T04:00:00Z","052929","9/28/2021","2021-09-28T04:00:00Z","1580 DEAN STREET","40,675,675.000000",40675675,"7aa5db98-30f4-ea11-b882-24ee9a37d45c","Brooklyn",882450002,"-73,935,093.000000",-73935093,"16","P.S. 243 - BROOKLYN","P.S. 243K- The Weeksville School - K243 - K243 - 16K243 - 1580 DEAN STREET"
"W/""325861683""","Partial Classroom Quarantine",882450001,"28ef4234-aa1f-ec11-b6e6-001dd83068fb","10/3/2021","2021-10-03T04:00:00Z","052931","9/28/2021","2021-09-28T04:00:00Z","1181 NELSON AVENUE","40,837,338.000000",40837338,"4b45378b-4afb-ea11-b883-24ee9a37d459",,,"-73,926,063.000000",-73926063,"9","HIGHBRIDGE ADVISORY COUNCIL","Highbridge Advisory Council - XAIN - XAIN -  - 1181 NELSON AVENUE"
"W/""325861708""","Non-Classroom Quarantine",882450003,"448dc5f6-aa1f-ec11-b6e6-001dd83068fb","10/3/2021","2021-10-03T04:00:00Z","052943","9/28/2021","2021-09-28T04:00:00Z","50 AVENUE X","40,588,070.000000",40588070,"05fc3df4-30f4-ea11-b882-24ee9a37d45c","Brooklyn",882450002,"-73,981,925.000000",-73981925,"21","JOHN DEWEY HS - K","John Dewey High School - K540 - K540 - 21K540 - 50 AVENUE X"
"W/""327139723""","Classroom Closed",882450000,"8b66ae5e-ab1f-ec11-b6e6-001dd83068fb","10/1/2021","2021-10-01T04:00:00Z","052946","9/28/2021","2021-09-28T04:00:00Z","233-15 MERRICK BOULEVARD","40,675,070.000000",40675070,"52a10a44-32f4-ea11-b882-24ee9a37d45c","Queens",882450003,"-73,736,232.000000",-73736232,"29","P.S. 270 - QUEENS","The Gordon Parks School - Q270 - Q270 - 29Q270 - 233-15 MERRICK BOULEVARD"
"W/""326134508""","Partial Classroom Quarantine",882450001,"72e39d52-ac1f-ec11-b6e6-001dd83068fb","10/3/2021","2021-10-03T04:00:00Z","052951","9/28/2021","2021-09-28T04:00:00Z","1200 MANOR ROAD","40,588,985.000000",40588985,"5abe7adc-32f4-ea11-b882-24ee9a37d45c","Staten Island",882450004,"-74,130,819.000000",-74130819,"31","SUSAN E. WAGNER HS - S. I.","Susan E. Wagner High School - R460 - R460 - 31R460 - 1200 MANOR ROAD"
"W/""325861734""","Partial Classroom Quarantine",882450001,"0cf9e082-ac1f-ec11-b6e6-001dd83068fb","10/7/2021","2021-10-07T04:00:00Z","052953","9/28/2021","2021-09-28T04:00:00Z","48-01 90 STREET","40,740,824.000000",40740824,"8c476368-32f4-ea11-b882-24ee9a37d45c","Queens",882450003,"-73,874,129.000000",-73874129,"24","NEWTOWN HS - Q","Newtown High School - Q455 - Q455 - 24Q455 - 48-01 90 STREET"
"W/""327150138""","Partial Classroom Quarantine",882450001,"d0eeaf22-ad1f-ec11-b6e6-001dd83068fb","10/1/2021","2021-10-01T04:00:00Z","052958","9/28/2021","2021-09-28T04:00:00Z","1866 EAST  17 STREET","40,604,461.000000",40604461,"a883ff9e-30f4-ea11-b882-24ee9a37d45c","Brooklyn",882450002,"-73,955,891.000000",-73955891,"22","P.S. 255 - BROOKLYN","P.S. 255 Barbara Reing School - K255 - K255 - 22K255 - 1866 EAST  17 STREET"
"W/""327133626""","Classroom Closed",882450000,"de90991c-af1f-ec11-b6e6-001dd83068fb","10/3/2021","2021-10-03T04:00:00Z","052973","9/28/2021","2021-09-28T04:00:00Z","610 HENRY STREET","40,679,462.000000",40679462,"cfd27c6d-30f4-ea11-b882-24ee9a37d45c","Brooklyn",882450002,"-74,002,022.000000",-74002022,"15","J.H.S. 142 - BROOKLYN","The Brooklyn New School, P.S. 146 - K146 - K142 - 15K146 - 610 HENRY STREET"
"W/""326858138""","Partial Classroom Quarantine",882450001,"6c926d3f-b01f-ec11-b6e6-001dd83068fb","10/4/2021","2021-10-04T04:00:00Z","052982","9/28/2021","2021-09-28T04:00:00Z","455 HUGUENOT AVENUE","40,544,535.000000",40544535,"e28521d0-32f4-ea11-b882-24ee9a37d45c","Staten Island",882450004,"-74,197,033.000000",-74197033,"31","I.S. 75 - STATEN ISLAND","I.S. 075 Frank D. Paulo - R075 - R075 - 31R075 - 455 HUGUENOT AVENUE"
"W/""327142841""","Classroom Closed",882450000,"8d37fbef-b01f-ec11-b6e6-001dd83068fb","10/7/2021","2021-10-07T04:00:00Z","052987","9/28/2021","2021-09-28T04:00:00Z","46-08 5TH STREET","40,747,077.000000",40747077,"cf454b50-32f4-ea11-b882-24ee9a37d45c","Queens",882450003,"-73,955,145.000000",-73955145,"30","P.S./.IS. 78 - QUEENS","The Riverview School - Q277 - Q312 - 75Q277 - 46-08 5TH STREET"
"W/""327198892""","Partial Classroom Quarantine",882450001,"4eebf868-b11f-ec11-b6e6-001dd83068fb","10/4/2021","2021-10-04T04:00:00Z","052994","9/29/2021","2021-09-29T04:00:00Z","21-27 HIMROD STREET","40,711,881.000000",40711881,"74bc9674-32f4-ea11-b882-24ee9a37d45c","Queens",882450003,"-73,909,202.000000",-73909202,"24","GROVER CLEVELAND HS - Q","Grover Cleveland High School - Q485 - Q485 - 24Q485 - 21-27 HIMROD STREET"
"W/""326274403""","Partial Classroom Quarantine",882450001,"18984bac-b21f-ec11-b6e6-001dd83068fb","10/4/2021","2021-10-04T04:00:00Z","053007","9/28/2021","2021-09-28T04:00:00Z","456 WHITE PLAINS ROAD","40,815,043.000000",40815043,"2a2ed53d-33f4-ea11-b882-24ee9a37d45c","Bronx",882450001,"-73,856,070.000000",-73856070,"8","I.S. 174 - BRONX","Women's Academy of Excellence - X282 - X174 - 08X282 - 456 WHITE PLAINS ROAD"
"W/""328506182""","Partial Classroom Quarantine",882450001,"7d5c38a6-b31f-ec11-b6e6-001dd83068fb","10/3/2021","2021-10-03T04:00:00Z","053013","9/30/2021","2021-09-30T04:00:00Z","100 LUTEN AVENUE","40,528,152.000000",40528152,"605b4cd6-32f4-ea11-b882-24ee9a37d45c","Staten Island",882450004,"-74,193,431.000000",-74193431,"31","TOTTENVILLE HS - S. I.","Tottenville High School - R455 - R455 - 31R455 - 100 LUTEN AVENUE"
"W/""327150859""","Partial Classroom Quarantine",882450001,"e9fd1537-b51f-ec11-b6e6-001dd83068fb","10/4/2021","2021-10-04T04:00:00Z","053023","9/28/2021","2021-09-28T04:00:00Z","99 AVENUE P","40,608,135.000000",40608135,"c10d3c5b-30f4-ea11-b882-24ee9a37d45c","Brooklyn",882450002,"-73,984,985.000000",-73984985,"21","I.S. 96 - BROOKLYN","I.S. 096 Seth Low - K096 - K096 - 21K096 - 99 AVENUE P"
"W/""327151815""","Classroom Closed",882450000,"8311c0ae-b61f-ec11-b6e6-001dd83068fb","10/4/2021","2021-10-04T04:00:00Z","053030","9/28/2021","2021-09-28T04:00:00Z","171-11 35 AVENUE","40,765,459.000000",40765459,"ca8442ee-31f4-ea11-b882-24ee9a37d45c","Queens",882450003,"-73,794,323.000000",-73794323,"25","P.S. 32 - QUEENS","P.S. 032 State Street - Q032 - Q032 - 25Q032 - 171-11 35 AVENUE"
"W/""325861915""","Partial Classroom Quarantine",882450001,"8b1d7f31-b81f-ec11-b6e6-001dd83068fb","10/3/2021","2021-10-03T04:00:00Z","053036","9/28/2021","2021-09-28T04:00:00Z","730 BRYANT AVENUE","40,815,827.000000",40815827,"f9d10307-33f4-ea11-b882-24ee9a37d45c","Bronx",882450001,"-73,885,284.000000",-73885284,"8","I.S. 201 - BRONX","Bronx Academy for Multi-Media - X424 - X074 - 08X424 - 730 BRYANT AVENUE"
"W/""327198932""","Partial Classroom Quarantine",882450001,"c01b1cd4-bd1f-ec11-b6e6-001dd83068fb","10/4/2021","2021-10-04T04:00:00Z","053082","9/29/2021","2021-09-29T04:00:00Z","147-36 26 AVENUE","40,774,134.000000",40774134,"adfc24e8-31f4-ea11-b882-24ee9a37d45c","Queens",882450003,"-73,818,581.000000",-73818581,"25","P.S. 21 - QUEENS","P.S. 021 Edward Hart - Q021 - Q021 - 25Q021 - 147-36 26 AVENUE"
"W/""327152186""","Partial Classroom Quarantine",882450001,"18ecd6fe-bd1f-ec11-b6e6-001dd83068fb","10/7/2021","2021-10-07T04:00:00Z","053084","9/28/2021","2021-09-28T04:00:00Z","2756 RESERVOIR AVENUE","40,869,061.000000",40869061,"19474313-33f4-ea11-b882-24ee9a37d45c","Bronx",882450001,"-73,897,066.000000",-73897066,"10","P.S. 86 - BRONX","P.S. 086 Kingsbridge Heights - X086 - X086 - 10X086 - 2756 RESERVOIR AVENUE"
"W/""327153114""","Classroom Closed",882450000,"2bbae8c6-be1f-ec11-b6e6-001dd83068fb","10/4/2021","2021-10-04T04:00:00Z","053091","9/28/2021","2021-09-28T04:00:00Z","147-36 26 AVENUE","40,774,134.000000",40774134,"adfc24e8-31f4-ea11-b882-24ee9a37d45c","Queens",882450003,"-73,818,581.000000",-73818581,"25","P.S. 21 - QUEENS","P.S. 021 Edward Hart - Q021 - Q021 - 25Q021 - 147-36 26 AVENUE"
"W/""327198937""","Partial Classroom Quarantine",882450001,"5fd4735f-bf1f-ec11-b6e6-001dd83068fb","10/4/2021","2021-10-04T04:00:00Z","053098","9/29/2021","2021-09-29T04:00:00Z","138-01 77 AVENUE","40,721,514.000000",40721514,"ff9b4c1f-32f4-ea11-b882-24ee9a37d45c","Queens",882450003,"-73,823,569.000000",-73823569,"25","P.S. 164 - QUEENS","P.S. 164 Queens Valley - Q164 - Q164 - 25Q164 - 138-01 77 AVENUE"
"W/""327153327""","Classroom Closed",882450000,"a864ae6b-bf1f-ec11-b6e6-001dd83068fb","10/4/2021","2021-10-04T04:00:00Z","053099","9/28/2021","2021-09-28T04:00:00Z","4862 BROADWAY","40,866,381.000000",40866381,"46507380-31f4-ea11-b882-24ee9a37d45c","Manhattan",882450000,"-73,923,818.000000",-73923818,"6","P.S./I.S. 176 - MANHATTAN","Muscota - M314 - M176 - 06M314 - 4862 BROADWAY"
"W/""326825902""","Non-Classroom Quarantine",882450003,"c46393d1-c01f-ec11-b6e6-001dd83068fb","10/4/2021","2021-10-04T04:00:00Z","053111","9/28/2021","2021-09-28T04:00:00Z","133-40 79TH STREET","40,671,903.000000",40671903,"2c02926e-32f4-ea11-b882-24ee9a37d45c","Queens",882450003,"-73,857,176.000000",-73857176,"27","3K CENTER @ 133-40 79TH STREET - QUEENS","Curious Young Learners Pre-K Center - Q336 - Q473 - 27Q336 - 133-40 79TH STREET"
"W/""328318465""","Partial Classroom Quarantine",882450001,"7f42f3f6-c01f-ec11-b6e6-001dd83068fb","10/4/2021","2021-10-04T04:00:00Z","053112","9/28/2021","2021-09-28T04:00:00Z","149-11 MELBOURNE AVENUE","40,737,038.000000",40737038,"1db4977a-32f4-ea11-b882-24ee9a37d45c","Queens",882450003,"-73,821,532.000000",-73821532,"25","TOWNSEND HARRIS HS - Q","Townsend Harris High School - Q525 - Q515 - 25Q525 - 149-11 MELBOURNE AVENUE"
"W/""325862036""","Partial Classroom Quarantine",882450001,"99726264-c31f-ec11-b6e6-001dd83068fb","10/4/2021","2021-10-04T04:00:00Z","053135","9/28/2021","2021-09-28T04:00:00Z","33 FERNDALE AVENUE","40,592,132.000000",40592132,"e48521d0-32f4-ea11-b882-24ee9a37d45c","Staten Island",882450004,"-74,158,618.000000",-74158618,"31","I.S. 72 - STATEN ISLAND","I.S. 072 Rocco Laurie - R072 - R072 - 31R072 - 33 FERNDALE AVENUE"
"W/""326848205""","Partial Classroom Quarantine",882450001,"67fe0192-c41f-ec11-b6e6-001dd83068fb","10/7/2021","2021-10-07T04:00:00Z","053145","9/28/2021","2021-09-28T04:00:00Z","905 WINTHROP STREET","40,659,088.000000",40659088,"0222d292-30f4-ea11-b882-24ee9a37d45c","Brooklyn",882450002,"-73,928,744.000000",-73928744,"18","I.S. 232 - BROOKLYN","Kings Collegiate Charter School - K608 - K232 - 84K608 - 905 WINTHROP STREET"
"W/""326796022""","Partial Classroom Quarantine",882450001,"209c2704-c71f-ec11-b6e6-001dd83068fb","10/2/2021","2021-10-02T04:00:00Z","053163","9/28/2021","2021-09-28T04:00:00Z","34-65 192 STREET","40,764,884.000000",40764884,"befc24e8-31f4-ea11-b882-24ee9a37d45c","Queens",882450003,"-73,789,365.000000",-73789365,"25","J.H.S. 25 - QUEENS","I.S. 025 Adrien Block - Q025 - Q025 - 25Q025 - 34-65 192 STREET"
"W/""327198957""","Classroom Closed",882450000,"24745d28-c71f-ec11-b6e6-001dd83068fb","10/3/2021","2021-10-03T04:00:00Z","053164","9/29/2021","2021-09-29T04:00:00Z","140 Harvest Avenue","40,627,336.000000",40627336,"ee4e3585-4afb-ea11-b883-24ee9a37d459",,,"-74,109,969.000000",-74109969,"31","Hugs & Kiddies Early Learning Center","Hugs and Kiddies of Staten Island NY LLC - RAIJ - RAIJ -  - 140 Harvest Avenue"
"W/""327198972""","Partial Classroom Quarantine",882450001,"f23227ec-d11f-ec11-b6e6-001dd83068fb","10/4/2021","2021-10-04T04:00:00Z","053191","9/29/2021","2021-09-29T04:00:00Z","419 WAVERLY AVENUE","40,685,896.000000",40685896,"e0f57030-30f4-ea11-b882-24ee9a37d45c","Brooklyn",882450002,"-73,965,890.000000",-73965890,"13","P.S. 11 - BROOKLYN","P.S. 011 Purvis J. Behan - K011 - K011 - 13K011 - 419 WAVERLY AVENUE"
"W/""326055187""","Classroom Closed",882450000,"7f5a95bd-d21f-ec11-b6e6-001dd83068fb","10/3/2021","2021-10-03T04:00:00Z","053192","9/28/2021","2021-09-28T04:00:00Z","419 WAVERLY AVENUE","40,685,896.000000",40685896,"e0f57030-30f4-ea11-b882-24ee9a37d45c","Brooklyn",882450002,"-73,965,890.000000",-73965890,"13","P.S. 11 - BROOKLYN","P.S. 011 Purvis J. Behan - K011 - K011 - 13K011 - 419 WAVERLY AVENUE"
"W/""327199038""","Partial Classroom Quarantine",882450001,"b0f2c83f-5220-ec11-b6e6-001dd83068fb","10/4/2021","2021-10-04T04:00:00Z","053212","9/29/2021","2021-09-29T04:00:00Z","125 STUYVESANT AVENUE","40,691,467.000000",40691467,"ae79df48-30f4-ea11-b882-24ee9a37d45c","Brooklyn",882450002,"-73,932,254.000000",-73932254,"16","J.H.S. 57 - BROOKLYN","Brooklyn Emerging Leaders Academy Charter School - K892 - K057 - 84K892 - 125 STUYVESANT AVENUE"
"W/""327199063""","Partial Classroom Quarantine",882450001,"4a531286-5520-ec11-b6e6-001dd83068fb","10/4/2021","2021-10-04T04:00:00Z","053222","9/29/2021","2021-09-29T04:00:00Z","198 Forsyth Street","40,722,415.000000",40722415,"d737fba4-31f4-ea11-b882-24ee9a37d45c","Manhattan",882450000,"-73,990,468.000000",-73990468,"1","FORSYTH HS (AUXSVC-OLD 91) - M","Cascades High School - M650 - M510 - 01M650 - 198 Forsyth Street"
"W/""328753515""","Partial Classroom Quarantine",882450001,"49800b4e-5720-ec11-b6e6-001dd83068fb","10/4/2021","2021-10-04T04:00:00Z","053227","9/29/2021","2021-09-29T04:00:00Z","1680 LEXINGTON AVENUE","40,791,966.000000",40791966,"61e61462-31f4-ea11-b882-24ee9a37d45c","Manhattan",882450000,"-73,946,879.000000",-73946879,"4","THE HERITAGE SCHOOL - MANHATTAN","Heritage School, The - M680 - M107 - 04M680 - 1680 LEXINGTON AVENUE"
"W/""327675196""","Partial Classroom Quarantine",882450001,"05d70d6f-5920-ec11-b6e6-001dd83068fb","10/7/2021","2021-10-07T04:00:00Z","053236","9/29/2021","2021-09-29T04:00:00Z","154-60 17 AVENUE","40,783,231.000000",40783231,"8a977d2b-32f4-ea11-b882-24ee9a37d45c","Queens",882450003,"-73,806,990.000000",-73806990,"25","J.H.S. 194 - QUEENS","J.H.S. 194 William Carr - Q194 - Q194 - 25Q194 - 154-60 17 AVENUE"
"W/""327199124""","Partial Classroom Quarantine",882450001,"2eefddbd-5b20-ec11-b6e6-001dd83068fb","10/2/2021","2021-10-02T04:00:00Z","053239","9/29/2021","2021-09-29T04:00:00Z","91-37 222 STREET","40,727,172.000000",40727172,"cd8442ee-31f4-ea11-b882-24ee9a37d45c","Queens",882450003,"-73,734,102.000000",-73734102,"29","P.S. 33 - QUEENS","P.S. 033 Edward M. Funk - Q033 - Q033 - 29Q033 - 91-37 222 STREET"
"W/""328768293""","Classroom Closed",882450000,"65019045-5f20-ec11-b6e6-001dd83068fb","10/4/2021","2021-10-04T04:00:00Z","053262","9/29/2021","2021-09-29T04:00:00Z","35-59 81ST STREET","40,749,934.000000",40749934,"d511f898-32f4-ea11-b882-24ee9a37d45c","Queens",882450003,"-73,884,817.000000",-73884817,"30","RENAISSANCE CHARTER SCHOOL - Q","Renaissance Charter School - Q705 - Q885 - 84Q705 - 35-59 81ST STREET"
"W/""327199169""","Classroom Closed",882450000,"74aa46ad-5f20-ec11-b6e6-001dd83068fb","10/7/2021","2021-10-07T04:00:00Z","053266","9/29/2021","2021-09-29T04:00:00Z","104-12 SPRINGFIELD BLVD","40,710,986.000000",40710986,"1bbef08c-32f4-ea11-b882-24ee9a37d45c","Queens",882450003,"-73,737,702.000000",-73737702,"29","P.S. 34 MINISCHOOL - QUEENS","P.S. 034 John Harvard - Q034 - Q834 - 29Q034 - 104-12 SPRINGFIELD BLVD"
"W/""327199179""","Partial Classroom Quarantine",882450001,"1160e007-6020-ec11-b6e6-001dd83068fb","10/4/2021","2021-10-04T04:00:00Z","053271","9/29/2021","2021-09-29T04:00:00Z","50-51 98TH STREET","40,741,139.000000",40741139,"30c73b4a-32f4-ea11-b882-24ee9a37d45c","Queens",882450003,"-73,863,408.000000",-73863408,"24","P.S./ I.S. 298 - QUEENS","Elm Tree Elementary School - Q211 - Q298 - 24Q211 - 50-51 98TH STREET"
"W/""327678557""","Partial Classroom Quarantine",882450001,"42115a44-6720-ec11-b6e6-001dd83068fb","10/4/2021","2021-10-04T04:00:00Z","053321","9/29/2021","2021-09-29T04:00:00Z","55-20 METROPOLITAN AVENUE","40,713,030.000000",40713030,"24c73b4a-32f4-ea11-b882-24ee9a37d45c","Queens",882450003,"-73,908,307.000000",-73908307,"24","THE GERALDINE FERRARO CAMPUS - QUEENS","A.C.E. Academy for Scholars at the Geraldine Ferraro Campus - Q290 - Q290 - 24Q290 - 55-20 METROPOLITAN AVENUE"
"W/""327463482""","Partial Classroom Quarantine",882450001,"0aeb3af6-6920-ec11-b6e6-001dd83068fb","10/4/2021","2021-10-04T04:00:00Z","053339","9/29/2021","2021-09-29T04:00:00Z","3540 Bivona Street","40,882,980.000000",40882980,"aaeb0e7b-33f4-ea11-b882-24ee9a37d45c","Bronx",882450001,"-73,831,856.000000",-73831856,"11","P.S. 723 - BRONX","P.S. 723 - X723 - X701 - 75X723 - 3540 Bivona Street"
"W/""327199280""","Partial Classroom Quarantine",882450001,"107c7b47-6c20-ec11-b6e6-001dd83068fb","10/4/2021","2021-10-04T04:00:00Z","053360","9/29/2021","2021-09-29T04:00:00Z","66-56 FOREST AVENUE","40,705,609.000000",40705609,"0f7eed06-32f4-ea11-b882-24ee9a37d45c","Queens",882450003,"-73,903,057.000000",-73903057,"24","I.S. 93 - QUEENS","I.S. 093 Ridgewood - Q093 - Q093 - 24Q093 - 66-56 FOREST AVENUE"
"W/""328091447""","Non-Classroom Quarantine",882450003,"bb10d11c-6f20-ec11-b6e6-001dd83068fb","10/7/2021","2021-10-07T04:00:00Z","053386","9/30/2021","2021-09-30T04:00:00Z","29-66 137 STREET","40,769,752.000000",40769752,"2d06003e-32f4-ea11-b882-24ee9a37d45c","Queens",882450003,"-73,832,005.000000",-73832005,"25","P.S. 242 - (ECC) - QUEENS","P.S. 242 Leonard P. Stavisky Early Childhood School - Q242 - Q242 - 25Q242 - 29-66 137 STREET"
"W/""327199320""","Partial Classroom Quarantine",882450001,"76e29ae9-7020-ec11-b6e6-001dd83068fb","10/3/2021","2021-10-03T04:00:00Z","053394","9/29/2021","2021-09-29T04:00:00Z","132-15 218 STREET","40,681,948.000000",40681948,"12af0313-32f4-ea11-b882-24ee9a37d45c","Queens",882450003,"-73,749,300.000000",-73749300,"29","P.S. 132 - QUEENS","P.S. 132 Ralph Bunche - Q132 - Q132 - 29Q132 - 132-15 218 STREET"
"W/""327199356""","Classroom Closed",882450000,"c08bb4d3-7420-ec11-b6e6-001dd83068fb","10/4/2021","2021-10-04T04:00:00Z","053419","9/29/2021","2021-09-29T04:00:00Z","45-50 195 STREET","40,754,435.000000",40754435,"71ce9ac9-49fb-ea11-b883-24ee9a37d459",,,"-73,786,532.000000",-73786532,"25","SAINT KEVIN SCHOOL","Saint Kevin Catholic Academy - QAFY - QAFY -  - 45-50 195 STREET"
"W/""328076226""","Partial Classroom Quarantine",882450001,"d673b7e3-7620-ec11-b6e6-001dd83068fb","10/4/2021","2021-10-04T04:00:00Z","053431","9/29/2021","2021-09-29T04:00:00Z","105 East 106th Street","40,792,932.000000",40792932,"d4ed94c3-31f4-ea11-b882-24ee9a37d45c","Manhattan",882450000,"-73,947,171.000000",-73947171,"4","YOUNG WOMEN'S LEADERSHIP HS - M","Young Women's Leadership School - M610 - M895 - 04M610 - 105 East 106th Street"
"W/""327199391""","Partial Classroom Quarantine",882450001,"cd151239-7820-ec11-b6e6-001dd83068fb","10/7/2021","2021-10-07T04:00:00Z","053442","9/29/2021","2021-09-29T04:00:00Z","510 WAVERLY AVENUE","40,682,422.000000",40682422,"8228a20c-31f4-ea11-b882-24ee9a37d45c","Brooklyn",882450002,"-73,965,928.000000",-73965928,"13","ACHIEVEMENT FIRST ENDEAVOR CHARTER SCHOOL - K","Achievement First Endeavor Charter School - K508 - K784 - 84K508 - 510 WAVERLY AVENUE"
"W/""327199396""","Partial Classroom Quarantine",882450001,"71cb2fb5-7920-ec11-b6e6-001dd83068fb","10/4/2021","2021-10-04T04:00:00Z","053448","9/29/2021","2021-09-29T04:00:00Z","510 WAVERLY AVENUE","40,682,422.000000",40682422,"8228a20c-31f4-ea11-b882-24ee9a37d45c","Brooklyn",882450002,"-73,965,928.000000",-73965928,"13","ACHIEVEMENT FIRST ENDEAVOR CHARTER SCHOOL - K","Achievement First Endeavor Charter School - K508 - K784 - 84K508 - 510 WAVERLY AVENUE"
"W/""327199421""","Partial Classroom Quarantine",882450001,"a4984c7d-7b20-ec11-b6e6-001dd83068fb","10/7/2021","2021-10-07T04:00:00Z","053460","9/29/2021","2021-09-29T04:00:00Z","510 WAVERLY AVENUE","40,682,422.000000",40682422,"8228a20c-31f4-ea11-b882-24ee9a37d45c","Brooklyn",882450002,"-73,965,928.000000",-73965928,"13","ACHIEVEMENT FIRST ENDEAVOR CHARTER SCHOOL - K","Achievement First Endeavor Charter School - K508 - K784 - 84K508 - 510 WAVERLY AVENUE"
"W/""328091493""","Partial Classroom Quarantine",882450001,"70ca835d-8820-ec11-b6e6-001dd83068fb","10/3/2021","2021-10-03T04:00:00Z","053540","9/30/2021","2021-09-30T04:00:00Z","1010 REV. J. A. POLITE AVENUE","40,823,124.000000",40823124,"8ce03d56-33f4-ea11-b882-24ee9a37d45c","Bronx",882450001,"-73,898,265.000000",-73898265,"12","BRONX REGIONAL HS (OLD 133) - X","New Visions A.I.M. Charter High School II - X200 - X401 - 84X200 - 1010 REV. J. A. POLITE AVENUE"
"W/""327262343""","Partial Classroom Quarantine",882450001,"3380b969-8820-ec11-b6e6-001dd83068fb","10/7/2021","2021-10-07T04:00:00Z","053541","9/29/2021","2021-09-29T04:00:00Z","1601 80 STREET","40,613,041.000000",40613041,"5488e6db-30f4-ea11-b882-24ee9a37d45c","Brooklyn",882450002,"-74,002,308.000000",-74002308,"20","NEW UTRECHT HS - K","New Utrecht High School - K445 - K445 - 20K445 - 1601 80 STREET"
"W/""327686614""","Partial Classroom Quarantine",882450001,"f43e6f9e-8920-ec11-b6e6-001dd83068fb","10/8/2021","2021-10-08T04:00:00Z","053549","9/29/2021","2021-09-29T04:00:00Z","58 LAWRENCE AVENUE","40,628,419.000000",40628419,"1f0410ca-32f4-ea11-b882-24ee9a37d45c","Staten Island",882450004,"-74,107,537.000000",-74107537,"31","P.S. 45 - STATEN ISLAND","P.S. 045 John Tyler - R045 - R045 - 31R045 - 58 LAWRENCE AVENUE"
"W/""327199582""","Partial Classroom Quarantine",882450001,"bb86ec18-8a20-ec11-b6e6-001dd83068fb","10/4/2021","2021-10-04T04:00:00Z","053556","9/29/2021","2021-09-29T04:00:00Z","1700 3 AVENUE","40,785,018.000000",40785018,"7f8d8486-31f4-ea11-b882-24ee9a37d45c","Manhattan",882450000,"-73,950,420.000000",-73950420,"2","P.S. 198 - MANHATTAN","P.S. 198 Isador E. Ida Straus - M198 - M198 - 02M198 - 1700 3 AVENUE"
"W/""327252743""","Partial Classroom Quarantine",882450001,"d172cb02-8d20-ec11-b6e6-001dd83068fb","10/7/2021","2021-10-07T04:00:00Z","053568","9/29/2021","2021-09-29T04:00:00Z","100 WEST MOSHOLU PARKWAY SOUTH","40,879,958.000000",40879958,"4cffcc6e-33f4-ea11-b882-24ee9a37d45c","Bronx",882450001,"-73,889,011.000000",-73889011,"10","DEWITT CLINTON HS - X","World View High School - X353 - X440 - 10X353 - 100 WEST MOSHOLU PARKWAY SOUTH"
"W/""327686988""","Partial Classroom Quarantine",882450001,"4482feaf-9020-ec11-b6e6-001dd83068fb","10/7/2021","2021-10-07T04:00:00Z","053586","9/29/2021","2021-09-29T04:00:00Z","170 GATES AVENUE","40,684,286.000000",40684286,"39eabc42-30f4-ea11-b882-24ee9a37d45c","Brooklyn",882450002,"-73,960,536.000000",-73960536,"13","P.S. 56 - BROOKLYN","The Urban Assembly Unison School - K351 - K056 - 13K351 - 170 GATES AVENUE"
"W/""328091503""","Partial Classroom Quarantine",882450001,"28c70583-9220-ec11-b6e6-001dd83068fb","10/7/2021","2021-10-07T04:00:00Z","053594","9/30/2021","2021-09-30T04:00:00Z","51-60 MARATHON PARKWAY","40,762,241.000000",40762241,"732f77fa-31f4-ea11-b882-24ee9a37d45c","Queens",882450003,"-73,734,832.000000",-73734832,"26","J.H.S. 67 - QUEENS","J.H.S. 067 Louis Pasteur - Q067 - Q067 - 26Q067 - 51-60 MARATHON PARKWAY"
"W/""328091548""","Classroom Closed",882450000,"cf843a07-1721-ec11-b6e6-001dd83068fb","10/8/2021","2021-10-08T04:00:00Z","053617","9/30/2021","2021-09-30T04:00:00Z","545 WILLOUGHBY AVENUE","40,694,470.000000",40694470,"e5968d36-30f4-ea11-b882-24ee9a37d45c","Brooklyn",882450002,"-73,947,256.000000",-73947256,"14","P.S. 23 - BROOKLYN","P.S. 023 Carter G. Woodson - K023 - K023 - 14K023 - 545 WILLOUGHBY AVENUE"
"W/""328091563""","Classroom Closed",882450000,"0391a459-1821-ec11-b6e6-001dd83068fb","10/2/2021","2021-10-02T04:00:00Z","053621","9/30/2021","2021-09-30T04:00:00Z","2545 GUNTHER AVENUE","40,863,842.000000",40863842,"b22aa42b-33f4-ea11-b882-24ee9a37d45c","Bronx",882450001,"-73,836,525.000000",-73836525,"11","I.S. 144 - BRONX","Bronx Charter School for Better Learning II - X484 - X144 - 84X484 - 2545 GUNTHER AVENUE"
"W/""328091604""","Classroom Closed",882450000,"a4617960-1a21-ec11-b6e6-001dd83068fb","10/4/2021","2021-10-04T04:00:00Z","053633","9/30/2021","2021-09-30T04:00:00Z","1595 BATHGATE AVENUE","40,839,508.000000",40839508,"e177bb9f-33f4-ea11-b882-24ee9a37d45c","Bronx",882450001,"-73,901,774.000000",-73901774,"9","BATHGATE HS - BRONX","Urban Assembly School for Applied Math and Science, The - X241 - X970 - 09X241 - 1595 BATHGATE AVENUE"
"W/""328091609""","Classroom Closed",882450000,"21e1ca98-1a21-ec11-b6e6-001dd83068fb","10/8/2021","2021-10-08T04:00:00Z","053634","9/30/2021","2021-09-30T04:00:00Z","3829 AVENUE K","40,626,038.000000",40626038,"b4315367-30f4-ea11-b882-24ee9a37d45c","Brooklyn",882450002,"-73,938,733.000000",-73938733,"22","P.S. 119 - BROOKLYN","P.S. 119 Amersfort - K119 - K119 - 22K119 - 3829 AVENUE K"
"W/""328651206""","Classroom Closed",882450000,"1f334b86-1f21-ec11-b6e6-001dd83068fb","10/4/2021","2021-10-04T04:00:00Z","053654","10/1/2021","2021-10-01T04:00:00Z","86-35 235 COURT","40,731,853.000000",40731853,"16f32ce2-31f4-ea11-b882-24ee9a37d45c","Queens",882450003,"-73,732,290.000000",-73732290,"26","P.S. 18 - QUEENS","P.S. 018 Winchester - Q018 - Q018 - 26Q018 - 86-35 235 COURT"
"W/""328091690""","Non-Classroom Quarantine",882450003,"bc1d27f4-2021-ec11-b6e6-001dd83068fb","10/4/2021","2021-10-04T04:00:00Z","053660","9/30/2021","2021-09-30T04:00:00Z","112 SCHERMERHORN STREET","40,690,007.000000",40690007,"f7fb3df4-30f4-ea11-b882-24ee9a37d45c","Brooklyn",882450002,"-73,989,369.000000",-73989369,"15","PACIFIC ALT HS - K","Brooklyn Frontiers High School - K423 - K520 - 15K423 - 112 SCHERMERHORN STREET"
"W/""328091700""","Classroom Closed",882450000,"10d4dc4b-2221-ec11-b6e6-001dd83068fb","10/4/2021","2021-10-04T04:00:00Z","053663","9/30/2021","2021-09-30T04:00:00Z","757 WORTMAN AVENUE","40,664,143.000000",40664143,"e121d292-30f4-ea11-b882-24ee9a37d45c","Brooklyn",882450002,"-73,866,542.000000",-73866542,"19","P.S. 224 - BROOKLYN","P.S. 224 Hale A. Woodruff - K224 - K224 - 19K224 - 757 WORTMAN AVENUE"
"W/""328091740""","Partial Classroom Quarantine",882450001,"9b5e8675-2421-ec11-b6e6-001dd83068fb","10/8/2021","2021-10-08T04:00:00Z","053676","9/30/2021","2021-09-30T04:00:00Z","977 FOX STREET","40,822,056.000000",40822056,"fd77931f-33f4-ea11-b882-24ee9a37d45c","Bronx",882450001,"-73,894,368.000000",-73894368,"12","I.S. 216 - BRONX","South Bronx Classical Charter School - X346 - X116 - 84X346 - 977 FOX STREET"
"W/""328232961""","No Intervention",882450002,"bba77e7b-2421-ec11-b6e6-001dd83068fb","10/1/2021","2021-10-01T04:00:00Z","053677","9/30/2021","2021-09-30T04:00:00Z","100 LUTEN AVENUE","40,528,152.000000",40528152,"605b4cd6-32f4-ea11-b882-24ee9a37d45c","Staten Island",882450004,"-74,193,431.000000",-74193431,"31","TOTTENVILLE HS - S. I.","Tottenville High School - R455 - R455 - 31R455 - 100 LUTEN AVENUE"
"W/""328685486""","Partial Classroom Quarantine",882450001,"69047a03-2621-ec11-b6e6-001dd83068fb","10/4/2021","2021-10-04T04:00:00Z","053690","9/30/2021","2021-09-30T04:00:00Z","127 EAST  22 STREET","40,739,121.000000",40739121,"680c1bb1-31f4-ea11-b882-24ee9a37d45c","Manhattan",882450000,"-73,985,323.000000",-73985323,"2","SCHL OF THE FUTURE (OLD BACON) - M","School of the Future High School - M413 - M660 - 02M413 - 127 EAST  22 STREET"
"W/""328407957""","Partial Classroom Quarantine",882450001,"83e2cae9-2721-ec11-b6e6-001dd83068fb","10/4/2021","2021-10-04T04:00:00Z","053708","10/1/2021","2021-10-01T04:00:00Z","916 EAGLE AVENUE","40,823,318.000000",40823318,"9f2aa42b-33f4-ea11-b882-24ee9a37d45c","Bronx",882450001,"-73,907,489.000000",-73907489,"8","P.S. 140 - BRONX","P.S. X140 The Eagle School - X140 - X140 - 08X140 - 916 EAGLE AVENUE"
"W/""328091811""","Partial Classroom Quarantine",882450001,"3afd5f64-2821-ec11-b6e6-001dd83068fb","10/4/2021","2021-10-04T04:00:00Z","053712","9/30/2021","2021-09-30T04:00:00Z","800 VAN SICLEN AVE","40,659,934.000000",40659934,"41ebaa73-30f4-ea11-b882-24ee9a37d45c","Brooklyn",882450002,"-73,885,704.000000",-73885704,"19","I.S. 166 - BROOKLYN","Achievement First Linden Charter School - K788 - K166 - 84K788 - 800 VAN SICLEN AVE"
"W/""328091821""","Non-Classroom Quarantine",882450003,"09b73fd9-2821-ec11-b6e6-001dd83068fb","10/8/2021","2021-10-08T04:00:00Z","053718","9/30/2021","2021-09-30T04:00:00Z","123 RIDGE STREET","40,719,148.000000",40719148,"3a9f4974-31f4-ea11-b882-24ee9a37d45c","Manhattan",882450000,"-73,983,769.000000",-73983769,"1","P.S. 140 - MANHATTAN","P.S. 140 Nathan Straus - M140 - M140 - 01M140 - 123 RIDGE STREET"
"W/""328565710""","Partial Classroom Quarantine",882450001,"462ca1b2-2a21-ec11-b6e6-001dd83068fb","10/4/2021","2021-10-04T04:00:00Z","053730","9/30/2021","2021-09-30T04:00:00Z","120 EAST 184 STREET","40,859,496.000000",40859496,"5b0d6d19-33f4-ea11-b882-24ee9a37d45c","Bronx",882450001,"-73,900,490.000000",-73900490,"10","I.S. 399 (OLD X HS/X115) - BRONX","Academy For Personal Leadership And Excellence - X363 - X115 - 10X363 - 120 EAST 184 STREET"
"W/""328652667""","Partial Classroom Quarantine",882450001,"0824fe08-2b21-ec11-b6e6-001dd83068fb","10/7/2021","2021-10-07T04:00:00Z","053732","9/30/2021","2021-09-30T04:00:00Z","590 SHEFFIELD AVENUE","40,662,243.000000",40662243,"dbb36d80-30f4-ea11-b882-24ee9a37d45c","Brooklyn",882450002,"-73,894,877.000000",-73894877,"19","P.S. 190 - BROOKLYN","Legacy School of the Arts - K907 - K190 - 19K907 - 590 SHEFFIELD AVENUE"
"W/""328091881""","Partial Classroom Quarantine",882450001,"46988334-2b21-ec11-b6e6-001dd83068fb","10/7/2021","2021-10-07T04:00:00Z","053733","9/30/2021","2021-09-30T04:00:00Z","4200 16 AVENUE","40,635,100.000000",40635100,"735bc58c-30f4-ea11-b882-24ee9a37d45c","Brooklyn",882450002,"-73,982,424.000000",-73982424,"20","I.S. 223 - BROOKLYN","Urban Assembly School for Leadership and Empowerment - K609 - K223 - 20K609 - 4200 16 AVENUE"
"W/""328548063""","Partial Classroom Quarantine",882450001,"8c8261c6-3321-ec11-b6e6-001dd83068fb","10/8/2021","2021-10-08T04:00:00Z","053777","9/30/2021","2021-09-30T04:00:00Z","1580 DEAN STREET","40,675,675.000000",40675675,"7aa5db98-30f4-ea11-b882-24ee9a37d45c","Brooklyn",882450002,"-73,935,093.000000",-73935093,"16","P.S. 243 - BROOKLYN","P.S. 243K- The Weeksville School - K243 - K243 - 16K243 - 1580 DEAN STREET"
"W/""328241251""","Classroom Closed",882450000,"83779a34-3721-ec11-b6e6-001dd83068fb","10/9/2021","2021-10-09T04:00:00Z","053807","9/30/2021","2021-09-30T04:00:00Z","1684 WHITE PLAINS ROAD","40,843,531.000000",40843531,"daba3c50-33f4-ea11-b882-24ee9a37d45c","Bronx",882450001,"-73,865,498.000000",-73865498,"11","P.S. 311 - BRONX","The STEAM Bridge School - X481 - X311 - 11X481 - 1684 WHITE PLAINS ROAD"
"W/""328649744""","Classroom Closed",882450000,"e97cebe9-3c21-ec11-b6e6-001dd83068fb","10/8/2021","2021-10-08T04:00:00Z","053842","9/30/2021","2021-09-30T04:00:00Z","1657 VICTORY BOULEVARD","40,613,792.000000",40613792,"abc9a854-4afb-ea11-b883-24ee9a37d459",,,"-74,118,931.000000",-74118931,"31","CASTLETON HILL MORAVIAN PRE SCHOOL","Castleton Hill Moravian Pre School - RADP - RADP -  - 1657 VICTORY BOULEVARD"
"W/""328240517""","Classroom Closed",882450000,"77f12e7a-4021-ec11-b6e6-001dd83068fb","10/7/2021","2021-10-07T04:00:00Z","053866","9/30/2021","2021-09-30T04:00:00Z","3010 BRIGGS AVENUE","40,872,259.000000",40872259,"1b9ebaee-32f4-ea11-b882-24ee9a37d45c","Bronx",882450001,"-73,883,339.000000",-73883339,"10","P.S. 8 - BRONX","P.S. 008 Isaac Varian - X008 - X008 - 10X008 - 3010 BRIGGS AVENUE"
"W/""328840424""","Partial Classroom Quarantine",882450001,"1914daa0-5121-ec11-b6e6-001dd83068fb","10/8/2021","2021-10-08T04:00:00Z","053945","10/1/2021","2021-10-01T04:00:00Z","1186 Carroll Street","40,666,790.000000",40666790,"e33159fa-30f4-ea11-b882-24ee9a37d45c","Brooklyn",882450002,"-73,951,823.000000",-73951823,"17","MIDDLE COLLEGE HS - BROOKLYN","Medgar Evers College Preparatory School - K590 - K590 - 17K590 - 1186 Carroll Street"
"W/""328092291""","Classroom Closed",882450000,"338cf3b9-5121-ec11-b6e6-001dd83068fb","10/8/2021","2021-10-08T04:00:00Z","053947","9/30/2021","2021-09-30T04:00:00Z","1001 EAST  45 STREET","40,635,842.000000",40635842,"2fe2abc9-30f4-ea11-b882-24ee9a37d45c","Brooklyn",882450002,"-73,933,099.000000",-73933099,"22","P.S./I.S. 395 - BROOKLYN","P.S. 109 - K109 - K395 - 22K109 - 1001 EAST  45 STREET"
"W/""328678259""","Partial Classroom Quarantine",882450001,"1868d085-5421-ec11-b6e6-001dd83068fb","10/9/2021","2021-10-09T04:00:00Z","053968","9/30/2021","2021-09-30T04:00:00Z","713 CATON AVENUE","40,647,598.000000",40647598,"4488e6db-30f4-ea11-b882-24ee9a37d45c","Brooklyn",882450002,"-73,973,363.000000",-73973363,"15","P.S./I.S. 437 - BROOKLYN","M.S. 839 - K839 - K437 - 15K839 - 713 CATON AVENUE"
"W/""328279459""","Partial Classroom Quarantine",882450001,"9bd37988-5a21-ec11-b6e6-001dd83068fb","10/4/2021","2021-10-04T04:00:00Z","053998","10/1/2021","2021-10-01T04:00:00Z","3040 ROBERTS AVENUE","40,845,379.000000",40845379,"e3d10307-33f4-ea11-b882-24ee9a37d45c","Bronx",882450001,"-73,829,562.000000",-73829562,"8","P.S. 71 - BRONX","P.S. 071 Rose E. Scala - X071 - X071 - 08X071 - 3040 ROBERTS AVENUE"
"W/""328685527""","Non-Classroom Quarantine",882450003,"8c34aa9a-5a21-ec11-b6e6-001dd83068fb","10/4/2021","2021-10-04T04:00:00Z","053999","10/1/2021","2021-10-01T04:00:00Z","57-40 MARATHON PARKWAY","40,758,808.000000",40758808,"11b7c337-32f4-ea11-b882-24ee9a37d45c","Queens",882450003,"-73,731,518.000000",-73731518,"26","P.S. 221 - QUEENS","P.S. 221 The North Hills School - Q221 - Q221 - 26Q221 - 57-40 MARATHON PARKWAY"
"W/""328298095""","Classroom Closed",882450000,"b3c8f059-de21-ec11-b6e6-001dd83068fb","10/9/2021","2021-10-09T04:00:00Z","054021","10/1/2021","2021-10-01T04:00:00Z","4211 14 AVENUE","40,637,101.000000",40637101,"36ebaa73-30f4-ea11-b882-24ee9a37d45c","Brooklyn",882450002,"-73,985,739.000000",-73985739,"20","P.S. 164 - BROOKLYN","P.S. 164 Caesar Rodney - K164 - K164 - 20K164 - 4211 14 AVENUE"
"W/""328725174""","Partial Classroom Quarantine",882450001,"841e1f67-e021-ec11-b6e6-001dd83068fb","10/3/2021","2021-10-03T04:00:00Z","054028","10/1/2021","2021-10-01T04:00:00Z","237 7 AVENUE","40,669,255.000000",40669255,"929c11e8-30f4-ea11-b882-24ee9a37d45c","Brooklyn",882450002,"-73,978,580.000000",-73978580,"15","John Jay Educational Campus","Park Slope Collegiate - K464 - K460 - 15K464 - 237 7 AVENUE"
"W/""328728321""","Partial Classroom Quarantine",882450001,"19998a52-e221-ec11-b6e6-001dd83068fb","10/7/2021","2021-10-07T04:00:00Z","054034","10/1/2021","2021-10-01T04:00:00Z","157 WILSON STREET","40,706,069.000000",40706069,"f9f57030-30f4-ea11-b882-24ee9a37d45c","Brooklyn",882450002,"-73,962,049.000000",-73962049,"14","P.S. 16 - BROOKLYN","P.S. 016 Leonard Dunkly - K016 - K016 - 14K016 - 157 WILSON STREET"
"W/""328731962""","Classroom Closed",882450000,"a72936db-e321-ec11-b6e6-001dd83068fb","10/8/2021","2021-10-08T04:00:00Z","054044","10/1/2021","2021-10-01T04:00:00Z","4305 7 AVENUE","40,645,825.000000",40645825,"55ebaa73-30f4-ea11-b882-24ee9a37d45c","Brooklyn",882450002,"-74,001,700.000000",-74001700,"15","P.S. 169 - BROOKLYN","P.S. 169 Sunset Park - K169 - K169 - 15K169 - 4305 7 AVENUE"
"W/""328764901""","Partial Classroom Quarantine",882450001,"10cb0755-e421-ec11-b6e6-001dd83068fb","10/9/2021","2021-10-09T04:00:00Z","054049","10/1/2021","2021-10-01T04:00:00Z","141 EAST 111 STREET","40,796,098.000000",40796098,"50e61462-31f4-ea11-b882-24ee9a37d45c","Manhattan",882450000,"-73,944,546.000000",-73944546,"4","P.S. 101 - MANHATTAN","Mosaic Preparatory Academy - M375 - M101 - 04M375 - 141 EAST 111 STREET"
"W/""328421505""","Partial Classroom Quarantine",882450001,"22e93dda-e621-ec11-b6e6-001dd83068fb","10/1/2021","2021-10-01T04:00:00Z","054056","10/1/2021","2021-10-01T04:00:00Z","167-01 GOTHIC DRIVE","40,714,551.000000",40714551,"1f02926e-32f4-ea11-b882-24ee9a37d45c","Queens",882450003,"-73,798,658.000000",-73798658,"28","JAMAICA HS - Q","Queens Collegiate: A College Board School - Q310 - Q470 - 28Q310 - 167-01 GOTHIC DRIVE"
"W/""328445639""","Partial Classroom Quarantine",882450001,"beb16300-e721-ec11-b6e6-001dd83068fb","10/9/2021","2021-10-09T04:00:00Z","054057","10/1/2021","2021-10-01T04:00:00Z","120 EAST 184 STREET","40,859,496.000000",40859496,"5b0d6d19-33f4-ea11-b882-24ee9a37d45c","Bronx",882450001,"-73,900,490.000000",-73900490,"10","I.S. 399 (OLD X HS/X115) - BRONX","Academy For Personal Leadership And Excellence - X363 - X115 - 10X363 - 120 EAST 184 STREET"
"W/""328744252""","Partial Classroom Quarantine",882450001,"23e2fdf8-e721-ec11-b6e6-001dd83068fb","10/9/2021","2021-10-09T04:00:00Z","054059","10/1/2021","2021-10-01T04:00:00Z","25 AUGUSTA AVENUE","40,552,213.000000",40552213,"8811b2e2-32f4-ea11-b882-24ee9a37d45c","Staten Island",882450004,"-74,169,038.000000",-74169038,"31","P.S. 42 ANNEX - STATEN ISLAND","P.S. 042 Eltingville - R042 - R848 - 31R042 - 25 AUGUSTA AVENUE"
"W/""328306954""","Classroom Closed",882450000,"1bfceb95-e821-ec11-b6e6-001dd83068fb","10/8/2021","2021-10-08T04:00:00Z","054061","10/1/2021","2021-10-01T04:00:00Z","75-10 21 Avenue","40,769,798.000000",40769798,"93dc32dc-31f4-ea11-b882-24ee9a37d45c","Queens",882450003,"-73,894,108.000000",-73894108,"30","P.S. 2 - QUEENS","P.S. 002 Alfred Zimberg - Q002 - Q002 - 30Q002 - 75-10 21 Avenue"
"W/""328745342""","Partial Classroom Quarantine",882450001,"572805a2-e821-ec11-b6e6-001dd83068fb","10/4/2021","2021-10-04T04:00:00Z","054063","10/1/2021","2021-10-01T04:00:00Z","800 VAN SICLEN AVE","40,659,934.000000",40659934,"41ebaa73-30f4-ea11-b882-24ee9a37d45c","Brooklyn",882450002,"-73,885,704.000000",-73885704,"19","I.S. 166 - BROOKLYN","Achievement First Linden Charter School - K788 - K166 - 84K788 - 800 VAN SICLEN AVE"
"W/""328836198""","Partial Classroom Quarantine",882450001,"083733e7-e821-ec11-b6e6-001dd83068fb","10/8/2021","2021-10-08T04:00:00Z","054065","10/1/2021","2021-10-01T04:00:00Z","380 GENESEE AVENUE","40,552,213.000000",40552213,"110410ca-32f4-ea11-b882-24ee9a37d45c","Staten Island",882450004,"-74,169,038.000000",-74169038,"31","P.S. 42 - STATEN ISLAND","P.S. 042 Eltingville - R042 - R042 - 31R042 - 380 GENESEE AVENUE"
"W/""328749621""","Non-Classroom Quarantine",882450003,"75abb4f9-e821-ec11-b6e6-001dd83068fb","10/10/2021","2021-10-10T04:00:00Z","054066","10/1/2021","2021-10-01T04:00:00Z","33 FERNDALE AVENUE","40,592,132.000000",40592132,"e48521d0-32f4-ea11-b882-24ee9a37d45c","Staten Island",882450004,"-74,158,618.000000",-74158618,"31","I.S. 72 - STATEN ISLAND","I.S. 072 Rocco Laurie - R072 - R072 - 31R072 - 33 FERNDALE AVENUE"
"W/""328843100""","Partial Classroom Quarantine",882450001,"575d0886-eb21-ec11-b6e6-001dd83068fb","10/9/2021","2021-10-09T04:00:00Z","054070","10/1/2021","2021-10-01T04:00:00Z","120 EAST 184 STREET","40,859,496.000000",40859496,"5b0d6d19-33f4-ea11-b882-24ee9a37d45c","Bronx",882450001,"-73,900,490.000000",-73900490,"10","I.S. 399 (OLD X HS/X115) - BRONX","Academy For Personal Leadership And Excellence - X363 - X115 - 10X363 - 120 EAST 184 STREET"
"W/""328372072""","Partial Classroom Quarantine",882450001,"5be51cb2-eb21-ec11-b6e6-001dd83068fb","10/7/2021","2021-10-07T04:00:00Z","054071","10/1/2021","2021-10-01T04:00:00Z","244 WEST 144 STREET","40,821,208.000000",40821208,"708d8486-31f4-ea11-b882-24ee9a37d45c","Manhattan",882450000,"-73,941,111.000000",-73941111,"5","P.S. 194 - MANHATTAN","Harlem Village Academy West Charter School - M709 - M194 - 84M709 - 244 WEST 144 STREET"
"W/""328423973""","Classroom Closed",882450000,"9aa24e81-ec21-ec11-b6e6-001dd83068fb","10/3/2021","2021-10-03T04:00:00Z","054073","10/1/2021","2021-10-01T04:00:00Z","123 RIDGE STREET","40,719,148.000000",40719148,"3a9f4974-31f4-ea11-b882-24ee9a37d45c","Manhattan",882450000,"-73,983,769.000000",-73983769,"1","P.S. 140 - MANHATTAN","P.S. 140 Nathan Straus - M140 - M140 - 01M140 - 123 RIDGE STREET"
"W/""328334031""","No Intervention",882450002,"3db04b87-ec21-ec11-b6e6-001dd83068fb","10/1/2021","2021-10-01T04:00:00Z","054074","9/30/2021","2021-09-30T04:00:00Z","70 Ocean Parkway","40,648,924.000000",40648924,"cc315367-30f4-ea11-b882-24ee9a37d45c","Brooklyn",882450002,"-73,976,053.000000",-73976053,"15","P.S. 130 - BROOKLYN","P.S. 130 The Parkside - K130 - K130 - 15K130 - 70 Ocean Parkway"
"W/""328765229""","Partial Classroom Quarantine",882450001,"6ff812b1-ef21-ec11-b6e6-001dd83068fb","10/9/2021","2021-10-09T04:00:00Z","054083","10/1/2021","2021-10-01T04:00:00Z","32-02 JUNCTION BOULEVARD","40,757,567.000000",40757567,"27b7c337-32f4-ea11-b882-24ee9a37d45c","Queens",882450003,"-73,874,614.000000",-73874614,"30","I.S. 227 - QUEENS","I.S. 227 Louis Armstrong - Q227 - Q227 - 30Q227 - 32-02 JUNCTION BOULEVARD"
"W/""328836953""","Partial Classroom Quarantine",882450001,"f2a327e4-f021-ec11-b6e6-001dd83068fb","10/7/2021","2021-10-07T04:00:00Z","054090","10/1/2021","2021-10-01T04:00:00Z","351 WEST  18 STREET","40,743,407.000000",40743407,"7834aa92-31f4-ea11-b882-24ee9a37d45c","Manhattan",882450000,"-74,002,540.000000",-74002540,"2","BAYARD RUSTIN EDUCATIONAL COMP-M","James Baldwin School, The: A School for Expeditionary Learning - M313 - M440 - 02M313 - 351 WEST  18 STREET"
"W/""328752077""","Classroom Closed",882450000,"03f269c5-f221-ec11-b6e6-001dd83068fb","10/8/2021","2021-10-08T04:00:00Z","054106","10/1/2021","2021-10-01T04:00:00Z","1100 ELM AVENUE","40,616,310.000000",40616310,"fdb98b86-30f4-ea11-b882-24ee9a37d45c","Brooklyn",882450002,"-73,963,026.000000",-73963026,"21","P.S. 199 - BROOKLYN","P.S. 199 Frederick Wachtel - K199 - K199 - 21K199 - 1100 ELM AVENUE"
"W/""328470504""","No Intervention",882450002,"55f5d3a9-fa21-ec11-b6e6-001dd83068fb","10/1/2021","2021-10-01T04:00:00Z","054137","9/30/2021","2021-09-30T04:00:00Z","350 Gerard Avenue","40,815,712.000000",40815712,"2dff3d8d-33f4-ea11-b882-24ee9a37d45c","Bronx",882450001,"-73,929,960.000000",-73929960,"7","HEALTH OPPORTUNITIES HS - X","Health Opportunities High School - X670 - X884 - 07X670 - 350 Gerard Avenue"
"W/""328752212""","Non-Classroom Quarantine",882450003,"01fb7ed8-fd21-ec11-b6e6-001dd83068fb","10/9/2021","2021-10-09T04:00:00Z","054155","10/1/2021","2021-10-01T04:00:00Z","98-02 ROOSEVELT AVENUE","40,748,600.000000",40748600,"19f32ce2-31f4-ea11-b882-24ee9a37d45c","Queens",882450003,"-73,866,557.000000",-73866557,"24","P.S. 19 - QUEENS","P.S. 019 Marino Jeantet - Q019 - Q019 - 24Q019 - 98-02 ROOSEVELT AVENUE"
"W/""328510145""","Partial Classroom Quarantine",882450001,"2c517546-0122-ec11-b6e6-001dd83068fb","10/8/2021","2021-10-08T04:00:00Z","054176","10/1/2021","2021-10-01T04:00:00Z","35 WEST 124TH STREET","40,806,262.000000",40806262,"cae0838c-31f4-ea11-b882-24ee9a37d45c","Manhattan",882450000,"-73,943,951.000000",-73943951,"5","HARLEM VILLAGE ACADEMY - MANHATTAN","Harlem Village Academy East Charter School - M335 - M280 - 84M335 - 35 WEST 124TH STREET"
"W/""328562898""","Partial Classroom Quarantine",882450001,"1408db8a-0122-ec11-b6e6-001dd83068fb","10/9/2021","2021-10-09T04:00:00Z","054177","10/1/2021","2021-10-01T04:00:00Z","1680 LEXINGTON AVENUE","40,791,966.000000",40791966,"61e61462-31f4-ea11-b882-24ee9a37d45c","Manhattan",882450000,"-73,946,879.000000",-73946879,"4","THE HERITAGE SCHOOL - MANHATTAN","Heritage School, The - M680 - M107 - 04M680 - 1680 LEXINGTON AVENUE"
"W/""328778267""","Partial Classroom Quarantine",882450001,"5da521e6-0522-ec11-b6e6-001dd83068fb","10/10/2021","2021-10-10T04:00:00Z","054203","10/1/2021","2021-10-01T04:00:00Z","925 ASTOR AVENUE","40,860,443.000000",40860443,"439d7c62-33f4-ea11-b882-24ee9a37d45c","Bronx",882450001,"-73,860,729.000000",-73860729,"11","CHRISTOPHER COLUMBUS HS - X","Collegiate Institute for Math and Science - X288 - X415 - 11X288 - 925 ASTOR AVENUE"
"W/""328611793""","Partial Classroom Quarantine",882450001,"0ea887f9-0822-ec11-b6e6-001dd83068fb","10/8/2021","2021-10-08T04:00:00Z","054217","10/1/2021","2021-10-01T04:00:00Z","80-55 CORNISH AVENUE","40,739,644.000000",40739644,"ecf22ce2-31f4-ea11-b882-24ee9a37d45c","Queens",882450003,"-73,882,446.000000",-73882446,"24","P.S. 7 - QUEENS","P.S. 007 Louis F. Simeone - Q007 - Q007 - 24Q007 - 80-55 CORNISH AVENUE"
"W/""328756345""","Classroom Closed",882450000,"d41279ea-0a22-ec11-b6e6-001dd83068fb","10/7/2021","2021-10-07T04:00:00Z","054224","10/1/2021","2021-10-01T04:00:00Z","120 STUYVESANT PLACE","40,643,000.000000",40643000,"e98521d0-32f4-ea11-b882-24ee9a37d45c","Staten Island",882450004,"-74,076,955.000000",-74076955,"31","PRE-K CENTER @ 120 STUYVESANT PLACE - S.I.","The Richmond Pre-K Center - R066 - R077 - 31R066 - 120 STUYVESANT PLACE"
"W/""328775175""","Partial Classroom Quarantine",882450001,"cce4a7e1-0c22-ec11-b6e6-001dd83068fb","10/7/2021","2021-10-07T04:00:00Z","054233","10/1/2021","2021-10-01T04:00:00Z","134 WEST 122 STREET","40,806,055.000000",40806055,"459f4974-31f4-ea11-b882-24ee9a37d45c","Manhattan",882450000,"-73,948,385.000000",-73948385,"3","P.S. 242 (OLD P144) - MANHATTAN","P.S. 242 - The Young Diplomats Magnet Academy - M242 - M144 - 03M242 - 134 WEST 122 STREET"
"W/""328658436""","Partial Classroom Quarantine",882450001,"bc670080-0d22-ec11-b6e6-001dd83068fb","10/4/2021","2021-10-04T04:00:00Z","054236","10/1/2021","2021-10-01T04:00:00Z","800 BAYCHESTER AVENUE","40,874,035.000000",40874035,"e78a0044-33f4-ea11-b882-24ee9a37d45c","Bronx",882450001,"-73,831,669.000000",-73831669,"11","I.S. 181 - BRONX","I.S. 181 Pablo Casals - X181 - X181 - 11X181 - 800 BAYCHESTER AVENUE"
"W/""328766794""","Partial Classroom Quarantine",882450001,"96b85ea9-1322-ec11-b6e6-001dd83068fb","10/8/2021","2021-10-08T04:00:00Z","054257","10/1/2021","2021-10-01T04:00:00Z","218-01 116 Avenue","40,698,028.000000",40698028,"e6883319-32f4-ea11-b882-24ee9a37d45c","Queens",882450003,"-73,740,140.000000",-73740140,"29","P.S. 147 - QUEENS","P.S./M.S. 147 Ronald McNair - Q147 - Q147 - 29Q147 - 218-01 116 Avenue"
"W/""328752951""","Partial Classroom Quarantine",882450001,"122dfb52-1522-ec11-b6e6-001dd83068fb","10/9/2021","2021-10-09T04:00:00Z","054262","10/1/2021","2021-10-01T04:00:00Z","8301 SHORE ROAD","40,626,827.000000",40626827,"522b3eee-30f4-ea11-b882-24ee9a37d45c","Brooklyn",882450002,"-74,038,103.000000",-74038103,"20","FORT HAMILTON HS - K","Fort Hamilton High School - K490 - K490 - 20K490 - 8301 SHORE ROAD"
"W/""328774016""","Partial Classroom Quarantine",882450001,"cfeadecd-1822-ec11-b6e6-001dd83068fb","10/9/2021","2021-10-09T04:00:00Z","054280","10/1/2021","2021-10-01T04:00:00Z","170 GATES AVENUE","40,684,286.000000",40684286,"39eabc42-30f4-ea11-b882-24ee9a37d45c","Brooklyn",882450002,"-73,960,536.000000",-73960536,"13","P.S. 56 - BROOKLYN","The Urban Assembly Unison School - K351 - K056 - 13K351 - 170 GATES AVENUE"
"W/""328843789""","Classroom Closed",882450000,"177a7054-2422-ec11-b6e6-001dd83068fb","10/10/2021","2021-10-10T04:00:00Z","054329","10/1/2021","2021-10-01T04:00:00Z","1794 EAST 172 STREET","40,832,529.000000",40832529,"5036d900-33f4-ea11-b882-24ee9a37d45c","Bronx",882450001,"-73,866,974.000000",-73866974,"12","P.S. 47 - BRONX","P.S. 047 John Randolph - X047 - X047 - 12X047 - 1794 EAST 172 STREET"
"W/""324595345""","Classroom Closed",882450000,"807e96f2-d51e-ec11-b6e6-001dd83069ee","10/4/2021","2021-10-04T04:00:00Z","052463","9/27/2021","2021-09-27T04:00:00Z","190-20 109 ROAD","40,703,182.000000",40703182,"d62ff20c-32f4-ea11-b882-24ee9a37d45c","Queens",882450003,"-73,765,237.000000",-73765237,"29","P.S. 118 - QUEENS","P.S. 118 Lorraine Hansberry - Q118 - Q118 - 29Q118 - 190-20 109 ROAD"
"W/""328226883""","Partial Classroom Quarantine",882450001,"e0b4fe4e-d61e-ec11-b6e6-001dd83069ee","10/4/2021","2021-10-04T04:00:00Z","052464","9/27/2021","2021-09-27T04:00:00Z","80 WILLOWBROOK ROAD","40,623,077.000000",40623077,"2f0410ca-32f4-ea11-b882-24ee9a37d45c","Staten Island",882450004,"-74,145,522.000000",-74145522,"31","I.S. 51 - STATEN ISLAND","I.S. 051 Edwin Markham - R051 - R051 - 31R051 - 80 WILLOWBROOK ROAD"
"W/""324597011""","Partial Classroom Quarantine",882450001,"36891d6f-d81e-ec11-b6e6-001dd83069ee","10/4/2021","2021-10-04T04:00:00Z","052468","9/27/2021","2021-09-27T04:00:00Z","88-15 182 Street","40,712,743.000000",40712743,"2106003e-32f4-ea11-b882-24ee9a37d45c","Queens",882450003,"-73,779,653.000000",-73779653,"29","I.S. 238 - QUEENS","I.S. 238 - Susan B. Anthony Academy - Q238 - Q238 - 29Q238 - 88-15 182 Street"
"W/""324595396""","Classroom Closed",882450000,"c2e959e7-db1e-ec11-b6e6-001dd83069ee","10/4/2021","2021-10-04T04:00:00Z","052475","9/27/2021","2021-09-27T04:00:00Z","33-09 35 AVENUE","40,757,497.000000",40757497,"7a0e6e25-32f4-ea11-b882-24ee9a37d45c","Queens",882450003,"-73,926,249.000000",-73926249,"30","P.S. 166 - QUEENS","P.S. 166 Henry Gradstein - Q166 - Q166 - 30Q166 - 33-09 35 AVENUE"
"W/""324597080""","Classroom Closed",882450000,"de01e0bc-dd1e-ec11-b6e6-001dd83069ee","10/4/2021","2021-10-04T04:00:00Z","052485","9/27/2021","2021-09-27T04:00:00Z","110 EAST  88 STREET","40,780,798.000000",40780798,"34005d7a-31f4-ea11-b882-24ee9a37d45c","Manhattan",882450000,"-73,955,594.000000",-73955594,"2","P.S. 169 (ECF) - MANHATTAN","P.S. M169 - Robert F. Kennedy - M169 - M169 - 75M169 - 110 EAST  88 STREET"
"W/""324811452""","Classroom Closed",882450000,"88a2dfe3-e01e-ec11-b6e6-001dd83069ee","10/4/2021","2021-10-04T04:00:00Z","052504","9/27/2021","2021-09-27T04:00:00Z","179-01 90 AVENUE","40,711,295.000000",40711295,"2b7eed06-32f4-ea11-b882-24ee9a37d45c","Queens",882450003,"-73,783,283.000000",-73783283,"29","P.S. 95 - QUEENS","P.S. 095 Eastwood - Q095 - Q095 - 29Q095 - 179-01 90 AVENUE"
"W/""325501656""","Classroom Closed",882450000,"45fd5652-e11e-ec11-b6e6-001dd83069ee","10/2/2021","2021-10-02T04:00:00Z","052507","9/27/2021","2021-09-27T04:00:00Z","421 East  88 Street","40,777,948.000000",40777948,"6341e65b-31f4-ea11-b882-24ee9a37d45c","Manhattan",882450000,"-73,947,287.000000",-73947287,"2","RICHARD R GREEN HS OF TEACHING - M","Yorkville Community School - M151 - M066 - 02M151 - 421 East  88 Street"
"W/""325101061""","Classroom Closed",882450000,"fce9666d-e31e-ec11-b6e6-001dd83069ee","10/4/2021","2021-10-04T04:00:00Z","052518","9/27/2021","2021-09-27T04:00:00Z","143-26 101 AVENUE","40,694,868.000000",40694868,"6a8946f4-31f4-ea11-b882-24ee9a37d45c","Queens",882450003,"-73,806,842.000000",-73806842,"28","P.S. 50 - QUEENS","P.S. 050 Talfourd Lawn Elementary School - Q050 - Q050 - 28Q050 - 143-26 101 AVENUE"
"W/""325524033""","Classroom Closed",882450000,"da5c1127-e51e-ec11-b6e6-001dd83069ee","10/3/2021","2021-10-03T04:00:00Z","052530","9/27/2021","2021-09-27T04:00:00Z","68-10 CENTRAL AVE","40,703,503.000000",40703503,"207eed06-32f4-ea11-b882-24ee9a37d45c","Queens",882450003,"-73,883,995.000000",-73883995,"24","P.S. 91 - QUEENS","P.S. 091 Richard Arkwright - Q091 - Q091 - 24Q091 - 68-10 CENTRAL AVE"
"W/""324684594""","Classroom Closed",882450000,"9c945559-e61e-ec11-b6e6-001dd83069ee","10/4/2021","2021-10-04T04:00:00Z","052531","9/27/2021","2021-09-27T04:00:00Z","133-40 79TH STREET","40,671,903.000000",40671903,"2c02926e-32f4-ea11-b882-24ee9a37d45c","Queens",882450003,"-73,857,176.000000",-73857176,"27","3K CENTER @ 133-40 79TH STREET - QUEENS","Curious Young Learners Pre-K Center - Q336 - Q473 - 27Q336 - 133-40 79TH STREET"
"W/""325860781""","Classroom Closed",882450000,"9ad10882-eb1e-ec11-b6e6-001dd83069ee","10/4/2021","2021-10-04T04:00:00Z","052543","9/28/2021","2021-09-28T04:00:00Z","159-01 59 AVENUE","40,741,107.000000",40741107,"049c4c1f-32f4-ea11-b882-24ee9a37d45c","Queens",882450003,"-73,808,765.000000",-73808765,"25","P.S. 163 - QUEENS","P.S. 163 Flushing Heights - Q163 - Q163 - 25Q163 - 159-01 59 AVENUE"
"W/""324813678""","Classroom Closed",882450000,"86502194-eb1e-ec11-b6e6-001dd83069ee","10/3/2021","2021-10-03T04:00:00Z","052544","9/27/2021","2021-09-27T04:00:00Z","763 KNICKERBOCKER AVENUE","40,693,432.000000",40693432,"ebd27c6d-30f4-ea11-b882-24ee9a37d45c","Brooklyn",882450002,"-73,908,242.000000",-73908242,"32","P.S. 151 - BROOKLYN","P.S. 151 Lyndon B. Johnson - K151 - K151 - 32K151 - 763 KNICKERBOCKER AVENUE"
"W/""326211830""","Classroom Closed",882450000,"6e8d18be-eb1e-ec11-b6e6-001dd83069ee","10/3/2021","2021-10-03T04:00:00Z","052545","9/27/2021","2021-09-27T04:00:00Z","888 Rev J A Polite Ave","40,820,108.000000",40820108,"7436d900-33f4-ea11-b882-24ee9a37d45c","Bronx",882450001,"-73,898,399.000000",-73898399,"8","P.S. 333 - BRONX","The Longwood Academy of Discovery - X333 - X060 - 08X333 - 888 Rev J A Polite Ave"
"W/""325525780""","Classroom Closed",882450000,"3e4b93a7-ee1e-ec11-b6e6-001dd83069ee","10/3/2021","2021-10-03T04:00:00Z","052553","9/27/2021","2021-09-27T04:00:00Z","168 HOOKER PLACE","40,631,165.000000",40631165,"67fdc1bd-32f4-ea11-b882-24ee9a37d45c","Staten Island",882450004,"-74,144,599.000000",-74144599,"31","P.S. 21 - STATEN ISLAND","P.S. 21 Margaret Emery-Elm Park - R021 - R021 - 31R021 - 168 HOOKER PLACE"
"W/""324595734""","Classroom Closed",882450000,"5ceae47f-f11e-ec11-b6e6-001dd83069ee","10/4/2021","2021-10-04T04:00:00Z","052558","9/27/2021","2021-09-27T04:00:00Z","380 GENESEE AVENUE","40,552,213.000000",40552213,"110410ca-32f4-ea11-b882-24ee9a37d45c","Staten Island",882450004,"-74,169,038.000000",-74169038,"31","P.S. 42 - STATEN ISLAND","P.S. 042 Eltingville - R042 - R042 - 31R042 - 380 GENESEE AVENUE"
"W/""328407542""","Classroom Closed",882450000,"86bb9ea2-f61e-ec11-b6e6-001dd83069ee","10/4/2021","2021-10-04T04:00:00Z","052575","9/27/2021","2021-09-27T04:00:00Z","425 EAST 35TH STREET","40,744,288.000000",40744288,"cde0838c-31f4-ea11-b882-24ee9a37d45c","Manhattan",882450000,"-73,972,592.000000",-73972592,"2","P.S. 281 - MANHATTAN","P.S. M094 - M094 - M281 - 75M094 - 425 EAST 35TH STREET"
"W/""327007421""","Non-Classroom Quarantine",882450003,"d7191852-fc1e-ec11-b6e6-001dd83069ee","10/4/2021","2021-10-04T04:00:00Z","052586","9/27/2021","2021-09-27T04:00:00Z","4222 4th Avenue","40,650,793.000000",40650793,"20a198c3-30f4-ea11-b882-24ee9a37d45c","Brooklyn",882450002,"-74,008,106.000000",-74008106,"15","P.S. 516 SUNSET PARK AVENUES ELEMENTARY SCHOOL - B","Sunset Park Avenues Elementary School - K516 - K333 - 15K516 - 4222 4th Avenue"
"W/""325761262""","Partial Classroom Quarantine",882450001,"6e779b2f-001f-ec11-b6e6-001dd83069ee","10/3/2021","2021-10-03T04:00:00Z","052593","9/27/2021","2021-09-27T04:00:00Z","1925 STUART STREET","40,606,745.000000",40606745,"e8201dab-30f4-ea11-b882-24ee9a37d45c","Brooklyn",882450002,"-73,938,721.000000",-73938721,"22","I.S. 278 - BROOKLYN","J.H.S. 278 Marine Park - K278 - K278 - 22K278 - 1925 STUART STREET"
"W/""328562027""","Partial Classroom Quarantine",882450001,"37883f92-0e1f-ec11-b6e6-001dd83069ee","10/4/2021","2021-10-04T04:00:00Z","052599","9/27/2021","2021-09-27T04:00:00Z","105 TECH PLACE","40,695,444.000000",40695444,"d33159fa-30f4-ea11-b882-24ee9a37d45c","Brooklyn",882450002,"-73,986,105.000000",-73986105,"13","GEORGE WESTINGHOUSE VOC HS - K","City Polytechnic High School of Engineering, Architecture, and Technology - K674 - K580 - 13K674 - 105 TECH PLACE"
"W/""324680049""","Classroom Closed",882450000,"4b5b18c3-121f-ec11-b6e6-001dd83069ee","10/2/2021","2021-10-02T04:00:00Z","052600","9/27/2021","2021-09-27T04:00:00Z","939 83 Street","0.000000",0,"74de261e-4afb-ea11-b883-24ee9a37d459",,,"0.000000",0,"20","Redeemer St. John's Nursery School","Redeemer St. John's Nursery School - KCPO - KCPO -  - 939 83 Street"
"W/""325860826""","Partial Classroom Quarantine",882450001,"242d5300-851f-ec11-b6e6-001dd83069ee","10/4/2021","2021-10-04T04:00:00Z","052608","9/28/2021","2021-09-28T04:00:00Z","791 EMPIRE BOULEVARD","40,663,964.000000",40663964,"6e5bc58c-30f4-ea11-b882-24ee9a37d45c","Brooklyn",882450002,"-73,935,753.000000",-73935753,"17","P.S. 221 - BROOKLYN","Ocean Hill Collegiate Charter School - K777 - K221 - 84K777 - 791 EMPIRE BOULEVARD"
"W/""326735465""","Non-Classroom Quarantine",882450003,"5585ab56-861f-ec11-b6e6-001dd83069ee","10/4/2021","2021-10-04T04:00:00Z","052616","9/28/2021","2021-09-28T04:00:00Z","80 SOUTH GOFF AVENUE","40,520,812.000000",40520812,"357c21b7-32f4-ea11-b882-24ee9a37d45c","Staten Island",882450004,"-74,211,850.000000",-74211850,"31","P.S. 3 - STATEN ISLAND","P.S. 003 The Margaret Gioiosa School - R003 - R003 - 31R003 - 80 SOUTH GOFF AVENUE"
"W/""325860861""","Partial Classroom Quarantine",882450001,"8565c540-871f-ec11-b6e6-001dd83069ee","10/1/2021","2021-10-01T04:00:00Z","052620","9/28/2021","2021-09-28T04:00:00Z","150 ALBANY AVENUE","40,675,905.000000",40675905,"23416e00-31f4-ea11-b882-24ee9a37d45c","Brooklyn",882450002,"-73,939,282.000000",-73939282,"17","ROBESON HS COMP&BUS TC (A HML)-K","Academy for Health Careers - K751 - K625 - 17K751 - 150 ALBANY AVENUE"
"W/""327198801""","Non-Classroom Quarantine",882450003,"0a7cc3db-871f-ec11-b6e6-001dd83069ee","10/3/2021","2021-10-03T04:00:00Z","052626","9/29/2021","2021-09-29T04:00:00Z","465 NEW DORP LANE","40,570,909.000000",40570909,"fb8521d0-32f4-ea11-b882-24ee9a37d45c","Staten Island",882450004,"-74,105,878.000000",-74105878,"31","NEW DORP HS (NEW) - S. I.","The Richard H. Hungerford School - R721 - R435 - 75R721 - 465 NEW DORP LANE"
"W/""327111227""","Partial Classroom Quarantine",882450001,"13b9258d-8a1f-ec11-b6e6-001dd83069ee","10/4/2021","2021-10-04T04:00:00Z","052639","9/28/2021","2021-09-28T04:00:00Z","100 LUTEN AVENUE","40,528,152.000000",40528152,"605b4cd6-32f4-ea11-b882-24ee9a37d45c","Staten Island",882450004,"-74,193,431.000000",-74193431,"31","TOTTENVILLE HS - S. I.","Tottenville High School - R455 - R455 - 31R455 - 100 LUTEN AVENUE"
"W/""325860972""","Partial Classroom Quarantine",882450001,"d0523bfa-8c1f-ec11-b6e6-001dd83069ee","10/4/2021","2021-10-04T04:00:00Z","052648","9/28/2021","2021-09-28T04:00:00Z","362 SCHERMERHORN STREET","40,686,147.000000",40686147,"9d28a20c-31f4-ea11-b882-24ee9a37d45c","Brooklyn",882450002,"-73,979,829.000000",-73979829,"15","METROPOLITAN CORPORATE ACAD. - K","Khalil Gibran International Academy - K592 - K806 - 15K592 - 362 SCHERMERHORN STREET"
"W/""325861002""","Partial Classroom Quarantine",882450001,"fa343847-8f1f-ec11-b6e6-001dd83069ee","10/3/2021","2021-10-03T04:00:00Z","052657","9/28/2021","2021-09-28T04:00:00Z","3202 STEUBEN AVENUE","40,876,819.000000",40876819,"370b210d-33f4-ea11-b882-24ee9a37d45c","Bronx",882450001,"-73,881,245.000000",-73881245,"10","I.S. 80/P.S. 280 - BRONX","P.S./M.S. 280 Mosholu Parkway - X280 - X080 - 10X280 - 3202 STEUBEN AVENUE"
"W/""325861053""","Partial Classroom Quarantine",882450001,"500b0e6a-911f-ec11-b6e6-001dd83069ee","10/4/2021","2021-10-04T04:00:00Z","052669","9/28/2021","2021-09-28T04:00:00Z","34-65 192 STREET","40,764,884.000000",40764884,"befc24e8-31f4-ea11-b882-24ee9a37d45c","Queens",882450003,"-73,789,365.000000",-73789365,"25","J.H.S. 25 - QUEENS","I.S. 025 Adrien Block - Q025 - Q025 - 25Q025 - 34-65 192 STREET"
"W/""325861083""","Partial Classroom Quarantine",882450001,"508e7da7-921f-ec11-b6e6-001dd83069ee","10/3/2021","2021-10-03T04:00:00Z","052677","9/28/2021","2021-09-28T04:00:00Z","50-40 JACOBUS STREET","40,737,405.000000",40737405,"9adc32dc-31f4-ea11-b882-24ee9a37d45c","Queens",882450003,"-73,888,133.000000",-73888133,"24","I.S. 5 - QUEENS","P.S. 009 - Q009 - Q005 - 75Q009 - 50-40 JACOBUS STREET"
"W/""325861098""","Partial Classroom Quarantine",882450001,"128e6ed8-921f-ec11-b6e6-001dd83069ee","10/4/2021","2021-10-04T04:00:00Z","052680","9/28/2021","2021-09-28T04:00:00Z","75-02 162 STREET","40,726,473.000000",40726473,"d69b4c1f-32f4-ea11-b882-24ee9a37d45c","Queens",882450003,"-73,807,750.000000",-73807750,"25","P.S. 154 - QUEENS","P.S. 154 Queens - Q154 - Q154 - 25Q154 - 75-02 162 STREET"
"W/""325861123""","Classroom Closed",882450000,"f284c083-931f-ec11-b6e6-001dd83069ee","10/4/2021","2021-10-04T04:00:00Z","052687","9/28/2021","2021-09-28T04:00:00Z","199 14TH STREET","40,667,245.000000",40667245,"7cc4fc0b-4afb-ea11-b883-24ee9a37d459",,,"-73,990,314.000000",-73990314,"15","12th STREET PRE-SCHOOL","12th STREET PRE-SCHOOL - KBMU - KBMU -  - 199 14TH STREET"
"W/""326910818""","Partial Classroom Quarantine",882450001,"f4575bd4-961f-ec11-b6e6-001dd83069ee","10/4/2021","2021-10-04T04:00:00Z","052715","9/28/2021","2021-09-28T04:00:00Z","1070 Castle Hill Avenue","40,829,480.000000",40829480,"0c18b7f4-32f4-ea11-b882-24ee9a37d45c","Bronx",882450001,"-73,849,791.000000",-73849791,"8","P.S. 36 - BRONX","P.S. 036 Unionport - X036 - X036 - 08X036 - 1070 Castle Hill Avenue"
"W/""325861239""","Classroom Closed",882450000,"30ce79d2-981f-ec11-b6e6-001dd83069ee","10/4/2021","2021-10-04T04:00:00Z","052733","9/28/2021","2021-09-28T04:00:00Z","6701 20 AVENUE","40,614,737.000000",40614737,"11ba8b86-30f4-ea11-b882-24ee9a37d45c","Brooklyn",882450002,"-73,986,792.000000",-73986792,"20","P.S. 205 - BROOKLYN","P.S. 205 Clarion - K205 - K205 - 20K205 - 6701 20 AVENUE"
"W/""325861264""","Partial Classroom Quarantine",882450001,"51182d1b-991f-ec11-b6e6-001dd83069ee","10/3/2021","2021-10-03T04:00:00Z","052740","9/28/2021","2021-09-28T04:00:00Z","1840 BOGART AVENUE","40,849,176.000000",40849176,"f777bb9f-33f4-ea11-b882-24ee9a37d45c","Bronx",882450001,"-73,858,769.000000",-73858769,"11","P.S. 83 ANNEX - BRONX","P.S. 083 Donald Hertz - X083 - X981 - 11X083 - 1840 BOGART AVENUE"
"W/""325861269""","Partial Classroom Quarantine",882450001,"5cfbea82-991f-ec11-b6e6-001dd83069ee","10/4/2021","2021-10-04T04:00:00Z","052742","9/28/2021","2021-09-28T04:00:00Z","37 HICKS STREET","40,700,709.000000",40700709,"d5f57030-30f4-ea11-b882-24ee9a37d45c","Brooklyn",882450002,"-73,992,841.000000",-73992841,"13","P.S. 8 - BROOKLYN","The Emily Warren Roebling School - K008 - K008 - 13K008 - 37 HICKS STREET"
"W/""325861284""","Partial Classroom Quarantine",882450001,"143b670e-9a1f-ec11-b6e6-001dd83069ee","10/3/2021","2021-10-03T04:00:00Z","052748","9/28/2021","2021-09-28T04:00:00Z","69-10 65th Drive","40,715,005.000000",40715005,"2ca10a44-32f4-ea11-b882-24ee9a37d45c","Queens",882450003,"-73,885,974.000000",-73885974,"24","PS/IS 128","P.S. 128 The Lorraine Tuzzo, Juniper Valley Elementary School - Q128 - Q247 - 24Q128 - 69-10 65th Drive"
"W/""327678886""","Classroom Closed",882450000,"3f33f4e0-9b1f-ec11-b6e6-001dd83069ee","10/3/2021","2021-10-03T04:00:00Z","052761","9/28/2021","2021-09-28T04:00:00Z","330 ALABAMA AVENUE","40,667,985.000000",40667985,"0ca198c3-30f4-ea11-b882-24ee9a37d45c","Brooklyn",882450002,"-73,898,249.000000",-73898249,"19","P.S. 328 - BROOKLYN","Hyde Leadership Charter School- Brooklyn - K769 - K328 - 84K769 - 330 ALABAMA AVENUE"
"W/""327117925""","Non-Classroom Quarantine",882450003,"74bc938a-9c1f-ec11-b6e6-001dd83069ee","10/4/2021","2021-10-04T04:00:00Z","052766","9/28/2021","2021-09-28T04:00:00Z","133 Kings First Walk","40,675,375.000000",40675375,"567becf3-49fb-ea11-b883-24ee9a37d459",,,"-73,927,200.000000",-73927200,"16","Bedford Styvesant ECDC 133","Bedford Styvesant ECDC 133 - KBTA - KBTO -  - 133 Kings First Walk"
"W/""327198846""","Partial Classroom Quarantine",882450001,"d602dec8-a11f-ec11-b6e6-001dd83069ee","10/1/2021","2021-10-01T04:00:00Z","052829","9/29/2021","2021-09-29T04:00:00Z","1601 80 STREET","40,613,041.000000",40613041,"5488e6db-30f4-ea11-b882-24ee9a37d45c","Brooklyn",882450002,"-74,002,308.000000",-74002308,"20","NEW UTRECHT HS - K","New Utrecht High School - K445 - K445 - 20K445 - 1601 80 STREET"
"W/""325861592""","Partial Classroom Quarantine",882450001,"02f25e48-a51f-ec11-b6e6-001dd83069ee","10/4/2021","2021-10-04T04:00:00Z","052875","9/28/2021","2021-09-28T04:00:00Z","57-00 223RD STREET","40,752,343.000000",40752343,"86e2635c-32f4-ea11-b882-24ee9a37d45c","Queens",882450003,"-73,757,271.000000",-73757271,"26","BENJAMIN N. CARDOZO HS - Q","Benjamin N. Cardozo High School - Q415 - Q415 - 26Q415 - 57-00 223RD STREET"
"W/""328833357""","Partial Classroom Quarantine",882450001,"5e6f2cc9-a71f-ec11-b6e6-001dd83069ee","10/4/2021","2021-10-04T04:00:00Z","052906","9/28/2021","2021-09-28T04:00:00Z","51 JEFFERSON STREET","40,590,887.000000",40590887,"4efdc1bd-32f4-ea11-b882-24ee9a37d45c","Staten Island",882450004,"-74,098,252.000000",-74098252,"31","P.S. 11 - STATEN ISLAND","P.S. 11 Thomas Dongan School - R011 - R011 - 31R011 - 51 JEFFERSON STREET"
"W/""325861693""","Classroom Closed",882450000,"4fbd3869-aa1f-ec11-b6e6-001dd83069ee","10/1/2021","2021-10-01T04:00:00Z","052937","9/28/2021","2021-09-28T04:00:00Z","200-214 WEST 135TH STREET","40,815,237.000000",40815237,"03ee94c3-31f4-ea11-b882-24ee9a37d45c","Manhattan",882450000,"-73,944,299.000000",-73944299,"5","THURGOOD MARSHALL ACAD. - M","Thurgood Marshall Academy for Learning and Social Change - M670 - M970 - 05M670 - 200-214 WEST 135TH STREET"
"W/""325861739""","Partial Classroom Quarantine",882450001,"191ecbb3-ac1f-ec11-b6e6-001dd83069ee","10/2/2021","2021-10-02T04:00:00Z","052954","9/28/2021","2021-09-28T04:00:00Z","98-50 50 AVENUE","40,741,898.000000",40741898,"5f2f77fa-31f4-ea11-b882-24ee9a37d45c","Queens",882450003,"-73,862,886.000000",-73862886,"24","I.S. 61 - QUEENS","I.S. 061 Leonardo Da Vinci - Q061 - Q061 - 24Q061 - 98-50 50 AVENUE"
"W/""326782914""","Classroom Closed",882450000,"8b3831b0-b11f-ec11-b6e6-001dd83069ee","10/7/2021","2021-10-07T04:00:00Z","052998","9/28/2021","2021-09-28T04:00:00Z","1260 FRANKLIN AVENUE","40,830,930.000000",40830930,"8736d900-33f4-ea11-b882-24ee9a37d45c","Bronx",882450001,"-73,901,859.000000",-73901859,"9","P.S. 63 - BRONX","P.S. 063 Author's Academy - X063 - X063 - 09X063 - 1260 FRANKLIN AVENUE"
"W/""325861870""","Partial Classroom Quarantine",882450001,"94797bbe-b41f-ec11-b6e6-001dd83069ee","10/4/2021","2021-10-04T04:00:00Z","053018","9/28/2021","2021-09-28T04:00:00Z","2950 WEST  25 STREET","40,574,029.000000",40574029,"79283fb1-30f4-ea11-b882-24ee9a37d45c","Brooklyn",882450002,"-73,992,393.000000",-73992393,"21","P.S. 288 - BROOKLYN","P.S. 288 The Shirley Tanyhill - K288 - K288 - 21K288 - 2950 WEST  25 STREET"
"W/""327153496""","Partial Classroom Quarantine",882450001,"9dce64f1-b51f-ec11-b6e6-001dd83069ee","10/4/2021","2021-10-04T04:00:00Z","053026","9/28/2021","2021-09-28T04:00:00Z","80-09 WINCHESTER BOULEVARD","40,738,892.000000",40738892,"349215a5-32f4-ea11-b882-24ee9a37d45c","Queens",882450003,"-73,732,923.000000",-73732923,"26","LIFELINE CENTER","P.S. Q023 @ Queens Children Center - Q023 - QALG - 75Q023 - 80-09 WINCHESTER BOULEVARD"
"W/""327198917""","Partial Classroom Quarantine",882450001,"2498cb03-b81f-ec11-b6e6-001dd83069ee","10/3/2021","2021-10-03T04:00:00Z","053035","9/29/2021","2021-09-29T04:00:00Z","905 WINTHROP STREET","40,659,088.000000",40659088,"0222d292-30f4-ea11-b882-24ee9a37d45c","Brooklyn",882450002,"-73,928,744.000000",-73928744,"18","I.S. 232 - BROOKLYN","Kings Collegiate Charter School - K608 - K232 - 84K608 - 905 WINTHROP STREET"
"W/""327198927""","Partial Classroom Quarantine",882450001,"0b5e36ff-bb1f-ec11-b6e6-001dd83069ee","10/4/2021","2021-10-04T04:00:00Z","053065","9/29/2021","2021-09-29T04:00:00Z","154-60 17 AVENUE","40,783,231.000000",40783231,"8a977d2b-32f4-ea11-b882-24ee9a37d45c","Queens",882450003,"-73,806,990.000000",-73806990,"25","J.H.S. 194 - QUEENS","J.H.S. 194 William Carr - Q194 - Q194 - 25Q194 - 154-60 17 AVENUE"
"W/""327153744""","Partial Classroom Quarantine",882450001,"1ed496cc-bc1f-ec11-b6e6-001dd83069ee","10/4/2021","2021-10-04T04:00:00Z","053075","9/28/2021","2021-09-28T04:00:00Z","2545 GUNTHER AVENUE","40,863,842.000000",40863842,"b22aa42b-33f4-ea11-b882-24ee9a37d45c","Bronx",882450001,"-73,836,525.000000",-73836525,"11","I.S. 144 - BRONX","Bronx Charter School for Better Learning II - X484 - X144 - 84X484 - 2545 GUNTHER AVENUE"
"W/""326970712""","Partial Classroom Quarantine",882450001,"7c954c1e-c01f-ec11-b6e6-001dd83069ee","10/4/2021","2021-10-04T04:00:00Z","053104","9/28/2021","2021-09-28T04:00:00Z","160 BEACH  29 STREET","40,593,480.000000",40593480,"ee8442ee-31f4-ea11-b882-24ee9a37d45c","Queens",882450003,"-73,761,086.000000",-73761086,"27","P.S. 43 - QUEENS","P.S. 043 - Q043 - Q043 - 27Q043 - 160 BEACH  29 STREET"
"W/""326905375""","Classroom Closed",882450000,"fa71b06c-c01f-ec11-b6e6-001dd83069ee","10/3/2021","2021-10-03T04:00:00Z","053106","9/28/2021","2021-09-28T04:00:00Z","3961 HILLMAN AVENUE","40,883,049.000000",40883049,"34474313-33f4-ea11-b882-24ee9a37d45c","Bronx",882450001,"-73,891,664.000000",-73891664,"10","P.S. 95 - BRONX","Ampark Neighborhood - X344 - X095 - 10X344 - 3961 HILLMAN AVENUE"
"W/""327198942""","Partial Classroom Quarantine",882450001,"a3756a17-c21f-ec11-b6e6-001dd83069ee","10/4/2021","2021-10-04T04:00:00Z","053123","9/29/2021","2021-09-29T04:00:00Z","549 AUDUBON AVENUE","40,856,532.000000",40856532,"25a6ba98-31f4-ea11-b882-24ee9a37d45c","Manhattan",882450000,"-73,926,060.000000",-73926060,"6","G. WASHINGTON HS EDUC. CAMPUS - M","High School for Health Careers and Sciences - M468 - M465 - 06M468 - 549 AUDUBON AVENUE"
"W/""326245084""","Partial Classroom Quarantine",882450001,"c52c84f6-c21f-ec11-b6e6-001dd83069ee","10/2/2021","2021-10-02T04:00:00Z","053134","9/28/2021","2021-09-28T04:00:00Z","2005 MADISON AVENUE","40,807,019.000000",40807019,"cb37fba4-31f4-ea11-b882-24ee9a37d45c","Manhattan",882450000,"-73,938,714.000000",-73938714,"5","ARTHUR SCHOMBURG HS (IS 201) - M","Democracy Prep Harlem Charter School - M481 - M501 - 84M481 - 2005 MADISON AVENUE"
"W/""327198947""","Partial Classroom Quarantine",882450001,"9396ed2f-c41f-ec11-b6e6-001dd83069ee","10/4/2021","2021-10-04T04:00:00Z","053142","9/29/2021","2021-09-29T04:00:00Z","725 BRADY AVENUE","40,853,075.000000",40853075,"390d6d19-33f4-ea11-b882-24ee9a37d45c","Bronx",882450001,"-73,866,264.000000",-73866264,"11","P.S. 105 - BRONX","P.S. 105 Sen Abraham Bernstein - X105 - X105 - 11X105 - 725 BRADY AVENUE"
"W/""325862086""","Classroom Closed",882450000,"8ec15e1c-c61f-ec11-b6e6-001dd83069ee","10/4/2021","2021-10-04T04:00:00Z","053156","9/28/2021","2021-09-28T04:00:00Z","76 LOTT AVENUE","40,657,061.000000",40657061,"43ebaa73-30f4-ea11-b882-24ee9a37d45c","Brooklyn",882450002,"-73,910,938.000000",-73910938,"23","P.S. 165 - BROOKLYN","P.S. 165 Ida Posner - K165 - K165 - 23K165 - 76 LOTT AVENUE"
"W/""327198962""","Non-Classroom Quarantine",882450003,"111aab60-c71f-ec11-b6e6-001dd83069ee","10/4/2021","2021-10-04T04:00:00Z","053167","9/29/2021","2021-09-29T04:00:00Z","1573 MADISON AVENUE","40,793,649.000000",40793649,"98886843-31f4-ea11-b882-24ee9a37d45c","Manhattan",882450000,"-73,948,488.000000",-73948488,"4","I.S. 13 - MANHATTAN","East Harlem Scholars Academy Charter School II - M168 - M013 - 84M168 - 1573 MADISON AVENUE"
"W/""326474855""","Classroom Closed",882450000,"41989544-c81f-ec11-b6e6-001dd83069ee","10/4/2021","2021-10-04T04:00:00Z","053173","9/28/2021","2021-09-28T04:00:00Z","89-02 32 AVENUE","40,757,629.000000",40757629,"ef883319-32f4-ea11-b882-24ee9a37d45c","Queens",882450003,"-73,878,638.000000",-73878638,"30","P.S. 148 - QUEENS","P.S. 148 Queens - Q148 - Q148 - 30Q148 - 89-02 32 AVENUE"
"W/""327199114""","Partial Classroom Quarantine",882450001,"6bf60269-5920-ec11-b6e6-001dd83069ee","10/7/2021","2021-10-07T04:00:00Z","053235","9/29/2021","2021-09-29T04:00:00Z","33 FERNDALE AVENUE","40,592,132.000000",40592132,"e48521d0-32f4-ea11-b882-24ee9a37d45c","Staten Island",882450004,"-74,158,618.000000",-74158618,"31","I.S. 72 - STATEN ISLAND","I.S. 072 Rocco Laurie - R072 - R072 - 31R072 - 33 FERNDALE AVENUE"
"W/""327199230""","Classroom Closed",882450000,"37cb90ae-6620-ec11-b6e6-001dd83069ee","10/8/2021","2021-10-08T04:00:00Z","053318","9/29/2021","2021-09-29T04:00:00Z","223 GRAHAM AVENUE","40,709,765.000000",40709765,"14eabc42-30f4-ea11-b882-24ee9a37d45c","Brooklyn",882450002,"-73,944,463.000000",-73944463,"14","I.S. 49 - BROOKLYN","Brooklyn Latin School, The - K449 - K049 - 14K449 - 223 GRAHAM AVENUE"
"W/""327199240""","Partial Classroom Quarantine",882450001,"48266924-6820-ec11-b6e6-001dd83069ee","10/4/2021","2021-10-04T04:00:00Z","053328","9/29/2021","2021-09-29T04:00:00Z","419 WAVERLY AVENUE","40,685,896.000000",40685896,"e0f57030-30f4-ea11-b882-24ee9a37d45c","Brooklyn",882450002,"-73,965,890.000000",-73965890,"13","P.S. 11 - BROOKLYN","P.S. 011 Purvis J. Behan - K011 - K011 - 13K011 - 419 WAVERLY AVENUE"
"W/""327691609""","Partial Classroom Quarantine",882450001,"242e0841-7520-ec11-b6e6-001dd83069ee","10/4/2021","2021-10-04T04:00:00Z","053422","9/29/2021","2021-09-29T04:00:00Z","4210 ARTHUR KILL ROAD","40,539,758.000000",40539758,"6fa9d9c3-32f4-ea11-b882-24ee9a37d45c","Staten Island",882450004,"-74,236,681.000000",-74236681,"31","P.S. 25 ANNEX (OLD 4) - S. I.","South Richmond High School I.S./P.S. 25 - R025 - R025 - 75R025 - 4210 ARTHUR KILL ROAD"
"W/""327685855""","Partial Classroom Quarantine",882450001,"580cb1c4-7d20-ec11-b6e6-001dd83069ee","10/4/2021","2021-10-04T04:00:00Z","053471","9/29/2021","2021-09-29T04:00:00Z","3441 STEENWICK AVENUE","40,882,778.000000",40882778,"018b0044-33f4-ea11-b882-24ee9a37d45c","Bronx",882450001,"-73,830,616.000000",-73830616,"11","P.S./I.S. 189 - BRONX","Cornerstone Academy for Social Action Middle School (CASA) - X462 - X189 - 11X462 - 3441 STEENWICK AVENUE"
"W/""327686129""","Partial Classroom Quarantine",882450001,"44106d07-8e20-ec11-b6e6-001dd83069ee","10/4/2021","2021-10-04T04:00:00Z","053573","9/29/2021","2021-09-29T04:00:00Z","1355 HERKIMER STREET","40,677,634.000000",40677634,"f6d27c6d-30f4-ea11-b882-24ee9a37d45c","Brooklyn",882450002,"-73,908,682.000000",-73908682,"23","P.S. 155 - BROOKLYN","P.S./ I.S. 155 Nicholas Herkimer - K155 - K155 - 23K155 - 1355 HERKIMER STREET"
"W/""328091518""","Classroom Closed",882450000,"6a34f450-1521-ec11-b6e6-001dd83069ee","10/8/2021","2021-10-08T04:00:00Z","053610","9/30/2021","2021-09-30T04:00:00Z","369 93RD STREET","40,618,135.000000",40618135,"f53159fa-30f4-ea11-b882-24ee9a37d45c","Brooklyn",882450002,"-74,031,046.000000",-74031046,"20","PRE-K CENTER @93RD STREET - BROOKLYN","District 20 Pre-K Center - K768 - K613 - 20K768 - 369 93RD STREET"
"W/""328091528""","Classroom Closed",882450000,"8b424c2d-1621-ec11-b6e6-001dd83069ee","10/8/2021","2021-10-08T04:00:00Z","053613","9/30/2021","2021-09-30T04:00:00Z","140 PALMA DRIVE","40,611,136.000000",40611136,"410410ca-32f4-ea11-b882-24ee9a37d45c","Staten Island",882450004,"-74,083,799.000000",-74083799,"31","P.S. 57 - STATEN ISLAND","P.S. 057 Hubert H. Humphrey - R057 - R057 - 31R057 - 140 PALMA DRIVE"
"W/""328547279""","Partial Classroom Quarantine",882450001,"e1b342f3-1721-ec11-b6e6-001dd83069ee","10/7/2021","2021-10-07T04:00:00Z","053619","9/30/2021","2021-09-30T04:00:00Z","125 EAST 181 STREET","40,855,337.000000",40855337,"2c0b210d-33f4-ea11-b882-24ee9a37d45c","Bronx",882450001,"-73,903,139.000000",-73903139,"10","P.S. 79 - BRONX","Elementary School for Math, Science, and Technology - X382 - X079 - 10X382 - 125 EAST 181 STREET"
"W/""328091589""","Partial Classroom Quarantine",882450001,"b3c7ea18-1a21-ec11-b6e6-001dd83069ee","10/8/2021","2021-10-08T04:00:00Z","053630","9/30/2021","2021-09-30T04:00:00Z","1070 Castle Hill Avenue","40,829,480.000000",40829480,"0c18b7f4-32f4-ea11-b882-24ee9a37d45c","Bronx",882450001,"-73,849,791.000000",-73849791,"8","P.S. 36 - BRONX","P.S. 036 Unionport - X036 - X036 - 08X036 - 1070 Castle Hill Avenue"
"W/""328091634""","Partial Classroom Quarantine",882450001,"d6353f2e-1c21-ec11-b6e6-001dd83069ee","10/8/2021","2021-10-08T04:00:00Z","053641","9/30/2021","2021-09-30T04:00:00Z","1595 BATHGATE AVENUE","40,839,508.000000",40839508,"e177bb9f-33f4-ea11-b882-24ee9a37d45c","Bronx",882450001,"-73,901,774.000000",-73901774,"9","BATHGATE HS - BRONX","Mott Hall Bronx High School - X252 - X970 - 09X252 - 1595 BATHGATE AVENUE"
"W/""328591965""","Partial Classroom Quarantine",882450001,"722c01b1-2221-ec11-b6e6-001dd83069ee","10/4/2021","2021-10-04T04:00:00Z","053665","9/30/2021","2021-09-30T04:00:00Z","735 WEST END AVENUE","40,795,109.000000",40795109,"6a41e65b-31f4-ea11-b882-24ee9a37d45c","Manhattan",882450000,"-73,973,996.000000",-73973996,"3","P.S. 75 - MANHATTAN","M.S. 250 West Side Collaborative Middle School - M250 - M075 - 03M250 - 735 WEST END AVENUE"
"W/""328091730""","Partial Classroom Quarantine",882450001,"ec0682a2-2321-ec11-b6e6-001dd83069ee","10/7/2021","2021-10-07T04:00:00Z","053673","9/30/2021","2021-09-30T04:00:00Z","64 WEST 17 STREET","40,739,145.000000",40739145,"e3e0838c-31f4-ea11-b882-24ee9a37d45c","Manhattan",882450000,"-73,995,534.000000",-73995534,"2","THE SIXTH AVENUE EDUCATIONAL CAMPUS - MANHATTAN","Sixth Avenue Elementary School - M340 - M340 - 02M340 - 64 WEST 17 STREET"
"W/""328833363""","Partial Classroom Quarantine",882450001,"4f9cafcb-2421-ec11-b6e6-001dd83069ee","10/8/2021","2021-10-08T04:00:00Z","053680","9/30/2021","2021-09-30T04:00:00Z","51 JEFFERSON STREET","40,590,887.000000",40590887,"4efdc1bd-32f4-ea11-b882-24ee9a37d45c","Staten Island",882450004,"-74,098,252.000000",-74098252,"31","P.S. 11 - STATEN ISLAND","P.S. 11 Thomas Dongan School - R011 - R011 - 31R011 - 51 JEFFERSON STREET"
"W/""328091750""","Partial Classroom Quarantine",882450001,"7b36be26-2521-ec11-b6e6-001dd83069ee","10/8/2021","2021-10-08T04:00:00Z","053682","9/30/2021","2021-09-30T04:00:00Z","300 Richmond Terrace","40,647,898.000000",40647898,"480410ca-32f4-ea11-b882-24ee9a37d45c","Staten Island",882450004,"-74,083,408.000000",-74083408,"31","THE HARBOR VIEW SCHOOL - STATEN ISLAND","The Harbor View School - R059 - R059 - 31R059 - 300 Richmond Terrace"
"W/""328091755""","Partial Classroom Quarantine",882450001,"0e43bb2c-2521-ec11-b6e6-001dd83069ee","10/8/2021","2021-10-08T04:00:00Z","053683","9/30/2021","2021-09-30T04:00:00Z","300 Richmond Terrace","40,647,898.000000",40647898,"480410ca-32f4-ea11-b882-24ee9a37d45c","Staten Island",882450004,"-74,083,408.000000",-74083408,"31","THE HARBOR VIEW SCHOOL - STATEN ISLAND","The Harbor View School - R059 - R059 - 31R059 - 300 Richmond Terrace"
"W/""328091770""","Partial Classroom Quarantine",882450001,"6235bf1e-2621-ec11-b6e6-001dd83069ee","10/8/2021","2021-10-08T04:00:00Z","053692","9/30/2021","2021-09-30T04:00:00Z","101-01 ROCKAWAY BOULEVARD","40,680,065.000000",40680065,"6abc9674-32f4-ea11-b882-24ee9a37d45c","Queens",882450003,"-73,838,616.000000",-73838616,"27","JOHN ADAMS HS - QUEENS","John Adams High School - Q480 - Q480 - 27Q480 - 101-01 ROCKAWAY BOULEVARD"
"W/""328592429""","Classroom Closed",882450000,"f1d9fae7-2821-ec11-b6e6-001dd83069ee","10/7/2021","2021-10-07T04:00:00Z","053719","9/30/2021","2021-09-30T04:00:00Z","31 NEW YORK AVENUE","40,679,079.000000",40679079,"8ad92255-30f4-ea11-b882-24ee9a37d45c","Brooklyn",882450002,"-73,946,381.000000",-73946381,"13","P.S. 93 - BROOKLYN","P.S. 093 William H. Prescott - K093 - K093 - 13K093 - 31 NEW YORK AVENUE"
"W/""328091846""","Partial Classroom Quarantine",882450001,"79a8b21c-2a21-ec11-b6e6-001dd83069ee","10/7/2021","2021-10-07T04:00:00Z","053724","9/30/2021","2021-09-30T04:00:00Z","421 East  88 Street","40,777,948.000000",40777948,"6341e65b-31f4-ea11-b882-24ee9a37d45c","Manhattan",882450000,"-73,947,287.000000",-73947287,"2","RICHARD R GREEN HS OF TEACHING - M","Yorkville Community School - M151 - M066 - 02M151 - 421 East  88 Street"
"W/""328592931""","Partial Classroom Quarantine",882450001,"1aa4a436-3021-ec11-b6e6-001dd83069ee","10/8/2021","2021-10-08T04:00:00Z","053753","9/30/2021","2021-09-30T04:00:00Z","715 OCEAN TERRACE","40,607,637.000000",40607637,"4bfdc1bd-32f4-ea11-b882-24ee9a37d45c","Staten Island",882450004,"-74,105,883.000000",-74105883,"31","P.S. 80 (PETRIDES COMPLEX) AF - STATEN ISLAND","The Michael J. Petrides School - R080 - R010 - 31R080 - 715 OCEAN TERRACE"
"W/""328091937""","Partial Classroom Quarantine",882450001,"86649ede-3021-ec11-b6e6-001dd83069ee","10/7/2021","2021-10-07T04:00:00Z","053758","9/30/2021","2021-09-30T04:00:00Z","1200 MANOR ROAD","40,588,985.000000",40588985,"5abe7adc-32f4-ea11-b882-24ee9a37d45c","Staten Island",882450004,"-74,130,819.000000",-74130819,"31","SUSAN E. WAGNER HS - S. I.","Susan E. Wagner High School - R460 - R460 - 31R460 - 1200 MANOR ROAD"
"W/""328091962""","Partial Classroom Quarantine",882450001,"674ffc6c-3221-ec11-b6e6-001dd83069ee","10/1/2021","2021-10-01T04:00:00Z","053769","9/30/2021","2021-09-30T04:00:00Z","1200 MANOR ROAD","40,588,985.000000",40588985,"5abe7adc-32f4-ea11-b882-24ee9a37d45c","Staten Island",882450004,"-74,130,819.000000",-74130819,"31","SUSAN E. WAGNER HS - S. I.","Susan E. Wagner High School - R460 - R460 - 31R460 - 1200 MANOR ROAD"
"W/""328593589""","Partial Classroom Quarantine",882450001,"4f6568a7-3421-ec11-b6e6-001dd83069ee","10/9/2021","2021-10-09T04:00:00Z","053784","9/30/2021","2021-09-30T04:00:00Z","301 VERMONT STREET","40,671,601.000000",40671601,"8a283fb1-30f4-ea11-b882-24ee9a37d45c","Brooklyn",882450002,"-73,893,319.000000",-73893319,"19","I.S. 292 - BROOKLYN","J.H.S. 292 Margaret S. Douglas - K292 - K292 - 19K292 - 301 VERMONT STREET"
"W/""328595356""","Classroom Closed",882450000,"085afe70-3721-ec11-b6e6-001dd83069ee","10/8/2021","2021-10-08T04:00:00Z","053810","10/1/2021","2021-10-01T04:00:00Z","29-66 137 STREET","40,769,752.000000",40769752,"2d06003e-32f4-ea11-b882-24ee9a37d45c","Queens",882450003,"-73,832,005.000000",-73832005,"25","P.S. 242 - (ECC) - QUEENS","P.S. 242 Leonard P. Stavisky Early Childhood School - Q242 - Q242 - 25Q242 - 29-66 137 STREET"
"W/""328092058""","Partial Classroom Quarantine",882450001,"7050ba8b-3821-ec11-b6e6-001dd83069ee","10/8/2021","2021-10-08T04:00:00Z","053815","9/30/2021","2021-09-30T04:00:00Z","89-02 32 AVENUE","40,757,629.000000",40757629,"ef883319-32f4-ea11-b882-24ee9a37d45c","Queens",882450003,"-73,878,638.000000",-73878638,"30","P.S. 148 - QUEENS","P.S. 148 Queens - Q148 - Q148 - 30Q148 - 89-02 32 AVENUE"
"W/""328092083""","Classroom Closed",882450000,"f64f6ada-3a21-ec11-b6e6-001dd83069ee","10/8/2021","2021-10-08T04:00:00Z","053826","9/30/2021","2021-09-30T04:00:00Z","153-23 83 STREET","40,665,408.000000",40665408,"ebfa079f-32f4-ea11-b882-24ee9a37d45c","Queens",882450003,"-73,850,622.000000",-73850622,"27","P.S. 232 TRANSPORTABLE - Q","P.S. 232 Lindenwood - Q232 - Q983 - 27Q232 - 153-23 83 STREET"
"W/""328092113""","Partial Classroom Quarantine",882450001,"9ce593e2-3b21-ec11-b6e6-001dd83069ee","10/8/2021","2021-10-08T04:00:00Z","053834","9/30/2021","2021-09-30T04:00:00Z","2401 NEPTUNE AVENUE","40,578,640.000000",40578640,"6ca5db98-30f4-ea11-b882-24ee9a37d45c","Brooklyn",882450002,"-73,992,447.000000",-73992447,"21","I.S. 239 - BROOKLYN","Mark Twain I.S. 239 for the Gifted & Talented - K239 - K239 - 21K239 - 2401 NEPTUNE AVENUE"
"W/""328092143""","Partial Classroom Quarantine",882450001,"3226f791-3e21-ec11-b6e6-001dd83069ee","10/7/2021","2021-10-07T04:00:00Z","053853","9/30/2021","2021-09-30T04:00:00Z","425 HENRY STREET","40,686,843.000000",40686843,"ee1aad3c-30f4-ea11-b882-24ee9a37d45c","Brooklyn",882450002,"-73,997,447.000000",-73997447,"15","P.S. 29 - BROOKLYN","P.S. 029 John M. Harrigan - K029 - K029 - 15K029 - 425 HENRY STREET"
"W/""328203561""","Classroom Closed",882450000,"4629f0b6-4221-ec11-b6e6-001dd83069ee","10/4/2021","2021-10-04T04:00:00Z","053881","9/30/2021","2021-09-30T04:00:00Z","60 COOK STREET","40,702,759.000000",40702759,"ad83ff9e-30f4-ea11-b882-24ee9a37d45c","Brooklyn",882450002,"-73,941,345.000000",-73941345,"14","P.S. 257 - BROOKLYN","P.S. 257 John F. Hylan - K257 - K257 - 14K257 - 60 COOK STREET"
"W/""328238628""","Classroom Closed",882450000,"930ecaa3-4621-ec11-b6e6-001dd83069ee","10/8/2021","2021-10-08T04:00:00Z","053901","9/30/2021","2021-09-30T04:00:00Z","232 BARLOW AVENUE","40,557,900.000000",40557900,"80a9d9c3-32f4-ea11-b882-24ee9a37d45c","Staten Island",882450004,"-74,155,400.000000",-74155400,"31","P.S. 32 - STATEN ISLAND","P.S. 032 The Gifford School - R032 - R032 - 31R032 - 232 BARLOW AVENUE"
"W/""328238269""","Partial Classroom Quarantine",882450001,"52098cc3-4821-ec11-b6e6-001dd83069ee","10/7/2021","2021-10-07T04:00:00Z","053913","9/30/2021","2021-09-30T04:00:00Z","317 EAST  67 STREET","40,765,638.000000",40765638,"6007e99e-31f4-ea11-b882-24ee9a37d45c","Manhattan",882450000,"-73,959,777.000000",-73959777,"2","JULIA RICHMAN ED. COMPLEX - M","Talent Unlimited High School - M519 - M480 - 02M519 - 317 EAST  67 STREET"
"W/""328092260""","Partial Classroom Quarantine",882450001,"63bd39db-4921-ec11-b6e6-001dd83069ee","10/4/2021","2021-10-04T04:00:00Z","053915","9/30/2021","2021-09-30T04:00:00Z","66-56 FOREST AVENUE","40,705,609.000000",40705609,"0f7eed06-32f4-ea11-b882-24ee9a37d45c","Queens",882450003,"-73,903,057.000000",-73903057,"24","I.S. 93 - QUEENS","I.S. 093 Ridgewood - Q093 - Q093 - 24Q093 - 66-56 FOREST AVENUE"
"W/""328092265""","Partial Classroom Quarantine",882450001,"1da9b857-4b21-ec11-b6e6-001dd83069ee","10/4/2021","2021-10-04T04:00:00Z","053921","9/30/2021","2021-09-30T04:00:00Z","66-56 FOREST AVENUE","40,705,609.000000",40705609,"0f7eed06-32f4-ea11-b882-24ee9a37d45c","Queens",882450003,"-73,903,057.000000",-73903057,"24","I.S. 93 - QUEENS","I.S. 093 Ridgewood - Q093 - Q093 - 24Q093 - 66-56 FOREST AVENUE"
"W/""328092270""","Partial Classroom Quarantine",882450001,"f67660f5-4b21-ec11-b6e6-001dd83069ee","10/4/2021","2021-10-04T04:00:00Z","053924","9/30/2021","2021-09-30T04:00:00Z","14-30 BROADWAY","40,765,881.000000",40765881,"81476368-32f4-ea11-b882-24ee9a37d45c","Queens",882450003,"-73,933,907.000000",-73933907,"30","LONG ISLAND CITY HS(NEW)-Q","Long Island City High School - Q450 - Q452 - 30Q450 - 14-30 BROADWAY"
"W/""328092275""","Partial Classroom Quarantine",882450001,"28bd77fb-4b21-ec11-b6e6-001dd83069ee","10/2/2021","2021-10-02T04:00:00Z","053925","9/30/2021","2021-09-30T04:00:00Z","14-30 BROADWAY","40,765,881.000000",40765881,"81476368-32f4-ea11-b882-24ee9a37d45c","Queens",882450003,"-73,933,907.000000",-73933907,"30","LONG ISLAND CITY HS(NEW)-Q","Long Island City High School - Q450 - Q452 - 30Q450 - 14-30 BROADWAY"
"W/""328237841""","Classroom Closed",882450000,"585841ad-5821-ec11-b6e6-001dd83069ee","10/9/2021","2021-10-09T04:00:00Z","053989","9/30/2021","2021-09-30T04:00:00Z","110 CHESTER STREET","40,668,232.000000",40668232,"2d8dbfcf-30f4-ea11-b882-24ee9a37d45c","Brooklyn",882450002,"-73,911,788.000000",-73911788,"23","P.S. 396 (TANDEM K327-D23)-K","Sid Miller Academy - K396 - K396 - 75K396 - 110 CHESTER STREET"
"W/""328092346""","Partial Classroom Quarantine",882450001,"b2bcbceb-5c21-ec11-b6e6-001dd83069ee","10/4/2021","2021-10-04T04:00:00Z","054016","9/30/2021","2021-09-30T04:00:00Z","500 19TH STREET","40,656,202.000000",40656202,"97d91731-31f4-ea11-b882-24ee9a37d45c","Brooklyn",882450002,"-73,982,624.000000",-73982624,"15","STANLEY LAMM INSTITUE PRE-SCHOOL OF LONGISLAND HO","Brooklyn Urban Garden Charter School - K758 - KBNU - 84K758 - 500 19TH STREET"
"W/""328239114""","Classroom Closed",882450000,"9c336010-5d21-ec11-b6e6-001dd83069ee","10/7/2021","2021-10-07T04:00:00Z","054017","9/30/2021","2021-09-30T04:00:00Z","50 NAVY STREET","40,697,856.000000",40697856,"73283fb1-30f4-ea11-b882-24ee9a37d45c","Brooklyn",882450002,"-73,981,120.000000",-73981120,"13","P.S. 287 - BROOKLYN","P.S. 287 Bailey K. Ashford - K287 - K287 - 13K287 - 50 NAVY STREET"
"W/""328814983""","Classroom Closed",882450000,"15ceb02a-5e21-ec11-b6e6-001dd83069ee","10/8/2021","2021-10-08T04:00:00Z","054018","10/1/2021","2021-10-01T04:00:00Z","510 WAVERLY AVENUE","40,682,422.000000",40682422,"8228a20c-31f4-ea11-b882-24ee9a37d45c","Brooklyn",882450002,"-73,965,928.000000",-73965928,"13","ACHIEVEMENT FIRST ENDEAVOR CHARTER SCHOOL - K","Achievement First Endeavor Charter School - K508 - K784 - 84K508 - 510 WAVERLY AVENUE"
"W/""328814020""","Partial Classroom Quarantine",882450001,"ce99a626-df21-ec11-b6e6-001dd83069ee","10/9/2021","2021-10-09T04:00:00Z","054024","10/1/2021","2021-10-01T04:00:00Z","219 East 109 Street","40,793,363.000000",40793363,"8141e65b-31f4-ea11-b882-24ee9a37d45c","Manhattan",882450000,"-73,941,955.000000",-73941955,"4","P.S. 83 - MANHATTAN","P.S. 083 Luis Munoz Rivera - M083 - M083 - 04M083 - 219 East 109 Street"
"W/""328320072""","Partial Classroom Quarantine",882450001,"659184f9-e321-ec11-b6e6-001dd83069ee","10/9/2021","2021-10-09T04:00:00Z","054045","10/1/2021","2021-10-01T04:00:00Z","1425 WALTON AVENUE","40,840,400.000000",40840400,"d4d10307-33f4-ea11-b882-24ee9a37d45c","Bronx",882450001,"-73,915,879.000000",-73915879,"9","P.S. 64 - BRONX","The Walton Avenue School - X294 - X064 - 09X294 - 1425 WALTON AVENUE"
"W/""328836775""","Classroom Closed",882450000,"9c258461-f121-ec11-b6e6-001dd83069ee","10/10/2021","2021-10-10T04:00:00Z","054098","10/1/2021","2021-10-01T04:00:00Z","4360-78 BROADWAY","40,853,193.000000",40853193,"d9c88e4f-31f4-ea11-b882-24ee9a37d45c","Manhattan",882450000,"-73,933,629.000000",-73933629,"6","P.S. 48 - MANHATTAN","P.S. 048 P.O. Michael J. Buczek - M048 - M048 - 06M048 - 4360-78 BROADWAY"
"W/""328607719""","Non-Classroom Quarantine",882450003,"eaf88481-f821-ec11-b6e6-001dd83069ee","10/8/2021","2021-10-08T04:00:00Z","054126","10/1/2021","2021-10-01T04:00:00Z","850 KENT AVENUE","40,695,397.000000",40695397,"23ebaa73-30f4-ea11-b882-24ee9a37d45c","Brooklyn",882450002,"-73,959,999.000000",-73959999,"14","P.S. 157 - BROOKLYN","P.S./I.S. 157 The Benjamin Franklin Health & Science Academy - K157 - K157 - 14K157 - 850 KENT AVENUE"
"W/""328719146""","No Intervention",882450002,"65a17f87-f821-ec11-b6e6-001dd83069ee","10/1/2021","2021-10-01T04:00:00Z","054127","9/30/2021","2021-09-30T04:00:00Z","45-10 94th Street","40,743,228.000000",40743228,"e22ece86-32f4-ea11-b882-24ee9a37d45c","Queens",882450003,"-73,871,505.000000",-73871505,"24","ELMHURST EDUCATIONAL CAMPUS - Q","Pan American International High School - Q296 - Q744 - 24Q296 - 45-10 94th Street"
"W/""328625733""","Partial Classroom Quarantine",882450001,"b0ca4113-0022-ec11-b6e6-001dd83069ee","10/10/2021","2021-10-10T04:00:00Z","054172","10/1/2021","2021-10-01T04:00:00Z","64-20 175 Street","40,737,188.000000",40737188,"04b7c337-32f4-ea11-b882-24ee9a37d45c","Queens",882450003,"-73,794,501.000000",-73794501,"26","J.H.S. 216 - QUEENS","J.H.S. 216 George J. Ryan - Q216 - Q216 - 26Q216 - 64-20 175 Street"
"W/""328755897""","Partial Classroom Quarantine",882450001,"182b19d8-0122-ec11-b6e6-001dd83069ee","10/9/2021","2021-10-09T04:00:00Z","054179","10/1/2021","2021-10-01T04:00:00Z","800 LYDIG AVENUE","40,854,423.000000",40854423,"d1ba3c50-33f4-ea11-b882-24ee9a37d45c","Bronx",882450001,"-73,863,733.000000",-73863733,"11","THE DOMINIC CASTORE EDUCATIONAL CAMPUS - BRONX","Young Voices Academy of the Bronx - X357 - X292 - 11X357 - 800 LYDIG AVENUE"
"W/""328813752""","Classroom Closed",882450000,"faeff524-0422-ec11-b6e6-001dd83069ee","10/7/2021","2021-10-07T04:00:00Z","054192","10/1/2021","2021-10-01T04:00:00Z","85-27 91st Street","40,695,842.000000",40695842,"97c4fc0b-4afb-ea11-b883-24ee9a37d459",,,"-73,854,458.000000",-73854458,"27","North Side School","Parsons Preschool - 91 Street - QBFR - QBJJ -  - 85-27 91st Street"
"W/""328616853""","Partial Classroom Quarantine",882450001,"bfc439db-0922-ec11-b6e6-001dd83069ee","10/4/2021","2021-10-04T04:00:00Z","054221","10/1/2021","2021-10-01T04:00:00Z","47-07 30th Place","40,742,217.000000",40742217,"d911f898-32f4-ea11-b882-24ee9a37d45c","Queens",882450003,"-73,936,442.000000",-73936442,"24","R. F. WAGNER SEC SCL ARTS & TECH-Q","Robert F. Wagner, Jr. Secondary School for Arts and Technology - Q560 - Q891 - 24Q560 - 47-07 30th Place"
"W/""328781805""","Classroom Closed",882450000,"f4ad9ddb-0b22-ec11-b6e6-001dd83069ee","10/7/2021","2021-10-07T04:00:00Z","054225","10/1/2021","2021-10-01T04:00:00Z","231-10 HILLSIDE AVENUE","40,732,809.000000",40732809,"33275a30-4afb-ea11-b883-24ee9a37d459",,,"-73,738,338.000000",-73738338,"26","INTERDISPLINARY CENTER FOR CHILD DEVELOPMENT","PSYCHOTHERAPEUTIC EVALUATION PROGRAM PEP INC, DBA Parsons Preschool - QBFO - QAZN -  - 231-10 HILLSIDE AVENUE"
"W/""328781836""","Classroom Closed",882450000,"fcc80d85-0c22-ec11-b6e6-001dd83069ee","10/4/2021","2021-10-04T04:00:00Z","054231","10/1/2021","2021-10-01T04:00:00Z","84-60 PARSONS BLVD","40,712,498.000000",40712498,"24025a42-4afb-ea11-b883-24ee9a37d459",,,"-73,806,863.000000",-73806863,"28","PARSONS PRESCHOOL FOR CHILDREN","CIRCLE ACADEMY ( NORTH SIDE SCHOOL - JAMAICA ) - QASJ - QANJ -  - 84-60 PARSONS BLVD"
"W/""328744164""","Partial Classroom Quarantine",882450001,"5485312c-1222-ec11-b6e6-001dd83069ee","10/7/2021","2021-10-07T04:00:00Z","054251","10/1/2021","2021-10-01T04:00:00Z","152-20 11 AVENUE","40,792,053.000000",40792053,"87977d2b-32f4-ea11-b882-24ee9a37d45c","Queens",882450003,"-73,808,987.000000",-73808987,"25","P.S. 193 - QUEENS","P.S. 193 Alfred J. Kennedy - Q193 - Q193 - 25Q193 - 152-20 11 AVENUE"
"W/""328813632""","Partial Classroom Quarantine",882450001,"979c8c5a-1522-ec11-b6e6-001dd83069ee","10/8/2021","2021-10-08T04:00:00Z","054263","10/1/2021","2021-10-01T04:00:00Z","200 WARDWELL AVENUE","40,618,097.000000",40618097,"73a9d9c3-32f4-ea11-b882-24ee9a37d45c","Staten Island",882450004,"-74,133,080.000000",-74133080,"31","P.S. 30 - STATEN ISLAND","P.S. 030 Westerleigh - R030 - R030 - 31R030 - 200 WARDWELL AVENUE"
"W/""328783187""","Classroom Closed",882450000,"4925e53d-1e22-ec11-b6e6-001dd83069ee","10/8/2021","2021-10-08T04:00:00Z","054306","10/1/2021","2021-10-01T04:00:00Z","972 FULTON STREET","40,682,256.000000",40682256,"2dde261e-4afb-ea11-b883-24ee9a37d459",,,"-73,962,221.000000",-73962221,"13","YOUNG MINDS DAY CARE","YOUNG MINDS DAY CARE - KBLI - KBLI -  - 972 FULTON STREET"
"W/""324839765""","Classroom Closed",882450000,"30f90368-db1e-ec11-b6e6-001dd8306e46","10/4/2021","2021-10-04T04:00:00Z","052472","9/27/2021","2021-09-27T04:00:00Z","369 93RD STREET","40,618,135.000000",40618135,"f53159fa-30f4-ea11-b882-24ee9a37d45c","Brooklyn",882450002,"-74,031,046.000000",-74031046,"20","PRE-K CENTER @93RD STREET - BROOKLYN","District 20 Pre-K Center - K768 - K613 - 20K768 - 369 93RD STREET"
"W/""324595406""","Classroom Closed",882450000,"044efc96-dc1e-ec11-b6e6-001dd8306e46","10/4/2021","2021-10-04T04:00:00Z","052477","9/27/2021","2021-09-27T04:00:00Z","3010 BRIGGS AVENUE","40,872,259.000000",40872259,"1b9ebaee-32f4-ea11-b882-24ee9a37d45c","Bronx",882450001,"-73,883,339.000000",-73883339,"10","P.S. 8 - BRONX","P.S. 008 Isaac Varian - X008 - X008 - 10X008 - 3010 BRIGGS AVENUE"
"W/""324595411""","Partial Classroom Quarantine",882450001,"05a5aeb5-dc1e-ec11-b6e6-001dd8306e46","10/4/2021","2021-10-04T04:00:00Z","052478","9/27/2021","2021-09-27T04:00:00Z","57-00 223RD STREET","40,752,343.000000",40752343,"86e2635c-32f4-ea11-b882-24ee9a37d45c","Queens",882450003,"-73,757,271.000000",-73757271,"26","BENJAMIN N. CARDOZO HS - Q","Benjamin N. Cardozo High School - Q415 - Q415 - 26Q415 - 57-00 223RD STREET"
"W/""324597830""","Classroom Closed",882450000,"87179633-de1e-ec11-b6e6-001dd8306e46","10/3/2021","2021-10-03T04:00:00Z","052489","9/27/2021","2021-09-27T04:00:00Z","2545 GUNTHER AVENUE","40,863,842.000000",40863842,"b22aa42b-33f4-ea11-b882-24ee9a37d45c","Bronx",882450001,"-73,836,525.000000",-73836525,"11","I.S. 144 - BRONX","Bronx Charter School for Better Learning II - X484 - X144 - 84X484 - 2545 GUNTHER AVENUE"
"W/""325860761""","Classroom Closed",882450000,"0bd02cc5-df1e-ec11-b6e6-001dd8306e46","10/4/2021","2021-10-04T04:00:00Z","052494","9/28/2021","2021-09-28T04:00:00Z","325 SOUTH  3 STREET","40,710,107.000000",40710107,"d7968d36-30f4-ea11-b882-24ee9a37d45c","Brooklyn",882450002,"-73,954,678.000000",-73954678,"14","P.S. 19 - BROOKLYN","Brooklyn Arbor Elementary School - K414 - K019 - 14K414 - 325 SOUTH  3 STREET"
"W/""324595492""","Non-Classroom Quarantine",882450003,"bf1dfcf0-df1e-ec11-b6e6-001dd8306e46","10/4/2021","2021-10-04T04:00:00Z","052497","9/27/2021","2021-09-27T04:00:00Z","48-10 31 AVENUE","40,757,072.000000",40757072,"d8b66262-32f4-ea11-b882-24ee9a37d45c","Queens",882450003,"-73,911,165.000000",-73911165,"30","WILLIAM C. BRYANT HS - Q","William Cullen Bryant High School - Q445 - Q445 - 30Q445 - 48-10 31 AVENUE"
"W/""327006566""","Partial Classroom Quarantine",882450001,"212dde0f-e01e-ec11-b6e6-001dd8306e46","10/4/2021","2021-10-04T04:00:00Z","052500","9/27/2021","2021-09-27T04:00:00Z","45-30 36 STREET","40,743,309.000000",40743309,"44b4977a-32f4-ea11-b882-24ee9a37d45c","Queens",882450003,"-73,929,577.000000",-73929577,"24","AVIATION HS - Q","Aviation Career & Technical Education High School - Q610 - Q610 - 24Q610 - 45-30 36 STREET"
"W/""324597897""","Classroom Closed",882450000,"37ca547f-e01e-ec11-b6e6-001dd8306e46","10/3/2021","2021-10-03T04:00:00Z","052502","9/27/2021","2021-09-27T04:00:00Z","325 SOUTH  3 STREET","40,710,107.000000",40710107,"d7968d36-30f4-ea11-b882-24ee9a37d45c","Brooklyn",882450002,"-73,954,678.000000",-73954678,"14","P.S. 19 - BROOKLYN","Brooklyn Arbor Elementary School - K414 - K019 - 14K414 - 325 SOUTH  3 STREET"
"W/""324597961""","Classroom Closed",882450000,"0491c6e4-e11e-ec11-b6e6-001dd8306e46","10/3/2021","2021-10-03T04:00:00Z","052511","9/27/2021","2021-09-27T04:00:00Z","1458 YORK AVENUE","40,770,215.000000",40770215,"1d005d7a-31f4-ea11-b882-24ee9a37d45c","Manhattan",882450000,"-73,950,745.000000",-73950745,"2","P.S. 158 - MANHATTAN","P.S. 158 Bayard Taylor - M158 - M158 - 02M158 - 1458 YORK AVENUE"
"W/""325464894""","Classroom Closed",882450000,"7523b298-e31e-ec11-b6e6-001dd8306e46","10/4/2021","2021-10-04T04:00:00Z","052520","9/27/2021","2021-09-27T04:00:00Z","330 59 STREET","40,641,950.000000",40641950,"8ee657bd-30f4-ea11-b882-24ee9a37d45c","Brooklyn",882450002,"-74,019,299.000000",-74019299,"20","P.S. 314 - BROOKLYN","P.S. 503: The School of Discovery - K503 - K314 - 20K503 - 330 59 STREET"
"W/""325104876""","Classroom Closed",882450000,"11be7c8e-e41e-ec11-b6e6-001dd8306e46","10/4/2021","2021-10-04T04:00:00Z","052526","9/27/2021","2021-09-27T04:00:00Z","69-10 65th Drive","40,715,005.000000",40715005,"2ca10a44-32f4-ea11-b882-24ee9a37d45c","Queens",882450003,"-73,885,974.000000",-73885974,"24","PS/IS 128","P.S. 128 The Lorraine Tuzzo, Juniper Valley Elementary School - Q128 - Q247 - 24Q128 - 69-10 65th Drive"
"W/""324595658""","Classroom Closed",882450000,"3131d837-e81e-ec11-b6e6-001dd8306e46","10/4/2021","2021-10-04T04:00:00Z","052537","9/27/2021","2021-09-27T04:00:00Z","3096 BRIGHTON 6TH STREET","40,576,883.000000",40576883,"305d0a12-4afb-ea11-b883-24ee9a37d459",,,"-73,961,593.000000",-73961593,"21","M.S. SUNSHINE DAY CARE CENTER","M.S. SUNSHINE DAY CARE CENTER - KBQG - KBQG -  - 3096 BRIGHTON 6TH STREET"
"W/""324595739""","Classroom Closed",882450000,"b96bd80a-f31e-ec11-b6e6-001dd8306e46","10/3/2021","2021-10-03T04:00:00Z","052561","9/27/2021","2021-09-27T04:00:00Z","140 PALMA DRIVE","40,611,136.000000",40611136,"410410ca-32f4-ea11-b882-24ee9a37d45c","Staten Island",882450004,"-74,083,799.000000",-74083799,"31","P.S. 57 - STATEN ISLAND","P.S. 057 Hubert H. Humphrey - R057 - R057 - 31R057 - 140 PALMA DRIVE"
"W/""325860786""","Partial Classroom Quarantine",882450001,"d4f22232-f91e-ec11-b6e6-001dd8306e46","10/2/2021","2021-10-02T04:00:00Z","052576","9/28/2021","2021-09-28T04:00:00Z","511 7 AVENUE","40,660,912.000000",40660912,"dbf57030-30f4-ea11-b882-24ee9a37d45c","Brooklyn",882450002,"-73,985,946.000000",-73985946,"15","P.S. 10 - BROOKLYN","Magnet School of Math, Science and Design Technology - K010 - K010 - 15K010 - 511 7 AVENUE"
"W/""324847219""","Classroom Closed",882450000,"813883d6-fb1e-ec11-b6e6-001dd8306e46","10/4/2021","2021-10-04T04:00:00Z","052585","9/27/2021","2021-09-27T04:00:00Z","108-10 109 AVENUE","40,679,083.000000",40679083,"b92ff20c-32f4-ea11-b882-24ee9a37d45c","Queens",882450003,"-73,831,025.000000",-73831025,"27","P.S. 108 - QUEENS","P.S. 108 Captain Vincent G. Fowler - Q108 - Q108 - 27Q108 - 108-10 109 AVENUE"
"W/""325737015""","Classroom Closed",882450000,"686acfe5-fc1e-ec11-b6e6-001dd8306e46","10/4/2021","2021-10-04T04:00:00Z","052588","9/27/2021","2021-09-27T04:00:00Z","91-02 88 AVENUE","40,691,467.000000",40691467,"8e8946f4-31f4-ea11-b882-24ee9a37d45c","Queens",882450003,"-73,852,792.000000",-73852792,"27","P.S. 60 - QUEENS","P.S. 060 Woodhaven - Q060 - Q060 - 27Q060 - 91-02 88 AVENUE"
"W/""324654735""","Partial Classroom Quarantine",882450001,"476aff68-ff1e-ec11-b6e6-001dd8306e46","10/4/2021","2021-10-04T04:00:00Z","052591","9/27/2021","2021-09-27T04:00:00Z","544 7TH AVENUE","40,660,805.000000",40660805,"76d92255-30f4-ea11-b882-24ee9a37d45c","Brooklyn",882450002,"-73,988,743.000000",-73988743,"15","I.S. 88 - BROOKLYN","J.H.S. 088 Peter Rouget - K088 - K088 - 15K088 - 544 7TH AVENUE"
"W/""325860806""","Non-Classroom Quarantine",882450003,"9736ed7c-841f-ec11-b6e6-001dd8306e46","10/3/2021","2021-10-03T04:00:00Z","052604","9/28/2021","2021-09-28T04:00:00Z","466 WEST END AVENUE","40,786,330.000000",40786330,"676e70b7-31f4-ea11-b882-24ee9a37d45c","Manhattan",882450000,"-73,979,217.000000",-73979217,"3","P.S. 811 (OLD P148/LIVINGS HS) - M","P.S. M811 - Mickey Mantle School - M811 - M841 - 75M811 - 466 WEST END AVENUE"
"W/""325860811""","Non-Classroom Quarantine",882450003,"a036ed7c-841f-ec11-b6e6-001dd8306e46","10/2/2021","2021-10-02T04:00:00Z","052605","9/28/2021","2021-09-28T04:00:00Z","319 EAST 117 STREET","40,797,507.000000",40797507,"15005d7a-31f4-ea11-b882-24ee9a37d45c","Manhattan",882450000,"-73,935,895.000000",-73935895,"4","P.S. 155 - MANHATTAN","P.S. M811 - Mickey Mantle School - M811 - M155 - 75M811 - 319 EAST 117 STREET"
"W/""327459649""","Classroom Closed",882450000,"600b144e-871f-ec11-b6e6-001dd8306e46","10/4/2021","2021-10-04T04:00:00Z","052621","9/28/2021","2021-09-28T04:00:00Z","545 WILLOUGHBY AVENUE","40,694,470.000000",40694470,"e5968d36-30f4-ea11-b882-24ee9a37d45c","Brooklyn",882450002,"-73,947,256.000000",-73947256,"14","P.S. 23 - BROOKLYN","P.S. 023 Carter G. Woodson - K023 - K023 - 14K023 - 545 WILLOUGHBY AVENUE"
"W/""325860887""","Classroom Closed",882450000,"0fdfd6d0-871f-ec11-b6e6-001dd8306e46","10/4/2021","2021-10-04T04:00:00Z","052625","9/28/2021","2021-09-28T04:00:00Z","1307 CENTRAL AVENUE","40,607,247.000000",40607247,"30a10a44-32f4-ea11-b882-24ee9a37d45c","Queens",882450003,"-73,748,799.000000",-73748799,"27","P.S. 253 -QUEENS","P.S. 253 - Q253 - Q253 - 27Q253 - 1307 CENTRAL AVENUE"
"W/""325860897""","Partial Classroom Quarantine",882450001,"3b3a1d4c-881f-ec11-b6e6-001dd8306e46","10/4/2021","2021-10-04T04:00:00Z","052628","9/28/2021","2021-09-28T04:00:00Z","145 WEST  84 STREET","40,786,134.000000",40786134,"33a6ba98-31f4-ea11-b882-24ee9a37d45c","Manhattan",882450000,"-73,974,483.000000",-73974483,"3","LOUIS D. BRANDEIS HS - MANHATTAN","Frank McCourt High School - M417 - M470 - 03M417 - 145 WEST  84 STREET"
"W/""325860902""","Partial Classroom Quarantine",882450001,"c9609c76-881f-ec11-b6e6-001dd8306e46","10/3/2021","2021-10-03T04:00:00Z","052629","9/28/2021","2021-09-28T04:00:00Z","2545 GUNTHER AVENUE","40,863,842.000000",40863842,"b22aa42b-33f4-ea11-b882-24ee9a37d45c","Bronx",882450001,"-73,836,525.000000",-73836525,"11","I.S. 144 - BRONX","Bronx Charter School for Better Learning II - X484 - X144 - 84X484 - 2545 GUNTHER AVENUE"
"W/""328647553""","Partial Classroom Quarantine",882450001,"ec9f6d04-891f-ec11-b6e6-001dd8306e46","10/3/2021","2021-10-03T04:00:00Z","052633","9/28/2021","2021-09-28T04:00:00Z","32-24 CORPORAL KENNEDY STREET","40,771,398.000000",40771398,"6be2635c-32f4-ea11-b882-24ee9a37d45c","Queens",882450003,"-73,781,041.000000",-73781041,"26","BAYSIDE HS - Q","Bayside High School - Q495 - Q405 - 26Q495 - 32-24 CORPORAL KENNEDY STREET"
"W/""325860932""","Classroom Closed",882450000,"e7bd7c91-891f-ec11-b6e6-001dd8306e46","10/4/2021","2021-10-04T04:00:00Z","052636","9/28/2021","2021-09-28T04:00:00Z","1683 THIRD AVENUE","40,783,981.000000",40783981,"c537fba4-31f4-ea11-b882-24ee9a37d45c","Manhattan",882450000,"-73,949,807.000000",-73949807,"2","PRE-K CENTER @ 3RD AVENUE - MANHATTAN","District 2 Pre-K Center - M391 - M491 - 02M391 - 1683 THIRD AVENUE"
"W/""325860942""","Non-Classroom Quarantine",882450003,"8b5ac140-8a1f-ec11-b6e6-001dd8306e46","10/1/2021","2021-10-01T04:00:00Z","052638","9/28/2021","2021-09-28T04:00:00Z","475 NOSTRAND AVENUE","40,681,512.000000",40681512,"412f7d06-31f4-ea11-b882-24ee9a37d45c","Brooklyn",882450002,"-73,949,130.000000",-73949130,"13","ADULT LRNG CTR (OLD GRLS HS) - K","Adult and Continuing Education - K755 - K743 - 79K755 - 475 NOSTRAND AVENUE"
"W/""325860952""","Partial Classroom Quarantine",882450001,"51f9330b-8b1f-ec11-b6e6-001dd8306e46","10/4/2021","2021-10-04T04:00:00Z","052640","9/28/2021","2021-09-28T04:00:00Z","58-74 57 STREET","40,718,234.000000",40718234,"f8f22ce2-31f4-ea11-b882-24ee9a37d45c","Queens",882450003,"-73,912,458.000000",-73912458,"24","P.S. 9 (W REED SCHOOL) - QUEENS","P.S. 009 - Q009 - Q009 - 75Q009 - 58-74 57 STREET"
"W/""325860957""","Non-Classroom Quarantine",882450003,"89ffd729-8b1f-ec11-b6e6-001dd8306e46","10/1/2021","2021-10-01T04:00:00Z","052642","9/28/2021","2021-09-28T04:00:00Z","2529 GERRITSEN AVENUE","40,595,798.000000",40595798,"e5201dab-30f4-ea11-b882-24ee9a37d45c","Brooklyn",882450002,"-73,927,850.000000",-73927850,"22","P.S. 277 - BROOKLYN","P.S. 277 Gerritsen Beach - K277 - K277 - 22K277 - 2529 GERRITSEN AVENUE"
"W/""325860967""","Classroom Closed",882450000,"e66c67b1-8c1f-ec11-b6e6-001dd8306e46","10/4/2021","2021-10-04T04:00:00Z","052646","9/28/2021","2021-09-28T04:00:00Z","195 DANIEL LOW TERRACE","40,639,638.000000",40639638,"56fdc1bd-32f4-ea11-b882-24ee9a37d45c","Staten Island",882450004,"-74,079,594.000000",-74079594,"31","P.S. 16 - STATEN ISLAND","P.S. 016 John J. Driscoll - R016 - R016 - 31R016 - 195 DANIEL LOW TERRACE"
"W/""327112229""","Partial Classroom Quarantine",882450001,"f225c625-8d1f-ec11-b6e6-001dd8306e46","10/3/2021","2021-10-03T04:00:00Z","052649","9/28/2021","2021-09-28T04:00:00Z","800 EAST GUN HILL ROAD","40,875,172.000000",40875172,"699d7c62-33f4-ea11-b882-24ee9a37d45c","Bronx",882450001,"-73,861,649.000000",-73861649,"11","EVANDER CHILDS HS - X","Bronx Lab School - X265 - X425 - 11X265 - 800 EAST GUN HILL ROAD"
"W/""326846860""","Partial Classroom Quarantine",882450001,"f0177819-8e1f-ec11-b6e6-001dd8306e46","10/4/2021","2021-10-04T04:00:00Z","052653","9/28/2021","2021-09-28T04:00:00Z","101-01 ROCKAWAY BOULEVARD","40,680,065.000000",40680065,"6abc9674-32f4-ea11-b882-24ee9a37d45c","Queens",882450003,"-73,838,616.000000",-73838616,"27","JOHN ADAMS HS - QUEENS","John Adams High School - Q480 - Q480 - 27Q480 - 101-01 ROCKAWAY BOULEVARD"
"W/""325861013""","Partial Classroom Quarantine",882450001,"78efaf0d-901f-ec11-b6e6-001dd8306e46","10/4/2021","2021-10-04T04:00:00Z","052660","9/28/2021","2021-09-28T04:00:00Z","75 WEST 205 STREET","40,879,958.000000",40879958,"64ffcc6e-33f4-ea11-b882-24ee9a37d45c","Bronx",882450001,"-73,889,011.000000",-73889011,"10","BRONX HS OF SCIENCE - X","The Bronx High School of Science - X445 - X445 - 10X445 - 75 WEST 205 STREET"
"W/""325861018""","Partial Classroom Quarantine",882450001,"31e82857-901f-ec11-b6e6-001dd8306e46","10/3/2021","2021-10-03T04:00:00Z","052661","9/28/2021","2021-09-28T04:00:00Z","147-26 25 DRIVE","40,774,906.000000",40774906,"ae0e6e25-32f4-ea11-b882-24ee9a37d45c","Queens",882450003,"-73,818,607.000000",-73818607,"25","J.H.S. 185 - QUEENS","J.H.S. 185 Edward Bleeker - Q185 - Q185 - 25Q185 - 147-26 25 DRIVE"
"W/""325861033""","Non-Classroom Quarantine",882450003,"179d0601-911f-ec11-b6e6-001dd8306e46","10/4/2021","2021-10-04T04:00:00Z","052665","9/28/2021","2021-09-28T04:00:00Z","921 EAST 228TH STREET","40,888,242.000000",40888242,"6ce03d56-33f4-ea11-b882-24ee9a37d45c","Bronx",882450001,"-73,852,714.000000",-73852714,"11","I.S./H.S. 362 - BRONX","The Bronxwood Preparatory Academy - X514 - X362 - 11X514 - 921 EAST 228TH STREET"
"W/""325861048""","Partial Classroom Quarantine",882450001,"1b503f62-911f-ec11-b6e6-001dd8306e46","10/4/2021","2021-10-04T04:00:00Z","052668","9/28/2021","2021-09-28T04:00:00Z","990 DEKALB AVENUE","40,692,866.000000",40692866,"9303194f-30f4-ea11-b882-24ee9a37d45c","Brooklyn",882450002,"-73,935,123.000000",-73935123,"16","P.S. 81 - BROOKLYN","P.S. K004 - K004 - K081 - 75K004 - 990 DEKALB AVENUE"
"W/""325861068""","Classroom Closed",882450000,"5b372aed-911f-ec11-b6e6-001dd8306e46","10/4/2021","2021-10-04T04:00:00Z","052672","9/28/2021","2021-09-28T04:00:00Z","3201 KINGSBRIDGE AVENUE","40,881,562.000000",40881562,"189ebaee-32f4-ea11-b882-24ee9a37d45c","Bronx",882450001,"-73,905,697.000000",-73905697,"10","P.S. 7 - BRONX","Milton Fein School - X007 - X007 - 10X007 - 3201 KINGSBRIDGE AVENUE"
"W/""325861088""","Partial Classroom Quarantine",882450001,"8bd29ab8-921f-ec11-b6e6-001dd8306e46","10/4/2021","2021-10-04T04:00:00Z","052678","9/28/2021","2021-09-28T04:00:00Z","80 UNDERHILL AVENUE","40,678,554.000000",40678554,"d8f57030-30f4-ea11-b882-24ee9a37d45c","Brooklyn",882450002,"-73,966,333.000000",-73966333,"13","P.S. 9 - BROOKLYN","Public School 9 The Sarah Smith Garnet School - K009 - K009 - 13K009 - 80 UNDERHILL AVENUE"
"W/""325861103""","Partial Classroom Quarantine",882450001,"3a075bdd-921f-ec11-b6e6-001dd8306e46","10/4/2021","2021-10-04T04:00:00Z","052681","9/28/2021","2021-09-28T04:00:00Z","19 EAST 103 STREET","40,792,302.000000",40792302,"42005d7a-31f4-ea11-b882-24ee9a37d45c","Manhattan",882450000,"-73,951,425.000000",-73951425,"4","P.S. 171 - MANHATTAN","P.S. 171 Patrick Henry - M171 - M171 - 04M171 - 19 EAST 103 STREET"
"W/""325861113""","Partial Classroom Quarantine",882450001,"94839b50-931f-ec11-b6e6-001dd8306e46","10/1/2021","2021-10-01T04:00:00Z","052684","9/28/2021","2021-09-28T04:00:00Z","213 EAST 63RD STREET","40,763,883.000000",40763883,"c1e0838c-31f4-ea11-b882-24ee9a37d45c","Manhattan",882450000,"-73,963,861.000000",-73963861,"2","P.S. 59 - (MEETH) -MANHATTAN","East Side Elementary School, PS 267 - M267 - M267 - 02M267 - 213 EAST 63RD STREET"
"W/""325861164""","Classroom Closed",882450000,"f6b74b03-951f-ec11-b6e6-001dd8306e46","10/4/2021","2021-10-04T04:00:00Z","052702","9/28/2021","2021-09-28T04:00:00Z","757 CAULDWELL AVENUE","40,819,419.000000",40819419,"8901ce37-33f4-ea11-b882-24ee9a37d45c","Bronx",882450001,"-73,908,965.000000",-73908965,"7","P.S. 157 - BRONX","P.S. 157 Grove Hill - X157 - X157 - 07X157 - 757 CAULDWELL AVENUE"
"W/""325861174""","Partial Classroom Quarantine",882450001,"e828d018-961f-ec11-b6e6-001dd8306e46","10/2/2021","2021-10-02T04:00:00Z","052709","9/28/2021","2021-09-28T04:00:00Z","200 WOODBINE STREET","40,693,542.000000",40693542,"11e2abc9-30f4-ea11-b882-24ee9a37d45c","Brooklyn",882450002,"-73,915,159.000000",-73915159,"32","P.S. 377 - BROOKLYN","Achievement First North Brooklyn Prep Charter School - K784 - K377 - 84K784 - 200 WOODBINE STREET"
"W/""327916552""","Partial Classroom Quarantine",882450001,"bce904ad-971f-ec11-b6e6-001dd8306e46","10/4/2021","2021-10-04T04:00:00Z","052722","9/28/2021","2021-09-28T04:00:00Z","50 NAVY STREET","40,697,856.000000",40697856,"73283fb1-30f4-ea11-b882-24ee9a37d45c","Brooklyn",882450002,"-73,981,120.000000",-73981120,"13","P.S. 287 - BROOKLYN","P.S. 287 Bailey K. Ashford - K287 - K287 - 13K287 - 50 NAVY STREET"
"W/""327869165""","Partial Classroom Quarantine",882450001,"78f2e2f6-981f-ec11-b6e6-001dd8306e46","10/2/2021","2021-10-02T04:00:00Z","052738","9/28/2021","2021-09-28T04:00:00Z","50 NAVY STREET","40,697,856.000000",40697856,"73283fb1-30f4-ea11-b882-24ee9a37d45c","Brooklyn",882450002,"-73,981,120.000000",-73981120,"13","P.S. 287 - BROOKLYN","P.S. 287 Bailey K. Ashford - K287 - K287 - 13K287 - 50 NAVY STREET"
"W/""328709730""","Partial Classroom Quarantine",882450001,"4b978ae3-9a1f-ec11-b6e6-001dd8306e46","10/4/2021","2021-10-04T04:00:00Z","052755","9/28/2021","2021-09-28T04:00:00Z","29 FT GREENE PLACE","40,688,896.000000",40688896,"3188e6db-30f4-ea11-b882-24ee9a37d45c","Brooklyn",882450002,"-73,976,435.000000",-73976435,"13","BROOKLYN TECH HS - K","Brooklyn Technical High School - K430 - K430 - 13K430 - 29 FT GREENE PLACE"
"W/""327117606""","Classroom Closed",882450000,"217cf328-9d1f-ec11-b6e6-001dd8306e46","10/3/2021","2021-10-03T04:00:00Z","052775","9/28/2021","2021-09-28T04:00:00Z","1935 BUSSING AVENUE","40,895,741.000000",40895741,"f427b299-33f4-ea11-b882-24ee9a37d45c","Bronx",882450001,"-73,846,198.000000",-73846198,"11","P.S. 87 TRANSPORTABLE - X","P.S. 087 Bronx - X087 - X945 - 11X087 - 1935 BUSSING AVENUE"
"W/""326859330""","Partial Classroom Quarantine",882450001,"fb6844a7-9d1f-ec11-b6e6-001dd8306e46","10/3/2021","2021-10-03T04:00:00Z","052781","9/28/2021","2021-09-28T04:00:00Z","45-10 94th Street","40,743,228.000000",40743228,"e22ece86-32f4-ea11-b882-24ee9a37d45c","Queens",882450003,"-73,871,505.000000",-73871505,"24","ELMHURST EDUCATIONAL CAMPUS - Q","Queens Transition Center - Q752 - Q744 - 75Q752 - 45-10 94th Street"
"W/""328075847""","Partial Classroom Quarantine",882450001,"e97ae98a-9e1f-ec11-b6e6-001dd8306e46","10/4/2021","2021-10-04T04:00:00Z","052790","9/28/2021","2021-09-28T04:00:00Z","750 BAYCHESTER AVENUE","40,874,035.000000",40874035,"8253dd74-33f4-ea11-b882-24ee9a37d45c","Bronx",882450001,"-73,831,669.000000",-73831669,"11","HARRY S. TRUMAN HS - X","Harry S Truman High School - X455 - X455 - 11X455 - 750 BAYCHESTER AVENUE"
"W/""327123216""","Classroom Closed",882450000,"737f2739-9f1f-ec11-b6e6-001dd8306e46","10/4/2021","2021-10-04T04:00:00Z","052796","9/28/2021","2021-09-28T04:00:00Z","512 CARROLL STREET","40,676,198.000000",40676198,"fcd7cf12-31f4-ea11-b882-24ee9a37d45c","Brooklyn",882450002,"-73,985,500.000000",-73985500,"15","P.S. 372 (OUR LADY OF PEACE)-K","The Children's School - K418 - K834 - 15K418 - 512 CARROLL STREET"
"W/""327681206""","Partial Classroom Quarantine",882450001,"aa79b7e6-9f1f-ec11-b6e6-001dd8306e46","10/3/2021","2021-10-03T04:00:00Z","052804","9/28/2021","2021-09-28T04:00:00Z","158 RICHMOND STREET","40,683,399.000000",40683399,"ca79df48-30f4-ea11-b882-24ee9a37d45c","Brooklyn",882450002,"-73,877,256.000000",-73877256,"19","P.S. 65 - BROOKLYN","Achievement First East New York Charter School - K358 - K065 - 84K358 - 158 RICHMOND STREET"
"W/""325862533""","Classroom Closed",882450000,"c65cc992-a21f-ec11-b6e6-001dd8306e46","10/3/2021","2021-10-03T04:00:00Z","052839","9/28/2021","2021-09-28T04:00:00Z","350 LINWOOD STREET","40,677,112.000000",40677112,"42de5eb7-30f4-ea11-b882-24ee9a37d45c","Brooklyn",882450002,"-73,884,211.000000",-73884211,"19","I.S. 302 - BROOKLYN","Achievement First Apollo Charter School - K774 - K302 - 84K774 - 350 LINWOOD STREET"
"W/""325861526""","Partial Classroom Quarantine",882450001,"82e7bdf2-a21f-ec11-b6e6-001dd8306e46","10/3/2021","2021-10-03T04:00:00Z","052847","9/28/2021","2021-09-28T04:00:00Z","4600 BROADWAY","40,860,951.000000",40860951,"978d8486-31f4-ea11-b882-24ee9a37d45c","Manhattan",882450000,"-73,930,082.000000",-73930082,"6","I.S. 218 - MANHATTAN","City College Academy of the Arts - M293 - M218 - 06M293 - 4600 BROADWAY"
"W/""325861531""","Partial Classroom Quarantine",882450001,"c9acaf0a-a31f-ec11-b6e6-001dd8306e46","10/4/2021","2021-10-04T04:00:00Z","052849","9/28/2021","2021-09-28T04:00:00Z","730 BRYANT AVENUE","40,815,827.000000",40815827,"f9d10307-33f4-ea11-b882-24ee9a37d45c","Bronx",882450001,"-73,885,284.000000",-73885284,"8","I.S. 201 - BRONX","Hyde Leadership Charter School - X345 - X074 - 84X345 - 730 BRYANT AVENUE"
"W/""327122172""","Partial Classroom Quarantine",882450001,"28879685-a41f-ec11-b6e6-001dd8306e46","10/7/2021","2021-10-07T04:00:00Z","052867","9/28/2021","2021-09-28T04:00:00Z","240 EAST 172 STREET","40,839,307.000000",40839307,"c856635c-33f4-ea11-b882-24ee9a37d45c","Bronx",882450001,"-73,911,366.000000",-73911366,"9","WILLIAM H. TAFT HS - X","Bronx High School for Medical Science - X413 - X410 - 09X413 - 240 EAST 172 STREET"
"W/""327763396""","Partial Classroom Quarantine",882450001,"e2e73d07-a61f-ec11-b6e6-001dd8306e46","10/4/2021","2021-10-04T04:00:00Z","052884","9/28/2021","2021-09-28T04:00:00Z","1794 EAST 172 STREET","40,832,529.000000",40832529,"5036d900-33f4-ea11-b882-24ee9a37d45c","Bronx",882450001,"-73,866,974.000000",-73866974,"12","P.S. 47 - BRONX","P.S. 047 John Randolph - X047 - X047 - 12X047 - 1794 EAST 172 STREET"
"W/""327154897""","Non-Classroom Quarantine",882450003,"ca8c465b-a61f-ec11-b6e6-001dd8306e46","10/4/2021","2021-10-04T04:00:00Z","052891","9/28/2021","2021-09-28T04:00:00Z","91-30 METROPOLITAN AVENUE","40,708,431.000000",40708431,"a372c880-32f4-ea11-b882-24ee9a37d45c","Queens",882450003,"-73,855,543.000000",-73855543,"28","METROPOLITAN AVENUE CAMPUS - QUEENS","Queens Metropolitan High School - Q686 - Q686 - 28Q686 - 91-30 METROPOLITAN AVENUE"
"W/""325861638""","Partial Classroom Quarantine",882450001,"db72880a-a71f-ec11-b6e6-001dd8306e46","10/4/2021","2021-10-04T04:00:00Z","052899","9/28/2021","2021-09-28T04:00:00Z","35 Hill Street","40,622,415.000000",40622415,"46fdc1bd-32f4-ea11-b882-24ee9a37d45c","Staten Island",882450004,"-74,079,228.000000",-74079228,"31","P.S. 14 - STATEN ISLAND","P.S. 78 - R078 - R014 - 31R078 - 35 Hill Street"
"W/""327130593""","Classroom Closed",882450000,"2ea3e476-a71f-ec11-b6e6-001dd8306e46","10/4/2021","2021-10-04T04:00:00Z","052903","9/28/2021","2021-09-28T04:00:00Z","80-51 261 STREET","40,744,201.000000",40744201,"cd2ff20c-32f4-ea11-b882-24ee9a37d45c","Queens",882450003,"-73,709,404.000000",-73709404,"26","The James J. Ambrose School","The James J. Ambrose School - Q115 - Q115 - 26Q115 - 80-51 261 STREET"
"W/""325861673""","Classroom Closed",882450000,"ca612c16-a91f-ec11-b6e6-001dd8306e46","10/4/2021","2021-10-04T04:00:00Z","052921","9/28/2021","2021-09-28T04:00:00Z","138-01 77 AVENUE","40,721,514.000000",40721514,"ff9b4c1f-32f4-ea11-b882-24ee9a37d45c","Queens",882450003,"-73,823,569.000000",-73823569,"25","P.S. 164 - QUEENS","P.S. 164 Queens Valley - Q164 - Q164 - 25Q164 - 138-01 77 AVENUE"
"W/""327683894""","Partial Classroom Quarantine",882450001,"561aca0d-ab1f-ec11-b6e6-001dd8306e46","10/4/2021","2021-10-04T04:00:00Z","052944","9/29/2021","2021-09-29T04:00:00Z","3961 HILLMAN AVENUE","40,883,049.000000",40883049,"34474313-33f4-ea11-b882-24ee9a37d45c","Bronx",882450001,"-73,891,664.000000",-73891664,"10","P.S. 95 - BRONX","Ampark Neighborhood - X344 - X095 - 10X344 - 3961 HILLMAN AVENUE"
"W/""327685508""","Partial Classroom Quarantine",882450001,"bbd3aa09-ac1f-ec11-b6e6-001dd8306e46","10/4/2021","2021-10-04T04:00:00Z","052948","9/28/2021","2021-09-28T04:00:00Z","17-15 WEIRFIELD STREET","40,699,431.000000",40699431,"2606003e-32f4-ea11-b882-24ee9a37d45c","Queens",882450003,"-73,903,838.000000",-73903838,"24","P.S. 239 - QUEENS","P.S. 239 - Q239 - Q239 - 24Q239 - 17-15 WEIRFIELD STREET"
"W/""327198881""","Partial Classroom Quarantine",882450001,"b3ea09e0-ae1f-ec11-b6e6-001dd8306e46","10/4/2021","2021-10-04T04:00:00Z","052971","9/29/2021","2021-09-29T04:00:00Z","228 AVENUE S","40,600,660.000000",40600660,"e921d292-30f4-ea11-b882-24ee9a37d45c","Brooklyn",882450002,"-73,976,801.000000",-73976801,"21","I.S. 228 - BROOKLYN","I.S. 228 David A. Boody - K228 - K228 - 21K228 - 228 AVENUE S"
"W/""325861779""","Partial Classroom Quarantine",882450001,"56f661f4-af1f-ec11-b6e6-001dd8306e46","10/4/2021","2021-10-04T04:00:00Z","052979","9/28/2021","2021-09-28T04:00:00Z","228 AVENUE S","40,600,660.000000",40600660,"e921d292-30f4-ea11-b882-24ee9a37d45c","Brooklyn",882450002,"-73,976,801.000000",-73976801,"21","I.S. 228 - BROOKLYN","I.S. 228 David A. Boody - K228 - K228 - 21K228 - 228 AVENUE S"
"W/""327198887""","Partial Classroom Quarantine",882450001,"4c57f815-b11f-ec11-b6e6-001dd8306e46","10/3/2021","2021-10-03T04:00:00Z","052992","9/29/2021","2021-09-29T04:00:00Z","228 AVENUE S","40,600,660.000000",40600660,"e921d292-30f4-ea11-b882-24ee9a37d45c","Brooklyn",882450002,"-73,976,801.000000",-73976801,"21","I.S. 228 - BROOKLYN","I.S. 228 David A. Boody - K228 - K228 - 21K228 - 228 AVENUE S"
"W/""326773291""","Partial Classroom Quarantine",882450001,"11609da6-b11f-ec11-b6e6-001dd8306e46","10/4/2021","2021-10-04T04:00:00Z","052996","9/28/2021","2021-09-28T04:00:00Z","3010 BRIGGS AVENUE","40,872,259.000000",40872259,"1b9ebaee-32f4-ea11-b882-24ee9a37d45c","Bronx",882450001,"-73,883,339.000000",-73883339,"10","P.S. 8 - BRONX","P.S. 008 Isaac Varian - X008 - X008 - 10X008 - 3010 BRIGGS AVENUE"
"W/""327688341""","Partial Classroom Quarantine",882450001,"ef4eafb2-b11f-ec11-b6e6-001dd8306e46","10/4/2021","2021-10-04T04:00:00Z","052999","9/28/2021","2021-09-28T04:00:00Z","25 AUGUSTA AVENUE","40,552,213.000000",40552213,"8811b2e2-32f4-ea11-b882-24ee9a37d45c","Staten Island",882450004,"-74,169,038.000000",-74169038,"31","P.S. 42 ANNEX - STATEN ISLAND","P.S. 042 Eltingville - R042 - R848 - 31R042 - 25 AUGUSTA AVENUE"
"W/""325861834""","Classroom Closed",882450000,"15f7ffe8-b11f-ec11-b6e6-001dd8306e46","11/3/2021","2021-11-03T04:00:00Z","053001","9/28/2021","2021-09-28T04:00:00Z","63 25 Dry Harbor Road","40,721,739.000000",40721739,"5562a357-e9fe-eb11-b8b2-24ee9a37d45c",,,"-73,873,725.000000",-73873725,"24","NY League Forest Hills West","UCP of NEW YORK CITY FOREST HILLS WEST - QAPD - QAPD -  - 63 25 Dry Harbor Road"
"W/""327198907""","Classroom Closed",882450000,"616c1ab8-b31f-ec11-b6e6-001dd8306e46","10/4/2021","2021-10-04T04:00:00Z","053014","9/29/2021","2021-09-29T04:00:00Z","956 EAST  82 STREET","40,635,388.000000",40635388,"6b03194f-30f4-ea11-b882-24ee9a37d45c","Brooklyn",882450002,"-73,911,215.000000",-73911215,"18","I.S. 68 - BROOKLYN","Explore Excel Charter School - K379 - K068 - 84K379 - 956 EAST  82 STREET"
"W/""327151566""","Classroom Closed",882450000,"103d0672-b41f-ec11-b6e6-001dd8306e46","10/4/2021","2021-10-04T04:00:00Z","053016","9/28/2021","2021-09-28T04:00:00Z","2512 Marion Avenue","40,861,316.000000",40861316,"60ffcc6e-33f4-ea11-b882-24ee9a37d45c","Bronx",882450001,"-73,893,236.000000",-73893236,"10","PRE-K CENTER @MARION AVENUE - BRONX","Rose Hill Pre-K Center - X535 - X444 - 10X535 - 2512 Marion Avenue"
"W/""327147795""","Partial Classroom Quarantine",882450001,"56e5ba26-b51f-ec11-b6e6-001dd8306e46","10/2/2021","2021-10-02T04:00:00Z","053022","9/28/2021","2021-09-28T04:00:00Z","164 bruckner boulevard","40,803,052.000000",40803052,"a0845cb8-33f4-ea11-b882-24ee9a37d45c","Bronx",882450001,"-73,918,037.000000",-73918037,"7","SOUTH BRONX CHARTER SCHOOL","South Bronx Charter School for International Cultures and the Arts - X309 - XAXD - 84X309 - 164 bruckner boulevard"
"W/""325861890""","Partial Classroom Quarantine",882450001,"89ce63b0-b51f-ec11-b6e6-001dd8306e46","10/4/2021","2021-10-04T04:00:00Z","053024","9/28/2021","2021-09-28T04:00:00Z","3000 AVENUE X","40,593,157.000000",40593157,"552b3eee-30f4-ea11-b882-24ee9a37d45c","Brooklyn",882450002,"-73,936,635.000000",-73936635,"22","Frank J. Macchiarola Educational Complex","New Visions Charter High School for the Humanities III - K739 - K495 - 84K739 - 3000 AVENUE X"
"W/""327155249""","Classroom Closed",882450000,"9480ba73-b91f-ec11-b6e6-001dd8306e46","10/4/2021","2021-10-04T04:00:00Z","053040","9/28/2021","2021-09-28T04:00:00Z","108-10 109 AVENUE","40,679,083.000000",40679083,"b92ff20c-32f4-ea11-b882-24ee9a37d45c","Queens",882450003,"-73,831,025.000000",-73831025,"27","P.S. 108 - QUEENS","P.S. 108 Captain Vincent G. Fowler - Q108 - Q108 - 27Q108 - 108-10 109 AVENUE"
"W/""325862041""","Partial Classroom Quarantine",882450001,"6c669181-c31f-ec11-b6e6-001dd8306e46","10/3/2021","2021-10-03T04:00:00Z","053136","9/28/2021","2021-09-28T04:00:00Z","275 HARLEM RIVER PARK BRIDGE","40,852,400.000000",40852400,"c0ab074a-33f4-ea11-b882-24ee9a37d45c","Bronx",882450001,"-73,921,600.000000",-73921600,"9","P.S. 230/I.S. 229 (UDC) - BRONX","The New American Academy at Roberto Clemente State Park - X274 - X229 - 09X274 - 275 HARLEM RIVER PARK BRIDGE"
"W/""325862056""","Partial Classroom Quarantine",882450001,"b0228684-c41f-ec11-b6e6-001dd8306e46","10/2/2021","2021-10-02T04:00:00Z","053144","9/28/2021","2021-09-28T04:00:00Z","275 HARLEM RIVER PARK BRIDGE","40,852,400.000000",40852400,"c0ab074a-33f4-ea11-b882-24ee9a37d45c","Bronx",882450001,"-73,921,600.000000",-73921600,"9","P.S. 230/I.S. 229 (UDC) - BRONX","The New American Academy at Roberto Clemente State Park - X274 - X229 - 09X274 - 275 HARLEM RIVER PARK BRIDGE"
"W/""326921827""","Non-Classroom Quarantine",882450003,"6c7ca3cd-c81f-ec11-b6e6-001dd8306e46","10/4/2021","2021-10-04T04:00:00Z","053175","9/28/2021","2021-09-28T04:00:00Z","757 CAULDWELL AVENUE","40,819,419.000000",40819419,"8901ce37-33f4-ea11-b882-24ee9a37d45c","Bronx",882450001,"-73,908,965.000000",-73908965,"7","P.S. 157 - BRONX","P.S. 157 Grove Hill - X157 - X157 - 07X157 - 757 CAULDWELL AVENUE"
"W/""327198982""","Classroom Closed",882450000,"cb8914ef-4d20-ec11-b6e6-001dd8306e46","10/7/2021","2021-10-07T04:00:00Z","053199","9/29/2021","2021-09-29T04:00:00Z","1537 WASHINGTON AVENUE","40,838,636.000000",40838636,"1103cefa-32f4-ea11-b882-24ee9a37d45c","Bronx",882450001,"-73,903,243.000000",-73903243,"9","P.S. 42 - BRONX","P.S. 042 Claremont - X042 - X042 - 09X042 - 1537 WASHINGTON AVENUE"
"W/""327198987""","Partial Classroom Quarantine",882450001,"91e5d486-4e20-ec11-b6e6-001dd8306e46","10/4/2021","2021-10-04T04:00:00Z","053200","9/29/2021","2021-09-29T04:00:00Z","109-15 98 STREET","40,678,112.000000",40678112,"22af0313-32f4-ea11-b882-24ee9a37d45c","Queens",882450003,"-73,839,377.000000",-73839377,"27","M.S. 137 - QUEENS","M.S. 137 America's School of Heroes - Q137 - Q137 - 27Q137 - 109-15 98 STREET"
"W/""327198992""","Partial Classroom Quarantine",882450001,"e406b3a4-4e20-ec11-b6e6-001dd8306e46","10/4/2021","2021-10-04T04:00:00Z","053201","9/29/2021","2021-09-29T04:00:00Z","1060 WILLOWBROOK ROAD","40,602,779.000000",40602779,"380410ca-32f4-ea11-b882-24ee9a37d45c","Staten Island",882450004,"-74,137,259.000000",-74137259,"31","P.S. 54 - STATEN ISLAND","P.S. 054 Charles W. Leng - R054 - R054 - 31R054 - 1060 WILLOWBROOK ROAD"
"W/""327198998""","Partial Classroom Quarantine",882450001,"f687acb6-4e20-ec11-b6e6-001dd8306e46","10/4/2021","2021-10-04T04:00:00Z","053202","9/29/2021","2021-09-29T04:00:00Z","1875 EAST  17 STREET","40,604,447.000000",40604447,"56a5db98-30f4-ea11-b882-24ee9a37d45c","Brooklyn",882450002,"-73,955,217.000000",-73955217,"22","I.S. 234 - BROOKLYN","J.H.S. 234 Arthur W. Cunningham - K234 - K234 - 22K234 - 1875 EAST  17 STREET"
"W/""328833367""","No Intervention",882450002,"a99c3e8a-4f20-ec11-b6e6-001dd8306e46","10/1/2021","2021-10-01T04:00:00Z","053205","9/30/2021","2021-09-30T04:00:00Z","51 JEFFERSON STREET","40,590,887.000000",40590887,"4efdc1bd-32f4-ea11-b882-24ee9a37d45c","Staten Island",882450004,"-74,098,252.000000",-74098252,"31","P.S. 11 - STATEN ISLAND","P.S. 11 Thomas Dongan School - R011 - R011 - 31R011 - 51 JEFFERSON STREET"
"W/""327199013""","Partial Classroom Quarantine",882450001,"fb7f83df-4f20-ec11-b6e6-001dd8306e46","10/7/2021","2021-10-07T04:00:00Z","053206","9/29/2021","2021-09-29T04:00:00Z","290 ST MARKS PLACE","40,642,820.000000",40642820,"5ebe7adc-32f4-ea11-b882-24ee9a37d45c","Staten Island",882450004,"-74,079,263.000000",-74079263,"31","RALPH MCKEE VOC HS - S. I.","Ralph R. McKee Career and Technical Education High School - R600 - R600 - 31R600 - 290 ST MARKS PLACE"
"W/""327199018""","Partial Classroom Quarantine",882450001,"ba05f3e5-4f20-ec11-b6e6-001dd8306e46","10/7/2021","2021-10-07T04:00:00Z","053207","9/29/2021","2021-09-29T04:00:00Z","58-01 136 STREET","40,745,215.000000",40745215,"dc2ff20c-32f4-ea11-b882-24ee9a37d45c","Queens",882450003,"-73,828,674.000000",-73828674,"25","P.S. 120 - QUEENS","P.S. 120 Queens - Q120 - Q120 - 25Q120 - 58-01 136 STREET"
"W/""327199043""","Partial Classroom Quarantine",882450001,"6b0317fc-5220-ec11-b6e6-001dd8306e46","10/7/2021","2021-10-07T04:00:00Z","053216","9/29/2021","2021-09-29T04:00:00Z","34-25 82 STREET","40,753,035.000000",40753035,"b969c231-32f4-ea11-b882-24ee9a37d45c","Queens",882450003,"-73,884,458.000000",-73884458,"30","P.S. 212 - QUEENS","P.S. 212 - Q212 - Q212 - 30Q212 - 34-25 82 STREET"
"W/""328230628""","Partial Classroom Quarantine",882450001,"f3dc4abc-5420-ec11-b6e6-001dd8306e46","10/7/2021","2021-10-07T04:00:00Z","053219","9/30/2021","2021-09-30T04:00:00Z","213-10 92 AVENUE","40,720,074.000000",40720074,"bc2ff20c-32f4-ea11-b882-24ee9a37d45c","Queens",882450003,"-73,746,375.000000",-73746375,"29","I.S. 109 - QUEENS","Jean Nuzzi Intermediate School - Q109 - Q109 - 29Q109 - 213-10 92 AVENUE"
"W/""327199068""","Partial Classroom Quarantine",882450001,"e2b0e4b9-5520-ec11-b6e6-001dd8306e46","10/7/2021","2021-10-07T04:00:00Z","053223","9/29/2021","2021-09-29T04:00:00Z","1155 CROMWELL AVENUE","40,834,979.000000",40834979,"5d0d6d19-33f4-ea11-b882-24ee9a37d45c","Bronx",882450001,"-73,923,297.000000",-73923297,"9","P.S. 114 - BRONX","P.S. X114 - Luis Llorens Torres Schools - X114 - X114 - 09X114 - 1155 CROMWELL AVENUE"
"W/""327199073""","Partial Classroom Quarantine",882450001,"8922a7de-5520-ec11-b6e6-001dd8306e46","10/7/2021","2021-10-07T04:00:00Z","053224","9/29/2021","2021-09-29T04:00:00Z","1400 PENNSYLVANIA AVENUE","40,646,640.000000",40646640,"30a198c3-30f4-ea11-b882-24ee9a37d45c","Brooklyn",882450002,"-73,881,997.000000",-73881997,"19","P.S. 346 - BROOKLYN","P.S. 346 Abe Stark - K346 - K346 - 19K346 - 1400 PENNSYLVANIA AVENUE"
"W/""327199078""","Partial Classroom Quarantine",882450001,"d842bdf0-5520-ec11-b6e6-001dd8306e46","10/4/2021","2021-10-04T04:00:00Z","053225","9/29/2021","2021-09-29T04:00:00Z","790 EAST NEW YORK AVENUE","40,662,092.000000",40662092,"2ae2abc9-30f4-ea11-b882-24ee9a37d45c","Brooklyn",882450002,"-73,936,313.000000",-73936313,"17","I.S. 391 - BROOKLYN","New Heights Middle School - K722 - K391 - 17K722 - 790 EAST NEW YORK AVENUE"
"W/""327199088""","Non-Classroom Quarantine",882450003,"59dc5f6a-5720-ec11-b6e6-001dd8306e46","10/7/2021","2021-10-07T04:00:00Z","053228","9/29/2021","2021-09-29T04:00:00Z","143-10 SPRINGFIELD BOULEVARD","40,669,030.000000",40669030,"abb66262-32f4-ea11-b882-24ee9a37d45c","Queens",882450003,"-73,757,744.000000",-73757744,"29","SPRINGFIELD GARDENS HS - Q","Preparatory Academy for Writers: A College Board School - Q283 - Q420 - 29Q283 - 143-10 SPRINGFIELD BOULEVARD"
"W/""327199108""","Partial Classroom Quarantine",882450001,"2723e656-5920-ec11-b6e6-001dd8306e46","10/4/2021","2021-10-04T04:00:00Z","053234","9/29/2021","2021-09-29T04:00:00Z","2750 THROOP AVENUE","40,866,474.000000",40866474,"1c78931f-33f4-ea11-b882-24ee9a37d45c","Bronx",882450001,"-73,850,510.000000",-73850510,"11","P.S. 121 - BRONX","P.S. 121 Throop - X121 - X121 - 11X121 - 2750 THROOP AVENUE"
"W/""327691857""","Partial Classroom Quarantine",882450001,"f08a4943-5c20-ec11-b6e6-001dd8306e46","10/4/2021","2021-10-04T04:00:00Z","053240","9/29/2021","2021-09-29T04:00:00Z","33-55 74TH STREET","40,753,829.000000",40753829,"2ec73b4a-32f4-ea11-b882-24ee9a37d45c","Queens",882450003,"-73,892,623.000000",-73892623,"30","I.S. 230 ANNEX - QUEENS","I.S. 230 - Q230 - Q297 - 30Q230 - 33-55 74TH STREET"
"W/""327199144""","Classroom Closed",882450000,"0e3aae0f-5e20-ec11-b6e6-001dd8306e46","10/1/2021","2021-10-01T04:00:00Z","053250","9/29/2021","2021-09-29T04:00:00Z","33-16 79 STREET","40,754,318.000000",40754318,"38e197cf-49fb-ea11-b883-24ee9a37d459",,,"-73,888,458.000000",-73888458,"30","GARDEN SCHOOL","Garden School - QABL - QABL -  - 33-16 79 STREET"
"W/""327199149""","Partial Classroom Quarantine",882450001,"4f3f607c-5e20-ec11-b6e6-001dd8306e46","10/4/2021","2021-10-04T04:00:00Z","053253","9/29/2021","2021-09-29T04:00:00Z","101 MAUJER STREET","40,710,880.000000",40710880,"d4968d36-30f4-ea11-b882-24ee9a37d45c","Brooklyn",882450002,"-73,946,695.000000",-73946695,"14","P.S. 18 - BROOKLYN","P.S. 018 Edward Bush - K018 - K018 - 14K018 - 101 MAUJER STREET"
"W/""327199224""","Non-Classroom Quarantine",882450003,"2bfde23a-6620-ec11-b6e6-001dd8306e46","10/7/2021","2021-10-07T04:00:00Z","053313","9/29/2021","2021-09-29T04:00:00Z","590 SHEFFIELD AVENUE","40,662,243.000000",40662243,"dbb36d80-30f4-ea11-b882-24ee9a37d45c","Brooklyn",882450002,"-73,894,877.000000",-73894877,"19","P.S. 190 - BROOKLYN","P.S. 190 Sheffield - K190 - K190 - 19K190 - 590 SHEFFIELD AVENUE"
"W/""327199285""","Classroom Closed",882450000,"61cfb271-6c20-ec11-b6e6-001dd8306e46","10/7/2021","2021-10-07T04:00:00Z","053362","9/29/2021","2021-09-29T04:00:00Z","91 HENDERSON AVENUE","40,641,180.000000",40641180,"97a9d9c3-32f4-ea11-b882-24ee9a37d45c","Staten Island",882450004,"-74,095,454.000000",-74095454,"31","P.S. 373 (OLD P40) - STATEN ISLAND","P.S. R373 - R373 - R040 - 75R373 - 91 HENDERSON AVENUE"
"W/""328076448""","Partial Classroom Quarantine",882450001,"4350acce-7120-ec11-b6e6-001dd8306e46","10/4/2021","2021-10-04T04:00:00Z","053402","9/29/2021","2021-09-29T04:00:00Z","800 HOME STREET","40,826,933.000000",40826933,"8601ce37-33f4-ea11-b882-24ee9a37d45c","Bronx",882450001,"-73,900,593.000000",-73900593,"12","I.S. 158 - BRONX","Bronx Latin - X267 - X158 - 12X267 - 800 HOME STREET"
"W/""327693258""","Partial Classroom Quarantine",882450001,"e4f3ab04-7220-ec11-b6e6-001dd8306e46","10/7/2021","2021-10-07T04:00:00Z","053403","9/29/2021","2021-09-29T04:00:00Z","109-10 47 AVENUE","40,747,017.000000",40747017,"be8442ee-31f4-ea11-b882-24ee9a37d45c","Queens",882450003,"-73,854,268.000000",-73854268,"24","P.S. 28 - QUEENS","P.S. 28 - The Thomas Emanuel Early Childhood Center - Q028 - Q028 - 24Q028 - 109-10 47 AVENUE"
"W/""328750401""","Classroom Closed",882450000,"3aada016-7220-ec11-b6e6-001dd8306e46","10/7/2021","2021-10-07T04:00:00Z","053404","9/30/2021","2021-09-30T04:00:00Z","757 CAULDWELL AVENUE","40,819,419.000000",40819419,"8901ce37-33f4-ea11-b882-24ee9a37d45c","Bronx",882450001,"-73,908,965.000000",-73908965,"7","P.S. 157 - BRONX","P.S. 157 Grove Hill - X157 - X157 - 07X157 - 757 CAULDWELL AVENUE"
"W/""328091462""","Partial Classroom Quarantine",882450001,"09a2438e-7420-ec11-b6e6-001dd8306e46","10/7/2021","2021-10-07T04:00:00Z","053417","9/30/2021","2021-09-30T04:00:00Z","74-30 COMMONWEALTH BLVD","40,744,276.000000",40744276,"ab69c231-32f4-ea11-b882-24ee9a37d45c","Queens",882450003,"-73,727,632.000000",-73727632,"26","P.S./I.S. 208 - QUEENS","P.S./I.S. 208 - Q208 - Q208 - 29Q208 - 74-30 COMMONWEALTH BLVD"
"W/""327684167""","Non-Classroom Quarantine",882450003,"1ac95581-7620-ec11-b6e6-001dd8306e46","10/3/2021","2021-10-03T04:00:00Z","053428","9/29/2021","2021-09-29T04:00:00Z","214 STUYVESANT AVENUE","40,687,823.000000",40687823,"7fc4fc0b-4afb-ea11-b883-24ee9a37d459",,,"-73,933,393.000000",-73933393,"16","BEDFORD STUYVESANT EARLY CHILDHOOD DEVELOPMENT CEN","BEDFORD STUYVESANT EARLY CHILDHOOD DEVELOPMENT CENTER SITE 5 - KBNI - KBNI -  - 214 STUYVESANT AVENUE"
"W/""327199381""","Partial Classroom Quarantine",882450001,"532c1f0c-7720-ec11-b6e6-001dd8306e46","10/4/2021","2021-10-04T04:00:00Z","053434","9/29/2021","2021-09-29T04:00:00Z","74-30 COMMONWEALTH BLVD","40,744,276.000000",40744276,"ab69c231-32f4-ea11-b882-24ee9a37d45c","Queens",882450003,"-73,727,632.000000",-73727632,"26","P.S./I.S. 208 - QUEENS","P.S./I.S. 208 - Q208 - Q208 - 29Q208 - 74-30 COMMONWEALTH BLVD"
"W/""327199436""","Partial Classroom Quarantine",882450001,"d52b5fe8-7c20-ec11-b6e6-001dd8306e46","10/3/2021","2021-10-03T04:00:00Z","053468","9/29/2021","2021-09-29T04:00:00Z","154 WEST  93 STREET","40,791,395.000000",40791395,"246e3d68-31f4-ea11-b882-24ee9a37d45c","Manhattan",882450000,"-73,971,011.000000",-73971011,"3","I.S. 118 - MANHATTAN","Lafayette Academy - M256 - M118 - 03M256 - 154 WEST  93 STREET"
"W/""327199451""","Non-Classroom Quarantine",882450003,"1239b598-7f20-ec11-b6e6-001dd8306e46","10/7/2021","2021-10-07T04:00:00Z","053474","9/29/2021","2021-09-29T04:00:00Z","40 IRVING PLACE","40,735,361.000000",40735361,"16a6ba98-31f4-ea11-b882-24ee9a37d45c","Manhattan",882450000,"-73,987,064.000000",-73987064,"2","WASHINGTON IRVING HS - MANHATTAN","International High School at Union Square - M438 - M460 - 02M438 - 40 IRVING PLACE"
"W/""327683206""","Classroom Closed",882450000,"17f68bab-8120-ec11-b6e6-001dd8306e46","10/7/2021","2021-10-07T04:00:00Z","053491","9/29/2021","2021-09-29T04:00:00Z","385 Avenue W","40,592,894.000000",40592894,"3f416e00-31f4-ea11-b882-24ee9a37d45c","Brooklyn",882450002,"-73,968,638.000000",-73968638,"21","PRE-K CENTER @AVENUE W - BROOKLYN","Brooklyn's Daily Discovery Pre-K Center - K840 - K662 - 21K840 - 385 Avenue W"
"W/""327199477""","Partial Classroom Quarantine",882450001,"4191815a-8220-ec11-b6e6-001dd8306e46","10/4/2021","2021-10-04T04:00:00Z","053498","9/29/2021","2021-09-29T04:00:00Z","147-36 26 AVENUE","40,774,134.000000",40774134,"adfc24e8-31f4-ea11-b882-24ee9a37d45c","Queens",882450003,"-73,818,581.000000",-73818581,"25","P.S. 21 - QUEENS","DYCD - P.S. 021 Edward Hart - 124412 - 147-36 26 AVENUE"
"W/""327680822""","Classroom Closed",882450000,"6e6e26bb-8220-ec11-b6e6-001dd8306e46","10/8/2021","2021-10-08T04:00:00Z","053500","9/29/2021","2021-09-29T04:00:00Z","900 ST MARKS AVENUE","40,674,244.000000",40674244,"77283fb1-30f4-ea11-b882-24ee9a37d45c","Brooklyn",882450002,"-73,942,401.000000",-73942401,"17","P.S. 289 - BROOKLYN","Sid Miller Academy - K396 - K289 - 75K396 - 900 ST MARKS AVENUE"
"W/""328647483""","Partial Classroom Quarantine",882450001,"dcecee64-8620-ec11-b6e6-001dd8306e46","10/8/2021","2021-10-08T04:00:00Z","053526","9/30/2021","2021-09-30T04:00:00Z","171-11 35 AVENUE","40,765,459.000000",40765459,"ca8442ee-31f4-ea11-b882-24ee9a37d45c","Queens",882450003,"-73,794,323.000000",-73794323,"25","P.S. 32 - QUEENS","P.S. 032 State Street - Q032 - Q032 - 25Q032 - 171-11 35 AVENUE"
"W/""327199537""","Non-Classroom Quarantine",882450003,"013f9af7-8720-ec11-b6e6-001dd8306e46","10/4/2021","2021-10-04T04:00:00Z","053537","9/29/2021","2021-09-29T04:00:00Z","465 NEW DORP LANE","40,570,909.000000",40570909,"fb8521d0-32f4-ea11-b882-24ee9a37d45c","Staten Island",882450004,"-74,105,878.000000",-74105878,"31","NEW DORP HS (NEW) - S. I.","New Dorp High School - R440 - R435 - 31R440 - 465 NEW DORP LANE"
"W/""327685467""","Partial Classroom Quarantine",882450001,"c2c82cd5-8820-ec11-b6e6-001dd8306e46","10/7/2021","2021-10-07T04:00:00Z","053545","9/29/2021","2021-09-29T04:00:00Z","2111 CROTONA AVENUE","40,848,748.000000",40848748,"6c36d900-33f4-ea11-b882-24ee9a37d45c","Bronx",882450001,"-73,888,987.000000",-73888987,"12","P.S. 57 - BRONX","Frederick Douglass Academy V. Middle School - X273 - X057 - 12X273 - 2111 CROTONA AVENUE"
"W/""327199562""","Partial Classroom Quarantine",882450001,"35f7466b-8920-ec11-b6e6-001dd8306e46","10/4/2021","2021-10-04T04:00:00Z","053548","9/29/2021","2021-09-29T04:00:00Z","29 FT GREENE PLACE","40,688,896.000000",40688896,"3188e6db-30f4-ea11-b882-24ee9a37d45c","Brooklyn",882450002,"-73,976,435.000000",-73976435,"13","BROOKLYN TECH HS - K","Brooklyn Technical High School - K430 - K430 - 13K430 - 29 FT GREENE PLACE"
"W/""328235895""","Partial Classroom Quarantine",882450001,"8f03c7ef-8920-ec11-b6e6-001dd8306e46","10/7/2021","2021-10-07T04:00:00Z","053555","9/30/2021","2021-09-30T04:00:00Z","500 WEST 138 STREET","40,820,510.000000",40820510,"64507380-31f4-ea11-b882-24ee9a37d45c","Manhattan",882450000,"-73,952,023.000000",-73952023,"6","P.S. 192 - MANHATTAN","Hamilton Grange Middle School - M209 - M192 - 06M209 - 500 WEST 138 STREET"
"W/""327746028""","Partial Classroom Quarantine",882450001,"508f6f04-9220-ec11-b6e6-001dd8306e46","10/4/2021","2021-10-04T04:00:00Z","053592","9/29/2021","2021-09-29T04:00:00Z","4140 HUTCHINSON RIVER PKWAY EA","40,864,073.000000",40864073,"9501ce37-33f4-ea11-b882-24ee9a37d45c","Bronx",882450001,"-73,823,816.000000",-73823816,"11","P.S. 160 - BRONX","P.S. 160 Walt Disney - X160 - X160 - 11X160 - 4140 HUTCHINSON RIVER PKWAY EA"
"W/""328091508""","Partial Classroom Quarantine",882450001,"7497b3be-9220-ec11-b6e6-001dd8306e46","10/4/2021","2021-10-04T04:00:00Z","053597","9/30/2021","2021-09-30T04:00:00Z","121-15 LUCAS STREET","40,686,050.000000",40686050,"0df32ce2-31f4-ea11-b882-24ee9a37d45c","Queens",882450003,"-73,756,546.000000",-73756546,"29","P.S. 15 - QUEENS","P.S. 015 Jackie Robinson - Q015 - Q015 - 29Q015 - 121-15 LUCAS STREET"
"W/""327683417""","Classroom Closed",882450000,"d73afbde-9720-ec11-b6e6-001dd8306e46","10/7/2021","2021-10-07T04:00:00Z","053606","9/29/2021","2021-09-29T04:00:00Z","241 EMERSON PLACE","40,691,275.000000",40691275,"87b50aa5-30f4-ea11-b882-24ee9a37d45c","Brooklyn",882450002,"-73,961,134.000000",-73961134,"13","P.S. 270 - BROOKLYN","P.S. 270 Johann DeKalb - K270 - K270 - 13K270 - 241 EMERSON PLACE"
"W/""327688478""","Partial Classroom Quarantine",882450001,"132ceeea-9720-ec11-b6e6-001dd8306e46","10/7/2021","2021-10-07T04:00:00Z","053607","9/29/2021","2021-09-29T04:00:00Z","241 EMERSON PLACE","40,691,275.000000",40691275,"87b50aa5-30f4-ea11-b882-24ee9a37d45c","Brooklyn",882450002,"-73,961,134.000000",-73961134,"13","P.S. 270 - BROOKLYN","P.S. 270 Johann DeKalb - K270 - K270 - 13K270 - 241 EMERSON PLACE"
"W/""328565232""","Partial Classroom Quarantine",882450001,"f0f9efd1-1621-ec11-b6e6-001dd8306e46","10/8/2021","2021-10-08T04:00:00Z","053615","9/30/2021","2021-09-30T04:00:00Z","54-25 SKILLMAN AVENUE","40,746,127.000000",40746127,"fff22ce2-31f4-ea11-b882-24ee9a37d45c","Queens",882450003,"-73,909,032.000000",-73909032,"30","P.S. 11 - QUEENS","P.S. 011 Kathryn Phelan - Q011 - Q011 - 30Q011 - 54-25 SKILLMAN AVENUE"
"W/""328091558""","Classroom Closed",882450000,"7e863701-1821-ec11-b6e6-001dd8306e46","10/4/2021","2021-10-04T04:00:00Z","053620","9/30/2021","2021-09-30T04:00:00Z","144-176 EAST 128 STREET","40,805,653.000000",40805653,"38767649-31f4-ea11-b882-24ee9a37d45c","Manhattan",882450000,"-73,935,461.000000",-73935461,"5","P.S. 30 - MANHATTAN","P.S. 030 Hernandez/Hughes - M030 - M030 - 05M030 - 144-176 EAST 128 STREET"
"W/""328091594""","Partial Classroom Quarantine",882450001,"b7ff772a-1a21-ec11-b6e6-001dd8306e46","10/8/2021","2021-10-08T04:00:00Z","053631","9/30/2021","2021-09-30T04:00:00Z","142-30 BARCLAY AVENUE","40,758,347.000000",40758347,"14f32ce2-31f4-ea11-b882-24ee9a37d45c","Queens",882450003,"-73,824,388.000000",-73824388,"25","P.S. 20 - QUEENS","P.S. 020 John Bowne - Q020 - Q020 - 25Q020 - 142-30 BARCLAY AVENUE"
"W/""328091619""","Partial Classroom Quarantine",882450001,"b395c281-1b21-ec11-b6e6-001dd8306e46","10/8/2021","2021-10-08T04:00:00Z","053637","9/30/2021","2021-09-30T04:00:00Z","153-23 83 STREET","40,665,408.000000",40665408,"1106003e-32f4-ea11-b882-24ee9a37d45c","Queens",882450003,"-73,850,622.000000",-73850622,"27","P.S. 232 - QUEENS","P.S. 232 Lindenwood - Q232 - Q232 - 27Q232 - 153-23 83 STREET"
"W/""328091674""","Partial Classroom Quarantine",882450001,"580833fe-1e21-ec11-b6e6-001dd8306e46","10/8/2021","2021-10-08T04:00:00Z","053652","9/30/2021","2021-09-30T04:00:00Z","1601 80 STREET","40,613,041.000000",40613041,"5488e6db-30f4-ea11-b882-24ee9a37d45c","Brooklyn",882450002,"-74,002,308.000000",-74002308,"20","NEW UTRECHT HS - K","New Utrecht High School - K445 - K445 - 20K445 - 1601 80 STREET"
"W/""328749966""","Partial Classroom Quarantine",882450001,"5529c6dd-1f21-ec11-b6e6-001dd8306e46","10/9/2021","2021-10-09T04:00:00Z","053655","9/30/2021","2021-09-30T04:00:00Z","2021 BERGEN STREET","40,674,456.000000",40674456,"32eabc42-30f4-ea11-b882-24ee9a37d45c","Brooklyn",882450002,"-73,912,685.000000",-73912685,"23","I.S. 55 - BROOKLYN","Brooklyn Collegiate: A College Board School - K493 - K055 - 23K493 - 2021 BERGEN STREET"
"W/""328091760""","Classroom Closed",882450000,"3de84766-2521-ec11-b6e6-001dd8306e46","10/8/2021","2021-10-08T04:00:00Z","053684","9/30/2021","2021-09-30T04:00:00Z","425 EAST 35TH STREET","40,744,288.000000",40744288,"cde0838c-31f4-ea11-b882-24ee9a37d45c","Manhattan",882450000,"-73,972,592.000000",-73972592,"2","P.S. 281 - MANHATTAN","P.S. M094 - M094 - M281 - 75M094 - 425 EAST 35TH STREET"
"W/""328830395""","Partial Classroom Quarantine",882450001,"b944633c-2721-ec11-b6e6-001dd8306e46","9/30/2021","2021-09-30T04:00:00Z","053700","9/30/2021","2021-09-30T04:00:00Z","559 CYPRESS AVENUE","40,703,942.000000",40703942,"dbe8ce00-32f4-ea11-b882-24ee9a37d45c","Queens",882450003,"-73,911,885.000000",-73911885,"24","P.S. 81 - QUEENS","P.S. 81Q Jean Paul Richter - Q081 - Q081 - 24Q081 - 559 CYPRESS AVENUE"
"W/""328091790""","Partial Classroom Quarantine",882450001,"ef216248-2721-ec11-b6e6-001dd8306e46","10/4/2021","2021-10-04T04:00:00Z","053701","9/30/2021","2021-09-30T04:00:00Z","34-12 36 AVENUE","40,754,975.000000",40754975,"00bef08c-32f4-ea11-b882-24ee9a37d45c","Queens",882450003,"-73,926,977.000000",-73926977,"30","BACCALAUREATE SCL FOR GLOBAL ED-Q","Baccalaureate School for Global Education - Q580 - Q798 - 30Q580 - 34-12 36 AVENUE"
"W/""328091851""","Partial Classroom Quarantine",882450001,"b6fa3a57-2a21-ec11-b6e6-001dd8306e46","10/7/2021","2021-10-07T04:00:00Z","053725","9/30/2021","2021-09-30T04:00:00Z","160 BEACH  29 STREET","40,593,480.000000",40593480,"ee8442ee-31f4-ea11-b882-24ee9a37d45c","Queens",882450003,"-73,761,086.000000",-73761086,"27","P.S. 43 - QUEENS","P.S. Q256 - Q256 - Q043 - 75Q256 - 160 BEACH  29 STREET"
"W/""328091861""","Partial Classroom Quarantine",882450001,"0cebb1a5-2a21-ec11-b6e6-001dd8306e46","10/8/2021","2021-10-08T04:00:00Z","053729","9/30/2021","2021-09-30T04:00:00Z","6500 16 AVENUE","40,622,102.000000",40622102,"ee21d292-30f4-ea11-b882-24ee9a37d45c","Brooklyn",882450002,"-73,995,961.000000",-73995961,"20","I.S. 227 - BROOKLYN","J.H.S. 227 Edward B. Shallow - K227 - K227 - 20K227 - 6500 16 AVENUE"
"W/""328091871""","Classroom Closed",882450000,"52f467e8-2a21-ec11-b6e6-001dd8306e46","10/4/2021","2021-10-04T04:00:00Z","053731","9/30/2021","2021-09-30T04:00:00Z","43-12 46th Street","40,744,542.000000",40744542,"4dc0eb6c-4afb-ea11-b883-24ee9a37d459",,,"-73,918,434.000000",-73918434,"30","Magic Beans","The Q StudioLab 46th Street - QBFT - QBJP -  - 43-12 46th Street"
"W/""328091886""","Classroom Closed",882450000,"43546850-2b21-ec11-b6e6-001dd8306e46","10/7/2021","2021-10-07T04:00:00Z","053734","9/30/2021","2021-09-30T04:00:00Z","157 WILSON STREET","40,706,069.000000",40706069,"f9f57030-30f4-ea11-b882-24ee9a37d45c","Brooklyn",882450002,"-73,962,049.000000",-73962049,"14","P.S. 16 - BROOKLYN","Williamsburg Collegiate Charter School - K355 - K016 - 84K355 - 157 WILSON STREET"
"W/""328484348""","Partial Classroom Quarantine",882450001,"80acf31d-2c21-ec11-b6e6-001dd8306e46","10/4/2021","2021-10-04T04:00:00Z","053739","10/1/2021","2021-10-01T04:00:00Z","999 JAMAICA AVENUE","40,693,002.000000",40693002,"c692e6d5-30f4-ea11-b882-24ee9a37d45c","Brooklyn",882450002,"-73,869,305.000000",-73869305,"19","FRANKLIN K. LANE HS - K","Kings Collegiate Charter School - K608 - K420 - 84K608 - 999 JAMAICA AVENUE"
"W/""328091891""","Partial Classroom Quarantine",882450001,"d398fd5f-2e21-ec11-b6e6-001dd8306e46","10/8/2021","2021-10-08T04:00:00Z","053745","9/30/2021","2021-09-30T04:00:00Z","790 EAST NEW YORK AVENUE","40,662,092.000000",40662092,"2ae2abc9-30f4-ea11-b882-24ee9a37d45c","Brooklyn",882450002,"-73,936,313.000000",-73936313,"17","I.S. 391 - BROOKLYN","New Heights Middle School - K722 - K391 - 17K722 - 790 EAST NEW YORK AVENUE"
"W/""328234309""","Classroom Closed",882450000,"c4cef8f5-2e21-ec11-b6e6-001dd8306e46","10/4/2021","2021-10-04T04:00:00Z","053748","9/30/2021","2021-09-30T04:00:00Z","1997 BATHGATE AVENUE","40,848,824.000000",40848824,"3345378b-4afb-ea11-b883-24ee9a37d459",,,"-73,896,075.000000",-73896075,"10","BATHGATE LEARNING CENTER","Trabajamos Community Head Start, Inc. Center # 6 - XAHH - XAKP -  - 1997 BATHGATE AVENUE"
"W/""328237177""","Classroom Closed",882450000,"03ca1eaf-2f21-ec11-b6e6-001dd8306e46","10/8/2021","2021-10-08T04:00:00Z","053750","9/30/2021","2021-09-30T04:00:00Z","2121 5 AVENUE","40,809,665.000000",40809665,"18cf496e-31f4-ea11-b882-24ee9a37d45c","Manhattan",882450000,"-73,939,178.000000",-73939178,"5","P.S. 133 - MANHATTAN","P.S. 133 Fred R Moore - M133 - M133 - 05M133 - 2121 5 AVENUE"
"W/""328091927""","Partial Classroom Quarantine",882450001,"ba86105d-3021-ec11-b6e6-001dd8306e46","10/7/2021","2021-10-07T04:00:00Z","053755","9/30/2021","2021-09-30T04:00:00Z","557 PENNSYLVANIA AVENUE","40,664,067.000000",40664067,"e7f57030-30f4-ea11-b882-24ee9a37d45c","Brooklyn",882450002,"-73,893,328.000000",-73893328,"19","P.S. 13 - BROOKLYN","P.S. 013 Roberto Clemente - K013 - K013 - 19K013 - 557 PENNSYLVANIA AVENUE"
"W/""328091932""","Partial Classroom Quarantine",882450001,"f3fddcb6-3021-ec11-b6e6-001dd8306e46","10/9/2021","2021-10-09T04:00:00Z","053756","9/30/2021","2021-09-30T04:00:00Z","1700 MACOMBS ROAD","40,849,416.000000",40849416,"3f0b210d-33f4-ea11-b882-24ee9a37d45c","Bronx",882450001,"-73,915,217.000000",-73915217,"9","I.S. 232 - BRONX","Academy for Language and Technology - X365 - X082 - 09X365 - 1700 MACOMBS ROAD"
"W/""328091952""","Classroom Closed",882450000,"c5d10c7d-3121-ec11-b6e6-001dd8306e46","10/9/2021","2021-10-09T04:00:00Z","053763","9/30/2021","2021-09-30T04:00:00Z","111 BERRIMAN STREET","40,676,207.000000",40676207,"2ca198c3-30f4-ea11-b882-24ee9a37d45c","Brooklyn",882450002,"-73,879,886.000000",-73879886,"19","P.S. 345 - BROOKLYN","P.S. 345 Patrolman Robert Bolden - K345 - K345 - 19K345 - 111 BERRIMAN STREET"
"W/""328091992""","Classroom Closed",882450000,"d4b02f6c-3421-ec11-b6e6-001dd8306e46","10/9/2021","2021-10-09T04:00:00Z","053782","9/30/2021","2021-09-30T04:00:00Z","104 SUTTER AVENUE","40,665,553.000000",40665553,"35a198c3-30f4-ea11-b882-24ee9a37d45c","Brooklyn",882450002,"-73,917,880.000000",-73917880,"23","P.S. 156 - BROOKLYN","P.S. 156 Waverly - K156 - K356 - 23K156 - 104 SUTTER AVENUE"
"W/""328092002""","Classroom Closed",882450000,"feca7fa8-3421-ec11-b6e6-001dd8306e46","10/9/2021","2021-10-09T04:00:00Z","053785","9/30/2021","2021-09-30T04:00:00Z","696 JAMAICA AVENUE","40,686,534.000000",40686534,"8528a20c-31f4-ea11-b882-24ee9a37d45c","Brooklyn",882450002,"-73,878,353.000000",-73878353,"19","Cesiah Toro Mullane School","P.S. 065 - K065 - K798 - 19K065 - 696 JAMAICA AVENUE"
"W/""328092007""","Partial Classroom Quarantine",882450001,"388e8ab4-3421-ec11-b6e6-001dd8306e46","10/4/2021","2021-10-04T04:00:00Z","053786","9/30/2021","2021-09-30T04:00:00Z","2185 BATHGATE AVENUE","40,853,141.000000",40853141,"7936d900-33f4-ea11-b882-24ee9a37d45c","Bronx",882450001,"-73,893,639.000000",-73893639,"10","P.S. 59 - BRONX","P.S. 059 The Community School of Technology - X059 - X059 - 10X059 - 2185 BATHGATE AVENUE"
"W/""328092012""","Partial Classroom Quarantine",882450001,"5fbff1c6-3421-ec11-b6e6-001dd8306e46","10/7/2021","2021-10-07T04:00:00Z","053787","9/30/2021","2021-09-30T04:00:00Z","750 DURANT AVENUE","40,545,490.000000",40545490,"5bfdc1bd-32f4-ea11-b882-24ee9a37d45c","Staten Island",882450004,"-74,145,558.000000",-74145558,"31","I.S. 24 - STATEN ISLAND","I.S. 024 Myra S. Barnes - R024 - R024 - 31R024 - 750 DURANT AVENUE"
"W/""328092022""","Partial Classroom Quarantine",882450001,"dc52395d-3521-ec11-b6e6-001dd8306e46","10/4/2021","2021-10-04T04:00:00Z","053792","9/30/2021","2021-09-30T04:00:00Z","2185 BATHGATE AVENUE","40,853,141.000000",40853141,"7936d900-33f4-ea11-b882-24ee9a37d45c","Bronx",882450001,"-73,893,639.000000",-73893639,"10","P.S. 59 - BRONX","P.S. 059 The Community School of Technology - X059 - X059 - 10X059 - 2185 BATHGATE AVENUE"
"W/""328436153""","Classroom Closed",882450000,"56120b99-3521-ec11-b6e6-001dd8306e46","10/8/2021","2021-10-08T04:00:00Z","053793","9/30/2021","2021-09-30T04:00:00Z","58-01 136 STREET","40,745,215.000000",40745215,"dc2ff20c-32f4-ea11-b882-24ee9a37d45c","Queens",882450003,"-73,828,674.000000",-73828674,"25","P.S. 120 - QUEENS","P.S. 120 Queens - Q120 - Q120 - 25Q120 - 58-01 136 STREET"
"W/""328092037""","Partial Classroom Quarantine",882450001,"82789f41-3621-ec11-b6e6-001dd8306e46","10/8/2021","2021-10-08T04:00:00Z","053802","9/30/2021","2021-09-30T04:00:00Z","227 STERLING PLACE","40,676,357.000000",40676357,"0904d718-31f4-ea11-b882-24ee9a37d45c","Brooklyn",882450002,"-73,970,315.000000",-73970315,"13","I.S. 340 (OLD 249 AX) - BROOKLYN","I.S. 340 - K340 - K874 - 17K340 - 227 STERLING PLACE"
"W/""328594642""","Classroom Closed",882450000,"8f1bd270-3821-ec11-b6e6-001dd8306e46","10/7/2021","2021-10-07T04:00:00Z","053814","9/30/2021","2021-09-30T04:00:00Z","183 SOUTH  3 STREET","40,711,915.000000",40711915,"1feabc42-30f4-ea11-b882-24ee9a37d45c","Brooklyn",882450002,"-73,960,137.000000",-73960137,"14","J.H.S. 50 - BROOKLYN","Success Academy Charter School - Williamsburg - K182 - K050 - 84K182 - 183 SOUTH  3 STREET"
"W/""328325393""","Classroom Closed",882450000,"7270f600-3921-ec11-b6e6-001dd8306e46","10/8/2021","2021-10-08T04:00:00Z","053817","9/30/2021","2021-09-30T04:00:00Z","439 WEST 49TH STREET","40,763,655.000000",40763655,"a9d810ab-31f4-ea11-b882-24ee9a37d45c","Manhattan",882450000,"-73,990,318.000000",-73990318,"2","HS OF GRAPHIC COMMUNICATION ARTS-M","Success Academy Charter School - Hell's Kitchen - M170 - M625 - 84M170 - 439 WEST 49TH STREET"
"W/""328092078""","Classroom Closed",882450000,"00f0579b-3a21-ec11-b6e6-001dd8306e46","10/7/2021","2021-10-07T04:00:00Z","053824","9/30/2021","2021-09-30T04:00:00Z","145-01 119 AVENUE","40,678,913.000000",40678913,"f7ae0313-32f4-ea11-b882-24ee9a37d45c","Queens",882450003,"-73,795,571.000000",-73795571,"27","P.S. 123 - QUEENS","P.S. 123 - Q123 - Q123 - 27Q123 - 145-01 119 AVENUE"
"W/""328092098""","Classroom Closed",882450000,"ebc23d49-3b21-ec11-b6e6-001dd8306e46","10/7/2021","2021-10-07T04:00:00Z","053831","9/30/2021","2021-09-30T04:00:00Z","519 ST ANNS AVENUE","40,813,385.000000",40813385,"fc17b7f4-32f4-ea11-b882-24ee9a37d45c","Bronx",882450001,"-73,913,872.000000",-73913872,"7","P.S. 277 - BRONX","P.S. 277 - X277 - X027 - 07X277 - 519 ST ANNS AVENUE"
"W/""328261633""","Partial Classroom Quarantine",882450001,"bafc9963-3c21-ec11-b6e6-001dd8306e46","10/8/2021","2021-10-08T04:00:00Z","053841","10/1/2021","2021-10-01T04:00:00Z","925 ASTOR AVENUE","40,860,443.000000",40860443,"439d7c62-33f4-ea11-b882-24ee9a37d45c","Bronx",882450001,"-73,860,729.000000",-73860729,"11","CHRISTOPHER COLUMBUS HS - X","Pelham Preparatory Academy - X542 - X415 - 11X542 - 925 ASTOR AVENUE"
"W/""328595913""","Classroom Closed",882450000,"84e694a2-3d21-ec11-b6e6-001dd8306e46","10/9/2021","2021-10-09T04:00:00Z","053847","9/30/2021","2021-09-30T04:00:00Z","211 THROOP AVENUE","40,697,619.000000",40697619,"b579df48-30f4-ea11-b882-24ee9a37d45c","Brooklyn",882450002,"-73,943,279.000000",-73943279,"14","P.S. 59 - BROOKLYN","P.S. 059 William Floyd - K059 - K059 - 14K059 - 211 THROOP AVENUE"
"W/""328092148""","Classroom Closed",882450000,"11362e54-3f21-ec11-b6e6-001dd8306e46","10/8/2021","2021-10-08T04:00:00Z","053858","9/30/2021","2021-09-30T04:00:00Z","1860 FOREST AVENUE","40,624,847.000000",40624847,"6afdc1bd-32f4-ea11-b882-24ee9a37d45c","Staten Island",882450004,"-74,150,544.000000",-74150544,"31","P.S. 22 - STATEN ISLAND","P.S. 022 Graniteville - R022 - R022 - 31R022 - 1860 FOREST AVENUE"
"W/""328092153""","Partial Classroom Quarantine",882450001,"8bd1ecd2-3f21-ec11-b6e6-001dd8306e46","10/7/2021","2021-10-07T04:00:00Z","053862","9/30/2021","2021-09-30T04:00:00Z","2987 FREDERICK DOUGLASS BOULEVARD","40,830,400.000000",40830400,"ccc88e4f-31f4-ea11-b882-24ee9a37d45c","Manhattan",882450000,"-73,936,300.000000",-73936300,"5","P.S. 46 - MANHATTAN","P.S. 046 Arthur Tappan - M046 - M046 - 05M046 - 2987 FREDERICK DOUGLASS BOULEVARD"
"W/""328092175""","Classroom Closed",882450000,"9381282f-4121-ec11-b6e6-001dd8306e46","10/8/2021","2021-10-08T04:00:00Z","053871","9/30/2021","2021-09-30T04:00:00Z","1615 MADISON AVENUE","40,795,032.000000",40795032,"5be61462-31f4-ea11-b882-24ee9a37d45c","Manhattan",882450000,"-73,947,855.000000",-73947855,"4","P.S. 108 - MANHATTAN","P.S. 138 - M138 - M108 - 75M138 - 1615 MADISON AVENUE"
"W/""328651747""","Partial Classroom Quarantine",882450001,"e22b53d8-4121-ec11-b6e6-001dd8306e46","10/8/2021","2021-10-08T04:00:00Z","053876","9/30/2021","2021-09-30T04:00:00Z","56-37 188 STREET","40,743,400.000000",40743400,"8b0e6e25-32f4-ea11-b882-24ee9a37d45c","Queens",882450003,"-73,787,419.000000",-73787419,"26","P.S. 177 - QUEENS","P.S. Q177 - Q177 - Q177 - 75Q177 - 56-37 188 STREET"
"W/""328092190""","Partial Classroom Quarantine",882450001,"b56fba02-4221-ec11-b6e6-001dd8306e46","10/8/2021","2021-10-08T04:00:00Z","053877","9/30/2021","2021-09-30T04:00:00Z","116 WEST  11 STREET","40,735,450.000000",40735450,"53767649-31f4-ea11-b882-24ee9a37d45c","Manhattan",882450000,"-73,999,094.000000",-73999094,"2","P.S. 41 - MANHATTAN","P.S. 041 Greenwich Village - M041 - M041 - 02M041 - 116 WEST  11 STREET"
"W/""328651234""","Classroom Closed",882450000,"e7c95f45-4221-ec11-b6e6-001dd8306e46","10/4/2021","2021-10-04T04:00:00Z","053878","9/30/2021","2021-09-30T04:00:00Z","191-02 90 Avenue","40,713,438.000000",40713438,"bb8442ee-31f4-ea11-b882-24ee9a37d45c","Queens",882450003,"-73,768,894.000000",-73768894,"29","P.S. 35 - QUEENS","P.S. 131 Abigail Adams - Q131 - Q035 - 29Q131 - 191-02 90 Avenue"
"W/""328651253""","Partial Classroom Quarantine",882450001,"6f14326c-4321-ec11-b6e6-001dd8306e46","10/8/2021","2021-10-08T04:00:00Z","053886","9/30/2021","2021-09-30T04:00:00Z","3202 STEUBEN AVENUE","40,876,819.000000",40876819,"370b210d-33f4-ea11-b882-24ee9a37d45c","Bronx",882450001,"-73,881,245.000000",-73881245,"10","I.S. 80/P.S. 280 - BRONX","J.H.S. 080 The Mosholu Parkway - X080 - X080 - 10X080 - 149 EAST MOSHOLU PKWY N"
"W/""328754721""","No Intervention",882450002,"b54a804e-4721-ec11-b6e6-001dd8306e46","10/1/2021","2021-10-01T04:00:00Z","053906","9/30/2021","2021-09-30T04:00:00Z","1625 11 AVENUE","40,657,002.000000",40657002,"fbd27c6d-30f4-ea11-b882-24ee9a37d45c","Brooklyn",882450002,"-73,975,967.000000",-73975967,"15","P.S. 154 - BROOKLYN","The Windsor Terrace School - K154 - K154 - 15K154 - 1625 11 AVENUE"
"W/""328652923""","Partial Classroom Quarantine",882450001,"e080c049-5121-ec11-b6e6-001dd8306e46","10/1/2021","2021-10-01T04:00:00Z","053943","10/1/2021","2021-10-01T04:00:00Z","1866 EAST  17 STREET","40,604,461.000000",40604461,"a883ff9e-30f4-ea11-b882-24ee9a37d45c","Brooklyn",882450002,"-73,955,891.000000",-73955891,"22","P.S. 255 - BROOKLYN","P.S. 255 Barbara Reing School - K255 - K255 - 22K255 - 1866 EAST  17 STREET"
"W/""328657055""","Partial Classroom Quarantine",882450001,"833f5859-5421-ec11-b6e6-001dd8306e46","10/8/2021","2021-10-08T04:00:00Z","053967","9/30/2021","2021-09-30T04:00:00Z","1970 WEST FARMS ROAD","40,839,297.000000",40839297,"152ed53d-33f4-ea11-b882-24ee9a37d45c","Bronx",882450001,"-73,879,931.000000",-73879931,"12","P.S. 214 - BRONX","Emolior Academy - X383 - X167 - 12X383 - 1970 WEST FARMS ROAD"
"W/""328830403""","Partial Classroom Quarantine",882450001,"e12bb6b3-5421-ec11-b6e6-001dd8306e46","9/30/2021","2021-09-30T04:00:00Z","053969","9/30/2021","2021-09-30T04:00:00Z","165-65 84 AVENUE","40,716,071.000000",40716071,"49b4977a-32f4-ea11-b882-24ee9a37d45c","Queens",882450003,"-73,799,692.000000",-73799692,"28","THOMAS A. EDISON VOC HS - Q","Thomas A. Edison Career and Technical Education High School - Q620 - Q620 - 28Q620 - 165-65 84 AVENUE"
"W/""328749999""","Partial Classroom Quarantine",882450001,"5ba07705-5621-ec11-b6e6-001dd8306e46","10/7/2021","2021-10-07T04:00:00Z","053977","10/1/2021","2021-10-01T04:00:00Z","755 EAST  100 STREET","40,645,965.000000",40645965,"71a5db98-30f4-ea11-b882-24ee9a37d45c","Brooklyn",882450002,"-73,898,607.000000",-73898607,"19","P.S. 235 ANNEX - BROOKLYN","Olympus Academy - K635 - K242 - 18K635 - 755 EAST  100 STREET"
"W/""328235249""","No Intervention",882450002,"bbc7c3b2-5a21-ec11-b6e6-001dd8306e46","10/1/2021","2021-10-01T04:00:00Z","054002","9/30/2021","2021-09-30T04:00:00Z","64-35 102 STREET","40,731,016.000000",40731016,"960e6e25-32f4-ea11-b882-24ee9a37d45c","Queens",882450003,"-73,852,210.000000",-73852210,"28","P.S. 175 - QUEENS","P.S. 175 The Lynn Gross Discovery School - Q175 - Q175 - 28Q175 - 64-35 102 STREET"
"W/""328199340""","Partial Classroom Quarantine",882450001,"290a0972-e021-ec11-b6e6-001dd8306e46","10/7/2021","2021-10-07T04:00:00Z","054029","10/1/2021","2021-10-01T04:00:00Z","100 AMSTERDAM AVENUE","40,774,202.000000",40774202,"7207e99e-31f4-ea11-b882-24ee9a37d45c","Manhattan",882450000,"-73,985,976.000000",-73985976,"3","FIORELLO LAGUARDIA HS - MANHATTAN","Fiorello H. LaGuardia High School of Music & Art and Performing Arts - M485 - M485 - 03M485 - 100 AMSTERDAM AVENUE"
"W/""328234186""","Classroom Closed",882450000,"15cc486c-e321-ec11-b6e6-001dd8306e46","10/9/2021","2021-10-09T04:00:00Z","054041","10/1/2021","2021-10-01T04:00:00Z","91 HENDERSON AVENUE","40,641,180.000000",40641180,"97a9d9c3-32f4-ea11-b882-24ee9a37d45c","Staten Island",882450004,"-74,095,454.000000",-74095454,"31","P.S. 373 (OLD P40) - STATEN ISLAND","P.S. R373 - R373 - R040 - 75R373 - 91 HENDERSON AVENUE"
"W/""328743158""","Classroom Closed",882450000,"ca9dbcc1-e521-ec11-b6e6-001dd8306e46","10/7/2021","2021-10-07T04:00:00Z","054052","10/1/2021","2021-10-01T04:00:00Z","4108 VICTORY BOULEVARD","40,591,546.000000",40591546,"75a9d9c3-32f4-ea11-b882-24ee9a37d45c","Staten Island",882450004,"-74,190,093.000000",-74190093,"31","P.S. 26 - STATEN ISLAND","P.S. 026 The Carteret School - R026 - R026 - 31R026 - 4108 VICTORY BOULEVARD"
"W/""328833371""","Classroom Closed",882450000,"bae689f2-e521-ec11-b6e6-001dd8306e46","10/9/2021","2021-10-09T04:00:00Z","054054","10/1/2021","2021-10-01T04:00:00Z","51 JEFFERSON STREET","40,590,887.000000",40590887,"4efdc1bd-32f4-ea11-b882-24ee9a37d45c","Staten Island",882450004,"-74,098,252.000000",-74098252,"31","P.S. 11 - STATEN ISLAND","P.S. 11 Thomas Dongan School - R011 - R011 - 31R011 - 51 JEFFERSON STREET"
"W/""328617609""","Classroom Closed",882450000,"49c228b7-e821-ec11-b6e6-001dd8306e46","10/10/2021","2021-10-10T04:00:00Z","054064","10/1/2021","2021-10-01T04:00:00Z","98-01 25 AVENUE","40,765,507.000000",40765507,"06af0313-32f4-ea11-b882-24ee9a37d45c","Queens",882450003,"-73,870,931.000000",-73870931,"30","P.S. 127 - QUEENS","P.S. 127 Aerospace Science Magnet School - Q127 - Q127 - 30Q127 - 98-01 25 AVENUE"
"W/""328395540""","Partial Classroom Quarantine",882450001,"2defd82f-ef21-ec11-b6e6-001dd8306e46","10/8/2021","2021-10-08T04:00:00Z","054080","10/1/2021","2021-10-01T04:00:00Z","105 HAMILTON AVENUE","40,645,436.000000",40645436,"5a5b4cd6-32f4-ea11-b882-24ee9a37d45c","Staten Island",882450004,"-74,082,149.000000",-74082149,"31","CURTIS HS - S. I.","Curtis High School - R450 - R450 - 31R450 - 105 HAMILTON AVENUE"
"W/""328568176""","Classroom Closed",882450000,"e1ec4b1f-f121-ec11-b6e6-001dd8306e46","10/9/2021","2021-10-09T04:00:00Z","054092","10/1/2021","2021-10-01T04:00:00Z","421 EAST 106 STREET","40,789,535.000000",40789535,"4f9f4974-31f4-ea11-b882-24ee9a37d45c","Manhattan",882450000,"-73,938,727.000000",-73938727,"4","P.S. 146 - MANHATTAN","P.S. M169 - Robert F. Kennedy - M169 - M146 - 75M169 - 421 EAST 106 STREET"
"W/""328433577""","Partial Classroom Quarantine",882450001,"dbb23337-f321-ec11-b6e6-001dd8306e46","10/4/2021","2021-10-04T04:00:00Z","054109","10/1/2021","2021-10-01T04:00:00Z","171-10 Linden Boulevard","40,691,720.000000",40691720,"9172c880-32f4-ea11-b882-24ee9a37d45c","Queens",882450003,"-73,778,924.000000",-73778924,"29","EAGLE ACADEMY - QUEENS","Eagle Academy for Young Men III - Q327 - Q633 - 29Q327 - 171-10 Linden Boulevard"
"W/""328399110""","No Intervention",882450002,"2b4654a3-f321-ec11-b6e6-001dd8306e46","10/1/2021","2021-10-01T04:00:00Z","054110","9/30/2021","2021-09-30T04:00:00Z","131 NORMAN AVENUE","40,726,378.000000",40726378,"f91aad3c-30f4-ea11-b882-24ee9a37d45c","Brooklyn",882450002,"-73,949,756.000000",-73949756,"14","P.S. 34 - BROOKLYN","P.S. 034 Oliver H. Perry - K034 - K034 - 14K034 - 131 NORMAN AVENUE"
"W/""328751297""","Classroom Closed",882450000,"4e223939-f821-ec11-b6e6-001dd8306e46","10/8/2021","2021-10-08T04:00:00Z","054125","10/1/2021","2021-10-01T04:00:00Z","1420 EAST  68 STREET","40,620,537.000000",40620537,"8b03194f-30f4-ea11-b882-24ee9a37d45c","Brooklyn",882450002,"-73,912,914.000000",-73912914,"22","I.S. 78 - BROOKLYN","Success Academy Charter School - Bergen Beach - New York 4 - K781 - K078 - 84K781 - 1420 EAST  68 STREET"
"W/""328718248""","Partial Classroom Quarantine",882450001,"131ba0f5-f921-ec11-b6e6-001dd8306e46","10/8/2021","2021-10-08T04:00:00Z","054133","10/1/2021","2021-10-01T04:00:00Z","144-176 EAST 128 STREET","40,805,653.000000",40805653,"38767649-31f4-ea11-b882-24ee9a37d45c","Manhattan",882450000,"-73,935,461.000000",-73935461,"5","P.S. 30 - MANHATTAN","Success Academy Charter School - Harlem 2 - M384 - M030 - 84M384 - 144-176 EAST 128 STREET"
"W/""328578629""","Non-Classroom Quarantine",882450003,"b7dfc3e7-fb21-ec11-b6e6-001dd8306e46","10/9/2021","2021-10-09T04:00:00Z","054144","10/1/2021","2021-10-01T04:00:00Z","145 WEST  84 STREET","40,786,134.000000",40786134,"33a6ba98-31f4-ea11-b882-24ee9a37d45c","Manhattan",882450000,"-73,974,483.000000",-73974483,"3","LOUIS D. BRANDEIS HS - MANHATTAN","Success Academy Charter School - Upper West - M523 - M470 - 84M523 - 145 WEST  84 STREET"
"W/""328508725""","Classroom Closed",882450000,"8e1bc6fb-fc21-ec11-b6e6-001dd8306e46","10/7/2021","2021-10-07T04:00:00Z","054150","10/1/2021","2021-10-01T04:00:00Z","87-41 PARSONS BOULEVARD","40,709,461.000000",40709461,"117eed06-32f4-ea11-b882-24ee9a37d45c","Queens",882450003,"-73,803,001.000000",-73803001,"28","P.S. 86 - QUEENS","P.S. Q086 - Q086 - Q086 - 28Q086 - 87-41 PARSONS BOULEVARD"
"W/""328763804""","Partial Classroom Quarantine",882450001,"fb68c17e-fe21-ec11-b6e6-001dd8306e46","10/2/2021","2021-10-02T04:00:00Z","054160","10/1/2021","2021-10-01T04:00:00Z","223 GRAHAM AVENUE","40,709,765.000000",40709765,"14eabc42-30f4-ea11-b882-24ee9a37d45c","Brooklyn",882450002,"-73,944,463.000000",-73944463,"14","I.S. 49 - BROOKLYN","The Williamsburg High School of Art and Technology - K454 - K049 - 14K454 - 223 GRAHAM AVENUE"
"W/""328813858""","Partial Classroom Quarantine",882450001,"b13a6675-ff21-ec11-b6e6-001dd8306e46","10/8/2021","2021-10-08T04:00:00Z","054165","10/1/2021","2021-10-01T04:00:00Z","345 East  15th Street","40,732,665.000000",40732665,"5607e99e-31f4-ea11-b882-24ee9a37d45c","Manhattan",882450000,"-73,982,590.000000",-73982590,"2","HEALTH PROFESSIONS HS (OL STY) - M","High School for Health Professions and Human Services - M420 - M475 - 02M420 - 345 East  15th Street"
"W/""328595734""","No Intervention",882450002,"38e2607b-ff21-ec11-b6e6-001dd8306e46","10/1/2021","2021-10-01T04:00:00Z","054166","9/30/2021","2021-09-30T04:00:00Z","5550 RIVERDALE AVENUE","40,903,275.000000",40903275,"420b210d-33f4-ea11-b882-24ee9a37d45c","Bronx",882450001,"-73,904,657.000000",-73904657,"10","P.S. 81 - BRONX","P.S. 081 Robert J. Christen - X081 - X081 - 10X081 - 5550 RIVERDALE AVENUE"
"W/""328760523""","Partial Classroom Quarantine",882450001,"57dfe0c2-0222-ec11-b6e6-001dd8306e46","10/8/2021","2021-10-08T04:00:00Z","054183","10/1/2021","2021-10-01T04:00:00Z","1664 BENSON AVENUE","40,606,739.000000",40606739,"3cebaa73-30f4-ea11-b882-24ee9a37d45c","Brooklyn",882450002,"-74,007,469.000000",-74007469,"20","P.S. 163 - BROOKLYN","P.S. 748 Brooklyn School for Global Scholars - K748 - K163 - 20K748 - 1664 BENSON AVENUE"
"W/""328856864""","Partial Classroom Quarantine",882450001,"71e3a4b3-0522-ec11-b6e6-001dd8306e46","10/8/2021","2021-10-08T04:00:00Z","054202","10/1/2021","2021-10-01T04:00:00Z","1875 EAST  17 STREET","40,604,447.000000",40604447,"56a5db98-30f4-ea11-b882-24ee9a37d45c","Brooklyn",882450002,"-73,955,217.000000",-73955217,"22","I.S. 234 - BROOKLYN","J.H.S. 234 Arthur W. Cunningham - K234 - K234 - 22K234 - 1875 EAST  17 STREET"
"W/""328643578""","Classroom Closed",882450000,"f526285b-0c22-ec11-b6e6-001dd8306e46","10/9/2021","2021-10-09T04:00:00Z","054229","10/1/2021","2021-10-01T04:00:00Z","3-65 BEACH 56 STREET","40,594,008.000000",40594008,"85977d2b-32f4-ea11-b882-24ee9a37d45c","Queens",882450003,"-73,786,649.000000",-73786649,"27","I.S. 198 - QUEENS","Goldie Maple Academy - Q333 - Q198 - 27Q333 - 3-65 BEACH 56 STREET"
"W/""328720519""","No Intervention",882450002,"5c0b14cb-0d22-ec11-b6e6-001dd8306e46","10/1/2021","2021-10-01T04:00:00Z","054237","9/30/2021","2021-09-30T04:00:00Z","5550 RIVERDALE AVENUE","40,903,275.000000",40903275,"420b210d-33f4-ea11-b882-24ee9a37d45c","Bronx",882450001,"-73,904,657.000000",-73904657,"10","P.S. 81 - BRONX","P.S. 081 Robert J. Christen - X081 - X081 - 10X081 - 5550 RIVERDALE AVENUE"
"W/""328668561""","Partial Classroom Quarantine",882450001,"669d2eec-0e22-ec11-b6e6-001dd8306e46","10/9/2021","2021-10-09T04:00:00Z","054241","10/1/2021","2021-10-01T04:00:00Z","234 West 109 Street","40,802,653.000000",40802653,"2f005d7a-31f4-ea11-b882-24ee9a37d45c","Manhattan",882450000,"-73,965,949.000000",-73965949,"3","P.S. 165 - MANHATTAN","Mott Hall II - M862 - M165 - 03M862 - 234 West 109 Street"
"W/""328669984""","No Intervention",882450002,"48519146-0f22-ec11-b6e6-001dd8306e46","10/1/2021","2021-10-01T04:00:00Z","054242","9/30/2021","2021-09-30T04:00:00Z","228 AVENUE S","40,600,660.000000",40600660,"e921d292-30f4-ea11-b882-24ee9a37d45c","Brooklyn",882450002,"-73,976,801.000000",-73976801,"21","I.S. 228 - BROOKLYN","I.S. 228 David A. Boody - K228 - K228 - 21K228 - 228 AVENUE S"
"W/""328717293""","Partial Classroom Quarantine",882450001,"4f938567-1022-ec11-b6e6-001dd8306e46","10/4/2021","2021-10-04T04:00:00Z","054247","10/1/2021","2021-10-01T04:00:00Z","228 AVENUE S","40,600,660.000000",40600660,"e921d292-30f4-ea11-b882-24ee9a37d45c","Brooklyn",882450002,"-73,976,801.000000",-73976801,"21","I.S. 228 - BROOKLYN","I.S. 228 David A. Boody - K228 - K228 - 21K228 - 228 AVENUE S"
"W/""328722531""","Classroom Closed",882450000,"6446cd97-1022-ec11-b6e6-001dd8306e46","10/8/2021","2021-10-08T04:00:00Z","054248","10/1/2021","2021-10-01T04:00:00Z","75-10 21 Avenue","40,769,798.000000",40769798,"93dc32dc-31f4-ea11-b882-24ee9a37d45c","Queens",882450003,"-73,894,108.000000",-73894108,"30","P.S. 2 - QUEENS","DYCD - P.S. 002 Alfred Zimberg - 126038 - 75-10 21 AVENUE"
"W/""328804234""","Partial Classroom Quarantine",882450001,"a1a61283-1322-ec11-b6e6-001dd8306e46","10/7/2021","2021-10-07T04:00:00Z","054256","10/1/2021","2021-10-01T04:00:00Z","2500 NOSTRAND AVENUE","40,623,788.000000",40623788,"69a5db98-30f4-ea11-b882-24ee9a37d45c","Brooklyn",882450002,"-73,946,836.000000",-73946836,"22","I.S. 240 - BROOKLYN","I. S. 381 - K381 - K240 - 22K381 - 2500 NOSTRAND AVENUE"
"W/""328790845""","Partial Classroom Quarantine",882450001,"ac998b0a-1c22-ec11-b6e6-001dd8306e46","10/9/2021","2021-10-09T04:00:00Z","054295","10/1/2021","2021-10-01T04:00:00Z","57-40 MARATHON PARKWAY","40,758,808.000000",40758808,"11b7c337-32f4-ea11-b882-24ee9a37d45c","Queens",882450003,"-73,731,518.000000",-73731518,"26","P.S. 221 - QUEENS","P.S. 221 The North Hills School - Q221 - Q221 - 26Q221 - 57-40 MARATHON PARKWAY"
"W/""328795151""","No Intervention",882450002,"cfdd9130-1e22-ec11-b6e6-001dd8306e46","10/1/2021","2021-10-01T04:00:00Z","054305","9/30/2021","2021-09-30T04:00:00Z","350 67 STREET","40,636,721.000000",40636721,"bf9c11e8-30f4-ea11-b882-24ee9a37d45c","Brooklyn",882450002,"-74,023,419.000000",-74023419,"20","TELECOM. ARTS & TECH. - K","High School of Telecommunication Arts and Technology - K485 - K485 - 20K485 - 350 67 STREET"
"W/""328804421""","Classroom Closed",882450000,"00d10f67-1e22-ec11-b6e6-001dd8306e46","10/4/2021","2021-10-04T04:00:00Z","054307","10/1/2021","2021-10-01T04:00:00Z","249 EAST 17TH STREET","40,644,927.000000",40644927,"432f7d06-31f4-ea11-b882-24ee9a37d45c","Brooklyn",882450002,"-73,962,743.000000",-73962743,"22","P.S. 245 - BROOKLYN","P.S. 245 - K245 - K735 - 22K245 - 249 EAST 17TH STREET"
"W/""328799541""","Partial Classroom Quarantine",882450001,"c3422da9-1e22-ec11-b6e6-001dd8306e46","10/4/2021","2021-10-04T04:00:00Z","054310","10/1/2021","2021-10-01T04:00:00Z","100 AMSTERDAM AVENUE","40,774,202.000000",40774202,"7207e99e-31f4-ea11-b882-24ee9a37d45c","Manhattan",882450000,"-73,985,976.000000",-73985976,"3","FIORELLO LAGUARDIA HS - MANHATTAN","Fiorello H. LaGuardia High School of Music & Art and Performing Arts - M485 - M485 - 03M485 - 100 AMSTERDAM AVENUE"
"W/""328805775""","Classroom Closed",882450000,"241bdfbe-1f22-ec11-b6e6-001dd8306e46","10/8/2021","2021-10-08T04:00:00Z","054317","10/1/2021","2021-10-01T04:00:00Z","1100 NEWKIRK AVENUE","40,633,482.000000",40633482,"545bc58c-30f4-ea11-b882-24ee9a37d45c","Brooklyn",882450002,"-73,966,442.000000",-73966442,"22","P.S. 217 - BROOKLYN","P.S. 217 Colonel David Marcus School - K217 - K217 - 22K217 - 1100 NEWKIRK AVENUE"
"W/""328837519""","Classroom Closed",882450000,"b63549e2-2322-ec11-b6e6-001dd8306e46","10/7/2021","2021-10-07T04:00:00Z","054326","10/1/2021","2021-10-01T04:00:00Z","2005 MADISON AVENUE","40,807,019.000000",40807019,"cb37fba4-31f4-ea11-b882-24ee9a37d45c","Manhattan",882450000,"-73,938,714.000000",-73938714,"5","ARTHUR SCHOMBURG HS (IS 201) - M","Democracy Prep Harlem Charter School - M481 - M501 - 84M481 - 2005 MADISON AVENUE"
"W/""328838616""","Classroom Closed",882450000,"e2004db4-2422-ec11-b6e6-001dd8306e46","10/8/2021","2021-10-08T04:00:00Z","054332","10/1/2021","2021-10-01T04:00:00Z","2005 MADISON AVENUE","40,807,019.000000",40807019,"cb37fba4-31f4-ea11-b882-24ee9a37d45c","Manhattan",882450000,"-73,938,714.000000",-73938714,"5","ARTHUR SCHOMBURG HS (IS 201) - M","Democracy Prep Harlem Charter School - M481 - M501 - 84M481 - 2005 MADISON AVENUE"
"W/""324597222""","Classroom Closed",882450000,"5eeca75d-d41e-ec11-b6e6-001dd8306f41","10/4/2021","2021-10-04T04:00:00Z","052460","9/27/2021","2021-09-27T04:00:00Z","60-02 60 LANE","40,716,296.000000",40716296,"e19b4c1f-32f4-ea11-b882-24ee9a37d45c","Queens",882450003,"-73,904,463.000000",-73904463,"24","P.S. 153 - QUEENS","P.S. 153 Maspeth Elem - Q153 - Q153 - 24Q153 - 60-02 60 LANE"
"W/""324595365""","Partial Classroom Quarantine",882450001,"604aa667-d71e-ec11-b6e6-001dd8306f41","10/4/2021","2021-10-04T04:00:00Z","052467","9/27/2021","2021-09-27T04:00:00Z","5800 20 AVENUE","40,621,299.000000",40621299,"682b3eee-30f4-ea11-b882-24ee9a37d45c","Brooklyn",882450002,"-73,982,583.000000",-73982583,"20","FRANKLIN D. ROOSEVELT HS - K","Franklin Delano Roosevelt High School - K505 - K505 - 20K505 - 5800 20 AVENUE"
"W/""324627588""","Non-Classroom Quarantine",882450003,"54662834-dd1e-ec11-b6e6-001dd8306f41","10/4/2021","2021-10-04T04:00:00Z","052480","9/27/2021","2021-09-27T04:00:00Z","237 7 AVENUE","40,669,255.000000",40669255,"929c11e8-30f4-ea11-b882-24ee9a37d45c","Brooklyn",882450002,"-73,978,580.000000",-73978580,"15","John Jay Educational Campus","Park Slope Collegiate - K464 - K460 - 15K464 - 237 7 AVENUE"
"W/""326561282""","Non-Classroom Quarantine",882450003,"c4ae2f4c-dd1e-ec11-b6e6-001dd8306f41","10/4/2021","2021-10-04T04:00:00Z","052481","9/27/2021","2021-09-27T04:00:00Z","736 48TH STREET","40,643,018.000000",40643018,"4d416e00-31f4-ea11-b882-24ee9a37d45c","Brooklyn",882450002,"-74,004,306.000000",-74004306,"15","P.S. @ 736 48 STREET - BROOKLYN","The School of Creativity and Innovation - K896 - K682 - 15K896 - 736 48TH STREET"
"W/""325106157""","Classroom Closed",882450000,"e773245e-dd1e-ec11-b6e6-001dd8306f41","10/4/2021","2021-10-04T04:00:00Z","052482","9/27/2021","2021-09-27T04:00:00Z","736 48TH STREET","40,643,018.000000",40643018,"4d416e00-31f4-ea11-b882-24ee9a37d45c","Brooklyn",882450002,"-74,004,306.000000",-74004306,"15","P.S. @ 736 48 STREET - BROOKLYN","The School of Creativity and Innovation - K896 - K682 - 15K896 - 736 48TH STREET"
"W/""325738980""","Classroom Closed",882450000,"77d8907c-df1e-ec11-b6e6-001dd8306f41","10/4/2021","2021-10-04T04:00:00Z","052493","9/27/2021","2021-09-27T04:00:00Z","50 AVENUE P","40,606,994.000000",40606994,"5fa5db98-30f4-ea11-b882-24ee9a37d45c","Brooklyn",882450002,"-73,986,678.000000",-73986678,"21","LUCRETIA MARCIGLIANO CAMPUS - K","The Academy of Talented Scholars - K682 - K237 - 20K682 - 50 AVENUE P"
"W/""324597358""","Partial Classroom Quarantine",882450001,"2645d21e-e01e-ec11-b6e6-001dd8306f41","10/4/2021","2021-10-04T04:00:00Z","052501","9/27/2021","2021-09-27T04:00:00Z","455 HUGUENOT AVENUE","40,544,535.000000",40544535,"e28521d0-32f4-ea11-b882-24ee9a37d45c","Staten Island",882450004,"-74,197,033.000000",-74197033,"31","I.S. 75 - STATEN ISLAND","I.S. 075 Frank D. Paulo - R075 - R075 - 31R075 - 455 HUGUENOT AVENUE"
"W/""325758977""","Classroom Closed",882450000,"e5967237-e21e-ec11-b6e6-001dd8306f41","10/3/2021","2021-10-03T04:00:00Z","052513","9/27/2021","2021-09-27T04:00:00Z","50 AVENUE P","40,606,994.000000",40606994,"5fa5db98-30f4-ea11-b882-24ee9a37d45c","Brooklyn",882450002,"-73,986,678.000000",-73986678,"21","LUCRETIA MARCIGLIANO CAMPUS - K","The Academy of Talented Scholars - K682 - K237 - 20K682 - 50 AVENUE P"
"W/""326731333""","Classroom Closed",882450000,"3ae0ad5e-e31e-ec11-b6e6-001dd8306f41","10/4/2021","2021-10-04T04:00:00Z","052517","9/27/2021","2021-09-27T04:00:00Z","91 HENDERSON AVENUE","40,641,180.000000",40641180,"97a9d9c3-32f4-ea11-b882-24ee9a37d45c","Staten Island",882450004,"-74,095,454.000000",-74095454,"31","P.S. 373 (OLD P40) - STATEN ISLAND","P.S. R373 - R373 - R040 - 75R373 - 91 HENDERSON AVENUE"
"W/""325151360""","Classroom Closed",882450000,"372dc992-e61e-ec11-b6e6-001dd8306f41","10/3/2021","2021-10-03T04:00:00Z","052532","9/27/2021","2021-09-27T04:00:00Z","610 EAST  12 STREET","40,727,537.000000",40727537,"c8fab455-31f4-ea11-b882-24ee9a37d45c","Manhattan",882450000,"-73,978,254.000000",-73978254,"1","P.S. 61 - MANHATTAN","The Children's Workshop School - M361 - M061 - 01M361 - 610 EAST  12 STREET"
"W/""325134093""","Partial Classroom Quarantine",882450001,"3e53ca5b-e91e-ec11-b6e6-001dd8306f41","10/4/2021","2021-10-04T04:00:00Z","052538","9/27/2021","2021-09-27T04:00:00Z","3040 ROBERTS AVENUE","40,845,379.000000",40845379,"e3d10307-33f4-ea11-b882-24ee9a37d45c","Bronx",882450001,"-73,829,562.000000",-73829562,"8","P.S. 71 - BRONX","P.S. 071 Rose E. Scala - X071 - X071 - 08X071 - 3040 ROBERTS AVENUE"
"W/""324598028""","Partial Classroom Quarantine",882450001,"adc2aa4e-f01e-ec11-b6e6-001dd8306f41","10/3/2021","2021-10-03T04:00:00Z","052555","9/27/2021","2021-09-27T04:00:00Z","6500 16 AVENUE","40,622,102.000000",40622102,"ee21d292-30f4-ea11-b882-24ee9a37d45c","Brooklyn",882450002,"-73,995,961.000000",-73995961,"20","I.S. 227 - BROOKLYN","J.H.S. 227 Edward B. Shallow - K227 - K227 - 20K227 - 6500 16 AVENUE"
"W/""325860791""","Classroom Closed",882450000,"2b36d399-fa1e-ec11-b6e6-001dd8306f41","10/4/2021","2021-10-04T04:00:00Z","052579","9/28/2021","2021-09-28T04:00:00Z","160 WEST  78 STREET","40,781,710.000000",40781710,"8e41e65b-31f4-ea11-b882-24ee9a37d45c","Manhattan",882450000,"-73,978,020.000000",-73978020,"3","P.S. 87 - MANHATTAN","P.S. 087 William Sherman - M087 - M087 - 03M087 - 160 WEST  78 STREET"
"W/""324595790""","Classroom Closed",882450000,"b9ed6bf4-fa1e-ec11-b6e6-001dd8306f41","10/2/2021","2021-10-02T04:00:00Z","052582","9/27/2021","2021-09-27T04:00:00Z","750 Jennings Street","40,831,388.000000",40831388,"892aa42b-33f4-ea11-b882-24ee9a37d45c","Bronx",882450001,"-73,897,797.000000",-73897797,"12","P.S. 186 (OLD J136) - BRONX","P186X Walter J. Damrosch School - X186 - X136 - 75X186 - 750 Jennings Street"
"W/""326889864""","Partial Classroom Quarantine",882450001,"b702eb76-fe1e-ec11-b6e6-001dd8306f41","10/1/2021","2021-10-01T04:00:00Z","052590","9/27/2021","2021-09-27T04:00:00Z","100 WEST MOSHOLU PARKWAY SOUTH","40,879,958.000000",40879958,"4cffcc6e-33f4-ea11-b882-24ee9a37d45c","Bronx",882450001,"-73,889,011.000000",-73889011,"10","DEWITT CLINTON HS - X","World View High School - X353 - X440 - 10X353 - 100 WEST MOSHOLU PARKWAY SOUTH"
"W/""328461813""","Partial Classroom Quarantine",882450001,"20048511-001f-ec11-b6e6-001dd8306f41","10/4/2021","2021-10-04T04:00:00Z","052592","9/30/2021","2021-09-30T04:00:00Z","45 EAST  81 STREET","40,777,737.000000",40777737,"8d886843-31f4-ea11-b882-24ee9a37d45c","Manhattan",882450000,"-73,960,427.000000",-73960427,"2","P.S. 6 - MANHATTAN","P.S. 006 Lillie D. Blake - M006 - M006 - 02M006 - 45 EAST  81 STREET"
"W/""325852414""","Classroom Closed",882450000,"c5126fb8-031f-ec11-b6e6-001dd8306f41","10/4/2021","2021-10-04T04:00:00Z","052597","9/27/2021","2021-09-27T04:00:00Z","1400 BENSON AVENUE","40,610,331.000000",40610331,"f521d292-30f4-ea11-b882-24ee9a37d45c","Brooklyn",882450002,"-74,013,585.000000",-74013585,"20","P.S. 229 - BROOKLYN","P.S. 229 Dyker - K229 - K229 - 20K229 - 1400 BENSON AVENUE"
"W/""327111557""","Partial Classroom Quarantine",882450001,"e3862e3d-861f-ec11-b6e6-001dd8306f41","10/3/2021","2021-10-03T04:00:00Z","052614","9/28/2021","2021-09-28T04:00:00Z","730 CONCOURSE VILLAGE WEST","40,821,828.000000",40821828,"0ea31781-33f4-ea11-b882-24ee9a37d45c","Bronx",882450001,"-73,922,366.000000",-73922366,"7","MOTT HAVEN EDUCATIONAL CAMPUS - BRONX","Bronx Leadership Academy II High School - X527 - X790 - 07X527 - 730 CONCOURSE VILLAGE WEST"
"W/""327008812""","Partial Classroom Quarantine",882450001,"8c302555-861f-ec11-b6e6-001dd8306f41","10/2/2021","2021-10-02T04:00:00Z","052615","9/28/2021","2021-09-28T04:00:00Z","63-60 80th Street","40,719,567.000000",40719567,"678946f4-31f4-ea11-b882-24ee9a37d45c","Queens",882450003,"-73,875,493.000000",-73875493,"24","P.S./I.S. 49 - QUEENS","P.S. 049 Dorothy Bonawit Kole - Q049 - Q049 - 24Q049 - 63-60 80th Street"
"W/""325860876""","Partial Classroom Quarantine",882450001,"146287a6-871f-ec11-b6e6-001dd8306f41","10/4/2021","2021-10-04T04:00:00Z","052623","9/28/2021","2021-09-28T04:00:00Z","63-60 80th Street","40,719,567.000000",40719567,"678946f4-31f4-ea11-b882-24ee9a37d45c","Queens",882450003,"-73,875,493.000000",-73875493,"24","P.S./I.S. 49 - QUEENS","P.S. 049 Dorothy Bonawit Kole - Q049 - Q049 - 24Q049 - 63-60 80th Street"
"W/""325860937""","Classroom Closed",882450000,"f4567add-891f-ec11-b6e6-001dd8306f41","10/4/2021","2021-10-04T04:00:00Z","052637","9/28/2021","2021-09-28T04:00:00Z","1400 PENNSYLVANIA AVENUE","40,646,640.000000",40646640,"30a198c3-30f4-ea11-b882-24ee9a37d45c","Brooklyn",882450002,"-73,881,997.000000",-73881997,"19","P.S. 346 - BROOKLYN","P.S. 346 Abe Stark - K346 - K346 - 19K346 - 1400 PENNSYLVANIA AVENUE"
"W/""325860962""","Partial Classroom Quarantine",882450001,"98f5540e-8c1f-ec11-b6e6-001dd8306f41","10/4/2021","2021-10-04T04:00:00Z","052644","9/28/2021","2021-09-28T04:00:00Z","148-20 REEVES AVENUE","40,738,599.000000",40738599,"8bbc9674-32f4-ea11-b882-24ee9a37d45c","Queens",882450003,"-73,820,821.000000",-73820821,"25","P.S./I.S. 499 - QUEENS","The Queens College School for Math, Science and Technology - Q499 - Q499 - 25Q499 - 148-20 REEVES AVENUE"
"W/""325860997""","Partial Classroom Quarantine",882450001,"cfe355e2-8e1f-ec11-b6e6-001dd8306f41","10/4/2021","2021-10-04T04:00:00Z","052655","9/28/2021","2021-09-28T04:00:00Z","93-11 34 AVENUE","40,755,759.000000",40755759,"f3883319-32f4-ea11-b882-24ee9a37d45c","Queens",882450003,"-73,874,505.000000",-73874505,"30","P.S. 149 - QUEENS","P.S. 149 Christa McAuliffe - Q149 - Q149 - 30Q149 - 93-11 34 AVENUE"
"W/""325861063""","Classroom Closed",882450000,"ba698fd1-911f-ec11-b6e6-001dd8306f41","10/4/2021","2021-10-04T04:00:00Z","052671","9/28/2021","2021-09-28T04:00:00Z","64-35 102 STREET","40,731,016.000000",40731016,"960e6e25-32f4-ea11-b882-24ee9a37d45c","Queens",882450003,"-73,852,210.000000",-73852210,"28","P.S. 175 - QUEENS","P.S. 175 The Lynn Gross Discovery School - Q175 - Q175 - 28Q175 - 64-35 102 STREET"
"W/""325861093""","Partial Classroom Quarantine",882450001,"0d2b62ce-921f-ec11-b6e6-001dd8306f41","10/4/2021","2021-10-04T04:00:00Z","052679","9/28/2021","2021-09-28T04:00:00Z","2800 OCEAN PARKWAY","40,582,627.000000",40582627,"518dbfcf-30f4-ea11-b882-24ee9a37d45c","Brooklyn",882450002,"-73,968,733.000000",-73968733,"21","ABRAHAM LINCOLN HS - K","Abraham Lincoln High School - K410 - K410 - 21K410 - 2800 OCEAN PARKWAY"
"W/""326854321""","Partial Classroom Quarantine",882450001,"bb227ae6-921f-ec11-b6e6-001dd8306f41","10/2/2021","2021-10-02T04:00:00Z","052682","9/28/2021","2021-09-28T04:00:00Z","64-35 102 STREET","40,731,016.000000",40731016,"960e6e25-32f4-ea11-b882-24ee9a37d45c","Queens",882450003,"-73,852,210.000000",-73852210,"28","P.S. 175 - QUEENS","P.S. 175 The Lynn Gross Discovery School - Q175 - Q175 - 28Q175 - 64-35 102 STREET"
"W/""327198816""","Partial Classroom Quarantine",882450001,"884511b6-941f-ec11-b6e6-001dd8306f41","10/4/2021","2021-10-04T04:00:00Z","052698","9/29/2021","2021-09-29T04:00:00Z","64-35 102 STREET","40,731,016.000000",40731016,"960e6e25-32f4-ea11-b882-24ee9a37d45c","Queens",882450003,"-73,852,210.000000",-73852210,"28","P.S. 175 - QUEENS","P.S. 175 The Lynn Gross Discovery School - Q175 - Q175 - 28Q175 - 64-35 102 STREET"
"W/""325861199""","Partial Classroom Quarantine",882450001,"6f4c27f5-971f-ec11-b6e6-001dd8306f41","10/4/2021","2021-10-04T04:00:00Z","052724","9/28/2021","2021-09-28T04:00:00Z","31-15 140 STREET","40,770,215.000000",40770215,"feb6c337-32f4-ea11-b882-24ee9a37d45c","Queens",882450003,"-73,827,606.000000",-73827606,"25","P.S. 214 - QUEENS","P.S. 214 Cadwallader Colden - Q214 - Q214 - 25Q214 - 31-15 140 STREET"
"W/""325861244""","Classroom Closed",882450000,"e3646fd3-981f-ec11-b6e6-001dd8306f41","10/4/2021","2021-10-04T04:00:00Z","052734","9/28/2021","2021-09-28T04:00:00Z","31-15 140 STREET","40,770,215.000000",40770215,"feb6c337-32f4-ea11-b882-24ee9a37d45c","Queens",882450003,"-73,827,606.000000",-73827606,"25","P.S. 214 - QUEENS","P.S. 214 Cadwallader Colden - Q214 - Q214 - 25Q214 - 31-15 140 STREET"
"W/""327198831""","Non-Classroom Quarantine",882450003,"bc5e0c3c-9a1f-ec11-b6e6-001dd8306f41","10/4/2021","2021-10-04T04:00:00Z","052750","9/29/2021","2021-09-29T04:00:00Z","67-01 110 STREET","40,730,017.000000",40730017,"d3b66262-32f4-ea11-b882-24ee9a37d45c","Queens",882450003,"-73,843,972.000000",-73843972,"28","FOREST HILLS HS - Q","Forest Hills High School - Q440 - Q440 - 28Q440 - 67-01 110 STREET"
"W/""325861335""","Classroom Closed",882450000,"833d1a90-9c1f-ec11-b6e6-001dd8306f41","10/2/2021","2021-10-02T04:00:00Z","052767","9/28/2021","2021-09-28T04:00:00Z","419 WAVERLY AVENUE","40,685,896.000000",40685896,"e0f57030-30f4-ea11-b882-24ee9a37d45c","Brooklyn",882450002,"-73,965,890.000000",-73965890,"13","P.S. 11 - BROOKLYN","P.S. 011 Purvis J. Behan - K011 - K011 - 13K011 - 419 WAVERLY AVENUE"
"W/""327198836""","Partial Classroom Quarantine",882450001,"eb1e3dcc-9c1f-ec11-b6e6-001dd8306f41","10/7/2021","2021-10-07T04:00:00Z","052771","9/29/2021","2021-09-29T04:00:00Z","535 BRIAR PLACE","40,599,467.000000",40599467,"01b7c337-32f4-ea11-b882-24ee9a37d45c","Queens",882450003,"-73,758,587.000000",-73758587,"27","P.S. 215 - QUEENS","Wave Preparatory Elementary School - Q362 - Q215 - 27Q362 - 535 BRIAR PLACE"
"W/""325861360""","Partial Classroom Quarantine",882450001,"9cd6b338-9d1f-ec11-b6e6-001dd8306f41","10/4/2021","2021-10-04T04:00:00Z","052776","9/28/2021","2021-09-28T04:00:00Z","255 IONIA AVENUE","40,543,433.000000",40543433,"8ba9d9c3-32f4-ea11-b882-24ee9a37d45c","Staten Island",882450004,"-74,182,548.000000",-74182548,"31","P.S. 36 - STATEN ISLAND","P.S. 036 J. C. Drumgoole - R036 - R036 - 31R036 - 255 IONIA AVENUE"
"W/""326895371""","Classroom Closed",882450000,"0bdca956-9d1f-ec11-b6e6-001dd8306f41","10/3/2021","2021-10-03T04:00:00Z","052777","9/28/2021","2021-09-28T04:00:00Z","279-80 EAST BURNSIDE AVENUE","40,851,214.000000",40851214,"bd0a7997-4afb-ea11-b883-24ee9a37d459",,,"-73,901,594.000000",-73901594,"9","BILINGUALS, INC. SHARON BAPTIST HEAD START","Bilinguals, Inc. Sharon Baptist Head Start - XAJJ - XAJJ -  - 279-80 EAST BURNSIDE AVENUE"
"W/""325861375""","Classroom Closed",882450000,"ec55e2aa-9d1f-ec11-b6e6-001dd8306f41","10/1/2021","2021-10-01T04:00:00Z","052782","9/28/2021","2021-09-28T04:00:00Z","701 Fort Washington Avenue","40,857,650.000000",40857650,"6a34aa92-31f4-ea11-b882-24ee9a37d45c","Manhattan",882450000,"-73,935,231.000000",-73935231,"6","Success Academy - Washington Heights","Success Academy Charter School - Washington Heights - New York 1 - M265 - M387 - 84M265 - 701 Fort Washington Avenue"
"W/""325861385""","Classroom Closed",882450000,"539bc9e6-9d1f-ec11-b6e6-001dd8306f41","10/3/2021","2021-10-03T04:00:00Z","052784","9/28/2021","2021-09-28T04:00:00Z","419 WAVERLY AVENUE","40,685,896.000000",40685896,"e0f57030-30f4-ea11-b882-24ee9a37d45c","Brooklyn",882450002,"-73,965,890.000000",-73965890,"13","P.S. 11 - BROOKLYN","P.S. 011 Purvis J. Behan - K011 - K011 - 13K011 - 419 WAVERLY AVENUE"
"W/""325861415""","Partial Classroom Quarantine",882450001,"4cea6fb9-9e1f-ec11-b6e6-001dd8306f41","10/4/2021","2021-10-04T04:00:00Z","052791","9/28/2021","2021-09-28T04:00:00Z","63-60 80th Street","40,719,567.000000",40719567,"678946f4-31f4-ea11-b882-24ee9a37d45c","Queens",882450003,"-73,875,493.000000",-73875493,"24","P.S./I.S. 49 - QUEENS","P.S. 049 Dorothy Bonawit Kole - Q049 - Q049 - 24Q049 - 63-60 80th Street"
"W/""327118415""","Classroom Closed",882450000,"9d3c264f-9f1f-ec11-b6e6-001dd8306f41","10/4/2021","2021-10-04T04:00:00Z","052797","9/28/2021","2021-09-28T04:00:00Z","439 WEST 49TH STREET","40,763,655.000000",40763655,"a9d810ab-31f4-ea11-b882-24ee9a37d45c","Manhattan",882450000,"-73,990,318.000000",-73990318,"2","HS OF GRAPHIC COMMUNICATION ARTS-M","Success Academy Charter School - Hell's Kitchen - M170 - M625 - 84M170 - 439 WEST 49TH STREET"
"W/""326897971""","Classroom Closed",882450000,"47ab2479-9f1f-ec11-b6e6-001dd8306f41","10/4/2021","2021-10-04T04:00:00Z","052799","9/28/2021","2021-09-28T04:00:00Z","1290 SPOFFORD AVENUE","40,814,034.000000",40814034,"5336d900-33f4-ea11-b882-24ee9a37d45c","Bronx",882450001,"-73,886,834.000000",-73886834,"8","P.S. 48 - BRONX","P.S. 048 Joseph R. Drake - X048 - X048 - 08X048 - 1290 SPOFFORD AVENUE"
"W/""325861446""","Classroom Closed",882450000,"4a2bd1de-9f1f-ec11-b6e6-001dd8306f41","10/7/2021","2021-10-07T04:00:00Z","052803","9/28/2021","2021-09-28T04:00:00Z","143-26 101 AVENUE","40,694,868.000000",40694868,"6a8946f4-31f4-ea11-b882-24ee9a37d45c","Queens",882450003,"-73,806,842.000000",-73806842,"28","P.S. 50 - QUEENS","P.S. 050 Talfourd Lawn Elementary School - Q050 - Q050 - 28Q050 - 143-26 101 AVENUE"
"W/""325861466""","Classroom Closed",882450000,"888589aa-a01f-ec11-b6e6-001dd8306f41","10/3/2021","2021-10-03T04:00:00Z","052809","9/28/2021","2021-09-28T04:00:00Z","419 WAVERLY AVENUE","40,685,896.000000",40685896,"e0f57030-30f4-ea11-b882-24ee9a37d45c","Brooklyn",882450002,"-73,965,890.000000",-73965890,"13","P.S. 11 - BROOKLYN","P.S. 011 Purvis J. Behan - K011 - K011 - 13K011 - 419 WAVERLY AVENUE"
"W/""327683023""","Partial Classroom Quarantine",882450001,"1cd97eb6-a01f-ec11-b6e6-001dd8306f41","10/1/2021","2021-10-01T04:00:00Z","052812","9/29/2021","2021-09-29T04:00:00Z","1000 EAST TREMONT AVENUE","40,840,445.000000",40840445,"0e9ebaee-32f4-ea11-b882-24ee9a37d45c","Bronx",882450001,"-73,882,531.000000",-73882531,"12","P.S. 6 - BRONX","P.S. 006 West Farms - X006 - X006 - 12X006 - 1000 EAST TREMONT AVENUE"
"W/""325861486""","Partial Classroom Quarantine",882450001,"42cc70e6-a01f-ec11-b6e6-001dd8306f41","10/4/2021","2021-10-04T04:00:00Z","052816","9/28/2021","2021-09-28T04:00:00Z","760 Van Siclen Avenue","40,661,102.000000",40661102,"7b3fd300-d214-ec11-b8b5-24ee9a37d45c",,,"-73,886,668.000000",-73886668,"19","K599  East New York","P.S. K077 - K077 - K599 - 75K077 - 760 Van Siclen Avenue"
"W/""325861501""","Non-Classroom Quarantine",882450003,"ebd67516-a11f-ec11-b6e6-001dd8306f41","10/4/2021","2021-10-04T04:00:00Z","052823","9/28/2021","2021-09-28T04:00:00Z","965 LONGWOOD AVENUE","40,817,741.000000",40817741,"0203cefa-32f4-ea11-b882-24ee9a37d45c","Bronx",882450001,"-73,897,876.000000",-73897876,"8","NEW SCH FOR ARTS AND SCIENCE - X","Success Academy Charter School - Bronx 3 - X380 - X039 - 84X380 - 965 LONGWOOD AVENUE"
"W/""325861506""","Classroom Closed",882450000,"5ff36f22-a11f-ec11-b6e6-001dd8306f41","10/3/2021","2021-10-03T04:00:00Z","052824","9/28/2021","2021-09-28T04:00:00Z","419 WAVERLY AVENUE","40,685,896.000000",40685896,"e0f57030-30f4-ea11-b882-24ee9a37d45c","Brooklyn",882450002,"-73,965,890.000000",-73965890,"13","P.S. 11 - BROOKLYN","P.S. 011 Purvis J. Behan - K011 - K011 - 13K011 - 419 WAVERLY AVENUE"
"W/""327125358""","Partial Classroom Quarantine",882450001,"f6b9a4d0-a11f-ec11-b6e6-001dd8306f41","10/4/2021","2021-10-04T04:00:00Z","052831","9/28/2021","2021-09-28T04:00:00Z","63-25 MAIN STREET","40,737,448.000000",40737448,"bab66262-32f4-ea11-b882-24ee9a37d45c","Queens",882450003,"-73,823,841.000000",-73823841,"25","JOHN BOWNE HS - QUEENS","John Bowne High School - Q425 - Q425 - 25Q425 - 63-25 MAIN STREET"
"W/""325861541""","Partial Classroom Quarantine",882450001,"9fd436ab-a31f-ec11-b6e6-001dd8306f41","10/1/2021","2021-10-01T04:00:00Z","052856","9/28/2021","2021-09-28T04:00:00Z","100 WEST MOSHOLU PARKWAY SOUTH","40,879,958.000000",40879958,"4cffcc6e-33f4-ea11-b882-24ee9a37d45c","Bronx",882450001,"-73,889,011.000000",-73889011,"10","DEWITT CLINTON HS - X","DeWitt Clinton High School - X440 - X440 - 10X440 - 100 WEST MOSHOLU PARKWAY SOUTH"
"W/""326823908""","Partial Classroom Quarantine",882450001,"6b253759-a41f-ec11-b6e6-001dd8306f41","10/1/2021","2021-10-01T04:00:00Z","052865","9/28/2021","2021-09-28T04:00:00Z","56-37 188 STREET","40,743,400.000000",40743400,"8b0e6e25-32f4-ea11-b882-24ee9a37d45c","Queens",882450003,"-73,787,419.000000",-73787419,"26","P.S. 177 - QUEENS","P.S. Q177 - Q177 - Q177 - 75Q177 - 56-37 188 STREET"
"W/""325861607""","Partial Classroom Quarantine",882450001,"084ce110-a61f-ec11-b6e6-001dd8306f41","10/4/2021","2021-10-04T04:00:00Z","052886","9/28/2021","2021-09-28T04:00:00Z","240 EAST 109 STREET","40,792,556.000000",40792556,"1b6e3d68-31f4-ea11-b882-24ee9a37d45c","Manhattan",882450000,"-73,942,285.000000",-73942285,"4","J.H.S. 117 - MANHATTAN","Tag Young Scholars - M012 - M117 - 04M012 - 240 EAST 109 STREET"
"W/""325861617""","Classroom Closed",882450000,"dcd30835-a61f-ec11-b6e6-001dd8306f41","10/4/2021","2021-10-04T04:00:00Z","052890","9/28/2021","2021-09-28T04:00:00Z","311 EAST  82 STREET","40,775,181.000000",40775181,"66507380-31f4-ea11-b882-24ee9a37d45c","Manhattan",882450000,"-73,952,777.000000",-73952777,"2","P.S. 290 - MANHATTAN","P.S. 290 Manhattan New School - M290 - M190 - 02M290 - 311 EAST  82 STREET"
"W/""327198856""","Partial Classroom Quarantine",882450001,"f6987564-a81f-ec11-b6e6-001dd8306f41","10/4/2021","2021-10-04T04:00:00Z","052913","9/29/2021","2021-09-29T04:00:00Z","5550 RIVERDALE AVENUE","40,903,275.000000",40903275,"420b210d-33f4-ea11-b882-24ee9a37d45c","Bronx",882450001,"-73,904,657.000000",-73904657,"10","P.S. 81 - BRONX","P.S. 081 Robert J. Christen - X081 - X081 - 10X081 - 5550 RIVERDALE AVENUE"
"W/""328559430""","Classroom Closed",882450000,"94d41d0e-aa1f-ec11-b6e6-001dd8306f41","10/4/2021","2021-10-04T04:00:00Z","052928","9/29/2021","2021-09-29T04:00:00Z","3829 AVENUE K","40,626,038.000000",40626038,"b4315367-30f4-ea11-b882-24ee9a37d45c","Brooklyn",882450002,"-73,938,733.000000",-73938733,"22","P.S. 119 - BROOKLYN","P.S. 119 Amersfort - K119 - K119 - 22K119 - 3829 AVENUE K"
"W/""327135176""","Partial Classroom Quarantine",882450001,"52245e74-aa1f-ec11-b6e6-001dd8306f41","10/3/2021","2021-10-03T04:00:00Z","052938","9/28/2021","2021-09-28T04:00:00Z","965 LONGWOOD AVENUE","40,817,741.000000",40817741,"0203cefa-32f4-ea11-b882-24ee9a37d45c","Bronx",882450001,"-73,897,876.000000",-73897876,"8","NEW SCH FOR ARTS AND SCIENCE - X","Success Academy Charter School - Bronx 3 - X380 - X039 - 84X380 - 965 LONGWOOD AVENUE"
"W/""327140186""","Classroom Closed",882450000,"5db8aaa4-aa1f-ec11-b6e6-001dd8306f41","10/4/2021","2021-10-04T04:00:00Z","052939","9/28/2021","2021-09-28T04:00:00Z","701 Fort Washington Avenue","40,857,650.000000",40857650,"6a34aa92-31f4-ea11-b882-24ee9a37d45c","Manhattan",882450000,"-73,935,231.000000",-73935231,"6","Success Academy - Washington Heights","Success Academy Charter School - Washington Heights - New York 1 - M265 - M387 - 84M265 - 701 Fort Washington Avenue"
"W/""327149315""","Classroom Closed",882450000,"058bfb5a-ae1f-ec11-b6e6-001dd8306f41","10/4/2021","2021-10-04T04:00:00Z","052966","9/28/2021","2021-09-28T04:00:00Z","91 HENDERSON AVENUE","40,641,180.000000",40641180,"97a9d9c3-32f4-ea11-b882-24ee9a37d45c","Staten Island",882450004,"-74,095,454.000000",-74095454,"31","P.S. 373 (OLD P40) - STATEN ISLAND","P.S. R373 - R373 - R040 - 75R373 - 91 HENDERSON AVENUE"
"W/""327155830""","Partial Classroom Quarantine",882450001,"cc0959bb-ae1f-ec11-b6e6-001dd8306f41","10/3/2021","2021-10-03T04:00:00Z","052970","9/28/2021","2021-09-28T04:00:00Z","179-01 90 AVENUE","40,711,295.000000",40711295,"2b7eed06-32f4-ea11-b882-24ee9a37d45c","Queens",882450003,"-73,783,283.000000",-73783283,"29","P.S. 95 - QUEENS","P.S. 095 Eastwood - Q095 - Q095 - 29Q095 - 179-01 90 AVENUE"
"W/""326725235""","Classroom Closed",882450000,"22af6a0c-b01f-ec11-b6e6-001dd8306f41","10/4/2021","2021-10-04T04:00:00Z","052980","9/28/2021","2021-09-28T04:00:00Z","91 HENDERSON AVENUE","40,641,180.000000",40641180,"97a9d9c3-32f4-ea11-b882-24ee9a37d45c","Staten Island",882450004,"-74,095,454.000000",-74095454,"31","P.S. 373 (OLD P40) - STATEN ISLAND","P.S. R373 - R373 - R040 - 75R373 - 91 HENDERSON AVENUE"
"W/""327257152""","Partial Classroom Quarantine",882450001,"d00c7c68-b11f-ec11-b6e6-001dd8306f41","10/4/2021","2021-10-04T04:00:00Z","052995","9/28/2021","2021-09-28T04:00:00Z","183 SOUTH  3 STREET","40,711,915.000000",40711915,"1feabc42-30f4-ea11-b882-24ee9a37d45c","Brooklyn",882450002,"-73,960,137.000000",-73960137,"14","J.H.S. 50 - BROOKLYN","J.H.S. 050 John D. Wells - K050 - K050 - 14K050 - 183 SOUTH  3 STREET"
"W/""326562945""","Partial Classroom Quarantine",882450001,"b1be190a-b41f-ec11-b6e6-001dd8306f41","10/3/2021","2021-10-03T04:00:00Z","053015","9/28/2021","2021-09-28T04:00:00Z","1875 EAST  17 STREET","40,604,447.000000",40604447,"56a5db98-30f4-ea11-b882-24ee9a37d45c","Brooklyn",882450002,"-73,955,217.000000",-73955217,"22","I.S. 234 - BROOKLYN","J.H.S. 234 Arthur W. Cunningham - K234 - K234 - 22K234 - 1875 EAST  17 STREET"
"W/""326534476""","Classroom Closed",882450000,"e16405f1-b51f-ec11-b6e6-001dd8306f41","10/4/2021","2021-10-04T04:00:00Z","053025","9/28/2021","2021-09-28T04:00:00Z","3-65 BEACH 56 STREET","40,594,008.000000",40594008,"85977d2b-32f4-ea11-b882-24ee9a37d45c","Queens",882450003,"-73,786,649.000000",-73786649,"27","I.S. 198 - QUEENS","Goldie Maple Academy - Q333 - Q198 - 27Q333 - 3-65 BEACH 56 STREET"
"W/""327157636""","Non-Classroom Quarantine",882450003,"e38238b1-b61f-ec11-b6e6-001dd8306f41","10/4/2021","2021-10-04T04:00:00Z","053031","9/28/2021","2021-09-28T04:00:00Z","88-13 PARSONS BOULEVARD","40,706,346.000000",40706346,"1ac73b4a-32f4-ea11-b882-24ee9a37d45c","Queens",882450003,"-73,801,370.000000",-73801370,"28","PS 182 ANNEX - QUEENS","P.S. 182 Samantha Smith - Q182 - Q278 - 28Q182 - 88-13 PARSONS BOULEVARD"
"W/""325861935""","Classroom Closed",882450000,"62d22814-bb1f-ec11-b6e6-001dd8306f41","10/3/2021","2021-10-03T04:00:00Z","053054","9/28/2021","2021-09-28T04:00:00Z","19 EAST 103 STREET","40,792,302.000000",40792302,"42005d7a-31f4-ea11-b882-24ee9a37d45c","Manhattan",882450000,"-73,951,425.000000",-73951425,"4","P.S. 171 - MANHATTAN","P.S. 171 Patrick Henry - M171 - M171 - 04M171 - 19 EAST 103 STREET"
"W/""327157912""","Partial Classroom Quarantine",882450001,"0315baac-bc1f-ec11-b6e6-001dd8306f41","10/4/2021","2021-10-04T04:00:00Z","053074","9/28/2021","2021-09-28T04:00:00Z","3117 AVENUE W","40,598,069.000000",40598069,"ecb98b86-30f4-ea11-b882-24ee9a37d45c","Brooklyn",882450002,"-73,934,163.000000",-73934163,"22","P.S. 194 - BROOKLYN","P.S. 194 Raoul Wallenberg - K194 - K194 - 22K194 - 3117 AVENUE W"
"W/""326242222""","Partial Classroom Quarantine",882450001,"2abf4934-be1f-ec11-b6e6-001dd8306f41","10/2/2021","2021-10-02T04:00:00Z","053087","9/28/2021","2021-09-28T04:00:00Z","61-15 Oceania Street","40,744,743.000000",40744743,"cfe8ce00-32f4-ea11-b882-24ee9a37d45c","Queens",882450003,"-73,766,653.000000",-73766653,"26","I.S. 74 - QUEENS","J.H.S. 074 Nathaniel Hawthorne - Q074 - Q074 - 26Q074 - 61-15 Oceania Street"
"W/""326791109""","Partial Classroom Quarantine",882450001,"0f1b8178-bf1f-ec11-b6e6-001dd8306f41","10/3/2021","2021-10-03T04:00:00Z","053100","9/28/2021","2021-09-28T04:00:00Z","400 IRVING AVENUE","40,696,457.000000",40696457,"b39c11e8-30f4-ea11-b882-24ee9a37d45c","Brooklyn",882450002,"-73,911,751.000000",-73911751,"32","BUSHWICK EDUCATIONAL CAMPUS - K","Academy for Excellence in Leadership - K403 - K480 - 32K403 - 400 IRVING AVENUE"
"W/""326094775""","Partial Classroom Quarantine",882450001,"1a6ee3a0-c11f-ec11-b6e6-001dd8306f41","10/4/2021","2021-10-04T04:00:00Z","053120","9/28/2021","2021-09-28T04:00:00Z","3109 NEWKIRK AVENUE","40,640,551.000000",40640551,"23d8cf12-31f4-ea11-b882-24ee9a37d45c","Brooklyn",882450002,"-73,947,025.000000",-73947025,"22","P.S. 361  (OLD 89) - BROOKLYN","Success Academy Charter School - Bergen Beach - New York 4 - K781 - K864 - 84K781 - 3109 NEWKIRK AVENUE"
"W/""326695878""","Classroom Closed",882450000,"672f7dc3-c31f-ec11-b6e6-001dd8306f41","10/4/2021","2021-10-04T04:00:00Z","053138","9/28/2021","2021-09-28T04:00:00Z","86-50 109 STREET","40,696,653.000000",40696653,"1d7eed06-32f4-ea11-b882-24ee9a37d45c","Queens",882450003,"-73,839,517.000000",-73839517,"27","P.S. 90 - QUEENS","P.S. 090 Horace Mann - Q090 - Q090 - 27Q090 - 86-50 109 STREET"
"W/""327158132""","Partial Classroom Quarantine",882450001,"ac59a1ef-c41f-ec11-b6e6-001dd8306f41","10/1/2021","2021-10-01T04:00:00Z","053148","9/28/2021","2021-09-28T04:00:00Z","86-35 235 COURT","40,731,853.000000",40731853,"16f32ce2-31f4-ea11-b882-24ee9a37d45c","Queens",882450003,"-73,732,290.000000",-73732290,"26","P.S. 18 - QUEENS","P.S. 018 Winchester - Q018 - Q018 - 26Q018 - 86-35 235 COURT"
"W/""327198967""","Partial Classroom Quarantine",882450001,"b6d05c22-c91f-ec11-b6e6-001dd8306f41","10/7/2021","2021-10-07T04:00:00Z","053177","9/29/2021","2021-09-29T04:00:00Z","1110 BOSTON ROAD","40,827,455.000000",40827455,"82e03d56-33f4-ea11-b882-24ee9a37d45c","Bronx",882450001,"-73,903,920.000000",-73903920,"9","MORRIS HS - X","School for Excellence - X404 - X400 - 09X404 - 1110 BOSTON ROAD"
"W/""327915987""","Partial Classroom Quarantine",882450001,"a26098e4-e51f-ec11-b6e6-001dd8306f41","10/2/2021","2021-10-02T04:00:00Z","053193","9/28/2021","2021-09-28T04:00:00Z","68-17 AUSTIN STREET","40,723,478.000000",40723478,"75977d2b-32f4-ea11-b882-24ee9a37d45c","Queens",882450003,"-73,851,700.000000",-73851700,"28","J.H.S. 190 - QUEENS","J.H.S. 190 Russell Sage - Q190 - Q190 - 28Q190 - 68-17 AUSTIN STREET"
"W/""327155270""","Partial Classroom Quarantine",882450001,"bd6098e4-e51f-ec11-b6e6-001dd8306f41","10/4/2021","2021-10-04T04:00:00Z","053194","9/28/2021","2021-09-28T04:00:00Z","222-14 JAMAICA AVENUE","40,720,617.000000",40720617,"41a10a44-32f4-ea11-b882-24ee9a37d45c","Queens",882450003,"-73,731,398.000000",-73731398,"29","P.S. /I.S 295 - QUEENS","P.S. Q177 - Q177 - Q263 - 75Q177 - 222-14 JAMAICA AVENUE"
"W/""327411420""","Non-Classroom Quarantine",882450003,"296198e4-e51f-ec11-b6e6-001dd8306f41","10/4/2021","2021-10-04T04:00:00Z","053195","9/28/2021","2021-09-28T04:00:00Z","230-17 HILLSIDE AVENUE","40,733,888.000000",40733888,"c4b66262-32f4-ea11-b882-24ee9a37d45c","Queens",882450003,"-73,739,726.000000",-73739726,"26","MARTIN VAN BUREN HS - QUEENS","P.S. Q177 - Q177 - Q435 - 75Q177 - 230-17 HILLSIDE AVENUE"
"W/""327291141""","Non-Classroom Quarantine",882450003,"a7edf2f2-4e20-ec11-b6e6-001dd8306f41","10/7/2021","2021-10-07T04:00:00Z","053203","9/29/2021","2021-09-29T04:00:00Z","85-15 143 STREET","40,710,428.000000",40710428,"d32ff20c-32f4-ea11-b882-24ee9a37d45c","Queens",882450003,"-73,812,968.000000",-73812968,"28","P.S. 117 - QUEENS","P.S. 117 J. Keld / Briarwood School - Q117 - Q117 - 28Q117 - 85-15 143 STREET"
"W/""328171744""","Partial Classroom Quarantine",882450001,"8dc1f76e-5020-ec11-b6e6-001dd8306f41","10/4/2021","2021-10-04T04:00:00Z","053209","9/30/2021","2021-09-30T04:00:00Z","4108 VICTORY BOULEVARD","40,591,546.000000",40591546,"75a9d9c3-32f4-ea11-b882-24ee9a37d45c","Staten Island",882450004,"-74,190,093.000000",-74190093,"31","P.S. 26 - STATEN ISLAND","P.S. 026 The Carteret School - R026 - R026 - 31R026 - 4108 VICTORY BOULEVARD"
"W/""327199053""","Partial Classroom Quarantine",882450001,"a606c382-5420-ec11-b6e6-001dd8306f41","10/8/2021","2021-10-08T04:00:00Z","053218","9/29/2021","2021-09-29T04:00:00Z","261 EAST 163 STREET","40,828,009.000000",40828009,"fd02cefa-32f4-ea11-b882-24ee9a37d45c","Bronx",882450001,"-73,917,705.000000",-73917705,"9","P.S. 35 - BRONX","P.S. 035 Franz Siegel - X035 - X035 - 09X035 - 261 EAST 163 STREET"
"W/""327199093""","Partial Classroom Quarantine",882450001,"d42aa385-5720-ec11-b6e6-001dd8306f41","10/3/2021","2021-10-03T04:00:00Z","053229","9/29/2021","2021-09-29T04:00:00Z","1573 MADISON AVENUE","40,793,649.000000",40793649,"98886843-31f4-ea11-b882-24ee9a37d45c","Manhattan",882450000,"-73,948,488.000000",-73948488,"4","I.S. 13 - MANHATTAN","East Harlem Scholars Academy Charter School II - M168 - M013 - 84M168 - 1573 MADISON AVENUE"
"W/""327199098""","Partial Classroom Quarantine",882450001,"e82aa385-5720-ec11-b6e6-001dd8306f41","10/3/2021","2021-10-03T04:00:00Z","053230","9/29/2021","2021-09-29T04:00:00Z","1573 MADISON AVENUE","40,793,649.000000",40793649,"98886843-31f4-ea11-b882-24ee9a37d45c","Manhattan",882450000,"-73,948,488.000000",-73948488,"4","I.S. 13 - MANHATTAN","East Harlem Scholars Academy Charter School II - M168 - M013 - 84M168 - 1573 MADISON AVENUE"
"W/""328091412""","Classroom Closed",882450000,"83a6e833-5820-ec11-b6e6-001dd8306f41","10/7/2021","2021-10-07T04:00:00Z","053231","9/30/2021","2021-09-30T04:00:00Z","1100 EAST NEW YORK AVENUE","40,665,228.000000",40665228,"d7b36d80-30f4-ea11-b882-24ee9a37d45c","Brooklyn",882450002,"-73,925,435.000000",-73925435,"17","P.S. 189 - BROOKLYN","P.S. 189 The Bilingual Center - K189 - K189 - 17K189 - 1100 EAST NEW YORK AVENUE"
"W/""327199134""","Partial Classroom Quarantine",882450001,"451ca5c2-5c20-ec11-b6e6-001dd8306f41","10/4/2021","2021-10-04T04:00:00Z","053241","9/29/2021","2021-09-29T04:00:00Z","251 MAC DOUGAL STREET","40,680,679.000000",40680679,"8503194f-30f4-ea11-b882-24ee9a37d45c","Brooklyn",882450002,"-73,910,719.000000",-73910719,"23","P.S. 73 - BROOKLYN","Brooklyn Landmark Elementary School - K599 - K073 - 23K599 - 251 MAC DOUGAL STREET"
"W/""328091422""","Partial Classroom Quarantine",882450001,"1e80be13-6220-ec11-b6e6-001dd8306f41","10/7/2021","2021-10-07T04:00:00Z","053280","9/30/2021","2021-09-30T04:00:00Z","35 Hill Street","40,622,415.000000",40622415,"46fdc1bd-32f4-ea11-b882-24ee9a37d45c","Staten Island",882450004,"-74,079,228.000000",-74079228,"31","P.S. 14 - STATEN ISLAND","P.S. 78 - R078 - R014 - 31R078 - 35 Hill Street"
"W/""327682207""","Classroom Closed",882450000,"a4ddb608-6520-ec11-b6e6-001dd8306f41","10/3/2021","2021-10-03T04:00:00Z","053302","9/29/2021","2021-09-29T04:00:00Z","144-39 GRAVETT ROAD","40,737,448.000000",40737448,"0bb7c337-32f4-ea11-b882-24ee9a37d45c","Queens",882450003,"-73,823,841.000000",-73823841,"25","P.S. 219 - QUEENS","P.S. 219 Paul Klapper - Q219 - Q219 - 25Q219 - 144-39 GRAVETT ROAD"
"W/""327748943""","Partial Classroom Quarantine",882450001,"2c8d56af-6a20-ec11-b6e6-001dd8306f41","10/4/2021","2021-10-04T04:00:00Z","053344","9/29/2021","2021-09-29T04:00:00Z","330 CROWN STREET","40,665,757.000000",40665757,"31ebaa73-30f4-ea11-b882-24ee9a37d45c","Brooklyn",882450002,"-73,949,243.000000",-73949243,"17","P.S. 161 - BROOKLYN","Success Academy Charter School - Crown Heights - K741 - K161 - 84K741 - 330 CROWN STREET"
"W/""327914378""","Partial Classroom Quarantine",882450001,"63f0d56f-6b20-ec11-b6e6-001dd8306f41","10/7/2021","2021-10-07T04:00:00Z","053351","9/29/2021","2021-09-29T04:00:00Z","439 WEST 49TH STREET","40,763,655.000000",40763655,"a9d810ab-31f4-ea11-b882-24ee9a37d45c","Manhattan",882450000,"-73,990,318.000000",-73990318,"2","HS OF GRAPHIC COMMUNICATION ARTS-M","Success Academy Charter School - Upper West - M523 - M625 - 84M523 - 439 WEST 49TH STREET"
"W/""327199310""","Partial Classroom Quarantine",882450001,"5728acdb-6e20-ec11-b6e6-001dd8306f41","10/8/2021","2021-10-08T04:00:00Z","053384","9/29/2021","2021-09-29T04:00:00Z","71-77 Clinton Avenue","40,695,389.000000",40695389,"1b68ee1e-31f4-ea11-b882-24ee9a37d45c","Brooklyn",882450002,"-73,968,759.000000",-73968759,"13","BENJAMIN BANNEKER ACADEMY-BROOKLYN","Benjamin Banneker Academy - K670 - K914 - 13K670 - 71-77 Clinton Avenue"
"W/""327199330""","Partial Classroom Quarantine",882450001,"083d2175-7120-ec11-b6e6-001dd8306f41","10/2/2021","2021-10-02T04:00:00Z","053399","9/29/2021","2021-09-29T04:00:00Z","71-77 Clinton Avenue","40,695,389.000000",40695389,"1b68ee1e-31f4-ea11-b882-24ee9a37d45c","Brooklyn",882450002,"-73,968,759.000000",-73968759,"13","BENJAMIN BANNEKER ACADEMY-BROOKLYN","Benjamin Banneker Academy - K670 - K914 - 13K670 - 71-77 Clinton Avenue"
"W/""327199527""","Classroom Closed",882450000,"64f76cd4-8620-ec11-b6e6-001dd8306f41","10/4/2021","2021-10-04T04:00:00Z","053530","9/29/2021","2021-09-29T04:00:00Z","2100 LAFONTAINE AVENUE","40,850,131.000000",40850131,"049ebaee-32f4-ea11-b882-24ee9a37d45c","Bronx",882450001,"-73,891,630.000000",-73891630,"10","P.S. 3 - BRONX","DYCD - P.S. 3 Raul Julia Micro Society - 134114-1 - 2100 LAFONTAINE AVENUE"
"W/""327199597""","Partial Classroom Quarantine",882450001,"590a94e7-8c20-ec11-b6e6-001dd8306f41","10/8/2021","2021-10-08T04:00:00Z","053567","9/29/2021","2021-09-29T04:00:00Z","330 RUGBY ROAD","40,641,340.000000",40641340,"cad27c6d-30f4-ea11-b882-24ee9a37d45c","Brooklyn",882450002,"-73,965,862.000000",-73965862,"22","P.S. 139 - BROOKLYN","P.S. 139 Alexine A. Fenty - K139 - K139 - 22K139 - 330 RUGBY ROAD"
"W/""327199618""","Partial Classroom Quarantine",882450001,"94f98e7f-8e20-ec11-b6e6-001dd8306f41","10/7/2021","2021-10-07T04:00:00Z","053575","9/29/2021","2021-09-29T04:00:00Z","333 WEST  17 STREET","40,742,512.000000",40742512,"defab455-31f4-ea11-b882-24ee9a37d45c","Manhattan",882450000,"-74,002,222.000000",-74002222,"2","I.S. 70 - MANHATTAN","N.Y.C. Museum School - M414 - M070 - 02M414 - 333 WEST  17 STREET"
"W/""327199623""","Partial Classroom Quarantine",882450001,"2952a58d-8f20-ec11-b6e6-001dd8306f41","10/8/2021","2021-10-08T04:00:00Z","053582","9/29/2021","2021-09-29T04:00:00Z","1100 NEWKIRK AVENUE","40,633,482.000000",40633482,"545bc58c-30f4-ea11-b882-24ee9a37d45c","Brooklyn",882450002,"-73,966,442.000000",-73966442,"22","P.S. 217 - BROOKLYN","P.S. 217 Colonel David Marcus School - K217 - K217 - 22K217 - 1100 NEWKIRK AVENUE"
"W/""327752660""","Partial Classroom Quarantine",882450001,"a5592950-9320-ec11-b6e6-001dd8306f41","10/7/2021","2021-10-07T04:00:00Z","053599","9/29/2021","2021-09-29T04:00:00Z","4305 FT HAMILTON PARKWAY","40,640,728.000000",40640728,"d9315367-30f4-ea11-b882-24ee9a37d45c","Brooklyn",882450002,"-73,993,247.000000",-73993247,"15","P.S. 131 - BROOKLYN","P.S. 131 Brooklyn - K131 - K131 - 15K131 - 4305 FT HAMILTON PARKWAY"
"W/""328091573""","Partial Classroom Quarantine",882450001,"6b72e39e-1821-ec11-b6e6-001dd8306f41","10/7/2021","2021-10-07T04:00:00Z","053623","9/30/2021","2021-09-30T04:00:00Z","76-05 51 AVENUE","40,737,222.000000",40737222,"c9edf392-32f4-ea11-b882-24ee9a37d45c","Queens",882450003,"-73,887,011.000000",-73887011,"24","51ST AVENUE ACADEMY - QUEENS","P.S. 007 Louis F. Simeone - Q007 - Q877 - 24Q007 - 76-05 51 AVENUE"
"W/""328091584""","Partial Classroom Quarantine",882450001,"be2e95e4-1921-ec11-b6e6-001dd8306f41","10/8/2021","2021-10-08T04:00:00Z","053627","9/30/2021","2021-09-30T04:00:00Z","1633 EAST  8 STREET","40,608,801.000000",40608801,"65a5db98-30f4-ea11-b882-24ee9a37d45c","Brooklyn",882450002,"-73,964,586.000000",-73964586,"21","P.S. 238 - BROOKLYN","P.S. K231 - K231 - K238 - 75K231 - 1633 EAST  8 STREET"
"W/""328091639""","Classroom Closed",882450000,"443350b7-1c21-ec11-b6e6-001dd8306f41","10/7/2021","2021-10-07T04:00:00Z","053642","9/30/2021","2021-09-30T04:00:00Z","32-52 37th Street","40,759,308.000000",40759308,"a4eb6056-32f4-ea11-b882-24ee9a37d45c","Queens",882450003,"-73,920,948.000000",-73920948,"30","PRE-K CENTER @37TH STREET - QUEENS","P.S. Q255 - Q255 - Q397 - 75Q255 - 32-52 37th Street"
"W/""328091669""","Partial Classroom Quarantine",882450001,"56218e7a-1e21-ec11-b6e6-001dd8306f41","10/9/2021","2021-10-09T04:00:00Z","053651","9/30/2021","2021-09-30T04:00:00Z","46-21 COLDEN STREET","40,749,430.000000",40749430,"1b06003e-32f4-ea11-b882-24ee9a37d45c","Queens",882450003,"-73,821,402.000000",-73821402,"25","J.H.S. 237 - QUEENS","I.S. 237 - Q237 - Q237 - 25Q237 - 46-21 COLDEN STREET"
"W/""328091695""","Partial Classroom Quarantine",882450001,"908bd53e-2221-ec11-b6e6-001dd8306f41","10/7/2021","2021-10-07T04:00:00Z","053662","9/30/2021","2021-09-30T04:00:00Z","91-02 88 AVENUE","40,691,467.000000",40691467,"8e8946f4-31f4-ea11-b882-24ee9a37d45c","Queens",882450003,"-73,852,792.000000",-73852792,"27","P.S. 60 - QUEENS","P.S. 060 Woodhaven - Q060 - Q060 - 27Q060 - 91-02 88 AVENUE"
"W/""328091705""","Classroom Closed",882450000,"b9d25aab-2221-ec11-b6e6-001dd8306f41","10/7/2021","2021-10-07T04:00:00Z","053664","9/30/2021","2021-09-30T04:00:00Z","165 BROWN PLACE","40,806,452.000000",40806452,"1803cefa-32f4-ea11-b882-24ee9a37d45c","Bronx",882450001,"-73,921,593.000000",-73921593,"7","P.S. 43 - BRONX","DYCD - P.S. 043 Jonas Bronck - 124110 - 165 Brown Place"
"W/""328091735""","Partial Classroom Quarantine",882450001,"b5b0972c-2421-ec11-b6e6-001dd8306f41","10/3/2021","2021-10-03T04:00:00Z","053675","9/30/2021","2021-09-30T04:00:00Z","549 AUDUBON AVENUE","40,856,532.000000",40856532,"25a6ba98-31f4-ea11-b882-24ee9a37d45c","Manhattan",882450000,"-73,926,060.000000",-73926060,"6","G. WASHINGTON HS EDUC. CAMPUS - M","Restart Academy - M973 - M465 -  - 549 AUDUBON AVENUE"
"W/""328591462""","Partial Classroom Quarantine",882450001,"9fc3db18-2621-ec11-b6e6-001dd8306f41","10/8/2021","2021-10-08T04:00:00Z","053691","10/1/2021","2021-10-01T04:00:00Z","231-02 67 AVENUE","40,747,457.000000",40747457,"f8b6c337-32f4-ea11-b882-24ee9a37d45c","Queens",882450003,"-73,745,390.000000",-73745390,"26","P.S. 213 - QUEENS","P.S. 213 The Carl Ullman School - Q213 - Q213 - 26Q213 - 231-02 67 AVENUE"
"W/""328658428""","Classroom Closed",882450000,"5291a44f-2f21-ec11-b6e6-001dd8306f41","10/9/2021","2021-10-09T04:00:00Z","053749","9/30/2021","2021-09-30T04:00:00Z","1070 Castle Hill Avenue","40,829,480.000000",40829480,"0c18b7f4-32f4-ea11-b882-24ee9a37d45c","Bronx",882450001,"-73,849,791.000000",-73849791,"8","P.S. 36 - BRONX","P.S. 036 Unionport - X036 - X036 - 08X036 - 1070 Castle Hill Avenue"
"W/""328091911""","Partial Classroom Quarantine",882450001,"4642c0f1-2f21-ec11-b6e6-001dd8306f41","10/7/2021","2021-10-07T04:00:00Z","053752","9/30/2021","2021-09-30T04:00:00Z","207 BUSHWICK AVENUE","40,708,804.000000",40708804,"e9b98b86-30f4-ea11-b882-24ee9a37d45c","Brooklyn",882450002,"-73,939,385.000000",-73939385,"14","P.S. 196 - BROOKLYN","M.S. 582 - K582 - K196 - 14K582 - 207 BUSHWICK AVENUE"
"W/""328091922""","Classroom Closed",882450000,"4abce857-3021-ec11-b6e6-001dd8306f41","10/4/2021","2021-10-04T04:00:00Z","053754","9/30/2021","2021-09-30T04:00:00Z","124 EAMES PLACE","40,869,142.000000",40869142,"36ff3d8d-33f4-ea11-b882-24ee9a37d45c","Bronx",882450001,"-73,901,821.000000",-73901821,"10","P.S. 86 ANNEX - BRONX","Luisa Pineiro Fuentes School of Science and Discovery - X307 - X886 - 10X307 - 124 EAMES PLACE"
"W/""328496054""","Partial Classroom Quarantine",882450001,"0c82f4cc-3121-ec11-b6e6-001dd8306f41","10/8/2021","2021-10-08T04:00:00Z","053766","10/1/2021","2021-10-01T04:00:00Z","330 EAST  21 STREET","40,735,879.000000",40735879,"5ee61462-31f4-ea11-b882-24ee9a37d45c","Manhattan",882450000,"-73,981,034.000000",-73981034,"2","I.S. 104 - MANHATTAN","J.H.S. 104 Simon Baruch - M104 - M104 - 02M104 - 330 EAST  21 STREET"
"W/""328409639""","Partial Classroom Quarantine",882450001,"4da7dcb0-3221-ec11-b6e6-001dd8306f41","10/8/2021","2021-10-08T04:00:00Z","053770","9/30/2021","2021-09-30T04:00:00Z","330 EAST  21 STREET","40,735,879.000000",40735879,"5ee61462-31f4-ea11-b882-24ee9a37d45c","Manhattan",882450000,"-73,981,034.000000",-73981034,"2","I.S. 104 - MANHATTAN","DYCD - JHS 104 Simon Baruch (02M104) - 142357 - 330 East   21 Street"
"W/""328092032""","Partial Classroom Quarantine",882450001,"07a279ff-3521-ec11-b6e6-001dd8306f41","10/4/2021","2021-10-04T04:00:00Z","053800","9/30/2021","2021-09-30T04:00:00Z","2780 RESERVOIR AVENUE","40,869,061.000000",40869061,"a13aa668-33f4-ea11-b882-24ee9a37d45c","Bronx",882450001,"-73,897,066.000000",-73897066,"10","WALTON HS - X","Celia Cruz Bronx High School of Music, The - X442 - X430 - 10X442 - 2780 RESERVOIR AVENUE"
"W/""328092043""","Classroom Closed",882450000,"e1cd43ea-3621-ec11-b6e6-001dd8306f41","10/8/2021","2021-10-08T04:00:00Z","053805","9/30/2021","2021-09-30T04:00:00Z","1225 69 STREET","40,624,835.000000",40624835,"08d1de79-30f4-ea11-b882-24ee9a37d45c","Brooklyn",882450002,"-74,005,205.000000",-74005205,"20","P.S. 176 - BROOKLYN","P.S. 176 Ovington - K176 - K176 - 20K176 - 1225 69 STREET"
"W/""328092073""","Classroom Closed",882450000,"824f8a28-3a21-ec11-b6e6-001dd8306f41","10/4/2021","2021-10-04T04:00:00Z","053821","9/30/2021","2021-09-30T04:00:00Z","601 STICKBALL BOULEVARD","40,818,925.000000",40818925,"f18a0044-33f4-ea11-b882-24ee9a37d45c","Bronx",882450001,"-73,856,976.000000",-73856976,"8","P.S. 182 - BRONX","P.S. 182 - X182 - X182 - 08X182 - 601 STICKBALL BOULEVARD"
"W/""328726006""","Partial Classroom Quarantine",882450001,"1a6589ca-3a21-ec11-b6e6-001dd8306f41","10/7/2021","2021-10-07T04:00:00Z","053825","10/1/2021","2021-10-01T04:00:00Z","1550 CROTONA PARK EAST","40,836,156.000000",40836156,"7e36d900-33f4-ea11-b882-24ee9a37d45c","Bronx",882450001,"-73,892,784.000000",-73892784,"12","P.S. 61 - BRONX","E.S.M.T- I.S. 190 - X190 - X061 - 12X190 - 1550 CROTONA PARK EAST"
"W/""328092118""","Classroom Closed",882450000,"6483911b-3c21-ec11-b6e6-001dd8306f41","10/9/2021","2021-10-09T04:00:00Z","053836","9/30/2021","2021-09-30T04:00:00Z","54-25 101ST STREET","40,740,033.000000",40740033,"89eb6056-32f4-ea11-b882-24ee9a37d45c","Queens",882450003,"-73,858,755.000000",-73858755,"24","PRE-K CENTER @ 54-25 101ST STREET - QUEENS","Mosaic Pre-K Center - Q331 - Q368 - 24Q331 - 54-25 101ST STREET"
"W/""328092170""","Partial Classroom Quarantine",882450001,"b8fcdfd8-4021-ec11-b6e6-001dd8306f41","10/4/2021","2021-10-04T04:00:00Z","053868","9/30/2021","2021-09-30T04:00:00Z","333 MIDLAND AVENUE","40,576,728.000000",40576728,"2b7c21b7-32f4-ea11-b882-24ee9a37d45c","Staten Island",882450004,"-74,099,685.000000",-74099685,"31","I.S. 2 - STATEN ISLAND","I.S. R002 George L. Egbert - R002 - R002 - 31R002 - 333 MIDLAND AVENUE"
"W/""328668081""","Classroom Closed",882450000,"bbf56a31-4321-ec11-b6e6-001dd8306f41","10/2/2021","2021-10-02T04:00:00Z","053884","10/1/2021","2021-10-01T04:00:00Z","178-37 146 TERRACE","40,661,427.000000",40661427,"708946f4-31f4-ea11-b882-24ee9a37d45c","Queens",882450003,"-73,767,161.000000",-73767161,"29","P.S. 52 - QUEENS","P.S. 052 Queens - Q052 - Q052 - 29Q052 - 178-37 146 TERRACE"
"W/""328092225""","Partial Classroom Quarantine",882450001,"4177871b-4621-ec11-b6e6-001dd8306f41","10/8/2021","2021-10-08T04:00:00Z","053897","9/30/2021","2021-09-30T04:00:00Z","345 CHAMBERS STREET","40,718,025.000000",40718025,"5c07e99e-31f4-ea11-b882-24ee9a37d45c","Manhattan",882450000,"-74,013,921.000000",-74013921,"2","STUYVESANT HS (NEW) - MANHATTAN","Stuyvesant High School - M475 - M477 - 02M475 - 345 CHAMBERS STREET"
"W/""328092280""","Partial Classroom Quarantine",882450001,"0cd6c06c-4f21-ec11-b6e6-001dd8306f41","9/30/2021","2021-09-30T04:00:00Z","053933","9/30/2021","2021-09-30T04:00:00Z","3750 BAYCHESTER AVENUE","40,886,002.000000",40886002,"a32aa42b-33f4-ea11-b882-24ee9a37d45c","Bronx",882450001,"-73,839,682.000000",-73839682,"11","I.S. 142 - BRONX","Baychester Middle School - X532 - X142 - 11X532 - 3750 BAYCHESTER AVENUE"
"W/""328685096""","Classroom Closed",882450000,"0e48425f-5621-ec11-b6e6-001dd8306f41","10/8/2021","2021-10-08T04:00:00Z","053979","9/30/2021","2021-09-30T04:00:00Z","1400 PENNSYLVANIA AVENUE","40,646,640.000000",40646640,"30a198c3-30f4-ea11-b882-24ee9a37d45c","Brooklyn",882450002,"-73,881,997.000000",-73881997,"19","P.S. 346 - BROOKLYN","P.S. 346 Abe Stark - K346 - K346 - 19K346 - 1400 PENNSYLVANIA AVENUE"
"W/""328720696""","Partial Classroom Quarantine",882450001,"9acb59df-5721-ec11-b6e6-001dd8306f41","10/9/2021","2021-10-09T04:00:00Z","053985","10/1/2021","2021-10-01T04:00:00Z","240 EAST 172 STREET","40,839,307.000000",40839307,"c856635c-33f4-ea11-b882-24ee9a37d45c","Bronx",882450001,"-73,911,366.000000",-73911366,"9","WILLIAM H. TAFT HS - X","Bronx High School for Medical Science - X413 - X410 - 09X413 - 240 EAST 172 STREET"
"W/""328151822""","Non-Classroom Quarantine",882450003,"ba49762f-5b21-ec11-b6e6-001dd8306f41","10/2/2021","2021-10-02T04:00:00Z","054005","9/30/2021","2021-09-30T04:00:00Z","713 CATON AVENUE","40,647,598.000000",40647598,"4488e6db-30f4-ea11-b882-24ee9a37d45c","Brooklyn",882450002,"-73,973,363.000000",-73973363,"15","P.S./I.S. 437 - BROOKLYN","DYCD - M.S. 839 - 142364 - 701 Caton Avenue"
"W/""328092341""","Partial Classroom Quarantine",882450001,"e5004ca7-5b21-ec11-b6e6-001dd8306f41","10/9/2021","2021-10-09T04:00:00Z","054008","9/30/2021","2021-09-30T04:00:00Z","400 EMPIRE BOULEVARD","40,663,605.000000",40663605,"bd79df48-30f4-ea11-b882-24ee9a37d45c","Brooklyn",882450002,"-73,949,198.000000",-73949198,"17","I.S. 61 - BROOKLYN","M.S. 061 Dr. Gladstone H. Atwell - K061 - K061 - 17K061 - 400 EMPIRE BOULEVARD"
"W/""328272353""","Partial Classroom Quarantine",882450001,"44e3a2cd-5c21-ec11-b6e6-001dd8306f41","10/8/2021","2021-10-08T04:00:00Z","054015","10/1/2021","2021-10-01T04:00:00Z","400 EMPIRE BOULEVARD","40,663,605.000000",40663605,"bd79df48-30f4-ea11-b882-24ee9a37d45c","Brooklyn",882450002,"-73,949,198.000000",-73949198,"17","I.S. 61 - BROOKLYN","M.S. 061 Dr. Gladstone H. Atwell - K061 - K061 - 17K061 - 400 EMPIRE BOULEVARD"
"W/""328252861""","Partial Classroom Quarantine",882450001,"cfb5cf87-5f21-ec11-b6e6-001dd8306f41","10/8/2021","2021-10-08T04:00:00Z","054020","10/1/2021","2021-10-01T04:00:00Z","400 EMPIRE BOULEVARD","40,663,605.000000",40663605,"bd79df48-30f4-ea11-b882-24ee9a37d45c","Brooklyn",882450002,"-73,949,198.000000",-73949198,"17","I.S. 61 - BROOKLYN","DYCD - M.S. 061 Dr. Gladstone H. Atwell - 142185 - 400 EMPIRE BOULEVARD"
"W/""328768909""","Partial Classroom Quarantine",882450001,"0178c376-de21-ec11-b6e6-001dd8306f41","10/9/2021","2021-10-09T04:00:00Z","054022","10/1/2021","2021-10-01T04:00:00Z","34 WEST 118 STREET","40,802,649.000000",40802649,"539f4974-31f4-ea11-b882-24ee9a37d45c","Manhattan",882450000,"-73,948,088.000000",-73948088,"3","P.S. 149 (TANDEM M207) - MANHATTAN","P.S. M811 - Mickey Mantle School - M811 - M149 - 75M811 - 34 WEST 118 STREET"
"W/""328195002""","Partial Classroom Quarantine",882450001,"fdb2661f-df21-ec11-b6e6-001dd8306f41","10/9/2021","2021-10-09T04:00:00Z","054023","10/1/2021","2021-10-01T04:00:00Z","80 WILLOWBROOK ROAD","40,623,077.000000",40623077,"2f0410ca-32f4-ea11-b882-24ee9a37d45c","Staten Island",882450004,"-74,145,522.000000",-74145522,"31","I.S. 51 - STATEN ISLAND","I.S. 051 Edwin Markham - R051 - R051 - 31R051 - 80 WILLOWBROOK ROAD"
"W/""328746574""","Partial Classroom Quarantine",882450001,"3c44b039-e321-ec11-b6e6-001dd8306f41","10/8/2021","2021-10-08T04:00:00Z","054039","10/1/2021","2021-10-01T04:00:00Z","18-25 212 STREET","40,782,331.000000",40782331,"820e6e25-32f4-ea11-b882-24ee9a37d45c","Queens",882450003,"-73,778,430.000000",-73778430,"25","P.S. 169 - QUEENS","BELL Academy - Q294 - Q169 - 25Q294 - 18-25 212 STREET"
"W/""328747822""","Partial Classroom Quarantine",882450001,"e0ea1d88-e321-ec11-b6e6-001dd8306f41","10/9/2021","2021-10-09T04:00:00Z","054043","10/1/2021","2021-10-01T04:00:00Z","220 HENRY STREET","40,713,362.000000",40713362,"affab455-31f4-ea11-b882-24ee9a37d45c","Manhattan",882450000,"-73,986,051.000000",-73986051,"1","J.H.S. 56 - MANHATTAN","Orchard Collegiate Academy - M292 - M056 - 01M292 - 220 HENRY STREET"
"W/""328775648""","Partial Classroom Quarantine",882450001,"d46fb936-ea21-ec11-b6e6-001dd8306f41","10/9/2021","2021-10-09T04:00:00Z","054067","10/1/2021","2021-10-01T04:00:00Z","108-29 155 STREET","40,693,736.000000",40693736,"0ec73b4a-32f4-ea11-b882-24ee9a37d45c","Queens",882450003,"-73,796,358.000000",-73796358,"28","THE WILLIAM WORDSWORTH EDUCATIONAL COMPLEX","David N. Dinkins School - Q048 - Q276 - 28Q048 - 108-29 155 STREET"
"W/""328468483""","No Intervention",882450002,"e6bcb07e-ec21-ec11-b6e6-001dd8306f41","10/1/2021","2021-10-01T04:00:00Z","054072","9/30/2021","2021-09-30T04:00:00Z","232 BARLOW AVENUE","40,557,900.000000",40557900,"80a9d9c3-32f4-ea11-b882-24ee9a37d45c","Staten Island",882450004,"-74,155,400.000000",-74155400,"31","P.S. 32 - STATEN ISLAND","P.S. 032 The Gifford School - R032 - R032 - 31R032 - 232 BARLOW AVENUE"
"W/""328801614""","Partial Classroom Quarantine",882450001,"4c19c3cb-ee21-ec11-b6e6-001dd8306f41","10/7/2021","2021-10-07T04:00:00Z","054079","10/1/2021","2021-10-01T04:00:00Z","35 STARR STREET","40,700,810.000000",40700810,"18e85c61-30f4-ea11-b882-24ee9a37d45c","Brooklyn",882450002,"-73,927,938.000000",-73927938,"32","I.S. 111 - BROOKLYN","I.S. 349 Math, Science & Tech. - K349 - K111 - 32K349 - 35 STARR STREET"
"W/""328495163""","Partial Classroom Quarantine",882450001,"f8193fa2-f021-ec11-b6e6-001dd8306f41","10/8/2021","2021-10-08T04:00:00Z","054086","10/1/2021","2021-10-01T04:00:00Z","2424 BATCHELDER STREET","40,593,232.000000",40593232,"eef57030-30f4-ea11-b882-24ee9a37d45c","Brooklyn",882450002,"-73,938,107.000000",-73938107,"22","I.S. 14 - BROOKLYN","J.H.S. 014 Shell Bank - K014 - K014 - 22K014 - 2424 BATCHELDER STREET"
"W/""328589457""","Partial Classroom Quarantine",882450001,"a89c1d33-f121-ec11-b6e6-001dd8306f41","10/9/2021","2021-10-09T04:00:00Z","054093","10/1/2021","2021-10-01T04:00:00Z","29 FT GREENE PLACE","40,688,896.000000",40688896,"3188e6db-30f4-ea11-b882-24ee9a37d45c","Brooklyn",882450002,"-73,976,435.000000",-73976435,"13","BROOKLYN TECH HS - K","Brooklyn Technical High School - K430 - K430 - 13K430 - 29 FT GREENE PLACE"
"W/""328750037""","Classroom Closed",882450000,"d70a1d39-f121-ec11-b6e6-001dd8306f41","10/9/2021","2021-10-09T04:00:00Z","054094","10/1/2021","2021-10-01T04:00:00Z","4108 VICTORY BOULEVARD","40,591,546.000000",40591546,"75a9d9c3-32f4-ea11-b882-24ee9a37d45c","Staten Island",882450004,"-74,190,093.000000",-74190093,"31","P.S. 26 - STATEN ISLAND","P.S. 026 The Carteret School - R026 - R026 - 31R026 - 4108 VICTORY BOULEVARD"
"W/""328540305""","Classroom Closed",882450000,"bd556159-f221-ec11-b6e6-001dd8306f41","10/9/2021","2021-10-09T04:00:00Z","054105","10/1/2021","2021-10-01T04:00:00Z","23-70 31 STREET","40,773,126.000000",40773126,"0a7eed06-32f4-ea11-b882-24ee9a37d45c","Queens",882450003,"-73,915,039.000000",-73915039,"30","P.S. 85 - QUEENS","P.S. 085 Judge Charles Vallone - Q085 - Q085 - 30Q085 - 23-70 31 STREET"
"W/""328770305""","Partial Classroom Quarantine",882450001,"3c750c1b-f621-ec11-b6e6-001dd8306f41","10/10/2021","2021-10-10T04:00:00Z","054122","10/1/2021","2021-10-01T04:00:00Z","183 SOUTH  3 STREET","40,711,915.000000",40711915,"1feabc42-30f4-ea11-b882-24ee9a37d45c","Brooklyn",882450002,"-73,960,137.000000",-73960137,"14","J.H.S. 50 - BROOKLYN","J.H.S. 050 John D. Wells - K050 - K050 - 14K050 - 183 SOUTH  3 STREET"
"W/""328685341""","Partial Classroom Quarantine",882450001,"8cb14758-fe21-ec11-b6e6-001dd8306f41","10/4/2021","2021-10-04T04:00:00Z","054158","10/1/2021","2021-10-01T04:00:00Z","1581 VICTORY BOULEVARD","40,614,039.000000",40614039,"7ba9d9c3-32f4-ea11-b882-24ee9a37d45c","Staten Island",882450004,"-74,116,197.000000",-74116197,"31","P.S. 29 - STATEN ISLAND","P.S. 029 Bardwell - R029 - R029 - 31R029 - 1581 VICTORY BOULEVARD"
"W/""328723850""","Partial Classroom Quarantine",882450001,"b4cb66ba-ff21-ec11-b6e6-001dd8306f41","10/4/2021","2021-10-04T04:00:00Z","054168","10/1/2021","2021-10-01T04:00:00Z","1581 VICTORY BOULEVARD","40,614,039.000000",40614039,"7ba9d9c3-32f4-ea11-b882-24ee9a37d45c","Staten Island",882450004,"-74,116,197.000000",-74116197,"31","P.S. 29 - STATEN ISLAND","P.S. 029 Bardwell - R029 - R029 - 31R029 - 1581 VICTORY BOULEVARD"
"W/""328506387""","No Intervention",882450002,"4d5faae4-ff21-ec11-b6e6-001dd8306f41","10/1/2021","2021-10-01T04:00:00Z","054170","9/30/2021","2021-09-30T04:00:00Z","1855 STILLWELL AVENUE","40,601,191.000000",40601191,"cd0d3c5b-30f4-ea11-b882-24ee9a37d45c","Brooklyn",882450002,"-73,985,570.000000",-73985570,"21","P.S. 97 - BROOKLYN","P.S. 97 The Highlawn - K097 - K097 - 21K097 - 1855 STILLWELL AVENUE"
"W/""328761482""","Partial Classroom Quarantine",882450001,"d483be3e-0022-ec11-b6e6-001dd8306f41","10/9/2021","2021-10-09T04:00:00Z","054173","10/1/2021","2021-10-01T04:00:00Z","4011 FILLMORE AVENUE","40,613,981.000000",40613981,"17ba8b86-30f4-ea11-b882-24ee9a37d45c","Brooklyn",882450002,"-73,930,485.000000",-73930485,"22","P.S. 207 - BROOKLYN","P.S. 207 Elizabeth G. Leary - K207 - K207 - 22K207 - 4011 FILLMORE AVENUE"
"W/""328605749""","No Intervention",882450002,"05e84c71-0422-ec11-b6e6-001dd8306f41","10/1/2021","2021-10-01T04:00:00Z","054194","9/30/2021","2021-09-30T04:00:00Z","750 BAYCHESTER AVENUE","40,874,035.000000",40874035,"8253dd74-33f4-ea11-b882-24ee9a37d45c","Bronx",882450001,"-73,831,669.000000",-73831669,"11","HARRY S. TRUMAN HS - X","Bronx Health Sciences High School - X249 - X455 - 11X249 - 750 BAYCHESTER AVENUE"
"W/""328815964""","Partial Classroom Quarantine",882450001,"0d3c68a2-0e22-ec11-b6e6-001dd8306f41","10/1/2021","2021-10-01T04:00:00Z","054240","10/1/2021","2021-10-01T04:00:00Z","105 TECH PLACE","40,695,444.000000",40695444,"d33159fa-30f4-ea11-b882-24ee9a37d45c","Brooklyn",882450002,"-73,986,105.000000",-73986105,"13","GEORGE WESTINGHOUSE VOC HS - K","George Westinghouse Career and Technical Education High School - K605 - K580 - 13K605 - 105 TECH PLACE"
"W/""328803553""","Classroom Closed",882450000,"07341ff5-1e22-ec11-b6e6-001dd8306f41","10/10/2021","2021-10-10T04:00:00Z","054313","10/1/2021","2021-10-01T04:00:00Z","29-66 137 STREET","40,769,752.000000",40769752,"2d06003e-32f4-ea11-b882-24ee9a37d45c","Queens",882450003,"-73,832,005.000000",-73832005,"25","P.S. 242 - (ECC) - QUEENS","P.S. 242 Leonard P. Stavisky Early Childhood School - Q242 - Q242 - 25Q242 - 29-66 137 STREET"
"W/""323020697""","Partial Classroom Quarantine",882450001,"e8412596-f41a-ec11-b6e6-001dd830865f","10/1/2021","2021-10-01T04:00:00Z","051290","9/22/2021","2021-09-22T04:00:00Z","63-25 MAIN STREET","40,737,448.000000",40737448,"bab66262-32f4-ea11-b882-24ee9a37d45c","Queens",882450003,"-73,823,841.000000",-73823841,"25","JOHN BOWNE HS - QUEENS","John Bowne High School - Q425 - Q425 - 25Q425 - 63-25 MAIN STREET"
"W/""323016803""","Partial Classroom Quarantine",882450001,"9969920f-991b-ec11-b6e6-001dd830865f","10/1/2021","2021-10-01T04:00:00Z","051425","9/23/2021","2021-09-23T04:00:00Z","46-21 COLDEN STREET","40,749,430.000000",40749430,"1b06003e-32f4-ea11-b882-24ee9a37d45c","Queens",882450003,"-73,821,402.000000",-73821402,"25","J.H.S. 237 - QUEENS","I.S. 237 - Q237 - Q237 - 25Q237 - 46-21 COLDEN STREET"
"W/""322898116""","Partial Classroom Quarantine",882450001,"a5967243-a51b-ec11-b6e6-001dd830865f","10/2/2021","2021-10-02T04:00:00Z","051480","9/23/2021","2021-09-23T04:00:00Z","46-21 COLDEN STREET","40,749,430.000000",40749430,"1b06003e-32f4-ea11-b882-24ee9a37d45c","Queens",882450003,"-73,821,402.000000",-73821402,"25","J.H.S. 237 - QUEENS","I.S. 237 - Q237 - Q237 - 25Q237 - 46-21 COLDEN STREET"
"W/""322967975""","Classroom Closed",882450000,"a5786fe3-ae1b-ec11-b6e6-001dd830865f","10/2/2021","2021-10-02T04:00:00Z","051525","9/23/2021","2021-09-23T04:00:00Z","2023 PACIFIC STREET","40,676,312.000000",40676312,"3fde261e-4afb-ea11-b883-24ee9a37d459",,,"-73,921,046.000000",-73921046,"16","SHIRLEY CHISHOLM DAY CARE CENTER SITE 1","SHIRLEY CHISHOLM DAY CARE CENTER SITE 1 - KBNT - KBNT -  - 2023 PACIFIC STREET"
"W/""322974507""","Partial Classroom Quarantine",882450001,"a8e8f117-ba1b-ec11-b6e6-001dd830865f","10/1/2021","2021-10-01T04:00:00Z","051581","9/24/2021","2021-09-24T04:00:00Z","101 WALTON STREET","40,703,034.000000",40703034,"9de657bd-30f4-ea11-b882-24ee9a37d45c","Brooklyn",882450002,"-73,948,771.000000",-73948771,"14","I.S. 318 - BROOKLYN","I.S. 318 Eugenio Maria De Hostos - K318 - K318 - 14K318 - 101 WALTON STREET"
"W/""322997612""","Classroom Closed",882450000,"c998d5ec-c41b-ec11-b6e6-001dd830865f","10/1/2021","2021-10-01T04:00:00Z","051635","9/23/2021","2021-09-23T04:00:00Z","153-23 83 STREET","40,665,408.000000",40665408,"1106003e-32f4-ea11-b882-24ee9a37d45c","Queens",882450003,"-73,850,622.000000",-73850622,"27","P.S. 232 - QUEENS","P.S. 232 Lindenwood - Q232 - Q232 - 27Q232 - 153-23 83 STREET"
"W/""322965364""","Partial Classroom Quarantine",882450001,"2575e2cf-ce1b-ec11-b6e6-001dd830865f","10/2/2021","2021-10-02T04:00:00Z","051681","9/23/2021","2021-09-23T04:00:00Z","283 ADAMS STREET","40,694,629.000000",40694629,"82e657bd-30f4-ea11-b882-24ee9a37d45c","Brooklyn",882450002,"-73,988,323.000000",-73988323,"13","ADAMS STREET EDUCATIONAL CAMPUS - K","Urban Assembly Institute of Math and Science for Young Women - K527 - K313 - 13K527 - 283 ADAMS STREET"
"W/""322110140""","Non-Classroom Quarantine",882450003,"d5d476e3-d51b-ec11-b6e6-001dd830865f","10/1/2021","2021-10-01T04:00:00Z","051719","9/24/2021","2021-09-24T04:00:00Z","280 RIVERDALE AVENUE","40,661,009.000000",40661009,"27217b48-4afb-ea11-b883-24ee9a37d459",,,"-73,906,124.000000",-73906124,"23","SALVATION ARMY BROWNSVILLE DAY CARE CENTER","SALVATION ARMY BROWNSVILLE DAY CARE CENTER - KBRT - KBRT -  - 280 RIVERDALE AVENUE"
"W/""320790241""","Partial Classroom Quarantine",882450001,"c2a35be8-d81b-ec11-b6e6-001dd830865f","10/1/2021","2021-10-01T04:00:00Z","051725","9/23/2021","2021-09-23T04:00:00Z","171-10 Linden Boulevard","40,691,720.000000",40691720,"9172c880-32f4-ea11-b882-24ee9a37d45c","Queens",882450003,"-73,778,924.000000",-73778924,"29","EAGLE ACADEMY - QUEENS","Eagle Academy for Young Men III - Q327 - Q633 - 29Q327 - 171-10 Linden Boulevard"
"W/""323001278""","Partial Classroom Quarantine",882450001,"8bb1cf54-d91b-ec11-b6e6-001dd830865f","10/1/2021","2021-10-01T04:00:00Z","051728","9/23/2021","2021-09-23T04:00:00Z","1300 GREENE AVENUE","40,697,898.000000",40697898,"1de2abc9-30f4-ea11-b882-24ee9a37d45c","Brooklyn",882450002,"-73,919,088.000000",-73919088,"32","I.S. 383 - BROOKLYN","J.H.S. 383 Philippa Schuyler - K383 - K383 - 32K383 - 1300 GREENE AVENUE"
"W/""322110195""","Classroom Closed",882450000,"c2eed9ab-601c-ec11-b6e6-001dd830865f","10/1/2021","2021-10-01T04:00:00Z","051752","9/24/2021","2021-09-24T04:00:00Z","1625 11 AVENUE","40,657,002.000000",40657002,"fbd27c6d-30f4-ea11-b882-24ee9a37d45c","Brooklyn",882450002,"-73,975,967.000000",-73975967,"15","P.S. 154 - BROOKLYN","The Windsor Terrace School - K154 - K154 - 15K154 - 1625 11 AVENUE"
"W/""322973583""","Classroom Closed",882450000,"d9a0422d-611c-ec11-b6e6-001dd830865f","10/1/2021","2021-10-01T04:00:00Z","051753","9/24/2021","2021-09-24T04:00:00Z","1625 11 AVENUE","40,657,002.000000",40657002,"fbd27c6d-30f4-ea11-b882-24ee9a37d45c","Brooklyn",882450002,"-73,975,967.000000",-73975967,"15","P.S. 154 - BROOKLYN","The Windsor Terrace School - K154 - K154 - 15K154 - 1625 11 AVENUE"
"W/""323622768""","Partial Classroom Quarantine",882450001,"1907f4b6-661c-ec11-b6e6-001dd830865f","10/1/2021","2021-10-01T04:00:00Z","051772","9/25/2021","2021-09-25T04:00:00Z","229-02 137 AVENUE","40,672,259.000000",40672259,"e69b4c1f-32f4-ea11-b882-24ee9a37d45c","Queens",882450003,"-73,743,327.000000",-73743327,"29","P.S. 156 - QUEENS","Queens United Middle School - Q289 - Q156 - 29Q289 - 229-02 137 AVENUE"
"W/""322978819""","Partial Classroom Quarantine",882450001,"c5444f3c-691c-ec11-b6e6-001dd830865f","10/1/2021","2021-10-01T04:00:00Z","051786","9/24/2021","2021-09-24T04:00:00Z","63-25 MAIN STREET","40,737,448.000000",40737448,"bab66262-32f4-ea11-b882-24ee9a37d45c","Queens",882450003,"-73,823,841.000000",-73823841,"25","JOHN BOWNE HS - QUEENS","John Bowne High School - Q425 - Q425 - 25Q425 - 63-25 MAIN STREET"
"W/""325765563""","Classroom Closed",882450000,"8c2ede67-691c-ec11-b6e6-001dd830865f","10/1/2021","2021-10-01T04:00:00Z","051788","9/24/2021","2021-09-24T04:00:00Z","141 EAST 111 STREET","40,796,098.000000",40796098,"50e61462-31f4-ea11-b882-24ee9a37d45c","Manhattan",882450000,"-73,944,546.000000",-73944546,"4","P.S. 101 - MANHATTAN","Mosaic Preparatory Academy - M375 - M101 - 04M375 - 141 EAST 111 STREET"
"W/""324600165""","Partial Classroom Quarantine",882450001,"f985b107-6a1c-ec11-b6e6-001dd830865f","10/3/2021","2021-10-03T04:00:00Z","051790","9/24/2021","2021-09-24T04:00:00Z","167-01 GOTHIC DRIVE","40,714,551.000000",40714551,"1f02926e-32f4-ea11-b882-24ee9a37d45c","Queens",882450003,"-73,798,658.000000",-73798658,"28","JAMAICA HS - Q","Queens Collegiate: A College Board School - Q310 - Q470 - 28Q310 - 167-01 GOTHIC DRIVE"
"W/""322874215""","Classroom Closed",882450000,"c0cfc357-6b1c-ec11-b6e6-001dd830865f","10/2/2021","2021-10-02T04:00:00Z","051799","9/24/2021","2021-09-24T04:00:00Z","144-39 GRAVETT ROAD","40,737,448.000000",40737448,"0bb7c337-32f4-ea11-b882-24ee9a37d45c","Queens",882450003,"-73,823,841.000000",-73823841,"25","P.S. 219 - QUEENS","P.S. 219 Paul Klapper - Q219 - Q219 - 25Q219 - 144-39 GRAVETT ROAD"
"W/""322984970""","Partial Classroom Quarantine",882450001,"82d3a782-701c-ec11-b6e6-001dd830865f","10/1/2021","2021-10-01T04:00:00Z","051831","9/24/2021","2021-09-24T04:00:00Z","350 5 AVENUE","40,672,358.000000",40672358,"28eabc42-30f4-ea11-b882-24ee9a37d45c","Brooklyn",882450002,"-73,985,050.000000",-73985050,"15","I.S. 51 - BROOKLYN","M.S. 51 William Alexander - K051 - K051 - 15K051 - 350 5 AVENUE"
"W/""323114975""","Classroom Closed",882450000,"3993e8e2-701c-ec11-b6e6-001dd830865f","10/1/2021","2021-10-01T04:00:00Z","051832","9/24/2021","2021-09-24T04:00:00Z","55-20 METROPOLITAN AVENUE","40,713,030.000000",40713030,"24c73b4a-32f4-ea11-b882-24ee9a37d45c","Queens",882450003,"-73,908,307.000000",-73908307,"24","THE GERALDINE FERRARO CAMPUS - QUEENS","A.C.E. Academy for Scholars at the Geraldine Ferraro Campus - Q290 - Q290 - 24Q290 - 55-20 METROPOLITAN AVENUE"
"W/""323289544""","Partial Classroom Quarantine",882450001,"4553bddd-721c-ec11-b6e6-001dd830865f","10/1/2021","2021-10-01T04:00:00Z","051847","9/25/2021","2021-09-25T04:00:00Z","100 AMSTERDAM AVENUE","40,774,202.000000",40774202,"7207e99e-31f4-ea11-b882-24ee9a37d45c","Manhattan",882450000,"-73,985,976.000000",-73985976,"3","FIORELLO LAGUARDIA HS - MANHATTAN","Fiorello H. LaGuardia High School of Music & Art and Performing Arts - M485 - M485 - 03M485 - 100 AMSTERDAM AVENUE"
"W/""322998457""","Partial Classroom Quarantine",882450001,"329e9e11-741c-ec11-b6e6-001dd830865f","10/1/2021","2021-10-01T04:00:00Z","051859","9/24/2021","2021-09-24T04:00:00Z","35-59 81ST STREET","40,749,934.000000",40749934,"d511f898-32f4-ea11-b882-24ee9a37d45c","Queens",882450003,"-73,884,817.000000",-73884817,"30","RENAISSANCE CHARTER SCHOOL - Q","Renaissance Charter School - Q705 - Q885 - 84Q705 - 35-59 81ST STREET"
"W/""322889689""","Classroom Closed",882450000,"ced5d4a5-741c-ec11-b6e6-001dd830865f","10/2/2021","2021-10-02T04:00:00Z","051862","9/24/2021","2021-09-24T04:00:00Z","990 DEKALB AVENUE","40,692,866.000000",40692866,"9303194f-30f4-ea11-b882-24ee9a37d45c","Brooklyn",882450002,"-73,935,123.000000",-73935123,"16","P.S. 81 - BROOKLYN","P.S. K004 - K004 - K081 - 75K004 - 990 DEKALB AVENUE"
"W/""324126202""","Partial Classroom Quarantine",882450001,"20606a52-771c-ec11-b6e6-001dd830865f","10/2/2021","2021-10-02T04:00:00Z","051880","9/25/2021","2021-09-25T04:00:00Z","120 West  30 Street","40,747,425.000000",40747425,"f7ed94c3-31f4-ea11-b882-24ee9a37d45c","Manhattan",882450000,"-73,990,562.000000",-73990562,"2","SATELLITE ACADEMY - MANHATTAN","Satellite Academy High School - M570 - M920 - 02M570 - 120 West  30 Street"
"W/""323289590""","Classroom Closed",882450000,"668faa6a-7b1c-ec11-b6e6-001dd830865f","10/2/2021","2021-10-02T04:00:00Z","051907","9/25/2021","2021-09-25T04:00:00Z","2185 BATHGATE AVENUE","40,853,141.000000",40853141,"7936d900-33f4-ea11-b882-24ee9a37d45c","Bronx",882450001,"-73,893,639.000000",-73893639,"10","P.S. 59 - BRONX","P.S. 059 The Community School of Technology - X059 - X059 - 10X059 - 2185 BATHGATE AVENUE"
"W/""322110674""","Classroom Closed",882450000,"8bab6451-7e1c-ec11-b6e6-001dd830865f","10/3/2021","2021-10-03T04:00:00Z","051928","9/24/2021","2021-09-24T04:00:00Z","317 Hoyt Street","40,680,159.000000",40680159,"f41aad3c-30f4-ea11-b882-24ee9a37d45c","Brooklyn",882450002,"-73,991,141.000000",-73991141,"15","P.S. 32 - BROOKLYN","P.S. 032 Samuel Mills Sprole - K032 - K032 - 15K032 - 317 Hoyt Street"
"W/""322902943""","Classroom Closed",882450000,"333615a1-8e1c-ec11-b6e6-001dd830865f","10/2/2021","2021-10-02T04:00:00Z","052010","9/24/2021","2021-09-24T04:00:00Z","133-28 117 Street","40,672,392.000000",40672392,"604b1366-f7fe-eb11-b8b3-24ee9a37d45c",,,"-73,822,275.000000",-73822275,"27","133-28 117th Street","Ana M Genao- Pitter Patter Child Care - 1st Fl - QCHR - QCHR -  - 133-28 117 Street"
"W/""328145238""","Classroom Closed",882450000,"76348dfb-901c-ec11-b6e6-001dd830865f","10/3/2021","2021-10-03T04:00:00Z","052022","9/25/2021","2021-09-25T04:00:00Z","70 EAST 129 STREET","40,807,581.000000",40807581,"7a3eb8c9-31f4-ea11-b882-24ee9a37d45c","Manhattan",882450000,"-73,937,717.000000",-73937717,"5","THE CHILDREN'S STOREFRONT","Storefront Academy Harlem Charter School - M383 - MABT - 84M383 - 70 EAST 129 STREET"
"W/""323673029""","Classroom Closed",882450000,"c8bfc332-921c-ec11-b6e6-001dd830865f","10/2/2021","2021-10-02T04:00:00Z","052029","9/24/2021","2021-09-24T04:00:00Z","609 JACKSON AVENUE","40,814,952.000000",40814952,"f2de94be-33f4-ea11-b882-24ee9a37d45c","Bronx",882450001,"-73,908,773.000000",-73908773,"7","Storefront Jackson Avenue","Storefront Academy Charter School - X497 - XBBX - 84X497 - 609 JACKSON AVENUE"
"W/""324136191""","Partial Classroom Quarantine",882450001,"20cef022-961c-ec11-b6e6-001dd830865f","10/1/2021","2021-10-01T04:00:00Z","052052","9/24/2021","2021-09-24T04:00:00Z","330 EAST  21 STREET","40,735,879.000000",40735879,"5ee61462-31f4-ea11-b882-24ee9a37d45c","Manhattan",882450000,"-73,981,034.000000",-73981034,"2","I.S. 104 - MANHATTAN","J.H.S. 104 Simon Baruch - M104 - M104 - 02M104 - 330 EAST  21 STREET"
"W/""322880106""","Classroom Closed",882450000,"b8b8d57f-991c-ec11-b6e6-001dd830865f","10/2/2021","2021-10-02T04:00:00Z","052068","9/24/2021","2021-09-24T04:00:00Z","43-18 97TH PLACE","40,745,995.000000",40745995,"de454b50-32f4-ea11-b882-24ee9a37d45c","Queens",882450003,"-73,866,372.000000",-73866372,"24","P.S. 315 - Queens","P.S. 110 - Q110 - Q315 - 24Q110 - 43-18 97TH PLACE"
"W/""324209506""","Partial Classroom Quarantine",882450001,"17b7d2a5-9a1c-ec11-b6e6-001dd830865f","10/2/2021","2021-10-02T04:00:00Z","052073","9/24/2021","2021-09-24T04:00:00Z","921 EAST 228TH STREET","40,888,242.000000",40888242,"6ce03d56-33f4-ea11-b882-24ee9a37d45c","Bronx",882450001,"-73,852,714.000000",-73852714,"11","I.S./H.S. 362 - BRONX","Academy for Scholarship and Entrepreneurship: A College Board School - X270 - X362 - 11X270 - 921 EAST 228TH STREET"
"W/""324123058""","Classroom Closed",882450000,"17259c38-9b1c-ec11-b6e6-001dd830865f","10/3/2021","2021-10-03T04:00:00Z","052076","9/25/2021","2021-09-25T04:00:00Z","106-02 NORTHERN BOULEVARD","40,757,755.000000",40757755,"84e2635c-32f4-ea11-b882-24ee9a37d45c","Queens",882450003,"-73,862,659.000000",-73862659,"24","PRE-K CENTER @NORTHERN BOULEVARD - QUEENS","Mosaic Pre-K Center - Q331 - Q414 - 24Q331 - 106-02 NORTHERN BOULEVARD"
"W/""322110961""","Classroom Closed",882450000,"9fe65dc5-9c1c-ec11-b6e6-001dd830865f","10/3/2021","2021-10-03T04:00:00Z","052084","9/24/2021","2021-09-24T04:00:00Z","245 Simonson Avenue","40,630,439.000000",40630439,"aec9a854-4afb-ea11-b883-24ee9a37d459",,,"-74,152,138.000000",-74152138,"31","4 Angels","4 Angels Day Care, Inc. - RAEW - RAEW -  - 245 Simonson Avenue"
"W/""324127662""","Classroom Closed",882450000,"ae232b1e-9f1c-ec11-b6e6-001dd830865f","10/1/2021","2021-10-01T04:00:00Z","052093","9/25/2021","2021-09-25T04:00:00Z","75-02 162 STREET","40,726,473.000000",40726473,"d69b4c1f-32f4-ea11-b882-24ee9a37d45c","Queens",882450003,"-73,807,750.000000",-73807750,"25","P.S. 154 - QUEENS","P.S. 154 Queens - Q154 - Q154 - 25Q154 - 75-02 162 STREET"
"W/""323409817""","Classroom Closed",882450000,"9c6e2f3c-9f1c-ec11-b6e6-001dd830865f","10/3/2021","2021-10-03T04:00:00Z","052094","9/24/2021","2021-09-24T04:00:00Z","499 EAST 175 STREET","40,844,728.000000",40844728,"deab074a-33f4-ea11-b882-24ee9a37d45c","Bronx",882450001,"-73,898,593.000000",-73898593,"9","P.S. 236 ANNEX - BRONX","P.S. 163 Arthur A. Schomburg - X163 - X236 - 09X163 - 499 EAST 175 STREET"
"W/""322925780""","Classroom Closed",882450000,"62d968b7-9f1c-ec11-b6e6-001dd830865f","10/3/2021","2021-10-03T04:00:00Z","052098","9/24/2021","2021-09-24T04:00:00Z","499 EAST 175 STREET","40,844,728.000000",40844728,"deab074a-33f4-ea11-b882-24ee9a37d45c","Bronx",882450001,"-73,898,593.000000",-73898593,"9","P.S. 236 ANNEX - BRONX","P.S. 163 Arthur A. Schomburg - X163 - X236 - 09X163 - 499 EAST 175 STREET"
"W/""324820483""","Partial Classroom Quarantine",882450001,"d4220527-a01c-ec11-b6e6-001dd830865f","10/3/2021","2021-10-03T04:00:00Z","052101","9/24/2021","2021-09-24T04:00:00Z","223 GRAHAM AVENUE","40,709,765.000000",40709765,"14eabc42-30f4-ea11-b882-24ee9a37d45c","Brooklyn",882450002,"-73,944,463.000000",-73944463,"14","I.S. 49 - BROOKLYN","Lyons Community School - K586 - K049 - 14K586 - 223 GRAHAM AVENUE"
"W/""322751125""","Partial Classroom Quarantine",882450001,"a50180d1-a01c-ec11-b6e6-001dd830865f","10/1/2021","2021-10-01T04:00:00Z","052106","9/24/2021","2021-09-24T04:00:00Z","965 EAST 107TH STREET","40,647,396.000000",40647396,"08e2abc9-30f4-ea11-b882-24ee9a37d45c","Brooklyn",882450002,"-73,891,743.000000",-73891743,"18","SHIRLEY CHISHOLM CAMPUS - K","The Science And Medicine Middle School - K366 - K366 - 18K366 - 965 EAST 107TH STREET"
"W/""322111002""","Partial Classroom Quarantine",882450001,"8f26812b-a11c-ec11-b6e6-001dd830865f","10/2/2021","2021-10-02T04:00:00Z","052108","9/24/2021","2021-09-24T04:00:00Z","1390 Willoughby Avenue","40,706,816.000000",40706816,"39ebaa73-30f4-ea11-b882-24ee9a37d45c","Brooklyn",882450002,"-73,919,643.000000",-73919643,"32","I.S. 162 - BROOKLYN","J.H.S. 162 The Willoughby - K162 - K162 - 32K162 - 1390 Willoughby Avenue"
"W/""323289762""","Partial Classroom Quarantine",882450001,"ec1163fd-a91c-ec11-b6e6-001dd830865f","10/1/2021","2021-10-01T04:00:00Z","052142","9/25/2021","2021-09-25T04:00:00Z","46 MCKEEVER PLACE","40,665,199.000000",40665199,"a1e657bd-30f4-ea11-b882-24ee9a37d45c","Brooklyn",882450002,"-73,959,484.000000",-73959484,"17","P.S. 375 - BROOKLYN","DYCD - Ebbets Field Middle School - 142186 - 46 Mc Keever Place"
"W/""324123587""","Classroom Closed",882450000,"6e97ce93-271d-ec11-b6e6-001dd830865f","10/3/2021","2021-10-03T04:00:00Z","052144","9/25/2021","2021-09-25T04:00:00Z","33-09 35 AVENUE","40,757,497.000000",40757497,"7a0e6e25-32f4-ea11-b882-24ee9a37d45c","Queens",882450003,"-73,926,249.000000",-73926249,"30","P.S. 166 - QUEENS","P.S. 166 Henry Gradstein - Q166 - Q166 - 30Q166 - 33-09 35 AVENUE"
"W/""323289781""","Classroom Closed",882450000,"96fcd53f-281d-ec11-b6e6-001dd830865f","10/2/2021","2021-10-02T04:00:00Z","052146","9/25/2021","2021-09-25T04:00:00Z","107-25 WREN PLACE","40,700,840.000000",40700840,"d02ff20c-32f4-ea11-b882-24ee9a37d45c","Queens",882450003,"-73,781,839.000000",-73781839,"29","P.S. 116 - QUEENS","P.S./I.S. 116 William C. Hughley - Q116 - Q116 - 29Q116 - 107-25 WREN PLACE"
"W/""324273776""","Partial Classroom Quarantine",882450001,"ed50878d-2a1d-ec11-b6e6-001dd830865f","10/1/2021","2021-10-01T04:00:00Z","052151","9/25/2021","2021-09-25T04:00:00Z","1700 FULTON STREET","40,678,478.000000",40678478,"f209e2e1-30f4-ea11-b882-24ee9a37d45c","Brooklyn",882450002,"-73,931,604.000000",-73931604,"16","BOYS & GIRLS HS - K","Nelson Mandela High School - K765 - K455 - 16K765 - 1700 FULTON STREET"
"W/""324598460""","Classroom Closed",882450000,"4051eced-2b1d-ec11-b6e6-001dd830865f","10/2/2021","2021-10-02T04:00:00Z","052157","9/25/2021","2021-09-25T04:00:00Z","21 WEST 111 STREET","40,798,461.000000",40798461,"938d8486-31f4-ea11-b882-24ee9a37d45c","Manhattan",882450000,"-73,950,146.000000",-73950146,"3","P.S. 208 (TANDEM M185) - MANHATTAN","Harlem Link Charter School - M329 - M208 - 84M329 - 21 WEST 111 STREET"
"W/""323289897""","Classroom Closed",882450000,"3e5421ce-2c1d-ec11-b6e6-001dd830865f","10/3/2021","2021-10-03T04:00:00Z","052163","9/25/2021","2021-09-25T04:00:00Z","255 IONIA AVENUE","40,543,433.000000",40543433,"8ba9d9c3-32f4-ea11-b882-24ee9a37d45c","Staten Island",882450004,"-74,182,548.000000",-74182548,"31","P.S. 36 - STATEN ISLAND","P.S. 036 J. C. Drumgoole - R036 - R036 - 31R036 - 255 IONIA AVENUE"
"W/""323289916""","Classroom Closed",882450000,"f14133da-2c1d-ec11-b6e6-001dd830865f","10/1/2021","2021-10-01T04:00:00Z","052165","9/25/2021","2021-09-25T04:00:00Z","60 EAST  94 STREET","40,663,388.000000",40663388,"308dbfcf-30f4-ea11-b882-24ee9a37d45c","Brooklyn",882450002,"-73,927,979.000000",-73927979,"17","P.S. 398 (UDC) - BROOKLYN","P.S. 398 Walter Weaver - K398 - K398 - 17K398 - 60 EAST  94 STREET"
"W/""324502027""","Classroom Closed",882450000,"4b6ab29c-2e1d-ec11-b6e6-001dd830865f","10/3/2021","2021-10-03T04:00:00Z","052169","9/25/2021","2021-09-25T04:00:00Z","3000 EAST TREMONT AVENUE","40,839,775.000000",40839775,"b556635c-33f4-ea11-b882-24ee9a37d45c","Bronx",882450001,"-73,839,583.000000",-73839583,"11","HERBERT H. LEHMAN HS - X","Renaissance High School for Musical Theater and the Arts - X293 - X405 - 08X293 - 3000 EAST TREMONT AVENUE"
"W/""325854477""","Partial Classroom Quarantine",882450001,"2fcecbf8-2e1d-ec11-b6e6-001dd830865f","10/3/2021","2021-10-03T04:00:00Z","052171","9/27/2021","2021-09-27T04:00:00Z","14-30 BROADWAY","40,765,881.000000",40765881,"81476368-32f4-ea11-b882-24ee9a37d45c","Queens",882450003,"-73,933,907.000000",-73933907,"30","LONG ISLAND CITY HS(NEW)-Q","Long Island City High School - Q450 - Q452 - 30Q450 - 14-30 BROADWAY"
"W/""323289972""","Classroom Closed",882450000,"4f82345f-2f1d-ec11-b6e6-001dd830865f","10/3/2021","2021-10-03T04:00:00Z","052173","9/25/2021","2021-09-25T04:00:00Z","750 PROSPECT AVENUE","40,817,742.000000",40817742,"c4689025-33f4-ea11-b882-24ee9a37d45c","Bronx",882450001,"-73,901,709.000000",-73901709,"8","P.S. 130 - BRONX","P.S. 130 Abram Stevens Hewitt - X130 - X130 - 08X130 - 750 PROSPECT AVENUE"
"W/""325520643""","Classroom Closed",882450000,"033ac62c-321d-ec11-b6e6-001dd830865f","10/3/2021","2021-10-03T04:00:00Z","052180","9/27/2021","2021-09-27T04:00:00Z","48-09 CENTER BOULEVARD","40,744,368.000000",40744368,"bcedf392-32f4-ea11-b882-24ee9a37d45c","Queens",882450003,"-73,957,177.000000",-73957177,"30","P.S. 78 - QUEENS","P.S./I.S. 78Q - Q078 - Q868 - 30Q078 - 48-09 CENTER BOULEVARD"
"W/""327109304""","Partial Classroom Quarantine",882450001,"a9f6f1d3-331d-ec11-b6e6-001dd830865f","10/3/2021","2021-10-03T04:00:00Z","052181","9/25/2021","2021-09-25T04:00:00Z","145-00 SPRINGFIELD BOULEVARD","40,664,809.000000",40664809,"0c06003e-32f4-ea11-b882-24ee9a37d45c","Queens",882450003,"-73,759,396.000000",-73759396,"29","I.S. 231 (TANDEM Q251) - QUEENS","Community Voices Middle School - Q356 - Q231 - 29Q356 - 145-00 SPRINGFIELD BOULEVARD"
"W/""324595260""","Partial Classroom Quarantine",882450001,"518786ad-341d-ec11-b6e6-001dd830865f","10/2/2021","2021-10-02T04:00:00Z","052186","9/27/2021","2021-09-27T04:00:00Z","1001 EAST  45 STREET","40,635,842.000000",40635842,"2fe2abc9-30f4-ea11-b882-24ee9a37d45c","Brooklyn",882450002,"-73,933,099.000000",-73933099,"22","P.S./I.S. 395 - BROOKLYN","P.S. 109 - K109 - K395 - 22K109 - 1001 EAST  45 STREET"
"W/""323290047""","Partial Classroom Quarantine",882450001,"f60888d1-341d-ec11-b6e6-001dd830865f","10/1/2021","2021-10-01T04:00:00Z","052187","9/25/2021","2021-09-25T04:00:00Z","6565 FLATLANDS AVENUE","40,634,451.000000",40634451,"6d2b3eee-30f4-ea11-b882-24ee9a37d45c","Brooklyn",882450002,"-73,916,927.000000",-73916927,"18","SOUTH SHORE EDUCATIONAL CAMPUS - K","Brooklyn Community High School for Excellence and Equity - K566 - K515 - 18K566 - 6565 FLATLANDS AVENUE"
"W/""323290058""","Classroom Closed",882450000,"200988d1-341d-ec11-b6e6-001dd830865f","10/2/2021","2021-10-02T04:00:00Z","052188","9/25/2021","2021-09-25T04:00:00Z","11 SAMPSON AVENUE","40,552,679.000000",40552679,"b2a00518-4afb-ea11-b883-24ee9a37d459",,,"-74,149,204.000000",-74149204,"31","SOUTH SHORE TODDLER ACADEMY","SOUTH SHORE TODDLER ACADEMY - RAFW - RAFW -  - 11 SAMPSON AVENUE"
"W/""323290118""","Partial Classroom Quarantine",882450001,"14b30131-381d-ec11-b6e6-001dd830865f","10/3/2021","2021-10-03T04:00:00Z","052206","9/25/2021","2021-09-25T04:00:00Z","91-30 METROPOLITAN AVENUE","40,708,431.000000",40708431,"a372c880-32f4-ea11-b882-24ee9a37d45c","Queens",882450003,"-73,855,543.000000",-73855543,"28","METROPOLITAN AVENUE CAMPUS - QUEENS","P.S. Q233 - Q233 - Q686 - 75Q233 - 91-30 METROPOLITAN AVENUE"
"W/""324597423""","Classroom Closed",882450000,"fd8111d0-381d-ec11-b6e6-001dd830865f","10/4/2021","2021-10-04T04:00:00Z","052209","9/25/2021","2021-09-25T04:00:00Z","144-39 GRAVETT ROAD","40,737,448.000000",40737448,"0bb7c337-32f4-ea11-b882-24ee9a37d45c","Queens",882450003,"-73,823,841.000000",-73823841,"25","P.S. 219 - QUEENS","P.S. 219 Paul Klapper - Q219 - Q219 - 25Q219 - 144-39 GRAVETT ROAD"
"W/""323290187""","Classroom Closed",882450000,"d41610ff-3a1d-ec11-b6e6-001dd830865f","10/3/2021","2021-10-03T04:00:00Z","052219","9/25/2021","2021-09-25T04:00:00Z","199-10 112 AVENUE","40,702,329.000000",40702329,"e011f898-32f4-ea11-b882-24ee9a37d45c","Queens",882450003,"-73,756,259.000000",-73756259,"29","P.S. 892 - QUEENS","P.S. 360 - Q360 - Q892 - 29Q360 - 199-10 112 AVENUE"
"W/""323290192""","Partial Classroom Quarantine",882450001,"3e67b41a-3b1d-ec11-b6e6-001dd830865f","10/2/2021","2021-10-02T04:00:00Z","052220","9/25/2021","2021-09-25T04:00:00Z","976 Seneca Avenue","40,699,101.000000",40699101,"a4edf392-32f4-ea11-b882-24ee9a37d45c","Queens",882450003,"-73,902,147.000000",-73902147,"24","I.S. 77 - QUEENS","Joseph F. Quinn Intermediate School 77 - Q077 - Q849 - 24Q077 - 976 Seneca Avenue"
"W/""323290216""","Partial Classroom Quarantine",882450001,"9dd27265-3c1d-ec11-b6e6-001dd830865f","10/2/2021","2021-10-02T04:00:00Z","052226","9/25/2021","2021-09-25T04:00:00Z","98-50 50 AVENUE","40,741,898.000000",40741898,"5f2f77fa-31f4-ea11-b882-24ee9a37d45c","Queens",882450003,"-73,862,886.000000",-73862886,"24","I.S. 61 - QUEENS","I.S. 061 Leonardo Da Vinci - Q061 - Q061 - 24Q061 - 98-50 50 AVENUE"
"W/""323408874""","Classroom Closed",882450000,"d1db68c6-3c1d-ec11-b6e6-001dd830865f","10/2/2021","2021-10-02T04:00:00Z","052230","9/25/2021","2021-09-25T04:00:00Z","6701 20 AVENUE","40,614,737.000000",40614737,"11ba8b86-30f4-ea11-b882-24ee9a37d45c","Brooklyn",882450002,"-73,986,792.000000",-73986792,"20","P.S. 205 - BROOKLYN","P.S. 205 Clarion - K205 - K205 - 20K205 - 6701 20 AVENUE"
"W/""324169207""","Classroom Closed",882450000,"9e0ac6a3-3e1d-ec11-b6e6-001dd830865f","10/4/2021","2021-10-04T04:00:00Z","052243","9/25/2021","2021-09-25T04:00:00Z","344 MONROE STREET","40,685,653.000000",40685653,"57de5eb7-30f4-ea11-b882-24ee9a37d45c","Brooklyn",882450002,"-73,945,730.000000",-73945730,"13","P.S. 305 - BROOKLYN","Academy of Arts and Letters - K492 - K305 - 13K492 - 344 MONROE STREET"
"W/""323408664""","Classroom Closed",882450000,"4b70877a-411d-ec11-b6e6-001dd830865f","10/1/2021","2021-10-01T04:00:00Z","052258","9/25/2021","2021-09-25T04:00:00Z","1458 YORK AVENUE","40,770,215.000000",40770215,"1d005d7a-31f4-ea11-b882-24ee9a37d45c","Manhattan",882450000,"-73,950,745.000000",-73950745,"2","P.S. 158 - MANHATTAN","P.S. 158 Bayard Taylor - M158 - M158 - 02M158 - 1458 YORK AVENUE"
"W/""323290379""","Partial Classroom Quarantine",882450001,"542881bc-431d-ec11-b6e6-001dd830865f","10/2/2021","2021-10-02T04:00:00Z","052269","9/25/2021","2021-09-25T04:00:00Z","1600 AVENUE L","40,619,671.000000",40619671,"fafb3df4-30f4-ea11-b882-24ee9a37d45c","Brooklyn",882450002,"-73,959,141.000000",-73959141,"21","EDWARD R. MURROW HS - K","Edward R. Murrow High School - K525 - K525 - 21K525 - 1600 AVENUE L"
"W/""323290388""","Classroom Closed",882450000,"49991101-461d-ec11-b6e6-001dd830865f","10/4/2021","2021-10-04T04:00:00Z","052276","9/25/2021","2021-09-25T04:00:00Z","1075 PUGSLEY AVENUE","40,828,474.000000",40828474,"0f78931f-33f4-ea11-b882-24ee9a37d45c","Bronx",882450001,"-73,857,392.000000",-73857392,"8","P.S. 119 - BRONX","The Dr. Emmett W. Bassett School - X119 - X119 - 08X119 - 1075 PUGSLEY AVENUE"
"W/""324124639""","Classroom Closed",882450000,"0d159b81-511d-ec11-b6e6-001dd830865f","10/2/2021","2021-10-02T04:00:00Z","052320","9/25/2021","2021-09-25T04:00:00Z","511 WEST 182ND STREET","40,849,311.000000",40849311,"3f9f4974-31f4-ea11-b882-24ee9a37d45c","Manhattan",882450000,"-73,930,991.000000",-73930991,"6","I.S. 143 - MANHATTAN","Washington Heights Expeditionary Learning School - M348 - M143 - 06M348 - 511 WEST 182ND STREET"
"W/""324598525""","Partial Classroom Quarantine",882450001,"ac3d1c80-521d-ec11-b6e6-001dd830865f","10/2/2021","2021-10-02T04:00:00Z","052329","9/25/2021","2021-09-25T04:00:00Z","67-01 110 STREET","40,730,017.000000",40730017,"d3b66262-32f4-ea11-b882-24ee9a37d45c","Queens",882450003,"-73,843,972.000000",-73843972,"28","FOREST HILLS HS - Q","Forest Hills High School - Q440 - Q440 - 28Q440 - 67-01 110 STREET"
"W/""325134912""","Classroom Closed",882450000,"8d3f3436-531d-ec11-b6e6-001dd830865f","10/4/2021","2021-10-04T04:00:00Z","052332","9/25/2021","2021-09-25T04:00:00Z","17-15 WEIRFIELD STREET","40,699,431.000000",40699431,"2606003e-32f4-ea11-b882-24ee9a37d45c","Queens",882450003,"-73,903,838.000000",-73903838,"24","P.S. 239 - QUEENS","P.S. 239 - Q239 - Q239 - 24Q239 - 17-15 WEIRFIELD STREET"
"W/""325764500""","Partial Classroom Quarantine",882450001,"7249352a-551d-ec11-b6e6-001dd830865f","10/2/2021","2021-10-02T04:00:00Z","052337","9/25/2021","2021-09-25T04:00:00Z","46 MCKEEVER PLACE","40,665,199.000000",40665199,"a1e657bd-30f4-ea11-b882-24ee9a37d45c","Brooklyn",882450002,"-73,959,484.000000",-73959484,"17","P.S. 375 - BROOKLYN","Explore Exceed Charter School - K333 - K320 - 84K333 - 46 MCKEEVER PLACE"
"W/""324598091""","Partial Classroom Quarantine",882450001,"b4c5da61-571d-ec11-b6e6-001dd830865f","10/3/2021","2021-10-03T04:00:00Z","052345","9/25/2021","2021-09-25T04:00:00Z","1021 Jennings Street","40,831,212.000000",40831212,"27ff3d8d-33f4-ea11-b882-24ee9a37d45c","Bronx",882450001,"-73,885,804.000000",-73885804,"12","FANNIE LOU HAMER FREEDOM HS - X","Fannie Lou Hamer Freedom High School - X682 - X878 - 12X682 - 1021 Jennings Street"
"W/""323690471""","Partial Classroom Quarantine",882450001,"766ece10-581d-ec11-b6e6-001dd830865f","10/2/2021","2021-10-02T04:00:00Z","052349","9/25/2021","2021-09-25T04:00:00Z","1001 EAST 100 STREET","40,642,931.000000",40642931,"22ba8b86-30f4-ea11-b882-24ee9a37d45c","Brooklyn",882450002,"-73,895,224.000000",-73895224,"18","I.S. 211 - BROOKLYN","I.S. 211 John Wilson - K211 - K211 - 18K211 - 1001 EAST 100 STREET"
"W/""324598998""","Partial Classroom Quarantine",882450001,"e016702f-581d-ec11-b6e6-001dd830865f","10/1/2021","2021-10-01T04:00:00Z","052350","9/25/2021","2021-09-25T04:00:00Z","90 TRINITY PLACE","40,708,971.000000",40708971,"d1ed94c3-31f4-ea11-b882-24ee9a37d45c","Manhattan",882450000,"-74,012,465.000000",-74012465,"2","HS FOR LEADERSHIP & PUBLIC SER - M","Leadership and Public Service High School - M425 - M894 - 02M425 - 90 TRINITY PLACE"
"W/""323691507""","Partial Classroom Quarantine",882450001,"e526d1ae-581d-ec11-b6e6-001dd830865f","10/2/2021","2021-10-02T04:00:00Z","052352","9/25/2021","2021-09-25T04:00:00Z","1001 EAST 100 STREET","40,642,931.000000",40642931,"22ba8b86-30f4-ea11-b882-24ee9a37d45c","Brooklyn",882450002,"-73,895,224.000000",-73895224,"18","I.S. 211 - BROOKLYN","I.S. 211 John Wilson - K211 - K211 - 18K211 - 1001 EAST 100 STREET"
"W/""326675353""","Partial Classroom Quarantine",882450001,"670539d3-581d-ec11-b6e6-001dd830865f","10/1/2021","2021-10-01T04:00:00Z","052355","9/25/2021","2021-09-25T04:00:00Z","1300 GREENE AVENUE","40,697,898.000000",40697898,"1de2abc9-30f4-ea11-b882-24ee9a37d45c","Brooklyn",882450002,"-73,919,088.000000",-73919088,"32","I.S. 383 - BROOKLYN","J.H.S. 383 Philippa Schuyler - K383 - K383 - 32K383 - 1300 GREENE AVENUE"
"W/""327633672""","Partial Classroom Quarantine",882450001,"dc723ca5-5f1d-ec11-b6e6-001dd830865f","10/1/2021","2021-10-01T04:00:00Z","052369","9/29/2021","2021-09-29T04:00:00Z","535 EAST 119 STREET","40,796,889.000000",40796889,"0b6e3d68-31f4-ea11-b882-24ee9a37d45c","Manhattan",882450000,"-73,930,528.000000",-73930528,"4","P.S. 112 (TANDEM M206) - MANHATTAN","P.S. 112 Jose Celso Barbosa - M112 - M112 - 04M112 - 535 EAST 119 STREET"
"W/""325760425""","Partial Classroom Quarantine",882450001,"68987572-611d-ec11-b6e6-001dd830865f","10/3/2021","2021-10-03T04:00:00Z","052374","9/25/2021","2021-09-25T04:00:00Z","125 STUYVESANT AVENUE","40,691,467.000000",40691467,"ae79df48-30f4-ea11-b882-24ee9a37d45c","Brooklyn",882450002,"-73,932,254.000000",-73932254,"16","J.H.S. 57 - BROOKLYN","Brooklyn Emerging Leaders Academy Charter School - K892 - K057 - 84K892 - 125 STUYVESANT AVENUE"
"W/""324599065""","Classroom Closed",882450000,"84a182a9-611d-ec11-b6e6-001dd830865f","10/1/2021","2021-10-01T04:00:00Z","052376","9/25/2021","2021-09-25T04:00:00Z","159-01 59 AVENUE","40,741,107.000000",40741107,"049c4c1f-32f4-ea11-b882-24ee9a37d45c","Queens",882450003,"-73,808,765.000000",-73808765,"25","P.S. 163 - QUEENS","P.S. 163 Flushing Heights - Q163 - Q163 - 25Q163 - 159-01 59 AVENUE"
"W/""324599130""","Classroom Closed",882450000,"7f58211d-631d-ec11-b6e6-001dd830865f","10/1/2021","2021-10-01T04:00:00Z","052387","9/25/2021","2021-09-25T04:00:00Z","3441 STEENWICK AVENUE","40,882,778.000000",40882778,"018b0044-33f4-ea11-b882-24ee9a37d45c","Bronx",882450001,"-73,830,616.000000",-73830616,"11","P.S./I.S. 189 - BRONX","Cornerstone Academy for Social Action - X189 - X189 - 11X189 - 3441 STEENWICK AVENUE"
"W/""323680058""","Classroom Closed",882450000,"271e6a29-631d-ec11-b6e6-001dd830865f","10/4/2021","2021-10-04T04:00:00Z","052388","9/25/2021","2021-09-25T04:00:00Z","2944 PITKIN AVENUE","40,675,881.000000",40675881,"4b5bc58c-30f4-ea11-b882-24ee9a37d45c","Brooklyn",882450002,"-73,862,961.000000",-73862961,"19","P.S. 214 - BROOKLYN","P.S. 214 Michael Friedsam - K214 - K214 - 19K214 - 2944 PITKIN AVENUE"
"W/""325763004""","Partial Classroom Quarantine",882450001,"209ac974-631d-ec11-b6e6-001dd830865f","10/2/2021","2021-10-02T04:00:00Z","052391","9/25/2021","2021-09-25T04:00:00Z","1300 BOYNTON AVENUE","40,832,508.000000",40832508,"519d7c62-33f4-ea11-b882-24ee9a37d45c","Bronx",882450001,"-73,878,191.000000",-73878191,"12","JAMES MONROE EDUCATIONAL CAMPUS - X","The Metropolitan Soundview High School - X521 - X420 - 12X521 - 1300 BOYNTON AVENUE"
"W/""324277226""","Classroom Closed",882450000,"197a312f-641d-ec11-b6e6-001dd830865f","10/4/2021","2021-10-04T04:00:00Z","052394","9/25/2021","2021-09-25T04:00:00Z","2944 PITKIN AVENUE","40,675,881.000000",40675881,"4b5bc58c-30f4-ea11-b882-24ee9a37d45c","Brooklyn",882450002,"-73,862,961.000000",-73862961,"19","P.S. 214 - BROOKLYN","P.S. 214 Michael Friedsam - K214 - K214 - 19K214 - 2944 PITKIN AVENUE"
"W/""323290861""","Classroom Closed",882450000,"5dcf79c7-641d-ec11-b6e6-001dd830865f","10/2/2021","2021-10-02T04:00:00Z","052397","9/25/2021","2021-09-25T04:00:00Z","5500 BROADWAY","40,877,062.000000",40877062,"79e03d56-33f4-ea11-b882-24ee9a37d45c","Bronx",882450001,"-73,906,185.000000",-73906185,"10","PRE-K CENTER @5500 BROADWAY - BRONX","Rose Hill Pre-K Center - X535 - X387 - 10X535 - 5500 BROADWAY"
"W/""323699267""","Partial Classroom Quarantine",882450001,"3214b1aa-671d-ec11-b6e6-001dd830865f","10/2/2021","2021-10-02T04:00:00Z","052416","9/25/2021","2021-09-25T04:00:00Z","2365 WATERBURY AVENUE","40,835,410.000000",40835410,"b6ab074a-33f4-ea11-b882-24ee9a37d45c","Bronx",882450001,"-73,846,594.000000",-73846594,"11","P.S./I.S. 194 - BRONX","P.S./M.S. 194 - X194 - X194 - 11X194 - 2365 WATERBURY AVENUE"
"W/""323685084""","Classroom Closed",882450000,"d4ec2324-6d1d-ec11-b6e6-001dd830865f","10/4/2021","2021-10-04T04:00:00Z","052450","9/25/2021","2021-09-25T04:00:00Z","55-24 VAN HORN STREET","40,733,033.000000",40733033,"a72ff20c-32f4-ea11-b882-24ee9a37d45c","Queens",882450003,"-73,878,243.000000",-73878243,"24","P.S./I.S. 102 - QUEENS","P.S. 102 Bayview - Q102 - Q102 - 24Q102 - 55-24 VAN HORN STREET"
"W/""324277317""","Classroom Closed",882450000,"9e8cf1bc-6d1d-ec11-b6e6-001dd830865f","10/4/2021","2021-10-04T04:00:00Z","052451","9/25/2021","2021-09-25T04:00:00Z","350 AVENUE X","40,590,000.000000",40590000,"565bc58c-30f4-ea11-b882-24ee9a37d45c","Brooklyn",882450002,"-73,969,647.000000",-73969647,"21","P.S. 216 - BROOKLYN","P.S. 216 Arturo Toscanini - K216 - K216 - 21K216 - 350 AVENUE X"
"W/""323018996""","Partial Classroom Quarantine",882450001,"227278da-f41a-ec11-b6e6-001dd83094c7","10/1/2021","2021-10-01T04:00:00Z","051293","9/22/2021","2021-09-22T04:00:00Z","156-10 BAISLEY BOULEVARD","40,673,949.000000",40673949,"a9eb6056-32f4-ea11-b882-24ee9a37d45c","Queens",882450003,"-73,782,684.000000",-73782684,"27","AUGUST MARTIN HS - QUEENS","August Martin High School - Q400 - Q400 - 27Q400 - 156-10 BAISLEY BOULEVARD"
"W/""323020054""","Classroom Closed",882450000,"a0bfc2a2-031b-ec11-b6e6-001dd83094c7","10/1/2021","2021-10-01T04:00:00Z","051360","9/22/2021","2021-09-22T04:00:00Z","4222 4th Avenue","40,650,793.000000",40650793,"20a198c3-30f4-ea11-b882-24ee9a37d45c","Brooklyn",882450002,"-74,008,106.000000",-74008106,"15","P.S. 516 SUNSET PARK AVENUES ELEMENTARY SCHOOL - B","Sunset Park Avenues Elementary School - K516 - K333 - 15K516 - 4222 4th Avenue"
"W/""322998566""","Partial Classroom Quarantine",882450001,"67753723-051b-ec11-b6e6-001dd83094c7","10/1/2021","2021-10-01T04:00:00Z","051363","9/23/2021","2021-09-23T04:00:00Z","577 EAST 179 STREET","40,848,702.000000",40848702,"0b78931f-33f4-ea11-b882-24ee9a37d45c","Bronx",882450001,"-73,892,482.000000",-73892482,"10","I.S. 118 - BRONX","J.H.S. 118 William W. Niles - X118 - X118 - 10X118 - 577 EAST 179 STREET"
"W/""322996430""","Classroom Closed",882450000,"3746e850-071b-ec11-b6e6-001dd83094c7","10/1/2021","2021-10-01T04:00:00Z","051369","9/23/2021","2021-09-23T04:00:00Z","628 TINTON AVENUE","40,814,168.000000",40814168,"ff2dd53d-33f4-ea11-b882-24ee9a37d45c","Bronx",882450001,"-73,905,233.000000",-73905233,"7","P.S. 161 - BRONX","P.S. X017 - X017 - X161 - 75X017 - 628 TINTON AVENUE"
"W/""323126161""","Partial Classroom Quarantine",882450001,"dccd5847-081b-ec11-b6e6-001dd83094c7","10/1/2021","2021-10-01T04:00:00Z","051377","9/22/2021","2021-09-22T04:00:00Z","109-89 204 STREET","40,705,989.000000",40705989,"7f977d2b-32f4-ea11-b882-24ee9a37d45c","Queens",882450003,"-73,752,885.000000",-73752885,"29","I.S. 192 - QUEENS","Pathways College Preparatory School: A College Board School - Q259 - Q192 - 29Q259 - 109-89 204 STREET"
"W/""323021270""","Non-Classroom Quarantine",882450003,"1001493f-0d1b-ec11-b6e6-001dd83094c7","10/1/2021","2021-10-01T04:00:00Z","051395","9/22/2021","2021-09-22T04:00:00Z","225 WEST  24 STREET","40,745,677.000000",40745677,"94d810ab-31f4-ea11-b882-24ee9a37d45c","Manhattan",882450000,"-73,996,354.000000",-73996354,"2","FASHION INDUSTRIES VOC HS - M","The High School of Fashion Industries - M600 - M600 - 02M600 - 225 WEST  24 STREET"
"W/""322997288""","Classroom Closed",882450000,"bb6f0798-961b-ec11-b6e6-001dd83094c7","10/1/2021","2021-10-01T04:00:00Z","051417","9/23/2021","2021-09-23T04:00:00Z","200 ADELAIDE AVENUE","40,560,954.000000",40560954,"2c0410ca-32f4-ea11-b882-24ee9a37d45c","Staten Island",882450004,"-74,124,332.000000",-74124332,"31","P.S. 50 - STATEN ISLAND","P.S. 050 Frank Hankinson - R050 - R050 - 31R050 - 200 ADELAIDE AVENUE"
"W/""323002436""","Classroom Closed",882450000,"c90c896e-991b-ec11-b6e6-001dd83094c7","10/1/2021","2021-10-01T04:00:00Z","051427","9/23/2021","2021-09-23T04:00:00Z","1 TELEPORT DRIVE","40,607,104.000000",40607104,"d98521d0-32f4-ea11-b882-24ee9a37d45c","Staten Island",882450004,"-74,178,183.000000",-74178183,"31","PRE-K CENTER @ 1 TELEPORT DRIVE - STATEN ISLAND","The Richmond Pre-K Center - R066 - R068 - 31R066 - 1 TELEPORT DRIVE"
"W/""322997617""","Partial Classroom Quarantine",882450001,"9ac5187a-9c1b-ec11-b6e6-001dd83094c7","10/1/2021","2021-10-01T04:00:00Z","051442","9/23/2021","2021-09-23T04:00:00Z","25 DOCK STREET","40,702,952.000000",40702952,"f03159fa-30f4-ea11-b882-24ee9a37d45c","Brooklyn",882450002,"-73,992,076.000000",-73992076,"13","DOCK ST CAMPUS - BROOKLYN","Dock Street School for STEAM Studies - K313 - K611 - 13K313 - 19 DOCK STREET"
"W/""322974313""","Non-Classroom Quarantine",882450003,"04e1fad8-9e1b-ec11-b6e6-001dd83094c7","10/1/2021","2021-10-01T04:00:00Z","051450","9/24/2021","2021-09-24T04:00:00Z","145 WEST  84 STREET","40,786,134.000000",40786134,"33a6ba98-31f4-ea11-b882-24ee9a37d45c","Manhattan",882450000,"-73,974,483.000000",-73974483,"3","LOUIS D. BRANDEIS HS - MANHATTAN","Innovation Diploma Plus - M404 - M470 - 03M404 - 145 WEST  84 STREET"
"W/""322960261""","Partial Classroom Quarantine",882450001,"15223ae1-9f1b-ec11-b6e6-001dd83094c7","10/2/2021","2021-10-02T04:00:00Z","051452","9/23/2021","2021-09-23T04:00:00Z","1970 WEST FARMS ROAD","40,839,297.000000",40839297,"152ed53d-33f4-ea11-b882-24ee9a37d45c","Bronx",882450001,"-73,879,931.000000",-73879931,"12","P.S. 214 - BRONX","Emolior Academy - X383 - X167 - 12X383 - 1970 WEST FARMS ROAD"
"W/""322996134""","Classroom Closed",882450000,"30c30cd4-a41b-ec11-b6e6-001dd83094c7","10/1/2021","2021-10-01T04:00:00Z","051470","9/23/2021","2021-09-23T04:00:00Z","510 WAVERLY AVENUE","40,682,422.000000",40682422,"8228a20c-31f4-ea11-b882-24ee9a37d45c","Brooklyn",882450002,"-73,965,928.000000",-73965928,"13","ACHIEVEMENT FIRST ENDEAVOR CHARTER SCHOOL - K","Achievement First Endeavor Charter School - K508 - K784 - 84K508 - 510 WAVERLY AVENUE"
"W/""322968152""","Classroom Closed",882450000,"adcf09da-a41b-ec11-b6e6-001dd83094c7","10/2/2021","2021-10-02T04:00:00Z","051472","9/23/2021","2021-09-23T04:00:00Z","40 WEST TREMONT AVENUE","40,850,722.000000",40850722,"c0ba3c50-33f4-ea11-b882-24ee9a37d45c","Bronx",882450001,"-73,910,827.000000",-73910827,"10","P.S. 306 - BRONX","P.S. 306 - X306 - X306 - 10X306 - 40 WEST TREMONT AVENUE"
"W/""322999065""","Classroom Closed",882450000,"0c89de47-a91b-ec11-b6e6-001dd83094c7","10/1/2021","2021-10-01T04:00:00Z","051497","9/23/2021","2021-09-23T04:00:00Z","6701 20 AVENUE","40,614,737.000000",40614737,"11ba8b86-30f4-ea11-b882-24ee9a37d45c","Brooklyn",882450002,"-73,986,792.000000",-73986792,"20","P.S. 205 - BROOKLYN","P.S. 205 Clarion - K205 - K205 - 20K205 - 6701 20 AVENUE"
"W/""320789692""","Classroom Closed",882450000,"018397bf-a91b-ec11-b6e6-001dd83094c7","10/1/2021","2021-10-01T04:00:00Z","051499","9/23/2021","2021-09-23T04:00:00Z","512 CARROLL STREET","40,676,198.000000",40676198,"fcd7cf12-31f4-ea11-b882-24ee9a37d45c","Brooklyn",882450002,"-73,985,500.000000",-73985500,"15","P.S. 372 (OUR LADY OF PEACE)-K","P.S. 372 -The Children's School - K372 - K834 - 75K372 - 512 CARROLL STREET"
"W/""322975813""","Classroom Closed",882450000,"5c204469-ab1b-ec11-b6e6-001dd83094c7","10/2/2021","2021-10-02T04:00:00Z","051507","9/23/2021","2021-09-23T04:00:00Z","100 WEST  84 STREET","40,785,234.000000",40785234,"87886843-31f4-ea11-b882-24ee9a37d45c","Manhattan",882450000,"-73,974,256.000000",-73974256,"3","P.S. 9 - MANHATTAN","P.S. 009 Sarah Anderson - M009 - M009 - 03M009 - 100 WEST  84 STREET"
"W/""323408731""","Partial Classroom Quarantine",882450001,"2c9a0f82-b21b-ec11-b6e6-001dd83094c7","10/1/2021","2021-10-01T04:00:00Z","051539","9/24/2021","2021-09-24T04:00:00Z","237 7 AVENUE","40,669,255.000000",40669255,"929c11e8-30f4-ea11-b882-24ee9a37d45c","Brooklyn",882450002,"-73,978,580.000000",-73978580,"15","John Jay Educational Campus","John Jay School for Law - K462 - K460 - 15K462 - 237 7 AVENUE"
"W/""320789832""","Classroom Closed",882450000,"ecf5e8c3-b51b-ec11-b6e6-001dd83094c7","10/2/2021","2021-10-02T04:00:00Z","051551","9/23/2021","2021-09-23T04:00:00Z","2750 LAFAYETTE AVENUE","40,827,080.000000",40827080,"4e474313-33f4-ea11-b882-24ee9a37d45c","Bronx",882450001,"-73,829,211.000000",-73829211,"8","I.S. 101 - BRONX","P.S. 304 Early Childhood School - X304 - X101 - 08X304 - 2750 LAFAYETTE AVENUE"
"W/""324598933""","Classroom Closed",882450000,"161c1a14-b71b-ec11-b6e6-001dd83094c7","10/2/2021","2021-10-02T04:00:00Z","051561","9/23/2021","2021-09-23T04:00:00Z","101-24 SEAVIEW AVENUE","40,635,542.000000",40635542,"cd201dab-30f4-ea11-b882-24ee9a37d45c","Brooklyn",882450002,"-73,886,373.000000",-73886373,"18","P.S. 272 - BROOKLYN","P.S. 272 Curtis Estabrook - K272 - K272 - 18K272 - 101-24 SEAVIEW AVENUE"
"W/""322998521""","Classroom Closed",882450000,"cccbc0b5-b71b-ec11-b6e6-001dd83094c7","10/1/2021","2021-10-01T04:00:00Z","051563","9/23/2021","2021-09-23T04:00:00Z","90-15 SUTTER AVENUE","40,676,978.000000",40676978,"6a2f77fa-31f4-ea11-b882-24ee9a37d45c","Queens",882450003,"-73,846,796.000000",-73846796,"27","P.S. 63 - QUEENS","P.S. 063 Old South - Q063 - Q063 - 27Q063 - 90-15 SUTTER AVENUE"
"W/""328209051""","Partial Classroom Quarantine",882450001,"24beb3c1-b71b-ec11-b6e6-001dd83094c7","10/1/2021","2021-10-01T04:00:00Z","051564","10/1/2021","2021-10-01T04:00:00Z","3000 AVENUE X","40,593,157.000000",40593157,"552b3eee-30f4-ea11-b882-24ee9a37d45c","Brooklyn",882450002,"-73,936,635.000000",-73936635,"22","Frank J. Macchiarola Educational Complex","New Visions Charter High School for the Humanities III - K739 - K495 - 84K739 - 3000 AVENUE X"
"W/""322972965""","Classroom Closed",882450000,"852d1199-bb1b-ec11-b6e6-001dd83094c7","10/2/2021","2021-10-02T04:00:00Z","051592","9/23/2021","2021-09-23T04:00:00Z","41-15 104 STREET","40,748,996.000000",40748996,"b672c880-32f4-ea11-b882-24ee9a37d45c","Queens",882450003,"-73,860,547.000000",-73860547,"24","P.S. 16 (OLD Q721 SPED) - QUEENS","P.S. Q016 The Nancy DeBenedittis School - Q016 - Q721 - 24Q016 - 41-15 104 STREET"
"W/""322964228""","Non-Classroom Quarantine",882450003,"308d0c5c-c41b-ec11-b6e6-001dd83094c7","10/2/2021","2021-10-02T04:00:00Z","051632","9/23/2021","2021-09-23T04:00:00Z","1420 EAST  68 STREET","40,620,537.000000",40620537,"8b03194f-30f4-ea11-b882-24ee9a37d45c","Brooklyn",882450002,"-73,912,914.000000",-73912914,"22","I.S. 78 - BROOKLYN","J.H.S. 078 Roy H. Mann - K078 - K078 - 22K078 - 1420 EAST  68 STREET"
"W/""323007954""","Partial Classroom Quarantine",882450001,"a79faad7-cf1b-ec11-b6e6-001dd83094c7","10/1/2021","2021-10-01T04:00:00Z","051686","9/23/2021","2021-09-23T04:00:00Z","265 WARWICK STREET","40,677,707.000000",40677707,"a928a20c-31f4-ea11-b882-24ee9a37d45c","Brooklyn",882450002,"-73,886,712.000000",-73886712,"19","CYPRESS HILLS COMMUNITY SCHOOL - BROOKLYN","P.S. 089 Cypress Hills - K089 - K814 - 19K089 - 265 WARWICK STREET"
"W/""322110109""","Partial Classroom Quarantine",882450001,"6717c367-d01b-ec11-b6e6-001dd83094c7","10/1/2021","2021-10-01T04:00:00Z","051689","9/24/2021","2021-09-24T04:00:00Z","349 CABRINI BOULEVARD","40,856,239.000000",40856239,"59507380-31f4-ea11-b882-24ee9a37d45c","Manhattan",882450000,"-73,936,840.000000",-73936840,"6","P.S./I.S. 187 - MANHATTAN","P.S./I.S. 187 Hudson Cliffs - M187 - M187 - 06M187 - 349 CABRINI BOULEVARD"
"W/""322913599""","Partial Classroom Quarantine",882450001,"35f1fb84-dc1b-ec11-b6e6-001dd83094c7","10/2/2021","2021-10-02T04:00:00Z","051743","9/24/2021","2021-09-24T04:00:00Z","317 EAST  67 STREET","40,765,638.000000",40765638,"6007e99e-31f4-ea11-b882-24ee9a37d45c","Manhattan",882450000,"-73,959,777.000000",-73959777,"2","JULIA RICHMAN ED. COMPLEX - M","Manhattan International High School - M459 - M480 - 02M459 - 317 EAST  67 STREET"
"W/""325267314""","Partial Classroom Quarantine",882450001,"802fa95e-631c-ec11-b6e6-001dd83094c7","10/1/2021","2021-10-01T04:00:00Z","051761","9/24/2021","2021-09-24T04:00:00Z","3000 EAST TREMONT AVENUE","40,839,775.000000",40839775,"b556635c-33f4-ea11-b882-24ee9a37d45c","Bronx",882450001,"-73,839,583.000000",-73839583,"11","HERBERT H. LEHMAN HS - X","Schuylerville Preparatory High School - X348 - X405 - 08X348 - 3000 EAST TREMONT AVENUE"
"W/""325267319""","Partial Classroom Quarantine",882450001,"35fcd876-631c-ec11-b6e6-001dd83094c7","10/1/2021","2021-10-01T04:00:00Z","051762","9/24/2021","2021-09-24T04:00:00Z","3000 EAST TREMONT AVENUE","40,839,775.000000",40839775,"b556635c-33f4-ea11-b882-24ee9a37d45c","Bronx",882450001,"-73,839,583.000000",-73839583,"11","HERBERT H. LEHMAN HS - X","Schuylerville Preparatory High School - X348 - X405 - 08X348 - 3000 EAST TREMONT AVENUE"
"W/""325853042""","Partial Classroom Quarantine",882450001,"0affd4a0-631c-ec11-b6e6-001dd83094c7","10/2/2021","2021-10-02T04:00:00Z","051763","9/24/2021","2021-09-24T04:00:00Z","3000 EAST TREMONT AVENUE","40,839,775.000000",40839775,"b556635c-33f4-ea11-b882-24ee9a37d45c","Bronx",882450001,"-73,839,583.000000",-73839583,"11","HERBERT H. LEHMAN HS - X","Bronx River High School - X349 - X405 - 08X349 - 3000 EAST TREMONT AVENUE"
"W/""322935772""","Classroom Closed",882450000,"3c5e1018-661c-ec11-b6e6-001dd83094c7","10/2/2021","2021-10-02T04:00:00Z","051769","9/24/2021","2021-09-24T04:00:00Z","68-10 CENTRAL AVE","40,703,503.000000",40703503,"207eed06-32f4-ea11-b882-24ee9a37d45c","Queens",882450003,"-73,883,995.000000",-73883995,"24","P.S. 91 - QUEENS","P.S. 091 Richard Arkwright - Q091 - Q091 - 24Q091 - 68-10 CENTRAL AVE"
"W/""322896964""","Classroom Closed",882450000,"994584cf-6a1c-ec11-b6e6-001dd83094c7","10/2/2021","2021-10-02T04:00:00Z","051796","9/24/2021","2021-09-24T04:00:00Z","145-01 119 AVENUE","40,678,913.000000",40678913,"f7ae0313-32f4-ea11-b882-24ee9a37d45c","Queens",882450003,"-73,795,571.000000",-73795571,"27","P.S. 123 - QUEENS","P.S. 123 - Q123 - Q123 - 27Q123 - 145-01 119 AVENUE"
"W/""323409882""","Partial Classroom Quarantine",882450001,"6f4e748b-6c1c-ec11-b6e6-001dd83094c7","10/3/2021","2021-10-03T04:00:00Z","051808","9/24/2021","2021-09-24T04:00:00Z","750 BAYCHESTER AVENUE","40,874,035.000000",40874035,"8253dd74-33f4-ea11-b882-24ee9a37d45c","Bronx",882450001,"-73,831,669.000000",-73831669,"11","HARRY S. TRUMAN HS - X","Harry S Truman High School - X455 - X455 - 11X455 - 750 BAYCHESTER AVENUE"
"W/""323289532""","Classroom Closed",882450000,"f94b41bf-6e1c-ec11-b6e6-001dd83094c7","10/3/2021","2021-10-03T04:00:00Z","051818","9/25/2021","2021-09-25T04:00:00Z","51 SAINT EDWARDS STREET","40,695,339.000000",40695339,"d179df48-30f4-ea11-b882-24ee9a37d45c","Brooklyn",882450002,"-73,977,674.000000",-73977674,"13","P.S. 67 - BROOKLYN","P.S. 067 Charles A. Dorsey - K067 - K067 - 13K067 - 51 SAINT EDWARDS STREET"
"W/""322948814""","Non-Classroom Quarantine",882450003,"8e079b27-701c-ec11-b6e6-001dd83094c7","10/2/2021","2021-10-02T04:00:00Z","051824","9/24/2021","2021-09-24T04:00:00Z","60 EAST  94 STREET","40,663,388.000000",40663388,"308dbfcf-30f4-ea11-b882-24ee9a37d45c","Brooklyn",882450002,"-73,927,979.000000",-73927979,"17","P.S. 398 (UDC) - BROOKLYN","P.S. 398 Walter Weaver - K398 - K398 - 17K398 - 60 EAST  94 STREET"
"W/""323201496""","Classroom Closed",882450000,"cee68fa5-731c-ec11-b6e6-001dd83094c7","10/2/2021","2021-10-02T04:00:00Z","051856","9/24/2021","2021-09-24T04:00:00Z","1355 HERKIMER STREET","40,677,634.000000",40677634,"f6d27c6d-30f4-ea11-b882-24ee9a37d45c","Brooklyn",882450002,"-73,908,682.000000",-73908682,"23","P.S. 155 - BROOKLYN","P.S./ I.S. 155 Nicholas Herkimer - K155 - K155 - 23K155 - 1355 HERKIMER STREET"
"W/""328833375""","Classroom Closed",882450000,"d53cbaa7-741c-ec11-b6e6-001dd83094c7","10/2/2021","2021-10-02T04:00:00Z","051863","9/24/2021","2021-09-24T04:00:00Z","51 JEFFERSON STREET","40,590,887.000000",40590887,"4efdc1bd-32f4-ea11-b882-24ee9a37d45c","Staten Island",882450004,"-74,098,252.000000",-74098252,"31","P.S. 11 - STATEN ISLAND","P.S. 11 Thomas Dongan School - R011 - R011 - 31R011 - 51 JEFFERSON STREET"
"W/""322945296""","Partial Classroom Quarantine",882450001,"eac7948b-781c-ec11-b6e6-001dd83094c7","10/2/2021","2021-10-02T04:00:00Z","051888","9/24/2021","2021-09-24T04:00:00Z","74-20 COMMONWEALTH BLVD","40,744,197.000000",40744197,"27b4977a-32f4-ea11-b882-24ee9a37d45c","Queens",882450003,"-73,728,834.000000",-73728834,"26","QNS HS OF TEACH., LIB. ARTS&SCI-Q","Queens High School of Teaching, Liberal Arts and the Sciences - Q566 - Q566 - 26Q566 - 74-20 COMMONWEALTH BLVD"
"W/""322921665""","Classroom Closed",882450000,"2989eca9-781c-ec11-b6e6-001dd83094c7","10/2/2021","2021-10-02T04:00:00Z","051889","9/24/2021","2021-09-24T04:00:00Z","1599 EAST  22 STREET","40,612,339.000000",40612339,"f7b98b86-30f4-ea11-b882-24ee9a37d45c","Brooklyn",882450002,"-73,951,398.000000",-73951398,"22","P.S. 197 - BROOKLYN","P.S. 197 - The Kings Highway Academy - K197 - K197 - 22K197 - 1599 EAST  22 STREET"
"W/""322110593""","Classroom Closed",882450000,"113704a6-791c-ec11-b6e6-001dd83094c7","10/2/2021","2021-10-02T04:00:00Z","051895","9/24/2021","2021-09-24T04:00:00Z","275 HARLEM RIVER PARK BRIDGE","40,852,400.000000",40852400,"c0ab074a-33f4-ea11-b882-24ee9a37d45c","Bronx",882450001,"-73,921,600.000000",-73921600,"9","P.S. 230/I.S. 229 (UDC) - BRONX","The New American Academy at Roberto Clemente State Park - X274 - X229 - 09X274 - 275 HARLEM RIVER PARK BRIDGE"
"W/""322980807""","Partial Classroom Quarantine",882450001,"b26a9095-7a1c-ec11-b6e6-001dd83094c7","10/1/2021","2021-10-01T04:00:00Z","051901","9/24/2021","2021-09-24T04:00:00Z","101 WALTON STREET","40,703,034.000000",40703034,"9de657bd-30f4-ea11-b882-24ee9a37d45c","Brooklyn",882450002,"-73,948,771.000000",-73948771,"14","I.S. 318 - BROOKLYN","I.S. 318 Eugenio Maria De Hostos - K318 - K318 - 14K318 - 101 WALTON STREET"
"W/""322927138""","Partial Classroom Quarantine",882450001,"32818d2d-7c1c-ec11-b6e6-001dd83094c7","10/3/2021","2021-10-03T04:00:00Z","051914","9/24/2021","2021-09-24T04:00:00Z","1200 MANOR ROAD","40,588,985.000000",40588985,"5abe7adc-32f4-ea11-b882-24ee9a37d45c","Staten Island",882450004,"-74,130,819.000000",-74130819,"31","SUSAN E. WAGNER HS - S. I.","Susan E. Wagner High School - R460 - R460 - 31R460 - 1200 MANOR ROAD"
"W/""322910860""","Partial Classroom Quarantine",882450001,"4dd169c3-7c1c-ec11-b6e6-001dd83094c7","10/2/2021","2021-10-02T04:00:00Z","051919","9/24/2021","2021-09-24T04:00:00Z","4004 4 AVENUE","40,652,127.000000",40652127,"d6315367-30f4-ea11-b882-24ee9a37d45c","Brooklyn",882450002,"-74,007,596.000000",-74007596,"15","I.S. 136 - BROOKLYN","I.S. 136 Charles O. Dewey - K136 - K136 - 15K136 - 4004 4 AVENUE"
"W/""322980661""","Partial Classroom Quarantine",882450001,"5bb6c88b-7e1c-ec11-b6e6-001dd83094c7","10/1/2021","2021-10-01T04:00:00Z","051929","9/24/2021","2021-09-24T04:00:00Z","1200 MANOR ROAD","40,588,985.000000",40588985,"5abe7adc-32f4-ea11-b882-24ee9a37d45c","Staten Island",882450004,"-74,130,819.000000",-74130819,"31","SUSAN E. WAGNER HS - S. I.","Susan E. Wagner High School - R460 - R460 - 31R460 - 1200 MANOR ROAD"
"W/""322977118""","Classroom Closed",882450000,"8e3abca5-7f1c-ec11-b6e6-001dd83094c7","10/1/2021","2021-10-01T04:00:00Z","051935","9/24/2021","2021-09-24T04:00:00Z","98-01 159 AVENUE","40,660,531.000000",40660531,"e8883319-32f4-ea11-b882-24ee9a37d45c","Queens",882450003,"-73,834,896.000000",-73834896,"27","P.S. 146 - QUEENS","P.S. 146 Howard Beach - Q146 - Q146 - 27Q146 - 98-01 159 AVENUE"
"W/""323178256""","Classroom Closed",882450000,"9c9c4ecd-811c-ec11-b6e6-001dd83094c7","10/1/2021","2021-10-01T04:00:00Z","051947","9/24/2021","2021-09-24T04:00:00Z","508 EAST 120 STREET","40,796,889.000000",40796889,"908d8486-31f4-ea11-b882-24ee9a37d45c","Manhattan",882450000,"-73,930,528.000000",-73930528,"4","P.S. 206 (TANDEM M112) - MANHATTAN","P.S. 206 Jose Celso Barbosa - M206 - M206 - 04M206 - 508 EAST 120 STREET"
"W/""322110760""","Partial Classroom Quarantine",882450001,"e0862e92-841c-ec11-b6e6-001dd83094c7","10/2/2021","2021-10-02T04:00:00Z","051963","9/24/2021","2021-09-24T04:00:00Z","35-01 UNION STREET","40,764,892.000000",40764892,"97476368-32f4-ea11-b882-24ee9a37d45c","Queens",882450003,"-73,826,811.000000",-73826811,"25","FLUSHING HS - Q","Flushing High School - Q460 - Q460 - 25Q460 - 35-01 UNION STREET"
"W/""322894528""","Classroom Closed",882450000,"d28b3236-891c-ec11-b6e6-001dd83094c7","10/3/2021","2021-10-03T04:00:00Z","051989","9/24/2021","2021-09-24T04:00:00Z","1050 Targee Street","40,603,492.000000",40603492,"db8521d0-32f4-ea11-b882-24ee9a37d45c","Staten Island",882450004,"-74,091,239.000000",-74091239,"31","P.S./I.S. 48 - Staten Island","P.S. 048 William G. Wilcox - R048 - R071 - 31R048 - 1050 Targee Street"
"W/""323409956""","Partial Classroom Quarantine",882450001,"25d96fc2-8d1c-ec11-b6e6-001dd83094c7","10/3/2021","2021-10-03T04:00:00Z","052002","9/24/2021","2021-09-24T04:00:00Z","1065 ELTON STREET","40,657,266.000000",40657266,"da92e6d5-30f4-ea11-b882-24ee9a37d45c","Brooklyn",882450002,"-73,874,064.000000",-73874064,"19","SPRING CREEK EDUCATIONAL CAMPUS - BROOKLYN","Academy for Young Writers - K404 - K422 - 19K404 - 1065 ELTON STREET"
"W/""322110851""","Non-Classroom Quarantine",882450003,"fb96c5bf-911c-ec11-b6e6-001dd83094c7","10/1/2021","2021-10-01T04:00:00Z","052025","9/24/2021","2021-09-24T04:00:00Z","564 JACKSON AVENUE","40,813,896.000000",40813896,"119ebaee-32f4-ea11-b882-24ee9a37d45c","Bronx",882450001,"-73,908,358.000000",-73908358,"7","P.S. 5 - BRONX","P.S. 5 Port Morris - X005 - X005 - 07X005 - 564 JACKSON AVENUE"
"W/""322918429""","Partial Classroom Quarantine",882450001,"340e5b93-931c-ec11-b6e6-001dd83094c7","10/2/2021","2021-10-02T04:00:00Z","052038","9/24/2021","2021-09-24T04:00:00Z","370 FOUNTAIN AVENUE","40,670,020.000000",40670020,"5b5bc58c-30f4-ea11-b882-24ee9a37d45c","Brooklyn",882450002,"-73,874,537.000000",-73874537,"19","I.S. 218 - BROOKLYN","J.H.S. 218 James P. Sinnott - K218 - K218 - 19K218 - 370 FOUNTAIN AVENUE"
"W/""322110891""","Non-Classroom Quarantine",882450003,"e1a024f3-931c-ec11-b6e6-001dd83094c7","10/1/2021","2021-10-01T04:00:00Z","052043","9/24/2021","2021-09-24T04:00:00Z","564 JACKSON AVENUE","40,813,896.000000",40813896,"119ebaee-32f4-ea11-b882-24ee9a37d45c","Bronx",882450001,"-73,908,358.000000",-73908358,"7","P.S. 5 - BRONX","DYCD - P.S. 5 Port Morris - 142004 - 564 JACKSON AVENUE"
"W/""322981332""","Partial Classroom Quarantine",882450001,"a1c122fd-951c-ec11-b6e6-001dd83094c7","10/1/2021","2021-10-01T04:00:00Z","052051","9/24/2021","2021-09-24T04:00:00Z","58-20 UTOPIA PARKWAY","40,740,875.000000",40740875,"bcb66262-32f4-ea11-b882-24ee9a37d45c","Queens",882450003,"-73,795,049.000000",-73795049,"26","FRANCIS LEWIS HS - Q","Francis Lewis High School - Q430 - Q430 - 26Q430 - 58-20 UTOPIA PARKWAY"
"W/""322977295""","Partial Classroom Quarantine",882450001,"86b3608f-971c-ec11-b6e6-001dd83094c7","10/1/2021","2021-10-01T04:00:00Z","052059","9/24/2021","2021-09-24T04:00:00Z","3787 BEDFORD AVENUE","40,610,499.000000",40610499,"e092e6d5-30f4-ea11-b882-24ee9a37d45c","Brooklyn",882450002,"-73,947,661.000000",-73947661,"22","JAMES MADISON HS - K","James Madison High School - K425 - K425 - 22K425 - 3787 BEDFORD AVENUE"
"W/""323289701""","Partial Classroom Quarantine",882450001,"76196092-9f1c-ec11-b6e6-001dd83094c7","10/3/2021","2021-10-03T04:00:00Z","052096","9/25/2021","2021-09-25T04:00:00Z","37-11 21 AVENUE","40,775,766.000000",40775766,"ca883319-32f4-ea11-b882-24ee9a37d45c","Queens",882450003,"-73,904,508.000000",-73904508,"30","I.S. 141 - QUEENS","I.S. 141 The Steinway - Q141 - Q141 - 30Q141 - 37-11 21 AVENUE"
"W/""324598155""","Partial Classroom Quarantine",882450001,"874ceaed-a31c-ec11-b6e6-001dd83094c7","10/3/2021","2021-10-03T04:00:00Z","052123","9/25/2021","2021-09-25T04:00:00Z","144-80 BARCLAY AVENUE","40,759,963.000000",40759963,"6b977d2b-32f4-ea11-b882-24ee9a37d45c","Queens",882450003,"-73,818,399.000000",-73818399,"25","J.H.S. 189 - QUEENS","Flushing International High School - Q263 - Q189 - 25Q263 - 144-80 BARCLAY AVENUE"
"W/""323289797""","Classroom Closed",882450000,"ccda5452-281d-ec11-b6e6-001dd83094c7","10/3/2021","2021-10-03T04:00:00Z","052148","9/25/2021","2021-09-25T04:00:00Z","200 ADELAIDE AVENUE","40,560,954.000000",40560954,"2c0410ca-32f4-ea11-b882-24ee9a37d45c","Staten Island",882450004,"-74,124,332.000000",-74124332,"31","P.S. 50 - STATEN ISLAND","P.S. 050 Frank Hankinson - R050 - R050 - 31R050 - 200 ADELAIDE AVENUE"
"W/""323408940""","Classroom Closed",882450000,"a7d91fba-291d-ec11-b6e6-001dd83094c7","10/2/2021","2021-10-02T04:00:00Z","052150","9/25/2021","2021-09-25T04:00:00Z","510 QUINCY STREET","40,688,135.000000",40688135,"6f275a30-4afb-ea11-b883-24ee9a37d459",,,"-73,940,451.000000",-73940451,"16","Bedford Stuyvesant Headstart","Beford Styvesant ECDC 510 - KBZU - KBZU -  - 510 QUINCY STREET"
"W/""328852941""","Classroom Closed",882450000,"56127555-2d1d-ec11-b6e6-001dd83094c7","10/3/2021","2021-10-03T04:00:00Z","052166","9/25/2021","2021-09-25T04:00:00Z","6302 AVENUE U","40,615,494.000000",40615494,"5ba5db98-30f4-ea11-b882-24ee9a37d45c","Brooklyn",882450002,"-73,912,005.000000",-73912005,"22","P.S. 236 - BROOKLYN","P.S. K771 - K771 - K236 - 75K771 - 6302 AVENUE U"
"W/""323289935""","Classroom Closed",882450000,"a7ce93a3-2d1d-ec11-b6e6-001dd83094c7","10/3/2021","2021-10-03T04:00:00Z","052167","9/25/2021","2021-09-25T04:00:00Z","60 EAST  94 STREET","40,663,388.000000",40663388,"308dbfcf-30f4-ea11-b882-24ee9a37d45c","Brooklyn",882450002,"-73,927,979.000000",-73927979,"17","P.S. 398 (UDC) - BROOKLYN","P.S. 770 New American Academy - K770 - K398 - 17K770 - 60 EAST  94 STREET"
"W/""323289944""","Classroom Closed",882450000,"d38d434b-2e1d-ec11-b6e6-001dd83094c7","10/3/2021","2021-10-03T04:00:00Z","052168","9/25/2021","2021-09-25T04:00:00Z","170-45 84 AVENUE","40,717,150.000000",40717150,"0eaf0313-32f4-ea11-b882-24ee9a37d45c","Queens",882450003,"-73,794,061.000000",-73794061,"29","P.S. 131 - QUEENS","P.S. 131 Abigail Adams - Q131 - Q131 - 29Q131 - 170-45 84 AVENUE"
"W/""324598593""","Classroom Closed",882450000,"3035252f-2f1d-ec11-b6e6-001dd83094c7","10/2/2021","2021-10-02T04:00:00Z","052172","9/25/2021","2021-09-25T04:00:00Z","2400 MARION AVENUE","40,858,689.000000",40858689,"530b210d-33f4-ea11-b882-24ee9a37d45c","Bronx",882450001,"-73,894,682.000000",-73894682,"10","P.S. 85 - BRONX","P.S. 085 Great Expectations - X085 - X085 - 10X085 - 2400 MARION AVENUE"
"W/""323289981""","Partial Classroom Quarantine",882450001,"5623945a-301d-ec11-b6e6-001dd83094c7","10/2/2021","2021-10-02T04:00:00Z","052175","9/25/2021","2021-09-25T04:00:00Z","1270 HUGUENOT AVENUE","40,522,971.000000",40522971,"447c21b7-32f4-ea11-b882-24ee9a37d45c","Staten Island",882450004,"-74,186,096.000000",-74186096,"31","I.S. 7 - STATEN ISLAND","I.S. 007 Elias Bernstein - R007 - R007 - 31R007 - 1270 HUGUENOT AVENUE"
"W/""323409006""","Classroom Closed",882450000,"54987f75-351d-ec11-b6e6-001dd83094c7","10/2/2021","2021-10-02T04:00:00Z","052190","9/25/2021","2021-09-25T04:00:00Z","1801 AVENUE Y","40,591,103.000000",40591103,"a583ff9e-30f4-ea11-b882-24ee9a37d45c","Brooklyn",882450002,"-73,951,550.000000",-73951550,"22","P.S. 254 - BROOKLYN","P.S. 254 Dag Hammarskjold - K254 - K254 - 22K254 - 1801 AVENUE Y"
"W/""323635302""","Partial Classroom Quarantine",882450001,"9a2433db-351d-ec11-b6e6-001dd83094c7","10/3/2021","2021-10-03T04:00:00Z","052195","9/25/2021","2021-09-25T04:00:00Z","51-60 MARATHON PARKWAY","40,762,241.000000",40762241,"732f77fa-31f4-ea11-b882-24ee9a37d45c","Queens",882450003,"-73,734,832.000000",-73734832,"26","J.H.S. 67 - QUEENS","J.H.S. 067 Louis Pasteur - Q067 - Q067 - 26Q067 - 51-60 MARATHON PARKWAY"
"W/""323290102""","Partial Classroom Quarantine",882450001,"5bd5c23c-371d-ec11-b6e6-001dd83094c7","10/2/2021","2021-10-02T04:00:00Z","052201","9/25/2021","2021-09-25T04:00:00Z","142-10 LINDEN BOULEVARD","40,683,473.000000",40683473,"2eaf0313-32f4-ea11-b882-24ee9a37d45c","Queens",882450003,"-73,800,875.000000",-73800875,"28","P.S. 752 (OLD J142) - QUEENS","Queens Transition Center - Q752 - Q142 - 75Q752 - 142-10 LINDEN BOULEVARD"
"W/""323290178""","Partial Classroom Quarantine",882450001,"4c35b6f4-3a1d-ec11-b6e6-001dd83094c7","10/1/2021","2021-10-01T04:00:00Z","052217","9/25/2021","2021-09-25T04:00:00Z","6500 16 AVENUE","40,622,102.000000",40622102,"ee21d292-30f4-ea11-b882-24ee9a37d45c","Brooklyn",882450002,"-73,995,961.000000",-73995961,"20","I.S. 227 - BROOKLYN","J.H.S. 227 Edward B. Shallow - K227 - K227 - 20K227 - 6500 16 AVENUE"
"W/""325763789""","Classroom Closed",882450000,"5ac7662d-3d1d-ec11-b6e6-001dd83094c7","10/2/2021","2021-10-02T04:00:00Z","052231","9/25/2021","2021-09-25T04:00:00Z","131 NORMAN AVENUE","40,726,378.000000",40726378,"f91aad3c-30f4-ea11-b882-24ee9a37d45c","Brooklyn",882450002,"-73,949,756.000000",-73949756,"14","P.S. 34 - BROOKLYN","P.S. 034 Oliver H. Perry - K034 - K034 - 14K034 - 131 NORMAN AVENUE"
"W/""323700160""","Partial Classroom Quarantine",882450001,"52e22fab-3d1d-ec11-b6e6-001dd83094c7","10/2/2021","2021-10-02T04:00:00Z","052235","9/25/2021","2021-09-25T04:00:00Z","109-15 98 STREET","40,678,112.000000",40678112,"22af0313-32f4-ea11-b882-24ee9a37d45c","Queens",882450003,"-73,839,377.000000",-73839377,"27","M.S. 137 - QUEENS","M.S. 137 America's School of Heroes - Q137 - Q137 - 27Q137 - 109-15 98 STREET"
"W/""323701318""","Partial Classroom Quarantine",882450001,"e0802cb4-3f1d-ec11-b6e6-001dd83094c7","10/2/2021","2021-10-02T04:00:00Z","052248","9/25/2021","2021-09-25T04:00:00Z","50-40 JACOBUS STREET","40,737,405.000000",40737405,"9adc32dc-31f4-ea11-b882-24ee9a37d45c","Queens",882450003,"-73,888,133.000000",-73888133,"24","I.S. 5 - QUEENS","I.S. 5 - The Walter Crowley Intermediate School - Q005 - Q005 - 24Q005 - 50-40 JACOBUS STREET"
"W/""324253299""","Partial Classroom Quarantine",882450001,"a9c824ba-3f1d-ec11-b6e6-001dd83094c7","10/3/2021","2021-10-03T04:00:00Z","052249","9/25/2021","2021-09-25T04:00:00Z","48-10 31 AVENUE","40,757,072.000000",40757072,"d8b66262-32f4-ea11-b882-24ee9a37d45c","Queens",882450003,"-73,911,165.000000",-73911165,"30","WILLIAM C. BRYANT HS - Q","William Cullen Bryant High School - Q445 - Q445 - 30Q445 - 48-10 31 AVENUE"
"W/""325761511""","Classroom Closed",882450000,"e1dcbb8c-481d-ec11-b6e6-001dd83094c7","10/3/2021","2021-10-03T04:00:00Z","052285","9/25/2021","2021-09-25T04:00:00Z","175 WEST 166 STREET","40,835,866.000000",40835866,"b5689025-33f4-ea11-b882-24ee9a37d45c","Bronx",882450001,"-73,928,200.000000",-73928200,"9","P.S. 126 (ECF) - BRONX","P.S. 126 Dr Marjorie H Dunbar - X126 - X126 - 09X126 - 175 WEST 166 STREET"
"W/""323290459""","Classroom Closed",882450000,"288cd7c8-481d-ec11-b6e6-001dd83094c7","10/1/2021","2021-10-01T04:00:00Z","052287","9/25/2021","2021-09-25T04:00:00Z","88-08 164TH STREET","40,708,698.000000",40708698,"d5454b50-32f4-ea11-b882-24ee9a37d45c","Queens",882450003,"-73,797,981.000000",-73797981,"28","P.S./ I.S. 314 - Queens","The Queens School for Leadership and Excellence - Q349 - Q314 - 28Q349 - 88-08 164TH STREET"
"W/""323366553""","Partial Classroom Quarantine",882450001,"482df729-4a1d-ec11-b6e6-001dd83094c7","10/3/2021","2021-10-03T04:00:00Z","052293","9/25/2021","2021-09-25T04:00:00Z","500 19 STREET","40,656,952.000000",40656952,"ed201dab-30f4-ea11-b882-24ee9a37d45c","Brooklyn",882450002,"-73,983,116.000000",-73983116,"15","PRE-K CENTER @ 500 19TH STREET - BROOKLYN","M.S. 442 Carroll Gardens School for Innovation - K442 - K280 - 15K442 - 500 19 STREET"
"W/""324598657""","Partial Classroom Quarantine",882450001,"cc0bd88f-4a1d-ec11-b6e6-001dd83094c7","10/2/2021","2021-10-02T04:00:00Z","052295","9/25/2021","2021-09-25T04:00:00Z","333 MIDLAND AVENUE","40,576,728.000000",40576728,"2b7c21b7-32f4-ea11-b882-24ee9a37d45c","Staten Island",882450004,"-74,099,685.000000",-74099685,"31","I.S. 2 - STATEN ISLAND","I.S. R002 George L. Egbert - R002 - R002 - 31R002 - 333 MIDLAND AVENUE"
"W/""323290500""","Classroom Closed",882450000,"37ef990d-4b1d-ec11-b6e6-001dd83094c7","10/2/2021","2021-10-02T04:00:00Z","052298","9/25/2021","2021-09-25T04:00:00Z","88-08 164TH STREET","40,708,698.000000",40708698,"d5454b50-32f4-ea11-b882-24ee9a37d45c","Queens",882450003,"-73,797,981.000000",-73797981,"28","P.S./ I.S. 314 - Queens","The Queens School for Leadership and Excellence - Q349 - Q314 - 28Q349 - 88-08 164TH STREET"
"W/""324600299""","Classroom Closed",882450000,"e13d8f19-4b1d-ec11-b6e6-001dd83094c7","10/1/2021","2021-10-01T04:00:00Z","052299","9/25/2021","2021-09-25T04:00:00Z","196-25 PECK AVENUE","40,741,700.000000",40741700,"9c0e6e25-32f4-ea11-b882-24ee9a37d45c","Queens",882450003,"-73,778,118.000000",-73778118,"26","P.S. 179 - QUEENS","P.S. Q004 - Q004 - Q179 - 75Q004 - 196-25 PECK AVENUE"
"W/""323290515""","Classroom Closed",882450000,"2ca59f34-4d1d-ec11-b6e6-001dd83094c7","10/3/2021","2021-10-03T04:00:00Z","052307","9/25/2021","2021-09-25T04:00:00Z","763 KNICKERBOCKER AVENUE","40,693,432.000000",40693432,"ebd27c6d-30f4-ea11-b882-24ee9a37d45c","Brooklyn",882450002,"-73,908,242.000000",-73908242,"32","P.S. 151 - BROOKLYN","P.S. 151 Lyndon B. Johnson - K151 - K151 - 32K151 - 763 KNICKERBOCKER AVENUE"
"W/""324271899""","Classroom Closed",882450000,"d57a81d9-4f1d-ec11-b6e6-001dd83094c7","10/3/2021","2021-10-03T04:00:00Z","052314","9/25/2021","2021-09-25T04:00:00Z","168 HOOKER PLACE","40,631,165.000000",40631165,"67fdc1bd-32f4-ea11-b882-24ee9a37d45c","Staten Island",882450004,"-74,144,599.000000",-74144599,"31","P.S. 21 - STATEN ISLAND","P.S. 21 Margaret Emery-Elm Park - R021 - R021 - 31R021 - 168 HOOKER PLACE"
"W/""324638471""","Partial Classroom Quarantine",882450001,"c65b494b-501d-ec11-b6e6-001dd83094c7","10/2/2021","2021-10-02T04:00:00Z","052317","9/27/2021","2021-09-27T04:00:00Z","2021 BERGEN STREET","40,674,456.000000",40674456,"32eabc42-30f4-ea11-b882-24ee9a37d45c","Brooklyn",882450002,"-73,912,685.000000",-73912685,"23","I.S. 55 - BROOKLYN","Brooklyn Collegiate: A College Board School - K493 - K055 - 23K493 - 2021 BERGEN STREET"
"W/""323290549""","Classroom Closed",882450000,"8c633663-501d-ec11-b6e6-001dd83094c7","10/3/2021","2021-10-03T04:00:00Z","052318","9/25/2021","2021-09-25T04:00:00Z","774 SARATOGA AVENUE","40,661,733.000000",40661733,"dbdfede7-49fb-ea11-b883-24ee9a37d459",,,"-73,916,032.000000",-73916032,"23","HOPE FAITH AND CHARITY","Morris Koppelman Center - KCGN - KAYT -  - 774 SARATOGA AVENUE"
"W/""323290558""","Classroom Closed",882450000,"ab90d910-511d-ec11-b6e6-001dd83094c7","10/1/2021","2021-10-01T04:00:00Z","052319","9/25/2021","2021-09-25T04:00:00Z","41-15 104 STREET","40,748,996.000000",40748996,"b672c880-32f4-ea11-b882-24ee9a37d45c","Queens",882450003,"-73,860,547.000000",-73860547,"24","P.S. 16 (OLD Q721 SPED) - QUEENS","P.S. Q016 The Nancy DeBenedittis School - Q016 - Q721 - 24Q016 - 41-15 104 STREET"
"W/""324595280""","Partial Classroom Quarantine",882450001,"1aa4eea1-551d-ec11-b6e6-001dd83094c7","10/3/2021","2021-10-03T04:00:00Z","052341","9/27/2021","2021-09-27T04:00:00Z","400 EMPIRE BOULEVARD","40,663,605.000000",40663605,"bd79df48-30f4-ea11-b882-24ee9a37d45c","Brooklyn",882450002,"-73,949,198.000000",-73949198,"17","I.S. 61 - BROOKLYN","M.S. 061 Dr. Gladstone H. Atwell - K061 - K061 - 17K061 - 400 EMPIRE BOULEVARD"
"W/""324598725""","Partial Classroom Quarantine",882450001,"28a5a5ee-601d-ec11-b6e6-001dd83094c7","10/2/2021","2021-10-02T04:00:00Z","052372","9/25/2021","2021-09-25T04:00:00Z","230-17 HILLSIDE AVENUE","40,733,888.000000",40733888,"c4b66262-32f4-ea11-b882-24ee9a37d45c","Queens",882450003,"-73,739,726.000000",-73739726,"26","MARTIN VAN BUREN HS - QUEENS","Martin Van Buren High School - Q435 - Q435 - 26Q435 - 230-17 HILLSIDE AVENUE"
"W/""327753781""","Classroom Closed",882450000,"ef642984-651d-ec11-b6e6-001dd83094c7","10/3/2021","2021-10-03T04:00:00Z","052403","9/27/2021","2021-09-27T04:00:00Z","54 OSBORNE STREET","40,536,625.000000",40536625,"3b0410ca-32f4-ea11-b882-24ee9a37d45c","Staten Island",882450004,"-74,163,037.000000",-74163037,"31","P.S. 55 - STATEN ISLAND","P.S. 055 Henry M. Boehm - R055 - R055 - 31R055 - 54 OSBORNE STREET"
"W/""324812267""","Classroom Closed",882450000,"3015291d-681d-ec11-b6e6-001dd83094c7","10/4/2021","2021-10-04T04:00:00Z","052418","9/25/2021","2021-09-25T04:00:00Z","55-01 94 STREET","40,737,441.000000",40737441,"05f32ce2-31f4-ea11-b882-24ee9a37d45c","Queens",882450003,"-73,867,662.000000",-73867662,"24","P.S. 13 - QUEENS","P.S. 013 Clement C. Moore - Q013 - Q013 - 24Q013 - 55-01 94 STREET"
"W/""323290921""","Partial Classroom Quarantine",882450001,"17d5a066-691d-ec11-b6e6-001dd83094c7","10/3/2021","2021-10-03T04:00:00Z","052424","9/25/2021","2021-09-25T04:00:00Z","1600 ROCKAWAY PARKWAY","40,640,543.000000",40640543,"5e2b3eee-30f4-ea11-b882-24ee9a37d45c","Brooklyn",882450002,"-73,898,601.000000",-73898601,"18","CANARSIE HS - K","High School for Innovation in Advertising and Media - K617 - K500 - 18K617 - 1600 ROCKAWAY PARKWAY"
"W/""326118547""","Classroom Closed",882450000,"a7e2e874-6a1d-ec11-b6e6-001dd83094c7","10/4/2021","2021-10-04T04:00:00Z","052430","9/25/2021","2021-09-25T04:00:00Z","109-10 47 AVENUE","40,747,017.000000",40747017,"be8442ee-31f4-ea11-b882-24ee9a37d45c","Queens",882450003,"-73,854,268.000000",-73854268,"24","P.S. 28 - QUEENS","P.S. 28 - The Thomas Emanuel Early Childhood Center - Q028 - Q028 - 24Q028 - 109-10 47 AVENUE"
"W/""325762508""","Partial Classroom Quarantine",882450001,"26346e16-6b1d-ec11-b6e6-001dd83094c7","10/3/2021","2021-10-03T04:00:00Z","052433","9/25/2021","2021-09-25T04:00:00Z","317 Hoyt Street","40,680,159.000000",40680159,"f41aad3c-30f4-ea11-b882-24ee9a37d45c","Brooklyn",882450002,"-73,991,141.000000",-73991141,"15","P.S. 32 - BROOKLYN","DYCD - P.S. 032 Samuel Mills Sprole - 125202 - 317 HOYT STREET"
"W/""325508911""","Classroom Closed",882450000,"b0bc5f90-6c1d-ec11-b6e6-001dd83094c7","10/3/2021","2021-10-03T04:00:00Z","052446","9/27/2021","2021-09-27T04:00:00Z","54-25 SKILLMAN AVENUE","40,746,127.000000",40746127,"fff22ce2-31f4-ea11-b882-24ee9a37d45c","Queens",882450003,"-73,909,032.000000",-73909032,"30","P.S. 11 - QUEENS","P.S. 011 Kathryn Phelan - Q011 - Q011 - 30Q011 - 54-25 SKILLMAN AVENUE"
"W/""324595315""","Classroom Closed",882450000,"47b9c10b-6f1d-ec11-b6e6-001dd83094c7","10/3/2021","2021-10-03T04:00:00Z","052453","9/27/2021","2021-09-27T04:00:00Z","380 GENESEE AVENUE","40,552,213.000000",40552213,"110410ca-32f4-ea11-b882-24ee9a37d45c","Staten Island",882450004,"-74,169,038.000000",-74169038,"31","P.S. 42 - STATEN ISLAND","P.S. 042 Eltingville - R042 - R042 - 31R042 - 380 GENESEE AVENUE"
"W/""319371521""","Non-Classroom Quarantine",882450003,"04d1622c-f61a-ec11-b6e6-001dd830a1ac","10/1/2021","2021-10-01T04:00:00Z","051301","9/22/2021","2021-09-22T04:00:00Z","113 EAST  4TH STREET","40,725,892.000000",40725892,"6c0c1bb1-31f4-ea11-b882-24ee9a37d45c","Manhattan",882450000,"-73,987,791.000000",-73987791,"1","P.S. 751 (CAR.DEV/OLD 25) - M","Manhattan School for Career Development - M751 - M751 - 75M751 - 113 EAST  4TH STREET"
"W/""320789402""","Classroom Closed",882450000,"5a971eea-9b1b-ec11-b6e6-001dd830a1ac","10/1/2021","2021-10-01T04:00:00Z","051438","9/23/2021","2021-09-23T04:00:00Z","14 WEST 170 STREET","40,840,262.000000",40840262,"0a78bb9f-33f4-ea11-b882-24ee9a37d45c","Bronx",882450001,"-73,918,665.000000",-73918665,"9","FAMILY LIFE ACADEMY CHARTER SCHOOL","Family Life Academy Charter School - X705 - XABC - 84X705 - 14 WEST 170 STREET"
"W/""323001030""","Classroom Closed",882450000,"fb764d15-a31b-ec11-b6e6-001dd830a1ac","10/1/2021","2021-10-01T04:00:00Z","051461","9/23/2021","2021-09-23T04:00:00Z","230 EAST 183 STREET","40,856,440.000000",40856440,"169ebaee-32f4-ea11-b882-24ee9a37d45c","Bronx",882450001,"-73,898,821.000000",-73898821,"10","P.S. 9 (OLD 115) - BRONX","P.S. 9 Ryer Avenue Elementary School - X009 - X009 - 10X009 - 230 EAST 183 STREET"
"W/""323018456""","Classroom Closed",882450000,"0c4647ab-a91b-ec11-b6e6-001dd830a1ac","10/1/2021","2021-10-01T04:00:00Z","051498","9/23/2021","2021-09-23T04:00:00Z","19 EAST 103 STREET","40,792,302.000000",40792302,"42005d7a-31f4-ea11-b882-24ee9a37d45c","Manhattan",882450000,"-73,951,425.000000",-73951425,"4","P.S. 171 - MANHATTAN","P.S. 171 Patrick Henry - M171 - M171 - 04M171 - 19 EAST 103 STREET"
"W/""322969251""","Classroom Closed",882450000,"ba521983-bc1b-ec11-b6e6-001dd830a1ac","10/2/2021","2021-10-02T04:00:00Z","051596","9/23/2021","2021-09-23T04:00:00Z","1500 EAST  92 STREET","40,634,861.000000",40634861,"2fe85c61-30f4-ea11-b882-24ee9a37d45c","Brooklyn",882450002,"-73,897,896.000000",-73897896,"18","P.S. 115 - BROOKLYN","P.S. 115 Daniel Mucatel School - K115 - K115 - 18K115 - 1500 EAST  92 STREET"
"W/""322999543""","Non-Classroom Quarantine",882450003,"ab0d1204-c11b-ec11-b6e6-001dd830a1ac","10/1/2021","2021-10-01T04:00:00Z","051623","9/23/2021","2021-09-23T04:00:00Z","2630 BENSON AVENUE","40,593,028.000000",40593028,"3a8dbfcf-30f4-ea11-b882-24ee9a37d45c","Brooklyn",882450002,"-73,986,313.000000",-73986313,"21","Lafayette Educational Campus","Life Academy High School for Film and Music - K559 - K400 - 21K559 - 2630 BENSON AVENUE"
"W/""323005372""","Classroom Closed",882450000,"5d6be014-c21b-ec11-b6e6-001dd830a1ac","10/1/2021","2021-10-01T04:00:00Z","051626","9/23/2021","2021-09-23T04:00:00Z","195 DANIEL LOW TERRACE","40,639,638.000000",40639638,"56fdc1bd-32f4-ea11-b882-24ee9a37d45c","Staten Island",882450004,"-74,079,594.000000",-74079594,"31","P.S. 16 - STATEN ISLAND","P.S. 016 John J. Driscoll - R016 - R016 - 31R016 - 195 DANIEL LOW TERRACE"
"W/""323015856""","Classroom Closed",882450000,"5daef9d5-c71b-ec11-b6e6-001dd830a1ac","10/1/2021","2021-10-01T04:00:00Z","051650","9/23/2021","2021-09-23T04:00:00Z","200 WARDWELL AVENUE","40,618,097.000000",40618097,"73a9d9c3-32f4-ea11-b882-24ee9a37d45c","Staten Island",882450004,"-74,133,080.000000",-74133080,"31","P.S. 30 - STATEN ISLAND","P.S. 030 Westerleigh - R030 - R030 - 31R030 - 200 WARDWELL AVENUE"
"W/""322999874""","Classroom Closed",882450000,"474e63b0-cb1b-ec11-b6e6-001dd830a1ac","10/1/2021","2021-10-01T04:00:00Z","051665","9/23/2021","2021-09-23T04:00:00Z","195 DANIEL LOW TERRACE","40,639,638.000000",40639638,"56fdc1bd-32f4-ea11-b882-24ee9a37d45c","Staten Island",882450004,"-74,079,594.000000",-74079594,"31","P.S. 16 - STATEN ISLAND","Fort Hill Collaborative Elementary School - R010 - R016 - 31R010 - 195 DANIEL LOW TERRACE"
"W/""323000517""","Classroom Closed",882450000,"030f7f2f-cc1b-ec11-b6e6-001dd830a1ac","10/1/2021","2021-10-01T04:00:00Z","051667","9/23/2021","2021-09-23T04:00:00Z","64-35 102 STREET","40,731,016.000000",40731016,"960e6e25-32f4-ea11-b882-24ee9a37d45c","Queens",882450003,"-73,852,210.000000",-73852210,"28","P.S. 175 - QUEENS","P.S. 175 The Lynn Gross Discovery School - Q175 - Q175 - 28Q175 - 64-35 102 STREET"
"W/""320790133""","Partial Classroom Quarantine",882450001,"972d0daf-cc1b-ec11-b6e6-001dd830a1ac","10/2/2021","2021-10-02T04:00:00Z","051670","9/23/2021","2021-09-23T04:00:00Z","4143 THIRD AVENUE","40,845,366.000000",40845366,"8b53dd74-33f4-ea11-b882-24ee9a37d45c","Bronx",882450001,"-73,897,479.000000",-73897479,"9","Eagle Academy For Young Men - Bronx","Eagle Academy for Young Men - X231 - X465 - 09X231 - 4143 THIRD AVENUE"
"W/""323013616""","Classroom Closed",882450000,"f9b13609-cd1b-ec11-b6e6-001dd830a1ac","10/1/2021","2021-10-01T04:00:00Z","051673","9/23/2021","2021-09-23T04:00:00Z","64-35 102 STREET","40,731,016.000000",40731016,"960e6e25-32f4-ea11-b882-24ee9a37d45c","Queens",882450003,"-73,852,210.000000",-73852210,"28","P.S. 175 - QUEENS","P.S. 175 The Lynn Gross Discovery School - Q175 - Q175 - 28Q175 - 64-35 102 STREET"
"W/""322110175""","Classroom Closed",882450000,"d80c5573-5f1c-ec11-b6e6-001dd830a1ac","10/1/2021","2021-10-01T04:00:00Z","051747","9/24/2021","2021-09-24T04:00:00Z","54 OSBORNE STREET","40,536,625.000000",40536625,"3b0410ca-32f4-ea11-b882-24ee9a37d45c","Staten Island",882450004,"-74,163,037.000000",-74163037,"31","P.S. 55 - STATEN ISLAND","P.S. 055 Henry M. Boehm - R055 - R055 - 31R055 - 54 OSBORNE STREET"
"W/""322110215""","Classroom Closed",882450000,"6954d992-621c-ec11-b6e6-001dd830a1ac","10/2/2021","2021-10-02T04:00:00Z","051759","9/24/2021","2021-09-24T04:00:00Z","144 KEATING PLACE","40,591,480.000000",40591480,"dd8521d0-32f4-ea11-b882-24ee9a37d45c","Staten Island",882450004,"-74,157,327.000000",-74157327,"31","P.S. 69 - STATEN ISLAND","P.S. 069 Daniel D. Tompkins - R069 - R069 - 31R069 - 144 KEATING PLACE"
"W/""323289509""","Classroom Closed",882450000,"dac748a4-631c-ec11-b6e6-001dd830a1ac","10/3/2021","2021-10-03T04:00:00Z","051764","9/25/2021","2021-09-25T04:00:00Z","1458 YORK AVENUE","40,770,215.000000",40770215,"1d005d7a-31f4-ea11-b882-24ee9a37d45c","Manhattan",882450000,"-73,950,745.000000",-73950745,"2","P.S. 158 - MANHATTAN","P.S. 158 Bayard Taylor - M158 - M158 - 02M158 - 1458 YORK AVENUE"
"W/""322110240""","Partial Classroom Quarantine",882450001,"5092729c-641c-ec11-b6e6-001dd830a1ac","10/3/2021","2021-10-03T04:00:00Z","051765","9/24/2021","2021-09-24T04:00:00Z","3710 BARNES AVENUE","40,880,649.000000",40880649,"520d6d19-33f4-ea11-b882-24ee9a37d45c","Bronx",882450001,"-73,860,126.000000",-73860126,"11","I.S. 113 - BRONX","North Bronx School of Empowerment - X287 - X113 - 11X287 - 3710 BARNES AVENUE"
"W/""322933592""","Classroom Closed",882450000,"c0627d22-661c-ec11-b6e6-001dd830a1ac","10/2/2021","2021-10-02T04:00:00Z","051770","9/24/2021","2021-09-24T04:00:00Z","2756 RESERVOIR AVENUE","40,869,061.000000",40869061,"19474313-33f4-ea11-b882-24ee9a37d45c","Bronx",882450001,"-73,897,066.000000",-73897066,"10","P.S. 86 - BRONX","P.S. 086 Kingsbridge Heights - X086 - X086 - 10X086 - 2756 RESERVOIR AVENUE"
"W/""322979279""","Classroom Closed",882450000,"fb7dbb3a-661c-ec11-b6e6-001dd830a1ac","10/1/2021","2021-10-01T04:00:00Z","051771","9/24/2021","2021-09-24T04:00:00Z","421 EAST 106 STREET","40,789,535.000000",40789535,"4f9f4974-31f4-ea11-b882-24ee9a37d45c","Manhattan",882450000,"-73,938,727.000000",-73938727,"4","P.S. 146 - MANHATTAN","P.S. 146 Ann M. Short - M146 - M146 - 04M146 - 421 EAST 106 STREET"
"W/""323122995""","Partial Classroom Quarantine",882450001,"64898b5f-671c-ec11-b6e6-001dd830a1ac","10/2/2021","2021-10-02T04:00:00Z","051775","9/24/2021","2021-09-24T04:00:00Z","147-26 25 DRIVE","40,774,906.000000",40774906,"ae0e6e25-32f4-ea11-b882-24ee9a37d45c","Queens",882450003,"-73,818,607.000000",-73818607,"25","J.H.S. 185 - QUEENS","J.H.S. 185 Edward Bleeker - Q185 - Q185 - 25Q185 - 147-26 25 DRIVE"
"W/""323409076""","Partial Classroom Quarantine",882450001,"43e99cf7-671c-ec11-b6e6-001dd830a1ac","10/2/2021","2021-10-02T04:00:00Z","051780","9/24/2021","2021-09-24T04:00:00Z","1010 REV. J. A. POLITE AVENUE","40,823,124.000000",40823124,"8ce03d56-33f4-ea11-b882-24ee9a37d45c","Bronx",882450001,"-73,898,265.000000",-73898265,"12","BRONX REGIONAL HS (OLD 133) - X","Pathways to Graduation - Q950 - X401 - 79Q950 - 1010 REV. J. A. POLITE AVENUE"
"W/""322931874""","Partial Classroom Quarantine",882450001,"df0fdf1f-691c-ec11-b6e6-001dd830a1ac","10/2/2021","2021-10-02T04:00:00Z","051784","9/24/2021","2021-09-24T04:00:00Z","225 WEST  24 STREET","40,745,677.000000",40745677,"94d810ab-31f4-ea11-b882-24ee9a37d45c","Manhattan",882450000,"-73,996,354.000000",-73996354,"2","FASHION INDUSTRIES VOC HS - M","The High School of Fashion Industries - M600 - M600 - 02M600 - 225 WEST  24 STREET"
"W/""322929849""","Partial Classroom Quarantine",882450001,"7be91b2c-691c-ec11-b6e6-001dd830a1ac","10/3/2021","2021-10-03T04:00:00Z","051785","9/24/2021","2021-09-24T04:00:00Z","225 WEST  24 STREET","40,745,677.000000",40745677,"94d810ab-31f4-ea11-b882-24ee9a37d45c","Manhattan",882450000,"-73,996,354.000000",-73996354,"2","FASHION INDUSTRIES VOC HS - M","The High School of Fashion Industries - M600 - M600 - 02M600 - 225 WEST  24 STREET"
"W/""322953805""","Classroom Closed",882450000,"0ed691c5-6a1c-ec11-b6e6-001dd830a1ac","10/2/2021","2021-10-02T04:00:00Z","051795","9/24/2021","2021-09-24T04:00:00Z","1794 EAST 172 STREET","40,832,529.000000",40832529,"5036d900-33f4-ea11-b882-24ee9a37d45c","Bronx",882450001,"-73,866,974.000000",-73866974,"12","P.S. 47 - BRONX","P.S. 047 John Randolph - X047 - X047 - 12X047 - 1794 EAST 172 STREET"
"W/""322986797""","Classroom Closed",882450000,"798f2779-6c1c-ec11-b6e6-001dd830a1ac","10/1/2021","2021-10-01T04:00:00Z","051806","9/24/2021","2021-09-24T04:00:00Z","6701 20 AVENUE","40,614,737.000000",40614737,"11ba8b86-30f4-ea11-b882-24ee9a37d45c","Brooklyn",882450002,"-73,986,792.000000",-73986792,"20","P.S. 205 - BROOKLYN","P.S. 205 Clarion - K205 - K205 - 20K205 - 6701 20 AVENUE"
"W/""322959949""","Partial Classroom Quarantine",882450001,"54a2ab74-6d1c-ec11-b6e6-001dd830a1ac","10/2/2021","2021-10-02T04:00:00Z","051813","9/24/2021","2021-09-24T04:00:00Z","127 EAST  22 STREET","40,739,121.000000",40739121,"680c1bb1-31f4-ea11-b882-24ee9a37d45c","Manhattan",882450000,"-73,985,323.000000",-73985323,"2","SCHL OF THE FUTURE (OLD BACON) - M","School of the Future High School - M413 - M660 - 02M413 - 127 EAST  22 STREET"
"W/""327459657""","Classroom Closed",882450000,"300f4733-6e1c-ec11-b6e6-001dd830a1ac","10/1/2021","2021-10-01T04:00:00Z","051817","9/24/2021","2021-09-24T04:00:00Z","545 WILLOUGHBY AVENUE","40,694,470.000000",40694470,"e5968d36-30f4-ea11-b882-24ee9a37d45c","Brooklyn",882450002,"-73,947,256.000000",-73947256,"14","P.S. 23 - BROOKLYN","P.S. 023 Carter G. Woodson - K023 - K023 - 14K023 - 545 WILLOUGHBY AVENUE"
"W/""322904038""","Non-Classroom Quarantine",882450003,"0be119f8-6f1c-ec11-b6e6-001dd830a1ac","10/2/2021","2021-10-02T04:00:00Z","051821","9/24/2021","2021-09-24T04:00:00Z","131 IRWIN STREET","40,580,161.000000",40580161,"efb98b86-30f4-ea11-b882-24ee9a37d45c","Brooklyn",882450002,"-73,943,498.000000",-73943498,"22","P.S. 195 - BROOKLYN","P.S. 195 Manhattan Beach - K195 - K195 - 22K195 - 131 IRWIN STREET"
"W/""324503867""","Classroom Closed",882450000,"a7468aae-721c-ec11-b6e6-001dd830a1ac","10/1/2021","2021-10-01T04:00:00Z","051846","9/24/2021","2021-09-24T04:00:00Z","189-26 Linden  Boulevard","40,691,643.000000",40691643,"4ef92a2a-4afb-ea11-b883-24ee9a37d459",,,"-73,761,509.000000",-73761509,"29","JAMAICA NAACP DAY CARE CENTER","BAbove 16 - QAPP - QAXJ -  - 189-26 Linden  Boulevard"
"W/""324136833""","Partial Classroom Quarantine",882450001,"e4d1a1b8-751c-ec11-b6e6-001dd830a1ac","10/2/2021","2021-10-02T04:00:00Z","051870","9/24/2021","2021-09-24T04:00:00Z","260 PLEASANT AVENUE","40,794,184.000000",40794184,"7234aa92-31f4-ea11-b882-24ee9a37d45c","Manhattan",882450000,"-73,932,868.000000",-73932868,"4","MANHTN CT FOR MATH & SCI. HS - M","Isaac Newton Middle School for Math & Science - M825 - M435 - 04M825 - 260 PLEASANT AVENUE"
"W/""322988426""","Non-Classroom Quarantine",882450003,"6b6006ca-761c-ec11-b6e6-001dd830a1ac","10/1/2021","2021-10-01T04:00:00Z","051875","9/24/2021","2021-09-24T04:00:00Z","465 NEW DORP LANE","40,570,909.000000",40570909,"fb8521d0-32f4-ea11-b882-24ee9a37d45c","Staten Island",882450004,"-74,105,878.000000",-74105878,"31","NEW DORP HS (NEW) - S. I.","New Dorp High School - R440 - R435 - 31R440 - 465 NEW DORP LANE"
"W/""323400435""","Partial Classroom Quarantine",882450001,"0854694f-791c-ec11-b6e6-001dd830a1ac","10/3/2021","2021-10-03T04:00:00Z","051893","9/25/2021","2021-09-25T04:00:00Z","317 EAST  67 STREET","40,765,638.000000",40765638,"6007e99e-31f4-ea11-b882-24ee9a37d45c","Manhattan",882450000,"-73,959,777.000000",-73959777,"2","JULIA RICHMAN ED. COMPLEX - M","Talent Unlimited High School - M519 - M480 - 02M519 - 317 EAST  67 STREET"
"W/""323289585""","Partial Classroom Quarantine",882450001,"64da0892-7a1c-ec11-b6e6-001dd830a1ac","10/2/2021","2021-10-02T04:00:00Z","051900","9/25/2021","2021-09-25T04:00:00Z","317 EAST  67 STREET","40,765,638.000000",40765638,"6007e99e-31f4-ea11-b882-24ee9a37d45c","Manhattan",882450000,"-73,959,777.000000",-73959777,"2","JULIA RICHMAN ED. COMPLEX - M","Talent Unlimited High School - M519 - M480 - 02M519 - 317 EAST  67 STREET"
"W/""322861732""","Partial Classroom Quarantine",882450001,"626823e2-7a1c-ec11-b6e6-001dd830a1ac","10/3/2021","2021-10-03T04:00:00Z","051905","9/24/2021","2021-09-24T04:00:00Z","122 AMSTERDAM AVENUE","40,774,891.000000",40774891,"7c07e99e-31f4-ea11-b882-24ee9a37d45c","Manhattan",882450000,"-73,985,608.000000",-73985608,"3","MARTIN LUTHER KING, JR. HS - M","Urban Assembly School for Media Studies, The - M307 - M490 - 03M307 - 122 AMSTERDAM AVENUE"
"W/""322839518""","Partial Classroom Quarantine",882450001,"4304d696-7d1c-ec11-b6e6-001dd830a1ac","10/3/2021","2021-10-03T04:00:00Z","051925","9/24/2021","2021-09-24T04:00:00Z","750 DURANT AVENUE","40,545,490.000000",40545490,"5bfdc1bd-32f4-ea11-b882-24ee9a37d45c","Staten Island",882450004,"-74,145,558.000000",-74145558,"31","I.S. 24 - STATEN ISLAND","I.S. 024 Myra S. Barnes - R024 - R024 - 31R024 - 750 DURANT AVENUE"
"W/""322110729""","Partial Classroom Quarantine",882450001,"3e05055d-831c-ec11-b6e6-001dd830a1ac","10/1/2021","2021-10-01T04:00:00Z","051954","9/24/2021","2021-09-24T04:00:00Z","160 BEACH  29 STREET","40,593,480.000000",40593480,"ee8442ee-31f4-ea11-b882-24ee9a37d45c","Queens",882450003,"-73,761,086.000000",-73761086,"27","P.S. 43 - QUEENS","P.S. 043 - Q043 - Q043 - 27Q043 - 160 BEACH  29 STREET"
"W/""323289617""","Classroom Closed",882450000,"dfd8ff86-841c-ec11-b6e6-001dd830a1ac","10/2/2021","2021-10-02T04:00:00Z","051962","9/25/2021","2021-09-25T04:00:00Z","8515 RIDGE BOULEVARD","40,624,419.000000",40624419,"1dbdc8e1-49fb-ea11-b883-24ee9a37d459",,,"-74,032,986.000000",-74032986,"20","ADELPHI ACADEMY","Adelphi Academy - KAAE - KAAE -  - 8515 RIDGE BOULEVARD"
"W/""322993800""","Partial Classroom Quarantine",882450001,"3f63769e-901c-ec11-b6e6-001dd830a1ac","10/1/2021","2021-10-01T04:00:00Z","052019","9/24/2021","2021-09-24T04:00:00Z","154-60 17 AVENUE","40,783,231.000000",40783231,"8a977d2b-32f4-ea11-b882-24ee9a37d45c","Queens",882450003,"-73,806,990.000000",-73806990,"25","J.H.S. 194 - QUEENS","J.H.S. 194 William Carr - Q194 - Q194 - 25Q194 - 154-60 17 AVENUE"
"W/""322996159""","Partial Classroom Quarantine",882450001,"e1410855-931c-ec11-b6e6-001dd830a1ac","10/1/2021","2021-10-01T04:00:00Z","052036","9/24/2021","2021-09-24T04:00:00Z","577 EAST 179 STREET","40,848,702.000000",40848702,"0b78931f-33f4-ea11-b882-24ee9a37d45c","Bronx",882450001,"-73,892,482.000000",-73892482,"10","I.S. 118 - BRONX","J.H.S. 118 William W. Niles - X118 - X118 - 10X118 - 577 EAST 179 STREET"
"W/""322332711""","Partial Classroom Quarantine",882450001,"364a0b37-991c-ec11-b6e6-001dd830a1ac","10/2/2021","2021-10-02T04:00:00Z","052067","9/24/2021","2021-09-24T04:00:00Z","145-00 SPRINGFIELD BOULEVARD","40,664,809.000000",40664809,"0c06003e-32f4-ea11-b882-24ee9a37d45c","Queens",882450003,"-73,759,396.000000",-73759396,"29","I.S. 231 (TANDEM Q251) - QUEENS","Community Voices Middle School - Q356 - Q231 - 29Q356 - 145-00 SPRINGFIELD BOULEVARD"
"W/""325758452""","Classroom Closed",882450000,"b6b9ee32-9c1c-ec11-b6e6-001dd830a1ac","10/1/2021","2021-10-01T04:00:00Z","052082","9/27/2021","2021-09-27T04:00:00Z","400 ASHFORD STREET","40,672,590.000000",40672590,"29ebaa73-30f4-ea11-b882-24ee9a37d45c","Brooklyn",882450002,"-73,885,214.000000",-73885214,"19","P.S. 158 - BROOKLYN","P.S. 158 Warwick - K158 - K158 - 19K158 - 400 ASHFORD STREET"
"W/""324598792""","Partial Classroom Quarantine",882450001,"df4211ff-a11c-ec11-b6e6-001dd830a1ac","10/2/2021","2021-10-02T04:00:00Z","052112","9/25/2021","2021-09-25T04:00:00Z","3750 BAYCHESTER AVENUE","40,886,002.000000",40886002,"a32aa42b-33f4-ea11-b882-24ee9a37d45c","Bronx",882450001,"-73,839,682.000000",-73839682,"11","I.S. 142 - BRONX","One World Middle School at Edenwald - X529 - X142 - 11X529 - 3750 BAYCHESTER AVENUE"
"W/""323289739""","Classroom Closed",882450000,"7811f328-a21c-ec11-b6e6-001dd830a1ac","10/1/2021","2021-10-01T04:00:00Z","052114","9/25/2021","2021-09-25T04:00:00Z","2950 WEST  25 STREET","40,574,029.000000",40574029,"79283fb1-30f4-ea11-b882-24ee9a37d45c","Brooklyn",882450002,"-73,992,393.000000",-73992393,"21","P.S. 288 - BROOKLYN","P.S. 288 The Shirley Tanyhill - K288 - K288 - 21K288 - 2950 WEST  25 STREET"
"W/""323409142""","Partial Classroom Quarantine",882450001,"89cae8bf-a21c-ec11-b6e6-001dd830a1ac","10/2/2021","2021-10-02T04:00:00Z","052118","9/24/2021","2021-09-24T04:00:00Z","2950 WEST  25 STREET","40,574,029.000000",40574029,"79283fb1-30f4-ea11-b882-24ee9a37d45c","Brooklyn",882450002,"-73,992,393.000000",-73992393,"21","P.S. 288 - BROOKLYN","P.S. 288 The Shirley Tanyhill - K288 - K288 - 21K288 - 2950 WEST  25 STREET"
"W/""322935864""","Classroom Closed",882450000,"fd607805-a51c-ec11-b6e6-001dd830a1ac","10/2/2021","2021-10-02T04:00:00Z","052129","9/24/2021","2021-09-24T04:00:00Z","939 83 Street","0.000000",0,"74de261e-4afb-ea11-b883-24ee9a37d459",,,"0.000000",0,"20","Redeemer St. John's Nursery School","Redeemer St. John's Nursery School - KCPO - KCPO -  - 939 83 Street"
"W/""323289847""","Classroom Closed",882450000,"05b3c2ae-2b1d-ec11-b6e6-001dd830a1ac","10/3/2021","2021-10-03T04:00:00Z","052156","9/25/2021","2021-09-25T04:00:00Z","140 PALMA DRIVE","40,611,136.000000",40611136,"410410ca-32f4-ea11-b882-24ee9a37d45c","Staten Island",882450004,"-74,083,799.000000",-74083799,"31","P.S. 57 - STATEN ISLAND","P.S. 057 Hubert H. Humphrey - R057 - R057 - 31R057 - 140 PALMA DRIVE"
"W/""323289870""","Partial Classroom Quarantine",882450001,"023d900f-2c1d-ec11-b6e6-001dd830a1ac","10/3/2021","2021-10-03T04:00:00Z","052158","9/25/2021","2021-09-25T04:00:00Z","149-11 MELBOURNE AVENUE","40,737,038.000000",40737038,"1db4977a-32f4-ea11-b882-24ee9a37d45c","Queens",882450003,"-73,821,532.000000",-73821532,"25","TOWNSEND HARRIS HS - Q","P.S. Q255 - Q255 - Q515 - 75Q255 - 149-11 MELBOURNE AVENUE"
"W/""324321082""","Partial Classroom Quarantine",882450001,"be18a4d5-2e1d-ec11-b6e6-001dd830a1ac","10/4/2021","2021-10-04T04:00:00Z","052170","9/25/2021","2021-09-25T04:00:00Z","30-20 THOMSON AVENUE","40,744,175.000000",40744175,"db2ece86-32f4-ea11-b882-24ee9a37d45c","Queens",882450003,"-73,937,004.000000",-73937004,"24","QUEENS HIGH SCHOOL COMPLEX - Q","Bard High School Early College Queens - Q299 - Q735 - 24Q299 - 30-20 THOMSON AVENUE"
"W/""327253173""","Partial Classroom Quarantine",882450001,"5d6825a4-341d-ec11-b6e6-001dd830a1ac","10/3/2021","2021-10-03T04:00:00Z","052185","9/25/2021","2021-09-25T04:00:00Z","91-30 METROPOLITAN AVENUE","40,708,431.000000",40708431,"a372c880-32f4-ea11-b882-24ee9a37d45c","Queens",882450003,"-73,855,543.000000",-73855543,"28","METROPOLITAN AVENUE CAMPUS - QUEENS","P.S. Q233 - Q233 - Q686 - 75Q233 - 91-30 METROPOLITAN AVENUE"
"W/""325245542""","Partial Classroom Quarantine",882450001,"d07d7135-371d-ec11-b6e6-001dd830a1ac","10/3/2021","2021-10-03T04:00:00Z","052200","9/25/2021","2021-09-25T04:00:00Z","2401 NEPTUNE AVENUE","40,578,640.000000",40578640,"6ca5db98-30f4-ea11-b882-24ee9a37d45c","Brooklyn",882450002,"-73,992,447.000000",-73992447,"21","I.S. 239 - BROOKLYN","Mark Twain I.S. 239 for the Gifted & Talented - K239 - K239 - 21K239 - 2401 NEPTUNE AVENUE"
"W/""324170033""","Classroom Closed",882450000,"f6afe079-371d-ec11-b6e6-001dd830a1ac","10/2/2021","2021-10-02T04:00:00Z","052203","9/25/2021","2021-09-25T04:00:00Z","1155 CROMWELL AVENUE","40,834,979.000000",40834979,"5d0d6d19-33f4-ea11-b882-24ee9a37d45c","Bronx",882450001,"-73,923,297.000000",-73923297,"9","P.S. 114 - BRONX","P.S. X114 - Luis Llorens Torres Schools - X114 - X114 - 09X114 - 1155 CROMWELL AVENUE"
"W/""323290165""","Classroom Closed",882450000,"05a8cefe-391d-ec11-b6e6-001dd830a1ac","10/1/2021","2021-10-01T04:00:00Z","052216","9/25/2021","2021-09-25T04:00:00Z","900 ADEE AVENUE","40,869,059.000000",40869059,"250b210d-33f4-ea11-b882-24ee9a37d45c","Bronx",882450001,"-73,860,928.000000",-73860928,"11","P.S. 76 - BRONX","P.S. 076 The Bennington School - X076 - X076 - 11X076 - 900 ADEE AVENUE"
"W/""323290285""","Partial Classroom Quarantine",882450001,"e5d35fbb-3e1d-ec11-b6e6-001dd830a1ac","10/2/2021","2021-10-02T04:00:00Z","052244","9/25/2021","2021-09-25T04:00:00Z","241 EMERSON PLACE","40,691,275.000000",40691275,"87b50aa5-30f4-ea11-b882-24ee9a37d45c","Brooklyn",882450002,"-73,961,134.000000",-73961134,"13","P.S. 270 - BROOKLYN","Community Partnership Charter School - K702 - K270 - 84K702 - 241 EMERSON PLACE"
"W/""323290290""","Partial Classroom Quarantine",882450001,"7a900209-3f1d-ec11-b6e6-001dd830a1ac","10/3/2021","2021-10-03T04:00:00Z","052246","9/25/2021","2021-09-25T04:00:00Z","125 COVERT STREET","40,688,647.000000",40688647,"99283fb1-30f4-ea11-b882-24ee9a37d45c","Brooklyn",882450002,"-73,910,589.000000",-73910589,"32","I.S. 296 - BROOKLYN","Evergreen Middle School for Urban Exploration - K562 - K296 - 32K562 - 125 COVERT STREET"
"W/""324598222""","Partial Classroom Quarantine",882450001,"ee5dda5b-411d-ec11-b6e6-001dd830a1ac","10/3/2021","2021-10-03T04:00:00Z","052256","9/25/2021","2021-09-25T04:00:00Z","8787 24 AVENUE","40,594,648.000000",40594648,"f2201dab-30f4-ea11-b882-24ee9a37d45c","Brooklyn",882450002,"-73,993,565.000000",-73993565,"21","I.S. 281 - BROOKLYN","I.S. 281 Joseph B Cavallaro - K281 - K281 - 21K281 - 8787 24 AVENUE"
"W/""325764244""","Partial Classroom Quarantine",882450001,"546850c0-521d-ec11-b6e6-001dd830a1ac","10/1/2021","2021-10-01T04:00:00Z","052330","9/25/2021","2021-09-25T04:00:00Z","100 ESSEX DRIVE","40,581,958.000000",40581958,"a0a9d9c3-32f4-ea11-b882-24ee9a37d45c","Staten Island",882450004,"-74,159,343.000000",-74159343,"31","JEROME PARKER CAMPUS - S.I.","CSI High School for International Studies - R047 - R043 - 31R047 - 100 ESSEX DRIVE"
"W/""323685432""","Classroom Closed",882450000,"fbe2a95d-571d-ec11-b6e6-001dd830a1ac","10/4/2021","2021-10-04T04:00:00Z","052344","9/25/2021","2021-09-25T04:00:00Z","400 ASHFORD STREET","40,672,590.000000",40672590,"29ebaa73-30f4-ea11-b882-24ee9a37d45c","Brooklyn",882450002,"-73,885,214.000000",-73885214,"19","P.S. 158 - BROOKLYN","P.S. 158 Warwick - K158 - K158 - 19K158 - 400 ASHFORD STREET"
"W/""324599196""","Partial Classroom Quarantine",882450001,"e43f2dc5-581d-ec11-b6e6-001dd830a1ac","10/1/2021","2021-10-01T04:00:00Z","052353","9/25/2021","2021-09-25T04:00:00Z","105 East 106th Street","40,792,932.000000",40792932,"d4ed94c3-31f4-ea11-b882-24ee9a37d45c","Manhattan",882450000,"-73,947,171.000000",-73947171,"4","YOUNG WOMEN'S LEADERSHIP HS - M","Young Women's Leadership School - M610 - M895 - 04M610 - 105 East 106th Street"
"W/""324135978""","Partial Classroom Quarantine",882450001,"42d533cb-581d-ec11-b6e6-001dd830a1ac","10/2/2021","2021-10-02T04:00:00Z","052354","9/25/2021","2021-09-25T04:00:00Z","105 East 106th Street","40,792,932.000000",40792932,"d4ed94c3-31f4-ea11-b882-24ee9a37d45c","Manhattan",882450000,"-73,947,171.000000",-73947171,"4","YOUNG WOMEN'S LEADERSHIP HS - M","Young Women's Leadership School - M610 - M895 - 04M610 - 105 East 106th Street"
"W/""323290730""","Partial Classroom Quarantine",882450001,"391f8a17-5e1d-ec11-b6e6-001dd830a1ac","10/1/2021","2021-10-01T04:00:00Z","052365","9/25/2021","2021-09-25T04:00:00Z","2839 BEDFORD AVENUE","40,632,829.000000",40632829,"4d8dbfcf-30f4-ea11-b882-24ee9a37d45c","Brooklyn",882450002,"-73,952,356.000000",-73952356,"22","MIDWOOD HS - K","Midwood High School - K405 - K405 - 22K405 - 2839 BEDFORD AVENUE"
"W/""324370798""","Classroom Closed",882450000,"8dde8e0b-5f1d-ec11-b6e6-001dd830a1ac","10/1/2021","2021-10-01T04:00:00Z","052367","9/24/2021","2021-09-24T04:00:00Z","86-50 109 STREET","40,696,653.000000",40696653,"1d7eed06-32f4-ea11-b882-24ee9a37d45c","Queens",882450003,"-73,839,517.000000",-73839517,"27","P.S. 90 - QUEENS","P.S. 090 Horace Mann - Q090 - Q090 - 27Q090 - 86-50 109 STREET"
"W/""323290783""","Non-Classroom Quarantine",882450003,"1ffae4f7-611d-ec11-b6e6-001dd830a1ac","10/2/2021","2021-10-02T04:00:00Z","052377","9/25/2021","2021-09-25T04:00:00Z","101-01 ROCKAWAY BOULEVARD","40,680,065.000000",40680065,"6abc9674-32f4-ea11-b882-24ee9a37d45c","Queens",882450003,"-73,838,616.000000",-73838616,"27","JOHN ADAMS HS - QUEENS","John Adams High School - Q480 - Q480 - 27Q480 - 101-01 ROCKAWAY BOULEVARD"
"W/""328071546""","Classroom Closed",882450000,"81637026-651d-ec11-b6e6-001dd830a1ac","10/2/2021","2021-10-02T04:00:00Z","052400","9/25/2021","2021-09-25T04:00:00Z","3829 AVENUE K","40,626,038.000000",40626038,"b4315367-30f4-ea11-b882-24ee9a37d45c","Brooklyn",882450002,"-73,938,733.000000",-73938733,"22","P.S. 119 - BROOKLYN","P.S. 119 Amersfort - K119 - K119 - 22K119 - 3829 AVENUE K"
"W/""326700912""","Partial Classroom Quarantine",882450001,"905ded84-681d-ec11-b6e6-001dd830a1ac","10/4/2021","2021-10-04T04:00:00Z","052419","9/25/2021","2021-09-25T04:00:00Z","3000 EAST TREMONT AVENUE","40,839,775.000000",40839775,"b556635c-33f4-ea11-b882-24ee9a37d45c","Bronx",882450001,"-73,839,583.000000",-73839583,"11","HERBERT H. LEHMAN HS - X","Herbert H. Lehman High School - X405 - X405 - 08X405 - 3000 EAST TREMONT AVENUE"
"W/""325531450""","Non-Classroom Quarantine",882450003,"67e71a41-6b1d-ec11-b6e6-001dd830a1ac","10/3/2021","2021-10-03T04:00:00Z","052436","9/25/2021","2021-09-25T04:00:00Z","3000 EAST TREMONT AVENUE","40,839,775.000000",40839775,"b556635c-33f4-ea11-b882-24ee9a37d45c","Bronx",882450001,"-73,839,583.000000",-73839583,"11","HERBERT H. LEHMAN HS - X","Herbert H. Lehman High School - X405 - X405 - 08X405 - 3000 EAST TREMONT AVENUE"
"W/""326843354""","Partial Classroom Quarantine",882450001,"d061fceb-6b1d-ec11-b6e6-001dd830a1ac","10/3/2021","2021-10-03T04:00:00Z","052440","9/25/2021","2021-09-25T04:00:00Z","5800 20 AVENUE","40,621,299.000000",40621299,"682b3eee-30f4-ea11-b882-24ee9a37d45c","Brooklyn",882450002,"-73,982,583.000000",-73982583,"20","FRANKLIN D. ROOSEVELT HS - K","Franklin Delano Roosevelt High School - K505 - K505 - 20K505 - 5800 20 AVENUE"
"W/""323024119""","Classroom Closed",882450000,"e5209146-d51a-ec11-b6e6-001dd830a530","10/1/2021","2021-10-01T04:00:00Z","051108","9/22/2021","2021-09-22T04:00:00Z","306 FORT WASHINGTON AVENUE","40,845,459.000000",40845459,"3c005d7a-31f4-ea11-b882-24ee9a37d45c","Manhattan",882450000,"-73,939,785.000000",-73939785,"6","P.S. 173 - MANHATTAN","P.S. 173 - M173 - M173 - 06M173 - 306 FORT WASHINGTON AVENUE"
"W/""323026115""","Classroom Closed",882450000,"63f1fce5-e01a-ec11-b6e6-001dd830a530","10/1/2021","2021-10-01T04:00:00Z","051160","9/22/2021","2021-09-22T04:00:00Z","1550 VYSE AVENUE","40,834,188.000000",40834188,"5836d900-33f4-ea11-b882-24ee9a37d45c","Bronx",882450001,"-73,886,995.000000",-73886995,"12","P.S. 50 - BRONX","Samara Community School - X458 - X050 - 12X458 - 1550 VYSE AVENUE"
"W/""319371475""","Partial Classroom Quarantine",882450001,"f6096f2f-f41a-ec11-b6e6-001dd830a530","10/1/2021","2021-10-01T04:00:00Z","051284","9/22/2021","2021-09-22T04:00:00Z","74-01 78 AVENUE","40,705,187.000000",40705187,"d92ff20c-32f4-ea11-b882-24ee9a37d45c","Queens",882450003,"-73,875,073.000000",-73875073,"24","I.S. 119 - QUEENS","P.S./I.S. 119 The Glendale - Q119 - Q119 - 24Q119 - 74-01 78 AVENUE"
"W/""323020449""","Classroom Closed",882450000,"a6c96f92-ff1a-ec11-b6e6-001dd830a530","10/1/2021","2021-10-01T04:00:00Z","051342","9/22/2021","2021-09-22T04:00:00Z","2512 Marion Avenue","40,861,316.000000",40861316,"60ffcc6e-33f4-ea11-b882-24ee9a37d45c","Bronx",882450001,"-73,893,236.000000",-73893236,"10","PRE-K CENTER @MARION AVENUE - BRONX","Rose Hill Pre-K Center - X535 - X444 - 10X535 - 2512 Marion Avenue"
"W/""323021210""","Partial Classroom Quarantine",882450001,"457dd21b-011b-ec11-b6e6-001dd830a530","10/1/2021","2021-10-01T04:00:00Z","051347","9/22/2021","2021-09-22T04:00:00Z","57-00 223RD STREET","40,752,343.000000",40752343,"86e2635c-32f4-ea11-b882-24ee9a37d45c","Queens",882450003,"-73,757,271.000000",-73757271,"26","BENJAMIN N. CARDOZO HS - Q","Benjamin N. Cardozo High School - Q415 - Q415 - 26Q415 - 57-00 223RD STREET"
"W/""323029628""","Classroom Closed",882450000,"e66cf1dd-041b-ec11-b6e6-001dd830a530","10/1/2021","2021-10-01T04:00:00Z","051362","9/22/2021","2021-09-22T04:00:00Z","2050 PROSPECT AVENUE","40,846,128.000000",40846128,"d4ab074a-33f4-ea11-b882-24ee9a37d45c","Bronx",882450001,"-73,886,721.000000",-73886721,"12","P.S. 234 (PAIRED W I129) - BRONX","The School of Science and Applied Learning - X300 - X234 - 12X300 - 2050 PROSPECT AVENUE"
"W/""323023141""","Partial Classroom Quarantine",882450001,"24b16fbd-121b-ec11-b6e6-001dd830a530","10/1/2021","2021-10-01T04:00:00Z","051411","9/22/2021","2021-09-22T04:00:00Z","121-10 ROCKAWAY BOULEVARD","40,675,021.000000",40675021,"1eb7c337-32f4-ea11-b882-24ee9a37d45c","Queens",882450003,"-73,816,730.000000",-73816730,"27","I.S. 226 - QUEENS","J.H.S. 226 Virgil I. Grissom - Q226 - Q226 - 27Q226 - 121-10 ROCKAWAY BOULEVARD"
"W/""323012665""","Partial Classroom Quarantine",882450001,"356fcf85-981b-ec11-b6e6-001dd830a530","10/1/2021","2021-10-01T04:00:00Z","051421","9/23/2021","2021-09-23T04:00:00Z","3710 BARNES AVENUE","40,880,649.000000",40880649,"520d6d19-33f4-ea11-b882-24ee9a37d45c","Bronx",882450001,"-73,860,126.000000",-73860126,"11","I.S. 113 - BRONX","North Bronx School of Empowerment - X287 - X113 - 11X287 - 3710 BARNES AVENUE"
"W/""323198732""","Classroom Closed",882450000,"f68fb43c-a11b-ec11-b6e6-001dd830a530","10/1/2021","2021-10-01T04:00:00Z","051456","9/24/2021","2021-09-24T04:00:00Z","2589 7 AVENUE","40,823,988.000000",40823988,"848d8486-31f4-ea11-b882-24ee9a37d45c","Manhattan",882450000,"-73,935,746.000000",-73935746,"5","P.S. 200 (TANDEM M010) - MANHATTAN","P.S. 200- The James McCune Smith School - M200 - M200 - 05M200 - 2589 7 AVENUE"
"W/""323016418""","Partial Classroom Quarantine",882450001,"ce58f2e0-ac1b-ec11-b6e6-001dd830a530","10/1/2021","2021-10-01T04:00:00Z","051515","9/23/2021","2021-09-23T04:00:00Z","105 East 106th Street","40,792,932.000000",40792932,"d4ed94c3-31f4-ea11-b882-24ee9a37d45c","Manhattan",882450000,"-73,947,171.000000",-73947171,"4","YOUNG WOMEN'S LEADERSHIP HS - M","Young Women's Leadership School - M610 - M895 - 04M610 - 105 East 106th Street"
"W/""322984512""","Partial Classroom Quarantine",882450001,"82cbafda-b41b-ec11-b6e6-001dd830a530","10/2/2021","2021-10-02T04:00:00Z","051548","9/23/2021","2021-09-23T04:00:00Z","760 Van Siclen Avenue","40,661,102.000000",40661102,"7b3fd300-d214-ec11-b8b5-24ee9a37d45c",,,"-73,886,668.000000",-73886668,"19","K599  East New York","East New York Family Academy - K409 - K599 - 19K409 - 760 Van Siclen Avenue"
"W/""323016325""","Partial Classroom Quarantine",882450001,"4f42baa6-b61b-ec11-b6e6-001dd830a530","10/1/2021","2021-10-01T04:00:00Z","051556","9/23/2021","2021-09-23T04:00:00Z","8787 24 AVENUE","40,594,648.000000",40594648,"f2201dab-30f4-ea11-b882-24ee9a37d45c","Brooklyn",882450002,"-73,993,565.000000",-73993565,"21","I.S. 281 - BROOKLYN","I.S. 281 Joseph B Cavallaro - K281 - K281 - 21K281 - 8787 24 AVENUE"
"W/""320789857""","Partial Classroom Quarantine",882450001,"6fb4deb8-b61b-ec11-b6e6-001dd830a530","10/1/2021","2021-10-01T04:00:00Z","051557","9/23/2021","2021-09-23T04:00:00Z","29 FT GREENE PLACE","40,688,896.000000",40688896,"3188e6db-30f4-ea11-b882-24ee9a37d45c","Brooklyn",882450002,"-73,976,435.000000",-73976435,"13","BROOKLYN TECH HS - K","Brooklyn Technical High School - K430 - K430 - 13K430 - 29 FT GREENE PLACE"
"W/""322110069""","Partial Classroom Quarantine",882450001,"8762ae84-bb1b-ec11-b6e6-001dd830a530","10/1/2021","2021-10-01T04:00:00Z","051591","9/24/2021","2021-09-24T04:00:00Z","145-00 SPRINGFIELD BOULEVARD","40,664,809.000000",40664809,"0c06003e-32f4-ea11-b882-24ee9a37d45c","Queens",882450003,"-73,759,396.000000",-73759396,"29","I.S. 231 (TANDEM Q251) - QUEENS","Community Voices Middle School - Q356 - Q231 - 29Q356 - 145-00 SPRINGFIELD BOULEVARD"
"W/""323015460""","Partial Classroom Quarantine",882450001,"1b3ea958-bc1b-ec11-b6e6-001dd830a530","10/1/2021","2021-10-01T04:00:00Z","051593","9/23/2021","2021-09-23T04:00:00Z","3710 BARNES AVENUE","40,880,649.000000",40880649,"520d6d19-33f4-ea11-b882-24ee9a37d45c","Bronx",882450001,"-73,860,126.000000",-73860126,"11","I.S. 113 - BRONX","Leaders of Tomorrow - X370 - X113 - 11X370 - 3710 BARNES AVENUE"
"W/""323017393""","Classroom Closed",882450000,"e5aaed3d-ca1b-ec11-b6e6-001dd830a530","10/1/2021","2021-10-01T04:00:00Z","051658","9/23/2021","2021-09-23T04:00:00Z","64 WEST 17 STREET","40,739,145.000000",40739145,"e3e0838c-31f4-ea11-b882-24ee9a37d45c","Manhattan",882450000,"-73,995,534.000000",-73995534,"2","THE SIXTH AVENUE EDUCATIONAL CAMPUS - MANHATTAN","Sixth Avenue Elementary School - M340 - M340 - 02M340 - 64 WEST 17 STREET"
"W/""322110104""","Classroom Closed",882450000,"607389cc-cf1b-ec11-b6e6-001dd830a530","10/1/2021","2021-10-01T04:00:00Z","051685","9/24/2021","2021-09-24T04:00:00Z","549 AUDUBON AVENUE","40,856,532.000000",40856532,"fced94c3-31f4-ea11-b882-24ee9a37d45c","Manhattan",882450000,"-73,926,060.000000",-73926060,"6","I.S. 349 - MANHATTAN","The Equity Project Charter School (TEP) - M430 - M965 - 84M430 - 549 AUDUBON AVENUE"
"W/""322110114""","Partial Classroom Quarantine",882450001,"5e716b69-d01b-ec11-b6e6-001dd830a530","10/1/2021","2021-10-01T04:00:00Z","051690","9/24/2021","2021-09-24T04:00:00Z","145-00 SPRINGFIELD BOULEVARD","40,664,809.000000",40664809,"0c06003e-32f4-ea11-b882-24ee9a37d45c","Queens",882450003,"-73,759,396.000000",-73759396,"29","I.S. 231 (TANDEM Q251) - QUEENS","Collaborative Arts Middle School - Q355 - Q231 - 29Q355 - 145-00 SPRINGFIELD BOULEVARD"
"W/""323006734""","Classroom Closed",882450000,"f05c66c3-d11b-ec11-b6e6-001dd830a530","10/1/2021","2021-10-01T04:00:00Z","051701","9/23/2021","2021-09-23T04:00:00Z","800 TAYLOR AVENUE","40,822,552.000000",40822552,"50474313-33f4-ea11-b882-24ee9a37d45c","Bronx",882450001,"-73,862,760.000000",-73862760,"8","P.S. 100 - BRONX","P.S. 100 Isaac Clason - X100 - X100 - 08X100 - 800 TAYLOR AVENUE"
"W/""323014637""","Partial Classroom Quarantine",882450001,"087cb6ff-d11b-ec11-b6e6-001dd830a530","10/1/2021","2021-10-01T04:00:00Z","051703","9/23/2021","2021-09-23T04:00:00Z","46 MCKEEVER PLACE","40,665,199.000000",40665199,"a1e657bd-30f4-ea11-b882-24ee9a37d45c","Brooklyn",882450002,"-73,959,484.000000",-73959484,"17","P.S. 375 - BROOKLYN","Ebbets Field Middle School - K352 - K320 - 17K352 - 46 MCKEEVER PLACE"
"W/""322990755""","Classroom Closed",882450000,"666adb7f-db1b-ec11-b6e6-001dd830a530","10/1/2021","2021-10-01T04:00:00Z","051738","9/24/2021","2021-09-24T04:00:00Z","730 CONCOURSE VILLAGE WEST","40,821,828.000000",40821828,"0ea31781-33f4-ea11-b882-24ee9a37d45c","Bronx",882450001,"-73,922,366.000000",-73922366,"7","MOTT HAVEN EDUCATIONAL CAMPUS - BRONX","KIPP Academy Charter School - X704 - X790 - 84X704 - 730 CONCOURSE VILLAGE WEST"
"W/""323020105""","Classroom Closed",882450000,"2b5e4c48-de1b-ec11-b6e6-001dd830a530","10/1/2021","2021-10-01T04:00:00Z","051745","9/23/2021","2021-09-23T04:00:00Z","557 PENNSYLVANIA AVENUE","40,664,067.000000",40664067,"e7f57030-30f4-ea11-b882-24ee9a37d45c","Brooklyn",882450002,"-73,893,328.000000",-73893328,"19","P.S. 13 - BROOKLYN","Achievement First East New York Charter School - K358 - K013 - 84K358 - 557 PENNSYLVANIA AVENUE"
"W/""324600227""","Classroom Closed",882450000,"6854c247-601c-ec11-b6e6-001dd830a530","10/2/2021","2021-10-02T04:00:00Z","051750","9/24/2021","2021-09-24T04:00:00Z","126-10 109 AVENUE","40,683,585.000000",40683585,"df2ff20c-32f4-ea11-b882-24ee9a37d45c","Queens",882450003,"-73,815,330.000000",-73815330,"28","P.S. 121 - QUEENS","P.S. 121 Queens - Q121 - Q121 - 28Q121 - 126-10 109 AVENUE"
"W/""322998236""","Partial Classroom Quarantine",882450001,"8af7cf65-671c-ec11-b6e6-001dd830a530","10/1/2021","2021-10-01T04:00:00Z","051776","9/24/2021","2021-09-24T04:00:00Z","105 HAMILTON AVENUE","40,645,436.000000",40645436,"5a5b4cd6-32f4-ea11-b882-24ee9a37d45c","Staten Island",882450004,"-74,082,149.000000",-74082149,"31","CURTIS HS - S. I.","Curtis High School - R450 - R450 - 31R450 - 105 HAMILTON AVENUE"
"W/""322995069""","Partial Classroom Quarantine",882450001,"13f5ace2-671c-ec11-b6e6-001dd830a530","10/1/2021","2021-10-01T04:00:00Z","051779","9/24/2021","2021-09-24T04:00:00Z","330 ALABAMA AVENUE","40,667,985.000000",40667985,"0ca198c3-30f4-ea11-b882-24ee9a37d45c","Brooklyn",882450002,"-73,898,249.000000",-73898249,"19","P.S. 328 - BROOKLYN","Hyde Leadership Charter School- Brooklyn - K769 - K328 - 84K769 - 330 ALABAMA AVENUE"
"W/""322866786""","Classroom Closed",882450000,"a309297c-6c1c-ec11-b6e6-001dd830a530","10/3/2021","2021-10-03T04:00:00Z","051807","9/24/2021","2021-09-24T04:00:00Z","1007 EVERGREEN AVENUE","40,823,941.000000",40823941,"6a01ce37-33f4-ea11-b882-24ee9a37d45c","Bronx",882450001,"-73,880,479.000000",-73880479,"8","P.S. 152 - BRONX","P.S. 152 Evergreen - X152 - X152 - 08X152 - 1007 EVERGREEN AVENUE"
"W/""323113726""","Partial Classroom Quarantine",882450001,"c52376ff-6e1c-ec11-b6e6-001dd830a530","10/2/2021","2021-10-02T04:00:00Z","051819","9/24/2021","2021-09-24T04:00:00Z","160-20 GOETHALS AVENUE","40,718,027.000000",40718027,"ad72c880-32f4-ea11-b882-24ee9a37d45c","Queens",882450003,"-73,805,923.000000",-73805923,"28","QUEENS GATEWAY TO HEALTH SCIENCES SECONDARY SCHOOL","Queens Gateway to Health Sciences Secondary School - Q680 - Q695 - 28Q680 - 160-20 GOETHALS AVENUE"
"W/""322982480""","Partial Classroom Quarantine",882450001,"24b0ca6d-701c-ec11-b6e6-001dd830a530","10/1/2021","2021-10-01T04:00:00Z","051829","9/24/2021","2021-09-24T04:00:00Z","8787 24 AVENUE","40,594,648.000000",40594648,"f2201dab-30f4-ea11-b882-24ee9a37d45c","Brooklyn",882450002,"-73,993,565.000000",-73993565,"21","I.S. 281 - BROOKLYN","DYCD - I.S. 281 Joseph B Cavallaro - 134221-1 - 8787 24 AVENUE"
"W/""322980177""","Classroom Closed",882450000,"e37ab290-721c-ec11-b6e6-001dd830a530","10/1/2021","2021-10-01T04:00:00Z","051844","9/25/2021","2021-09-25T04:00:00Z","60 EAST  94 STREET","40,663,388.000000",40663388,"308dbfcf-30f4-ea11-b882-24ee9a37d45c","Brooklyn",882450002,"-73,927,979.000000",-73927979,"17","P.S. 398 (UDC) - BROOKLYN","P.S. 770 New American Academy - K770 - K398 - 17K770 - 60 EAST  94 STREET"
"W/""322994424""","Partial Classroom Quarantine",882450001,"860f463e-741c-ec11-b6e6-001dd830a530","10/1/2021","2021-10-01T04:00:00Z","051861","9/24/2021","2021-09-24T04:00:00Z","1980 LAFAYETTE AVENUE","40,821,218.000000",40821218,"62ffcc6e-33f4-ea11-b882-24ee9a37d45c","Bronx",882450001,"-73,855,930.000000",-73855930,"8","Adlai E. Stevenson Educational Campus","Gotham Collaborative High School - X452 - X450 - 08X452 - 1980 LAFAYETTE AVENUE"
"W/""322110568""","Partial Classroom Quarantine",882450001,"40677986-771c-ec11-b6e6-001dd830a530","10/2/2021","2021-10-02T04:00:00Z","051881","9/24/2021","2021-09-24T04:00:00Z","700 BAYCHESTER AVENUE","40,874,035.000000",40874035,"ea8a0044-33f4-ea11-b882-24ee9a37d45c","Bronx",882450001,"-73,831,669.000000",-73831669,"11","I.S. 180 - BRONX","M.S. 180 Dr. Daniel Hale Williams - X180 - X180 - 11X180 - 700 BAYCHESTER AVENUE"
"W/""322846003""","Classroom Closed",882450000,"5a451713-791c-ec11-b6e6-001dd830a530","10/3/2021","2021-10-03T04:00:00Z","051891","9/24/2021","2021-09-24T04:00:00Z","187-01 FOCH BOULEVARD","40,691,306.000000",40691306,"d88442ee-31f4-ea11-b882-24ee9a37d45c","Queens",882450003,"-73,764,081.000000",-73764081,"29","P.S. 36 - QUEENS","P.S. 036 Saint Albans School - Q036 - Q036 - 29Q036 - 187-01 FOCH BOULEVARD"
"W/""322958526""","Classroom Closed",882450000,"af88ec4e-7c1c-ec11-b6e6-001dd830a530","10/2/2021","2021-10-02T04:00:00Z","051915","9/24/2021","2021-09-24T04:00:00Z","200 NEDRA LANE","40,552,059.000000",40552059,"337c21b7-32f4-ea11-b882-24ee9a37d45c","Staten Island",882450004,"-74,195,281.000000",-74195281,"31","P.S. 4 - STATEN ISLAND","P.S. 004 Maurice Wollin - R004 - R004 - 31R004 - 200 NEDRA LANE"
"W/""322942715""","Classroom Closed",882450000,"1fd67936-7e1c-ec11-b6e6-001dd830a530","10/2/2021","2021-10-02T04:00:00Z","051927","9/24/2021","2021-09-24T04:00:00Z","144 KEATING PLACE","40,591,480.000000",40591480,"dd8521d0-32f4-ea11-b882-24ee9a37d45c","Staten Island",882450004,"-74,157,327.000000",-74157327,"31","P.S. 69 - STATEN ISLAND","P.S. 069 Daniel D. Tompkins - R069 - R069 - 31R069 - 144 KEATING PLACE"
"W/""322969173""","Classroom Closed",882450000,"22641296-811c-ec11-b6e6-001dd830a530","10/2/2021","2021-10-02T04:00:00Z","051946","9/24/2021","2021-09-24T04:00:00Z","468 EAST 140 STREET","40,809,080.000000",40809080,"0b03cefa-32f4-ea11-b882-24ee9a37d45c","Bronx",882450001,"-73,919,773.000000",-73919773,"7","P.S. 220 - BRONX","P.S. 179 - X179 - X040 - 07X179 - 468 EAST 140 STREET"
"W/""322950176""","Partial Classroom Quarantine",882450001,"30577bf1-811c-ec11-b6e6-001dd830a530","10/2/2021","2021-10-02T04:00:00Z","051949","9/24/2021","2021-09-24T04:00:00Z","98-50 50 AVENUE","40,741,898.000000",40741898,"5f2f77fa-31f4-ea11-b882-24ee9a37d45c","Queens",882450003,"-73,862,886.000000",-73862886,"24","I.S. 61 - QUEENS","I.S. 061 Leonardo Da Vinci - Q061 - Q061 - 24Q061 - 98-50 50 AVENUE"
"W/""323409247""","Partial Classroom Quarantine",882450001,"192381be-841c-ec11-b6e6-001dd830a530","10/2/2021","2021-10-02T04:00:00Z","051965","9/24/2021","2021-09-24T04:00:00Z","120 EAST 184 STREET","40,859,496.000000",40859496,"5b0d6d19-33f4-ea11-b882-24ee9a37d45c","Bronx",882450001,"-73,900,490.000000",-73900490,"10","I.S. 399 (OLD X HS/X115) - BRONX","Academy For Personal Leadership And Excellence - X363 - X115 - 10X363 - 120 EAST 184 STREET"
"W/""323409312""","Non-Classroom Quarantine",882450003,"023aa049-871c-ec11-b6e6-001dd830a530","10/2/2021","2021-10-02T04:00:00Z","051980","9/25/2021","2021-09-25T04:00:00Z","127 EAST  22 STREET","40,739,121.000000",40739121,"680c1bb1-31f4-ea11-b882-24ee9a37d45c","Manhattan",882450000,"-73,985,323.000000",-73985323,"2","SCHL OF THE FUTURE (OLD BACON) - M","School of the Future High School - M413 - M660 - 02M413 - 127 EAST  22 STREET"
"W/""322110830""","Classroom Closed",882450000,"056feeeb-8e1c-ec11-b6e6-001dd830a530","10/2/2021","2021-10-02T04:00:00Z","052013","9/24/2021","2021-09-24T04:00:00Z","1940 BENSON AVENUE","40,602,809.000000",40602809,"00ba8b86-30f4-ea11-b882-24ee9a37d45c","Brooklyn",882450002,"-74,001,915.000000",-74001915,"20","P.S. 200 - BROOKLYN","P.S. 200 Benson School - K200 - K200 - 20K200 - 1940 BENSON AVENUE"
"W/""323409381""","Partial Classroom Quarantine",882450001,"3616436f-921c-ec11-b6e6-001dd830a530","10/2/2021","2021-10-02T04:00:00Z","052030","9/25/2021","2021-09-25T04:00:00Z","138-30 LAFAYETTE STREET","40,670,905.000000",40670905,"9169c231-32f4-ea11-b882-24ee9a37d45c","Queens",882450003,"-73,845,992.000000",-73845992,"27","I.S. 202 - QUEENS","J.H.S. 202 Robert H. Goddard - Q202 - Q202 - 27Q202 - 138-30 LAFAYETTE STREET"
"W/""326674516""","Partial Classroom Quarantine",882450001,"d91a0ce9-931c-ec11-b6e6-001dd830a530","10/2/2021","2021-10-02T04:00:00Z","052042","9/24/2021","2021-09-24T04:00:00Z","1560 PURDY STREET","40,838,759.000000",40838759,"b9689025-33f4-ea11-b882-24ee9a37d45c","Bronx",882450001,"-73,853,203.000000",-73853203,"11","I.S. 127 - BRONX","J.H.S. 127 The Castle Hill - X127 - X127 - 11X127 - 1560 PURDY STREET"
"W/""322962734""","Partial Classroom Quarantine",882450001,"016c79ed-981c-ec11-b6e6-001dd830a530","10/3/2021","2021-10-03T04:00:00Z","052066","9/24/2021","2021-09-24T04:00:00Z","1420 EAST  68 STREET","40,620,537.000000",40620537,"8b03194f-30f4-ea11-b882-24ee9a37d45c","Brooklyn",882450002,"-73,912,914.000000",-73912914,"22","I.S. 78 - BROOKLYN","J.H.S. 078 Roy H. Mann - K078 - K078 - 22K078 - 1420 EAST  68 STREET"
"W/""322110956""","Non-Classroom Quarantine",882450003,"7d3f7135-9c1c-ec11-b6e6-001dd830a530","10/2/2021","2021-10-02T04:00:00Z","052081","9/24/2021","2021-09-24T04:00:00Z","345 East  15th Street","40,732,665.000000",40732665,"5607e99e-31f4-ea11-b882-24ee9a37d45c","Manhattan",882450000,"-73,982,590.000000",-73982590,"2","HEALTH PROFESSIONS HS (OL STY) - M","High School for Health Professions and Human Services - M420 - M475 - 02M420 - 345 East  15th Street"
"W/""325507937""","Classroom Closed",882450000,"1d80a5e2-9d1c-ec11-b6e6-001dd830a530","10/3/2021","2021-10-03T04:00:00Z","052088","9/24/2021","2021-09-24T04:00:00Z","695 East 182nd Street","40,850,674.000000",40850674,"13a31781-33f4-ea11-b882-24ee9a37d45c","Bronx",882450001,"-73,886,997.000000",-73886997,"10","P.S. 51 - BRONX","The Bronx STEM and Arts Academy - X051 - X781 - 10X051 - 695 East 182nd Street"
"W/""323409451""","Partial Classroom Quarantine",882450001,"2225fba7-9f1c-ec11-b6e6-001dd830a530","10/2/2021","2021-10-02T04:00:00Z","052097","9/24/2021","2021-09-24T04:00:00Z","101 PARK AVENUE","40,697,177.000000",40697177,"79b50aa5-30f4-ea11-b882-24ee9a37d45c","Brooklyn",882450002,"-73,976,104.000000",-73976104,"13","I.S. 265 - BROOKLYN","Dr. Susan S. McKinney Secondary School of the Arts - K265 - K265 - 13K265 - 101 PARK AVENUE"
"W/""322939230""","Classroom Closed",882450000,"dfbe9a1b-a41c-ec11-b6e6-001dd830a530","10/2/2021","2021-10-02T04:00:00Z","052125","9/24/2021","2021-09-24T04:00:00Z","65-11 155 STREET","40,736,541.000000",40736541,"9769c231-32f4-ea11-b882-24ee9a37d45c","Queens",882450003,"-73,813,011.000000",-73813011,"25","P.S. 201 - QUEENS","P.S. 201 The Discovery School for Inquiry and Research - Q201 - Q201 - 25Q201 - 65-11 155 STREET"
"W/""324817301""","Classroom Closed",882450000,"628f1cf2-2a1d-ec11-b6e6-001dd830a530","10/3/2021","2021-10-03T04:00:00Z","052152","9/25/2021","2021-09-25T04:00:00Z","159-01 59 AVENUE","40,741,107.000000",40741107,"049c4c1f-32f4-ea11-b882-24ee9a37d45c","Queens",882450003,"-73,808,765.000000",-73808765,"25","P.S. 163 - QUEENS","P.S. 163 Flushing Heights - Q163 - Q163 - 25Q163 - 159-01 59 AVENUE"
"W/""323289875""","Classroom Closed",882450000,"39f7ca76-2c1d-ec11-b6e6-001dd830a530","10/3/2021","2021-10-03T04:00:00Z","052160","9/25/2021","2021-09-25T04:00:00Z","309 47 STREET","40,648,959.000000",40648959,"dcc1392a-30f4-ea11-b882-24ee9a37d45c","Brooklyn",882450002,"-74,011,420.000000",-74011420,"15","P.S. 1 - BROOKLYN","P.S. 001 The Bergen - K001 - K001 - 15K001 - 309 47 STREET"
"W/""324249308""","Classroom Closed",882450000,"14faad71-311d-ec11-b6e6-001dd830a530","10/2/2021","2021-10-02T04:00:00Z","052177","9/25/2021","2021-09-25T04:00:00Z","74-01 78 AVENUE","40,705,187.000000",40705187,"d92ff20c-32f4-ea11-b882-24ee9a37d45c","Queens",882450003,"-73,875,073.000000",-73875073,"24","I.S. 119 - QUEENS","P.S./I.S. 119 The Glendale - Q119 - Q119 - 24Q119 - 74-01 78 AVENUE"
"W/""327089399""","Partial Classroom Quarantine",882450001,"de2e68cd-311d-ec11-b6e6-001dd830a530","10/1/2021","2021-10-01T04:00:00Z","052178","9/25/2021","2021-09-25T04:00:00Z","100 LUTEN AVENUE","40,528,152.000000",40528152,"605b4cd6-32f4-ea11-b882-24ee9a37d45c","Staten Island",882450004,"-74,193,431.000000",-74193431,"31","TOTTENVILLE HS - S. I.","Tottenville High School - R455 - R455 - 31R455 - 100 LUTEN AVENUE"
"W/""323290155""","Partial Classroom Quarantine",882450001,"96a6c9ee-391d-ec11-b6e6-001dd830a530","10/1/2021","2021-10-01T04:00:00Z","052215","9/25/2021","2021-09-25T04:00:00Z","1400 PENNSYLVANIA AVENUE","40,646,640.000000",40646640,"30a198c3-30f4-ea11-b882-24ee9a37d45c","Brooklyn",882450002,"-73,881,997.000000",-73881997,"19","P.S. 346 - BROOKLYN","Frederick Douglass Academy VIII Middle School - K452 - K346 - 19K452 - 1400 PENNSYLVANIA AVENUE"
"W/""323687190""","Classroom Closed",882450000,"2c581d15-411d-ec11-b6e6-001dd830a530","10/3/2021","2021-10-03T04:00:00Z","052254","9/25/2021","2021-09-25T04:00:00Z","104 SUTTER AVENUE","40,665,553.000000",40665553,"35a198c3-30f4-ea11-b882-24ee9a37d45c","Brooklyn",882450002,"-73,917,880.000000",-73917880,"23","P.S. 156 - BROOKLYN","P.S. 156 Waverly - K156 - K356 - 23K156 - 104 SUTTER AVENUE"
"W/""327192106""","Partial Classroom Quarantine",882450001,"4a4a8df9-411d-ec11-b6e6-001dd830a530","10/2/2021","2021-10-02T04:00:00Z","052259","9/27/2021","2021-09-27T04:00:00Z","156-10 BAISLEY BOULEVARD","40,673,949.000000",40673949,"a9eb6056-32f4-ea11-b882-24ee9a37d45c","Queens",882450003,"-73,782,684.000000",-73782684,"27","AUGUST MARTIN HS - QUEENS","August Martin High School - Q400 - Q400 - 27Q400 - 156-10 BAISLEY BOULEVARD"
"W/""323629373""","Classroom Closed",882450000,"47516bb0-421d-ec11-b6e6-001dd830a530","10/3/2021","2021-10-03T04:00:00Z","052262","9/25/2021","2021-09-25T04:00:00Z","2944 PITKIN AVENUE","40,675,881.000000",40675881,"4b5bc58c-30f4-ea11-b882-24ee9a37d45c","Brooklyn",882450002,"-73,862,961.000000",-73862961,"19","P.S. 214 - BROOKLYN","P.S. 214 Michael Friedsam - K214 - K214 - 19K214 - 2944 PITKIN AVENUE"
"W/""325514290""","Classroom Closed",882450000,"11cb9917-451d-ec11-b6e6-001dd830a530","10/3/2021","2021-10-03T04:00:00Z","052274","9/27/2021","2021-09-27T04:00:00Z","763 KNICKERBOCKER AVENUE","40,693,432.000000",40693432,"ebd27c6d-30f4-ea11-b882-24ee9a37d45c","Brooklyn",882450002,"-73,908,242.000000",-73908242,"32","P.S. 151 - BROOKLYN","P.S. 151 Lyndon B. Johnson - K151 - K151 - 32K151 - 763 KNICKERBOCKER AVENUE"
"W/""328073648""","Partial Classroom Quarantine",882450001,"bd70d348-461d-ec11-b6e6-001dd830a530","10/3/2021","2021-10-03T04:00:00Z","052277","9/25/2021","2021-09-25T04:00:00Z","2040 ANTIN PL","40,851,577.000000",40851577,"80593c87-33f4-ea11-b882-24ee9a37d45c","Bronx",882450001,"-73,864,438.000000",-73864438,"11","BRONX HIGH SCHOOL FOR THE VISUAL ARTS","Bronx High School for the Visual Arts - X418 - X839 - 11X418 - 2040 ANTIN PL"
"W/""323290419""","Classroom Closed",882450000,"047f325c-481d-ec11-b6e6-001dd830a530","10/3/2021","2021-10-03T04:00:00Z","052283","9/25/2021","2021-09-25T04:00:00Z","87-41 PARSONS BOULEVARD","40,709,461.000000",40709461,"117eed06-32f4-ea11-b882-24ee9a37d45c","Queens",882450003,"-73,803,001.000000",-73803001,"28","P.S. 86 - QUEENS","P.S. Q086 - Q086 - Q086 - 28Q086 - 87-41 PARSONS BOULEVARD"
"W/""323290510""","Classroom Closed",882450000,"5fb8c54b-4b1d-ec11-b6e6-001dd830a530","10/3/2021","2021-10-03T04:00:00Z","052300","9/25/2021","2021-09-25T04:00:00Z","34 WEST 118 STREET","40,802,649.000000",40802649,"539f4974-31f4-ea11-b882-24ee9a37d45c","Manhattan",882450000,"-73,948,088.000000",-73948088,"3","P.S. 149 (TANDEM M207) - MANHATTAN","Success Academy Charter School - Harlem 1 - M351 - M149 - 84M351 - 34 WEST 118 STREET"
"W/""323669090""","Classroom Closed",882450000,"6f03c844-501d-ec11-b6e6-001dd830a530","10/4/2021","2021-10-04T04:00:00Z","052316","9/25/2021","2021-09-25T04:00:00Z","6701 20 AVENUE","40,614,737.000000",40614737,"11ba8b86-30f4-ea11-b882-24ee9a37d45c","Brooklyn",882450002,"-73,986,792.000000",-73986792,"20","P.S. 205 - BROOKLYN","P.S. 205 Clarion - K205 - K205 - 20K205 - 6701 20 AVENUE"
"W/""326707721""","Classroom Closed",882450000,"46555b44-531d-ec11-b6e6-001dd830a530","10/3/2021","2021-10-03T04:00:00Z","052333","9/25/2021","2021-09-25T04:00:00Z","77 MARSH AVENUE","40,582,791.000000",40582791,"2a0410ca-32f4-ea11-b882-24ee9a37d45c","Staten Island",882450004,"-74,160,867.000000",-74160867,"31","P.S. 58 - STATEN ISLAND","Space Shuttle Columbia School - R058 - R058 - 31R058 - 77 MARSH AVENUE"
"W/""323702454""","Classroom Closed",882450000,"b0aaeef8-531d-ec11-b6e6-001dd830a530","10/2/2021","2021-10-02T04:00:00Z","052335","9/25/2021","2021-09-25T04:00:00Z","48-25 37th Street","40,739,438.000000",40739438,"27bef08c-32f4-ea11-b882-24ee9a37d45c","Queens",882450003,"-73,928,640.000000",-73928640,"24","P.S. 199 ANNEX - QUEENS","P.S. 199 Maurice A. Fitzgerald - Q199 - Q841 - 24Q199 - 48-25 37th Street"
"W/""324597489""","Partial Classroom Quarantine",882450001,"2b452845-551d-ec11-b6e6-001dd830a530","10/4/2021","2021-10-04T04:00:00Z","052338","9/25/2021","2021-09-25T04:00:00Z","105 HAMILTON AVENUE","40,645,436.000000",40645436,"5a5b4cd6-32f4-ea11-b882-24ee9a37d45c","Staten Island",882450004,"-74,082,149.000000",-74082149,"31","CURTIS HS - S. I.","Curtis High School - R450 - R450 - 31R450 - 105 HAMILTON AVENUE"
"W/""323703089""","Classroom Closed",882450000,"74f6f8c4-571d-ec11-b6e6-001dd830a530","10/2/2021","2021-10-02T04:00:00Z","052346","9/25/2021","2021-09-25T04:00:00Z","1155 CROMWELL AVENUE","40,834,979.000000",40834979,"5d0d6d19-33f4-ea11-b882-24ee9a37d45c","Bronx",882450001,"-73,923,297.000000",-73923297,"9","P.S. 114 - BRONX","DYCD - P.S. X114 - Luis Llorens Torres Schools - 126061 - 1155 Cromwell Avenue"
"W/""324703836""","Classroom Closed",882450000,"83e59b5c-621d-ec11-b6e6-001dd830a530","10/2/2021","2021-10-02T04:00:00Z","052381","9/25/2021","2021-09-25T04:00:00Z","346 AVENUE P","40,608,169.000000",40608169,"0ed1de79-30f4-ea11-b882-24ee9a37d45c","Brooklyn",882450002,"-73,974,425.000000",-73974425,"21","P.S. 177 - BROOKLYN","P.S. 177 The Marlboro - K177 - K177 - 21K177 - 346 AVENUE P"
"W/""324156758""","Classroom Closed",882450000,"309e6f7b-621d-ec11-b6e6-001dd830a530","10/2/2021","2021-10-02T04:00:00Z","052382","9/25/2021","2021-09-25T04:00:00Z","101-24 SEAVIEW AVENUE","40,635,542.000000",40635542,"cd201dab-30f4-ea11-b882-24ee9a37d45c","Brooklyn",882450002,"-73,886,373.000000",-73886373,"18","P.S. 272 - BROOKLYN","P.S. 272 Curtis Estabrook - K272 - K272 - 18K272 - 101-24 SEAVIEW AVENUE"
"W/""328740524""","Non-Classroom Quarantine",882450003,"0987b4ce-661d-ec11-b6e6-001dd830a530","10/3/2021","2021-10-03T04:00:00Z","052409","9/25/2021","2021-09-25T04:00:00Z","3750 BAYCHESTER AVENUE","40,886,002.000000",40886002,"a32aa42b-33f4-ea11-b882-24ee9a37d45c","Bronx",882450001,"-73,839,682.000000",-73839682,"11","I.S. 142 - BRONX","Baychester Middle School - X532 - X142 - 11X532 - 3750 BAYCHESTER AVENUE"
"W/""324157345""","Classroom Closed",882450000,"0fd81266-691d-ec11-b6e6-001dd830a530","10/2/2021","2021-10-02T04:00:00Z","052423","9/25/2021","2021-09-25T04:00:00Z","1750 AMSTERDAM AVENUE","40,826,514.000000",40826514,"589f4974-31f4-ea11-b882-24ee9a37d45c","Manhattan",882450000,"-73,947,599.000000",-73947599,"6","P.S. 153 - MANHATTAN","P.S. 153 Adam Clayton Powell - M153 - M153 - 06M153 - 1750 AMSTERDAM AVENUE"
"W/""326840160""","Partial Classroom Quarantine",882450001,"70343260-6b1d-ec11-b6e6-001dd830a530","10/4/2021","2021-10-04T04:00:00Z","052437","9/27/2021","2021-09-27T04:00:00Z","109-89 204 STREET","40,705,989.000000",40705989,"7f977d2b-32f4-ea11-b882-24ee9a37d45c","Queens",882450003,"-73,752,885.000000",-73752885,"29","I.S. 192 - QUEENS","Pathways College Preparatory School: A College Board School - Q259 - Q192 - 29Q259 - 109-89 204 STREET"
"W/""327755918""","Classroom Closed",882450000,"c3d6bb0f-6c1d-ec11-b6e6-001dd830a530","10/1/2021","2021-10-01T04:00:00Z","052443","9/25/2021","2021-09-25T04:00:00Z","757 WORTMAN AVENUE","40,664,143.000000",40664143,"e121d292-30f4-ea11-b882-24ee9a37d45c","Brooklyn",882450002,"-73,866,542.000000",-73866542,"19","P.S. 224 - BROOKLYN","P.S. 224 Hale A. Woodruff - K224 - K224 - 19K224 - 757 WORTMAN AVENUE"
"W/""327107364""","Partial Classroom Quarantine",882450001,"d657b85e-6c1d-ec11-b6e6-001dd830a530","10/3/2021","2021-10-03T04:00:00Z","052444","9/27/2021","2021-09-27T04:00:00Z","3000 EAST TREMONT AVENUE","40,839,775.000000",40839775,"b556635c-33f4-ea11-b882-24ee9a37d45c","Bronx",882450001,"-73,839,583.000000",-73839583,"11","HERBERT H. LEHMAN HS - X","Schuylerville Preparatory High School - X348 - X405 - 08X348 - 3000 EAST TREMONT AVENUE"
"W/""324597557""","Partial Classroom Quarantine",882450001,"c120a901-701d-ec11-b6e6-001dd830a530","10/4/2021","2021-10-04T04:00:00Z","052455","9/25/2021","2021-09-25T04:00:00Z","167-01 GOTHIC DRIVE","40,714,551.000000",40714551,"1f02926e-32f4-ea11-b882-24ee9a37d45c","Queens",882450003,"-73,798,658.000000",-73798658,"28","JAMAICA HS - Q","High School for Community Leadership - Q328 - Q470 - 28Q328 - 167-01 GOTHIC DRIVE"
"W/""327664885""","Partial Classroom Quarantine",882450001,"e80fba94-701d-ec11-b6e6-001dd830a530","10/4/2021","2021-10-04T04:00:00Z","052456","9/27/2021","2021-09-27T04:00:00Z","167-01 GOTHIC DRIVE","40,714,551.000000",40714551,"1f02926e-32f4-ea11-b882-24ee9a37d45c","Queens",882450003,"-73,798,658.000000",-73798658,"28","JAMAICA HS - Q","High School for Community Leadership - Q328 - Q470 - 28Q328 - 167-01 GOTHIC DRIVE"
"W/""323003606""","Classroom Closed",882450000,"5aa19835-f41a-ec11-b6e6-001dd830a895","10/2/2021","2021-10-02T04:00:00Z","051286","9/23/2021","2021-09-23T04:00:00Z","1970 HOMECREST AVENUE","40,601,179.000000",40601179,"f8d27c6d-30f4-ea11-b882-24ee9a37d45c","Brooklyn",882450002,"-73,960,027.000000",-73960027,"21","P.S. 153 - BROOKLYN","P.S. 153 Homecrest - K153 - K153 - 21K153 - 1970 HOMECREST AVENUE"
"W/""323017985""","Classroom Closed",882450000,"b152cfb5-bf1b-ec11-b6e6-001dd830a895","10/1/2021","2021-10-01T04:00:00Z","051613","9/23/2021","2021-09-23T04:00:00Z","2200 GRAVESEND NECK ROAD","40,596,876.000000",40596876,"14ba8b86-30f4-ea11-b882-24ee9a37d45c","Brooklyn",882450002,"-73,948,453.000000",-73948453,"22","P.S. 206 - BROOKLYN","P.S. 206 Joseph F Lamb - K206 - K206 - 22K206 - 2200 GRAVESEND NECK ROAD"
"W/""322110089""","Non-Classroom Quarantine",882450003,"444cfa45-cd1b-ec11-b6e6-001dd830a895","10/2/2021","2021-10-02T04:00:00Z","051674","9/24/2021","2021-09-24T04:00:00Z","74-03 COMMONWEALTH BOULEVARD","40,747,914.000000",40747914,"419215a5-32f4-ea11-b882-24ee9a37d45c","Queens",882450003,"-73,723,644.000000",-73723644,"26","Queens Children's Center","P.S. Q023 @ Queens Children Center - Q023 - QAPM - 75Q023 - 74-03 COMMONWEALTH BOULEVARD"
"W/""324599335""","Classroom Closed",882450000,"ce589c8d-ce1b-ec11-b6e6-001dd830a895","10/1/2021","2021-10-01T04:00:00Z","051680","9/24/2021","2021-09-24T04:00:00Z","2545 GUNTHER AVENUE","40,863,842.000000",40863842,"b22aa42b-33f4-ea11-b882-24ee9a37d45c","Bronx",882450001,"-73,836,525.000000",-73836525,"11","I.S. 144 - BRONX","Bronx Charter School for Better Learning II - X484 - X144 - 84X484 - 2545 GUNTHER AVENUE"
"W/""322989490""","Classroom Closed",882450000,"680eb8c3-db1b-ec11-b6e6-001dd830a895","10/1/2021","2021-10-01T04:00:00Z","051741","9/24/2021","2021-09-24T04:00:00Z","41-15 104 STREET","40,748,996.000000",40748996,"b672c880-32f4-ea11-b882-24ee9a37d45c","Queens",882450003,"-73,860,547.000000",-73860547,"24","P.S. 16 (OLD Q721 SPED) - QUEENS","P.S. Q016 The Nancy DeBenedittis School - Q016 - Q721 - 24Q016 - 41-15 104 STREET"
"W/""322992819""","Classroom Closed",882450000,"7b6a99e5-701c-ec11-b6e6-001dd830a895","10/1/2021","2021-10-01T04:00:00Z","051833","9/24/2021","2021-09-24T04:00:00Z","1800 Utica Avenue","40,628,417.000000",40628417,"17d8cf12-31f4-ea11-b882-24ee9a37d45c","Brooklyn",882450002,"-73,928,250.000000",-73928250,"22","P.S. 326 - BROOKLYN","P.S. 326 - K326 - K852 - 22K326 - 1800 Utica Avenue"
"W/""322993795""","Partial Classroom Quarantine",882450001,"53b0c2d9-741c-ec11-b6e6-001dd830a895","10/1/2021","2021-10-01T04:00:00Z","051864","9/24/2021","2021-09-24T04:00:00Z","999 JAMAICA AVENUE","40,693,002.000000",40693002,"c692e6d5-30f4-ea11-b882-24ee9a37d45c","Brooklyn",882450002,"-73,869,305.000000",-73869305,"19","FRANKLIN K. LANE HS - K","The Urban Assembly School for Collaborative Healthcare - K764 - K420 - 19K764 - 999 JAMAICA AVENUE"
"W/""322964672""","Classroom Closed",882450000,"34dd225f-751c-ec11-b6e6-001dd830a895","10/3/2021","2021-10-03T04:00:00Z","051866","9/24/2021","2021-09-24T04:00:00Z","28-37 29 STREET","40,768,034.000000",40768034,"0af32ce2-31f4-ea11-b882-24ee9a37d45c","Queens",882450003,"-73,922,544.000000",-73922544,"30","P.S. 17 - QUEENS","P.S. 017 Henry David Thoreau - Q017 - Q017 - 30Q017 - 28-37 29 STREET"
"W/""323012823""","Partial Classroom Quarantine",882450001,"31a0ef73-781c-ec11-b6e6-001dd830a895","10/1/2021","2021-10-01T04:00:00Z","051886","9/24/2021","2021-09-24T04:00:00Z","300 ADELPHI STREET","40,688,769.000000",40688769,"1fe85c61-30f4-ea11-b882-24ee9a37d45c","Brooklyn",882450002,"-73,971,474.000000",-73971474,"13","I.S. 113 - BROOKLYN","M.S. 113 Ronald Edmonds Learning Center - K113 - K113 - 13K113 - 300 ADELPHI STREET"
"W/""323019218""","Classroom Closed",882450000,"0972dc27-891c-ec11-b6e6-001dd830a895","10/3/2021","2021-10-03T04:00:00Z","051988","9/24/2021","2021-09-24T04:00:00Z","1050 Targee Street","40,603,492.000000",40603492,"db8521d0-32f4-ea11-b882-24ee9a37d45c","Staten Island",882450004,"-74,091,239.000000",-74091239,"31","P.S./I.S. 48 - Staten Island","DYCD - P.S. 048 William G. Wilcox - 126191 - 1050 Targee Street"
"W/""322995398""","Partial Classroom Quarantine",882450001,"eba87a4d-8e1c-ec11-b6e6-001dd830a895","10/1/2021","2021-10-01T04:00:00Z","052007","9/24/2021","2021-09-24T04:00:00Z","400 PENNSYLVANIA AVENUE","40,666,868.000000",40666868,"3688e6db-30f4-ea11-b882-24ee9a37d45c","Brooklyn",882450002,"-73,895,122.000000",-73895122,"19","THOMAS JEFFERSON HS - K","World Academy for Total Community Health High School - K510 - K435 - 19K510 - 400 PENNSYLVANIA AVENUE"
"W/""323409516""","Partial Classroom Quarantine",882450001,"69c97943-9b1c-ec11-b6e6-001dd830a895","10/2/2021","2021-10-02T04:00:00Z","052077","9/24/2021","2021-09-24T04:00:00Z","150 ALBANY AVENUE","40,675,905.000000",40675905,"23416e00-31f4-ea11-b882-24ee9a37d45c","Brooklyn",882450002,"-73,939,282.000000",-73939282,"17","ROBESON HS COMP&BUS TC (A HML)-K","Pathways in Technology Early College High School (P-Tech) - K122 - K625 - 17K122 - 150 ALBANY AVENUE"
"W/""322111047""","Partial Classroom Quarantine",882450001,"b6ef8d40-a71c-ec11-b6e6-001dd830a895","10/1/2021","2021-10-01T04:00:00Z","052135","9/24/2021","2021-09-24T04:00:00Z","1 EAST 104 STREET","40,793,098.000000",40793098,"7f3eb8c9-31f4-ea11-b882-24ee9a37d45c","Manhattan",882450000,"-73,951,367.000000",-73951367,"4","HARBOR SCIENCE & ART CHARTER SCHOOL","Capital Preparatory (CP) Harlem Charter School - M204 - MADQ - 84M204 - 1 EAST 104 STREET"
"W/""323289905""","Non-Classroom Quarantine",882450003,"43e722d6-2c1d-ec11-b6e6-001dd830a895","10/3/2021","2021-10-03T04:00:00Z","052164","9/25/2021","2021-09-25T04:00:00Z","577 EAST 179 STREET","40,848,702.000000",40848702,"0b78931f-33f4-ea11-b882-24ee9a37d45c","Bronx",882450001,"-73,892,482.000000",-73892482,"10","I.S. 118 - BRONX","J.H.S. 118 William W. Niles - X118 - X118 - 10X118 - 577 EAST 179 STREET"
"W/""324127156""","Classroom Closed",882450000,"5ca3fd06-391d-ec11-b6e6-001dd830a895","10/2/2021","2021-10-02T04:00:00Z","052210","9/25/2021","2021-09-25T04:00:00Z","4305 7 AVENUE","40,645,825.000000",40645825,"55ebaa73-30f4-ea11-b882-24ee9a37d45c","Brooklyn",882450002,"-74,001,700.000000",-74001700,"15","P.S. 169 - BROOKLYN","P.S. 169 Sunset Park - K169 - K169 - 15K169 - 4305 7 AVENUE"
"W/""324598288""","Classroom Closed",882450000,"9397f782-3f1d-ec11-b6e6-001dd830a895","10/3/2021","2021-10-03T04:00:00Z","052247","9/25/2021","2021-09-25T04:00:00Z","3961 HILLMAN AVENUE","40,883,049.000000",40883049,"34474313-33f4-ea11-b882-24ee9a37d45c","Bronx",882450001,"-73,891,664.000000",-73891664,"10","P.S. 95 - BRONX","P.S. 095 Sheila Mencher - X095 - X095 - 10X095 - 3961 HILLMAN AVENUE"
"W/""323290366""","Non-Classroom Quarantine",882450003,"28b6fe84-431d-ec11-b6e6-001dd830a895","10/2/2021","2021-10-02T04:00:00Z","052267","9/25/2021","2021-09-25T04:00:00Z","120 WEST 231 STREET","40,875,636.000000",40875636,"ad2aa42b-33f4-ea11-b882-24ee9a37d45c","Bronx",882450001,"-73,901,565.000000",-73901565,"10","I.S. 143 - BRONX","The New School for Leadership and Journalism - X244 - X143 - 10X244 - 120 WEST 231 STREET"
"W/""327116225""","Classroom Closed",882450000,"87462080-481d-ec11-b6e6-001dd830a895","10/2/2021","2021-10-02T04:00:00Z","052284","9/25/2021","2021-09-25T04:00:00Z","233-15 MERRICK BOULEVARD","40,675,070.000000",40675070,"52a10a44-32f4-ea11-b882-24ee9a37d45c","Queens",882450003,"-73,736,232.000000",-73736232,"29","P.S. 270 - QUEENS","The Gordon Parks School - Q270 - Q270 - 29Q270 - 233-15 MERRICK BOULEVARD"
"W/""323622114""","Classroom Closed",882450000,"a9b9d213-4f1d-ec11-b6e6-001dd830a895","10/4/2021","2021-10-04T04:00:00Z","052312","9/25/2021","2021-09-25T04:00:00Z","1290 SPOFFORD AVENUE","40,814,034.000000",40814034,"5336d900-33f4-ea11-b882-24ee9a37d45c","Bronx",882450001,"-73,886,834.000000",-73886834,"8","P.S. 48 - BRONX","P.S. 048 Joseph R. Drake - X048 - X048 - 08X048 - 1290 SPOFFORD AVENUE"
"W/""323687711""","Partial Classroom Quarantine",882450001,"d2fefb56-631d-ec11-b6e6-001dd830a895","10/3/2021","2021-10-03T04:00:00Z","052390","9/25/2021","2021-09-25T04:00:00Z","778 FOREST AVENUE","40,818,703.000000",40818703,"f88a0044-33f4-ea11-b882-24ee9a37d45c","Bronx",882450001,"-73,905,389.000000",-73905389,"7","I.S. 184 - BRONX","P.S. X017 - X017 - X184 - 75X017 - 778 FOREST AVENUE"
"W/""324865122""","Classroom Closed",882450000,"15aa90df-6a1d-ec11-b6e6-001dd830a895","10/1/2021","2021-10-01T04:00:00Z","052431","9/25/2021","2021-09-25T04:00:00Z","232 BARLOW AVENUE","40,557,900.000000",40557900,"80a9d9c3-32f4-ea11-b882-24ee9a37d45c","Staten Island",882450004,"-74,155,400.000000",-74155400,"31","P.S. 32 - STATEN ISLAND","P.S. 032 The Gifford School - R032 - R032 - 31R032 - 232 BARLOW AVENUE"
"W/""324274793""","Classroom Closed",882450000,"00b387a3-e71a-ec11-b6e6-001dd830acba","10/1/2021","2021-10-01T04:00:00Z","051192","9/25/2021","2021-09-25T04:00:00Z","276 WEST 151ST STREET","40,825,831.000000",40825831,"6334aa92-31f4-ea11-b882-24ee9a37d45c","Manhattan",882450000,"-73,937,833.000000",-73937833,"5","P.S. 318 - MANHATTAN","Thurgood Marshall Academy Lower School - M318 - M371 - 05M318 - 276 WEST 151ST STREET"
"W/""323017449""","Partial Classroom Quarantine",882450001,"ee8daffe-941b-ec11-b6e6-001dd830acba","10/1/2021","2021-10-01T04:00:00Z","051414","9/23/2021","2021-09-23T04:00:00Z","300 ADELPHI STREET","40,688,769.000000",40688769,"1fe85c61-30f4-ea11-b882-24ee9a37d45c","Brooklyn",882450002,"-73,971,474.000000",-73971474,"13","I.S. 113 - BROOKLYN","M.S. 113 Ronald Edmonds Learning Center - K113 - K113 - 13K113 - 300 ADELPHI STREET"
"W/""323018497""","Partial Classroom Quarantine",882450001,"2b951bcf-971b-ec11-b6e6-001dd830acba","10/1/2021","2021-10-01T04:00:00Z","051420","9/23/2021","2021-09-23T04:00:00Z","521 WEST AVENUE","40,582,518.000000",40582518,"4cde5eb7-30f4-ea11-b882-24ee9a37d45c","Brooklyn",882450002,"-73,972,009.000000",-73972009,"21","I.S. 303 - BROOKLYN","Rachel Carson High School for Coastal Studies - K344 - K303 - 21K344 - 521 WEST AVENUE"
"W/""323021788""","Classroom Closed",882450000,"d32df975-9a1b-ec11-b6e6-001dd830acba","10/1/2021","2021-10-01T04:00:00Z","051431","9/23/2021","2021-09-23T04:00:00Z","144-39 GRAVETT ROAD","40,737,448.000000",40737448,"0bb7c337-32f4-ea11-b882-24ee9a37d45c","Queens",882450003,"-73,823,841.000000",-73823841,"25","P.S. 219 - QUEENS","P.S. 219 Paul Klapper - Q219 - Q219 - 25Q219 - 144-39 GRAVETT ROAD"
"W/""323018638""","Partial Classroom Quarantine",882450001,"01d9482e-9b1b-ec11-b6e6-001dd830acba","10/1/2021","2021-10-01T04:00:00Z","051435","9/23/2021","2021-09-23T04:00:00Z","40 WEST TREMONT AVENUE","40,850,722.000000",40850722,"c0ba3c50-33f4-ea11-b882-24ee9a37d45c","Bronx",882450001,"-73,910,827.000000",-73910827,"10","P.S. 306 - BRONX","The Bronx School of Young Leaders - X331 - X306 - 10X331 - 40 WEST TREMONT AVENUE"
"W/""322966157""","Partial Classroom Quarantine",882450001,"2553dfe5-9c1b-ec11-b6e6-001dd830acba","10/2/2021","2021-10-02T04:00:00Z","051443","9/23/2021","2021-09-23T04:00:00Z","40 WEST TREMONT AVENUE","40,850,722.000000",40850722,"c0ba3c50-33f4-ea11-b882-24ee9a37d45c","Bronx",882450001,"-73,910,827.000000",-73910827,"10","P.S. 306 - BRONX","The Bronx School of Young Leaders - X331 - X306 - 10X331 - 40 WEST TREMONT AVENUE"
"W/""323017743""","Partial Classroom Quarantine",882450001,"aeffe2fe-a01b-ec11-b6e6-001dd830acba","10/1/2021","2021-10-01T04:00:00Z","051454","9/23/2021","2021-09-23T04:00:00Z","1300 GREENE AVENUE","40,697,898.000000",40697898,"1de2abc9-30f4-ea11-b882-24ee9a37d45c","Brooklyn",882450002,"-73,919,088.000000",-73919088,"32","I.S. 383 - BROOKLYN","Achievement First Bushwick Charter School - K538 - K383 - 84K538 - 1300 GREENE AVENUE"
"W/""323582365""","Partial Classroom Quarantine",882450001,"a30ee610-a11b-ec11-b6e6-001dd830acba","10/1/2021","2021-10-01T04:00:00Z","051455","9/23/2021","2021-09-23T04:00:00Z","925 ASTOR AVENUE","40,860,443.000000",40860443,"439d7c62-33f4-ea11-b882-24ee9a37d45c","Bronx",882450001,"-73,860,729.000000",-73860729,"11","CHRISTOPHER COLUMBUS HS - X","Pelham Preparatory Academy - X542 - X415 - 11X542 - 925 ASTOR AVENUE"
"W/""323023160""","Partial Classroom Quarantine",882450001,"dbd94e50-a21b-ec11-b6e6-001dd830acba","10/1/2021","2021-10-01T04:00:00Z","051459","9/23/2021","2021-09-23T04:00:00Z","800 EAST GUN HILL ROAD","40,875,172.000000",40875172,"699d7c62-33f4-ea11-b882-24ee9a37d45c","Bronx",882450001,"-73,861,649.000000",-73861649,"11","EVANDER CHILDS HS - X","Bronx Lab School - X265 - X425 - 11X265 - 800 EAST GUN HILL ROAD"
"W/""323018360""","Classroom Closed",882450000,"c96d2813-a51b-ec11-b6e6-001dd830acba","10/1/2021","2021-10-01T04:00:00Z","051478","9/23/2021","2021-09-23T04:00:00Z","4222 4th Avenue","40,650,793.000000",40650793,"20a198c3-30f4-ea11-b882-24ee9a37d45c","Brooklyn",882450002,"-74,008,106.000000",-74008106,"15","P.S. 516 SUNSET PARK AVENUES ELEMENTARY SCHOOL - B","Sunset Park Avenues Elementary School - K516 - K333 - 15K516 - 4222 4th Avenue"
"W/""322970351""","Classroom Closed",882450000,"196e2813-a51b-ec11-b6e6-001dd830acba","10/2/2021","2021-10-02T04:00:00Z","051479","9/23/2021","2021-09-23T04:00:00Z","300 ADELPHI STREET","40,688,769.000000",40688769,"1fe85c61-30f4-ea11-b882-24ee9a37d45c","Brooklyn",882450002,"-73,971,474.000000",-73971474,"13","I.S. 113 - BROOKLYN","P.S. 372 -The Children's School - K372 - K113 - 75K372 - 300 ADELPHI STREET"
"W/""320789711""","Classroom Closed",882450000,"38fa9804-ab1b-ec11-b6e6-001dd830acba","10/1/2021","2021-10-01T04:00:00Z","051504","9/23/2021","2021-09-23T04:00:00Z","50 AVENUE P","40,606,994.000000",40606994,"5fa5db98-30f4-ea11-b882-24ee9a37d45c","Brooklyn",882450002,"-73,986,678.000000",-73986678,"21","LUCRETIA MARCIGLIANO CAMPUS - K","Brooklyn School of Inquiry - K686 - K237 - 20K686 - 50 AVENUE P"
"W/""323018095""","Classroom Closed",882450000,"f85d3ee5-ab1b-ec11-b6e6-001dd830acba","10/1/2021","2021-10-01T04:00:00Z","051511","9/23/2021","2021-09-23T04:00:00Z","333 EAST 135 STREET","40,808,194.000000",40808194,"7101ce37-33f4-ea11-b882-24ee9a37d45c","Bronx",882450001,"-73,925,459.000000",-73925459,"7","P.S. 154 - BRONX","South Bronx Classical Charter School II - X364 - X154 - 84X364 - 333 EAST 135 STREET"
"W/""322978391""","Partial Classroom Quarantine",882450001,"ff627d86-b11b-ec11-b6e6-001dd830acba","10/2/2021","2021-10-02T04:00:00Z","051537","9/23/2021","2021-09-23T04:00:00Z","442 EAST HOUSTON STREET","40,719,888.000000",40719888,"4b507380-31f4-ea11-b882-24ee9a37d45c","Manhattan",882450000,"-73,977,380.000000",-73977380,"1","P.S. 188 - MANHATTAN","P.S. M094 - M094 - M188 - 75M094 - 442 EAST HOUSTON STREET"
"W/""322975089""","Classroom Closed",882450000,"fe12b374-b31b-ec11-b6e6-001dd830acba","10/2/2021","2021-10-02T04:00:00Z","051543","9/23/2021","2021-09-23T04:00:00Z","33-09 35 AVENUE","40,757,497.000000",40757497,"7a0e6e25-32f4-ea11-b882-24ee9a37d45c","Queens",882450003,"-73,926,249.000000",-73926249,"30","P.S. 166 - QUEENS","P.S. 166 Henry Gradstein - Q166 - Q166 - 30Q166 - 33-09 35 AVENUE"
"W/""323019097""","Classroom Closed",882450000,"86e67a9d-bf1b-ec11-b6e6-001dd830acba","10/1/2021","2021-10-01T04:00:00Z","051611","9/23/2021","2021-09-23T04:00:00Z","3961 HILLMAN AVENUE","40,883,049.000000",40883049,"34474313-33f4-ea11-b882-24ee9a37d45c","Bronx",882450001,"-73,891,664.000000",-73891664,"10","P.S. 95 - BRONX","P.S. 095 Sheila Mencher - X095 - X095 - 10X095 - 3961 HILLMAN AVENUE"
"W/""322110079""","Partial Classroom Quarantine",882450001,"e293eea9-bf1b-ec11-b6e6-001dd830acba","10/1/2021","2021-10-01T04:00:00Z","051612","9/24/2021","2021-09-24T04:00:00Z","400 EMPIRE BOULEVARD","40,663,605.000000",40663605,"bd79df48-30f4-ea11-b882-24ee9a37d45c","Brooklyn",882450002,"-73,949,198.000000",-73949198,"17","I.S. 61 - BROOKLYN","M.S. 061 Dr. Gladstone H. Atwell - K061 - K061 - 17K061 - 400 EMPIRE BOULEVARD"
"W/""323019658""","Non-Classroom Quarantine",882450003,"4797f487-c11b-ec11-b6e6-001dd830acba","10/1/2021","2021-10-01T04:00:00Z","051625","9/23/2021","2021-09-23T04:00:00Z","101-01 ROCKAWAY BOULEVARD","40,680,065.000000",40680065,"6abc9674-32f4-ea11-b882-24ee9a37d45c","Queens",882450003,"-73,838,616.000000",-73838616,"27","JOHN ADAMS HS - QUEENS","John Adams High School - Q480 - Q480 - 27Q480 - 101-01 ROCKAWAY BOULEVARD"
"W/""320790028""","Non-Classroom Quarantine",882450003,"62c3d0a3-c21b-ec11-b6e6-001dd830acba","10/1/2021","2021-10-01T04:00:00Z","051628","9/23/2021","2021-09-23T04:00:00Z","101-01 ROCKAWAY BOULEVARD","40,680,065.000000",40680065,"6abc9674-32f4-ea11-b882-24ee9a37d45c","Queens",882450003,"-73,838,616.000000",-73838616,"27","JOHN ADAMS HS - QUEENS","John Adams High School - Q480 - Q480 - 27Q480 - 101-01 ROCKAWAY BOULEVARD"
"W/""322474108""","Partial Classroom Quarantine",882450001,"113fcdc4-d11b-ec11-b6e6-001dd830acba","10/1/2021","2021-10-01T04:00:00Z","051702","9/24/2021","2021-09-24T04:00:00Z","3000 EAST TREMONT AVENUE","40,839,775.000000",40839775,"b556635c-33f4-ea11-b882-24ee9a37d45c","Bronx",882450001,"-73,839,583.000000",-73839583,"11","HERBERT H. LEHMAN HS - X","Renaissance High School for Musical Theater and the Arts - X293 - X405 - 08X293 - 3000 EAST TREMONT AVENUE"
"W/""322915430""","Partial Classroom Quarantine",882450001,"16f74463-611c-ec11-b6e6-001dd830acba","10/3/2021","2021-10-03T04:00:00Z","051755","9/24/2021","2021-09-24T04:00:00Z","121-10 ROCKAWAY BOULEVARD","40,675,021.000000",40675021,"1eb7c337-32f4-ea11-b882-24ee9a37d45c","Queens",882450003,"-73,816,730.000000",-73816730,"27","I.S. 226 - QUEENS","Hawtree Creek Middle School - Q297 - Q226 - 27Q297 - 121-10 ROCKAWAY BOULEVARD"
"W/""322110220""","Partial Classroom Quarantine",882450001,"9d38f6e7-621c-ec11-b6e6-001dd830acba","10/2/2021","2021-10-02T04:00:00Z","051760","9/24/2021","2021-09-24T04:00:00Z","1025 MORRISON AVENUE","40,824,989.000000",40824989,"2378931f-33f4-ea11-b882-24ee9a37d45c","Bronx",882450001,"-73,874,162.000000",-73874162,"8","I.S. 123 - BRONX","J.H.S. 123 James M. Kieran - X123 - X123 - 08X123 - 1025 MORRISON AVENUE"
"W/""322953245""","Classroom Closed",882450000,"186df2bc-671c-ec11-b6e6-001dd830acba","10/2/2021","2021-10-02T04:00:00Z","051778","9/24/2021","2021-09-24T04:00:00Z","135-21 241 STREET","40,671,150.000000",40671150,"e08442ee-31f4-ea11-b882-24ee9a37d45c","Queens",882450003,"-73,733,774.000000",-73733774,"29","P.S. 38 - QUEENS","P.S. 038 Rosedale - Q038 - Q038 - 29Q038 - 135-21 241 STREET"
"W/""322956282""","Classroom Closed",882450000,"bd2173a6-681c-ec11-b6e6-001dd830acba","10/2/2021","2021-10-02T04:00:00Z","051782","9/24/2021","2021-09-24T04:00:00Z","69-20 JUNO STREET","40,714,890.000000",40714890,"e0883319-32f4-ea11-b882-24ee9a37d45c","Queens",882450003,"-73,852,398.000000",-73852398,"28","P.S. 144 - QUEENS","P.S. 144 Col Jeromus Remsen - Q144 - Q144 - 28Q144 - 69-20 JUNO STREET"
"W/""322962886""","Partial Classroom Quarantine",882450001,"434a4af4-681c-ec11-b6e6-001dd830acba","10/2/2021","2021-10-02T04:00:00Z","051783","9/24/2021","2021-09-24T04:00:00Z","121-10 ROCKAWAY BOULEVARD","40,675,021.000000",40675021,"1eb7c337-32f4-ea11-b882-24ee9a37d45c","Queens",882450003,"-73,816,730.000000",-73816730,"27","I.S. 226 - QUEENS","J.H.S. 226 Virgil I. Grissom - Q226 - Q226 - 27Q226 - 121-10 ROCKAWAY BOULEVARD"
"W/""322991994""","Partial Classroom Quarantine",882450001,"49011b12-6c1c-ec11-b6e6-001dd830acba","10/2/2021","2021-10-02T04:00:00Z","051802","9/24/2021","2021-09-24T04:00:00Z","198 Forsyth Street","40,722,415.000000",40722415,"d737fba4-31f4-ea11-b882-24ee9a37d45c","Manhattan",882450000,"-73,990,468.000000",-73990468,"1","FORSYTH HS (AUXSVC-OLD 91) - M","Adult and Continuing Education - K755 - M510 - 79K755 - 198 Forsyth Street"
"W/""322110387""","Partial Classroom Quarantine",882450001,"b8d4bd50-6d1c-ec11-b6e6-001dd830acba","10/3/2021","2021-10-03T04:00:00Z","051810","9/24/2021","2021-09-24T04:00:00Z","63-55 102ND STREET","40,732,348.000000",40732348,"f09b4c1f-32f4-ea11-b882-24ee9a37d45c","Queens",882450003,"-73,852,879.000000",-73852879,"28","J.H.S. 157 - QUEENS","J.H.S. 157 Stephen A. Halsey - Q157 - Q157 - 28Q157 - 63-55 102ND STREET"
"W/""322110392""","Partial Classroom Quarantine",882450001,"fad4bd50-6d1c-ec11-b6e6-001dd830acba","10/3/2021","2021-10-03T04:00:00Z","051811","9/24/2021","2021-09-24T04:00:00Z","63-55 102ND STREET","40,732,348.000000",40732348,"f09b4c1f-32f4-ea11-b882-24ee9a37d45c","Queens",882450003,"-73,852,879.000000",-73852879,"28","J.H.S. 157 - QUEENS","J.H.S. 157 Stephen A. Halsey - Q157 - Q157 - 28Q157 - 63-55 102ND STREET"
"W/""322110402""","Classroom Closed",882450000,"6deba682-6d1c-ec11-b6e6-001dd830acba","10/3/2021","2021-10-03T04:00:00Z","051814","9/24/2021","2021-09-24T04:00:00Z","475 WEST 155 STREET","40,831,630.000000",40831630,"3b767649-31f4-ea11-b882-24ee9a37d45c","Manhattan",882450000,"-73,942,023.000000",-73942023,"6","P.S. 28 - MANHATTAN","P.S. 028 Wright Brothers - M028 - M028 - 06M028 - 475 WEST 155 STREET"
"W/""322110467""","Classroom Closed",882450000,"f52aef1c-721c-ec11-b6e6-001dd830acba","10/2/2021","2021-10-02T04:00:00Z","051842","9/24/2021","2021-09-24T04:00:00Z","717 EAST 105TH STREET","40,648,974.000000",40648974,"33de261e-4afb-ea11-b883-24ee9a37d459",,,"-73,894,454.000000",-73894454,"18","BREUKELEN RECREATION ROOMS DAY CARE CENTER","BREUKELEN RECREATION ROOMS DAY CARE CENTER - KBPB - KBPB -  - 717 EAST 105TH STREET"
"W/""324557906""","Partial Classroom Quarantine",882450001,"d189bd1a-731c-ec11-b6e6-001dd830acba","10/1/2021","2021-10-01T04:00:00Z","051851","9/24/2021","2021-09-24T04:00:00Z","165-65 84 AVENUE","40,716,071.000000",40716071,"49b4977a-32f4-ea11-b882-24ee9a37d45c","Queens",882450003,"-73,799,692.000000",-73799692,"28","THOMAS A. EDISON VOC HS - Q","Thomas A. Edison Career and Technical Education High School - Q620 - Q620 - 28Q620 - 165-65 84 AVENUE"
"W/""322953094""","Partial Classroom Quarantine",882450001,"ccd761ca-7c1c-ec11-b6e6-001dd830acba","10/2/2021","2021-10-02T04:00:00Z","051920","9/24/2021","2021-09-24T04:00:00Z","1200 MANOR ROAD","40,588,985.000000",40588985,"5abe7adc-32f4-ea11-b882-24ee9a37d45c","Staten Island",882450004,"-74,130,819.000000",-74130819,"31","SUSAN E. WAGNER HS - S. I.","Susan E. Wagner High School - R460 - R460 - 31R460 - 1200 MANOR ROAD"
"W/""322999737""","Partial Classroom Quarantine",882450001,"a5659d10-821c-ec11-b6e6-001dd830acba","10/1/2021","2021-10-01T04:00:00Z","051950","9/24/2021","2021-09-24T04:00:00Z","37-11 21 AVENUE","40,775,766.000000",40775766,"ca883319-32f4-ea11-b882-24ee9a37d45c","Queens",882450003,"-73,904,508.000000",-73904508,"30","I.S. 141 - QUEENS","I.S. 141 The Steinway - Q141 - Q141 - 30Q141 - 37-11 21 AVENUE"
"W/""322993231""","Partial Classroom Quarantine",882450001,"181eb65e-851c-ec11-b6e6-001dd830acba","10/1/2021","2021-10-01T04:00:00Z","051971","9/24/2021","2021-09-24T04:00:00Z","133-25 GUY R BREWER BOULEVARD","40,675,014.000000",40675014,"852f77fa-31f4-ea11-b882-24ee9a37d45c","Queens",882450003,"-73,775,643.000000",-73775643,"28","J.H.S. 72 - QUEENS","P.S. Q993 - Q993 - Q072 - 75Q993 - 133-25 GUY R BREWER BOULEVARD"
"W/""322110866""","Non-Classroom Quarantine",882450003,"94efbe57-931c-ec11-b6e6-001dd830acba","10/2/2021","2021-10-02T04:00:00Z","052035","9/24/2021","2021-09-24T04:00:00Z","1 EAST 104 STREET","40,793,098.000000",40793098,"7f3eb8c9-31f4-ea11-b882-24ee9a37d45c","Manhattan",882450000,"-73,951,367.000000",-73951367,"4","HARBOR SCIENCE & ART CHARTER SCHOOL","Capital Preparatory (CP) Harlem Charter School - M204 - MADQ - 84M204 - 1 EAST 104 STREET"
"W/""323409582""","Partial Classroom Quarantine",882450001,"f891c0bb-981c-ec11-b6e6-001dd830acba","10/2/2021","2021-10-02T04:00:00Z","052065","9/24/2021","2021-09-24T04:00:00Z","1925 STUART STREET","40,606,745.000000",40606745,"e8201dab-30f4-ea11-b882-24ee9a37d45c","Brooklyn",882450002,"-73,938,721.000000",-73938721,"22","I.S. 278 - BROOKLYN","J.H.S. 278 Marine Park - K278 - K278 - 22K278 - 1925 STUART STREET"
"W/""324245305""","Classroom Closed",882450000,"cd4ac8f5-9a1c-ec11-b6e6-001dd830acba","10/2/2021","2021-10-02T04:00:00Z","052075","9/25/2021","2021-09-25T04:00:00Z","725 BRADY AVENUE","40,853,075.000000",40853075,"390d6d19-33f4-ea11-b882-24ee9a37d45c","Bronx",882450001,"-73,866,264.000000",-73866264,"11","P.S. 105 - BRONX","P.S. 105 Sen Abraham Bernstein - X105 - X105 - 11X105 - 725 BRADY AVENUE"
"W/""324249064""","Classroom Closed",882450000,"ff7e7e06-9c1c-ec11-b6e6-001dd830acba","10/2/2021","2021-10-02T04:00:00Z","052079","9/25/2021","2021-09-25T04:00:00Z","725 BRADY AVENUE","40,853,075.000000",40853075,"390d6d19-33f4-ea11-b882-24ee9a37d45c","Bronx",882450001,"-73,866,264.000000",-73866264,"11","P.S. 105 - BRONX","P.S. 105 Sen Abraham Bernstein - X105 - X105 - 11X105 - 725 BRADY AVENUE"
